Unnamed: 0,comment_count,upvote_delta,timeup_list,subreddit,thread_text
574,1200.0,12700.0,9.0,r/antiwork,I got offered a scab job.
575,171.0,3200.0,5.0,r/Unexpected,Surviving a blizzard
576,47.0,3000.0,7.0,r/Hololive,What a year huh?
577,48.0,1300.0,7.0,r/HistoryPorn,"Marilyn Monroe reading “Ulysses” by James Joyce, 1955. [977x1200]"
578,326.0,2200.0,6.0,r/HermanCainAward,Blue was sick of “mask waring” and wanted to know when the next “I can’t breath” march would be. Purple mourns blue’s passing but also tells it like it is.
579,58.0,1000.0,6.0,r/btd6,My BTD6 waifu tier list
580,191.0,4200.0,6.0,r/oddlyterrifying,"The mayor in Naples, Italy told the residents no fireworks, the residents said no. It sounds like a warzone."
581,50.0,5000.0,13.0,r/MemeEconomy,Tobey standing next to his stunt double . Is it worth investing
582,52.0,959.0,7.0,r/WorldofTanks,Nevermind then
583,54.0,1200.0,5.0,r/stevenuniverse,Y’all remember when Steven was getting mauled by a raccoon and Amythest did nothing
584,160.0,4300.0,7.0,r/Wellthatsucks,Second day of 2022 and I already missed a flight :(
585,28.0,1500.0,8.0,r/feedthebeast,Dont divide by zero
586,69.0,529.0,4.0,r/6thForm,if only I knew sooner...
587,43.0,1000.0,5.0,r/StarWarsBattlefront,Is funny how EA still have in its YT channel the video of Iden Version being the founder of the 1st Order
588,12.0,1700.0,7.0,r/tippytaps,Otter doing tippy demands..
589,39.0,817.0,3.0,r/rupaulsdragrace,"Icesis Couture’s whole runway package, showing why she really was THAT bitch."
590,58.0,1400.0,9.0,r/reddeadredemption,RDR2 has the most beautiful open world
592,34.0,1500.0,6.0,r/EverythingScience,"The glue lice use to attach eggs to hair is exceptional at trapping & preserving anything it encases—including high-quality ancient human DNA from the lice’s hosts. Using hair encased in lice glue scientists were able to isolate human DNA from 1,500 to 2,000-year-old mummies in the Andes Mountains"
593,30.0,1600.0,6.0,r/cringepics,"""Pretended"""
594,24.0,1400.0,5.0,r/NewDealAmerica,Look Grandma...
596,1100.0,12000.0,9.0,r/facepalm,Woman is shocked and appalled that her and her daughter were not allowed to pet a service dog by the dog’s handler.
597,51.0,2700.0,11.0,r/deadbydaylight,"""AEEUGH"""
598,44.0,2300.0,8.0,r/photoshopbattles,PsBattle: Carrot in a Kitchen
599,52.0,614.0,5.0,r/VaushV,MTG IS BANNED 🦀🦀🦀
600,45.0,795.0,6.0,r/Breadit,Thought it’d be a cute idea to make doughnut shaped rolls…
601,106.0,522.0,4.0,r/SHIBArmy,Every time I do something
602,172.0,3000.0,5.0,r/mildlyinteresting,Bathroom stall door with no crack in between
603,32.0,1200.0,8.0,r/DarkSouls2,Aldia really makes you think
604,39.0,863.0,6.0,r/HumanForScale,"A rocket being transported to lauch site , India"
605,44.0,812.0,6.0,r/danganronpa,I did Akane justice by giving her abs
606,43.0,773.0,5.0,r/dogecoin,"Fly, Doge, Fly"
608,12.0,1200.0,5.0,r/PetsareAmazing,Cute Little Thief!
609,93.0,4000.0,8.0,r/marvelmemes,I mean it do feel like that.
610,39.0,823.0,2.0,r/CatastrophicFailure,Maiden flight of the Atlas D testing program ends in failure on April 14th 1959
611,55.0,1500.0,11.0,r/CitiesSkylines,Completing the Port ✔️
612,12.0,1400.0,6.0,r/evangelionmemes,Petty Yui.
613,39.0,4400.0,12.0,r/OneSecondBeforeDisast,GS5
614,43.0,1200.0,5.0,r/BoJackHorseman,i’m super baked and can’t stop laughing at these stilton holiday ideas on the whiteboard
615,37.0,1100.0,6.0,r/ARK,Anxiety in a nutshell
616,30.0,1000.0,5.0,r/TheGoodPlace,"Oh Jeff Bezos, I’m not wrong."
617,254.0,2900.0,7.0,r/tf2,Best comment gets to name my only unusual. Just nothing too cursed
618,28.0,944.0,6.0,r/BravoRealHousewives,Fake Donn wins again
619,36.0,2300.0,10.0,r/SapphoAndHerFriend,"found this while trying to find something to embroider (they ranked 2nd out of 10, FYI)"
620,55.0,1200.0,6.0,r/torties,"My little, weird tortie LOVES sitting on top of the door."
621,43.0,1100.0,6.0,r/vegan,The actual hardest part of being vegan
622,24.0,3100.0,13.0,r/JustGuysBeingDudes,The wrong restaurant
623,31.0,1200.0,5.0,r/The_Mueller,Marjorie Taylor Greene Permanently Suspended From Twitter for Pushing Covid Lies
624,30.0,1800.0,11.0,r/rance,"La fameuse ""petite"" sieste du dimanche"
625,50.0,498.0,4.0,r/LiverpoolFC,Chelsea 0 - [2] Liverpool - Mohamed Salah 26'
626,37.0,1600.0,9.0,r/comedyhomicide,Why do they feel its necessary to add these reactions?
627,49.0,574.0,4.0,r/StarWarsCantina,Me introducing my wife to Star Wars.
628,23.0,693.0,6.0,r/GamingDetails,"In Until Dawn, at one point the psychiatrist will ask you which character you dislike the most. Later on, you can find a diorama of photographs. Whoever you picked will have their eyes crossed out. (These are just 3 of them)."
629,40.0,1300.0,8.0,r/Frugal,"Jacket damaged, got 50% off, so I sewed it up."
630,127.0,1500.0,4.0,r/IdiotsInCars,"New Year, Same Idiots"
631,51.0,4900.0,13.0,r/funnyvideos,Genius
632,55.0,1900.0,5.0,r/Art,"Sunflower Clouds, Me, Digital, 2022"
633,50.0,1200.0,9.0,r/bleach,Enjoy Your Stay at Hueco Mundo!
634,33.0,1200.0,7.0,r/CloneWarsMemes,Sayonara Savage!
635,36.0,706.0,5.0,r/memeframe,I'm enjoying it tho
636,37.0,748.0,4.0,r/lostredditors,A sub for medieval/vintage art depicting cats….
637,45.0,2300.0,9.0,r/ihadastroke,Is the highway high?
638,19.0,3000.0,10.0,r/reactiongifs,MRW I see my wife thru our glass shower door
639,13.0,1400.0,6.0,r/rickandmorty,"You son of a bitch, I'm in."
640,43.0,868.0,19.0,r/therewasanattempt,Too short and definitely worth it
642,34.0,1100.0,6.0,r/KerbalSpaceProgram,Going full meta: creating a working KSP game inside stock KSP.
643,28.0,1400.0,6.0,r/TwoSentenceHorror,My husband peeled the skin off my stomach until only a thin layer remained
644,43.0,1100.0,5.0,r/Rabbits,Lady exploring a new area for the first time
646,718.0,2300.0,10.0,r/TooAfraidToAsk,"Why does America have race as a prefix to nationality? examples: African-American, Asian-American. Why not just call them all Americans?"
647,31.0,1300.0,7.0,r/notmycat,He jumped into my window and acted like the appartment was his lol
648,25.0,1700.0,4.0,r/cursedcomments,Cursed_butthole
649,54.0,2300.0,9.0,r/drawing,"Last drawing of 2021, made with graphite pencils."
650,96.0,1500.0,4.0,r/hmm,Hmmmmmmmmmmmmmmmmmmm
651,21.0,1300.0,9.0,r/thomastheplankengine,I swear to God I wish I could remember what the context was for this but all I know is I woke up and I had to make a meme
652,34.0,1400.0,7.0,r/shittyrainbow6,HE’S JUST AS EFFECTIVE
653,53.0,4200.0,14.0,r/animememes,Congratulations 🎆
654,748.0,2700.0,5.0,r/gaming,What games should I play before turning blind?
655,49.0,628.0,2.0,r/SpidermanPS4,not the most exciting photos but i tried to make them realistic-ish
656,30.0,876.0,6.0,r/Overwatch_Memes,Flex is just tank with benefits
657,50.0,1600.0,9.0,r/Markiplier,The meme is ßorn
658,27.0,934.0,7.0,r/BeforeNAfterAdoption,"Not a typical adoption but I thought I’d share. My mom called me over last summer to throw a dead baby mouse out into the yard for her. Squeaks was in fact not dead but still blind and needed fed with a syringe. Didn’t think she’d make it, but I still have my wild deer mouse!"
659,19.0,3700.0,13.0,r/ElderScrolls,Hero of Bruma
660,29.0,1200.0,5.0,r/cakedecorating,Happy New Year! Latest from my wife. Stunning art deco piece.
661,37.0,1600.0,8.0,r/Warhammer40k,One crispy heretic comin' right up.
662,29.0,1600.0,6.0,r/wholesome,Core memory for both
663,40.0,1100.0,7.0,r/mapporncirclejerk,Guess where I live based off of which Antarctic cities I can name
665,29.0,1500.0,7.0,r/Komi_san,When will he come back ?
666,28.0,1400.0,7.0,r/skiing,The good 'ol boys.
667,38.0,636.0,3.0,r/guineapigs,Our new girl Maple! (Info in comments)
668,23.0,984.0,5.0,r/pointlesslygendered,[product]
669,36.0,886.0,5.0,r/intermittentfasting,Finally!!!! 6 months of 16:8 or 18:6 with strength training and cardio 5x a week. SW: 239 GW: 170 by my wedding in May 🥰
670,31.0,5600.0,13.0,r/oddlyspecific,The small band paradox
671,38.0,1800.0,9.0,r/notliketheothergirls,"I'm not like other girls, I am lonely"
672,31.0,2800.0,5.0,r/meme,Actually not made with mematic.
673,36.0,1400.0,7.0,r/arknights,"New Surtr artworks by her illustrator, Ask"
674,56.0,2500.0,5.0,r/oddlysatisfying,"Mirror, Mirror on the... woah.."
675,30.0,1900.0,10.0,r/thalassophobia,The “great blue hole” of Belize
676,657.0,57900.0,12.0,r/interestingasfuck,NASA workers making the selfie with James Webb telescope before launch.
678,201.0,4100.0,9.0,r/MapPorn,1 Euro Coin Of Each Eurozone Member State
679,39.0,1900.0,11.0,r/Memes_Of_The_Dank,Who knew🧐
680,16.0,1300.0,6.0,r/BobsBurgers,"Oh Gretchen, never stop being you"
681,16.0,1000.0,4.0,r/Chonkers,"My spoiled Chonker, Salem."
682,24.0,3000.0,8.0,r/Eyebleach,Belly rubs
684,29.0,4000.0,11.0,r/ihadastroke,brirg
685,24.0,1400.0,7.0,r/apexlegends,I wish the landing jets activated this late all the time!
686,47.0,1700.0,7.0,r/Eldenring,FABRUARING
687,29.0,377.0,2.0,r/paradoxplaza,I sent my son to Greece and he returned gay...
688,29.0,1100.0,7.0,r/AccidentalWesAnderson,This brand of canned seafood has major Wes Anderson vibes
689,24.0,2300.0,11.0,r/disneyvacation,How to collect semen at a sperm bank
690,36.0,1200.0,6.0,r/falloutnewvegas,A certified Hood classic
691,30.0,633.0,5.0,r/okbuddybaka,Yuno is a Charger
692,26.0,744.0,6.0,r/ParadoxExtra,OMG guys I restored the Roman empire!!!
693,14.0,1300.0,4.0,r/EarthPorn,"Sedona, AZ [OC][2048x1582]"
694,27.0,1300.0,7.0,r/IdiotsFightingThings,Idiot fighting a scooter
695,30.0,1500.0,7.0,r/Awwducational,"Halitrephes maasi or the ""firework jellyfish"" is a typically bathypelagic or deep sea hydromedusa that sports light-reflective frilled tentacles and a bell-shaped, starburst-patterned body. This jelly was spotted by happenstance at 1225m in the Revillagigedo Archipelago off Baja California, Mexico."
696,29.0,1000.0,4.0,r/AddisonRae,Bikini Babe
697,29.0,988.0,8.0,r/parrots,Happy 43rd birthday to this cuddly girl!
698,31.0,5100.0,14.0,r/shittymoviedetails,In Spider-Man: Into The Spider-Verse there is a very slight difference in the lighting of one of the numbers laying on the ground. This is subtle four shadowing.
700,31.0,973.0,5.0,r/NotMyJob,This instruction is very convenius
701,522.0,2200.0,6.0,r/europe,"On this day in 1492, Granada was taken by the Catholic Kings, putting an end to the Reconquista and 780 years of Mulsim occupation of the Iberian Península."
702,196.0,1800.0,3.0,r/Damnthatsinteresting,Johnny Kim a true legend
703,21.0,1300.0,6.0,r/imsorryjon,"""Rudolph"""
704,24.0,3400.0,11.0,r/SmashBrosUltimate,Pikachu up B?
705,35.0,993.0,4.0,r/funnyvideos,I don’t know who made this but it made me laugh 😂
706,17.0,858.0,4.0,r/OldPhotosInRealLife,"11 years of decay - Martindale Feed Mill - Marshall, Texas"
707,47.0,2100.0,3.0,r/Superstonk,Remember this tweet? They're counting on the critical voices to go quiet and everything to continue as it has for the last few decades. But the voices will not be silenced. They are here to stay until the very end of this journey.
708,21.0,1200.0,6.0,r/HazbinHotel,Something to think about.
711,105.0,3000.0,9.0,r/battlestations,Spent far too long building this. Wfh + gaming setup!
712,14.0,1300.0,6.0,r/happycowgifs,Man who runs an animal sanctuary spends time with the cows he helped rescue
713,35.0,1300.0,7.0,r/MemeVideos,Freddie Mercury's Greatest Concert in History
714,97.0,1800.0,3.0,r/WatchPeopleDieInside,bestie is just jealous
715,102.0,2200.0,14.0,r/worldnewsvideo,to get his attention
717,28.0,809.0,5.0,r/AvatarMemes,Mr. Incredible becoming uncanny ~ Avatar the Last Airbender Edition
718,35.0,2700.0,10.0,r/Satisfyingasfuck,This is an awesome
719,32.0,5400.0,13.0,r/im14andthisisdeep,this is deep (sorry Elmo...)
720,24.0,1200.0,17.0,r/Damnthatsinteresting,This dude is a straight metal gear character
722,30.0,4500.0,13.0,r/bi_irl,Bi_irl
723,11.0,1500.0,7.0,r/Superbowl,"Yep, as promised, I will keep my door open for the rest of my life"
724,11.0,11.0,7.0,r/Superbowl,Invest Pre-IPO in Company with drug shown effective in 3 clinical trials to prevent cold sores.
725,29.0,758.0,6.0,r/HollowKnight,All my Hollow Knight fan art in my style!
726,21.0,1100.0,6.0,r/CrusaderKings,This belongs here
727,31.0,961.0,7.0,r/HunterXHunter,Kurapika drawing
728,48.0,1300.0,4.0,r/BrandNewSentence,Ignorance in every age
729,24.0,951.0,5.0,r/legostarwars,Got the Cantina set for Christmas. Been having fun recreating some scenes!
730,1.0,1600.0,7.0,r/WhatsWrongWithYourCat,Starting the new year off derpy
731,31.0,848.0,6.0,r/skamtebord,Vegito
732,25.0,2500.0,11.0,r/carporn,Lancia Stratos [1080x870]
733,12.0,1400.0,8.0,r/antifastonetoss,"Reject modernity, embrace femboys"
734,22.0,532.0,9.0,r/shitposting,Outjerked
736,557.0,10000.0,8.0,r/nextfuckinglevel,Time travelling guy in near perfect nostalgic lip-sync
737,12.0,1300.0,6.0,r/FellowKids,Rare Bangladeshi Post
739,28.0,603.0,4.0,r/gifsthatendtoosoon,Quadruple front flip
740,26.0,1400.0,23.0,r/nextfuckinglevel,I thought it was going to explode
742,157.0,3900.0,6.0,r/politics,"Michael Cohen celebrates as his lawyers serve Bill Barr with legal papers: 'Happy New Year, asshole!'"
743,336.0,3400.0,9.0,r/todayilearned,"TIL about Hikikomori: modern day hermits/recluses in Japan whose numbers are on the rise, with an estimated million youths/middle age already afflicted."
745,69.0,1100.0,5.0,r/kpop,Yuju - The 1st Mini Album: REC. (Teaser Poster)
746,78.0,1600.0,5.0,r/ich_iel,ich🧠📖iel
747,30.0,7300.0,17.0,r/cyberpunkgame,"It's OUR life now, kid"
748,28.0,1000.0,7.0,r/SupermodelCats,Watching me as I ate ice cream. Hard to say no to that face.
749,221.0,5200.0,9.0,r/formula1,Bottas with a Mercedes mask in the Alfa Romeo garage
750,17.0,764.0,4.0,r/lgbtmemes,The developers really thought of everything
751,26.0,1900.0,10.0,r/dadjokes,Just paid $200 for a belt that doesn’t fit!
752,21.0,735.0,3.0,r/DarkViperAU,Look How Happy Matto Is!
753,23.0,693.0,6.0,r/HalfLife,Da Feels
754,25.0,650.0,5.0,r/MilitaryPorn,Kazakhstan's special police unit 'Sunkar' [1680x1259]
755,397.0,3400.0,9.0,r/Showerthoughts,Hamsters never seem to die from natural causes. Everyone always has a crazy story as to what happened to theirs.
756,24.0,832.0,7.0,r/analog,Evelina. Canon AE1P / Kodak ultramax 400
757,23.0,1600.0,8.0,r/AnimalsBeingGeniuses,Dog licks its way out
758,23.0,596.0,4.0,r/CatsStandingUp,Cat.
759,25.0,587.0,3.0,r/standardissuecat,Adopted him off the streets of Hollywood. Now he’s 14 lbs and meows at me if I don’t top his food with bone broth.
760,22.0,874.0,4.0,r/combinedgifs,Traveling through space and time
761,22.0,676.0,5.0,r/BanVideoGames,Atleast some g*mers admit what they are.
762,19.0,787.0,5.0,r/homestead,It held! Happy and all accounted for!
763,459.0,48600.0,12.0,r/MadeMeSmile,What a brave boy!
764,124.0,3600.0,10.0,r/funny,Real names
765,9.0,1400.0,7.0,r/Catswhoyell,My chatter box today
766,21.0,1400.0,8.0,r/gravityfalls,*Cracks Knuckles*
767,482.0,2400.0,9.0,r/CasualUK,GF just had a full on rant at me for doing some washing on NYD.
768,36.0,3400.0,9.0,r/whenthe,Deezney
771,21.0,1500.0,9.0,r/Outdoors,"Reflection of the sky on the wet railing, Estonia"
772,18.0,1100.0,6.0,r/teefies,My friend's cat has giant teefies
773,21.0,962.0,8.0,r/DestinyMemes,I respect anyone willing to sweep up my dead body
774,25.0,1700.0,6.0,r/perfectlycutscreams,So hows the war goin' for you guys ?
776,18.0,487.0,4.0,r/Suomi,Vihreillä kuulilla hidastettiin vihollisen etenemistä jatkosodan vetäytymisvaiheessa. Pioneerit kuulittavat tietä Ihantalassa kesäkuussa 1944.
777,15.0,926.0,7.0,r/boneachingjuice,She went to magic camp for many years
778,51.0,2000.0,5.0,r/BlackPeopleTwitter,Momma Mia
779,48.0,1100.0,6.0,r/Deltarune,Ralsei equips the Dealmaker
780,22.0,1200.0,8.0,r/OMORI,Don’t listen to what OMOCAT says.
781,17.0,1600.0,6.0,r/comics,π (OC)
782,15.0,2500.0,6.0,r/dndmemes,Expanded on an old format (based on true events)
783,40.0,3700.0,5.0,r/HolUp,true love
784,7.0,672.0,3.0,r/shitposting_inc,I'm 15 and this is yeet
786,15.0,2500.0,8.0,r/trippinthroughtime,Traffic stop
787,19.0,539.0,4.0,r/CatsEnjoyingPets,My HIV positive cyclops boy loves his scritches!
788,19.0,842.0,6.0,r/Badfaketexts,...
789,19.0,929.0,6.0,r/MadeMeCry,Oh the contrast of the world
790,19.0,1500.0,9.0,r/SCP,Our orange blob wishes us a happy 2022
791,19.0,844.0,7.0,r/DDLC,I drew miHoYo-like Monika and Yuri icons.
792,105.0,965.0,3.0,r/TrueOffMyChest,My gf talks nonstop about my roommate/housemate who she saw for like 30 sec. I've had enough.
793,18.0,1300.0,7.0,r/surrealmemes,it is crab
794,20.0,3100.0,10.0,r/Catswithjobs,Plumber and apprentice
795,19.0,675.0,5.0,r/squidgame,"my fanart, done with colored pencils"
796,118.0,5900.0,7.0,r/WhitePeopleTwitter,Value on human life?! Abhorrent!
797,21.0,1500.0,6.0,r/StardewValley,Taking a break from Stardew to spend a moment with one of my void chickens on my *other* farm!
798,15.0,2500.0,8.0,r/BikiniBottomTwitter,"How times have changed, happy new tears"
799,16.0,2900.0,13.0,r/KenM,Ken M on the frozen fish aisle
800,16.0,687.0,5.0,r/firstworldanarchists,Downed my antibiotics with a probiotic drink.
801,133.0,2100.0,5.0,r/Cringetopia,Girl tries to hang herself
802,17.0,803.0,3.0,r/PandR,Something looks suspicious here…
803,17.0,1500.0,9.0,r/corgi,"Please say hello to Fen, we survived our first week together and are best buds."
804,17.0,868.0,6.0,r/furry,warm-up bit of art i did for a member of the discord server this morning 🥰🍪 <character belongs to @purpledug_>
805,19.0,1600.0,4.0,r/PrequelMemes,The towel need to be a cape
806,35.0,1300.0,5.0,r/raimimemes,This is something else
807,17.0,2700.0,11.0,r/MostBeautiful,"Winter in Freibergsee, a small lake in the mountainous town of Oberstdorf, Allgäu, Germany."
808,16.0,780.0,7.0,r/ConvenientCop,[Czech Republic] Thief caught right after the robbery
809,25.0,2800.0,7.0,r/Genshin_Impact,Did you know Childe can jump perfectly over Zhongli? With a side of Osmanthus wine
810,119.0,1200.0,5.0,r/2007scape,Decided to send a solo raid on the GIM. I'm a total noob and kept dying to Olm.
811,17.0,697.0,4.0,r/jacksepticeye,Dear 2022: PLEASE (Read Picture). . .
812,19.0,364.0,2.0,r/dbz,Vegeta #1 Dad Award
813,123.0,2700.0,9.0,r/JusticeServed,McDonald’s loses appeal on Roman baths restaurant
814,14.0,808.0,7.0,r/MonsterHunter,Monster Hunter by Drake (Winson) Tsui
815,18.0,567.0,3.0,r/TheDepthsBelow,That shark was like ooh shit I'm outta here
816,14.0,772.0,6.0,r/Justfuckmyshitup,Iraqi tv hairstyles rock
817,13.0,656.0,6.0,r/seinfeld,January 2nd...so many people today.
818,14.0,635.0,5.0,r/Helltaker,Baphomet Deal
819,13.0,577.0,4.0,r/futurama,2022 is Soylent Green year.
820,13.0,2200.0,10.0,r/Cursed_Images,Cursed eating
821,14.0,591.0,4.0,r/brasil,"Brasil, verão de 2022."
822,12.0,1100.0,17.0,r/CuratedTumblr,He's Sensitive
824,11.0,521.0,3.0,r/WhyWomenLiveLonger,Skating off the bridge
825,11.0,733.0,5.0,r/fnv,The crossover I always needed
826,170.0,4500.0,9.0,r/shitposting,Greetings lactose intolerance community
827,9.0,609.0,3.0,r/nukedmemes,Bob Wicks only eats living things
828,12.0,2100.0,10.0,r/animegifs,Mikasa's expression was priceless...
829,11.0,1200.0,9.0,r/simpsonsshitposting,Won't somebody please think of the reposts?
830,13.0,422.0,2.0,r/PetTheDamnDog,She took matters into her own hands after 4 minutes of being ignored.
832,12.0,684.0,4.0,r/velvethippos,This is Coco! She’s 8 and loves treats
833,12.0,671.0,4.0,r/Awww,This elephant wants to play and have fun.
834,6.0,840.0,5.0,r/HuskyTantrums,Pls Dad..
835,4.0,843.0,5.0,r/PixelArt,Cyberpunk 2077 pixel art by Arthur Vista
836,11.0,1100.0,22.0,r/sports,[Request] How many different 9 dart combinations are there that would win this game?
838,6.0,1300.0,7.0,r/educationalgifs,Cesium Plasma (Caesius in Latin means sky blue)
839,9.0,545.0,2.0,r/StardustCrusaders,[OC] Plushies with their owners
840,12.0,824.0,6.0,r/asexuality,Strong Ace Vibes. ?. ?
841,10.0,1800.0,10.0,r/ImaginaryCharacters,A Short Break in the Tranquility of the Woods by Christopher Anry
842,10.0,556.0,3.0,r/cromch,Cromch the Lego plant
843,11.0,581.0,4.0,r/oompasubs,Plz no ban
844,10.0,692.0,5.0,r/goldenretrievers,Hello. I couldn’t help noticing I wasn’t getting 100% of your attention
845,20.0,1500.0,6.0,r/AnimalsBeingDerps,My in-laws dog when she wants her ears warmed.
846,8.0,1200.0,9.0,r/japanpics,Mount fuji
847,10.0,816.0,7.0,r/RaidenMains,Wholesome Ei and Shogun moment
848,9.0,684.0,4.0,r/GME,Vanguard finally released my stonk! 30 for the ♾️🌊
849,6.0,568.0,7.0,r/Eyebleach,Biting for attention
851,8.0,1000.0,8.0,r/animenocontext,<Kobayashi-san Chi No Maid Dragon>
852,8.0,974.0,7.0,r/PerfectlyCutBooms,Social Experiment
853,7.0,912.0,7.0,r/esist,This is a deal .
854,10.0,593.0,3.0,r/pitbulls,"If you’re ever playing a video game and it allows you to pet a dog, you could virtually be petting this mix!"
855,90.0,2200.0,4.0,r/dankmemes,Is it ß or not?
856,7.0,615.0,5.0,r/cremposting,"Parshendi scribe attempts to use a spanreed, colorized."
857,8.0,459.0,3.0,r/HuTao_Mains,Rascal
858,7.0,3000.0,13.0,r/BirdsArentReal,Some fijne NSA work here...
859,8.0,944.0,8.0,r/Re_Zero,[Media] Ram looks good in a suit
862,76.0,4100.0,8.0,r/aww,This Turkish butcher looks after stray dogs that visit his shop
863,6.0,900.0,7.0,r/Catloaf,Miso happy loaf
864,108.0,10100.0,11.0,r/gaming,Am I punny guys
865,6.0,446.0,3.0,r/IncreasinglyVerbose,Sent this picture to a friend
866,9.0,444.0,2.0,r/boottoobig,"Roses are red, I have no excuse,"
867,4.0,460.0,3.0,r/wholesomegreentext,It’s enough to make a grown man cry
868,4.0,938.0,6.0,r/CatTaps,She’s been obsessed with this ball all morning
869,19.0,998.0,4.0,r/IllegallySmolCats,The most baby Mr. Man I’ve ever had the pleasure to meet. He has 6 toes on each of his front paws hehe 🤍
870,3.0,648.0,4.0,r/ImaginaryLeviathans,Yin and Yang by Adrian Bush
871,3.0,915.0,7.0,r/PunPatrol,Self-care is important
872,2.0,451.0,3.0,r/woof_irl,woof irl
873,227.0,1000.0,4.0,r/MapPorn,Percentage of adults in USA who identify as LGBT+ (2015-16 survey)
874,249.0,1900.0,9.0,r/unpopularopinion,The saying ‘what doesn’t kill you makes you stronger’ is bullshit and I’m sick of hearing it to justify bad shit happening.
876,106.0,8300.0,11.0,r/oddlysatisfying,Making an beach epoxy resin table top
877,116.0,3100.0,7.0,r/dndmemes,Had to hop on the hype train.. Wait! It's going into the wrong direction!!
878,282.0,17300.0,15.0,r/greentext,league of legends g*mer
879,46.0,2300.0,6.0,r/cursedcomments,Cursed thing
880,52.0,1400.0,4.0,r/Whatcouldgowrong,WCGW launching a oil barrel into the air
881,36.0,1500.0,7.0,r/DunderMifflin,"It's Called H*ntai, and It's Art - The Office US (Deleted Scene)"
882,22.0,2500.0,7.0,r/blursedimages,Blursed_Finger
883,59.0,1200.0,4.0,r/marvelstudios,"My issue with NWH that ruins the movie for me, making it a 1/10."
884,21.0,2200.0,7.0,r/Minecraft,ive finally finished it
886,49.0,1100.0,8.0,r/Damnthatsinteresting,This gave me chills.... Ufff
888,199.0,1700.0,5.0,r/europe,"Neubaugasse, Vienna 2020 vs. 2021"
889,45.0,2200.0,8.0,r/comics,Care to boogie?
890,170.0,4400.0,8.0,r/Damnthatsinteresting,"Newborn Kangaroos are about the size of a knuckle. After birth, joeys travel, unassisted, through their mom's thick fur to the comfort and safety of the pouch."
891,139.0,4300.0,24.0,r/Damnthatsinteresting,Breaking apart sandy snow
893,59.0,1400.0,6.0,r/CrappyDesign,A song plays asking you to press triangle…there isn’t a triangle to press
894,154.0,2100.0,4.0,r/Superstonk,After all the heart warmth shit I've seen since January of last year. I've never been more proud of a community like this. As a pretty heavy alcoholic. I quit until MOASS.
895,42.0,1700.0,7.0,r/Animemes,I feel pathetic
896,29.0,2900.0,8.0,r/Hololive,"🎉Nanashi Mumei🪶 celebrates 500,000 subscribers!🎉 (Jan 1)"
897,14.0,906.0,4.0,r/suspiciouslyspecific,Green power ranger man....
898,52.0,924.0,5.0,r/HollowKnightMemes,Don't
899,83.0,4800.0,12.0,r/blursed_videos,Blursed Phineas and Ferb
902,23.0,2100.0,7.0,r/ShitPostCrusaders,I can't believe the second Stone Ocean op was leaked already!
903,60.0,879.0,4.0,r/TheLastAirbender,Literally a legendary trio
904,60.0,1500.0,7.0,r/FortNiteBR,I added Iron Spider in Fortnite [Concept]
905,88.0,3100.0,7.0,r/Unexpected,dude cuts his guitar string
906,43.0,829.0,4.0,r/AnimalsBeingJerks,TurkeyJerks wont let me deliver mail
907,51.0,1300.0,6.0,r/mildlyinfuriating,Just wanted to get a glass of water
908,51.0,805.0,4.0,r/trashy,Warning: might retract if your mom touches it
909,34.0,988.0,3.0,r/Eyebleach,Welcome to the New Year! Are you ready for an adventure?
910,37.0,857.0,5.0,r/MemePiece,Big mon crew be wilding sometimes
912,58.0,2500.0,8.0,r/PoliticalHumor,This Brandon guy seems to be gaining popularity
913,34.0,1700.0,6.0,r/OldSchoolCool,Tony Hawk at a competition circa 1980’s
914,36.0,1100.0,3.0,r/formuladank,"No Michael, no! This is so not right!"
915,43.0,2000.0,7.0,r/funny,Happy Honda Days
916,33.0,1600.0,8.0,r/BeAmazed,This Halloween makeup
917,52.0,977.0,2.0,r/ich_iel,ich😎iel
918,67.0,1300.0,5.0,r/pics,I also think cultural representation is important!
919,71.0,1700.0,5.0,r/pcmasterrace,I need more RAM..
920,14.0,2200.0,7.0,r/hmm,Hmm
921,19.0,947.0,5.0,r/harrypotter,Poor Ron.. he wasn't even sure he would get out of the chamber alive or not
922,18.0,782.0,4.0,r/combinedgifs,juicy
923,14.0,816.0,3.0,r/WhatsWrongWithYourDog,His favorite toy
924,14.0,731.0,3.0,r/gayspiderbrothel,the
925,10.0,1100.0,6.0,r/SmashBrosUltimate,Helo
926,11.0,1000.0,5.0,r/starwarsmemes,"""General Kenobi"""
927,12.0,1300.0,7.0,r/gifsthatkeepongiving,drawing about our life journey
928,12.0,1200.0,6.0,r/dankvideos,Post Nut Clarity
929,11.0,783.0,4.0,r/GetMotivated,[Image] Good dog
932,8.0,889.0,4.0,r/rareinsults,Guess it’s not the first time this guy’s been burned
933,29.0,1200.0,4.0,r/maybemaybemaybe,Maybe maybe maybe
