Unnamed: 0,comment_count,upvote_delta,timeup_list,subreddit,thread_text
275,183.0,858.0,5.0,r/TwoXChromosomes,What is up with men treating this website like a dating service?
276,81.0,3200.0,5.0,r/TheRightCantMeme,Amazing how no other first-world country that has free healthcare has ended up like this.
277,156.0,1900.0,10.0,r/GifRecipes,LEMON DRIZZLE MUG CAKE !
278,220.0,1700.0,9.0,r/Naruto,A recent post reminded me of this scene. Do people consider Boruto a brat even after watching this one?
279,227.0,1300.0,6.0,r/philadelphia,"The “cough/sore throat section,” at the 24 hour CVS on Harrison Ave, NE Philly."
280,106.0,3100.0,12.0,r/dankchristianmemes,1500 year of scholars > 3 random monks
281,106.0,3300.0,3.0,r/interestingasfuck,"After the Nazis invaded the Netherlands in 1940, a Dutch watchmaker named Corrie ten Boom and her family decided to build a secret room in their home. For four years, they would use this room to hide Jews and helped rescue more than 800 people."
282,221.0,6000.0,14.0,r/ItemShop,"Potions, choose one for it's power, the effects are permanent"
283,60.0,11000.0,8.0,r/Unexpected,That's so cute
284,226.0,5900.0,12.0,r/AbruptChaos,"Balloons , sparklers and how to evacuate a party. 170 evacuated & miraculously no one dead."
285,56.0,2600.0,4.0,r/cursedcomments,Cursed aim
286,145.0,2000.0,3.0,r/ThatLookedExpensive,Car made a drive thru
287,56.0,5800.0,8.0,r/AnimalsBeingBros,Dog adopts blind man
288,131.0,6900.0,5.0,r/antiwork,This kind of behaviour can only end badly for a business.
289,196.0,882.0,7.0,r/averageredditor,Average redditor completely abandons reality to live in fantasy land
290,248.0,2200.0,5.0,r/aviation,B-2 flyover at rosebowl yesterday
291,196.0,1700.0,8.0,r/shittyfoodporn,I tried to make fried rice
292,59.0,1100.0,5.0,r/LivestreamFail,uncle fuslie is unforgettable
293,28.0,2900.0,10.0,r/AskHistorians,Was my famous ancestor a Nazi collaborator?
294,96.0,1400.0,5.0,r/Steam,Steam has just achieved a concurrent players online record of almost 28 million
295,69.0,2500.0,4.0,r/3Dprinting,My wife’s 10 year old brother got a 3D printer for Christmas. I joked that he can build me a PlayStation. Every day I’ve been asking him when it’ll be ready. Today he brought me this. Best present ever
296,39.0,4300.0,6.0,r/antimeme,always has been
297,96.0,4800.0,13.0,r/TwoSentenceHorror,"“Stop!” The man yelled at his parents, who were making love before his very eyes."
298,172.0,2500.0,4.0,r/HollowKnightMemes,Sorry to make you choose between them
299,174.0,2400.0,5.0,r/libertarianmeme,"In Naples, Italy, the mayor cited COVID to announce a ban on fireworks for a second straight New Year’s Eve. This was the response from citizens."
300,142.0,8000.0,12.0,r/GlobalOffensive,I’ve been a raving G2 fan since cluj-napoca. For Christmas my friend got me this framed picture of the exact moment my heart broke.
301,250.0,737.0,5.0,r/ireland,It’s January in Ireland in the middle of winter - now our Solar Panels are supplying all the power needed for our house and even exporting a little to the grid. In 2021 the system generated a total of 3000kWh of renewable electricity meeting about half of our power needs and all our hot water needs.
302,177.0,16100.0,12.0,r/thisismylifenow,Let me love you
303,40.0,4600.0,24.0,r/matrixmemes,The only time I wanna see Morpheous in a bathroom....
305,179.0,2600.0,7.0,r/Rainbow6,"I miss the old pre-rework map versions. Sure they were sometimes imbalanced, but they also were a lot of fun.."
306,137.0,6900.0,11.0,r/Gamingcirclejerk,I just want to live in the most racist country in the world😩
307,163.0,1500.0,6.0,r/Overwatch,Someone stole my account. Just got it back :)
308,592.0,8400.0,3.0,r/memes,What is it?
309,50.0,2100.0,4.0,r/DiWHY,Cursed candle
310,126.0,2200.0,9.0,r/YUROP,Macron being the clear favorite
311,98.0,3500.0,6.0,r/KneadyCats,"Temperatures were below freezing last night, so my friend let this kitty (who she calls Corn) who hangs outside around her house inside her garage for the night. He appreciated the heated blanket"
312,204.0,33100.0,15.0,r/meirl,meirl
313,139.0,855.0,7.0,r/PremierLeague,Lukaku DROPPED completely from the match day squad against Liverpool.
314,115.0,1300.0,5.0,r/CapitolConsequences,Jan. 6 committee prepares to go public as findings mount
316,140.0,1200.0,8.0,r/factorio,I can’t believe this community!
317,36.0,6200.0,8.0,r/perfectlycutscreams,Homie screamed in autotune
318,165.0,4400.0,13.0,r/holdmyredbull,"I made it my goal to clock 100km/60mph. I realized it's actually tough to go that fast without perfect conditions. After a few weeks at different resorts, I finally hit 118km/74mph at Lake Louise. I'll probably never try again after this one haha"
319,175.0,1500.0,10.0,r/leagueoflegends,Asol in lore vs asol ingame
320,90.0,5600.0,11.0,r/LeagueOfMemes,Ezreal and Lux mains can relate
321,133.0,1300.0,6.0,r/ENLIGHTENEDCENTRISM,How dare you want universal healthcare?! It’s almost as bad as banning people from voting in red states.
322,332.0,7500.0,6.0,r/news,Judge says Prince Andrew cannot block lawsuit from accuser Virginia Giuffre on grounds she no longer lives in US
323,44.0,3700.0,6.0,r/dankvideos,Attract attention
324,132.0,5800.0,6.0,r/WatchPeopleDieInside,LEGO motorcycle crash!
325,137.0,2100.0,4.0,r/trashy,Dancing sexy
326,59.0,5400.0,10.0,r/dogelore,Le Dating Master has arrived
327,140.0,14400.0,16.0,r/bonehurtingjuice,im very sensitive about my hair 😟
329,100.0,1100.0,6.0,r/fantasyfootball,Bears Rumors: Matt Nagy Expected to Be Fired; HC Search to Start After Week 18
330,282.0,3000.0,6.0,r/Tinder,The sad part is... I wasn't even shocked
331,92.0,886.0,5.0,r/totalwar,"Launch and Complete comparison of TW:WII editions, that's just the Eye of the Vortex people. Imagine how ''the very big campaign'' in game 3 will be !"
332,89.0,1700.0,11.0,r/gameofthrones,"[NO SPOILERS] Is it just me or do Sophie (Sansa), Maisie (Arya), and Isaac (Bran) look like actual siblings in this picture?"
333,59.0,4000.0,12.0,r/skyrim,I love that you can play the thane card after attempting to kill the emperor.
334,165.0,2100.0,6.0,r/OnePunchMan,French fries being a thing in the opm universe implies that France does/did exist
335,127.0,2400.0,4.0,r/LifeProTips,"LPT: Be careful who you vent to in work. Just because they listen, it doesn't mean that they're your friend or have your best interests at heart."
336,111.0,5600.0,9.0,r/redneckengineering,Redneck moment
337,125.0,2800.0,5.0,r/titanfall,A sad day today :(
338,112.0,639.0,3.0,r/GreenBayPackers,Warning: if you are going to the game and not used to Wisconsin cold
339,79.0,5900.0,16.0,r/aww,…I AM SPEED
341,131.0,1500.0,6.0,r/Qult_Headquarters,Twitter FINALLY bans Marjorie Taylor Greene… For reals this time!
342,131.0,2700.0,12.0,r/GreenAndPleasant,No billionaire is “self-made“
343,95.0,2600.0,9.0,r/Art,"Dead Guy in Urgent Care while Receptionist learns Solitaire, Me, Oil, 2022"
344,88.0,1900.0,6.0,r/justneckbeardthings,Here we go again
345,179.0,758.0,5.0,r/NoFap,"I left my boyfriend for good, he told me that I'm useless since porn turns him on and I don't."
346,140.0,9400.0,11.0,r/Art,"M’Lady, Me, Acrylic Paint Marker, 2022"
347,98.0,3600.0,14.0,r/polandball,Big News
348,72.0,3400.0,15.0,r/sewing,My first sewing project … ever!
349,151.0,8100.0,7.0,r/MadeMeSmile,3 year old daughter is trying hearing aids for the first time.
350,129.0,3000.0,12.0,r/Baking,"This is the only cake I know how to make. It’s around 30,000 calories."
351,169.0,5800.0,13.0,r/youngpeopleyoutube,taco language
352,88.0,938.0,5.0,r/Persecutionfetish,"If they don’t like it, they could… ignore it? Mute the TV? Change the channel? Turn it off?"
353,123.0,1500.0,7.0,r/onguardforthee,I guess we're on our own
354,97.0,5600.0,13.0,r/TrashTaste,Cultured
355,127.0,3200.0,8.0,r/EngineeringPorn,660 metric ton wind damper located inside the Taipei 101 (once the tallest building in the world). One of only two in the world that is open to visitors.
356,52.0,2600.0,4.0,r/shitposting,i need aswers 😡
357,68.0,1200.0,3.0,r/YouShouldKnow,YSK to never search for a domain name you want to purchase using a Domain Registrar
358,148.0,9600.0,17.0,r/yesyesyesyesno,Impressive workout
359,112.0,4500.0,11.0,r/blackmagicfuckery,Soap bubble floats in place for over a minute. Wtf
360,65.0,5700.0,14.0,r/anime_irl,anime_irl
361,18.0,2000.0,4.0,r/AteTheOnion,"""couldn't they use just use puppets"""
362,94.0,516.0,7.0,r/WhitePeopleTwitter,What the fuck
364,130.0,1500.0,6.0,r/insaneparents,My dad spewing political nonsense after I told him I was trans and getting the vaccine then swiftly went into no-contact after he verbally abused my mother (his ex-wife). We are encouraging him to go to a therapist but I don't feel like having a relationship at all after this.
365,403.0,19300.0,10.0,r/facepalm,Infinite money glitch
366,143.0,3100.0,6.0,r/woahdude,Two stationary rings
367,122.0,1100.0,6.0,r/ClashRoyale,for all of those wondering why is lava hound a legendary it's because it is the only card in the game which can't be knocked back
368,176.0,6400.0,8.0,r/ShitPostCrusaders,I played JOJO op 2 with my mouth trumpet
369,79.0,717.0,5.0,r/anime_titties,Finland Says It Has Right to Join NATO Despite Russia Warning Finland of “serious military and political consequences”
370,125.0,3200.0,4.0,r/oddlyterrifying,"Your friend looks cool, wait for it"
371,58.0,499.0,3.0,r/TopMindsOfReddit,"To hit back at AOC's claim of right wing sexual frustration towards her, Top Minds spend the greater part of a thread discussing how they'd have sex with her, even if just to silence her."
372,43.0,3700.0,13.0,r/Technoblade,I made a meme
373,119.0,2800.0,6.0,r/HydroHomies,"Fyi: your color of pee tells you if you drank too little, enough, or too much. stay hydrated!"
374,85.0,824.0,6.0,r/JustBootThings,Caught in the wild at DFW Airport
375,81.0,623.0,5.0,r/askscience,Where does gut bacteria come from and how does it stay where it should be?
376,167.0,1900.0,3.0,r/halo,"343, Fix your damn maps. What is the point of having an air vehicle if I have to traverse as if I was walking?"
377,80.0,3200.0,7.0,r/vexillology,The black Hong Kong flag captured in a masterpiece
378,99.0,1200.0,9.0,r/houkai3rd,A rare ship
379,33.0,6300.0,10.0,r/trippinthroughtime,Sexy Witch
380,82.0,1100.0,6.0,r/Grimdank,Feels Aeldari man...
381,7.0,2700.0,5.0,r/blessedimages,Blessed_Citizen
382,34.0,3900.0,8.0,r/toptalent,Daughter makes art from magazines that her grandpa gave to her throughout her childhood!
383,106.0,1800.0,3.0,r/ThatsInsane,People have to clean this up
384,39.0,2000.0,4.0,r/vaxxhappened,iT’s LiKe ThE hOlOcAuSt GuYs
385,31.0,8200.0,8.0,r/wholesomememes,So wholesome to see those two together again
386,98.0,1600.0,3.0,r/AbruptChaos,Take that!?
387,75.0,1400.0,7.0,r/vexillologycirclejerk,Flag of the USA but there's a star for every funny & original joke conservatives make about genders
388,18.0,3400.0,7.0,r/fakehistoryporn,Hitler introducing the first iPhone(2007)
389,73.0,1800.0,7.0,r/suddenlysexoffender,No wait just one minute
390,22.0,2100.0,5.0,r/tattoos,"Incredible piece I got from Andy at Extreme Needle, London"
391,147.0,1700.0,5.0,r/FortNiteBR,I miss the Tac
392,160.0,1000.0,5.0,r/loopringorg,Confirmed on Discord! NFT made by Byron
393,94.0,1400.0,8.0,r/dankruto,Best Armor? I prefer Naruto's nature energy armor but Lava armor is cool too
394,78.0,2700.0,6.0,r/AnimalsBeingJerks,This is why I can't have nice things
395,176.0,2400.0,4.0,r/cats,Rate my cat
396,78.0,7700.0,7.0,r/meme,What!?
397,47.0,2400.0,3.0,r/NatureIsFuckingLit,"🔥 A rare phenomena called ""Sand snakes"" in Iceland."
398,93.0,1700.0,10.0,r/london,Getting there…
399,189.0,731.0,5.0,r/RocketLeague,"The answer to all the ""Is rank X after Y hours good?"""
400,26.0,2800.0,5.0,r/NonPoliticalTwitter,Fatality!
401,90.0,2000.0,10.0,r/GTA,The fact that the fucked up events of Manhunt take place in the same universe as GTA is so surreal to me
402,226.0,3200.0,5.0,r/Showerthoughts,A society of workers without Billionaires is possible. A society of Billionaires without workers is not.
403,117.0,872.0,5.0,r/HighStrangeness,The Massive Sphere at the Bosnia Pyramid
404,27.0,1400.0,3.0,r/IASIP,Everyone coming back to work on Monday after partying on NYE
405,94.0,616.0,4.0,r/RedLetterMedia,It's like poetry
406,84.0,1700.0,4.0,r/HaloMemes,Escharum's quotes are so meta.
407,121.0,5100.0,14.0,r/adhdmeme,Maybe! 😅
408,124.0,1600.0,6.0,r/pokemongo,"Well, that's one way of forcing me to do PvP, I guess..."
410,52.0,5200.0,10.0,r/thanosdidnothingwrong,I might have made a record in those 30 minutes.
411,33.0,2400.0,13.0,r/bindingofisaac,disco ball
412,35.0,3500.0,8.0,r/lego,Police Chase render
413,84.0,2300.0,9.0,r/kurzgesagt,P A N I K
414,130.0,3900.0,12.0,r/ShingekiNoKyojin,Armin's Multiverse
415,79.0,1100.0,6.0,r/iiiiiiitttttttttttt,As someone in IT and listening to my wife yell at the help desk
416,203.0,3800.0,8.0,r/Minecraftbuilds,After very hard work i finally complete my potato island
417,64.0,2000.0,5.0,r/streetwear,[wdywt] anime convention fit
419,54.0,1600.0,6.0,r/hoi4,Stalin has purged EVERY GENERAL he had
420,80.0,3400.0,12.0,r/BokuNoHeroAcademia,New Horikoshi sketch.
421,123.0,825.0,6.0,r/Amd,Yeston 6700xt
422,13.0,2800.0,4.0,r/tumblr,No gag reflex
424,144.0,2600.0,10.0,r/Persona5,Yes
425,58.0,1300.0,3.0,r/PandR,Does anyone else really love and feel bad for these guys?
426,162.0,1800.0,10.0,r/SaimanSays,We exists guys but normies will come soon
427,78.0,2200.0,5.0,r/awfuleverything,Cars that never left after 9/11
428,145.0,13500.0,15.0,r/whitepeoplegifs,"""I purrpurred for this exam."""
429,32.0,1500.0,4.0,r/me_irlgbt,me_irlgbt
430,133.0,2500.0,7.0,r/battlestations,My gaming setup in 2003.
431,86.0,821.0,7.0,r/piano,Oh my god...
433,169.0,1400.0,10.0,r/AskOuija,"If a woman sleeps with multiple men, she's a whore, but if a man does it, he's _____"
434,21.0,1600.0,4.0,r/oddlyspecific,Roosters are the best
435,115.0,2300.0,6.0,r/videos,"Just some pure, unadulterated drum and bass performed by Rikuo and Kyotaro"
436,114.0,3800.0,10.0,r/WinStupidPrizes,Good old cannabis and fireworks
437,29.0,1600.0,4.0,r/Catswithjobs,My sister’s one-eyed cat is an expert mountaineer and will take you up Everest. Payment is in cat treats only.
438,60.0,911.0,7.0,r/reddevils,Simon Stone : Ralf Rangnick on Edinson Cavani: “Had quite a few conversations in last couple of weeks - probably player with whom I have spoken most. He knows I will definitely not let him go. Is highly important player for rest of season. For me it's clear that Edi has to stay.”
439,123.0,2700.0,8.0,r/dankinindia,Wha-? Where did they go ?
440,149.0,3400.0,8.0,r/confidentlyincorrect,"Because you save so many letters spelling it center instead. Also meter, realize, etc, etc"
441,187.0,1200.0,3.0,r/CryptoMoonShots,"Hector DAO - Ohm Spoon, not Fork - AMA about 2022 Master Plan Live on Youtube at 20.00 UTC - Combining Utility with Rebasing + a $100,000,000 Treasury - Bullish 🚀"
442,125.0,4600.0,7.0,r/pcmasterrace,Oh no
443,99.0,1500.0,9.0,r/Battlefield,"WTF, I love bf hardline now"
444,232.0,7300.0,10.0,r/todayilearned,"TIL When Charlie Sheen announced that he was HIV positive in 2015, it resulted in a vast increase of online search queries for HIV prevention and testing, which was later dubbed the ""Charlie Sheen effect""."
445,125.0,4700.0,11.0,r/softwaregore,This bus had a bit too much gasoline last night... (I blurred the bus driver)
446,80.0,5600.0,16.0,r/SequelMemes,Do not compare me to my father
447,85.0,3400.0,6.0,r/therewasanattempt,To land a perfect kick.
448,131.0,3500.0,9.0,r/FoodPorn,"Homemade Pastrami. This is my second run. It spent 20 days in brine, 1.5 days in water, 2.5 days in its rub, and finally 13.5 hours on the smoker (wrapped in butcher's paper after 8 hrs)."
449,142.0,1400.0,7.0,r/IndianDankMemes,"Le bhai, Anti-misogynistic"
450,79.0,1100.0,7.0,r/worldbuilding,Simple Ideas for Your Eastern-Influenced Fantasy World
451,50.0,2600.0,7.0,u/hero0fwar,You think HQG is some kind of Starter Sub??? (Sound Sunday)
453,37.0,1500.0,8.0,r/Stellaris,"Even if the Artisan Troupe is wiped out, their ghost will haunt you to renew your Subscription"
454,49.0,4100.0,6.0,r/PewdiepieSubmissions,I love you Pewds. Please don't hate me.
455,168.0,928.0,5.0,r/Undertale,And Fell is out! You guys really hate the edgelords. There are only 2 left
456,10.0,1400.0,4.0,r/ScottishPeopleTwitter,Keep the tradition alive
457,83.0,2400.0,9.0,r/blender,I recreated Vulture scenes from Spiderman for my school assignment. I'm looking for any feedback on any aspect that can be improved!
458,39.0,2600.0,7.0,r/tf2shitposterclub,funny sentry gang
459,23.0,1300.0,3.0,r/CozyPlaces,My reading nook is my favorite cozy place.
460,154.0,2900.0,5.0,r/Minecraft,I made mincraft smooth
461,46.0,1800.0,5.0,r/dogelore,Le “I’m barely drunk” has arrived
462,98.0,3200.0,8.0,r/YouShouldKnow,"YSK A Hotel’s free-cancellation policy has nothing to do with a possible refund, and you should always familiarize yourself with their refund policy when traveling. Just in case."
463,37.0,1600.0,4.0,r/thesims,I think I would enjoy cooking in The Sims 4 a lot more if the food looked as good as it does in Animal Crossing
464,90.0,2000.0,84.0,r/therewasanattempt,HMFT after I try to rope swing above these rocks
466,73.0,368.0,2.0,r/recruitinghell,Want to maximize your earnings and happiness? Leave your job every 3 or 4 years.
467,21.0,1400.0,4.0,r/ItHadToBeBrazil,That's a hot dog
468,79.0,610.0,4.0,r/subnautica,[No Spoilers] Please help... its Safe Shallows. How... How do i get rid of it?
469,26.0,678.0,3.0,r/BestofRedditorUpdates,OP looking for Reddit post in which ‘a young woman asking for relationship advice is saved from human trafficking’ to send and warn her jeopardized daughter
470,14.0,2100.0,4.0,r/dndmemes,Sniper Rifle
471,484.0,2400.0,7.0,r/science,"No convincing scientific evidence that hangover cures work, according to new research. The study assessed 21 placebo-controlled randomized trials of clove extract, red ginseng, Korean pear juice, and other hangover cures."
472,34.0,4600.0,6.0,r/aww,Three good boys
473,71.0,1700.0,11.0,r/HelluvaBoss,Viv thought she can sneak herself in the pilot and it would go on noticed
474,68.0,2300.0,4.0,r/oddlysatisfying,"St Josephs lighthouse, Michigan"
475,62.0,770.0,5.0,r/chelseafc,[Miguel Delaney] Am told Chelsea squad broadly supportive of how Tuchel has handled all this.
476,91.0,2100.0,7.0,r/Brawlstars,"Brawl Stars pins, but something's a bit... Different..."
477,72.0,2000.0,10.0,r/Breath_of_the_Wild,Love doing botw memes.
478,111.0,669.0,5.0,r/linuxmemes,Let me guess - you *need* more?
479,36.0,1100.0,5.0,r/TrueSTL,He was the obvious candidate.
480,58.0,503.0,4.0,r/QAnonCasualties,Update: My Q-aunt was just put on a ventilator
481,144.0,1500.0,4.0,r/Animemes,Try to watch these in a row
482,67.0,831.0,7.0,r/valheim,We all have THAT ONE FRIEND...
484,87.0,1900.0,6.0,r/BoneAppleTea,"May body, may rules"
485,27.0,2400.0,24.0,r/wholesomegifs,Had to watch it through multiple times to see her evil schemes formulate inside her brain
487,3.0,1100.0,3.0,r/puns,Happy moo year! !
488,56.0,3700.0,6.0,r/shitposting,Free money baby
489,81.0,3000.0,8.0,r/arcane,[no spoilers] every song is just amazing
490,21.0,1800.0,5.0,r/Breath_of_the_Wild,Are boomerang memes still relevant?
491,24.0,3000.0,8.0,r/Konosuba,"My Megumin fanart, a few years ago"
492,91.0,645.0,6.0,r/autism,"Old job told me I had to take my like 2-3 gundams and action figures home from my office because it wasn't professional. New Job pays better, I get treated with respect and this is my new office. *HUGE* surprise I still get things done in my massive nest of scifi nerdery."
493,34.0,2400.0,7.0,r/PS4,"I drew the Ghost of Sparta, Ragnarok is coming ❄"
494,74.0,915.0,5.0,r/kpop,fromis_9 - The 4th Mini Album: Midnight Guest (Official Photos - Before Midnight)
495,45.0,2900.0,8.0,r/legendofkorra,The only thing
496,465.0,10200.0,5.0,r/memes,Lets hope not
497,89.0,3700.0,9.0,r/OnePiece,[OC] Here is (almost) every Robin piece I've drawn this year
498,75.0,630.0,3.0,r/community,Community was voted as r/television's #6 favorite show of all time!
499,64.0,2200.0,9.0,r/im14andthisisdeep,My 11yo nephew's new drawing
500,37.0,3900.0,7.0,r/ShitPostCrusaders,Killer Queen has already touched the screenshot button (by me)
501,52.0,1800.0,11.0,r/RimWorld,My last man starving to death next to my first colonist sarcophagus.
502,99.0,978.0,6.0,r/steelers,Today’s front page of the Pittsburgh Gazette.
503,46.0,3400.0,9.0,r/dontputyourdickinthat,no not the snussy
504,13.0,2300.0,7.0,r/CuratedTumblr,The assistant is Kronk
505,75.0,748.0,7.0,r/dashcamgifs,Squid doesn't know how to use front brakes
506,70.0,812.0,6.0,r/KansasCityChiefs,"[OC] Alright, alright, alright."
507,60.0,1900.0,7.0,r/reddeadredemption2,It is a pity...
508,147.0,5600.0,10.0,r/blursed_videos,blursed_happiness
509,36.0,3700.0,5.0,r/interestingasfuck,Landscape perfectly divided by the rails of a fence.
510,64.0,1700.0,9.0,r/ik_ihe,Ik_ihe
511,46.0,708.0,6.0,r/EnoughCommieSpam,Twitter was a mistake
512,19.0,2000.0,4.0,r/Bossfight,"Fatima, the goddess of sky, receptionist of God"
513,16.0,1100.0,3.0,r/TheBoys,I Met Mother’s Milk!
514,17.0,4600.0,13.0,r/brooklynninenine,I love them so much
515,41.0,1200.0,7.0,r/Deltarune,RalselBot my beloved
516,232.0,2400.0,2.0,r/MadeMeSmile,Saw this walking around with my daughters. It's about time! ☺️
517,37.0,2800.0,7.0,r/technicallythetruth,The shortest movie ever 😂
518,377.0,28400.0,10.0,r/antiwork,"Image of a lone striker, holding down the picket line at night in the pouring rain during the victorious 2021 Kellogg’s strike. This worker stood up for all of us."
520,63.0,389.0,2.0,r/golf,Anyone know a friend like this?
521,75.0,3600.0,12.0,r/weed,Start tellin facts
522,36.0,2400.0,7.0,r/OneSecondBeforeDisast,Only Japan can make it like this weird
523,85.0,1600.0,5.0,r/gtaonline,you can unconventionally remove the wheels of the new hummer
524,34.0,692.0,4.0,r/Witcher3,I gave my dad Witcher 3 as a Christmas present this year
525,245.0,5900.0,6.0,r/WhitePeopleTwitter,Bye Marge!
526,70.0,869.0,5.0,r/ParlerWatch,"It's only MTG's personal account, but it's a step in the right direction"
527,132.0,2800.0,6.0,r/Tinder,"Just redownloaded tinder yesterday, rethinking my decision"
528,106.0,2000.0,9.0,r/trans,Do I pass? I’m the one on the left
529,63.0,1300.0,6.0,r/Eldenring,welcome to 2022 bois
530,50.0,642.0,4.0,r/soccercirclejerk,American Here
531,51.0,1000.0,8.0,r/ReallyAmerican,Nothing makes trump supporters angrier than not being able to go to apple bees.
532,81.0,1800.0,11.0,r/india,Wordplay by swiggy.
533,58.0,983.0,5.0,r/DnD,Looking for adventures? The entire catalog of Dungeon magazine is available online. 200+ issues.
534,60.0,1400.0,9.0,r/environment,At Least 100 House Members Are Invested in Fossil Fuels
535,39.0,1400.0,5.0,r/trashpandas,Can anyone help me identify this type of bird?
536,55.0,550.0,4.0,r/MURICA,Thanks for the highway yanks! 🇨🇦🇺🇸
537,52.0,18000.0,15.0,r/2meirl4meirl,2meirl4meirl
538,39.0,704.0,6.0,r/yakuzagames,I found out the hard way why getting drunk in Yakuza 7 is a bad idea
539,10.0,1400.0,5.0,r/calvinandhobbes,Vandalism
540,38.0,1700.0,9.0,r/FullmetalAlchemist,Just Netflix logic
542,45.0,1200.0,4.0,r/BokuNoMetaAcademia,Weird isn't it...
543,64.0,2500.0,8.0,r/woooosh,I don't even know what to say
544,138.0,1900.0,4.0,r/Whatcouldgowrong,WCGW using fireworks indoors close to balloons filled with flammable gas.
545,76.0,2500.0,5.0,r/blursedimages,Blursed_ Landscape
546,43.0,1700.0,6.0,r/playboicarti,NFTs in a nutshell 💀💀💀
547,98.0,2300.0,10.0,r/Indiangirlsontinder,How the turn tables 👀
548,36.0,2000.0,7.0,r/GaySoundsShitposts,this sounded better in my head
549,69.0,913.0,5.0,r/CallOfDuty,[COD] When cod ww1 gonna drop
550,45.0,1200.0,8.0,r/TheSimpsons,"Ah man! Ned spilled ink all over my poems! He's a real flat tire. I mean a cube, man. He's putting us all on the train to squaresville, boy."
551,74.0,2000.0,6.0,r/IndianDankMemes,Abb to grammy ye hi layega
552,23.0,3900.0,10.0,r/starwarsmemes,Lightsaber is my dream 😢
553,72.0,1400.0,5.0,r/malelivingspace,Moved out of my parent's basement last month.
554,59.0,1100.0,6.0,r/suggestmeabook,"In 2019, I read one book. In 2020 I read 4 books! In 2021 I read 7 books!! This subreddit has reignited my love for reading…"
555,6.0,1200.0,4.0,r/OTMemes,When Starwars is your life.
556,35.0,2100.0,5.0,r/BlackPeopleTwitter,Madison Cawthorns seek to erase American history so they can repeat it
557,58.0,1900.0,11.0,r/2meirl42meirl4meirl,2meirl42meirl4meirl
558,44.0,2400.0,8.0,r/ApexOutlands,Seer Trauma hits hard
559,39.0,2300.0,12.0,r/WorkersStrikeBack,Love it here
560,65.0,873.0,7.0,r/IndiaSpeaks,Proposed models of rockets made by Indian space tech startups. Some of these rockers will be launched in 2022
561,56.0,948.0,6.0,r/MMA,"Among all the many takedowns in MMA, the Grapevine Throw Oбивив is truly the most Russian"
562,35.0,1100.0,7.0,r/fakedisordercringe,What?
563,30.0,1200.0,4.0,r/DankMemesFromSite19,Let’s get those damn Type Blues bois
564,49.0,3600.0,10.0,r/Catculations,Didn't catculate that correctly
565,56.0,696.0,4.0,r/Kaiserreich,When you play Russia so much that the beginning preparations are done subconsciously.
566,17.0,1400.0,5.0,r/Simulated,truck rig with rigid body physics
567,68.0,1100.0,9.0,r/MurderedByWords,our king Hasanabi
569,47.0,1200.0,4.0,r/MoldyMemes,Titol
570,79.0,653.0,5.0,r/TenseiSlime,[Round 11 Results] Le i-cant-fit-it-in-a-single-img has arrived
571,61.0,910.0,2.0,r/MakeMeSuffer,"Walked into the bathroom at my friends house, worst part is there’s no TP. The situation made me suffer"
572,36.0,1600.0,4.0,r/formuladank,Fia new track reveal for 2022
573,52.0,1300.0,4.0,r/lgbt,Saw a meme on here recently and decided to make it a bit more inclusive
