Unnamed: 0,comment_count,upvote_delta,timeup_list,subreddit,thread_text
0,18900.0,58900.0,15.0,r/AskReddit,What is a survival myth that is completely wrong and could get you killed?
1,9200.0,54500.0,8.0,r/mildlyinteresting,American food section in a supermarket in Ireland
2,8800.0,20100.0,7.0,r/gaming,Nier: Automata
3,357.0,28900.0,5.0,r/gaming,Merchant Tactics
4,4900.0,60900.0,5.0,r/news,Twitter permanently suspends Marjorie Taylor Greene's personal account
5,304.0,14400.0,4.0,r/space,Photo of me with the JWST Optical Telescope Element
6,4500.0,77100.0,9.0,r/Unexpected,President Obama forgets the salute
7,767.0,21600.0,5.0,r/Coronavirus,Twitter Permanently Suspends Marjorie Taylor Greene’s Account
9,2100.0,25500.0,5.0,r/interestingasfuck,The armor of a French soldier wounded by a cannonball at the Battle of Waterloo (which marked the end of Napoleon.)
10,518.0,22300.0,6.0,r/wallstreetbets,My life in stock.
11,4500.0,57000.0,12.0,r/Damnthatsinteresting,"Opening a $15,000 bottle of Petrus, 1961 with heated tools. This method is used to make sure that the cork stays intact."
12,997.0,39800.0,6.0,r/todayilearned,"TIL that Mohamed Bzeek, an Arab-American from California, is a foster parent who takes in only terminally ill children. He has fostered 80 children over 20 years, a practice he has continued even after his wife passed away in 2015."
13,855.0,25900.0,4.0,r/memes,Is it ẞ or not?
14,3600.0,60700.0,8.0,r/iamatotalpieceofshit,"This garbage human being goes drunk driving with friends and ends up killing two people. He gets mad because his friends (rightfully) get thrown in jail, so he films a video of himself destroying the memorials of the two people he and his friends murdered, and posts it on Twitter"
15,3200.0,65700.0,9.0,r/MurderedByWords,"Well, in his defense, he's a fucking idiot"
16,653.0,15800.0,6.0,r/PoliticalHumor,Happy 2022 😃🎉🥳
17,852.0,12900.0,5.0,r/politics,Twitter reportedly suspends Marjorie Taylor Greene's account for spreading COVID-19 misinformation
18,3300.0,39500.0,11.0,r/facepalm,Those are fathers with their daughters who just took a virginity pledge.
19,1700.0,38500.0,6.0,r/coolguides,Will get worse before it ever gets better
20,3200.0,26600.0,8.0,r/PublicFreakout,Pure unadulterated road rage
21,673.0,35100.0,6.0,r/MadeMeSmile,MrBeast have completed the goal of #teamseas... More than 600k+ people have donated in this campaign
22,541.0,32600.0,6.0,r/HolUp,Progression of Art
23,1400.0,13400.0,5.0,r/antiwork,The U.S. Healthcare System is About to Collapse
24,2900.0,6500.0,8.0,r/teenagers,Which language can you speak? Or would like to speak?
25,251.0,9200.0,4.0,r/ATBGE,This $300 shirt that looks like a gaping a**hole from a distance.
26,2300.0,37900.0,18.0,r/nba,[Highlight] Demar does it again! knocking down the tough contest corner triple to win at the buzzer
27,73.0,9300.0,4.0,r/BrandNewSentence,I thought a rusty trombone was something else
28,497.0,12900.0,5.0,r/IdiotsInCars,2021 trying to send me out with a bang
29,299.0,15100.0,5.0,r/BlackPeopleTwitter,happy new year’s everyone 🥂
30,2100.0,36000.0,18.0,r/Justrolledintotheshop,2022 CRV decided to self destruct an hour before it was delivered to customer.
31,1600.0,1800.0,9.0,r/SquaredCircle,"Meltzer on AEW “Diversity” Issue: “Those who are over will get more tv time, the guys who aren’t won’t whoever it is...the purpose is to find those who draw but some people don’t care about any of that and don’t care if business goes down just so they have a percentage time for certain individuals”"
32,64.0,12300.0,5.0,r/mildlyinteresting,Happy Moo Year from my milk jug!
33,1600.0,38500.0,9.0,r/WhitePeopleTwitter,Ain't that the truth
34,1600.0,2500.0,8.0,r/books,"After 4 attempts, I'm giving up on ever finishing the Wheel Of Time series. What book/ series have you given up on?"
35,1500.0,25000.0,8.0,r/PoliticalHumor,Covid embattled Texas governor Gregg Abbot has requested assistance from Joe Biden and FEMA in handling irony.
36,1400.0,50900.0,12.0,r/dankmemes,(chuckles) we're in danger
37,1500.0,26100.0,15.0,r/Tinder,wtf 😭
38,272.0,52000.0,7.0,r/aww,Seal gets surprised with a giant ice fish cake on his 31st birthday
39,1300.0,3700.0,7.0,r/TooAfraidToAsk,"Why are the COVID variants promoted as a ""bad"" thing? Shouldn't we be happy that the virus has become more virulent and less deadly?"
40,414.0,30000.0,7.0,r/Eyebleach,Say hello to Pumpkin.
41,78.0,7500.0,4.0,r/AnimalsBeingDerps,"Didn't see him at lunchtime, so looked around and found him sleeping in the front yard"
42,117.0,22800.0,7.0,r/TheLastAirbender,Oh Zuko. I was genuinely so surprised when Zuko decided to return to the fire nation at the end of season 2.
43,1300.0,8400.0,17.0,r/stocks,"Too many of you have never experienced a stock market crash, and it shows."
44,1300.0,23700.0,9.0,r/politics,Chilling Trump Letter Calling For 'Seizure' Of Election Material Revealed In Log To Jan. 6 Probers
45,1100.0,2700.0,8.0,r/movies,"What movie, in your mind, had a memorable marketing campaign which struck you as especially creative or innovative?"
46,305.0,13600.0,5.0,r/lotrmemes,Just noticed on a re-watch
47,1100.0,16200.0,9.0,r/nextfuckinglevel,How to open a 1961 Château Péteus ($10000-$15000) with heating tools to keep the cork intact.
48,1100.0,6800.0,8.0,r/explainlikeimfive,ELI5: Why is euthanasia often the only option when a horse breaks its leg?
49,80.0,10000.0,5.0,r/suspiciouslyspecific,roosters are the best
50,1000.0,9000.0,13.0,r/europe,Finland says it could join NATO despite Russian pressure
51,1000.0,2000.0,11.0,r/AskUK,What do you think Charles is going to do with Andrew?
52,233.0,33900.0,7.0,r/wholesomememes,Thank you my friend.
53,287.0,11700.0,6.0,r/raimimemes,I never thought he'd really do that
54,204.0,10500.0,6.0,r/WhitePeopleTwitter,Good start
55,1000.0,18300.0,9.0,r/Showerthoughts,"Everyone has genetic code for both a boob size and penis size, but your body only uses one of them"
56,64.0,8900.0,5.0,r/ProgrammerHumor,Debugging Code Be Like.
57,863.0,1600.0,6.0,r/ontario,Incredulous at how insensitive people on this sub have become to immunocompromised or otherwise at-risk individuals
58,974.0,16600.0,9.0,r/mildlyinfuriating,"At a parking lot. These cars are all parked in EV charging spots, despite the fact that none of these are electric vehicles…"
59,374.0,4700.0,3.0,r/Wellthatsucks,My (ex)wife's reaction when I got back from 5 month deployment.
60,1000.0,6300.0,5.0,r/blackcats,"What is Henry thinking about? Wrong answers only, please."
61,799.0,7800.0,17.0,r/sports,"Ole Miss star QB Matt Corral, one of the top quarterback prospects in the upcoming NFL draft, declined to opt-out of the Sugar Bowl against Baylor. During the Sugar Bowl, Corral suffered a lower leg injury that would take him out of the game and put him in crutches."
62,768.0,21900.0,17.0,r/science,"Depression affects over 17 million American adults yearly and has been identified as leading cause of disability in people between the ages of 15 and 44 years. New study shows that feeling not loved or wanted by a parent/caregiver during adolescence has serious implications, for both men and women."
63,528.0,6300.0,4.0,r/Wellthatsucks,New Years gift. Digging out a rifle round from my deck.
64,825.0,6600.0,15.0,r/dataisbeautiful,Doctors (physicians) per 1000 people across the US and the EU. 2018-2019 data 🇺🇸🇪🇺🗺️ [OC]
65,839.0,7800.0,5.0,r/unpopularopinion,Reddit needs to allow users to make their history private.
66,774.0,2300.0,4.0,r/television,Results for r/television's 2021 Favorite Shows Survey
67,739.0,4700.0,9.0,r/ufc,Thoughts? Jake Paul responds to Dana White and agrees to steroid testing in exchange for testing every UFC fighter.
68,196.0,6700.0,4.0,r/greentext,Anon is a jerk off
69,250.0,10500.0,6.0,r/OldSchoolCool,"Tilda Swinton, 1988"
70,703.0,5000.0,13.0,r/confidentlyincorrect,The origins of circumcision
71,619.0,8300.0,8.0,r/byebyejob,Police officer resigns after intentionally damaging car during a search.
72,468.0,6700.0,15.0,r/SelfAwarewolves,"Asks why the weather is changing, but doesn't accept climate change as an answer"
73,162.0,9600.0,6.0,r/itookapicture,ITAP of a Lion as it walked towards me.
74,653.0,9500.0,8.0,r/HolUp,So.... She's black?
75,599.0,1800.0,8.0,r/atheism,Turns out my bf is a believer
76,249.0,6200.0,14.0,r/starterpacks,Executive DILF on Dating Apps starter pack
77,294.0,7200.0,5.0,r/GetMotivated,"[Image] Annual UPDATE - Day 865 of no zero days - daily workout, quit drinking/smoking"
78,141.0,9300.0,4.0,r/dankmemes,Necessity is the mother of all inventions
79,558.0,6000.0,9.0,r/niceguys,"Guy posts racist ""nice guy"" post and then proceeds to argue with everyone who tells him he's an asshole."
80,286.0,17000.0,7.0,r/PrequelMemes,Why would anyone think closing on them is a good idea?
81,540.0,15300.0,12.0,r/Hololive,RAP CONTEST!! Hololive X Nijisanji X VOMS
82,587.0,2900.0,6.0,r/AdviceAnimals,The Whiners who spoked their own wheels asking Brandon for help is just irony
83,431.0,18900.0,8.0,r/ContagiousLaughter,Debbie or David?
84,183.0,9700.0,13.0,r/harrypotter,"Shoot your shot, Dan"
85,199.0,44000.0,16.0,r/AnimalsBeingBros,Being there is what keeps us going.
86,477.0,18200.0,12.0,r/formula1,Throwback to when Lewis took down pro wrestler Mistico prior to the 2015 Mexican GP
87,629.0,8800.0,9.0,r/PrequelMemes,Star wars rebels is underrated tho
88,468.0,2400.0,6.0,r/marvelstudios,"I was told a common superhero trope is that a villain is concerned about a real problem, hero disagrees with method (violence), and doesn’t actually do anything about the problem."
89,214.0,8200.0,6.0,r/pics,I shot a lion... with my Nikon.
90,614.0,6200.0,5.0,r/cats,"She goes outside to collect moss and throws it into her water bowl. Does anybody know, why she does this?"
91,570.0,15000.0,18.0,r/blunderyears,I was one of those who used to wear a beanie in the middle of the summer.
92,531.0,12700.0,15.0,r/CrappyDesign,"The official county seal of St. Francis County, Missouri"
93,522.0,899.0,5.0,r/Conservative,Marjorie Taylor Greene’s personal Twitter account permanently banned over ‘repeated violations’ of COVID-19 misinformation policy
94,1500.0,24500.0,8.0,r/Damnthatsinteresting,Two years ago on China Central Television
95,583.0,8500.0,8.0,r/terriblefacebookmemes,Body Shaming children?
96,3000.0,6000.0,4.0,r/AskReddit,What short sentence does every man want to hear?
97,531.0,3900.0,5.0,r/Cringetopia,Women shaming their exes for not being conventionally attractive is a new TikTok trend
98,533.0,15100.0,8.0,r/NatureIsFuckingLit,🔥 Giraffe fighting
99,525.0,3200.0,4.0,r/Spiderman,How would you list the MCU Spider-Man trilogy from strongest movie to weakest movie?
100,403.0,2500.0,11.0,r/Genshin_Impact_Leaks,2.5 test server - Next Wednesday
101,417.0,4700.0,4.0,r/nba,"[Basketball Reference]: Klay Thompson has earned $78,838,770 until injury in 2019 Finals. Since last time Klay Thompson has played he earned $84,314,642. Klay made more money being injured than through playing."
102,502.0,10700.0,10.0,r/assholedesign,This Arabic anime translation has random “don’t let the episode distract you from your imposed prayers” and half of the dialogue disappears
103,167.0,7700.0,11.0,r/DunderMifflin,Favorite Darryl lines? Mine:
104,91.0,10400.0,6.0,r/me_irl,me_irl
105,168.0,7200.0,6.0,r/Jokes,A guy walks into a bar and sees a jar of 100$ bills on the counter
106,351.0,19600.0,8.0,r/therewasanattempt,to HIDE......
107,153.0,8400.0,7.0,r/witcher,I hate it when it happens
108,483.0,3200.0,9.0,r/Warframe,"A reminder that out of these concepts, DE chose the water girl. [Art by Matias Tapia]"
109,530.0,38900.0,8.0,r/funny,We are living in the future
110,371.0,13600.0,14.0,r/ProgrammerHumor,Quora is truly a Magnificent place
111,5900.0,9400.0,6.0,r/AskReddit,What is a movie you assume everyone has seen?
112,319.0,9800.0,11.0,r/TIHI,"Thanks, I hate these father daughter pictures"
113,583.0,4300.0,3.0,r/facepalm,Read the Bible for details
114,174.0,6200.0,5.0,r/nextfuckinglevel,He is gonna smile all the way to the bank selling this toys.
115,237.0,14300.0,8.0,r/Superstonk,"Last January, we jumped in for a quick short squeeze. Instead, what we found was a fully corrupt and fraudulent global financial system."
116,144.0,5500.0,6.0,r/MarchAgainstNazis,Finally
117,448.0,7000.0,9.0,r/wow,The fact that 99.9% of the shops in game have no use whatsoever is extremely depressing.
118,444.0,2100.0,11.0,r/AskMen,What is the proper etiquette if a guy buys me a drink at the bar?
119,494.0,7700.0,5.0,r/politics,Twitter permanently suspends Marjorie Taylor Greene account over COVID-19 misinformation
120,469.0,7100.0,7.0,r/pettyrevenge,Neighbors kept bitching about my Christmas decorations so I kept adding to them.
121,272.0,10900.0,18.0,r/hockey,"Canucks Equipment Manager Red Hamilton and fan Nadia Popovici have met one another tonight after Popovici spotted a mole on Hamilton's neck during a game that was found to be early stage cancer, potentially saving his life"
122,278.0,11800.0,7.0,r/maybemaybemaybe,Maybe maybe Maybe
123,253.0,5500.0,4.0,r/meme,Im definitley the outdated guy
124,412.0,48200.0,10.0,r/WatchPeopleDieInside,He wasn't ready.
125,34.0,5700.0,6.0,r/NonPoliticalTwitter,Deep
128,341.0,6600.0,17.0,r/tooktoomuch,"Andy Cohen after being ""overserved"""
129,72.0,3300.0,3.0,r/formuladank,Knight Rider
130,89.0,12800.0,8.0,r/HumansBeingBros,Daughter helps out her deaf father 💞
131,37.0,4800.0,5.0,r/AnimalCrossing,They're on a date <3
132,603.0,7600.0,6.0,r/BikiniBottomTwitter,The good music
133,297.0,7700.0,60.0,r/dumbasseswithlighters,What could go wrong trying to spit fire
135,215.0,6200.0,6.0,r/formula1,Few 2022 chassis being transported by airplane
136,455.0,1500.0,8.0,r/GamingLeaksAndRumours,"Cyberpunk 2077 DLC, big patch, anime, Leaks and more"
138,475.0,857.0,7.0,r/Libertarian,"Republican rep. Madison Cawthorn tweets ""Our Founding Fathers wouldn't recognize the America we live in today."". Republican rep Adam Kinzinger responds ""I think they would be concerned, but certainly proud that the institutions held against people like you."""
139,470.0,3600.0,5.0,r/CasualUK,Is it a UK thing to have benches in pointless locations?
140,100.0,5200.0,6.0,r/food,[homemade] Steak
141,460.0,11500.0,8.0,r/oddlyterrifying,POV: Polar Bear is trying to eat you.
142,401.0,2700.0,9.0,r/germany,Things must be bad if the German Army are now advertising on pizza boxes
143,1400.0,23200.0,8.0,r/WhitePeopleTwitter,"No, seriously. This is the actual Lt. Gov of Pa."
144,316.0,27000.0,10.0,r/FuckYouKaren,Karens in a nutshell
145,125.0,14400.0,10.0,r/greentext,Anon plays the autism card
146,358.0,14100.0,15.0,r/HermanCainAward,"Decisions, decisions……"
147,391.0,581.0,4.0,r/bayarea,Is it Just Me or are a Lot of Boomers in the Area Super Hypocritical?
149,546.0,14400.0,7.0,r/antiwork,"Refused to be given an interview for promotion, so I quit"
150,437.0,27600.0,10.0,r/BeAmazed,How We Learned that Bees Perceive Time
151,125.0,2800.0,6.0,r/UpliftingNews,US Marshals find five missing teenagers in New Orleans during 'Operation Boo Dat'
152,400.0,2100.0,9.0,r/battlefield2042,This is a sadness. That's it for EU Portal servers
153,380.0,11200.0,15.0,r/KidsAreFuckingStupid,Trying to burn my house down!! No more S’mores.
154,397.0,1700.0,10.0,r/xboxone,Ex girlfriend dumped liquid into my brand new series x can I fix it? Today’s my birthday and I just found out…..I could cry
155,291.0,7100.0,10.0,r/tifu,TIFU by asking the Judaism subreddit to translate something written in Tengwar (the Lord of the Rings script/language)
156,479.0,7000.0,6.0,r/Cringetopia,Attention attracted
157,344.0,27300.0,11.0,r/pcmasterrace,Mum can I have a burger
158,416.0,22300.0,11.0,r/lotrmemes,keep your forked tongue behind your teeth
159,404.0,2300.0,8.0,r/halo,Why do people argue against Assasinations by saying 'it ruins the flow of gameplay' when you can toggle it off or just not hold the smack button? Seems like a bad deal to swap the hilarious and rub-in-face action of assasinating someone for basically nothing.
160,283.0,4300.0,5.0,r/dndmemes,"Tried playing completely RAW once... caster players kept saying I was ""nerfing"" them"
161,220.0,4200.0,10.0,r/CrazyFuckingVideos,argument gone wrong...
162,133.0,3600.0,10.0,r/MemePiece,😏😐
163,421.0,16000.0,14.0,r/space,An exploding star captured by Hubble
164,218.0,28700.0,9.0,r/blursedimages,Blursed_Facecam
165,308.0,1300.0,9.0,r/apple,Kuo: AirPods Pro 2 to Feature Lossless Support and Sound-Emitting Charging Case
166,378.0,5400.0,10.0,r/TikTokCringe,A Challenge for Democrats
167,42.0,5100.0,6.0,r/ToiletPaperUSA,Benny DESTROYS Dora with facts and logic
168,317.0,5000.0,7.0,r/Instagramreality,Men need body positive just as much as women do
169,284.0,2200.0,5.0,r/MaliciousCompliance,Stick to your crappy wedding playlist? Ok!
170,1400.0,12100.0,7.0,r/news,"Capitol rioters’ tears, remorse don’t spare them from jail"
171,295.0,2100.0,5.0,r/pcgaming,Steam reached a peak record of almost 28 million concurrent users today
172,181.0,6800.0,6.0,r/hmm,Hmmm
173,55.0,3800.0,4.0,r/Bossfight,"Sir Sax, Musical Gentlemen"
174,364.0,10500.0,12.0,r/LifeProTips,"LPT: If you offer someone an alcoholic drink and they say no, immediately tell them what non-alcoholic drinks you have. With no judgment. They don't owe you any explanation of recovery, medical contraindications, or whether or not they just don't feel like it that day."
175,224.0,33300.0,7.0,r/memes,The online classes
176,217.0,5100.0,12.0,r/StardewValley,"Finally, blind people can play Stardew Valley"
177,336.0,11200.0,13.0,r/MinecraftMemes,This time it is repost (sorry for bad image)
178,81.0,2800.0,10.0,r/TankPorn,Thermal signature of the Abrams vs a T-72 tank
179,218.0,22600.0,10.0,r/rarepuppers,He's the coolest puppy!
180,389.0,5700.0,16.0,r/houseplants,Am I the only one that agrees
181,319.0,4100.0,10.0,r/EscapefromTarkov,VOIP is a blessing. I couldn't believe my ears.
182,145.0,4500.0,14.0,r/ChoosingBeggars,Because spray paint costs nothing
183,252.0,893.0,7.0,r/Romania,Apartament de 70.000€ in Bucuresti
184,210.0,1600.0,9.0,r/freefolk,Blowing up the sept was a brilliantly moronic scene
185,43.0,2700.0,3.0,r/PraiseTheCameraMan,"Excellent choice of camera location, some good timing on the zoom in/out, and they hang in there through the carnage at the end"
186,288.0,1400.0,6.0,r/vancouver,"Vancouver has been great, but it's time to move on"
187,61.0,5400.0,6.0,r/marvelstudios,Working title by me
188,300.0,6700.0,9.0,r/marvelmemes,I was looking through some old photos and this looks very uhhh similar
189,205.0,1500.0,8.0,r/canada,Whistleblower warns baffling neurological illness affects growing number of young adults
190,290.0,4300.0,13.0,r/evilbuildings,"Antilia- house of Asia's richest man in Mumbai, India"
191,287.0,14700.0,9.0,r/WhatsWrongWithYourDog,.
192,80.0,5800.0,9.0,r/interestingasfuck,SLPT: Leave your kid in the car while you shop so it doesn’t get stolen.
194,39.0,8400.0,8.0,r/tumblr,perfect
195,105.0,2300.0,4.0,r/tf2,How TF did this even happen?(please explain)
196,296.0,1800.0,8.0,r/pokemon,Does anyone else find using legendaries is weird?
197,28.0,5300.0,5.0,r/Minecraft,"Hey everyone. I’m working on an absolute true model of the World Trade Center, and will be as accurate as possible. I’m 210 Hours in, and it’s being built by me only on an Xbox Series X. I’d love to give updates on here. I’ll answer any questions in the comments as well"
198,355.0,15500.0,11.0,r/HumansBeingBros,Animal rescuer helps free squirrel from birdcage.
199,176.0,11300.0,8.0,r/whenthe,"Can't have it both ways, John!"
200,148.0,642.0,3.0,r/nursing,Really?
201,103.0,15200.0,9.0,r/rareinsults,How do people even come up with these
202,137.0,6800.0,8.0,r/FUCKYOUINPARTICULAR,that's the definition of petty
203,418.0,1400.0,4.0,r/CryptoCurrency,I'm into Crypto for hookers and cocaine. Happy New Year
204,117.0,4800.0,7.0,r/HermanCainAward,Simba was onto something
205,455.0,1900.0,9.0,r/lgbt,What'd you name me?
206,381.0,19500.0,9.0,r/maybemaybemaybe,Maybe Maybe Maybe
207,325.0,11600.0,14.0,r/awfuleverything,Rip EKO
208,194.0,2900.0,10.0,r/AnarchyChess,"What now, mortals?"
209,150.0,10500.0,6.0,r/dankmemes,Chad
210,183.0,70000.0,16.0,r/wholesomememes,A wholesome family
211,229.0,867.0,4.0,r/Teachers,Update to 2 colleagues quitting! Condescending email from principal.
212,27.0,4100.0,6.0,r/wholesomegifs,Taking both your little ones for a stroll
213,190.0,4200.0,15.0,r/TheMandalorianTV,"I love that Ahsoka in Mando is an absolute force of nature. She clears out an entire town, but Luke gets all the hype… Rosario didn’t have to go this hard but she did!"
214,291.0,3300.0,7.0,r/MapPorn,A topographic map of Ukraine
215,100.0,3700.0,6.0,r/freefolk,Characters that have killed more Starks than the Night King
216,56.0,6400.0,8.0,r/PeopleFuckingDying,iNnOcEnT dOg CrUeLLy BuRiEd uP tO iTs ArMpItS iN cOnCrEtE
217,316.0,7200.0,9.0,r/pics,A powerful shot in Hong Kong.
218,395.0,888.0,7.0,r/polls,What's the most annoying grammar mistake?
219,249.0,8100.0,11.0,r/ich_iel,ich_iel
220,237.0,4100.0,5.0,r/ksi,This better not be something crypto or NFT related.
221,204.0,3100.0,4.0,r/starterpacks,"The ""Successful"" middle class American starter pack. Probably going to trigger a few with this one. You know it's true!"
222,23.0,3700.0,6.0,r/EarthPorn,Wildflowers - Grand Teton National Park [OC] [4989x3326]
223,142.0,9100.0,15.0,r/fakehistoryporn,J.K. Rowling writing Harry Potter at a café in Scotland (1998)
224,245.0,8800.0,10.0,r/Futurology,There's a new VR psychology treatment that lets you talk to yourself by switching roles (being both the patient and the psychologist) that can lead to detachment from habitual ways of thinking about personal problems. It allows you to see yourself as you see others.
225,91.0,2500.0,3.0,r/nottheonion,5-year-old basset hound elected mayor of Colorado town
226,281.0,53700.0,10.0,r/nextfuckinglevel,Pop-up memes by PaperPaul.
228,228.0,904.0,6.0,r/Boxing,Jake Paul has more to say to Dana White...
229,131.0,859.0,5.0,r/playboicarti,What does Carti do all day fr
230,271.0,22000.0,11.0,r/oddlysatisfying,Kumiki: Traditional Japanese Wood Joinery
231,220.0,3900.0,3.0,r/Superstonk,GameStop Employee here. Some great deals starting today like this insane 25% everything you can fit in a corgi bag! u/criand 👀
232,58.0,520.0,3.0,r/WestSubEver,Did she just curse at ye??? 😭
233,113.0,2200.0,7.0,r/de,…
234,171.0,16900.0,12.0,r/IllegallySmolCats,Omggg!
235,235.0,30900.0,20.0,r/StartledCats,Cat just wanna startle his owner but instead he was the one who was startled
236,186.0,22500.0,24.0,r/MadeMeSmile,But he went to get milk...
238,175.0,2300.0,5.0,r/TrueOffMyChest,My Dad thinks he will die of COVID today
239,296.0,2300.0,7.0,r/NoStupidQuestions,"If I weigh 99 pounds, and I eat 1 pound of cheese, am I 1% cheese?"
240,226.0,795.0,3.0,r/CFB,"[On3] C.J. Stroud: ""This is the Rose Bowl, man. This is where the legendary games are being played. If you aren't motivated to play, I question your love of the game."""
241,109.0,2100.0,10.0,r/HadesTheGame,Infinite HP😂
242,184.0,8200.0,12.0,r/Terraria,The seven deadly sins of terrarians
243,191.0,2700.0,19.0,r/LateStageCapitalism,"From what was said about him on the news, most of us grew up believing that Fidel Castro was a monster. Yet it is obvious here that he is more rational and emphatic than most western leaders were"
245,202.0,949.0,7.0,r/TalesFromYourServer,"Lady orders 13 cactus coolers, then refuses to pay"
246,123.0,2500.0,9.0,r/unitedkingdom,Matt Hancock and lover were at Downing St party on same day he told Brits to keep 2m apart
247,77.0,7700.0,7.0,r/PewdiepieSubmissions,why?
248,208.0,1700.0,7.0,r/fuckcars,Americans are so blinded by consumerism and big things that they don't realize life in other countries can be much better.
249,237.0,966.0,4.0,r/bestof,/u/inoveryourtoes explains why the 2nd amendment won’t save you from a tyrannical government
250,104.0,4400.0,6.0,r/Genshin_Impact,Eula combo in real life!
251,54.0,2700.0,4.0,r/gifs,Let me love you :
252,249.0,3300.0,2.0,r/HolUp,"Don't know why it happened, but pretty satisfying"
253,97.0,2400.0,9.0,r/mathmemes,I'll never understand this
254,244.0,1100.0,4.0,r/teslamotors,"Tesla delivered 308,600 vehicles in Q4, and delivered a total of 936,172 vehicles in 2021"
255,43.0,5400.0,8.0,r/comics,Pervmote [oc]
257,78.0,4300.0,4.0,r/HumansBeingBros,Pay It Forward :)
258,254.0,3400.0,12.0,r/UrbanHell,Western Sydney Sprawl
259,71.0,2700.0,5.0,r/Embroidery,My embroidery diary did not go too well
260,156.0,7000.0,9.0,r/hmmm,hmmm
261,169.0,4800.0,5.0,r/aww,He never gives up
262,275.0,966.0,3.0,r/ffxiv,I have Rescue bound to my spacebar and I'm not afraid to use it!
263,93.0,4800.0,16.0,r/AnimalsBeingBros,"Canine treats homeless man better than humans do, gets framed as a feel good Dog story."
265,225.0,749.0,6.0,r/Maplestory,"Official GMS 2022 Boycott, It Is Time For This To End."
266,111.0,1100.0,7.0,r/overlord,Can we plz prescribe them a brain cell?
267,55.0,5100.0,8.0,r/MovieDetails,Foreshadowing in Coco (2017). Explanation in picture.
268,240.0,1300.0,6.0,r/worldnews,UAE to ban non-vaccinated citizens from traveling abroad from Jan. 10
269,278.0,1300.0,4.0,r/DestinyTheGame,I must be in the extreme minority… but I can’t wait to get to rank 16 so that I can never farm Dares of Eternity again.
270,275.0,1900.0,8.0,r/amcstock,Most people can see the problems. Lots of people are angry about it. Few know what to do about it. Even fewer have the capability. I’ll hold until the job is done.
271,142.0,9800.0,10.0,r/Genshin_Impact,"Please accept my first Genshin Animation sacrifice. Enjoy! (Sound ON, important!)"
272,221.0,8400.0,10.0,r/instant_regret,Empowerment!
273,258.0,3300.0,10.0,r/2007scape,TIL: RuneLite uses the R from RS3. Get triggered nerds
274,152.0,625.0,5.0,r/NewVegasMemes,Meta post
