Unnamed: 0,comment_count,upvote_delta,timeup_list,subreddit,thread_text
934,76.0,2600.0,4.0,r/nextfuckinglevel,1961 Anti-theft suitcase
935,25.0,1900.0,7.0,r/ProgrammerHumor,Senior Developer vs Intern
936,5.0,640.0,3.0,r/ScottishPeopleTwitter,Fair dos
937,40.0,4100.0,4.0,r/memes,I like cheese
938,110.0,1400.0,8.0,r/de,Bella Deutschland
939,61.0,857.0,5.0,r/gtaonline,"You may be old, but are you this old?"
940,41.0,1100.0,6.0,r/toptalent,Jamming in the studio
941,62.0,499.0,4.0,r/MealPrepSunday,A Near Year; Same Old Me. Nothing’s Changed.
942,41.0,1700.0,9.0,r/Rainbow6,my barbed wire ocean that i made after the situation wouldnt progress.
943,16.0,3000.0,14.0,r/ImaginarySliceOfLife,TAIWAN Officelady - Dusk market by Skyfire
944,179.0,529.0,5.0,r/StockMarket,"Tesla delivers 'Stunning' 308,600 vehicles in Q4 vs 266k Wall Street Estimate"
945,40.0,386.0,3.0,r/DeepRockGalactic,"Im challenging myself to draw the DRG machines as badass humans, here is the first: meet BET-C !"
946,211.0,649.0,6.0,r/CODWarzone,Fuck the akimbo double barrel
947,91.0,915.0,3.0,r/PublicFreakout,Embarrassed Relative Apologizes For His Karen Aunt
948,13.0,475.0,4.0,r/TransClones,A weakness only the cis possess
949,264.0,730.0,6.0,r/Firearms,"We can do memes, right?"
950,95.0,555.0,5.0,r/ak47,As requested: shooting video of the 7.62x25 Ak
951,17.0,892.0,7.0,r/absolutelynotme_irl,absolutelynotme_irl
952,24.0,512.0,4.0,r/MakeupAddiction,my new year's eve makeup
953,12.0,608.0,5.0,r/Blep,Penny blep
954,8.0,643.0,6.0,r/k_on,Move over Yui!
955,53.0,841.0,7.0,r/forwardsfromgrandma,"grandma - it is your right, but it isn't."
956,16.0,634.0,6.0,r/AbandonedPorn,Wonka Mansion in Germany
957,40.0,1900.0,10.0,r/DnD,"[OC] My newest character for a homebrew campaign, Micah!"
958,98.0,522.0,4.0,r/ShitMomGroupsSay,The lengths people will go to abide by their arbitrary religious rules in a very right leaning mom’s group
960,134.0,1700.0,9.0,r/MaliciousCompliance,You don't want the climbing plants? Sure thing!
961,9.0,786.0,7.0,r/lotr,"Sam and Rosie's wedding, a commissioned painting I made"
962,67.0,631.0,6.0,r/americandad,Son of Stan?
963,32.0,731.0,6.0,r/tech,Researchers use electron microscope to turn nanotube into tiny transistor
964,51.0,3000.0,12.0,r/vexillologycirclejerk,can somebody identify this flag????
965,22.0,711.0,4.0,r/videos,Mr Bean in Cyberpunk 2077
966,13.0,626.0,6.0,r/PhasmophobiaGame,Hanged Man to High Priestess
967,39.0,2200.0,8.0,r/lotrmemes,Fool of a Took
969,22.0,532.0,5.0,r/egg_irl,egg_irl
970,55.0,426.0,3.0,r/FinalFantasy,Don’t do melee attacks with staffed girl characters they said. Those are healers they said. Staffed girls are skull pummeling destroyers I said.
971,6.0,536.0,10.0,r/HolUp,C'mon it's funny!
973,261.0,4200.0,20.0,r/facepalm,"Logan Paul expects the only ambulance in the city to rehydrate him via IV, so that he can enjoy NYE with his friends"
975,207.0,6000.0,8.0,r/HolUp,Damn kid
976,42.0,970.0,8.0,r/woodworking,Epoxy old floor AC grates (1946 house)
977,51.0,591.0,3.0,r/soccer,Upvotes to the left. Awards on the right
979,112.0,744.0,4.0,r/LivestreamFail,Nymn tries Tarkov for the first time
980,211.0,837.0,7.0,r/Daytrading,"$400k+ profit, 20,000% account growth in 1.5 years daytrading"
981,94.0,751.0,7.0,r/MCPE,Nothing just some reviews of Minecraft trial on playstore
982,46.0,775.0,7.0,r/gatekeeping,Gatekeeping esports and any competition based league because the competitors can’t handle sexual harassment.
984,61.0,778.0,7.0,r/90DayFiance,This whole sub.
985,25.0,1900.0,18.0,r/nextfuckinglevel,Taking a Shortcut
987,79.0,394.0,3.0,r/Turkey,"Dün Adana’da 13 yaşındaki Musa Mert Tığıl, Hatay’da ise lise öğrencisi Rıfat Uygun dinci sığınmacılar tarafından bıçaklandı. Durumları kritik. 😔"
988,43.0,2700.0,5.0,r/interestingasfuck,Emerging instincts on pups is something wow
989,70.0,1000.0,9.0,r/GODZILLA,I don’t think enough people remember just how haunting Legendary Godzilla’s first introduction to the world was.
990,74.0,672.0,3.0,r/MinecraftMemes,"I prefer the OG stuff, but dang Lena Raine's music slaps"
991,24.0,753.0,7.0,r/DestinyFashion,My purple warlock
992,66.0,520.0,5.0,r/ACAB,Bootlicker in my DMs didn't like my bio.
995,32.0,2600.0,14.0,r/howtonotgiveafuck,The ultimate stoic teacher
996,8.0,1300.0,8.0,r/destiny2,Xur bouta neuter someone
997,4.0,408.0,3.0,r/spaceporn,The butterfly nebula or also known as the bug nebula
998,133.0,4700.0,12.0,r/CasualUK,Lottery money well-spent; perhaps it's most major project...
999,24.0,502.0,4.0,r/eu4,Hmmmm
1000,30.0,1300.0,7.0,r/ksi,How the KSI vs Logan paul 3 face off would go.
1001,2.0,480.0,4.0,r/uselessredcircle,Red
1002,17.0,581.0,5.0,r/adventuretime,My favourite sewing project! Huntress Wizard cosplay
1003,29.0,588.0,6.0,r/MortalKombat,"You Suffer Against Toxic Players, I Enjoy Minigun Rambo. We Are Not The Same"
1004,158.0,5000.0,17.0,r/lifehacks,Use a small binder clip to keep your cell phone charging cord from falling off the bed
1005,40.0,6200.0,17.0,r/instantkarma,Taxi runs a red and cuts off a cop
1006,13.0,412.0,4.0,r/steinsgate,sneaky
1008,34.0,964.0,8.0,r/Sims4,Working on some details for my overgrown villa :) Trying to achieve a little bit of a ghibli-feel to it. What do you think?
1009,653.0,20000.0,17.0,r/TIHI,Thanks I hate Fake Translucent Fleece Pantyhose
1010,134.0,1100.0,7.0,r/legendofkorra,Controversial Topic: Do you feel Kuvira deserves sympathy/redemption after this scene?
1011,18.0,2000.0,13.0,r/AdultHood,New Years
1013,295.0,512.0,5.0,r/PS5,PlayStation 5 & Xbox Series X/S - Year One Retrospective - Digital Foundry
1014,103.0,832.0,8.0,r/linux,Canonical is looking for a Linux Desktop Gaming Product Manager
1015,130.0,873.0,8.0,r/WetlanderHumor,peak cringe
1016,404.0,1700.0,11.0,r/VALORANT,Why insta lock duelist if ur not gonna entry
1017,229.0,629.0,11.0,r/VALORANT,RTS with deep economics. All resources are physical and must be transported to each point in the supply chain.
1018,23.0,1000.0,9.0,r/TheWayWeWere,"Members of a local history association posing next to a runestone. Badelunda, Sweden on the 24th of June 1913."
1019,175.0,419.0,3.0,r/starcitizen,"Due to recent heated discussion about NFTs, I decided to create a handy infographic on why it is not a good idea to implement such thing into Star Citizen (or even in video games in general)."
1020,33.0,1100.0,9.0,r/minipainting,"Oleana, the Werewolf Queen"
1021,16.0,546.0,5.0,r/cottagecore,More fairycore style but I just made this wing drop necklace :)
1022,27.0,3200.0,14.0,r/csgo,Enjoy your MM sir
1023,196.0,3300.0,15.0,r/ArtefactPorn,"18th century iron Scold’s Bridle, The Tower of London’s collection. Formerly mistaken as an executioner’s mask. These heavy metal masks were common implements of torture and public humiliation used on women whose gossip or speech caused scandal or division in society. [600x726]"
1024,8.0,1000.0,9.0,r/mycology,I enjoy seeing your posts when they hit the front page and felt I had to share this with you! Imagine seeing a toad actually sitting on a toadstool
1025,54.0,590.0,5.0,r/copypasta,⠀⠀⠀⠀⠀⠀⠀⢀⠤⠀⠄⡀⠀⠀⠀⢀⣠⣤⣄⠀⠀⠀⠀⠀⠀⠀⠀⠀⠀ ⠀⠀⠀⠀⠀⠀⠀⠀⡆⠀⠀⠀⠈⣄⣠⠶⠋⠁⠀⡿⠀⠀⠀⠀⠀⠀⠀⠀⠀⠀ ⠀⠀⠀⠀⠀⠀⠀⠀⠐⢄⡀⢀⡠⠋⠀⠀⠀⠀⣸⠃⠀⠀⠀⠀⠀⠀⠀⠀⠀⠀ ⠀⠀⠀⠀⠀⠀⠀⠀⡀⠄⠒⠒⢂⡄⠤⠀⠀⠐⠧⠀⡀⠀⢀⣀⠀⠀⠀⠀⠀⠀ ⠀⠀⠀⠀⠀⠀⠀⡌⠀⠀⡠⠊⠁⠀⠀⠀⠀⠀⠀⠀⠀⠉⠀⠀⠀⠁⠢⡀⠀⠀ ⠀⠀⠀⠀⠀⠀⠀⡀⢠⠊⠀⠀⠀⠀⠀⠀⠀⠀⠀⠀⠀⠀⠀⠀⠀⠀⠀⢡⠀⠀ ⠀⠀⠀⠀⠀⠀⠀⠱⠃⢀⣀⣤⡄⠀⠀⠀⠀⠀⠀⠀⠀⠀⠀⠀⠀⠀⠀⡈⠀⠀ ⠀⠀⠀⠀⠀⠀⢠⠃⠀⢸⣿⣿⡇⠀⠀⠀⠀⠀⠀⢀⠀⠀⠀⠀⠀⠀⡠⠁⠀⠀ ⠀⠀⠀⠀⠀⠀⢸⠀⠠⠈⠛⠋⠀⠀⠀⠐⠊⠩⠀⠀⠀⠀⠀⠀⠀⡈⠀⠀⠀⠀ ⠀⠀⠀⠀⠀⠀⠘⢄⠀⠀⢀⣠⣶⣄⠀⠀⠀⠀⠀⠀⠀⠀
1026,127.0,1900.0,7.0,r/marvelmemes,Just re-watching infinity war and endgame and found it weird that strange was asking Tony to take him back when he can just use a portal ? Am I the only one
1027,32.0,1700.0,11.0,r/PhoenixSC,title
1028,7.0,849.0,8.0,r/OkBrudiMongo,Guck mal das bist du
1029,13.0,1500.0,11.0,r/okmatewanker,And all the memes
1030,92.0,1400.0,8.0,r/wallstreetbets,Future is predetermined
1031,116.0,455.0,4.0,r/Music,The band that has brought me the most joy..... Sublime
1032,9.0,507.0,5.0,r/distressingmemes,"Guys, you see them too"
1033,42.0,2500.0,5.0,r/MadeMeSmile,Farley the door stopper dog!
1034,102.0,705.0,7.0,r/ForzaHorizon,Needless to say I was quite pissed off
1035,13.0,403.0,3.0,r/KitchenConfidential,"Not as good as some I've seen, but it's mine and I'm proud."
1038,24.0,713.0,5.0,r/Naruto,im gonna watch this again and again
1039,1100.0,15900.0,14.0,r/whenthe,They are scared of science
1040,84.0,3200.0,12.0,r/animegifs,Nami vs Robin
1042,180.0,778.0,5.0,r/ufc,😂😂😂
1043,25.0,1300.0,4.0,r/BlackPeopleTwitter,Just Do It
1044,9.0,569.0,5.0,r/cursed_videomemes,Cursed hanging
1045,27.0,1100.0,9.0,r/Autos,Ford Escort RS Cosworth
1046,8.0,507.0,5.0,r/LatinoPeopleTwitter,El Mariachi: No Way Home
1047,62.0,557.0,5.0,r/KingOfTheHill,"This episode, for me, will always be the pinnacle of Bobby's 'blunders' in the series."
1048,23.0,1200.0,10.0,r/dadswhodidnotwantpets,"“They’re okay, i just don’t like their tails” - my bf, who now gets offended if he doesn’t get cuddles or kisses from Mr Odie"
1049,46.0,727.0,7.0,r/CODZombies,I wish it would happen
1050,33.0,1700.0,11.0,r/ComedyCemetery,Get it? Because you don’t respawn when you die?? LOL #EPICGAMERMOMENT
1051,45.0,729.0,7.0,r/thatHappened,Teenage incel imagines what it's like to be around girls
1052,47.0,620.0,6.0,r/oculus,Literally any time I contact support for my device.
1053,16.0,707.0,5.0,r/HuskyTantrums,He hasn't had water in years!
1054,150.0,561.0,5.0,r/bisexual,Where's the Bi tops at here?
1055,20.0,524.0,5.0,r/ForgottenWeapons,Young Japanese women train with a domestically made Type 11 LMG in preparation for the American invasion of the home islands (which never happened). 1945
1056,110.0,522.0,3.0,r/IASIP,It's Always Sunny in Philadelphia was voted as r/television's #10 favorite show of all time!
1057,144.0,4300.0,11.0,r/Animemes,It is all coming together
1058,20.0,1200.0,6.0,r/IllegallySmolCats,Sabrina learning how to drink
1059,196.0,862.0,8.0,r/Anarcho_Capitalism,Obey
1060,81.0,1400.0,8.0,r/Grimdank,From the moment I understood the weakness of my flesh it disgusted me
1061,221.0,1300.0,10.0,r/DC_Cinematic,My interest in DCEU after reading the rumors
1063,5.0,535.0,5.0,r/firefly,2020 pt. 3
1064,43.0,12900.0,15.0,r/blessedimages,Blessed nyan cat
1065,53.0,438.0,4.0,r/DaniDev,I think I broke the MUCK chain. 😧
1066,328.0,516.0,5.0,r/PersonalFinanceCanada,Landlord wants to raise my rent.
1067,179.0,6400.0,18.0,r/AmateurRoomPorn,"A before and after ft. A poor man's backsplash - done while being stuck at home. Detroit, MI"
1068,35.0,525.0,3.0,r/deadbydaylight,“BlOoDpOiNtS ArE CaPpeD So ThAt YoU DoN't EnD uP hOaRdinG PoiNtS Or PuT OtHerS aT a DiSaDvAnTaGe” ( Behaviour Interactive )
1069,23.0,1500.0,7.0,r/AbruptChaos,Magic Butterfly flying Card Toy
1070,6.0,846.0,8.0,r/Apandah,but why
1071,33.0,649.0,8.0,r/LateStageCapitalism,Elon Musk gets destroyed by facts and logic
1073,490.0,452.0,2.0,r/pokemon,What would you do if you owned your favourite Pokémon in real life and you had a very strong bond with them.
1074,24.0,475.0,5.0,r/PirateKitties,"My pirate son all dolled up for Christmas, looking extremely proper."
1075,11.0,733.0,7.0,r/gay,Definitely using this for a DnD campaign 🤣
1076,64.0,778.0,7.0,r/HuntShowdown,Reviving is sexy
1077,318.0,3400.0,15.0,r/Marvel,what was he cooking
1079,139.0,2300.0,13.0,r/awesome,The Perfect Peel
1080,8.0,542.0,5.0,r/tacticalgear,"""Industrial strength NVG"""
1081,37.0,2800.0,14.0,r/forbiddensnacks,Forbidden chocolate powder ice cream
1082,67.0,946.0,7.0,r/EngineeringPorn,"ThyssenKrupp elevators test tower in Guangzhou, China"
1083,68.0,316.0,2.0,r/FundieSnarkUncensored,Bethany's marriage is falling apart: an essay
1084,2.0,420.0,4.0,r/MyPeopleNeedMe,My Truck People Need Me
1085,66.0,662.0,7.0,r/Bitcoin,A Message From Hal Finney's Wife
1086,38.0,477.0,5.0,r/Vermintide,[GIF] Rayla - Kerillian by spaceMAXmarine
1087,40.0,781.0,7.0,r/sololeveling,A must read for solo levelling fans
1088,112.0,770.0,6.0,r/AnimalCrossing,"Didn't feel like kicking out anyone for Graham, but he's so adorable especially once you know how his eyes look like! 🥺 Do you have him?"
1090,199.0,2000.0,12.0,r/tommyinnit,"POV: you’re out on the streets, suddenly you see this dude running towards you. What do you do?"
1091,43.0,837.0,8.0,r/languagelearning,Evolution of The Alphabet
1092,89.0,1300.0,7.0,r/amcstock,A reminder :)
1093,67.0,569.0,6.0,r/SuccessionTV,Eminem who?
1094,42.0,320.0,3.0,r/ReadyOrNotGame,I'd like to seriously thank Void for their support.
1095,36.0,349.0,3.0,r/NoMansSkyTheGame,"Umm... Excuse me, sir? I believe you took a wrong turn."
1096,75.0,1300.0,10.0,r/imaginarymaps,Come visit Germany! A tourist's infographic map of the German Empire from 1935.
1098,143.0,9800.0,20.0,r/StarWars,Levitating Millennium Falcon model I built after a depressing hiatus of not really building anything. I resolve to build more cool stuff this year.
1099,21.0,717.0,7.0,r/Gunners,With saka being 20yo there’s a chance we could see these situations occur for another 10 years. Robben regen.
1100,3.0,348.0,3.0,r/gamegrumps,A nice challenge guaranteed to make you laugh enough for the entire day.
1101,59.0,1400.0,11.0,r/functionalprint,PUMA - the World's First Open Source 3D Printed Microscope with an Augmented Reality Heads Up Display
1102,31.0,569.0,6.0,r/pics,Comfort town a suburb of Kiev was created to brighten up former grey Soviet buildings
1104,52.0,888.0,8.0,r/Design,I created and prototyped a cardboard chair within one week
1105,173.0,2900.0,15.0,r/BuyItForLife,"My mom got me like, 30 of these restaurant grade glasses for Christmas. I don’t think I’ll ever need new ones."
1106,76.0,1100.0,9.0,r/BritishSuccess,"After years of playing the lottery via direct debit, the big email arrived - £30 win 💥"
1108,5.0,1800.0,12.0,r/pyrocynical,Pyro likes the methe
1109,7.0,514.0,5.0,r/antinatalism,Therapy or Children?
1110,28.0,621.0,6.0,r/wikipedia,"In Islamic tradition, cats are admired for their cleanliness. They are thought to be ritually clean, and are thus allowed to enter homes and even mosques, including Masjid al-Haram."
1111,9.0,866.0,8.0,r/Bondedpairs,we call these two “the husbands”
1112,11.0,464.0,5.0,r/fucktheccp,2 years anniversary for the CCP propaganda that killed millions of people worldwide.
1113,210.0,1400.0,11.0,r/OutOfTheLoop,What is the deal with people on Twitter going crazy about tungsten cubes?
1114,31.0,420.0,4.0,r/labrats,I left my postdoc this year for a job in academic administration. My wife got me this for Christmas.
1115,65.0,540.0,6.0,r/entitledparents,Entitled grandmother demands that I should give my 'uncle' my Xmas money because I got more than him
1116,143.0,493.0,5.0,r/NFA,Press F to pay respects
1117,8.0,464.0,5.0,r/RWBY,The Schnee sisters (ar_jart)
1118,11.0,363.0,3.0,r/sphynx,Ick pushed his tent up against the heater. No one has been allowed entry since.
1120,13.0,566.0,6.0,r/Morrowind,Morrostonks
1121,118.0,643.0,4.0,r/Battlefield,What even is a true Battlefield at this point...
1122,49.0,1900.0,10.0,r/TheRightCantMeme,100s of years later and these same talking points are still used
1123,13.0,580.0,6.0,r/Chihuahua,This is Diesel! Our new pup and best friend to my family’s Boston terrier
1124,36.0,547.0,6.0,r/SpaceXMasterrace,B O O S T E R R E C O V E R Y
1125,11.0,459.0,5.0,r/forza,The strongest Audi of all time ?
1126,478.0,1100.0,7.0,r/canada,One arrested and 57 ticketed for protesting Quebec's curfew
1127,855.0,33800.0,21.0,r/sadcringe,He’ll never show his face in that place again.
1128,42.0,1200.0,10.0,r/Seaofthieves,The instant I equipped that cutlass I knew I had to do this.
1130,59.0,552.0,6.0,r/BatmanArkham,Let's all admit....this was the best sequence in Arkham Knight.
1131,37.0,632.0,6.0,r/DBZDokkanBattle,"found these guys while farming prime battles, could they be Dev accounts? never seen and ID so low"
1132,4.0,472.0,5.0,r/HongKong,The Red Sea
1133,23.0,1000.0,9.0,r/Portal,fav song ngl
1134,70.0,999.0,5.0,r/nba,Kyle Kuzma on DeMar DeRozan answering his clutch 3 with a game-winner: “Brad hit me on a play and then… Shit happens. DeMar told me to hold my beer.”
1135,77.0,7900.0,7.0,r/memes,Sir Scooby-Doo wise words
1136,75.0,14700.0,18.0,r/shittymoviedetails,"In Avatar (2009), not only are the aliens from Pandora blue, but all the humans and objects are also blue because I need to fix the RGB settings on my TV."
1137,1000.0,26100.0,14.0,r/meme,The three Holy Zones
1138,9.0,451.0,5.0,r/thumbcats,Extra grippy power
1139,347.0,4500.0,16.0,r/notinteresting,If you look really hard at this photo you can notice there is a dog in the center of it
1140,20.0,409.0,4.0,r/baseball,View of Ebbets Field from nearby rooftop
1141,30.0,464.0,5.0,r/texas,105°F range in temperature yesterday in Texas
1142,38.0,3200.0,13.0,r/CozyPlaces,Finally settled into our new apartment
1143,59.0,536.0,6.0,r/BlackPink,220103 Happy Birthday Jisoo!
1144,14.0,619.0,6.0,r/Philza,I saw some stupid hardcore deaths lately. So I thought I would share my dumbest one
1145,11.0,734.0,7.0,r/Augenbleiche,Schmeckt gut
1147,17.0,1100.0,10.0,r/babyelephantgifs,Cute baby elephant's first steps and steps on his trunk
1148,37.0,719.0,7.0,r/vinyl,A good day to stay inside
1150,27.0,933.0,21.0,r/What,"Beautiful :,)"
1151,38.0,877.0,6.0,r/blackcats,Tub Time!! Rocky loves playing in the water. Anyone else’s cats do this?
