Unnamed: 0,comment_count,upvote_delta,timeup_list,subreddit,thread_text
959,175.0,1200.0,10.0,r/australia,Australia is the hottest place in the world right now and I’m definitely feeling it
960,45.0,10100.0,19.0,r/AvatarMemes,Until next November 1st
961,28.0,372.0,4.0,r/DestinyFashion,"""Chroma Fang' I think I have found a very unique look for my hunter, what do you guys think ? appreciate any feedback !"
962,222.0,12100.0,20.0,r/toptalent,"After 2 years and over 750 working hours, my dad finally finished building his fireplace"
963,34.0,298.0,2.0,r/Argaming,+10 de carisma
964,66.0,1200.0,5.0,r/oddlyterrifying,"New fear unlocked, the bone and skin man"
965,68.0,604.0,6.0,r/WeWantPlates,Didnt think they’d serve my steak INSIDE my drink. New York Strip in a Manhattan lol.
966,44.0,1100.0,10.0,r/okbuddyhetero,Like bruh 💀💀💀
967,10.0,356.0,3.0,r/superpoweralchemists,Knowing everything about 3 year olds
968,179.0,514.0,5.0,r/canada,"Canadians eager to be nurses facing tougher entry requirements, fewer training spots"
969,21.0,982.0,6.0,r/egg_irl,egg😍irl
970,108.0,324.0,3.0,r/PersonalFinanceCanada,Do not use KOHO
971,11.0,337.0,3.0,r/CoolGadgetsTube,Open / Closed 3D Prints
972,31.0,917.0,3.0,r/dndmemes,Am I too much of a lore nerd?
973,180.0,1000.0,9.0,r/memesITA,Girartelo fino alla fine (collaborazione con u/NapoleoneBonoacarte u/donix_d_nator u/wjdbfifj e u/itsfrank25
974,56.0,7600.0,13.0,r/PrequelMemes,I've been looking forward to this
975,50.0,1400.0,5.0,r/gaming,R6 do be strange sometimes doe
976,4.0,657.0,7.0,r/ImaginaryMonsters,God by Me
977,170.0,476.0,5.0,r/boxoffice,All 48 Billion Dollar Films
978,14.0,684.0,7.0,r/SandersForPresident,This pandemic makes it clear how dysfunctional our healthcare system is. Let us not give up the struggle for Medicare for All.
979,19.0,515.0,6.0,r/RDR2,"The realism is stunning, found his teeth and my bullet in this point blank E-Round execution."
980,14.0,887.0,9.0,r/HuTao_Mains,I'm a little late to the party but Merry Christmas! 🎄Hutao fanart by me~
981,26.0,1600.0,3.0,r/Hololive,"No memes. Just Haachama appreciation posting. KEEP WORKING HARD, STRONGEST IDOL!"
982,758.0,5400.0,17.0,r/RedDeadOnline,do you like my character?
983,37.0,424.0,5.0,r/SonicTheHedgehog,Amy Rose by @PyonSukis
984,6.0,410.0,5.0,r/ACAB,Wee Woo pt 2
987,5.0,734.0,8.0,r/pisscommenting,Beat it chick!
988,99.0,381.0,4.0,r/BravoRealHousewives,"The top result, wow"
989,12.0,454.0,5.0,r/EpicSeven,Yufine [art by げげ_gae'gae]
991,15.0,370.0,4.0,r/nostalgia,Rugrats watches
992,144.0,796.0,5.0,r/unpopularopinion,"""Home made"" doesn't mean ""good"" and it's extremely overrated"
993,39.0,630.0,4.0,r/niceguys,I’m glad he made all his red flags loud and clear
994,12.0,940.0,6.0,r/SweatyPalms,jumping into the water like this
995,172.0,363.0,4.0,r/germany,How do you feel? There are more and more more atheists?
996,186.0,5600.0,180.0,r/DocumentedFights,HMFT after I try to attack someone whose filming me
999,148.0,802.0,8.0,r/IllegalLifeProTips,ILPT: Quickly disable FaceID on iPhone in case the police gets your phone
1000,16.0,863.0,6.0,r/MovieDetails,"In Ratatouille (2007), the restaurant has ""Nemo"" brand caviar, a reference to Finding Nemo (2003)."
1001,9.0,442.0,5.0,r/analog,Boardwalk [Minolta SRT-101 | 50mm f/1.4 | Kodak Portra 400]
1002,44.0,570.0,6.0,r/EliteDangerous,The more you look the weirder it gets
1003,15.0,339.0,7.0,r/MadeMeSmile,Tippy taps for his gift! 🎄
1005,16.0,2100.0,11.0,r/BikiniBottomTwitter,Just adult things
1006,4.0,373.0,4.0,r/ImaginaryBehemoths,Grimdancer by Randy Vargas
1007,41.0,898.0,3.0,r/BlackPeopleTwitter,A romantic WWE Mixed Tag Team Match for four.
1008,15.0,374.0,4.0,r/guineapigs,Now this is how Mondays should be handled!
1009,45.0,724.0,8.0,r/SatisfactoryGame,Q: How big a rail network should we build? A: Yes!
1010,27.0,902.0,9.0,r/howtonotgiveafuck,“I will not give a fuck”
1011,16.0,356.0,4.0,r/horizon,Rare view of two Behemoths mating
1012,6.0,400.0,4.0,r/PandR,Sister in law came through with the greatest Xmas present!
1013,26.0,847.0,3.0,r/TheLastAirbender,Real Life Bending
1014,14.0,1500.0,12.0,r/MadeMeSmile,Being pulled over
1016,14.0,818.0,8.0,r/MilitaryPorn,Croatian soldiers going home from frontlines in Croatia summer 1991. [1080 x 719]
1017,417.0,330.0,3.0,r/Libertarian,"For those of you thinking about moving to Florida because it the ""free-est state in the US"" remember these points."
1018,240.0,14400.0,21.0,r/Astronomy,The James Webb. From my observatory.
1019,7.0,598.0,7.0,r/ImaginaryLandscapes,Distant Hills
1020,17.0,378.0,4.0,r/americandad,At Disney today. Immediately thought of this.
1021,53.0,1100.0,7.0,r/lgbt,I guess I’m gay now
1022,47.0,330.0,3.0,r/retrogaming,Did you guys notice George Costanza owned a Virtual Boy?
1023,32.0,347.0,4.0,r/LegendsOfRuneterra,"It's one damage, Michael. How much could it cost? 7 mana?"
1024,103.0,999.0,10.0,r/2visegrad4you,I hate their nat***alists🤢. Our Nationalists are the best!!! 💪💪💪
1025,17.0,375.0,4.0,r/splatoon,Discount Splatoon
1027,6.0,969.0,9.0,r/PunPatrol,Sorry not sorry
1028,17.0,352.0,4.0,r/feemagers,Guys am I dreaming?? The jeans I got for Christmas have pockets deep enough to actually fit stuff??
1029,3.0,338.0,4.0,r/dank_meme,Any Numbers? ;-)
1031,123.0,291.0,3.0,r/greece,Έπεσα θύμα βίαιης ομοφοβικής επίθεσης από προσωπικό νυχτερινού κέντρου. Η αστυνομία δεν έκανε απολύτως τίποτα. Τι μπορώ να κάνω?
1032,20.0,408.0,5.0,r/ElderScrolls,The church in my hometown looks a little like the chapels in Cyrodiil
1033,23.0,1500.0,4.0,r/WhitePeopleTwitter,More of a pie man myself
1034,23.0,556.0,6.0,r/MineralPorn,Gorgeous Top Quality Dark Body Opal Cabochons Natural ! Cabochons I Made Recently 🔥💕
1035,13.0,371.0,4.0,r/NewGreentexts,Mother's Milk
