Unnamed: 0,comment_count,upvote_delta,timeup_list,subreddit,thread_text
279,106.0,5200.0,15.0,r/ufc,WCGW diving head first into a frozen river
281,140.0,1400.0,11.0,r/sweden,Kristina skippar mellandagsrean
282,185.0,1900.0,6.0,r/Eldenring,Collection of all default character faces in the CNT
283,174.0,1700.0,4.0,r/MarchAgainstNazis,Look at what my parents got for me for Christmas… without me asking of course.
284,102.0,4300.0,14.0,r/dankruto,space time ninjutsu would be a faster option smh
285,310.0,7100.0,6.0,r/memes,Feet fetish is one of the most normal fetishes
286,38.0,1800.0,3.0,r/Art,"Marie Antoinette Strip Tease, Thierry Bruet, Oil on canvas, 2010"
287,198.0,1000.0,6.0,r/SquaredCircle,"A move you'll never see in the WWE, Seth Rollins 'Rubix Cube'"
288,188.0,1400.0,7.0,r/battlefield2042,Specialists ranked by how cheesy their voice lines are
289,145.0,22500.0,16.0,r/perfectlycutscreams,Aaa-
290,47.0,1600.0,2.0,r/WhatsWrongWithYourDog,"Never seen a doggo sit like this before but I must say, I’m happy I did!"
291,191.0,2200.0,5.0,r/philosophy,"Societies choose to make evil look sexy to distract us from real evil – called ‘banal’ evil by Hannah Arendt. Real evil is done quietly and without intention, like climate change."
292,56.0,2500.0,5.0,r/marvelstudios,The greatest scene in NWH (fan art)
293,64.0,2300.0,13.0,r/JustGuysBeingDudes,Filming his boy getting berated
294,178.0,15100.0,15.0,r/rareinsults,Strawberry Shortcake Extra
295,113.0,4300.0,15.0,r/Rainbow6,Who's the artist of this Jack O Pose Nøkk? (Not my content)
296,58.0,4100.0,7.0,r/titanfall,hey who is that guy?
297,137.0,5100.0,15.0,r/adhdmeme,"Not Schizophrenia, ADHD"
298,133.0,2200.0,10.0,r/HistoryPorn,"Mohamed Reza Pahlavi and his wife Farah Pahlavi, upon his coronation as the Shâhanshâh of Imperial (Pahlavi) Iran, and his wife was crowned as the Shahbanu, on October 26th, 1967, in the Imperial State of Iran. [417 x 590]"
299,68.0,5400.0,9.0,r/WhatsWrongWithYourCat,My cat brings random items he finds in the attic :)
300,100.0,1200.0,4.0,r/techsupportgore,I thought I had a tiktok addiction... poor s9 :(
301,41.0,2200.0,4.0,r/Terraria,Late Merry Xmas from the nurse =w=
302,170.0,2800.0,6.0,r/Coronavirus,'We just do not have enough players': More bowl games canceled as COVID cases surge
303,137.0,10400.0,9.0,r/StarWars,Nailed it!
304,44.0,2200.0,5.0,r/AbruptChaos,Tractor has a mind of its own
305,194.0,17600.0,14.0,r/rarepuppers,Good boy knows today is HIS day!
306,97.0,2400.0,5.0,r/ich_iel,ich🏴󠁧󠁢󠁥󠁮󠁧󠁿iel
307,66.0,1800.0,3.0,r/Tinder,This could be me
308,76.0,3700.0,15.0,r/baseball,I think this is one of the greatest ugly sweater I’ve ever got!!
311,41.0,2800.0,6.0,r/BeAmazed,drawing a nose
312,475.0,3700.0,4.0,r/shitposting,IT'S ABOUT TO GO DOWN
313,259.0,7400.0,7.0,r/dankmemes,Come here
314,29.0,5700.0,9.0,r/suicidebywords,...
315,76.0,2100.0,4.0,r/MapPorn,A Very detailed Blank Map Resource for editing
316,76.0,3200.0,10.0,r/vexillology,Flag of Japan in the style of Saudi Arabia (Text says Long live Japan / Nippon Banzai. Gun is an Arisaka Type 99)
317,31.0,2600.0,4.0,r/Hololive,Haachama is celebrating Cocos 2nd anniversary with emotional karaoke right now 😢
318,104.0,9900.0,17.0,r/WitchesVsPatriarchy,Feminist saint 🙏🏻
319,751.0,2700.0,3.0,r/pics,This is what you can find in a local gun store from Texas
320,79.0,876.0,17.0,r/funny,Is he… you know…
322,69.0,1100.0,6.0,r/Bad_Cop_No_Donut,Copaganda in the wholesome subreddits
323,275.0,681.0,5.0,r/FridayNightFunkin,Bnb has officially been trashed
324,98.0,1700.0,5.0,r/Rabbits,I spotted this bunny. Is he domestic or wild?
325,89.0,8800.0,11.0,r/CrappyDesign,Not the best brand name for a wheel chair
328,248.0,3300.0,7.0,r/fakehistoryporn,The Cold War map of the world 1985.
329,204.0,11500.0,12.0,r/TikTokCringe,Gingerbread house by an architect
330,148.0,595.0,3.0,r/FantasyPL,FPL Crashes one min before the transfer deadline. Compilation video of live reactions as they happened.
331,33.0,2400.0,6.0,r/spaceporn,A Juno picture of the rings of Jupiter from the inside.
332,145.0,5500.0,5.0,r/MadeMeSmile,Aggressive generosity
333,78.0,5300.0,9.0,r/engrish,It is forbidden to dog
335,174.0,22700.0,17.0,r/dogswithjobs,My service dog recently learned a new task!
336,74.0,4600.0,9.0,r/anime_irl,anime_irl
337,173.0,1800.0,4.0,r/iamatotalpieceofshit,Posse of Grown Adults Relentlessly Bullying Strangers During the Holidays.
338,83.0,1400.0,8.0,r/ENLIGHTENEDCENTRISM,Liberal rehabilitation of Trump is already starting
339,272.0,13000.0,9.0,r/politics,"Conservative dark-money group bankrolled almost every major Republican effort in Colorado last year, tax docs show"
340,72.0,815.0,2.0,r/Kanye,man
341,139.0,5400.0,11.0,r/dankvideos,Minors 😳
342,84.0,2300.0,9.0,r/ArtefactPorn,"The death mask of Agnes Sorel, famous “Dame de beauté” and mistress of King Charles VII of France compared to the Fouquet painting of her - 1450 [1758x784]"
343,271.0,2800.0,7.0,r/Damnthatsinteresting,this man has an extra functioning finger
344,183.0,6300.0,16.0,r/MakeMeSuffer,"I posted a burn on my hand just recently. I have another burn from a radiator cap unthreading on a HWY. I DO know better to mess with a radiator when it’s boiling and over heated, but it unthreaded, It sounds like a loud zip noise and is scary. I got out of the way and avoided traffic just in time."
345,208.0,2000.0,6.0,r/amcstock,"This is why I HODL! My baby has already had 3 open hear surgeries, doctors paralyzed his vocal chords which caused him a tracheotomy. Rebuilt his airway and now he can breathe but will never be able to speak.."
346,107.0,4600.0,23.0,r/youseeingthisshit,HMC while I kick a bottle cap off the Liquor I just bought
348,110.0,2300.0,10.0,r/DeepRockGalactic,DRG in a nutshell
349,138.0,5600.0,17.0,r/antiassholedesign,Instead of listing games on sale for 34.99$ like most stores would. GameStop lists them for 35.01$ so they are eligible for free shipping.
350,135.0,8500.0,15.0,r/yesyesyesno,yes yes yes no
351,72.0,1100.0,7.0,r/Gunners,Martin Ødegaard's 3 goals and 3 assists in December
352,387.0,3200.0,7.0,r/teenagers,How to deal with a creep 101
353,181.0,3200.0,13.0,r/BisexualTeens,"Oh, I know you do"
354,51.0,2100.0,5.0,r/gifsthatkeepongiving,Making an ice bar
355,230.0,4500.0,6.0,r/Superstonk,Thought this comment deserved its own post. 'How do you deal with that?'
356,64.0,1500.0,3.0,r/halo,"I’ve never been great with the sniper, so this is my crowning achievement"
357,81.0,3800.0,16.0,r/reactiongifs,MRW my mom’s new boyfriend gets me a Victoria Secret gift card for Christmas
358,106.0,4900.0,10.0,r/gatekeeping,"Gatekeeping having fun with your children. (Crosspost, but had to cross out the names)"
359,155.0,3200.0,3.0,r/nextfuckinglevel,This guy found some ancient dna inside himself
361,66.0,744.0,5.0,r/averageredditor,Average groomers
362,143.0,9700.0,7.0,r/interestingasfuck,Real-time geomorphology
363,105.0,925.0,7.0,r/hockey,"There are currently 146 open rinks or ice tracks free to use in Tampere, Finland all within 10 km radius."
364,129.0,1300.0,5.0,r/Warframe,"""Let's say we shake on it!"""
365,101.0,4600.0,10.0,r/ThatsInsane,Why was this abandoned
368,70.0,2400.0,6.0,r/formuladank,Is this a joke?
369,77.0,1500.0,10.0,r/GreenAndPleasant,Tory MP who voted against free school meals and in favour of benefit cuts has the nerve to use a food bank for self-promotion
370,81.0,2200.0,11.0,r/polandball,Türkiye
372,89.0,1500.0,4.0,r/lotrmemes,Hey do! Merry do!
373,154.0,1400.0,10.0,r/mapporncirclejerk,Mamma Mia!
374,35.0,1200.0,2.0,r/quityourbullshit,OP goes on r/povertyfinance to claim he saved up nearly 100k in 3 years by budgeting with Mint. Quickly has to backtrack when called out. Suddenly it takes more than budgeting to save so much.
375,132.0,1300.0,3.0,r/pitbulls,Y’all keeping bullying my fat girl so here are pics where you can tell she isn’t morbidly obese.
376,132.0,923.0,8.0,r/Bitcoin,"I was this high on mushrooms 5 years ago when I finally understood Bitcoin and decided to make it my savings account, changing my life forever. Thank you Bitcoin"
377,35.0,4600.0,7.0,r/oddlysatisfying,This bouncing ball animation
378,24.0,1700.0,4.0,r/Breath_of_the_Wild,"One year later - this is Franks daughter, Daisy."
379,117.0,2900.0,11.0,r/Showerthoughts,"Your brain is the only organ that can’t be transplanted. If you got a brain transplant, you wouldn’t wake up with a new brain. You would wake up with a new body."
380,6.0,2200.0,6.0,r/wholesomegreentext,Wholesome grandpa/grandson
383,33.0,2100.0,6.0,r/ihadastroke,Me when when eating I'm happy: cheese:
384,162.0,1200.0,3.0,r/legendofkorra,My attempt at the worst LoK live action casting
385,69.0,2400.0,13.0,r/Witcher3,Best detail in the game
386,240.0,929.0,4.0,r/SHIBArmy,Who is still holding strong?! 🎁🎁🎁
387,77.0,3200.0,15.0,r/Perfectfit,Apple Air Tags to my butt plug (NSFW?)
388,282.0,5900.0,6.0,r/funny,Rise in complaints
389,58.0,2100.0,6.0,r/Grimdank,The unimaginable has happened
390,98.0,848.0,5.0,r/Warhammer40k,Hopefully this clears up some confusion.
392,100.0,446.0,3.0,r/DBZDokkanBattle,SUPER STRIKE EVENTS are getting updated!
393,27.0,1700.0,4.0,r/apexlegends,Whenever I see a Mirage decoy
394,101.0,1000.0,7.0,r/walkaway,Funny how people forgot about this footage after Biden won isn't?
395,94.0,4000.0,9.0,r/LeagueOfMemes,This is what I think about Yuumi
396,31.0,2500.0,7.0,r/Konosuba,Picked up Megumin's China Dress version today!
397,14.0,1300.0,3.0,r/blessedimages,Blessed Cloudy Day
398,113.0,387.0,3.0,r/ageofsigmar,Fury of the Deep battle box revealed! Idoneth Deepkin vs Fyreslayers
399,58.0,3000.0,11.0,r/HollowKnightMemes,Literally 30 minutes ago
400,108.0,556.0,2.0,r/trashy,I feel sorry for everyone who had to encounter them
401,104.0,812.0,4.0,r/EverythingScience,"One-Third Of Programmers Use Marijuana While Working, With Many Touting Creative Benefits, Study Finds"
402,54.0,2600.0,10.0,r/NewVegasMemes,Terrifying Presence > Other Perks
403,60.0,1400.0,7.0,r/CapitolConsequences,Capitol panel to investigate Trump call to Willard hotel in hours before attack
404,21.0,1400.0,4.0,r/CatsAreAssholes,Charo recreating that one scene from Scarface
405,35.0,3400.0,24.0,r/CountOnceADay,bi_irl
407,21.0,3000.0,7.0,r/PewdiepieSubmissions,Pewds be like
408,122.0,2500.0,13.0,r/DIY,"I made a jewlery box with a hidden compartment that can only be opened with a powerful magnet, inside there are gears that can only be turned with a special key, the iris mechanism turns and presents a ring and also plays music from the light activated diode."
409,99.0,443.0,2.0,r/discordapp,"Oh boy, gotta make sure everyone is aware"
410,76.0,5300.0,10.0,r/suspiciouslyspecific,"ah yes, we all had that friend... right...?"
411,35.0,1500.0,4.0,r/harrypotter,Harry Potter and the Prisoner of Candyland
412,82.0,2500.0,20.0,r/AbruptChaos,16-car pileup
414,35.0,1700.0,4.0,r/meirl,meirl
415,91.0,2300.0,7.0,r/carporn,Toyota Yaris GR [1080x1080]
416,61.0,3100.0,12.0,r/CuratedTumblr,In case anyone's wondering I'm not a bot I'm just bored and there's a lot of content to post
417,48.0,1600.0,4.0,r/deadbydaylight,I just wanna be sure if he’s coming towards me
418,54.0,2500.0,10.0,r/TankPorn,German Tpz Fuchs
419,94.0,760.0,7.0,r/guitarcirclejerk,Thought it was posted in this sub lmao
420,35.0,1600.0,7.0,r/okbuddybaka,🐿️
421,41.0,3100.0,8.0,r/ShitPostCrusaders,"They know, they now"
422,97.0,1700.0,6.0,r/tooktoomuch,How goods cricket
423,7.0,1400.0,4.0,r/MemeEconomy,Gotta keep buying SHIB
424,68.0,1800.0,5.0,r/PrequelMemes,Virgin L3-37 vs Chad K-2SO
425,96.0,826.0,5.0,r/aaaaaaacccccccce,*hides in corner just trying to help invade Denmark*
426,83.0,11200.0,17.0,r/hmmm,hmmm
427,959.0,4400.0,7.0,r/Cringetopia,God protects me from such atrocities😌🙏
428,105.0,4300.0,10.0,r/SCP,scp 055
429,85.0,1500.0,6.0,r/religiousfruitcake,Oh brother.
430,62.0,2500.0,13.0,r/ClashOfClans,Relatable
431,39.0,2100.0,6.0,r/FUCKYOUINPARTICULAR,Fuck you Andrew
432,64.0,2900.0,10.0,r/egg_irl,egg_irl
433,46.0,1500.0,5.0,r/BokuNoMetaAcademia,Try what..? (official volume extra page)
434,117.0,799.0,6.0,r/stopdrinking,Can everyone who made it through Christmas alcohol free give yourself a high five?
435,62.0,1600.0,4.0,r/AbruptChaos,Who will pay for that
436,106.0,3300.0,9.0,r/SweatyPalms,"The path to Harihar Fort, Maharashtra India."
437,151.0,1100.0,7.0,r/3Dprinting,New Customizable Snap-Together Raspberry Pi Case 2/3/4
438,71.0,2000.0,11.0,r/csgo,Wait... i remember this place
439,145.0,496.0,4.0,r/AskOuija,"Without saying “Your Mom,” who has the hottest pussy?"
440,145.0,595.0,3.0,r/HelluvaBoss,Quote youre favourite character and let others guess who it is.
441,21.0,3200.0,5.0,r/blursedimages,Blursed friendzone
442,69.0,973.0,6.0,r/RimWorld,"Oh no... Randy, you psychopath! What do I do?"
443,50.0,1600.0,7.0,r/comics,I don't want to hear
444,60.0,1800.0,10.0,r/terriblefacebookmemes,From the generation that needed educational videos telling them not to hide in a fridge.
445,70.0,539.0,24.0,r/justneckbeardthings,"Weeb really wants all ""foreigners"" to be expelled from Japan"
447,64.0,1100.0,7.0,r/Philippines,Burn!!!
448,79.0,1600.0,6.0,r/HighQualityGifs,When I found out what it took to take the red pill
449,78.0,3800.0,13.0,r/animememes,So True 😂
450,188.0,5800.0,9.0,r/gaming,Oh Nintendo... You really have no clue what your audience wants
451,195.0,891.0,6.0,r/trans,What name do I look like?/ what do you think my name is?
452,120.0,14200.0,15.0,r/tattoos,"Geometric and pattern bands done by Elizabeth at Noir Tattoo in Shanghai, China"
453,24.0,2400.0,8.0,r/evangelionmemes,"""Fix Shinji's back, Asuka. Or Rei will have to do it instead."""
454,49.0,2600.0,7.0,r/youseeingthisshit,confused monkey
455,28.0,1800.0,9.0,r/AnarchyChess,Now the camera moves where Hikaru looks. Anti-cheating at its best.
456,174.0,4200.0,7.0,r/Minecraft,What did I do to deserve this?
457,47.0,4400.0,15.0,r/pyrocynical,Pie row
458,65.0,1000.0,6.0,r/forwardsfromgrandma,Can all the people who compare covid-related things to Nazi Germany just go fuck off
459,38.0,1600.0,10.0,r/soccercirclejerk,stats nonce
460,83.0,4400.0,10.0,r/gravityfalls,Shmebulock - Toothpaste 🪥🌈👀
461,121.0,4200.0,6.0,r/antiwork,Fuck the 40 hour work week.
462,66.0,1300.0,8.0,r/Sekiro,Skipping all of Fountainhead Palace with 2 simple items
463,67.0,890.0,6.0,r/Patriots,It never worked out.
464,73.0,2200.0,9.0,r/travel,"Michelangelo's David is great, but pieta is on whole another level with the details imo. Saw both last week and i couldn't stop admiring it"
465,56.0,5000.0,13.0,r/dogelore,Day Twenty Six of Destroy your Dick December Has Arrived.
466,24.0,1700.0,5.0,r/SupermodelCats,I swear Mochi poses when I point my phone in her direction
467,79.0,900.0,4.0,r/SaimanSays,Dislike button wapas laao mitron
468,65.0,1100.0,6.0,r/mathmemes,Which type of student are you ?
469,32.0,1300.0,4.0,r/videos,"A taxi driver's car catches on fire, so strangers stop by and start collecting donations for him. He made more than the car's worth in donations by the end of the day."
470,80.0,2700.0,11.0,r/notliketheothergirls,So special
471,35.0,1300.0,4.0,r/goldenretrievers,"Got hit by a car and have no injuries, only tiny lung bruises. Meanwhile car’s bumper is damaged pretty bad. Recovering from all the meds and the shock now! Lucky boi!"
472,391.0,5000.0,8.0,r/oddlyterrifying,'Surgically' Removing an iron rod used for healing a leg fracture
475,72.0,1400.0,3.0,r/CryptoMoonShots,🌟 FCF (French Connection Finance) 🌟| NASDAQ partnership contract received ! ✅ | Listed on 4 exchanges! Gate.io next🚀| Crypto Payment Gateway for Shopify & WooCommerce 🛍| Biggest crypto use case on BSC⚡️ | Passive Income paid in BNB daily! ✨ | Innovative KYC/Doxxed Team
476,44.0,1200.0,8.0,r/GaySoundsShitposts,Well if you insist
477,39.0,389.0,3.0,r/boardgames,"I'd find interesting a ""minimum table surface"" and ""recommended table surface"" on BGG pages"
478,47.0,1900.0,6.0,r/sewing,Saw this and it made me laugh and think of this sub
479,16.0,1800.0,6.0,r/RoomPorn,"Small guesthouse in the garden, South Pasadena, Los Angeles County, California [1080x1350]"
480,31.0,2300.0,7.0,r/CozyPlaces,Christmas morning at my parents’ house
481,5.0,984.0,3.0,r/KamikazeByWords,This is the “long story”
482,47.0,1500.0,7.0,r/FloridaMan,"Florida Man wears 'Fuck the Police' t-shirt to court, wins case against police"
483,68.0,4500.0,12.0,r/softwaregore,hehe baby go brrrrrrrr
484,76.0,3000.0,9.0,r/itookapicture,ITAP of a girl on a beach [MLM]
485,65.0,1000.0,5.0,r/blackcats,Do you ever wonder what your cat’s parents look like/if they’re black also?
486,66.0,2600.0,10.0,r/houseplants,Pest identification?
487,66.0,5700.0,17.0,r/OldPhotosInRealLife,Unknowingly captured the same image in 2020 that my dad took on vacation back in 1965 - Shenandoah NP
488,216.0,5100.0,9.0,r/PublicFreakout,That's some National Geographc S*%t
489,40.0,566.0,6.0,r/NobodyAsked,Just...why?
490,72.0,1100.0,21.0,r/interestingasfuck,We dead.
492,23.0,899.0,7.0,r/hoi4,Is This Rare ?
493,79.0,1300.0,4.0,r/gadgets,A 62-Year-Old Paralyzed Man Sent Out His First Tweet With Brain Chip | Without the need for keystrokes.
494,15.0,1300.0,4.0,r/WitchesVsPatriarchy,May your soul be overgrown with moss 🌿
495,55.0,946.0,5.0,r/LiverpoolFC,"[Liverpool FC] Thiago Alcantara, Fabinho, Curtis Jones and Virgil van Dijk are set to be available for our clash with Leicester."
496,87.0,2000.0,9.0,r/PhoenixSC,After seeing the monster school video screenshot on the last video of PhoenixSC that reminded me. What happened to the original monster school ???!
497,54.0,5100.0,15.0,r/OneSecondBeforeDisast,Hiding from the cat
498,42.0,916.0,6.0,r/BritishSuccess,Neighbours got the Christmas they deserved!
499,67.0,1100.0,6.0,r/brasil,Como burlar a lei bíblica
500,15.0,1200.0,2.0,r/AdviceAnimals,Every single year.
501,48.0,632.0,5.0,r/OMORI,"I just had an AU idea where Sunny suddenly starts speaking spanish after 'that' night, so i had to poorly draw it. (Also hi im new to the subreddit!)"
502,29.0,2500.0,6.0,r/tumblr,Pet names
503,30.0,1300.0,4.0,r/lego,10030 in black
504,51.0,747.0,6.0,r/CitiesSkylines,"NIMBY, or YIMBY? The Argument Between Railfans and Housewives Begins..."
505,57.0,1900.0,10.0,r/Cursed_Images,Cursed mod
506,67.0,376.0,3.0,r/nvidia,Nvidia GPU's Relative Performance Comparison Chart (last few generations) (credits to u/soomrevised)
507,23.0,1600.0,10.0,r/fixedbytheduet,The council has spoken
508,27.0,790.0,7.0,r/AskHistorians,"How did Spain manage to go from being the richest state in Europe during the first half of the XVI century to declaring bankruptcy multiple times in 1557, 1560, 1576, 1590 ?"
509,31.0,1200.0,6.0,r/freefolk,Will it ever end ?
512,29.0,2300.0,7.0,r/ComedyNecrophilia,big balls 4K hd😍😍😍😍
513,56.0,785.0,4.0,r/lgbtmemes,I'm waiting for Italy
514,1500.0,9800.0,9.0,r/antiwork,To all the anti-antiwork redditors:
515,67.0,2400.0,8.0,r/Undertale,gotta love steam (meme flair for no other reason)
516,38.0,837.0,3.0,r/kpop,"GOT the beat (GOT: Girls On Top) - Individual Teaser Images (BoA, Girls' Generation / SNSD Taeyeon, Red Velvet Seulgi, aespa Winter)"
517,31.0,1400.0,10.0,r/FragileWhiteRedditor,FWR makes abhorrent comment on post about 13yo black kid accidentally kills himself with a gun.
518,135.0,3100.0,12.0,r/PetTheDamnDog,"Her name was Claire, she was very cuddly and loved attention. She died in June, please press F."
519,1500.0,16300.0,11.0,r/facepalm,Falsely accused a guy of sexual harassment
520,62.0,840.0,7.0,r/IndiaSpeaks,School-going girls thrashed by Congress workers for raising pro-Modi slogans at Priyanka Vadra rally. What a model of women empowerment!
521,28.0,1500.0,5.0,r/cyberpunkgame,CyberCiri cosplay by me
522,48.0,748.0,5.0,r/dashcamgifs,Stay in your car and it won't be a mess.
523,24.0,2100.0,8.0,r/ik_ihe,ik_ihe
525,39.0,1200.0,7.0,r/physicsmemes,What could go wrong? (source in the comments)
526,75.0,3700.0,13.0,r/notinteresting,I found out something about worms
527,234.0,2400.0,5.0,r/mildlyinfuriating,"My wife went to a party last night with her friend, the designated driver that lives round the corner. When the friend said it was time to leave (at the agreed leaving time) my wife said that she was going to stay 10 more minutes so to go without her. It was a 2 hour round trip to fetch her at 1am."
528,63.0,825.0,6.0,r/Chihuahua,"Yuppy would like some sympathy because his mother won’t give him any. He snuck upstairs and ate more than a bowlful of cat food as fast as he possibly could and is now a tiny bit too full. Also, one naughty Yuppy to a good home."
529,9.0,1700.0,6.0,r/vexillologycirclejerk,"Rejected flag of the EU, but its my friends broken webcam"
530,9.0,1000.0,3.0,r/AteTheOnion,Go blow your noodle
531,36.0,2800.0,13.0,r/youngpeopleyoutube,NOOOOOOOOOOOO!
532,42.0,805.0,24.0,r/GreenAndPleasant,Love to have a free press
535,9.0,1200.0,4.0,r/zelda,[SS] Zelda (art by mmimmzel)
536,44.0,2400.0,13.0,r/babyelephantgifs,A baby elephant having a serious battle with its adorably small trunk
537,48.0,4800.0,7.0,r/aww,She is so pure!!
538,75.0,1100.0,5.0,r/Watches,[Vacheron Constantin] Overseas Dual Time Everest Edition
539,94.0,563.0,5.0,r/selfie,Happy Monday ☺️ Back to work for me today!
540,20.0,1100.0,4.0,r/futurama,"After the death of my best friend, this line was very comforting to me"
541,38.0,1100.0,7.0,r/environment,A Plant That Sterilizes Medical Equipment Spews Cancer-Causing Pollution on Tens of Thousands of Schoolchildren
542,15.0,1700.0,6.0,r/BoJackHorseman,For all yous out there pining for Andrew Garfield
543,44.0,594.0,5.0,r/Anticonsumption,Did they really thought we will pay for all of this
544,44.0,1300.0,5.0,r/HollowKnight,Like that's ever gonna happen!
545,72.0,708.0,3.0,r/weed,"Be like bob, don't be cringe."
546,53.0,1900.0,7.0,r/skyrim,The Elder Scrolls V: Skyrim
547,52.0,1100.0,7.0,r/NoMansSkyTheGame,tf was that soun— WHAT THE FU-
548,71.0,910.0,6.0,r/london,"I took a picture of Canary Wharf from Harrow, 15 miles across London."
549,78.0,4800.0,11.0,r/europe,The inside of Prague Astronomical Clock.
550,34.0,726.0,4.0,r/theydidthemath,[Request] Is it possible that the toy climbs the building on 2AA batteries? How high would it climb?
551,70.0,715.0,7.0,r/labrats,Italian lab drinking prosecco in 50ml Falcon because we ran out of plastic cups HAPPY HOLIDAYS!
552,60.0,3500.0,13.0,r/LiminalSpace,2:32 am
553,16.0,3000.0,4.0,r/memes,What have we got here?
554,44.0,1000.0,4.0,r/Technoblade,look who is on first
555,31.0,614.0,4.0,r/WetlanderHumor,The Ever Victorious Army
556,42.0,441.0,4.0,r/GreenBayPackers,Mmmmhmmm. A nice retort.
557,78.0,2400.0,24.0,r/BeAmazed,Would you like to bathe in the wind whilst people eat below you?
559,24.0,2100.0,7.0,r/Komi_san,The live wallpaper I animated ~ Original Artist:QOME
560,48.0,1600.0,6.0,r/Berserk,"i made this for my boyfriend, i hope he likes it"
561,30.0,882.0,6.0,r/chelseafc,Cesc don't stand for no non sense
562,15.0,1600.0,6.0,r/AnarchyChess,"Guys, I figured out how En Passant works"
563,85.0,465.0,4.0,r/amihot,27F What do you think about me?🤔😻
564,62.0,858.0,5.0,r/woahdude,Crazy drone
565,81.0,2500.0,2.0,r/Damnthatsinteresting,A deep sea monster scene inside a block of epoxy
566,17.0,1100.0,4.0,r/Chadtopia,Chad finally gets the card he’s been grinding for his whole life
567,60.0,371.0,3.0,r/Warhammer,🤩🤩🤩
568,38.0,833.0,7.0,r/UrbanHell,Faux store fronts masking rising vacancy
569,39.0,1300.0,7.0,r/HumansAreMetal,"Nadya Tolokonnikowa riskiert ihr Leben, um gegen den Autoritarismus in Russland zu protestieren."
570,50.0,353.0,2.0,r/FreeGameFindings,[Epic Games] (Game) Mages of Mystralia
571,48.0,1100.0,4.0,r/IdiotsNearlyDying,Tourist is attacked by crocodile after ‘mistaking it for a plastic model and posing for selfie’ 💓😄
572,32.0,1500.0,6.0,r/ShingekiNoKyojin,Looks familiar
573,41.0,2300.0,11.0,r/Naturewasmetal,Some 1880s Victorian holiday cards.
574,63.0,1500.0,6.0,r/crappyoffbrands,"Did not know, Mario was vegan"
575,66.0,841.0,3.0,r/apexlegends,Craziest 1hp Ranked clutch EVER.
576,42.0,458.0,3.0,r/libertarianmeme,Glitch in the matrix
577,33.0,1000.0,3.0,r/OnePunchMan,only fax here
578,57.0,1000.0,4.0,r/Shitty_Car_Mods,"Fuck you, PT Cruiser Limo"
579,87.0,1500.0,3.0,r/OldSchoolCool,Bill Watterson of Calvin and Hobbes came-1986
580,6.0,1200.0,4.0,r/comedyhomicide,Hahaha very funny
581,12.0,1700.0,3.0,r/cursedcomments,Cursed_foreskin
582,46.0,2200.0,5.0,r/titanfall,Respawn tried but failed
583,33.0,4400.0,9.0,r/TheLastAirbender,paused at the wrong moment
584,47.0,6800.0,18.0,r/rickandmorty,Who can relate?
585,31.0,536.0,4.0,r/DuggarsSnark,Tomorrow will officially be...
586,15.0,1400.0,6.0,r/disneyvacation,How to dress your spouse for work so they can get a few extra minutes of sleep after a holiday weekend
587,62.0,11400.0,15.0,r/NatureIsFuckingLit,🔥 Let It Snow! 🔥
588,33.0,485.0,4.0,r/IndoorGarden,Happy Jade💕 I never knew they flowered until this baby bloomed! I’m so happy it’s so happy! Makes my day every time I pass her💖
589,13.0,1400.0,6.0,r/hellsomememes,#TeamCthulhu
590,45.0,763.0,3.0,r/HadToHurt,"Hey man, what's wrong with this laser?"
591,452.0,975.0,3.0,r/LivestreamFail,DJWheat on Streamers Reacting to Entire Movies and Shows on Stream
592,37.0,1600.0,6.0,r/FoodPorn,[OC] Lasagna I made for the holidays
593,56.0,1800.0,5.0,r/cats,"Mom told me to sit still, If I don't want to be a clown"
594,18.0,4000.0,8.0,r/technicallythetruth,Kicked Out Even After a Perfect Answer ...
595,30.0,2600.0,8.0,r/ksi,JJ's hamster in his ex's house
596,45.0,1700.0,9.0,r/PixelArt,Made my pixel art come to life. My first animated artwork.
597,36.0,1600.0,7.0,r/GTA,And the best boss award goes to...
598,25.0,1500.0,3.0,r/Genshin_Impact,I drew Keqing
600,37.0,1200.0,9.0,r/Metroid,I felt so powerful just to die 10 seconds later
