Unnamed: 0,comment_count,upvote_delta,timeup_list,subreddit,thread_text
0,16900.0,19100.0,6.0,r/AskReddit,What ruins a movie instantly?
1,7500.0,58000.0,17.0,r/nottheonion,NASCAR driver who unintentionally sparked 'Let’s Go Brandon' chant says corporations don’t want to sponsor him
2,1300.0,31700.0,5.0,r/WhitePeopleTwitter,Can’t wait
3,6800.0,50000.0,7.0,r/pics,Mark Bryan a robotic engineer is shattering gender norms by wearing what he likes.
4,156.0,14600.0,3.0,r/WatchPeopleDieInside,This is some Tom and Jerry vibe
6,512.0,22600.0,5.0,r/PoliticalHumor,Any second now………
7,5600.0,57300.0,6.0,r/antiwork,So this is why we're protesting?
8,5500.0,69100.0,11.0,r/facepalm,This woman talking about what kind of men she wants...
10,4600.0,7200.0,6.0,r/AskMen,What are some HARD truths that people don't want to hear?
11,1200.0,15600.0,5.0,r/politics,"The Pandemic Shows Why We Need Universal Health Care. Why Does the Richest Country in the World Have the Most Covid Deaths? A Primary Reason is That the United States Does Not Have a Free, Universal Health Care System."
12,3600.0,56700.0,11.0,r/WhitePeopleTwitter,Richie Rich
13,377.0,10600.0,4.0,r/ProgrammerHumor,I have been attacked.
14,143.0,22400.0,6.0,r/aww,The ultimate coupling
15,2500.0,4300.0,10.0,r/OnePiece,One Piece: Chapter 1036
16,2500.0,49500.0,13.0,r/HolUp,HolUppppp
17,1800.0,24200.0,9.0,r/Cringetopia,Some FDS mentality right there
18,1400.0,19500.0,15.0,r/iamatotalpieceofshit,Woman sexually assaults guy on train
19,386.0,19000.0,5.0,r/nextfuckinglevel,Iceland without tourists.
20,1300.0,16900.0,7.0,r/technology,Moderator Who Watched Hours of Traumatic Videos Sues TikTok for Failing to Protect Her Mental Health
21,736.0,32600.0,6.0,r/wallstreetbets,12$ is generous
22,1300.0,16300.0,6.0,r/HermanCainAward,Uncanny coincidence: This old anti-vaxx cowboy with 1.9K Facebook friends died of COVID-19 and his funeral looked EXACTLY like this cartoon he shared.
23,1200.0,11300.0,11.0,r/marvelmemes,IM MARY POPPINS YALL
24,357.0,30800.0,6.0,r/HolUp,BRO WAI-
25,592.0,8900.0,4.0,r/worldnews,‘Colossal waste’: Nobel laureates call for 2% cut to military spending worldwide
26,1400.0,18900.0,8.0,r/IdiotsInCars,just a normal car meet (almost)
27,986.0,7500.0,4.0,r/PublicFreakout,Woman calls the cops because she's denied entry into a store for not wearing a mask
28,203.0,17700.0,6.0,r/BetterEveryLoop,Mid air kick from the pad holders perspective
29,1300.0,13300.0,24.0,r/whenthe,In 1945
31,1200.0,37000.0,8.0,r/MurderedByWords,Love it when people use dead celebs to push an agenda they would have completely disagreed with
32,1100.0,19200.0,16.0,r/LeopardsAteMyFace,Candace Owens requires a paid subscription to view her interview with Trump. Conservatives unironically demand to get it for free.
33,1300.0,8400.0,16.0,r/CoronavirusDownunder,A reminder of all the vaccinations & boosters you've already had.
34,564.0,41800.0,7.0,r/funny,I really need one of these nearby
35,1100.0,24600.0,14.0,r/movies,"Jean-Marc Vallée Has Died; Director Of ‘Dallas Buyers Club,’ ‘Big Little Lies’ & ‘Sharp Objects’ Was 58"
36,1200.0,49400.0,11.0,r/nextfuckinglevel,Jaw dropping fakeout on a charging wild boar.
37,803.0,27400.0,7.0,r/todayilearned,"TIL that in Churchill, Canada, locals keep their car doors unlocked in order to provide other residents a quick escape, should they encounter a polar bear"
38,994.0,16300.0,15.0,r/MovieDetails,"In ‘Don’t Look Up’ (2021), astronomers appear on a ‘Morning Joe’-style cable news talk show. Though not explicitly noted as liberal, their logo reflects their slant. A clever detail!"
39,1000.0,9300.0,15.0,r/NoStupidQuestions,Left at home announced?
40,1200.0,9400.0,7.0,r/dankmemes,What song is this?
41,366.0,33600.0,7.0,r/MadeMeSmile,Father of the year
42,282.0,15700.0,6.0,r/interestingasfuck,Jeff Lee Johnson Painting. The longer you look the more you see.
43,91.0,15500.0,6.0,r/Eyebleach,My Angel
44,671.0,13200.0,6.0,r/FuckYouKaren,Kickboxing Karen felt a little too arrogant
45,74.0,6900.0,4.0,r/HumansBeingBros,This barber gives free haircut to whoever can‘t afford it.
46,55.0,9400.0,5.0,r/AnimalsBeingDerps,That's pretty interesting looking stapler
47,933.0,20100.0,15.0,r/science,Analysis of Microplastics in Human Feces Reveals a Correlation between Fecal Microplastics and Inflammatory Bowel Disease Status
48,1100.0,2400.0,3.0,r/KGBTR,FURKAN TOPAL CURRENT MOOD: HAPİSTEN ÇIKTIM!
49,1100.0,463.0,4.0,r/Music,Describe a band poorly but accurately
50,963.0,1000.0,8.0,r/AskUK,What shop have you never been to?
51,1100.0,24500.0,13.0,r/teenagers,"Gonna ask my crush (an extreme marvel fan) to the movies, wish me luck!"
52,116.0,10800.0,5.0,r/2meirl4meirl,2meirl4meirl
53,912.0,13400.0,6.0,r/facepalm,"Never underestimate a ""little virus"""
54,235.0,10700.0,5.0,r/greentext,The end is near for UK anons
55,261.0,10900.0,6.0,r/leagueoflegends,I spammed Ultimate Spellbook for days trying to get this sick ult combo
56,82.0,7200.0,5.0,r/educationalgifs,How engineered structures affect flow in rivers
57,24.0,7900.0,6.0,r/comics,Cardio
58,976.0,24500.0,19.0,r/coolguides,Do not mix these cleaning products
59,435.0,8800.0,6.0,r/news,Virginia family gets keys to Habitat for Humanity's first 3D-printed home in the US
60,974.0,26600.0,12.0,r/mildlyinfuriating,I work at an ice skating rink and instead of properly turning in skates people started just throwing them over the counter
61,96.0,13400.0,6.0,r/tumblr,This hellhole is free
62,899.0,3300.0,3.0,r/TrueOffMyChest,"I really hope all this gender identity stuff is real and not actually just mental disorders, because if it is truly mental instability we are really messing up a lot of kids by feeding into it."
63,120.0,5200.0,4.0,r/Hololive,Come cry with us in Haachama’s stream
64,125.0,9800.0,6.0,r/gaming,+10 mental damage
65,860.0,19600.0,20.0,r/ATBGE,A total 180 of them. Great.
66,203.0,22800.0,16.0,r/LifeProTips,"LPT: When it's time for your pet to be euthanized, have the vet come to your home. That way your pet can spend their last moments at home relaxed rather than being anxious at the vet's office."
67,75.0,13000.0,6.0,r/PrequelMemes,I have the High Ground!
68,42.0,5100.0,4.0,r/TheLastAirbender,Zuko forgot to credit someone...
69,229.0,5700.0,4.0,r/WinStupidPrizes,UFC fighter films himself jumping headfirst into a frozen river
70,606.0,9500.0,7.0,r/BlackPeopleTwitter,Cue Pain’s theme
71,90.0,7200.0,5.0,r/perfectlycutscreams,I'm crying
72,87.0,7200.0,6.0,r/NonPoliticalTwitter,Do remove it and put it in the socket of someone missing an eye. This is the beginning of the next Mummy movie.
73,885.0,40800.0,13.0,r/AbsoluteUnits,My parents dog who i got to see over the holidays
74,351.0,5100.0,4.0,r/MaliciousCompliance,Ex demanded I cook the dinner HE wanted.
75,398.0,7200.0,6.0,r/space,ArianeSpace CEO on the injection of JWST by Ariane 5.
76,462.0,17200.0,14.0,r/nba,Nikola Jokic twerks before tipoff
77,101.0,8100.0,6.0,r/lotrmemes,So no school!!!??
78,827.0,19500.0,15.0,r/ANormalDayInRussia,Russians trying to make sense of English
79,334.0,81100.0,19.0,r/HumansBeingBros,This restaurant offers food for free if you can’t afford it
80,815.0,1700.0,8.0,r/LeagueOfMemes,Riot is removing 1 out of the 3 basic abilities of every champion. The ability getting removed is the one that is usually maxed last. How screwed is your champion?
81,241.0,11900.0,6.0,r/funny,"Ordered, “I’d Rather Be Driving My Volkswagen” and received this instead."
82,689.0,8700.0,16.0,r/sports,Washington Football Team players fighting amongst themselves on the sideline during Sunday Night Football
83,785.0,31400.0,18.0,r/blackmagicfuckery,what?
84,494.0,39000.0,9.0,r/dankmemes,We gonna have a good time.
85,111.0,2500.0,10.0,r/copypasta,Will I get pregnant if he ejaculated in me?
86,661.0,15900.0,16.0,r/atheism,Grandma tries to teach my kid the biblical Christmas story. It doesn't go the way she had hoped.
87,756.0,1700.0,9.0,r/CryptoCurrency,Decentralisation is the ONLY point of crypto
88,702.0,40800.0,11.0,r/interestingasfuck,This raven sounding eerily like a human. Think what a mess was the first guy who saw this animal
89,760.0,4400.0,3.0,r/memes,Just moved and apparently they do not like California
90,586.0,1700.0,7.0,r/LivestreamFail,Rich Campbell is literally streaming the Lord of the Rings movies on Twitch
91,710.0,3900.0,7.0,r/NotHowGirlsWork,Ah yes women are used milk now
92,500.0,27600.0,8.0,r/wholesomememes,real chads respect women
93,612.0,1500.0,11.0,r/CFB,Is it fair to say that a Cincinnati win would be the biggest in college football history?
94,427.0,12500.0,17.0,r/YouShouldKnow,YSK: How to save cash to get out of a relationship with someone who is financially controlling you.
95,2300.0,10500.0,6.0,r/shitposting,Based cum taiwan zamn femboy among us
96,94.0,6900.0,6.0,r/KidsAreFuckingStupid,Noob n Boomer 🤮 😦!!! 111
97,671.0,1500.0,4.0,r/starcitizen,"Downvote away, but it is what it is... 3 out of 18 planned items actually made it into 3.16's release"
98,124.0,1600.0,5.0,r/tifu,TIFU my friend's proposal
99,606.0,5500.0,9.0,r/CasualUK,"My daughter asked me if all the roads in Britain are connected. I mean, if we're just looking at the mainland... Maybe? Someone help, this is breaking my brain."
100,644.0,7500.0,8.0,r/ToiletPaperUSA,Imagine being this much of a fuckin cry baby
101,648.0,16000.0,8.0,r/oddlyterrifying,They pulled the towel out of the snake!
102,412.0,35200.0,14.0,r/shittymoviedetails,In Blade (1998) the policeman tell Blade to freeze and he turns without resisting however after seeing he is a black man the police fires at him
103,374.0,12900.0,10.0,r/formula1,"Brabham BT46B: Designed by Gordon Murray who found a loophole in the regulations and attached a massive fan to create a vacuum under the car and increase downforce. Driven by Niki Lauda at the '78 Swedish Grand Prix, it won the only race it ever competed in as it got withdrawn immediately after."
104,598.0,484.0,4.0,r/fantasyfootball,Let this be a lesson to some of you...
105,496.0,2100.0,12.0,r/TooAfraidToAsk,How can I know the porn I watch is Abuse-Free?
106,85.0,8000.0,7.0,r/pics,Our 1st Christmas together and our 15th Christmas together.
107,548.0,6800.0,11.0,r/awfuleverything,If you don't know what true human horror is please look up Nutty Putty Cave. 28 hours of claustrophobic hell.
108,436.0,3700.0,3.0,r/Animemes,Guess it.
109,112.0,5800.0,6.0,r/EarthPorn,"It is crazy cold in Sweden, Småland now. On my way to our “summer” cabin [OC][6000x4000]"
110,602.0,6700.0,9.0,r/ich_iel,Ich📝iel
111,498.0,2000.0,4.0,r/news,Outlets hurt by dwindling public interest in news in 2021
112,489.0,637.0,5.0,r/dndnext,What Did You Once Think Was OP?
113,407.0,2600.0,12.0,r/witcher,Yennefer and Geralt have no chemistry in the show
114,170.0,4700.0,4.0,r/Unexpected,Cursing driver while crossing the road
115,594.0,21500.0,18.0,r/Spiderman,Marvel need to reveal who he is
116,299.0,7700.0,12.0,r/gtaonline,what…
117,124.0,5600.0,6.0,r/DunderMifflin,Me and the boys on our way to take a widely agreed-upon opinion about The Office and post it in r/DunderMifflin as though it’s an original thought
118,97.0,6100.0,17.0,r/SapphoAndHerFriend,Gal pals dancing to attract a male mate
119,322.0,1300.0,8.0,r/nursing,Lol no
120,516.0,2800.0,7.0,r/unpopularopinion,'Narcissist' is the most overused/misused word of 2021
121,263.0,4800.0,4.0,r/meme,Spain … without the s ! 🐸🥲
122,182.0,8800.0,15.0,r/DunderMifflin,Has there ever been a better sales pitch of hot garbage than Andy with his break room cheese platter?
123,61.0,4800.0,5.0,r/EngineeringPorn,Large wave flume at a wave research lab
124,426.0,47300.0,12.0,r/mildlyinteresting,My Grandmother has the first snowmobile license in CA
125,60.0,5800.0,6.0,r/IllegallySmolCats,this is Mango
126,544.0,2400.0,10.0,r/ClashRoyale,Tell me something that will get you in a situation like this. Mega Knight is balanced.
127,473.0,1200.0,9.0,r/apple,Apple Allegedly Preparing for iPhones Without SIM Card Slot by September 2022
128,71.0,4600.0,4.0,r/me_irl,me_irl
129,430.0,1400.0,4.0,r/marvelstudios,"If Spidey is still going to have a mcu partner for every movie,who do you think should be the next one ?"
130,123.0,4800.0,6.0,r/GetMotivated,[Image] Believe in yourself!
131,358.0,16600.0,7.0,r/MadeMeSmile,Man gets what he wants for Christmas…
132,46.0,2900.0,3.0,r/Damnthatsinteresting,It is a small world
133,217.0,4000.0,5.0,r/brooklynninenine,MRW I'm downvoted into oblivion for saying I hate Adrian Pimento
134,112.0,4300.0,5.0,r/StarWars,Made this Star Wars animation a few weeks ago
135,89.0,4300.0,5.0,r/UpliftingNews,Taiwan delivers 10 metric tons of aid for Filipino typhoon victims
136,282.0,909.0,3.0,r/ufc,What did Uriah Hall mean by this?
137,454.0,2800.0,7.0,r/pokemon,Animals that I’m surprised that haven’t turned into Pokémon yet
138,363.0,2800.0,9.0,r/Genshin_Impact_Leaks,Keqing and Ningguang Skins Detail in Game (Source: Official Site Mihoyo)
139,127.0,7000.0,17.0,r/oldpeoplefacebook,"Visiting grandma, this is how she ""gets to Hulu""... On Netflix."
140,443.0,1200.0,9.0,r/unitedkingdom,Plans in England for car chargers in all commercial car parks quietly rolled back
141,521.0,6400.0,12.0,r/pcmasterrace,Gaming PC’s Graphics Card
142,197.0,4700.0,11.0,r/TwoSentenceHorror,"My boyfriend gets so angry sometimes, but it's not his fault; the restaurant has been putting a lot of strain on him."
143,298.0,12100.0,16.0,r/dadjokes,"I dislike karma whores who make posts that imply it's their cake day, simply for upvotes."
144,386.0,1700.0,4.0,r/stocks,"Why is it that this sub is for stocks, but whenever someone asks for what they should buy every one just goes directly towards index funds?"
145,268.0,773.0,6.0,r/relationship_advice,My parents care more about my brother's dog than they do about my son and it's driving a wedge between myself and them.
146,328.0,18200.0,12.0,r/ContagiousLaughter,spelling bee word got kid cracking up on stage
147,110.0,3900.0,5.0,r/cats,Meet Cleo! I rescued her off the street on my route (I’m a mailman)
149,201.0,7200.0,7.0,r/natureismetal,"Receding ice cap forces the polar bear to change its diet. Taking down reindeer. Svalbard, Norway"
150,383.0,590.0,3.0,r/DnD,What is a rule from another game that should be added to 5.5e? Wrong answers only
151,553.0,4100.0,2.0,r/interestingasfuck,"Illustration of the largest sacrifice of infants in history. Around 1450 AD, 227 children were sacrificed in the Peruvian Chimu culture. The theory is that this great sacrifice was made to appease the rain gods because the rain did not stop, flooding the area, ruining the crops and more."
152,335.0,1000.0,5.0,r/Firearms,When Canadians see rifles
153,377.0,8900.0,9.0,r/confidentlyincorrect,It's Wolfenstein
154,142.0,1800.0,4.0,r/playboicarti,kanye west
155,245.0,6600.0,14.0,r/DiWHY,"Please, do not cover you bathroom counter in cement. This has homeowner written all over it."
156,74.0,4000.0,5.0,r/Awwducational,"While donkeys may have a notorious reputation for being stubborn, they are actually quite fearless dealing with predators as well as intelligent, playful and curious. When this donkey in Arkansas received presents a few days ago, his owner reported he ""always gets so excited when he gets a new one."""
157,95.0,3100.0,4.0,r/SelfAwarewolves,Self aware wolfenstein
158,240.0,9500.0,7.0,r/maybemaybemaybe,Maybe maybe maybe
159,103.0,20200.0,10.0,r/trippinthroughtime,This is a whole mood
160,154.0,5400.0,7.0,r/OldSchoolCool,"Dolly Parton taking a bath at her Tennessee Mountain home, 1987."
161,256.0,6100.0,16.0,r/blunderyears,2002. What living with 3 sisters gets you. I'm a dude.
162,175.0,5800.0,7.0,r/dataisbeautiful,[OC] Photos in my library by month & year since 2007
163,285.0,1800.0,3.0,r/bestof,"u/CockGobblin does the math on ex-cop Jared Schmeck's PPP loan. Schmeck is the man who said ""Let's go Brandon"" to US President Biden in front of his children during a publicly televised Christmas greetings call."
164,59.0,8400.0,8.0,r/ItemShop,+1000 range
165,93.0,4300.0,6.0,r/food,[Homemade] Blueberry and Raspberry Pie
166,341.0,2000.0,7.0,r/explainlikeimfive,ELI5: Why cant phones turn on instantly when plugged in after dead battery but laptops can?
167,155.0,3300.0,4.0,r/Superstonk,The Big Short: Reloaded. A Summary of My DDs on Student Loan Asset Backed Securities.
168,134.0,4700.0,5.0,r/todayilearned,"TIL the identity of the Mona Lisa was only confirmed in 2005 when a researcher at Heidelberg University found a note in the margin of a book, handwritten by one of Leonardo´s contemporaries in 1503, saying ""Brother Leonardo is working on a portrait of Lisa of Giocondo."""
169,211.0,4100.0,6.0,r/greentext,Anon is a NEET
170,115.0,1500.0,5.0,r/Gamingcirclejerk,Who Did These Genres Best?
171,336.0,24900.0,15.0,r/Tinder,"Well, that was sweet."
172,218.0,10100.0,11.0,r/tf2,why the fuck is this in the game files
173,214.0,2500.0,6.0,r/IASIP,"I cried so hard at that last scene, not even ashamed to admit it"
174,308.0,1300.0,7.0,r/dating_advice,Looks don’t matter as much as you guys think they do
175,987.0,19700.0,8.0,r/nextfuckinglevel,A 1995 Interview with Princess Diana on her opinion on being Queen
176,165.0,17800.0,10.0,r/pcmasterrace,The dedication is Important...
177,62.0,3000.0,4.0,r/StardustCrusaders,New Araki Art dropped for the 35th anniversary of JoJo's Bizarre Adventure
178,364.0,1400.0,7.0,r/NintendoSwitch,Just bought The Witcher 3. What kind of black magic is behind this port?
179,177.0,6500.0,7.0,r/Genshin_Impact,It's Fischl's VA's Bday!
180,176.0,11700.0,16.0,r/raimimemes,How Peter should have responded smh
181,146.0,3000.0,6.0,r/TheRightCantMeme,Funny how they only care about feminism when they can use it as a cudgel against trans people.
182,243.0,1500.0,10.0,r/chess,"MVL on Twitter: It would be more reasonable to focus on having water available for players, metal detectors […] and respecting a schedule […] than to pay full attention on an outdated dress code"
183,338.0,2300.0,8.0,r/france,"""Sans masque sans capote""- la résistance, 2021"
184,283.0,18100.0,16.0,r/StartledCats,First time on ice combined with first time wearing a bell collar
185,210.0,2800.0,8.0,r/ProgrammerHumor,Oh god oh fuck I learned rust wtf do I do guys
186,306.0,1700.0,5.0,r/DestinyTheGame,"FYI - Bungie has already released more specifics about DCV in Year 5 (including currencies, consumables, The Helm Overhaul, and Vanity Acquisition, Exotics)"
187,213.0,3700.0,14.0,r/HermitCraft,Updated Hermit Chart
188,277.0,6100.0,14.0,r/SelfAwarewolves,Funny you should say that..
189,169.0,2000.0,7.0,r/justneckbeardthings,"He has always been VERY interested in Asian culture."" I can imagine!"
190,359.0,630.0,4.0,r/dogecoin,I work minimum wage and put my entire life savings into Doge 🚀🚀 🐕
191,162.0,14100.0,8.0,r/ProgrammerHumor,"I said ""we can make everything with css"" in class"
192,189.0,4100.0,12.0,r/TikTokCringe,Incorrectly assumed race/ethnicity
193,291.0,2600.0,10.0,r/india,Scares.
194,5.0,3000.0,4.0,r/gayspiderbrothel,NO REASON IN PARTICULAR
195,186.0,831.0,7.0,r/Polska,Veto
198,49.0,3700.0,5.0,r/dndmemes,Peace and Quiet was never an option.
199,130.0,4200.0,6.0,r/raimimemes,Multiverse of madness counts as a raimi’s movie right?
200,239.0,8100.0,13.0,r/Wellthatsucks,Couple getting soaked by multiple cars
201,239.0,13200.0,10.0,r/ChoosingBeggars,The right way to treat ChoosingBeggars
202,37.0,6800.0,8.0,r/antimeme,Virgin vs chad
203,340.0,4300.0,7.0,r/IndianDankMemes,Spiderman NWH ki baat chal rahi hai 🤡
204,69.0,3600.0,6.0,r/BrandNewSentence,Stanley Yelnats
205,56.0,3400.0,5.0,r/suspiciouslyspecific,Love Languages Matter
206,286.0,19200.0,17.0,r/WinStupidPrizes,Kid doing science experiment on the treadmill
207,237.0,16600.0,14.0,r/TIHI,"Thanks, I hate laughing without facial expressions"
208,176.0,10800.0,10.0,r/catsareliquid,"This is Cthulhu. If I don't do this, everyone will die."
209,278.0,3500.0,6.0,r/thatHappened,And it went down just like that!
210,243.0,21000.0,12.0,r/Superstonk,Saw this in another sub. Brick by brick
211,612.0,5800.0,6.0,r/politics,Fauci says he was 'stunned' by boos from Trump supporters over booster revelation
212,279.0,2000.0,8.0,r/TwoXChromosomes,"I thought I was just lazy and fat, but it turns out I have very low iron."
213,163.0,3800.0,6.0,r/Bossfight,"Potassius maximum, when you eat it it restores all of your HP"
214,218.0,2000.0,12.0,r/linux,My grandma called and thanked me for installing Linux on her old computer
215,208.0,2700.0,4.0,r/de,Vom Partner verlassen? Warum nicht ein wenig Kreditkartenbetrug für einen guten Zweck?
216,205.0,5500.0,7.0,r/Jokes,"Do you mind if I sit beside you?” The girl replied with a loud voice, ""NO, I DON 'T WANT TO SPEND THE NIGHT WITH YOU!"" All the students in the library started staring at the guy; he was truly embarrassed."
217,38.0,4200.0,7.0,r/Catswhoyell,My gfs cat yells back
218,158.0,9100.0,14.0,r/nevertellmetheodds,Finger of God
219,159.0,1500.0,4.0,r/dndmemes,What is the most creative use of an offense spell you have seen?
220,39.0,6100.0,7.0,r/blursedimages,blursed drawing
221,32.0,4200.0,6.0,r/NatureIsFuckingLit,🔥 Northern hawk owl
222,102.0,3400.0,6.0,r/destiny2,Found this at a Pawn shop yesterday for twelve bucks and couldn't resist grabbing it! Singlehandedly the coolest thing I own!
223,97.0,3800.0,13.0,r/youseeingthisshit,Wolf and dog - friendly encounter
224,238.0,13000.0,9.0,r/Minecraft,A friend challenged me to do a RGB texture pack. What do you think about it ?
225,149.0,11800.0,9.0,r/whenthe,All reputable information comes from the hub 👍
226,34.0,3400.0,6.0,r/surrealmemes,Turkey Looks Like It Has Been Rack'ed
227,326.0,2200.0,3.0,r/Spiderman,Which spiderman suffered the most?
228,67.0,6100.0,8.0,r/oddlyspecific,"Ok, Josh"
229,21.0,4300.0,6.0,r/OTMemes,At last he shall have his revenge
230,184.0,3300.0,6.0,r/AnimalCrossing,"In case anyone is wondering why I'm single - (my little bro got me the comforter for Christmas because he knows my favorite interests are Animal Crossing and sleeping lol, I love it!!)"
231,28.0,2600.0,4.0,r/rarepuppers,Pool pooch
232,78.0,11600.0,10.0,r/HydroHomies,make the conscious choice to hydrate
233,90.0,3200.0,5.0,r/oddlysatisfying,Sealcoating a driveway
234,282.0,10100.0,16.0,r/gadgets,The Kidney Project successfully tests a prototype bioartificial kidney
236,41.0,4700.0,7.0,r/bonehurtingjuice,Occupational hazards
237,269.0,1400.0,3.0,r/Coronavirus,Fauci wants to “seriously” consider vaccine mandate for domestic flights
238,211.0,1600.0,4.0,r/askscience,How does NASA and other space agencies protect their spacecraft from being hacked and taken over by signals broadcast from hostile third parties?
239,142.0,6900.0,7.0,r/Damnthatsinteresting,A water damaged copy of “Alice in Wonderland” which grew fungi.
240,310.0,44900.0,17.0,r/Eyebleach,TRIFORCE ACTIVATE
241,131.0,1900.0,3.0,r/arcane,"[no spoilers] I mean, seriously, what the hell?"
242,263.0,1700.0,12.0,r/newzealand,"Reminder that tip top is currently owned by nestle, a scumbag of a company."
243,123.0,12500.0,12.0,r/therewasanattempt,To hold your ball
244,96.0,1200.0,5.0,r/reddeadredemption,Found this sheep by valentine he was wondering alone and he has this pink tie i killed him but i cant skin it what the heck is this
248,95.0,2200.0,12.0,r/bindingofisaac,This meme took a fat 2 minutes to make so sorry if it’s bad
249,95.0,2900.0,6.0,r/sadcringe,I realy hope this is satire
250,132.0,7000.0,7.0,r/facepalm,“This is how it feels to be a white conservative”
251,244.0,18100.0,15.0,r/gaming,Mario then realized he now wants more than a kiss after rescuing Peach
252,153.0,4100.0,8.0,r/SmashBrosUltimate,That's enough to make me wanna strangle that bitch
253,224.0,2200.0,11.0,r/loopringorg,New GameStop Job Ad: Absolute PROOF that GME is building an NFT Gaming Platform on a Layer 2…. (Scroll Right ➡️➡️➡️) Buckle Up Loop Troop 🚀🚀🚀🚀
255,181.0,1600.0,9.0,r/CrusaderKings,The route the AI is taking to Jerusalem in the first crusade
256,97.0,4000.0,5.0,r/BlackPeopleTwitter,necessary pill to swallow 💊
257,113.0,3100.0,4.0,r/Unexpected,Gotem
258,267.0,1800.0,10.0,r/StarWarsBattlefront,Count Dooku’s reign of terror is over. Only 5 heroes remain. Who should go next?
259,69.0,2600.0,5.0,r/GlobalOffensive,First thing to draw with Lasercube
260,13.0,3200.0,6.0,r/BikiniBottomTwitter,You and I are not so different
261,142.0,1400.0,9.0,r/imaginarymaps,Alternate Map of Rome if they had Conquered China (Circa 576)
262,94.0,2300.0,5.0,r/ffxiv,Estinien 300 IQ [art by Diago_FFXIV]
263,156.0,2500.0,5.0,r/dankchristianmemes,The Africans I meet on FB may be the most active Christians I’ve ever seen
264,290.0,1500.0,10.0,r/xboxone,Watching the Xbox documentary. Can someone please tell me what this game is?
265,154.0,4000.0,6.0,r/MinecraftMemes,Who needs minecraft realms?
266,326.0,669.0,5.0,r/polls,What is your favorite sleep times?
267,337.0,15200.0,12.0,r/gifs,what's the name of this fruit...
268,43.0,3200.0,5.0,r/technicallythetruth,The place I visited most this year
269,265.0,2700.0,5.0,r/RocketLeague,Petition for Psyonix to add a Toyota Camry and/or a Honda Civic
270,75.0,2400.0,7.0,r/MemePiece,Fax
271,203.0,7900.0,11.0,r/BeAmazed,Your blood turns green 30ft underwater due to no red light being present
272,166.0,633.0,4.0,r/pcgaming,Why Does EA Destroy Companies They Buy?
273,164.0,885.0,3.0,r/europe,Global warming is not the only theat caused by coal plants
274,91.0,1100.0,6.0,r/factorio,I've been playing Factorio V0.16 for already several years now and I just noticed that there's a V1.1...
275,49.0,4300.0,6.0,r/cursedcomments,Cursed_christmas
276,100.0,8200.0,11.0,r/PewdiepieSubmissions,“i’lL nEvEr bE fAmiLy fRiEnDlY”
277,184.0,1600.0,6.0,r/ksi,Some of you guys make me sick
278,129.0,3100.0,11.0,r/tf2shitposterclub,mfw the meanie scunt on fire who stood still calling for medic took my healthpack
