Unnamed: 0,comment_count,upvote_delta,timeup_list,subreddit,thread_text
601,25.0,1900.0,10.0,r/civ,Yes I played this card. No the other cards weren’t better. Yes they knew the reference. No I did not win. Yes I cut all contact with them.
602,26.0,735.0,5.0,r/ZeroWaste,One of the (fairly popular) juice brands in Austria is now also selling juices in reusable glass bottles
603,28.0,1200.0,9.0,r/PropagandaPosters,"""Conquering Space!"" USSR, 1960"
604,448.0,1600.0,4.0,r/HermanCainAward,"🏆 Marine combat veteran, bodybuilder, young husband and father. Disinformation victim. 🏆"
605,57.0,765.0,6.0,r/Stellaris,Cryogenesis Unofficial Species Pack - Mod Release
606,47.0,623.0,6.0,r/SpaceXLounge,NSF Live catched a meteor!
607,28.0,2000.0,7.0,r/AnimalsBeingJerks,Give him a nice lil pet Mo
608,55.0,1000.0,7.0,r/DarkViperAU,Unsettled Matto
609,30.0,2400.0,8.0,r/confusing_perspective,It’s not her toes
610,30.0,901.0,8.0,r/Overwatch_Memes,Diff this diff that
611,53.0,1500.0,3.0,r/worldnews,Crisis response teams achieve 70% reduction in people taken into custody under Mental Health Act
612,44.0,875.0,6.0,r/Justrolledintotheshop,Guy says nail in his tire caused it to go flat
613,15.0,988.0,3.0,r/yesyesyesyesno,Don't you just love dogs?
614,130.0,14700.0,13.0,r/marvelmemes,My back Ah My back
615,103.0,2600.0,4.0,r/Superstonk,"Imagine tanking the price right after Christmas, when everybody had pocket money from grandma, float is about to get locked real quick, believe it or not, I'm hyped! LFG apes."
616,42.0,3000.0,10.0,r/im14andthisisdeep,Found this on a friend's story (he's around 50)
617,18.0,2600.0,9.0,r/starwarsmemes,The dark side of the force is a pathway to many abilities some consider to be unnatural...
618,42.0,1200.0,9.0,r/arknights,Sussurroverse
621,139.0,2600.0,7.0,r/CasualUK,My Taxi driver was having fun today...
622,45.0,1500.0,10.0,r/Brawlstars,Gru holding gun pin
623,42.0,944.0,3.0,r/notinteresting,Click here to add text
624,1.0,1000.0,4.0,r/AnimalTextGifs,Purrfection
625,51.0,1100.0,4.0,r/DeepRockGalactic,Met a dev earlier
626,36.0,540.0,20.0,r/GreenAndPleasant,Fox nonce
628,43.0,447.0,4.0,r/camping,Winter Car Camp for Xmas weekend
630,33.0,599.0,4.0,r/whatsthisbug,"I have never seen a fluorescent bug, except fireflies, can someone identify this one?"
631,27.0,1400.0,4.0,r/MinecraftMemes,It do be like that
632,34.0,772.0,4.0,r/WorkersStrikeBack,Why is this an acceptable life?
633,49.0,751.0,7.0,r/painting,"Acrylic and pencil on paper ""Pigeons"""
634,28.0,1500.0,6.0,r/GamePhysics,[Cyberpunk 2077] When you want to go home.. But you're already there.
635,46.0,3800.0,24.0,r/animalsdoingstuff,Never give up on your dreams.
637,247.0,2200.0,6.0,r/teenagers,I love my crush
638,38.0,1100.0,7.0,r/popping,I don’t know if it’s just me...
640,32.0,481.0,3.0,r/functionalprint,Geared Hinge
641,44.0,1200.0,5.0,r/Dachshund,I made a wooden dachshund paper towel holder. Someone in r/woodworking mentioned I should post it here too :)
642,30.0,1000.0,4.0,r/drawing,I drew my friend strolling through a foggy night
643,855.0,1200.0,6.0,r/AskReddit,Kids today will never know how legendary Chuck Norris is … What are some facts that you know about Chuck Norris ?
644,9.0,987.0,4.0,r/me_irlgbt,me_irlgbt
645,26.0,1100.0,5.0,r/Awwducational,Donkeys can get quite excited when they are given new toys to play with.
647,35.0,1300.0,9.0,r/FellowKids,I’m the cafeteria
648,28.0,1600.0,8.0,r/animegifs,How to use a gun properly | Bing :
649,19.0,1100.0,4.0,r/photoshopbattles,PsBattle: Cat in his carrier
650,29.0,1900.0,9.0,r/thisismylifenow,I wonder what did he do to deserve it
651,28.0,1300.0,7.0,r/ForzaHorizon,when you cant paint the roll cage so tint the windows
652,40.0,756.0,13.0,r/pics,For those of you who don’t live in a snowy tundra
654,7.0,1300.0,6.0,r/SpeedOfLobsters,Will Smith's musical career takes a strange turn
657,31.0,421.0,4.0,r/projectzomboid,"If you found these barrels, drop everything and grab this one. It can collect rainwater and store 800 units of water."
658,20.0,1200.0,5.0,r/subnautica,[NO SPOILERS] I enjoyed that reference.
659,39.0,2000.0,9.0,r/YUROP,nice.
660,35.0,911.0,4.0,r/attackontitan,AoT girls [art by しょぬ]
661,16.0,1800.0,8.0,r/BokuNoHeroAcademia,"[OC][Fanart] I colored my Deku art, hope you like it!"
662,20.0,435.0,3.0,r/fireemblem,Half the battle (Awkward Zombie_
663,18.0,569.0,5.0,r/mythologymemes,yes homo
664,36.0,432.0,4.0,r/5ToubunNoHanayome,New Merch Collaboration ft. The Driptuplets
665,12.0,1400.0,6.0,r/shittyrainbow6,Everybody has this Skin
666,93.0,1600.0,5.0,r/dataisbeautiful,[OC] My GF and I tracked the average effect of Video Games vs Average Heart Rate over the last 12 months
667,38.0,772.0,3.0,r/CozyPlaces,"pov: it’s snowing outside, your coffee is warm & you’re in for a day of games"
668,26.0,674.0,5.0,r/smashbros,New Smash Pic-of-the-Day! (12/27/2021) from @Sora_Sakurai
669,27.0,964.0,7.0,r/EnterTheGungeon,Sadge
670,34.0,2000.0,11.0,r/blursed_videos,Blursed_Imortality
671,162.0,1400.0,4.0,r/PoliticalHumor,Owning the libs by... owning your mom
672,32.0,918.0,5.0,r/battlestations,Orange is a nice color
673,26.0,2000.0,3.0,r/Hololive,Happy 2nd Anniversary Kaichou! o7
674,28.0,570.0,5.0,r/ConservativeMemes,What are y'all going to do once communism is achieved?
675,34.0,996.0,5.0,r/woodworking,My first shot at inlay work
676,36.0,581.0,6.0,r/Justfuckmyshitup,F I ? R C ?
677,18.0,608.0,6.0,r/WarshipPorn,A sad pic of HMS's Duke of York [1200x900]
678,37.0,1600.0,6.0,r/Konosuba,Wait a minute
679,76.0,2000.0,6.0,r/formula1,"Alain Prost, Gerhard Berger and Emerson Fittipaldi carrying Sennas coffin at his funeral"
680,33.0,3100.0,10.0,r/Minecraftbuilds,Thoughts on my recreation of the Nightingale portal!
681,29.0,629.0,6.0,r/Embroidery,Spent months recreating my boyfriend’s D&D map for him for Christmas! I’m still pretty amateur at embroidery but I’m super proud of how this turned out!
682,29.0,536.0,5.0,r/dune,I wanted to share with you this beautiful brazilian box of dune
683,32.0,2400.0,13.0,r/blender,"Dr. Strange style portal, Got a Greenscreen for Christmas, made this as a test"
684,33.0,367.0,2.0,r/PokemonUnite,A little something I made after scoring a last second goal
685,36.0,892.0,6.0,r/FortNiteBR,Run the Jules
686,33.0,2500.0,24.0,r/perfectlycutscreams,My helicopter people need me (sorry if repost)
688,27.0,731.0,3.0,r/vaxxhappened,The Herman Cain Seal of Approval.
689,33.0,1200.0,21.0,r/pics,They knew that very well
691,102.0,2700.0,7.0,r/therewasanattempt,To redeem money from a gift
692,17.0,1300.0,23.0,r/thisismylifenow,Let me fix your hair for you
694,33.0,685.0,4.0,r/dankinindia,High effort hai bro
695,21.0,445.0,3.0,r/TVDetails,Emily in Paris (2020) Actor doesn't even try. Lmao
696,26.0,3600.0,15.0,r/TheBoys,I posted my Homelander art on Instagram and Toni Starr himself commented on it! What a cool thing for him to do.
697,24.0,1200.0,6.0,r/ontario,Good morning Ontario
698,30.0,1500.0,11.0,r/gifsthatendtoosoon,yumy
699,30.0,893.0,7.0,r/Apandah,"""hey dad how was wor..."""
700,27.0,639.0,6.0,r/WarplanePorn,F-16 Takeoff [Video]
701,25.0,912.0,7.0,r/yakuzagames,He’s left the yakuza life and is a normal citizen now I swear
702,26.0,1100.0,9.0,r/spacefrogs,Hmmm
703,26.0,722.0,4.0,r/wow,My new Succubus doesn't do any DPS. Just sings and talks to critters a lot.
704,23.0,831.0,6.0,r/whitepeoplegifs,Incredible skills on 2 wheels
705,83.0,1200.0,3.0,r/ThatsInsane,How much we accomplished in just 66 years
706,25.0,1600.0,8.0,r/hmm,Hmm
707,16.0,3000.0,13.0,r/KenM,Ken M loves a good Christmas dinner with his family
710,26.0,643.0,5.0,r/TheWayWeWere,"Young couple posing for a portrait, Pittsburgh, late 1930s (photographed by Charles ""Teenie"" Harris)"
711,41.0,1700.0,3.0,r/Unexpected,newton’s third law
712,24.0,1600.0,10.0,r/Augenbleiche,Hirsch schießt und TOOR TOOOR TOOOR TOOR!!
713,18.0,557.0,4.0,r/savedyouaclick,Is Mount Everest really the tallest mountain on Earth? | Yes if measuring height above global mean sea level. No if measuring from base to peak (Mauna Kea is taller; it's partially under water)
714,18.0,1800.0,8.0,r/velvethippos,Dog Day Monday - Blue
715,15.0,767.0,4.0,r/BobsBurgers,Tiny baby Louise in S6E9 “Sacred Couch” is the cutest frickin thing
716,24.0,989.0,5.0,r/DnD,[Art]Ice Harpy Boss
717,20.0,634.0,4.0,r/GMEJungle,Love the smell of short attacks in the morning. You can taste their fear 😎💎🙌🏾🚀🌕
718,17.0,748.0,6.0,r/babybigcatgifs,Sharing is caring!
719,17.0,410.0,2.0,r/Kaiserreich,So turns out there’s a Custom Tag for Bhutan if you conquer the Himalayas.
720,25.0,669.0,6.0,r/osugame,"Utami | Aether Realm - The Sun, The Moon, The Star [Mourning Those Things I've Long Left Behind] 99.35% FC #2 | 826pp | 83.14 UR"
721,24.0,1800.0,9.0,r/Persona5,Queen by Chanch
722,7.0,1000.0,5.0,r/CuratedTumblr,blunder years
723,24.0,1700.0,8.0,r/Deltarune,Day 4 of modifying Starwalker: Suswalker
724,22.0,410.0,3.0,r/HaloMemes,Fred-104.jpg
725,24.0,1100.0,6.0,r/minecraftseeds,enclosed warm ocean covered in coral reef just west of spawn! seed: -404108749251477019 JAVA 1.18.1
726,22.0,2200.0,12.0,r/PeopleFuckingDying,MoNsTeR pRePaRiNg CaT fOr HiS dInNeR!
727,13.0,981.0,5.0,r/suddenlybi,I’m a male
728,24.0,418.0,4.0,r/esist,Love this!
729,23.0,1100.0,5.0,r/terriblefacebookmemes,Bro-
730,23.0,790.0,7.0,r/FIFA,Keeper runs into post (awful challenge)
731,23.0,964.0,6.0,r/PerfectlyCutBooms,"""You don't have the ba-"""
732,23.0,643.0,3.0,r/awesome,I’ve bath
733,23.0,603.0,2.0,r/2007scape,Me OMW to complete Recruitment Drive
734,15.0,351.0,3.0,r/victoria2,this what peak VIC 2 looks like
736,15.0,934.0,6.0,r/AdviceAnimals,"As an unphotogenic person, every time my picture is taken:"
739,17.0,2700.0,13.0,r/puns,Mind. Blown
740,18.0,2000.0,9.0,r/jacksepticeye,Ironic.
741,18.0,1300.0,9.0,r/Naruto,Happy Belated Birthday to the person whose clones can use susanoo! (Dec 24th)
742,17.0,888.0,4.0,r/golf,What it feels like sometimes
743,19.0,1400.0,9.0,r/Chonkers,"help, my cat has a hungry fainting"
744,51.0,1300.0,4.0,r/DunderMifflin,Steve carrell on the set right after his final shot on the series.
745,77.0,2100.0,4.0,r/Minecraft,"I know it's probably blasphemy, but I made the French Taunting scene out of Minecraft. Curse me if you will, but at least my mother wasn't a hamster, nor did my father smell of elderberries.."
746,18.0,670.0,7.0,r/JDM,Classic jdm picture. No laptops yet.
747,20.0,442.0,3.0,r/MemeVideos,Touch some grass
748,8.0,686.0,3.0,r/Memes_Of_The_Dank,Bruhh.
749,16.0,631.0,5.0,r/ralsei,Smug Dance
750,15.0,897.0,5.0,r/CatsStandingUp,Cat.
751,35.0,891.0,11.0,r/animegifs,[REQUEST] How much force is needed to shoot that marker from your butt?
753,170.0,4500.0,7.0,r/shitposting,Kevin
754,17.0,1100.0,8.0,r/okmatewanker,He can live with the Yanks for the rest of his life🤮🤢🤮
755,14.0,783.0,4.0,r/ShittyLifeProTips,"SLPT: Reduce your chance of getting covid by not showering before visiting friends and family, so that everyone will keep their distance from you"
756,72.0,1100.0,6.0,r/Warhammer40k,Finished the Howling Griffons fourth company!!
757,14.0,1100.0,6.0,r/darkestdungeon,_BILLY YES
758,15.0,869.0,7.0,r/animalsdoingstuff,Kitties just want belly rubs
759,15.0,632.0,5.0,r/TenseiSlime,Just finished the show and Clayman at Walpurgis reminded me of this meme.
760,15.0,394.0,3.0,r/FreckledGirls,Happy holidaze
761,14.0,398.0,2.0,r/boburnham,Just got my Inside CD and Bo left me a little message ☺️
762,14.0,628.0,5.0,r/MoldyMemes,A
763,14.0,544.0,5.0,r/rance,"Voilà où je passe mes vacances de Noël, comme un authentique rançais"
764,14.0,622.0,4.0,r/DarkViperAU,How DarkViperAU was created
765,15.0,878.0,5.0,r/PetTheDamnCat,I just cant
766,8.0,835.0,10.0,r/instantkarma,There was an attempt
768,18.0,1300.0,7.0,r/onejob,Maximum security
769,14.0,701.0,7.0,r/RATS,Some cuteness to fight seasonal depression!
770,14.0,968.0,7.0,r/blurrypicturesofcats,blurry picture of cats
772,40.0,1200.0,7.0,r/trans,I got a bunch of new dresses for Christmas and this is my favourite 😻
773,14.0,645.0,6.0,r/sabaton,Happy Birthdah Chris!
774,9.0,859.0,5.0,r/MostBeautiful,"The ancient Rock of Cashel upon snowfall, Tipperary, Ireland."
775,13.0,1300.0,4.0,r/shittymoviedetails,"In Spider-Man: No Way Home (2021), Dr. Strange wears a Columbia University hoodie under his robes. This is because he knew that Peter was rejected from MIT and wanted to rub it in that he got into a top school and Peter didn’t."
776,13.0,3800.0,13.0,r/SequelMemes,We're gonna crash
777,13.0,463.0,5.0,r/nier,Kaine [cosplay by Yumidun]
778,18.0,548.0,2.0,r/MakeMeSuffer,My Taxi driver was having a fun drive...
779,11.0,1100.0,6.0,r/2meirl42meirl4meirl,2meirl42meirl4meirl
780,35.0,1300.0,5.0,r/pokemon,"Apparently, if you press + on a Pokémon's page, it switches between one footprint and all of them."
781,13.0,753.0,5.0,r/HazbinHotel,"The year is nearing its end, fanart by artist Seely (@SeelApproved)"
782,130.0,9400.0,11.0,r/meme,There is another..
783,10.0,862.0,6.0,r/thomastheplankengine,saw this around 3am. i never played animal crossing
784,12.0,979.0,6.0,r/ArchitecturePorn,"Bled, Slovenia"
785,14.0,407.0,3.0,r/MadeMeCry,Toys R Us
786,79.0,5100.0,12.0,r/TrueOffMyChest,My mom broke life changing news to me 10 years after I figured it out.
788,33.0,1200.0,4.0,r/gifs,Doggy wont ever leave his home again
789,11.0,848.0,5.0,r/RoughRomanMemes,Who needs first or second hand sources anyways.
790,129.0,878.0,5.0,r/ClashRoyale,When you argue with a hog player
791,12.0,499.0,3.0,r/antifastonetoss,95% of Reddit on any topic ever.
792,10.0,590.0,3.0,r/HIMYM,I always loved this scene. This guy chose the right day to visit the Empire State building.
793,11.0,750.0,4.0,r/GME,DRSd 30 for my dad
794,7.0,714.0,4.0,r/DesignPorn,"Catton House, West Vancouver, Canada, designed by Arthur Erickson and Geoffrey Massey in 1967"
796,11.0,595.0,4.0,r/misleadingthumbnails,Rusty boat in the deep ocean.
798,10.0,537.0,5.0,r/ImaginaryCharacters,South Park Reimagined by Travis Davids
799,11.0,672.0,5.0,r/Pareidolia,"You would squint too, if you had to gobble up a traffic sign"
800,40.0,3300.0,7.0,r/greentext,Anon learns blizzard's secret
801,30.0,1100.0,4.0,r/lego,My brother received this from my mom yesterday for christmas. Told him it would take him a little while. Woke up to this this morning.
802,309.0,2600.0,6.0,r/mildlyinfuriating,Imagine paying taxes to get roads like this
803,10.0,565.0,5.0,r/thanksihateit,"Thanks, I hate it. ?. ?"
804,43.0,1400.0,5.0,r/Animemes,Turn off
805,11.0,1100.0,8.0,r/casualnintendo,The more you know.
806,4.0,743.0,5.0,r/CatsEnjoyingPets,More head scratchies for the best kitty around
807,22.0,1400.0,6.0,r/WatchPeopleDieInside,Something definitely broke
808,10.0,616.0,4.0,r/woooosh,He's a special one.
809,10.0,888.0,6.0,r/calvinandhobbes,My parents forced me to read when I was a child and I hated it until one day they gave me the Essential Calvin and Hobbes.
810,11.0,996.0,7.0,r/HalfLife,Although I guess some people would like to murder their coworkers...
811,115.0,5000.0,7.0,r/facepalm,Anti-vaxxers using potatoes. Uh huh....
813,83.0,2800.0,7.0,r/ich_iel,ich_iel
814,10.0,538.0,3.0,r/Catswithjobs,Freight inspector and official bridge monitor
815,33.0,1600.0,7.0,r/StardustCrusaders,I drew Zombie The World
816,9.0,711.0,5.0,r/offlineTV,When The Smartest Kid Takes Crack (Michael Reeves Compilation)
817,9.0,433.0,3.0,r/Superbowl,I was told to stop by over here! “Rainbow Owl” crossstitch
818,85.0,2700.0,9.0,r/pcmasterrace,Windows 9 is clearly better
819,116.0,811.0,3.0,r/IASIP,Never forget the fallen
820,9.0,526.0,5.0,r/DankMemesFromSite19,Making an SCP meme everyday for every SCP: Day [[866]]
821,8.0,442.0,4.0,r/ProperAnimalNames,Depressed Lettuce
822,8.0,1000.0,8.0,r/cursed_videomemes,Nfts
823,10.0,502.0,4.0,r/QuotesPorn,"""Its dark because you're trying too hard.""-Aldous Huxley [1080×1317]"
824,8.0,445.0,4.0,r/k_on,Feeding the nyan
825,8.0,478.0,4.0,r/PERSoNA,Takemi [art by n2w__ej]
826,8.0,584.0,5.0,r/torties,"I got This absolute cutie for christmas. We adopted her, and she already feels right at Home!"
827,10.0,1100.0,8.0,r/Angryupvote,Damnit man !!!!!
828,24.0,3500.0,8.0,r/HolUp,Meanwhile Cousins who just came back from their walk..
829,7.0,437.0,11.0,r/insanepeoplefacebook,This is how Genders SHOULD look!!
831,185.0,6400.0,10.0,r/Cringetopia,"As a member of the black community, I humbly decline"
832,5.0,920.0,6.0,r/AbandonedPorn,And here we see the duality of man… Utah [OC]
833,68.0,1400.0,6.0,r/IdiotsInCars,Exiting the freeway while racing
834,7.0,882.0,8.0,r/hermitcraftmemes,[What about Thor] Moon? Big
835,7.0,995.0,8.0,r/SkyrimMemes,Almost
836,7.0,971.0,8.0,r/MonsterHunter,MHRise Cosplay: Cassandra
837,7.0,626.0,6.0,r/AccidentalCamouflage,Dalmata Beach
838,4.0,786.0,5.0,r/Satisfyingasfuck,Amazing art
839,18.0,936.0,3.0,r/TIHI,"Thanks, I hate Guava Chawla"
840,7.0,1100.0,9.0,r/skamtebord,salad
841,6.0,440.0,3.0,r/TheDepthsBelow,So many turtles 😍
842,58.0,853.0,3.0,r/Genshin_Impact_Leaks,Qiqi's domain has been repurposed for the Potions event (via BLANK)
844,411.0,2300.0,7.0,r/PublicFreakout,Karen gets bad because woman moves her flower pot away from her own front door.
845,6.0,698.0,7.0,r/notmycat,Not my cat sitting outside my window around 9pm
846,5.0,421.0,4.0,r/BreadStapledToTrees,A Tiny Slice on American Beech
847,5.0,765.0,6.0,r/ofcoursethatsathing,Underground Houseplant Robot Fighting Ring
848,7.0,1300.0,3.0,r/wholesomememes,Good times :)
849,17.0,1600.0,4.0,r/oddlysatisfying,Video collage of a SpaceX launch.
850,23.0,1600.0,7.0,r/IllegallySmolCats,Roar loud little lion.
851,4.0,419.0,3.0,r/funnyvideos,Football Commentators In Real Life
852,5.0,593.0,5.0,r/dreamsmp,The two Arctic Empires
853,9.0,1600.0,7.0,r/starwarsmemes,Book of Boba Fett opening scene
854,44.0,1500.0,7.0,r/WhatsWrongWithYourDog,What's wrong with him?
855,151.0,1200.0,6.0,r/tifu,TIFU by thinking honey is spicy
856,179.0,855.0,3.0,r/wallstreetbets,This is what injecting hopium looks like.
857,32.0,997.0,4.0,r/formuladank,Gordon Murray was bonkers
858,4.0,1000.0,17.0,r/WinStupidPrizes,AA-
860,4.0,1200.0,9.0,r/EmpireDidNothingWrong,My oil painting of Darth Vader
862,3.0,387.0,2.0,r/submechanophobia,A ship lowering a deep sea oil pipeline
863,3.0,374.0,3.0,r/Animal_Sanctuary,"Bolt, the Egyptian fruit bat, quickly claiming his mango treat from his caretaker at Bat World Sanctuary"
864,3.0,388.0,3.0,r/sweden,Jakten efter svenska tacos till fredagsmyset här i Peru intensifieras
865,3.0,590.0,5.0,r/tuckedinkitties,My kitty Bjorn waiting for Santa
866,2.0,477.0,4.0,r/absolutelynotme_irl,absolutelynotme_irl
867,1.0,638.0,4.0,r/MEOW_IRL,MEOW IRL
868,297.0,1900.0,8.0,r/NoStupidQuestions,If you make macaroni and cheese with holy water does the macaroni and cheese become holy? If not which part of the process removes it's holiness?
869,193.0,2300.0,8.0,r/todayilearned,"TIL King Ferdinand VII of Spain had a huge member, so much in fact that it's rumored that one of his wives died of a hemorrhage derived from having sex with the monarch."
870,311.0,1900.0,7.0,r/CasualUK,Anyone else currently drowning in chocolate?
871,183.0,11500.0,14.0,r/whenthe,"You have good taste, my man"
872,275.0,2500.0,13.0,r/Damnthatsinteresting,This Is How Women Dressed In The Year 1896
875,129.0,13200.0,16.0,r/AnimalCrossing,I did this ACNH animation based on my winter trauma. Please enjoy 😊
876,140.0,1900.0,3.0,r/funny,I photoshopped an armadillo and a doe together
877,118.0,997.0,2.0,r/Tinder,For context she said she was learning French..
878,25.0,2600.0,10.0,r/Technoblade,Happens way too often :( (original technofanart in comments)
879,120.0,15000.0,22.0,r/tuckedinkitties,this must be so cozy
881,88.0,910.0,5.0,r/confidentlyincorrect,LinkedIn influences are on a whole different league
882,85.0,1000.0,6.0,r/gtaonline,Just 300 more
883,29.0,1500.0,7.0,r/science,"A significant proportion of U.K nurses were identified as having probable PTSD during the pandemic . While this declined over the three surveys, almost 29.3% continued to report experiences indicative of a probable post-traumatic stress disorder diagnosis 3 months after the first pandemic peak."
885,89.0,1700.0,9.0,r/awfuleverything,that's enough internet for the century
886,86.0,2300.0,5.0,r/politics,Alleged ‘dead’ Georgia voters found alive and well after 2020 election
887,37.0,1400.0,7.0,r/dankvideos,Reason why Men live shorter than women
888,65.0,2100.0,8.0,r/europe,"30 years today since the miracle at Gottröra (Scandinavian Airlines Flight 751) - Even though the airplane broke in three, there were no fatalites"
889,13.0,1300.0,4.0,r/suspiciouslyspecific,😔
890,83.0,712.0,3.0,r/LifeProTips,LPT: The *least* expensive part of owning a pet is buying the pet.
891,48.0,1300.0,7.0,r/TwoSentenceHorror,I was surprised by my ex-wife's nice gesture of sending me a box of chocolates for my 5 years of sobriety anniversary.
892,66.0,927.0,5.0,r/Grimdank,On a thread about kill team
893,93.0,1100.0,5.0,r/amcstock,I HOLD FOR 1m
894,110.0,1400.0,7.0,r/IndianDankMemes,Bruhh
895,47.0,655.0,3.0,r/Conservative,"“Alleged?” Hope Xi sees this, bro."
896,53.0,1100.0,5.0,r/natureismetal,Frog got caught in a flash freeze
897,27.0,3200.0,9.0,r/therewasanattempt,To catch the toy
898,49.0,4900.0,13.0,r/antimeme,It's a cow
899,63.0,651.0,3.0,r/DestinyTheGame,The 30th Anniversary ornament has finally let my Titan live his dream....of being covered in cats.
900,28.0,4700.0,13.0,r/Bossfight,"Dux, Obliteration of Boundaries, Protector of Egg"
901,77.0,893.0,3.0,r/nba,[Zach LaVine] reacts to recording his 65th 30-point game with the Bulls and being only 472 away from Michael Jordan's record: “😂😂Dude wasn’t real.”
902,53.0,7200.0,11.0,r/blursedimages,Blursed_Present
903,54.0,1300.0,4.0,r/titanfall,both are pretty cool
904,2.0,1500.0,8.0,r/BrandNewSentence,Someone please eat my brain spaghetti.
905,25.0,1100.0,8.0,r/oddlyspecific,It is pretty effective though
907,54.0,1900.0,7.0,r/news,"E.O. Wilson, naturalist dubbed a modern-day Darwin, dies at 92"
908,31.0,2300.0,8.0,r/lotrmemes,🤖
909,65.0,1100.0,4.0,r/OldSchoolCool,"Tennis fashion, 1978"
910,19.0,1200.0,7.0,r/itookapicture,ITAP of a Northern hawk owl
911,15.0,1400.0,5.0,r/cursedcomments,Cursed_wolverine
912,123.0,592.0,16.0,r/oddlyterrifying,Consider modern drones as a realistic candidate before you post a blurry video of a UFO from ground saying it moves goo fast.
914,1.0,403.0,4.0,r/ReasonableFantasy,Alice by Nature San light
915,59.0,496.0,2.0,r/MaliciousCompliance,Ex demands undercooked chicken; can’t understand how he got sick
916,19.0,3200.0,15.0,r/ImaginarySliceOfLife,Bokka Pass by のば
917,60.0,886.0,15.0,r/ANormalDayInRussia,Russians vs. the English language
919,16.0,805.0,8.0,r/Izlam,Siblingz unite!
920,131.0,520.0,5.0,r/Anarcho_Capitalism,"Is Reddit just a propagandist tool? My feed is littered with glaringly wrong, biased ‘news’ posts."
921,67.0,1100.0,9.0,r/Fallout,F*** that armed bottlecap mine in Starlight Drive-In
922,20.0,528.0,5.0,r/overlord,Clementine [OC]
923,144.0,668.0,7.0,r/ShuumatsuNoValkyrie,Chapter 57 - Shuumatsu No Valkyrie
924,43.0,490.0,5.0,r/PokemonROMhacks,[MAP] Pokémon Giratina's Legend - Ethereal City
925,15.0,312.0,3.0,r/BuyItForLife,Sunbeam Mixmaster still making cakes
926,49.0,1100.0,10.0,r/xqcow,x & marty ACTUAL duo of the year
927,39.0,4200.0,17.0,r/funny,I don’t understand the appeal
929,23.0,371.0,4.0,r/stalker,Mr. Incredible becoming uncanny (S.T.A.L.K.E.R Edition)
930,56.0,1900.0,13.0,r/DotA2,GabeN really thought he could fool me…
931,15.0,669.0,7.0,r/TarkovMemes,Me as a Scav trying to befriend a thicc PMC
932,10.0,1600.0,12.0,r/Re_Zero,[Media] Ram Mondays #94
933,4.0,524.0,5.0,r/woof_irl,woof irl
934,139.0,491.0,2.0,r/Deltarune,"i had a lot of fun drawing new Berdly's dialogue sprites, so now i'm asking you to give me any cosplay ideas for Kris! (i'll choose the most interesting suggestions from your comments)"
935,204.0,465.0,5.0,r/Seattle,Were you a part of that incredible shit show that was SeaTac yesterday? What's your story?
936,168.0,422.0,4.0,r/portugal,O meu vizinho é inspetor das finanças e é corrupto.
937,133.0,3500.0,15.0,r/BoneAppleTea,Maternity Leaf 😅
938,49.0,394.0,4.0,r/pokemongo,"At long last, it’s finally done. Caught a Kabuto, and now I’m free!"
939,8.0,876.0,6.0,r/oddlyspecific,"Meanwhile, in another dimension"
940,293.0,1500.0,11.0,r/EscapefromTarkov,My buddy has an Altyn & a slick
941,12.0,545.0,6.0,r/notdisneyvacation,How to Have Fun at a Party Where Everyone Is Getting Drunk
942,57.0,477.0,5.0,r/chile,/r/chile in a nutshell
943,44.0,1100.0,4.0,r/formula1,James Hunt and Niki Lauda just casually having lunch while sitting in the sidepod of a Ligier.
944,29.0,831.0,8.0,r/WritingPrompts,"[WP] ""BE NOT AFRAID"" said the multi-eyed, feather-winged being. ""Sir, this is a Wendy's"" sighed the baggy-eyed, tired cashier."
945,24.0,1700.0,12.0,r/PetsareAmazing,Gentle Giant with his Tiny Friend!
947,167.0,5100.0,18.0,r/loseit,Any “weight gain” after a single holiday meal is poop and water retention. You didn’t “gain” multiple pounds of body fat. You’re fine.
948,30.0,350.0,3.0,r/pansexual,"decided to cut my hair off, how do you guys like it?"
949,43.0,438.0,5.0,r/DDLC,You are wonderful
950,183.0,666.0,4.0,r/TwoXChromosomes,"More women than men feel uncomfortably cold at the office, and it’s impacting their work performance"
951,28.0,550.0,6.0,r/Destiny,The Match of the Century
952,81.0,4600.0,17.0,r/redneckengineering,PVC pipe bazooka ignites bonfire
953,15.0,389.0,4.0,r/cakedecorating,A cute cake for the birthday girl! :)
954,40.0,795.0,5.0,r/ffxiv,I made a little Fat Cat ( ˙꒳​˙ )
955,381.0,2500.0,14.0,r/ApexOutlands,Who is this? Wrong answers only.
956,230.0,21600.0,11.0,r/shitposting,I am 14 and this is deep
