Unnamed: 0,comment_count,upvote_delta,timeup_list,subreddit,thread_text
0,32400.0,42300.0,16.0,r/AskReddit,Whats criminally overpriced to you?
1,13300.0,5500.0,15.0,r/Wallstreetsilver,"FREE SILVER GIVEAWAY on REDDIT ... 15oz of SILVER FREE !!! Just comment why you love Silver and upvote this post. We will select 6 winners. 1st place gets 10oz End The Fed bar, 5 runner-up winners will get 1 oz WSS round! Contest ends New Years Eve at Midnight eastern time! 🚀"
2,1900.0,21600.0,7.0,r/HermanCainAward,Gratitude
3,152.0,13200.0,6.0,r/aww,Bucky Barnes
4,172.0,12900.0,6.0,r/MadeMeSmile,Goals.
5,983.0,19600.0,7.0,r/Damnthatsinteresting,"During the late 1800s through the early 1900s, physicians administered pelvic massages involving clitoral stimulation by early electronic vibrators as treatments for what was called female hysteria."
6,8900.0,23800.0,12.0,r/teenagers,I'll Do My Best To Reply To Everyone
7,423.0,21100.0,7.0,r/clevercomebacks,Hes on point
8,961.0,23500.0,6.0,r/memes,And...let the argument begin!
9,6800.0,123000.0,12.0,r/news,Ghislaine Maxwell found guilty in sex-trafficking trial
10,4300.0,39600.0,11.0,r/politics,"Marjorie Taylor Greene calls it ""wise"" to bar Democrats who move to red states from voting"
11,337.0,8400.0,6.0,r/todayilearned,"TIL About the ""murder bottle"". Many Victorian mothers would use a self feeding bottle to give their babies milk instead of breastfeeding. These bottles were made of earthenware & glass & were incredibly hard to clean which caused severe bacteria build up & caused the deaths of thousands of babies."
12,253.0,8800.0,5.0,r/funny,My girlfriend and I fought and didn’t talk for 3 days so I sent her an Amazon gift with this as the message.
13,387.0,12000.0,7.0,r/CrappyDesign,Folding The Second-row Seat In The New Cadillac Escalade
14,4000.0,91300.0,13.0,r/WhitePeopleTwitter,Poor Joe.
15,3500.0,28100.0,12.0,r/TikTokCringe,When you put it like that!
16,2300.0,20800.0,8.0,r/antiwork,"If people age 18 - 40 can't afford to partner, purchase a home, and raise a family, there will not be another generation."
17,130.0,33200.0,18.0,r/iamatotalpieceofshit,Covid Positive Woman attends Anti-Vaccine Rally in NYC
18,2500.0,7600.0,15.0,r/AskMen,What do you tell your partner when she is having an orgasm?
19,217.0,9100.0,6.0,r/interestingasfuck,How Japanese vehicles came to Russia 😮
20,2300.0,56900.0,17.0,r/worldnews,Kazakhstan completely abolishes death penalty
21,100.0,9900.0,7.0,r/Art,"Orange, me, digital, 2021"
22,290.0,15500.0,7.0,r/shitposting,right click
23,2200.0,34100.0,7.0,r/pics,Boy praying in front of missing children poster at Walmart
24,116.0,13100.0,8.0,r/BlackPeopleTwitter,9 out of 10 shoppers can't tell the difference
25,2000.0,11100.0,20.0,r/Warhammer40k,Goes straight through you. New Tau rules.
26,2100.0,36100.0,16.0,r/Wellthatsucks,Got a chef's knife for Christmas
27,2000.0,24500.0,13.0,r/Cringetopia,"""What if I danced half naked with my child for likes"""
28,2000.0,69400.0,15.0,r/mildlyinfuriating,My father forgot to tell me the renovations would be taking the stairs out today.
29,1900.0,6100.0,10.0,r/unpopularopinion,City people ruin small towns
30,1100.0,17400.0,8.0,r/LifeProTips,"LPT: You don't have plot armour. Stop speeding. Stop drinking too much. Stop doing drugs. You can die, super easily and meaninglessly. Don't let that be your story."
31,1800.0,49300.0,12.0,r/dankmemes,Approved by my Latino friends
32,217.0,39500.0,9.0,r/Unexpected,He did get a haircut tho
33,1400.0,19600.0,9.0,r/worldnews,"Looming mass extinction could be biggest 'since the dinosaurs,' says WWF: More plants and animals than ever before are on a global list of threatened species, with the World Wildlife Fund Germany warning that more than 1 million species could go extinct within the next 10 years."
34,1700.0,23600.0,15.0,r/movies,"The Warner Bros. release schedule worked. HBO Max acquired 45 million subscribers in 2021, making it the tenth most-downloaded app of the year."
35,1700.0,33300.0,18.0,r/nottheonion,"Patriots fans among saddest, most miserable in NFL, new survey reveals"
36,1500.0,4900.0,15.0,r/CFB,"Ohio State QB CJ Stroud on SoCal kids going out of state: ""You go to USC & UCLA games, and quite honestly, it's just kind of boring. Without all the people. They kind of just are there on vacation. You go to the other schools out of state & their fans are kind of like fanatics."""
37,1600.0,64200.0,12.0,r/technicallythetruth,"$500 to $160,000 with NFT"
38,205.0,9300.0,7.0,r/natureismetal,This rock that looks like a severed head
39,1500.0,65500.0,18.0,r/shittymoviedetails,"In the movie Don't Look Up, Leonardo DiCaprio is shown married to a woman who's in her mid 40s . This confirms that the movie is sci-fi because it's impossible for DiCaprio to be with a woman if shes over 25."
40,193.0,9300.0,7.0,r/nevertellmetheodds,"Ball spots itself at the 20 for the touchback, after a kickoff ""into"" the end zone"
41,1400.0,6600.0,14.0,r/hockey,Report: IIHF cancels remainder of 2022 world juniors due to COVID-19
42,1500.0,28300.0,18.0,r/IdiotsInCars,Everybody has a plan until they get punched in the mouth.
43,1400.0,3400.0,13.0,r/SquaredCircle,(Fightful) Toni Storm released by WWE
44,183.0,10300.0,8.0,r/FoodPorn,My dad made a Sausage McMuffin and we just had to admire it [OC]
45,1400.0,30200.0,20.0,r/tifu,TIFU by taking a job beyond my capabilities and I owe over $4k
46,193.0,5800.0,5.0,r/Showerthoughts,"Maybe dogs don’t really like belly scratches, they just like getting their nipples played with."
47,1300.0,22100.0,17.0,r/marvelstudios,‘Spider-Man: No Way Home’ Domestic Box Office Flies Past ‘Rise Of Skywalker’ Final $515.2M Total; Sony’s Best Ever Worldwide Total At $1.16B
48,642.0,21400.0,9.0,r/WhitePeopleTwitter,All of em
49,476.0,11800.0,8.0,r/pokemon,I created a tool that randomizes the entire map of Pokemon Platinum (Emerald supported too!)
50,74.0,8300.0,7.0,r/BikiniBottomTwitter,Walk of shame
51,1200.0,4400.0,16.0,r/unitedkingdom,J.K. Rowling tops ‘Person of the Year’ award poll — and it’s quickly closed
52,38.0,5900.0,6.0,r/StartledCats,The Tango cat
53,412.0,10100.0,6.0,r/teenagers,I pulled this with the money from a gamestop giftcard😎😎😎
54,1200.0,22800.0,10.0,r/PoliticalHumor,"Guess who was just convicted on 5 counts, inspite of donald's well wishes..."
55,1400.0,9500.0,18.0,r/gadgets,"Apple ditched Intel, and it paid off"
56,1100.0,4400.0,6.0,r/nba,"[Post Game Thread] The Memphis Grizzlies (22-14) defeat the Los Angeles Lakers (17-19), 104 - 99"
57,205.0,37300.0,10.0,r/wholesomememes,New Year Blessings
58,1300.0,28600.0,12.0,r/facepalm,And people follow him?
59,547.0,10200.0,9.0,r/marvelstudios,I wonder why this 3 year old tv show is suddenly in the top 10?
60,1200.0,25700.0,16.0,r/science,Substantial weight loss can reduce risk of severe COVID-19 complications. Successful weight-loss intervention before infection associated with 60% lower risk of severe disease in patients with obesity.
61,1200.0,12400.0,20.0,r/explainlikeimfive,"ELI5 If boiling water kills germs, aren't their dead bodies still in the water or do they evapourate or something"
62,228.0,10300.0,8.0,r/HumansBeingBros,Guy saves his friend after he gets completely buried by snow
63,66.0,8300.0,7.0,r/ShitPostCrusaders,LEGO Stop Motion - Josuke Learns Not To Trust Paper
64,140.0,8600.0,8.0,r/PrequelMemes,I think you mean why Senate
65,294.0,3900.0,5.0,r/mildlyinteresting,"Saw this… car??? the other night in Glendale, CA"
66,1300.0,28100.0,13.0,r/Whatcouldgowrong,WCGW tackling a harmless snowman
67,1300.0,79400.0,13.0,r/interestingasfuck,Dam breach experiment
68,286.0,24700.0,10.0,r/Eyebleach,This is what a baby platypus looks like.
69,188.0,5100.0,6.0,r/marvelmemes,NWH Reality Kicked Expectations BUTT!
70,1200.0,29400.0,12.0,r/PublicFreakout,One year later: follow-up on puppy thrown by crazy woman at man
71,146.0,7700.0,8.0,r/YouShouldKnow,"YSK if you enjoy cooking with lots of spices, local Asian/Indian/foreign grocery stores tend to have spices at much lower prices and at greater quantities than traditional grocers that only sell things like McCormick"
72,1000.0,41500.0,16.0,r/tumblr,Goodverdamt
73,781.0,40900.0,11.0,r/nextfuckinglevel,Guy make a house model with lego and cucumbers
74,1100.0,22900.0,21.0,r/PublicFreakout,Let me educate him
76,1200.0,23700.0,11.0,r/PoliticsPeopleTwitter,Idiots will idiot
78,70.0,7200.0,8.0,r/greentext,Anon goes to a New Years party
79,1100.0,24600.0,13.0,r/wallstreetbets,US govt after Elon pays $11 billion in taxes
80,339.0,34900.0,11.0,r/NatureIsFuckingLit,🔥 Baby deer notices a person filming and starts strutting.
81,1100.0,29000.0,15.0,r/awfuleverything,Artists not being able to share their artwork online due to NTFs
82,1100.0,10800.0,15.0,r/skyrim,What the hell is that?
83,946.0,14200.0,12.0,r/TrueOffMyChest,I kicked my brother and his wife and kids out of my home after I found a hidden camera in my living room.
84,1000.0,21300.0,13.0,r/SelfAwarewolves,"""We have Putin on our side"" -conservatives"
85,1100.0,44000.0,14.0,r/aww,my cat has a whisker growing out of the top of her head
86,134.0,6900.0,8.0,r/Awwducational,"Hippos were thought to ‘sweat blood’. A thick red substance containing hipposudoric acid, which is red, and norhipposudoric acid, which is orange oozes from glands over its skin helping to control body temperature , and acting as a sunscreen and antibiotic."
87,1100.0,2000.0,11.0,r/Bitcoin,I read a lot of posts early this year about Bitcoin on track to 100k by end of year and everyone seemed super confident. Well here we are....wtf happened?
88,1100.0,8200.0,17.0,r/Justrolledintotheshop,Working on a windshield on a truck and it has these plastic pieces on the lugnuts. I’ve worked on lots of trucks and cars but never seen them before any ideas?
89,278.0,23400.0,11.0,r/oddlyterrifying,Imagine falling in
90,241.0,8400.0,6.0,r/Unexpected,The variety of martial arts techniques used in the first Matrix movie is absolutely breathtaking
91,297.0,4300.0,6.0,r/facepalm,I got Transvaccinated.
92,157.0,10700.0,10.0,r/NonPoliticalTwitter,WTF
93,1000.0,10300.0,16.0,r/NoStupidQuestions,Should I delete videos of my dead friend off my phone
94,137.0,6000.0,8.0,r/cats,"We couldn’t find Peggy, our indoor cat. We started to panic, then looked out the front door."
95,1300.0,1700.0,4.0,r/gaming,"For me its Agent 47, so ofc I am fucked"
96,186.0,4900.0,7.0,r/Hololive,Hololive Comic: The Fall of Atlantis
97,990.0,7000.0,17.0,r/PS5,"PlayStation Plus games for January: Persona 5 Strikers, Dirt 5, Deep Rock Galactic"
98,796.0,25600.0,10.0,r/funny,Mr. Beaver doesn’t want anyone in his water.
99,877.0,15600.0,11.0,r/mildlyinteresting,The Quantity difference in wins vs losses in $1000 worth of scratch-off tickets.
100,328.0,12700.0,8.0,r/MadeMeSmile,Sometimes we need a bit of advice from the past
101,64.0,7800.0,8.0,r/rareinsults,I mean he’s not wrong
102,878.0,15600.0,17.0,r/trashy,"Methany, Bethany and Crystal all in one place boyzz"
103,118.0,4400.0,7.0,r/lotrmemes,LotR characters according to my 2-year old (not comprehensive)
104,922.0,18300.0,15.0,r/instant_regret,Trying to lift weights without a spotter
105,774.0,2100.0,14.0,r/masseffect,"Ashley's writer's take on her ""racism"""
106,671.0,1900.0,10.0,r/relationship_advice,My [29f] recently engaged friend [29f] implied I wasn't engaged because my boyfriend [31m] doesn't actually want to get married after being together 3 years. And I'm upset because I'm scared she's right.
107,714.0,13900.0,10.0,r/HolUp,I don’t think I’ve ever seen this Spider-Man movie
108,808.0,1900.0,13.0,r/france,Covid 19.. .on a perdu
109,907.0,11000.0,13.0,r/food,[i ate] Chicago style hot dog
110,96.0,6800.0,9.0,r/hmmm,hmmm
111,684.0,18900.0,15.0,r/dndmemes,You can’t tell me otherwise
112,829.0,23600.0,14.0,r/MurderedByAOC,Just tell him it's a drilling permit
113,160.0,12300.0,11.0,r/perfectlycutscreams,Happy 2020 too!
114,547.0,30700.0,12.0,r/agedlikemilk,I’ve never met a single adult without one
115,325.0,12600.0,12.0,r/space,Webb’s Deployable Tower Assembly Successfully Extends in Space!! Next up: Aft Moment Flap deployment followed by Sunshield Cover Release
116,783.0,7100.0,18.0,r/pcgaming,Microsoft / Xbox Game Studios have become one of the biggest publishers on PC / Steam with 3 of the Top 10 highest Gross Revenue games of the year in 2021 being 1st party releases
117,2800.0,10300.0,12.0,r/shitposting,Cope
118,60.0,8900.0,10.0,r/meirl,Meirl
119,306.0,9400.0,10.0,r/dndmemes,"Damn nature, you scary! (Don't piss off the Druids)"
120,71.0,4000.0,7.0,r/comics,I know
121,50.0,3900.0,7.0,r/me_irlgbt,me_irlgbt
122,651.0,19400.0,13.0,r/ProgrammerHumor,I'm gonna need you to send over those deets by the weekend.
123,852.0,63600.0,17.0,r/me_irl,me_irl
124,796.0,7400.0,16.0,r/Futurology,"China will set up a research base on the moon by around 2027, eight years earlier than previously scheduled, space authority deputy director says"
125,735.0,3600.0,14.0,r/stocks,To all of you who are red this year while the S&P500 is up 30%
126,95.0,4600.0,8.0,r/TheLastAirbender,Azula’s conversation about the tides perfectly sums up and introduces the character. You can tell right away that she’s going to be a problem.
127,595.0,7900.0,15.0,r/videos,When you recognise someone by their voice featuring Gillian Jacobs & Will Shortz
128,833.0,19800.0,12.0,r/lgbt,"Getting it updated was a bureaucratic nightmare, but the little piece of plastic does feel great."
129,783.0,55400.0,14.0,r/maybemaybemaybe,Maybe Maybe Maybe
130,731.0,1800.0,12.0,r/books,Did anyone actually enjoy “Lord of the Flies”?
131,728.0,34100.0,15.0,r/technology,"After the Facebook whistleblower came forward, the company reportedly tried to discredit her reputation among politicians"
132,188.0,18400.0,11.0,r/whenthe,easy money
133,624.0,6000.0,6.0,r/MadeMeSmile,I shall protect
134,627.0,9400.0,20.0,r/Bad_Cop_No_Donut,‘Suspicious’: Dallas Detectives Seize $100k from Woman at Airport Without Charging Her With a Crime
135,210.0,20700.0,13.0,r/AnimalsBeingJerks,"hahaha, they thought this water would prevent me from entering"
136,504.0,4100.0,13.0,r/LivestreamFail,Veibae goes off on a juicer
137,643.0,11100.0,14.0,r/ToiletPaperUSA,American brainrot is FUCKING WILD
138,58.0,7300.0,10.0,r/rarepuppers,Fun fact: Cheetahs can blep too
139,656.0,5200.0,17.0,r/holdmyfeedingtube,HMFT after I cut a turn and hit a longboarder
140,178.0,9700.0,12.0,r/woodworking,Secret storage on a dresser I’m building
141,683.0,31900.0,14.0,r/cats,This sweet lady was dumped at the lake today. Coldest day of the year.
142,589.0,47300.0,15.0,r/WitchesVsPatriarchy,-snort- true though
143,467.0,25400.0,14.0,r/UpliftingNews,Italy Votes to Ban Fur Farming and Shut Down Mink Farms
144,202.0,13000.0,12.0,r/mildlyinfuriating,My Gym is trying to catch a Phantom Pisser
145,90.0,6100.0,10.0,r/AbsoluteUnits,This wolf
146,660.0,44700.0,13.0,r/NatureIsFuckingLit,"🔥 This is RD Dhanani's daily drive to work. Banff, Alberta. 15 December 2021. No editing, no filters. Simply Stunning!"
147,101.0,2600.0,5.0,r/Animemes,"check it out guys, I swear it's good!"
148,536.0,12600.0,15.0,r/starterpacks,Terorize public starter pack
149,489.0,6700.0,12.0,r/halo,Wanna give a quick shoutout to the Spirit of Fire for actually putting up a hell of a fight against the Banished after being decades in cryosleep
150,94.0,4200.0,8.0,r/KidsAreFuckingStupid,“I promise I didn’t cut my hair”
151,556.0,21900.0,13.0,r/WatchPeopleDieInside,I guess he's not a fan!
152,474.0,3800.0,9.0,r/confidentlyincorrect,Sure it’s a normal variation in human sexuality.
153,2200.0,55600.0,12.0,r/antiwork,Foreign concept today
154,121.0,6000.0,12.0,r/greentext,Anon has had enough
155,586.0,6500.0,13.0,r/apexlegends,Down to four squads remaining. Which do you pick and why?
156,468.0,1200.0,5.0,r/Genshin_Impact_Leaks,2.5 Reruns and Story from Zluet
157,336.0,17900.0,13.0,r/cursedcomments,Cursed_Hamster
158,471.0,11800.0,12.0,r/pcmasterrace,"For those that don't browse/help this sub's ""/new"" here's 90% of what you're missing:"
159,491.0,14300.0,19.0,r/Spiderman,“Peter Parker has a genius-level intellect”
160,443.0,7600.0,12.0,r/playboicarti,Ah hell Naww she did him dirty bro lmaoo 😭😭 mf gotta change name and start life over dawg 💀💀
161,317.0,2300.0,10.0,r/IASIP,"[Question] As a non-American, I was always curious what 'milk steak' is. Did Charlie make it up or Does it really exist?"
162,142.0,4100.0,8.0,r/ForzaHorizon,"Was using drone to try and find a barn find, instead found a dude rippin' it."
163,511.0,4700.0,18.0,r/Music,"Vinyl sets new weekly sales peak for modern era: 2.11 million vinyl albums were sold in the week ending December 23, making it the biggest vinyl sales week since at least 1991"
164,428.0,8100.0,17.0,r/freefolk,Of course I remember who they all are!
165,60.0,5300.0,9.0,r/harrypotter,Meme I made:
166,286.0,3500.0,5.0,r/interestingasfuck,"For the First Time in History, Ancient Egyptian Coffins that were sealed 2,600 years ago have been opened."
167,467.0,5400.0,18.0,r/PixelArt,/r/PixelArt Update: NFT Posts Are Now Banned
168,524.0,12100.0,9.0,r/oddlyterrifying,Being woken up by a pack of wolves in the middle of the desert
169,209.0,9400.0,11.0,r/WinStupidPrizes,Messing around with scissors and electricity
170,267.0,4700.0,9.0,r/byebyejob,bummer joe
171,495.0,6300.0,15.0,r/MoldyMemes,N
172,445.0,3900.0,18.0,r/onguardforthee,Vancouver performance by unvaccinated superstar podcaster Joe Rogan has been cancelled
173,520.0,12100.0,16.0,r/CrazyFuckingVideos,An election worker in Russia places balloons in front of a camera before they begin ballot counting.
174,115.0,6900.0,8.0,r/Damnthatsinteresting,A Korean news program actually films atop a building instead of using a green screen.
175,456.0,2900.0,14.0,r/Cooking,"My MIL asked for my recipe for ""corn dip"""
176,90.0,2800.0,7.0,r/gayspiderbrothel,Reddti moment😎
177,302.0,17000.0,12.0,r/pics,"The people on my mail route shovel between houses for me which is so kind, and very appreciated."
178,560.0,38300.0,15.0,r/PrequelMemes,Something something “this is outrageous” something something “visible confusion”
179,105.0,2700.0,6.0,r/Warframe,Lego Liset - I serve the Operator above all else. It defines me
180,3400.0,7000.0,10.0,r/AskReddit,Whats the worst part of ejaculating?
181,335.0,31500.0,19.0,r/MovieDetails,"In Mean Girls (2004), Tim Meadows, who plays Principal Duvall, broke his wrist a week before filming started and had to wear a cast. This was written into the movie as Principal Duvall suffering from carpal tunnel syndrome."
182,465.0,2600.0,11.0,r/MMA,The Championship Power of Francis Ngannou
183,32.0,5000.0,9.0,r/AnimalsBeingDerps,This is what peak performance looks like
184,508.0,18200.0,19.0,r/AbsoluteUnits,"This is Peter Freuchen, a Danish explorer. He completed a 1000km dogsled journey and was trapped in an avalanche, he escaped with a knife made from his own frozen feaces. He killed a wolf with his bare hands, fought against the Nazis and escaped a POW camp."
185,344.0,3000.0,7.0,r/Coronavirus,"The U.S. breaks its single-day case record, nearly doubling the highest numbers from last winter."
186,233.0,4800.0,9.0,r/formula1,"Well that’s a crazy stat, Jim Clark was on a different level!"
187,379.0,2000.0,14.0,r/Advice,My husband purposely killed my dog
188,495.0,25400.0,14.0,r/Bossfight,"Zombie shark, eater of the dammed, survivor of disaster’s."
189,47.0,2700.0,7.0,r/Baking,"I didn’t make this, my husband did. It took him all day & he doesn’t post on Reddit only lurks. I think this deserves a few upvotes 🥳"
190,458.0,4000.0,11.0,r/ufc,Chito’s response to Sean’s YouTube video. We need to see this rematch
191,471.0,6800.0,17.0,r/battlefield2042,Battlefield 2042
192,145.0,7400.0,19.0,r/The8BitRyanReddit,"Thanks I hate this, weirdly satisfying, spider vibing"
194,95.0,3400.0,5.0,r/Showerthoughts,"Dreams make zero sense, while one part of the brain is making up a vivid story, another part of it is experiencing and genuinely being suprised by what it is seeing."
195,302.0,16600.0,14.0,r/Tinder,He found me from tinder… I’m laughing
196,230.0,5300.0,10.0,r/NoStupidQuestions,"Can I advertise my house as being ""made with real cheese"" if I mixed a tablespoon of Parmesan into over the cement for the foundation? Or does it have to be a certain percentage before I can say that."
197,186.0,6000.0,11.0,r/baseball,Drawing Mike Trout every day until the lockout is over. Day 26.
198,30.0,2300.0,6.0,r/anime_irl,anime_irl
199,479.0,1600.0,12.0,r/fantasyfootball,"The Vikings-Packers game is expected to be 5 degrees at kickoff. The average NFL passing game over the last 8 years in single-digit weather or colder: 16 completions, 160 yards, 0.3 touchdowns."
200,301.0,10000.0,12.0,r/BeAmazed,Greatest thing about spider man
201,137.0,4700.0,10.0,r/CozyPlaces,"My cozy place in Seattle, WA this morning"
202,373.0,5200.0,17.0,r/europe,"A police officer issuing a woman a ticket for wearing a bikini on a beach at Rimini, Italy, in 1957."
203,239.0,2500.0,6.0,r/Genshin_Impact,Shenhe Character Details
204,368.0,19500.0,22.0,r/FUCKYOUINPARTICULAR,"Fuck you, Louisiana"
205,456.0,13600.0,20.0,r/SweatyPalms,Glass Bridge in China Breaks During High Winds
206,448.0,5400.0,24.0,r/WhitePeopleTwitter,"Who’s in with me for pushing this for Seattle, King County and Washington state?"
208,251.0,2600.0,12.0,r/fuckcars,Fuck… um… carts?
209,235.0,4500.0,14.0,r/destiny2,"How do you look at this and honestly think “Yeah, that’s who will make my wishes come true without any repercussions”"
210,432.0,1000.0,9.0,r/pathofexile,"Since February will be stacked with big game releases, GGG will surely come in clutch with some big changes to pull back players"
211,385.0,1800.0,6.0,r/Genshin_Impact,"Character Teaser - ""Shenhe: Lonesome Dream"" | Genshin Impact"
212,270.0,5100.0,8.0,r/PoliticalHumor,The sound of crickets in Florida right now is DEAFENING
213,33.0,3700.0,8.0,r/oddlysatisfying,Pakistani-American artist Anila Quayyum Agha creates sculptures from intricately cut steel illuminated by a single light source - filling rooms with ornate patterns of light and shadow.
214,75.0,3900.0,8.0,r/IdiotsInCars,"There's a perfectly good turn lane, but..."
215,156.0,12300.0,10.0,r/nextfuckinglevel,That backflip landing got me
216,211.0,4100.0,11.0,r/raimimemes,"What are you planning, Parker"
217,161.0,3000.0,7.0,r/terriblefacebookmemes,I'm shitting myself
218,322.0,14600.0,13.0,r/FuckYouKaren,when you can't understand that other languages exist
219,527.0,8000.0,15.0,r/Minecraft,"My friend died in the nether and lost all his stuff, so i did some mining and got him new stuff. What else could I add?"
220,289.0,15500.0,13.0,r/coolguides,How to know if you're hungry or just thinking you're hungry
221,313.0,9100.0,18.0,r/MaliciousCompliance,Wanna show up drunk to an Ice cream shop and order 15 cones? Sure!
222,290.0,1500.0,10.0,r/BabyBumps,Watched a woman give birth in the waiting room y’all!!!
223,328.0,3700.0,15.0,r/pettyrevenge,I got my ex dishonorably discharged
224,276.0,3200.0,8.0,r/Genshin_Impact_Leaks,Yae in Liyue
225,261.0,3600.0,14.0,r/bestof,"u/timtom2211 distills the essence of how doctors feel when ""we tried but insurance won't pay for it"" means the patient is going to die"
226,165.0,4700.0,8.0,r/WhitePeopleTwitter,Now you know !!!
227,68.0,1600.0,4.0,r/IndianDankMemes,Let's Rewind!
228,971.0,41800.0,14.0,r/gaming,switch wins
229,360.0,7500.0,14.0,r/leagueoflegends,"When Your Top Laners Name Is ""Shen"", Your Screen Suddenly Changes Colour And You Get A Big Fucking Shield That Fills Half Of Your HP Bar Please Run INTO The Enemy And Not AWAY"
230,262.0,16300.0,21.0,r/MadeMeSmile,Very Wholesome!
232,401.0,7400.0,19.0,r/peopleofwalmart,Little boy at Walmart praying in front of a missing children sign
233,480.0,1000.0,6.0,r/CryptoCurrency,"Justin Sun is publicly dumping over 160,000 ETH on Binance. He became massively rich selling snake oils like Tron, BTT, SUN shitcoins to the public"
234,129.0,5100.0,12.0,r/titanfall,what's this in relics skybox
235,315.0,2600.0,12.0,r/insaneparents,Announced my elopement to my parents on Christmas. Did not go as planned. More info in comments.
236,167.0,4000.0,10.0,r/TwoXChromosomes,Ghislaine Maxwell has been found guilty!
237,445.0,2500.0,8.0,r/StupidFood,The cameraman tho
238,357.0,2900.0,20.0,r/PublicFreakout,A kid gets trampled by The Queen's Guard
240,43.0,1600.0,4.0,r/PewdiepieSubmissions,"Japan better open the border (just kidding, but it would great if they actually do it)"
241,98.0,3000.0,8.0,r/lifehacks,Easy life hack to walk someone (or yourself ) through a panic attack
242,28.0,2100.0,2.0,r/memes,Perhaps the opposite gender
243,388.0,7700.0,15.0,r/OnePiece,One Piece has become too repetitive lately.
244,202.0,7600.0,18.0,r/deadbydaylight,"She infact, did not have DS."
245,198.0,2000.0,8.0,r/antiMLM,I’m a garbage lady and just picked this up… I don’t want to know how much this would of cost
246,100.0,7600.0,10.0,r/aww,where's your mama
247,89.0,2200.0,6.0,r/reddeadredemption,Bruh moment
248,289.0,10600.0,17.0,r/Gamingcirclejerk,Cock and balls sorcery sounds interesting tbh.
249,47.0,2500.0,7.0,r/IllegallySmolCats,This is little Vanilla Bean
250,109.0,3200.0,11.0,r/ClashRoyale,My little cousin sent this to me and asked if i can contact Supercell and ask them if they can add this card . Bro what do i say to lil dude 💀
251,401.0,3600.0,7.0,r/nba,The Celtics shot 4-42 from 3 point land tonight
252,146.0,13600.0,14.0,r/lego,Brick Army Knife
253,275.0,5300.0,18.0,r/ArtefactPorn,The oldest jewelry ever found has been discovered this year by archaeologists in Bizmoune Cave in Morocco. The jewelry is made of perforated seashells and dates to between 142000 and 150000 years ago [2000x1333]
254,178.0,11800.0,13.0,r/Superstonk,+5.1🟣%
255,411.0,16500.0,15.0,r/therewasanattempt,To screen poops
