Unnamed: 0,comment_count,upvote_delta,timeup_list,subreddit,thread_text
256,78.0,4600.0,10.0,r/adhdmeme,Finally figured out what kind of job I want
257,176.0,14400.0,17.0,r/TheLastAirbender,"Key, send daughters!"
258,147.0,23200.0,15.0,r/AnimalsBeingBros,My sister’s dog never got along well with other dogs. But when they brought a rescue kitten at home to see if they would be compatible the two of them instantly became best bros.
259,110.0,4200.0,16.0,r/thesims,They used to be really aggressive
260,427.0,33800.0,17.0,r/KidsAreFuckingStupid,Watch out watch out watch out
261,71.0,2900.0,8.0,r/likeus,Elephants moving to violin music
262,44.0,5100.0,15.0,r/funny,Taking down the Christmas Decorations
265,308.0,5100.0,14.0,r/AnarchyChess,El Pipi
266,302.0,22600.0,22.0,r/HistoryPorn,"Atelier photo: ""A lesbian Couple in semi drag wedding attire""; Kingdom of Hungary - Budapest, 1920 [742x1187]"
267,82.0,4700.0,12.0,r/BlackPeopleTwitter,Pain its all pain
268,47.0,2800.0,5.0,r/HolUp,Solo is on TNT right now
269,354.0,18400.0,14.0,r/suspiciouslyspecific,Or are you normal?
270,32.0,2200.0,4.0,r/wholesomememes,Absolute marvel of a person
271,283.0,2500.0,8.0,r/apple,"Comment: 3D Touch was one of the best technologies Apple ever created, and I still miss it"
272,295.0,3200.0,7.0,r/todayilearned,"TIL about Māori chin tattoos. For Māori women, the traditional female chin tattoo is considered a physical manifestation of their true identity."
273,763.0,6700.0,10.0,r/news,"California man driving to White House to kill leaders on 'hit list' arrested in Iowa, officials say"
274,92.0,1300.0,4.0,r/IndianGaming,Xbox India's old Ad for 360
275,297.0,2900.0,12.0,r/space,NASA hasn’t hired theologians to study reaction to alien life
276,356.0,5700.0,12.0,r/JusticeServed,Ghislaine Maxwell Found Guilty on Nearly All Charges
277,293.0,2400.0,12.0,r/Conservative,Ghislaine Maxwell found guilty on 5 out of 6 charges
278,41.0,1200.0,4.0,r/facepalm,Even animals face casual erasure
280,169.0,2800.0,8.0,r/ShitPostCrusaders,Protagonist Tier List based on how many dicks they've sucked
281,327.0,4800.0,11.0,r/MapPorn,"The original 1947 Telephone Area Code Map - Codes were assigned based on population and time it took to dial the code on a rotary phone dial. High population areas got small numbers. i.e. NY 212, LA 213, Chicago 312."
282,207.0,3500.0,10.0,r/OldSchoolCool,Ruth Bader Ginsberg at Columbia University in 1972 as the first female law professor
283,397.0,3500.0,8.0,r/Tinder,Snickers nefariously
284,491.0,2100.0,14.0,r/MCPE,Can this guy technically last forever?
285,64.0,1500.0,11.0,r/arcane,[Spoilers Ep1] Claggor being humble.
286,175.0,8000.0,9.0,r/antiwork,nobody wants to work anymore
287,186.0,5700.0,14.0,r/TwoSentenceHorror,In 1950 there were 2.5 billion people on earth. now there is eight
288,25.0,2600.0,8.0,r/BrandNewSentence,It's a blowhobby
289,40.0,1300.0,4.0,r/TrashTaste,Garnt reacts to the Sabikui Bisco trailer
290,209.0,2100.0,7.0,r/CasualUK,Just became the first black champion of Countdown in its 40 year history
291,70.0,4500.0,11.0,r/corgi,This is what it’s like to have a nine year old corgi and a nine month old corgi
292,97.0,3400.0,9.0,r/WhatsWrongWithYourDog,Why does he keep offering me his arse when I walk in the room? Why? What have I done to deserve this?
293,348.0,350.0,3.0,r/dating_advice,Would You Date a Blind Girl?
294,306.0,7000.0,14.0,r/TheRightCantMeme,Sigh.
295,97.0,1500.0,3.0,r/Hololive,We have opened a permanent English language audition page for hololive production!🎉
296,348.0,3400.0,14.0,r/DestinyTheGame,Whaddya mean you can jump cancel?
297,351.0,1200.0,8.0,r/buildapc,"How do you tell which graphics cards are better than others, I just found out a GTX 1080 ti is better than a RTX 2060, what do the numbers mean?"
298,81.0,2800.0,4.0,r/interestingasfuck,Owl chicks sleep on their stomachs because their heads are too heavy. They do this until they are old enough to sleep upright.
299,49.0,1300.0,4.0,r/LivestreamFail,The Duality of Anime
300,285.0,9600.0,14.0,r/MaliciousCompliance,"Boss fired me for being pregnant, I’m the one who gets paid in the end"
301,285.0,3600.0,16.0,r/GlobalOffensive,Shox joins Liquid
302,171.0,6300.0,7.0,r/Unexpected,"""What race would you not date?"""
303,90.0,2900.0,9.0,r/CuratedTumblr,Voting Age
304,122.0,4500.0,14.0,r/GaySoundsShitposts,uh… wut
305,255.0,7300.0,18.0,r/Instagramreality,via linkedin... her husband 👁👄👁
306,88.0,6800.0,10.0,r/youseeingthisshit,He can't believe what he just saw
307,295.0,1100.0,6.0,r/Kanye,"Drop a Kanye verse that had you like this. Mine has to be ‘ this generation’s closest thing to Einstein, so don’t worry about me, I’m fine."
308,216.0,6900.0,17.0,r/aviation,A rare picture of the sr71 using its afterburners.
309,260.0,27500.0,19.0,r/DunderMifflin,[Tutorial] How to make a Rundown - Step by Step
310,101.0,1400.0,5.0,r/ThatsInsane,"A shark attacks a dolphin it had been chasing to a local beach, a bloodbath ensues"
311,278.0,10000.0,13.0,r/blackmagicfuckery,This block of flats near where I live.
312,83.0,4400.0,13.0,r/HermitCraft,I met Scar yesterday on Xisuma's public server
313,90.0,1600.0,10.0,r/HadesTheGame,"Just started playing for ~7 hours, no spoilers please but my number one observation is that Zagreus is very polite"
314,329.0,6000.0,12.0,r/SequelMemes,"Same magic, different reactions"
315,116.0,3100.0,9.0,r/Terraria,Spicy Build
316,31.0,2200.0,8.0,r/RoomPorn,"Arched bathtub alcove with white subway tile walls, Fox Island in Puget Sound, Pierce County, Washington [1800x2297]"
317,235.0,9400.0,19.0,r/ComedyNecrophilia,The good ending
318,343.0,3100.0,16.0,r/modernwarfare,I’m quitting
319,170.0,6000.0,13.0,r/StardewValley,The urbanization of Cindersnap Forest
320,267.0,4100.0,11.0,r/nostalgia,My mother still uses the same microwave since 1985.
321,48.0,4300.0,16.0,r/memes,For those of you who didn't learn how to button in school
323,269.0,7500.0,20.0,r/ReallyAmerican,1% the rich people won't pay their taxes in any conditions
325,173.0,3400.0,12.0,r/anime_titties,Ghislaine Maxwell found guilty in sex-trafficking trial | Ghislaine Maxwell
326,112.0,6400.0,10.0,r/pcmasterrace,Okay finally we can play StarCraft
327,105.0,1300.0,4.0,r/dankinindia,3 pEg 🥃
328,137.0,3400.0,13.0,r/witcher,A quick comic in honor of poor Ciri in S2
329,338.0,2200.0,9.0,r/homestead,"Well, since you asked"
330,119.0,1000.0,10.0,r/DuggarsSnark,Ghislaine Maxwell guilty verdict adding to a month of victories for those protecting minors against abuse
331,211.0,10000.0,14.0,r/lotr,Middle Earth is a better place with them.
332,102.0,3700.0,7.0,r/whenthe,M*tal
333,81.0,3300.0,15.0,r/CloneWarsMemes,"If you know, you know"
334,131.0,9000.0,16.0,r/ContagiousLaughter,Ice Machine Prank
335,269.0,1500.0,7.0,r/DnD,I just ran the math on how many arrows a high level character can put downrange in a minute and it's really hurting my brain.
336,281.0,12000.0,20.0,r/PandR,Patton Oswalt predicts the future (Book of Boba Fett spoilers)
337,167.0,2600.0,12.0,r/thatHappened,Yes that happened buddy
338,365.0,3600.0,10.0,r/animememes,What anime is like this?
339,113.0,4300.0,14.0,r/ProRevenge,Screw me on my bonus? Make me do two job? Enjoy the backwater you earned.
340,263.0,2100.0,12.0,r/ParlerWatch,"Mr. Kelly, your mask fell off"
341,292.0,1500.0,12.0,r/Epstein,Guilty on 5 out of 6 counts
342,263.0,5000.0,11.0,r/AbruptChaos,When you mistake a band for a road.
343,65.0,1700.0,12.0,r/okbuddychicanery,"Oh no, it’s spreading!"
344,291.0,2400.0,10.0,r/Cricket,Ross Taylor announces his retirement at the end of the home summer
345,289.0,15200.0,16.0,r/oddlyspecific,Is this a thing?
346,156.0,1000.0,9.0,r/NotHowGirlsWork,Most obvious is that we cannot taste things with our vaginas
347,279.0,18800.0,16.0,r/educationalgifs,Don't have a funnel for your car .
348,109.0,1700.0,13.0,r/Gunners,Late header? I know who it is!
349,314.0,8400.0,14.0,r/KitchenConfidential,"She's been with me ten years, through four head chefs. Today, she clicked her last clack."
350,104.0,2600.0,12.0,r/HaloMemes,"A Grunt's day in High Charity on November 3rd, 2552"
352,257.0,3600.0,14.0,r/religiousfruitcake,Oh please Jesus save us from the dyed hair and peace tattoos
353,140.0,1100.0,7.0,r/singapore,"Double Standards , image credit: Toast Comics"
354,57.0,3700.0,11.0,r/MEOW_IRL,MEOW_IRL
355,136.0,886.0,5.0,r/nursing,"Well, it finally happened. A patient coded in the waiting room 🤦‍♀️"
356,197.0,7000.0,11.0,r/natureismetal,Blood-thirsty squirrel
357,308.0,27100.0,19.0,r/oddlysatisfying,Dough ball shaper
358,230.0,12500.0,16.0,r/formuladank,One of the greatest moments in F1 history
359,130.0,5000.0,11.0,r/tf2,Should I put this on a sign?
360,244.0,3400.0,16.0,r/environment,I’m a climate scientist. Don’t Look Up captures the madness I see every day - A film about a comet hurtling towards Earth and no one is doing anything about it? Sounds exactly like the climate crisis
361,205.0,1800.0,8.0,r/atheism,"welp, they finally did it. I could use a hug =("
362,21.0,1900.0,7.0,r/blursed_videos,Blursed_Grandmaa
363,106.0,2500.0,12.0,r/ConvenientCop,[Brazil] Thieves went to rob a restaurant but a Tactical Group arrive at the right moment
365,99.0,1100.0,4.0,r/pokemongo,I live in the middle of nowhere but for some reason my house is an insane hotspot for Pokémon. Does anyone know why?
366,15.0,1300.0,5.0,r/blursedimages,Blursed_Dot
367,126.0,19700.0,14.0,r/BlackPeopleTwitter,average KKK meeting
368,299.0,2500.0,12.0,r/HollowKnight,Let's make a bosses tier list together!
369,126.0,1400.0,12.0,r/ShitMomGroupsSay,My favorite is the “head situation for reference.”
370,152.0,6800.0,11.0,r/Genshin_Impact,My Mona cosplay - Sailor Mae
371,26.0,1700.0,7.0,r/StardewValley,A Japanese style courtyard.
372,225.0,12200.0,21.0,r/quityourbullshit,"""No I didn't..."""
373,52.0,2900.0,9.0,r/DunderMifflin,I run a thrift store. I never cherry pick items...........until today.
374,913.0,1100.0,4.0,r/CFB,[Postgame Thread] Oklahoma Defeats Oregon 47-32
375,43.0,6900.0,13.0,r/fakehistoryporn,James Webb before transitioning into a space telescope 1992 (colorized)
376,128.0,3300.0,8.0,r/Superstonk,"It's no accident that today the brokers had ""opensea one of the big ips in 2022"" on your GME news ticker."
377,190.0,1500.0,12.0,r/walkaway,"Breaking: Jury finds Ghislaine Maxwell guilty of 5 out of 6 charges in sex trafficking trial. Judge orders trial papers sealed....meaning, I guess, that no charges will be brought against those (elites) who participated in underage sex."
378,177.0,12000.0,10.0,r/nextfuckinglevel,The high five at the end
379,159.0,10500.0,18.0,r/MinecraftMemes,Come on what is this abomination mojang my eyes hurt when i see it :(
380,32.0,1000.0,22.0,r/gifs,Machine used to bend metals
382,148.0,1300.0,6.0,r/blackcats,Which one are you? (I'm feeling like #9)
383,111.0,2100.0,8.0,r/evangelionmemes,Uncanny Evangelion Ships Part 2
384,154.0,6600.0,15.0,r/Konosuba,Ask yourselves who actually are the bad guys
385,191.0,2200.0,14.0,r/dankruto,"Ino's Most Popular Ship Isn't Even with Sai. Take your Gold and Silver Medals, ShikaIno and SasuIno Peeps"
386,96.0,2000.0,8.0,r/sports,Paris wants to make swimming in the Seine safe - and legal - for everyone
387,129.0,3600.0,11.0,r/watchpeoplesurvive,Quick thinking Ecuadorian prevents his assassination
388,142.0,4500.0,12.0,r/iamatotalpieceofshit,Now leave her in prison to rot.
389,40.0,2900.0,10.0,r/AnimalCrossing,"My passport, with my arsonist girl meme recreation."
390,227.0,629.0,8.0,r/CollegeBasketball,"[Post Game Thread] #11 Auburn defeats #12 LSU, 70-55"
391,20.0,3900.0,11.0,r/2meirl4meirl,2meirl4meirl
392,14.0,3800.0,22.0,r/NonPoliticalTwitter,Brotherly love
394,200.0,2000.0,5.0,r/gaming,Yup * checks notes * he wasn’t a complete pile of shit
395,133.0,2100.0,14.0,r/gaybros,He might need a full body search
396,527.0,2000.0,6.0,r/Genshin_Impact_Leaks,Phase 2 Banner And Weapon Banner via Ubatcha
397,160.0,540.0,5.0,r/TooAfraidToAsk,What are you supposed to say or do if you ejaculate too fast during sex?
398,240.0,1600.0,9.0,r/melbourne,Interesting info from Yarra trams!
399,15.0,4800.0,12.0,r/blessedimages,Blessed_interaction
400,110.0,6500.0,16.0,r/Jokes,A teacher tells her student to tell a story with a moral in it.
401,29.0,2700.0,9.0,r/PeopleFuckingDying,DiStUrBiNg ImAgEs ! KiWi BiRdS eAt ThEiR oWn KiNd !
402,22.0,922.0,3.0,r/dogswithjobs,"Flying with my hearing alert service dog, Mila"
403,59.0,10300.0,16.0,r/EarthPorn,"Milky Way rising over ""alien eggs"" in Northern California [2000x2996] [OC]"
404,17.0,1100.0,5.0,r/ihadastroke,"yes, gun=gum=fun"
405,266.0,2600.0,13.0,r/Eldenring,POV: you live in a 3rd world country and Elden Ring is too expensive for you
406,219.0,5400.0,18.0,r/Astronomy,James Webb Space Telescope UPDATE! - Mission life extended due to extra onboard fuel as a result of very precise launch and efficient mid-course corrections.
407,242.0,3100.0,9.0,r/amcstock,There is no such thing as computer glitch in modern computers - possible explanation from an experienced SW developer ape
408,40.0,1700.0,7.0,r/thalassophobia,These steps from a boardwalk into the Atlantic Ocean
409,11.0,924.0,4.0,r/Zoomies,"My new puppy, Zelda, Zoomed a little too hard! She's OK though"
410,159.0,988.0,5.0,r/australia,‘Complete collapse of leadership’: Australia’s recent Covid response amounts to world-class bungling
411,105.0,3100.0,12.0,r/Grimdank,Sister Charity and New Tau Guns
412,43.0,5900.0,14.0,r/forbiddensnacks,Forbidden bread
413,242.0,1100.0,10.0,r/JoeRogan,This amazing rant that Ari Shaffer went on about how fucked up social media companies are
414,76.0,2100.0,14.0,r/legendofkorra,Avatar: LOK Discovers Shipping! by Booter-Freak
415,82.0,2100.0,9.0,r/notliketheothergirls,Wattpad at its finest
416,258.0,37900.0,17.0,r/AnimalsBeingDerps,"A few weeks ago I posted a video of Edmond the dancing bed making cat, here is another one!"
417,54.0,1100.0,5.0,r/HollowKnightMemes,And the fucking audacity to put Grey Prince Zote after Markoth
418,76.0,1100.0,5.0,r/LeagueOfMemes,What’s wrong with this picture?
419,28.0,1800.0,5.0,r/dankmemes,Every. Single. One.
420,28.0,1300.0,6.0,r/SaimanSays,Upv0te if you're watching in 2021
421,171.0,4400.0,15.0,r/ffxiv,Who gave Zenos the WoL's Number?
422,155.0,913.0,8.0,r/mmamemes,"""It Does Not Matter If You Get Shot"" D.U.S.T. Response to Viral Video"
423,84.0,1400.0,10.0,r/Berserk,What happened to my berserk deluxe edition 4 🤨
424,43.0,949.0,4.0,r/Embroidery,“Knit 1 purl 2. Knit 1 purl 2. That’s right!”
425,161.0,5400.0,15.0,r/wholesome,Nice perspective
426,107.0,1500.0,7.0,r/InternetIsBeautiful,"""Nestflix"" - A site for movies and shows within movies and shows"
427,142.0,1700.0,12.0,r/newzealand,Chris Hipkins Emerging from the Bush for a Presser is the Kiwi Content We Need
428,105.0,3600.0,17.0,r/mapporncirclejerk,Map of the world if Hillary Clinton was elected president in 2016
429,118.0,20800.0,17.0,r/notinteresting,"This glass has clear water in it, but your brain sees it as magenta. That's because I changed the color in Photoshop."
430,142.0,1200.0,9.0,r/OutOfTheLoop,What's the deal with NASA hiring religious figures?
431,41.0,786.0,3.0,r/sadcringe,"I wrote a stupid book about three years ago on Wattpad that was fanfiction of historical figures, which resulted in a couple of strange people messaging me three years later. More info in the comments..."
432,95.0,6300.0,14.0,r/AnimalsBeingJerks,Landing safely on the green when there's water all around ... then ...
433,109.0,4400.0,13.0,r/Breath_of_the_Wild,OK I think I have definitively found what must be the most BS treasure chest in the whole game.
434,25.0,3600.0,11.0,r/BetterEveryLoop,Ménage à kitten
435,36.0,1400.0,6.0,r/MemeVideos,Sus
436,53.0,2600.0,10.0,r/egg_irl,Egg_irl
437,159.0,1800.0,13.0,r/whatsthisbug,Wtf is this? I found it on my shorts :/
438,121.0,4400.0,8.0,r/NatureIsFuckingLit,🔥 great eared nightjar
439,250.0,14800.0,13.0,r/PrequelMemes,It did sorta drag on…
440,533.0,2500.0,8.0,r/PublicFreakout,Workers wearing hazmat suits as Hemorrhagic Fever hits Xi'an city in northwest Shaanxi province
441,34.0,1200.0,6.0,r/AbandonedPorn,Vintage control room in abandoned power station
442,158.0,1700.0,10.0,r/tooktoomuch,Man didn't even flinch
443,130.0,1600.0,7.0,r/Gamingcirclejerk,What do you guys think of my shopping cart?
444,77.0,1400.0,12.0,r/2meirl42meirl4meirl,First appointment with a therapist ended like this lol
445,105.0,1500.0,9.0,r/BobsBurgers,Human Flesh is one of the best episodes and I wish they would have kept this going sometimes. I think the episode is 10/10
446,9.0,1300.0,6.0,r/ANormalDayInRussia,Hot water challenge!
447,36.0,2000.0,9.0,r/tattoos,"Shin Shining tattoo, done by Logan Shermeyer @ Colley Ave Tattoo, Norfolk VA!"
448,227.0,1700.0,11.0,r/motorcycles,I came home from work and my wife thought I looked silly. My sister pulled out her phone to record this video. It was 14 degrees (-10c) with a -9 degree (-22c) windchill riding into work today.
449,122.0,853.0,8.0,r/techsupportgore,TFW people selling internal PC components place said bare components on the carpet for the photo
450,193.0,3700.0,13.0,r/StarWarsBattlefront,First ever 64 player server through Kyber private matches
451,194.0,1800.0,12.0,r/DIY,Kitchen Remodel During the Pandemic
452,82.0,3000.0,10.0,r/Minecraft,We made Atari Breakout with just redstone!
453,69.0,6500.0,14.0,r/perfectlycutscreams,Someone is gonna end up single
454,160.0,7500.0,19.0,r/CasualConversation,I made my boyfriend cry on Christmas Day
455,1600.0,10900.0,12.0,r/Cringetopia,"You don't have any culture, they say."
456,73.0,8100.0,15.0,r/Catswithjobs,My boyfriend’s Christmas gift to me; our cat Wasabi as an astronaut. Thought you guys might appreciate this as much as I do.
457,18.0,9500.0,15.0,r/Catswithjobs,IDM - भविष्यवाणी टूर्नामेंट
458,107.0,6200.0,16.0,r/gifs,Wait a second...
459,89.0,2400.0,13.0,r/MarchAgainstNazis,These idiots are literally posting Putin quotes now.
460,148.0,4400.0,16.0,r/IdiotsNearlyDying,Almost turned into a miscarriage party
461,101.0,931.0,8.0,r/Firearms,"Surprise, surprise. FedEx beat up my ammo shipment and stole a few boxes for themselves."
462,66.0,5200.0,13.0,r/bonehurtingjuice,Aftermath
463,96.0,3100.0,14.0,r/dataisbeautiful,[OC] Top 40 trending topics in 2021 news
464,78.0,9400.0,16.0,r/gifsthatkeepongiving,“Australian Volleyball”
465,16.0,1400.0,7.0,r/mathmemes,Oh no... i forgor💀
466,105.0,2400.0,15.0,r/rupaulsdragrace,Kennedy Davenport completely annihilating the stage in San Francisco 🤩 I mean COME ON 🔥
467,26.0,2200.0,9.0,r/HumansAreMetal,Massive triple cork combo
468,93.0,5200.0,15.0,r/lostredditors,"Obviously a joke, and not cringe……"
469,263.0,10700.0,18.0,r/CozyPlaces,My custom butcher block work/play station!
470,220.0,985.0,5.0,r/tifu,TIFU by smoking weed for the first time and trusting my friend on the dosage.
471,5.0,1300.0,7.0,r/PunPatrol,A maths pun
472,117.0,15200.0,19.0,r/nonononoyes,All I Need Is A Miracle
473,657.0,7700.0,11.0,r/nba,"[Wojnarowski] Cavaliers guard Ricky Rubio has suffered a season-ending ACL tear to his left knee, sources tell ESPN."
474,180.0,5000.0,17.0,r/castiron,My little brother has his own cast iron frying pan. Every weekend he cooks himself 2 sausages and a cheesy omelet.
475,27.0,1200.0,6.0,r/Conservative,Seems like a solid meme
476,141.0,3500.0,8.0,r/funny,The British are like colon
477,26.0,678.0,2.0,r/hmm,Hmmmm
478,93.0,5300.0,16.0,r/LeagueOfMemes,This definetly didn't happen to me today
479,193.0,16800.0,14.0,r/technicallythetruth,That is enough for a skin care...
480,172.0,2300.0,10.0,r/Undertale,Uh oh
481,50.0,1400.0,7.0,r/blender,I'm brand new to blender... and art in general. Be nice to mid-life crisis Yoda
482,313.0,6300.0,8.0,r/memes,Dangerous meme
483,90.0,4100.0,18.0,r/holdmycosmo,HMC while I spin this chandelier
484,44.0,3300.0,5.0,r/MadeMeSmile,Even the smallest acts of kindness can have a lifelong impact
485,94.0,7600.0,16.0,r/MurderedByWords,Absolutely demolished the English cricket team
486,142.0,4200.0,18.0,r/ontario,R/Ontario for the next 2 months lol
487,18.0,780.0,4.0,r/povertyfinance,I can't even imagine spending $150 a month on coffee
488,112.0,12000.0,17.0,r/confusing_perspective,Just a curious doggo looking out of a roof… right?
489,99.0,443.0,4.0,r/BokuNoHeroAcademia,Hot take: I think MHA is hindered by the fact it takes place during one school year
490,50.0,2300.0,14.0,r/SpidermanPS4,For me it was the Chrysler building
491,93.0,661.0,6.0,r/FireEmblemHeroes,Leonie Cannot Win Against Gharnef
492,108.0,7800.0,14.0,r/JusticeServed,"Priest sexually assaults, threatens 12-year-old boy, gets life imprisonment | SIX YEARS after a priest at a church in Mumbai was booked for sexual assault on a 12-year-old boy, a special court on Wednesday sentenced him to life imprisonment"
493,216.0,5800.0,10.0,r/aww,Not sure this is aww for you but it is for me. Our first Daddy-Daughter date!
494,207.0,479.0,7.0,r/TLCsisterwives,Sister Brothers….ReBoot
495,13.0,3000.0,11.0,r/ImaginarySliceOfLife,Gathering Ingredients by SimzArt
496,121.0,694.0,7.0,r/DotA2,"I hate this mechanic so much, why does rearm work on this ?"
497,122.0,5600.0,15.0,r/FellowKids,A local police department posted this on Facebook
498,32.0,2100.0,9.0,r/gatekeeping,The dumbest hill to die on
499,41.0,1900.0,4.0,r/Damnthatsinteresting,A group of penguins briefly exchange information
500,132.0,4100.0,17.0,r/DC_Cinematic,This feels like the appropriate time to post this
502,119.0,3000.0,11.0,r/im14andthisisdeep,Life sucks when you're 14
505,149.0,1600.0,9.0,r/2007scape,The worst smelling screenshot in Reddit history
506,159.0,4800.0,18.0,r/ComedyCemetery,Guess the subreddit
507,99.0,1700.0,10.0,r/Letterkenny,For that one comment to do it on vaccines! Get vaccinated
508,68.0,1800.0,9.0,r/niceguys,The guy who hit on the cashier has come full circle
509,35.0,1000.0,6.0,r/india,Childhood memories:^)
510,111.0,3800.0,13.0,r/reddeadredemption,How did that even happen
511,23.0,1700.0,9.0,r/CatsAreAssholes,Our kitten acting like an asshole
512,150.0,2900.0,24.0,r/ultrawidemasterrace,Do you think this should be added to Steam?
514,97.0,4300.0,16.0,r/AdviceAnimals,"""Let's talk about"" I think you mean ""Listen up consumers"""
515,40.0,711.0,4.0,r/ThatLookedExpensive,Car plummets off parking garage
516,41.0,650.0,3.0,r/CatastrophicFailure,"Italian aviator Francesco ""Lord of Distance"" de Pinedo's fatal attempt to takeoff in his grossly overloaded Bellanca J-3-500 ""Santa Lucia"" (including 1,000 gallons of fuel) for a distance record setting flight from New York to Bagdad on 2 September 1933 from Floyd Bennett Field, NY."
517,97.0,817.0,7.0,r/justneckbeardthings,An IQ of 136. Nice.
518,113.0,3700.0,17.0,r/rimjob_steve,on my post about transphobia
519,133.0,2000.0,12.0,r/malelivingspace,"I’m finally happy about my small student apartment in Denmark, wanted to share"
520,155.0,1500.0,10.0,r/NintendoSwitch,I know it's quite late but I've got Zelda BotW on my xmas present and it's AWESOME!
521,122.0,1900.0,6.0,r/IndianDankMemes,Couple goals
522,154.0,1500.0,8.0,r/IndiaSpeaks,That's india
523,62.0,2100.0,14.0,r/cowboybebop,"""We'll never get out of here now... I'll never see Mars..."""
524,67.0,4300.0,16.0,r/Rainbow6,"Since we are able to choose the ending MVP animation, imagine if we could use different elites."
525,239.0,2700.0,14.0,r/trans,New skirt and tights! 😍
526,239.0,4200.0,14.0,r/antimeme,It only takes a brain to know this.
527,46.0,2600.0,14.0,r/ClashOfClans,Thats a good leader
528,148.0,5000.0,18.0,r/houseplants,"Before & after! My partner found this flf in the trash a year and a half ago, and look at him now ☺️ He’s not perfect, but I just wanted to show the progress he’s made to people who will appreciate it"
529,98.0,662.0,6.0,r/KGBTR,"Ya bi yayın açalım dedik, bir şeye heves ettik,. YouTube benim hesabımı patlatmış cinsellik ve çıplaklık gerekçesiyle. Amına koyim kesin YouTube'un sahibinin kızı da izliyodu yayını, sulandı kaltak, adam da kıskanıp beni banladı. 14,5 yıllık hesap niye banlanır ki amk? Neyse umarım geri alabilirim."
530,199.0,2600.0,9.0,r/NoStupidQuestions,Why does reddit always put some sweaty guy in a tie playing drums on my newsfeed?
531,90.0,2800.0,12.0,r/LiminalSpace,Did it happen to all of us?
532,72.0,3800.0,17.0,r/NewDealAmerica,"American workers, Now is the time! Labor produces all value & Strikes are the way to play your strongest card! Strike for your rights! Strike for more pay and less hours!"
534,118.0,2200.0,8.0,r/formula1,Lewis and Nico on unicycles
535,103.0,1700.0,11.0,r/youngpeopleyoutube,I can't with YouTube anymore😂😂😂
536,89.0,1500.0,12.0,r/houkai3rd,Kiana eats pineapple pizza
537,95.0,1500.0,10.0,r/MemePiece,Don't ever compare Luffy with other Shounen MC
538,66.0,971.0,7.0,r/boburnham,"""IT WAS NEVER ABOUT COVID"""
539,133.0,2500.0,14.0,r/streetwear,[WDYWT] I look like I move weight but I'm a stay at home dad.
540,19.0,2300.0,8.0,r/BikiniBottomTwitter,are you feeling it now Mr. Krabs?
541,75.0,869.0,8.0,r/bleach,"These scenes make a lot more sense when you realize that by technicality, Ichigo is part of the Shiba Clan..."
542,182.0,1200.0,7.0,r/doordash,Was Doordashing but wife water broke so iam delivering my son soon! Wish me luck (7 hour update later) it complete guys. Iam tired and it was the hardest longest delivery ever. Thank you guys for the support! I'll be on a short doordash vacation lol!
543,92.0,3000.0,11.0,r/Technoblade,We are only 100k away
544,53.0,1400.0,8.0,r/cringepics,Strawberry Jam is not a convincing substitute for blood.
545,34.0,1600.0,9.0,r/intermittentfasting,I laughed at myself today as I picked up a size 8 dress to try on knowing damn well I hadn't lost THAT much. Turns out I have 😊 about 10 months on IF with a bit of omad. 50lbs down and about 25 to go.
