Unnamed: 0,comment_count,upvote_delta,timeup_list,subreddit,thread_text
546,106.0,1500.0,8.0,r/shittyfoodporn,This calzone I ordered had an interesting look to it 👀
547,19.0,2800.0,11.0,r/tippytaps,Lots of wiggles from the queen of wiggles herself
548,126.0,951.0,7.0,r/Mommit,U/lillyanne99
549,92.0,3400.0,13.0,r/woahdude,Everything not saved will be lost.
550,292.0,9600.0,17.0,r/SquaredCircle,"JR ON Twitter ""I'm cancer free!"""
551,54.0,7100.0,60.0,r/tumblr,Food
553,22.0,1500.0,8.0,r/ABoringDystopia,"Phew, That's a Relief!"
554,45.0,2500.0,12.0,r/yesyesyesyesno,We went to School Together
555,59.0,2600.0,9.0,r/Eyebleach,How do you name this illusion!
556,161.0,3000.0,14.0,r/tech,Rats learn to play DOOM in this automated VR arena
557,134.0,4100.0,14.0,r/funnyvideos,This got me a 30 day ban on Facebook and was also taken down by iFunny. I've yet to understand why. It seems funny and harmless to me
559,38.0,986.0,6.0,r/TenseiSlime,KonoSlime!
560,61.0,3800.0,10.0,r/tumblr,You gotta get that validation where you can
561,53.0,3000.0,12.0,r/Chonkers,Lulu - dechonked from 14.5 lb to 7 lb
562,63.0,3000.0,14.0,r/soccercirclejerk,What a beautiful header
563,100.0,2300.0,12.0,r/Deltarune,Deltarune characters with as few strokes as possible
564,30.0,611.0,3.0,r/de,Heute morgen zu einem Rascheln am Fenster aufgewacht
565,67.0,7000.0,14.0,r/IllegallySmolCats,This lady was abandoned outside a petstore. Had to take her home.
566,60.0,1600.0,9.0,r/copypasta,Found in a christian discord server
567,109.0,1100.0,11.0,r/dogecoin,"Thanks to Doge….today at the vet when we got hit with the price tag for an emergency surgery to potentially save my little kitty Mr. Smokey Bones the Menace, I was able to afford whatever came our way. Now just prayers for Smokey that the surgery goes as planned."
568,325.0,2000.0,8.0,r/politics,"Trump accuses Jan. 6 panel of ""seeking evidence of criminal activity"""
569,16.0,960.0,6.0,r/PhoenixSC,The snail was waiting
570,103.0,3300.0,10.0,r/ProgrammerHumor,Tic tac toe
571,106.0,424.0,6.0,r/foodhacks,Cancelled family dinner and stuck with this beast. Any suggestions on how to tackle this monstrous 3.3kg whole wagyu tenderloin?
572,109.0,571.0,6.0,r/NoFap,Today I lost my virginity and I learned 1 thing
573,104.0,616.0,7.0,r/GodofWar,Made in 5 minutes
574,132.0,491.0,6.0,r/weed,The Bong Lord 😲
575,34.0,1000.0,6.0,r/ffxiv,I painted THE trailer scene that first hooked me on FFXIV's world and story
577,30.0,2500.0,11.0,r/Komi_san,I cleaned that beautiful panel from Chapter 302
578,240.0,6600.0,13.0,r/WatchPeopleDieInside,She nose she messed up
579,44.0,2500.0,10.0,r/ksi,Should have made this sooner
580,65.0,1100.0,10.0,r/NewGirl,Shameless plug! Stavros (played by me) misses you all 🕺🏻 love this community.
581,76.0,8200.0,15.0,r/rarepuppers,"Happy 15th birthday to my old man, Buddy! 2.5 years together and I wouldn't change them for the world ❤️"
582,78.0,4300.0,15.0,r/spaceporn,I can never get enough of the Hubble nebulas..
583,91.0,894.0,8.0,r/Fallout,Fellas Fallout New Vegas is $2.99 on Steam. If you haven't given it a try now is a good chance.
584,88.0,1700.0,11.0,r/ApexOutlands,too controversial?
585,62.0,1300.0,11.0,r/MadeMeCry,This needs to be done everywhere!
586,51.0,1900.0,13.0,r/ChainsawMan,Makima
587,69.0,13100.0,15.0,r/blursedimages,Blursed_ Phineas looking forward compilation
588,75.0,1700.0,10.0,r/libertarianmeme,Now go global with it
589,53.0,3800.0,16.0,r/ATBGE,Greggs Sausage Roll earrings
590,93.0,8000.0,17.0,r/carporn,R34 Skyline GT-R [1170x1170]
591,66.0,1200.0,11.0,r/HighQualityGifs,"Which works better: ""Between a rock and a hard place"" or ""Damn! We're in a tight spot!"""
592,97.0,13500.0,18.0,r/shittyrainbow6,Ded game
593,57.0,2400.0,15.0,r/Persona5,Hold Up... why I didn't noticed it before
594,51.0,2900.0,12.0,r/SmashBrosUltimate,Me when my opponent techs a stage spike
595,73.0,696.0,9.0,r/nflmemes,Tier list of each team's starting quarterback based on how many syllables are in their legal first name
596,51.0,1000.0,10.0,r/BlueArchive,Well
597,70.0,587.0,5.0,r/moreplatesmoredates,I drew a portrait of Derek today :)
598,53.0,5100.0,12.0,r/oddlysatisfying,Satisfying Pen Filling
599,105.0,7100.0,11.0,r/Hololive,Ina's 2021 art recap. Her favorite pieces from each month
600,47.0,1100.0,10.0,r/Philippines,A look back
601,73.0,2600.0,15.0,r/AmateurRoomPorn,"Pink Front Room in Macclesfield, England."
602,81.0,4300.0,14.0,r/softwaregore,..i think you missed the chair
603,33.0,4300.0,14.0,r/brooklynninenine,How I felt during my last refi...
604,56.0,1300.0,12.0,r/csgo,Something is wrong with my Inferno...
605,57.0,1400.0,10.0,r/arknights,PALLAS
606,82.0,6200.0,17.0,r/ShittyLifeProTips,SLPT: Depressed? Just remember these little tricks to help you through it.
607,92.0,1100.0,11.0,r/JuiceWRLD,"my painting of Juice (30x40) , i put sm love into this & tried my best to make it look just like him 🖤 ig - jessicajagetzz"
608,45.0,746.0,5.0,r/Naturewasmetal,What might have been: American mastodons on the road at night
611,36.0,2300.0,11.0,r/surrealmemes,BEAT GOBLIN
612,158.0,2600.0,9.0,r/KidsAreFuckingStupid,My son's best friend refuses to eat the crust on his pizza rolls..
613,655.0,16300.0,17.0,r/LifeProTips,"LPT: installing a lift-kit? For the love of god, adjust the headlights. Your lifted truck no longer has low-beams; it’s now either high beams or higher beams and you are blinding everyone."
614,64.0,1300.0,8.0,r/DiWHY,It's it just me or does that look like...
615,41.0,568.0,5.0,r/cremposting,What the fuck
616,39.0,4000.0,17.0,r/WritingPrompts,"[WP] You've discovered that nothing can kill the hero until they beat the dark one. You and the hero are now working together to cure all previously incurable fatal diseases by infecting the hero with them, and waiting to see how the universe conspires to cure them of it."
617,51.0,1400.0,11.0,r/Sneks,How to feed your Dragon (Eastern Indigo)
618,60.0,614.0,7.0,r/2Asia4u,Indonesia
619,51.0,907.0,9.0,r/SuccessionTV,Looking at the least favourite poll and seeing Logan still there
620,38.0,3400.0,16.0,r/Kitten,A Tape Cutter.
622,75.0,2100.0,12.0,r/3Dprinting,Brickring - My kid asked for a finger ring he could put Lego on so I designed this
623,59.0,5200.0,14.0,r/woooosh,Oh wait.
624,49.0,1600.0,11.0,r/Overwatch_Memes,Y'all be stressin me out
625,65.0,1100.0,8.0,r/loopringorg,"Trading Volume record smashed on Loopring L2 - Test complete, Something big is coming."
626,75.0,543.0,4.0,r/canucks,Bruce Boudreau ties NHL record for the longest win streak to begin a tenure with a new team
627,39.0,7900.0,20.0,r/vexillologycirclejerk,flag of saudi arabia except its a tone generator app on my phone
629,20.0,995.0,6.0,r/meme,Isn't the meme good enough
630,77.0,3600.0,15.0,r/Catswhoyell,Lotus left us two months ago and I miss this yell so much 💔
631,19.0,649.0,4.0,r/dogelore,"""Le NFTs has arrived"" except I took u/OreoDotexe's suggestion and removed the text from the middle pannel, making this post 8000x funnier"
632,56.0,2400.0,14.0,r/cursed_videomemes,Bedtime for redditors
633,25.0,992.0,10.0,r/okbuddyhololive,Least deranged KFP slave
634,79.0,3600.0,16.0,r/DestinyFashion,Crypt Forgemaster
635,844.0,6900.0,14.0,r/wallstreetbets,Albert Einstein of the stock markets
636,63.0,3100.0,15.0,r/FortNiteBR,Doing the ‘snap’ emote as somebody dies is my new favourite thing
637,31.0,2000.0,13.0,r/boottoobig,Spoiler now: stalking's not hot
638,103.0,2200.0,12.0,r/AnimeFunny,FINGER BRRRRR
639,27.0,3100.0,12.0,r/blessedimages,Blessed Child
640,43.0,5100.0,18.0,r/tuckedinkitties,Found my husband and my Cookie cat like this when I finally went to bed
641,43.0,4300.0,14.0,r/OneSecondBeforeDisast,"Uh, just cleaning."
642,50.0,967.0,10.0,r/h3h3productions,I like the twilight movies
643,44.0,1700.0,4.0,r/Superstonk,Loving this GameStop like... Bye OpenSea!
644,13.0,833.0,7.0,r/BestofRedditorUpdates,AITA for letting my step daughter Stay with her maternal grandparents for Christmas?
645,89.0,517.0,5.0,r/gravityfalls,"I'm drawing six characters, so far I've done Six and Dipper."
646,33.0,535.0,5.0,r/memeframe,Most of the time brute force doesn't work or don't yield the best results. Same thing for using status build in a weapon with 5-10% status chance.
647,39.0,3600.0,15.0,r/assholedesign,"Black text on black background, a classic"
648,49.0,2300.0,12.0,r/PetTheDamnCat,He loves his morning cuddles 🤣
649,46.0,7800.0,17.0,r/GetMotivated,[Image] - Good at something
650,31.0,2900.0,16.0,r/physicsmemes,Daily struggles
651,21.0,668.0,8.0,r/feedthebeast,A little teaser for 2022
652,24.0,659.0,4.0,r/Spiderman,How cool is this lamp I picked up today? Found it at Target hiding on the bottom shelf 🕷
653,70.0,3200.0,16.0,r/creepy,By the Beach [OC]
654,61.0,2500.0,12.0,r/BoneAppleTea,Entrance closed due to an earth quack
655,48.0,857.0,6.0,r/photoshopbattles,PsBattle: This 2-pronged icicle
656,53.0,5900.0,14.0,r/comics,"""Never Die"""
657,10.0,777.0,6.0,r/rickandmorty,We have to move to a new reality Morty
658,28.0,1100.0,10.0,r/guineapigs,My dog likes to keep watch over the piggies while I clean their pen. He is best boi at 15 years old ♡
659,37.0,1400.0,10.0,r/DemonSlayerAnime,This description at my Barnes and Nobles
660,24.0,556.0,7.0,r/GenshinGays,That's kinda sus kaeya/diluc 🤨
662,34.0,1200.0,11.0,r/legostarwars,Matey-AT version 2
663,10.0,703.0,5.0,r/absolutelynotme_irl,Absolutely not me irl
664,18.0,2700.0,14.0,r/Iamactuallyverybadass,Lion Mama
665,25.0,435.0,3.0,r/polandball,African capitalism vs African socialism
666,26.0,1100.0,11.0,r/VALORANT,Just 2 women ready to be drafted into pro leagues
667,26.0,2900.0,13.0,r/skamtebord,Hampter
668,11.0,780.0,6.0,r/subnautica,[No Spoilers] Here we go again
669,35.0,694.0,7.0,r/cakedecorating,Every cake I made in 2021 😅 (part 1)
670,8.0,1400.0,9.0,r/trebuchetmemes,"You don't deserve any grace, but must surrender to my will"
671,33.0,3200.0,16.0,r/Thisismylifemeow,Dave has been adopted
672,67.0,1700.0,8.0,r/WitchesVsPatriarchy,The sleepover is no good without a good sacrifice.
673,24.0,443.0,2.0,r/europe,Sunrise. Finland
674,60.0,4800.0,10.0,r/PrequelMemes,Basically what the Jedi Council was doing for 40 years while the Sith were plotting
675,41.0,2100.0,13.0,r/Memes_Of_The_Dank,:(
676,38.0,1300.0,9.0,r/CitiesSkylines,Small City - only vanilla assets
677,26.0,516.0,5.0,r/vaxxhappened,This is the way.
678,6.0,671.0,5.0,r/MyPeopleNeedMe,Brutal self-defense technique
680,110.0,476.0,3.0,r/dataisbeautiful,U.S. Domestic Migration from July 2020 to July 2021 - Click the link for more charts and the source data
681,19.0,520.0,4.0,r/OldPhotosInRealLife,Nickelodeon Studios in the 90’s vs the same building today
682,33.0,1100.0,10.0,r/sewing,a new coat to get me through this winter
683,24.0,553.0,4.0,r/JuJutsuKaisen,drew a lil jjk x naruto crossover for my shadow babies <3
684,32.0,856.0,9.0,r/reddeadredemption2,The Chelonian cut scene progressively getting more cursed
685,20.0,1100.0,6.0,r/therewasanattempt,To do the boiling water challenge
686,26.0,441.0,5.0,r/Eminem,We've done it everyone
687,32.0,1400.0,10.0,r/arknights,Skadi's Christmas（By 战五渣）
688,71.0,2700.0,11.0,r/apexlegends,A sweet little hidden easter egg from a dev 💜
689,76.0,4300.0,8.0,r/nextfuckinglevel,His voice is enough
694,21.0,1300.0,12.0,r/thomastheplankengine,"Had a dream I was at a party and I couldn't stop speaking in an Australian accent. Nobody said anything about it to my face, but I knew they were talking about it behind my back..."
695,29.0,5600.0,18.0,r/WhatsWrongWithYourCat,"Before and after adoption. In a span of 3 months Loki went from an outdoor loner to a pampered, mindless chonk"
696,23.0,4600.0,17.0,r/calvinandhobbes,I had never seen this one before!
697,14.0,822.0,7.0,r/bi_irl,Bi_irl
698,28.0,969.0,8.0,r/velvethippos,"This is Rue, the sweetest, most adorable idiot you’ll ever meet. Also loves to chase things in her dreams."
699,402.0,2400.0,8.0,r/pics,McDonald's in Indiana paying employees based on their age.
700,937.0,6800.0,16.0,r/HermanCainAward,New Jersey man has posted his last offensive meme.
701,25.0,1500.0,11.0,r/animegifs,Making an Entrance
702,135.0,2600.0,10.0,r/skyrim,"Why is my Beast Form so short? Female Breton, Lydia for comparison lmao"
703,29.0,1500.0,12.0,r/cute,A real live Night Fury.
704,26.0,1800.0,11.0,r/cyberpunkgame,Quick brag on my mom and her crafting phase 😌
705,26.0,575.0,7.0,r/xqcow,The world champion bowler
706,22.0,1100.0,11.0,r/DevilMayCry,Vergil will bury you
707,313.0,1400.0,5.0,r/PublicFreakout,A kidnapper caught red handed while abducting a kid in a suitcase!
708,25.0,1500.0,11.0,r/zelda,"[OC] one of my favorite little crafts, you guys like it? Sorry for the poor photography"
709,20.0,833.0,13.0,r/aww,"My Pet rat Egg is Learning to Place a Ball in a mini BBQ, then Close the Lid!"
711,7.0,817.0,4.0,r/cursedcomments,Cursed_Nikocado
712,21.0,440.0,6.0,r/apexuniversity,You can charge a rampage while hanging on a ledge apparently
713,879.0,4300.0,14.0,r/news,"Florida reports 46,923 new coronavirus cases, shattering state daily record"
714,55.0,1000.0,6.0,r/ThatsInsane,80 years later
715,23.0,578.0,6.0,r/CatsStandingUp,Cat.
716,22.0,463.0,6.0,r/TedLasso,"Drawing I did yesterday, of the man himself."
717,54.0,2600.0,11.0,r/confidentlyincorrect,G-A-R-B-I-T-C-H
718,13.0,1200.0,9.0,r/politecats,Katniss asked for a treat so nicely. I miss this fluffball.
719,1.0,493.0,18.0,r/4chan,anon finds his passion
721,640.0,3800.0,12.0,r/trashy,NSFW Found a “Used” Sex Doll in a Dumpster Behind My Office Today
722,21.0,1200.0,9.0,r/mexico,Bonito atardecer Mexicano
723,22.0,1400.0,12.0,r/Helltaker,Merry Christmas
724,56.0,2800.0,9.0,r/BlackPeopleTwitter,I might be young but my body acting like I qualify for retirement already
725,284.0,2300.0,10.0,r/halo,Multi Team is coming!
726,21.0,3300.0,15.0,r/HappyWoofGifs,I'm on TV!
727,1.0,578.0,5.0,r/AvatarMemes,It do be like that sometimes
728,23.0,802.0,9.0,r/jerma985,worma
729,15.0,718.0,6.0,r/valheim,My experiment with raising ground for support pillars.
730,23.0,434.0,6.0,r/suddenlysexoffender,Wait a minute
731,4.0,617.0,5.0,r/suicidebywords,True I guess
732,20.0,961.0,10.0,r/ArcherFX,This reminds me of something
733,20.0,914.0,10.0,r/PERSoNA,Black and White
734,21.0,1800.0,12.0,r/ItHadToBeBrazil,Only in Brazil will you have a security camera installed on a palm tree.
735,20.0,693.0,8.0,r/sphynx,Your weekly greeting from Miss Navi Nugget!
736,19.0,428.0,5.0,r/KendrickLamar,We have literally had a whole Spider-Man trilogy in the time since the last Kendrick Lamar album
737,64.0,1100.0,7.0,r/hockey,"Jack Hughes laughing at himself saying ""pp"""
738,66.0,2200.0,10.0,r/australia,"I know we rag on the Tele a lot, but on this occasion, they’ve nailed it"
739,2.0,393.0,3.0,r/SlyGifs,When you don't feel like picking something up from the floor
740,52.0,3300.0,12.0,r/blackcats,Just joined. Meet Luna.
741,1400.0,1400.0,5.0,r/AskReddit,"Before entering hell, you must sit in a waiting room. What song are they playing?"
742,19.0,3800.0,15.0,r/KamikazeByWords,Your mum
743,20.0,350.0,4.0,r/shittyrobots,Glasses for the Blind
744,45.0,6200.0,15.0,r/lotrmemes,I'll never look at this scene the same lol
745,17.0,1000.0,9.0,r/dadjokes,My boss asked me why I only get sick on work days
746,20.0,635.0,6.0,r/Daredevil,Daredevil season 3 behind the scenes photos!
747,17.0,1500.0,16.0,r/badassanimals,'3D printed beak'. They're not even hiding it anymore.
749,17.0,1100.0,10.0,r/ApplyingToCollege,leaked memo to Admission Officers
750,15.0,1400.0,24.0,r/MadeMeSmile,does your dog make giant snowballs?
752,17.0,1100.0,11.0,r/catbellies,The softest tum I ever did rub
753,101.0,1400.0,6.0,r/Showerthoughts,History makes a lot more sense when you realize we are the most sober generation there has ever been
754,17.0,1000.0,8.0,r/CoronavirusDownunder,"Man contracts, then recovers from COVID while waiting in testing line"
755,16.0,2300.0,13.0,r/RimWorld,Best Christmas gift and I also hate eating without a table..
756,84.0,5500.0,14.0,r/marvelmemes,"Mind your business, Cap"
757,23.0,1400.0,8.0,r/OldSchoolCool,I peaked in 1991
758,285.0,1300.0,8.0,r/Coronavirus,WHO warns new Covid variants could emerge that are fully resistant to vaccines as pandemic drags on
759,45.0,1100.0,7.0,r/IASIP,Truer words have never been spoken
760,16.0,999.0,9.0,r/depression_memes,bruh
761,23.0,1000.0,6.0,r/TrashTaste,The Secret Wings Recipe
762,14.0,3700.0,24.0,r/suspiciouslyspecific,Hold up
764,19.0,888.0,10.0,r/blunderyears,"Justa couple of badasses, ca. 1987."
765,43.0,1000.0,6.0,r/CuratedTumblr,Geoguesser players terrify me
766,15.0,1400.0,11.0,r/ImaginaryWarhammer,Pondering My Machine Spirit Chamber by Nictanova
767,10.0,446.0,4.0,r/AdviceAnimals,Had to change a fuse in my car and I'm not exactly a DIY or a car guy.
768,16.0,600.0,22.0,r/WeirdWheels,Tank hearse.
770,17.0,773.0,9.0,r/shieldbro,Raphtalia waiting for Naofumi (enmanuelart) [The Rising of the Shield Hero]
771,233.0,1500.0,4.0,r/nba,"[Highlight] Chimezie Metu, a career 24% three point shooter burries the game winning 3 at the buzzer right in front of the Mavericks bench!"
772,15.0,1200.0,18.0,r/Damnthatsinteresting,cute as a cucumber
774,15.0,655.0,8.0,r/bayarea,Monday’s Sunset over San Jose
775,14.0,634.0,8.0,r/FlorkofCowsOfficial,homegym
776,47.0,4100.0,7.0,r/MadeMeSmile,God bless him
777,14.0,308.0,5.0,r/dankmemes,[Request] How much would the average actually change based on what we know about the temperature inside a nuclear blast?
779,13.0,1400.0,19.0,r/WatchPeopleDieInside,Catlulated jump to slide
