,comment_count,upvote_delta,timeup_list,subreddit,thread_text
739,5 comments,844,4 hours ago,r/totallynotrobots,I WILL REACQUIRE THESE FRIENDS WITHIN THE METAVERSE.EXE
740,37 comments,883,6 hours ago,r/Simulated,MACHINE 005
741,41 comments,2.8k,11 hours ago,r/PartyParrot,I'm soldier 😂
742,14 comments,866,4 hours ago,r/tippytaps,Loves his Christmas present
743,31 comments,879,4 hours ago,r/GMEJungle,"Market has only been open for 2 hours and the volume is already over 10% of the total float. In case any onlookers are curious, this isn’t retail"
744,44 comments,2.0k,17 hours ago,r/Damnthatsinteresting,Nudibranch taking a bite.
745,44 comments,2.0k,17 hours ago,r/Damnthatsinteresting,Nudibranch taking a bite.
746,120 comments,2.2k,7 hours ago,r/IdiotsInCars,How did they think this would be okay?
747,35 comments,Vote,2 hours ago,r/JusticePorn,Three men to be sentenced to life in prison for Ahmaud Arbery murder
748,14 comments,1.4k,7 hours ago,r/goldenretrievers,I think he really enjoyed me being home for the holidays
749,23 comments,Vote,2 hours ago,r/clevercomebacks,"Bubbles, look out!"
750,53 comments,877,7 hours ago,r/ShingekiNoKyojin,"First time cosplay, pls be kind"
751,26 comments,2.0k,9 hours ago,r/pyrocynical,Some of you guys wanted another one so here you go :)
752,190 comments,2.7k,9 hours ago,r/deadbydaylight,Hope it's just for a legendary skin
753,24 comments,998,6 hours ago,r/marijuanaenthusiasts,One of the best trees I've seen while hiking
754,158 comments,2.4k,8 hours ago,r/CasualUK,"Summing up the UK, one image at a time."
755,36 comments,1.2k,6 hours ago,r/ClashRoyale,How not to wear your mask…
756,21 comments,2.3k,10 hours ago,r/puns,concrete 🗿
757,37 comments,622,4 hours ago,r/HumansAreMetal,"This Is Bruce Cook, The First Paraplegic To Backflip A Wheelchair"
758,28 comments,974,7 hours ago,r/CrossStitch,[FO] Calcifer from Howl's Moving Castle - my first fully completed project
759,25 comments,3.8k,13 hours ago,r/carporn,Two Green Lancia Delta [730x960]
760,5 comments,620,3 hours ago,r/Iamactuallyverybadass,Carpenter sends 33 students to college
761,14 comments,666,3 hours ago,r/ImaginaryWarhammer,Fireworks by me (ruoyuart)
762,45 comments,2.1k,11 hours ago,r/PixelArt,Void Crystal
763,23 comments,1.6k,8 hours ago,r/FullmetalAlchemist,"Not me, but it could be"
764,26 comments,812,6 hours ago,r/WarshipPorn,The USS Constitution looking majestic in the snow [1848 x 1230]
765,34 comments,748,6 hours ago,r/Aquariums,An army of cutie clowns
766,21 comments,1.2k,8 hours ago,r/Re_Zero,[Media] A Witch's Grief
767,28 comments,626,4 hours ago,r/ClashOfClans,You love to see it!
768,24 comments,679,4 hours ago,r/chess,Albin Countergambit accepted Anime variation (oc)
769,22 comments,743,5 hours ago,r/FemaleDatingStrategy,Never accommodating disrespect in 2022 💕
770,54 comments,3.2k,9 hours ago,r/Animemes,"Beat me up, Mommy Satan UwU"
771,112 comments,7.5k,5 hours ago,r/memes,Hello there
772,38 comments,573,4 hours ago,r/touhou,Shimmy
773,74 comments,1.4k,4 hours ago,r/Tinder,I am such an idiot
774,15 comments,1.1k,7 hours ago,r/esist,"Supercut of Republican politicians blaming Trump for the January 6 terror attack, followed by the same Republican politicians blaming everybody except Trump for the January 6 terror attack."
775,13 comments,1.2k,7 hours ago,r/cute,Grandma: “MEHEHHEHE”
776,36 comments,644,6 hours ago,r/Letterkenny,Once
777,26 comments,1.9k,10 hours ago,r/TheWayWeWere,My great grandparents with their children (My grandmother (elder) and my great aunt around 1914
778,18 comments,1.5k,8 hours ago,r/DDLC,Yuri got a bit flustered (LTze6 on twitter)
779,241 comments,2.2k,9 hours ago,r/ufc,Its hard to learn another language even as an adult.
780,6 comments,700,4 hours ago,r/Miniworlds,This little world caught my eye.
781,30 comments,941,8 hours ago,r/foxes,"Red foxes make a number of interaction calls. Submissive foxes will make ululating siren-like shrieks, aggressive encounters between foxes are met with ratchet-like sounds called gekkering, and rescued foxes, like Dixie, will elicit laughter-like sounds when communicating with her human handlers."
782,17 comments,1.5k,8 hours ago,r/HistoryAnimemes,Poland is not yet lost
783,26 comments,1.9k,9 hours ago,r/rickandmorty,Did another one of these on Forza Horizon 5 last night. Peace among worlds!
784,30 comments,704,5 hours ago,r/okbuddyhololive,rusia🇷🇺
785,31 comments,2.5k,12 hours ago,r/ImaginarySliceOfLife,Witch at work [SimzArts]
786,27 comments,1.1k,7 hours ago,r/PetTheDamnCat,just a Mexican cat
787,33 comments,997,7 hours ago,r/streetwear,[INSPO] AYYY r/STREETWEAR I WOKE UP TO MY ART ON COMPLEX!!! Thanks so much for all the support ya’ll! 🤍
788,53 comments,3.3k,2 hours ago,r/Superstonk,"🔴Daily Reverse Repo Update 01/07: $1,530.096B🔴"
789,32 comments,868,6 hours ago,r/SpidermanPS4,Raimi + TASM Suit With TASM 2 Lenses
790,25 comments,1.6k,5 hours ago,r/WinStupidPrizes,Look before you leap. Its a phrase that will help you through life.
791,17 comments,1.4k,5 hours ago,r/LeagueOfMemes,Pls give him a skin… he deserves it
792,36 comments,2.8k,5 hours ago,r/tumblr,Chihuahuas
793,20 comments,1.0k,6 hours ago,r/aviation,Cold and Lonely
794,33 comments,1.1k,8 hours ago,r/yakuzagames,I made Majima’s AOA!
795,99 comments,793,3 hours ago,r/BestofRedditorUpdates,I (26m) am interested in a woman (27f) who happens to be transgender. She doesn’t know that I know. How do I tell her in a way that doesn’t cause hurt feelings or concerns for her safety?
796,26 comments,967,7 hours ago,r/The_Mueller,"Supercut of Republican politicians blaming Trump for the January 6 terror attack, followed by the same Republican politicians blaming everybody except Trump for the January 6 terror attack."
797,16 comments,968,6 hours ago,r/Breath_of_the_Wild,Those damn Koroks are everywhere
798,36 comments,596,4 hours ago,r/3DS,What times …
799,19 comments,717,4 hours ago,r/SmashBrosUltimate,What are the chances of that
800,38 comments,496,3 hours ago,r/ww2,"In response to still surviving WW2 vets! 99 years old still going strong! He says ""hello reddit! whatever the hell that is"""
801,19 comments,1.1k,7 hours ago,r/StuffOnCats,fashion box show
802,4 comments,1.4k,8 hours ago,r/mathmemes,determinant's pretty chill with row ops
803,28 comments,532,3 hours ago,r/recipes,Coffee Bean Cookies
804,73 comments,1.6k,5 hours ago,r/TIHI,"Thanks, i hate karate now"
805,18 comments,582,5 hours ago,r/Wellworn,Brass Hammer. 1 year Vs Brand new.
806,15 comments,1.0k,7 hours ago,r/tuckedinkitties,Extremely rare double floof tuck!
807,31 comments,Vote,7 hours ago,r/tuckedinkitties,Rewards just got real. We match all the cash back you’ve earned at the end of your first year. (Limitations apply.)
808,337 comments,8.4k,8 hours ago,r/antiwork,This is why revolutionary class consciousness is so important.
809,28 comments,663,5 hours ago,r/furry,35 seconds of just Prism the Protogen & happy fursuit friday ya'll!
810,12 comments,Vote,2 hours ago,r/SubwayCreatures,Sometimes I almost miss my commute
811,125 comments,897,3 hours ago,r/CasualUK,A riot nearly happened today when a posh woman tried to jump the queue at the pharmacy... I love our british queue traditions
812,373 comments,3.7k,7 hours ago,r/facepalm,This should be illegal.
813,14 comments,641,4 hours ago,r/DetailCraft,"A vindicator called ""Johnny"" is a perfect cook, inside a kitchen. Works in survival, is a bit tricky tho."
814,237 comments,2.0k,4 hours ago,r/marvelstudios,James Gunn responds to a Fan Suggestion for Guardians of the Galaxy Vol. 3
815,11 comments,1.4k,5 hours ago,r/CuratedTumblr,green thumb grimoire
816,15 comments,754,5 hours ago,r/darkestdungeon,A Darkest Ronaldo meme (I spent too much time on it)
817,30 comments,1.0k,7 hours ago,r/distressingmemes,Under pressure
818,33 comments,1.6k,10 hours ago,r/awesome,awesome
819,1 comment,771,9 hours ago,r/aww,Wolf and her pups
820,1 comment,771,9 hours ago,r/aww,Wolf and her pups
821,14 comments,1.9k,10 hours ago,r/ImaginaryMonsters,Kings of the Forest by Dane Cozens
822,15 comments,633,4 hours ago,r/Blep,Long-term blep waiting 600+ days to be adopted
823,25 comments,3.4k,13 hours ago,r/onejob,Max Security
824,21 comments,440,3 hours ago,r/WatchandLearn,Threading a needle
825,15 comments,3.1k,6 hours ago,r/Eyebleach,This smol girl just trying to keep warm.
826,31 comments,643,6 hours ago,r/oldhagfashion,All black everything today
827,110 comments,3.9k,5 hours ago,r/Unexpected,how good are your reflexes
828,116 comments,1.6k,6 hours ago,r/Futurology,"Psilocybin, in 10mg or 25mg doses, has no short- or long-term detrimental effects in healthy people"
829,22 comments,675,4 hours ago,r/DotA2,Leaked image of the upcomming new year patch
830,27 comments,2.2k,10 hours ago,r/cursed_videomemes,Me and boys learning to cook
831,20 comments,1.1k,8 hours ago,r/IndoorGarden,Plant people working from home. I know y'all are doing this.
832,20 comments,1.4k,9 hours ago,r/AbandonedPorn,"Abandoned hospital in Mokrzeszów, Poland."
833,4 comments,Vote,2 hours ago,r/DesignPorn,This *magical* toothpick holder.
834,20 comments,720,6 hours ago,r/notliketheothergirls,tHiS dOeSnT aPpLy To Me
835,27 comments,1.1k,8 hours ago,r/vexillology,Optical illusion flag of Brazil
836,21 comments,601,4 hours ago,r/ItHadToBeBrazil,"Let’s be honest, you don’t see this advanced architecture anywhere else in the world."
837,24 comments,705,5 hours ago,r/BuyItForLife,"My dad bought this Salton waffle maker sometime in the early 90's. It's survived 5 moves, and now I make waffles for my kid with it"
838,31 comments,Vote,5 hours ago,r/BuyItForLife,Rewards just got real. We match all the cash back you’ve earned at the end of your first year. (Limitations apply.)
839,26 comments,537,5 hours ago,r/videogamedunkey,Dunkey?
840,24 comments,718,6 hours ago,r/TargetedShirts,🇱🇷🇱🇷🇱🇷
841,24 comments,824,6 hours ago,r/Pareidolia,Found on Kijiji. It's haunting.
842,35 comments,2.1k,7 hours ago,r/hmm,Hmmmm
843,21 comments,1.4k,8 hours ago,r/notmycat,"Notmycat, found this beautiful kit kit again in the park I go for running."
844,23 comments,1.2k,8 hours ago,r/Embroidery,Cute little Christmas gift for my grandma who is one of my biggest embroidery fans! Featuring her favourite bird! Pattern by magnusandquill
845,121 comments,20.6k,14 hours ago,r/ProgrammerHumor,it hurts
846,22 comments,2.2k,12 hours ago,r/AmongUs,"I got these ""Lego dots"" for Christmas, instantly knew what to do with it."
847,6 comments,595,14 hours ago,r/BirdsArentReal,Thu shall be summoned to this subreddit
848,6 comments,595,14 hours ago,r/BirdsArentReal,"Way to be discreet, surveillance drone..."
849,208 comments,842,2 hours ago,r/oddlyterrifying,"The deathtrap (hyperloop) designed by Elon Musk, supposed to be an anti-traffic jam design. Just imagine what will happen when there's an emergency or fire."
850,128 comments,885,4 hours ago,r/TheRightCantMeme,Amazingly no trans jokes here.
851,27 comments,1.1k,4 hours ago,r/CozyPlaces,My neighbor’s house always looks so cozy in the snow ❄️
852,16 comments,1.6k,9 hours ago,r/Sekiro,You are a bold one
853,24 comments,2.1k,5 hours ago,r/me_irl,me_irl
854,20 comments,1.8k,10 hours ago,r/RoughRomanMemes,Is that all you got?!
855,19 comments,1.4k,10 hours ago,r/airplaneears,"Commander, re-route course: there’s catnip in that nebula."
856,193 comments,2.9k,3 hours ago,r/nextfuckinglevel,Water used to project a stop sign in Sydney
857,19 comments,893,4 hours ago,r/Markiplier,Saw Mark on tv on a commercial about mental health
858,18 comments,836,7 hours ago,r/LiverpoolFC,Mo Salah v Watford animation
859,118 comments,1.7k,4 hours ago,r/NatureIsFuckingLit,🔥 When the Sky kisses the Earth
860,139 comments,43.0k,14 hours ago,r/wholesomememes,"Damn, That's why"
861,17 comments,1.3k,8 hours ago,r/ArcherFX,Going on Facebook now that I'm older
862,16 comments,912,7 hours ago,r/MoldyMemes,YAAAA
863,63 comments,869,3 hours ago,r/gtaonline,I'm just doing some evil deeds
864,18 comments,2.2k,12 hours ago,r/HazbinHotel,The Satyr and The Wendigo By @keydi_draws
865,16 comments,1.4k,2 hours ago,r/CryptoMoonShots,Dont Miss LAIKADOG – Presale 1000Bnb Live! | 🔥 Audited Certik | ✅Listing Pancake - Listing Mexc Exchange 🔱 Bsc - Dev Kyc Doxxed | Auto-staking | P2e | Farming | Giveaway $20.000
866,31 comments,Vote,2 hours ago,r/CryptoMoonShots,Rewards just got real. We match all the cash back you’ve earned at the end of your first year. (Limitations apply.)
867,15 comments,694,6 hours ago,r/kpop,Yuju - The 1st Mini Album: REC. (Concept Photo 1)
868,11 comments,458,2 hours ago,r/HumansAreMetal,"Skills, nothing but next level skills"
869,7 comments,1.8k,10 hours ago,r/calvinandhobbes,Bragging
870,47 comments,1.9k,8 hours ago,r/woahdude,A Trip Down Memory Lane
871,15 comments,460,4 hours ago,r/chelseafc,"A different angle of the full time whistle. Porto, May 2021."
872,120 comments,1.2k,3 hours ago,r/amcstock,"I own 4.2k shares. I’ve been in since January 29th, 2021. Although it pains me to see the stock price so far down, I have not lost my resolve in this beautiful stock. I am down 6 figures. I’M NOT SELLING!! I’M BUYIN THE DIP! Fuck you Kenny!!AMC🚀🌕💎✊🏿🦍"
873,15 comments,943,8 hours ago,r/Animal_Sanctuary,First time seeing snow for these kids at FarmSanctuary.org
874,14 comments,532,4 hours ago,r/KeanuBeingAwesome,"We are all the ""internet"""
875,14 comments,762,7 hours ago,r/standupshots,Profiles
876,2 comments,775,1 day ago,r/CuratedTumblr,Training or Defense?
877,2 comments,775,1 day ago,r/CuratedTumblr,roomba training
878,14 comments,1.5k,11 hours ago,r/trashpandas,Someone's grumpy
879,10 comments,800,6 hours ago,r/corgi,Cornbread’s 1st Snow (she loves it)
880,11 comments,915,7 hours ago,r/ArchitecturePorn,"Lakshmi Vilas Palace in Vadodara, India"
881,11 comments,Vote,2 hours ago,r/ANormalDayInRussia,Volgograd
882,11 comments,447,3 hours ago,r/thanosdidnothingwrong,Coming soon to Disney Plus!
883,10 comments,1.9k,11 hours ago,r/beetlejuicing,Poor guy
884,10 comments,381,2 hours ago,r/imsorryjon,Includes the terrifying tale ”Monday Massacre”!
885,9 comments,563,5 hours ago,r/steinsgate,Kimono Kurisu
886,10 comments,1.0k,9 hours ago,r/nier,Happy Birthday 2B by @kazamaraita
887,242 comments,2.0k,6 hours ago,r/nba,The Grizzlies have won 17 of their last 21 games
888,9 comments,905,8 hours ago,r/PunPatrol,I should have known
889,7 comments,410,5 hours ago,r/WhatsWrongWithYourCat,What apex animal is this
890,7 comments,410,5 hours ago,r/WhatsWrongWithYourCat,What apex animal is this
891,9 comments,535,4 hours ago,r/IdiotsNearlyDying,Lighting fireworks inside
892,8 comments,1.1k,8 hours ago,r/teefies,I think this is the best one I’ve seen yet!
893,6 comments,1.2k,9 hours ago,r/CatTaps,Tap tap
894,8 comments,707,6 hours ago,r/HumanForScale,"The Motherland Calls - Volgograd, Russia - 279 feet (85 meters)"
895,6 comments,824,18 hours ago,r/botecodoreddit,Brazil..
896,6 comments,824,18 hours ago,r/botecodoreddit,🐶 ⚽
897,31 comments,Vote,18 hours ago,r/botecodoreddit,Rewards just got real. We match all the cash back you’ve earned at the end of your first year. (Limitations apply.)
898,2 comments,596,4 hours ago,r/nocontextpics,PIC
899,20 comments,2.4k,9 hours ago,r/dankvideos,Tat is the luckiest guy in the class
900,32 comments,2.4k,10 hours ago,r/HydroHomies,Poor homie just wanted to drink some dihydrogen monoxide. But YouTube said no
901,18 comments,2.8k,7 hours ago,r/blursedimages,Blursed_Wireless
902,11 comments,1.6k,7 hours ago,r/meirl,Meirl
903,68 comments,1.4k,7 hours ago,r/space,Astronomers spot dying star just before it explodes and record supernova
904,401 comments,1.9k,2 hours ago,r/pics,These photos look eerily similar
905,362 comments,2.6k,5 hours ago,r/politics,Watch Ted Cruz Literally Beg Tucker Carlson for Forgiveness
906,36 comments,8.8k,15 hours ago,r/anime_irl,anime_irl
907,71 comments,2.8k,4 hours ago,r/Damnthatsinteresting,Thomas Garrett
908,86 comments,969,4 hours ago,r/ksi,"Ayoo! Congratulations JJ, big W♥️🎉. Wake me up when this man takes an L. Have been his fan since 2013 and I've never seen him take an L. Lesgoooo🔥"
909,58 comments,2.1k,9 hours ago,r/lego,Final photo shoot before this guy gets decommissioned. Keep a weather eye on the horizon matey! We may meet again 🏴‍☠️
910,14 comments,2.3k,9 hours ago,r/shittymoviedetails,In The Matrix (1999) there is a subtle hint to my dad coming home every friday night and showing my mom and me how much he loved us
911,29 comments,2.1k,15 hours ago,r/Damnthatsinteresting,And I thought this was CGI effect!!
912,29 comments,2.1k,15 hours ago,r/Damnthatsinteresting,And I thought this was CGI effect!!
913,48 comments,1.8k,8 hours ago,r/PeopleFuckingDying,gRapHic viDEo oF a wOMans FAce BeiNg DEstrOyeD bY deADly aCiD
914,52 comments,1.0k,5 hours ago,r/OnePiece,Rate KING cosplay
915,49 comments,6.3k,15 hours ago,r/EarthPorn,"Nowhere special in the public forestland of Western Oregon, USA [5464x8102][oc]"
916,83 comments,1.8k,6 hours ago,r/Genshin_Impact,[fanmade skins] Genshin x Alice in Wonderland crossover
917,17 comments,795,4 hours ago,r/reddeadredemption,"RIP Sidney Poitier. In 1958, he starred in a film called The Defiant Ones as a black prisoner chained to a white prisoner, with whom he learns to cooperate. This film served as a clear influence on the side characters Mr White and Mr Black in Red Dead Redemption 2."
918,65 comments,3.4k,6 hours ago,r/WhitePeopleTwitter,Is that it?
919,12 comments,1.1k,6 hours ago,r/Zoomies,Photo taken mid-zoomie
920,38 comments,2.3k,7 hours ago,r/BikiniBottomTwitter,"“You know, one of these days, they're going to want to make SpongeBob Babies. That's when I'm out of here.” - Steven Hillenburg, creator of SpongeBob (1961-2018)"
921,13 comments,786,7 hours ago,r/OMORI,"Booted up my old SNES to play some nostalgic games, but I can't quite shake the feeling that something's off...?"
922,65 comments,616,3 hours ago,r/Genshin_Impact_Leaks,EiMiko Duet via abc64
923,5 comments,569,5 hours ago,r/shittyreactiongifs,MW my friend tells me they didn't watch the Kentucky derby this year because they're working through a gambling addiction and didn't need the temptation
924,7 comments,626,6 hours ago,r/MostBeautiful,"Winter morning in Espoo, Finland [OC]"
925,23 comments,433,4 hours ago,r/hearthstone,How to be lucky in Hearthstone feat. Yogg-Saron and The Immovable Object.
926,95 comments,737,4 hours ago,r/SquaredCircle,"I know not everyone is a fan of Jade Cargill, but she just charms the pants off me! Busted this out during warmups in the last couple of days. <3"
927,31 comments,1.9k,9 hours ago,r/Battlefield,I hope they keep it
928,25 comments,972,8 hours ago,r/NintendoMemes,Mario's Battlefield
929,20 comments,652,6 hours ago,r/MemeHunter,we all know how it ends
930,89 comments,803,7 hours ago,r/BeardedDragons,Her name WAS George 🤦🏻‍♀️
931,52 comments,456,17 hours ago,r/instant_regret,Earn a free car by learning home defense
932,52 comments,456,17 hours ago,r/instant_regret,"When they heard the boom,boom..... they knew this was the wrong house"
933,29 comments,402,3 hours ago,r/fireemblem,Moving fates characters’ mouths slightly closer to their noses
934,17 comments,1.0k,9 hours ago,r/dontdeadopeninside,Stop dreaming doing start
935,41 comments,495,4 hours ago,r/AmateurRoomPorn,"My bedroom and bathroom! Athens, GA"
936,13 comments,1.0k,9 hours ago,r/MilitaryPorn,Polish soldiers at the Polish-Belarusian border [1700x1275]
937,23 comments,806,7 hours ago,r/dashcamgifs,Skillfully avoiding a crash
938,199 comments,3.6k,12 hours ago,r/maybemaybemaybe,Maybe maybe maybe
939,50 comments,3.6k,9 hours ago,r/AnimalsBeingJerks,Nope. You will stay right there.
940,42 comments,1.3k,7 hours ago,r/TwoSentenceHorror,"“It’s a girl!” the nurse exclaimed, as he handed her to me."
941,8 comments,919,5 hours ago,r/oddlyspecific,We all feel this though
942,101 comments,1.1k,9 hours ago,r/Persecutionfetish,This guy’s whole channel is like this
943,57 comments,5.0k,8 hours ago,r/MadeMeSmile,This is adorable!
944,6 comments,488,7 hours ago,r/sportsarefun,Life is like a bowl of roses.
945,6 comments,488,7 hours ago,r/sportsarefun,Life is like a bowl of roses.
946,11 comments,860,8 hours ago,r/BirdsArentReal,Just when you think you're safe
947,19 comments,432,4 hours ago,r/spotted,"Rare [ BMW E36 M3 GT ] only 356 made, very cool homologation special 🏎"
948,10 comments,709,6 hours ago,r/quityourbullshit,game dev reacts to fake news of their own game
949,107 comments,1.8k,8 hours ago,r/GME,Did someone just place a 110K GME share limit order?
950,45 comments,334,2 hours ago,r/ValorantCompetitive,New competitive change: Must be level 20 to play competitive instead of 10 unranked wins
951,66 comments,2.4k,7 hours ago,r/dndmemes,My first meme on this sub (partially inspired by someone else's meme)
952,33 comments,541,5 hours ago,r/nostalgia,Bobby's World (1990)
953,18 comments,498,8 hours ago,r/Awwducational,I now love foxes
954,18 comments,498,8 hours ago,r/Awwducational,"Red foxes are known to make a number of interaction calls. Submissive foxes will make ululating siren-like shrieks, aggressive encounters between foxes are met with ratchet-like sounds called gekkering, and tamed foxes will elicit laughter-like sounds when communicating with their human handlers."
955,101 comments,601,6 hours ago,r/AustralianCattleDog,We recorded her yawning in the morning for a few days. Anyone else have a Heeler that does this?
956,74 comments,3.5k,12 hours ago,r/vexillologycirclejerk,Has anyone ever noticed that the Pride flag looks kind of like a rainbow?
957,30 comments,3.3k,14 hours ago,r/SpeedOfLobsters,Me playing SSB
958,117 comments,428,4 hours ago,r/knives,Like my blade?
959,12 comments,700,7 hours ago,r/duck,Foot rub.
960,27 comments,2.1k,12 hours ago,r/ShittyLifeProTips,"SLPT: If you’re a man making love to your lady and let a fart rip, just say “engaging boosters to planet pleasure!” so not to ruin the vibe."
961,27 comments,885,8 hours ago,r/ClassPoliticsTwitter,This is why revolutionary class consciousness is so important.
962,34 comments,1.4k,8 hours ago,r/skyrim,I made a Skyrim keys holder !
963,19 comments,601,6 hours ago,r/Accounting,This is for the overthinking gang
964,14 comments,531,5 hours ago,r/ImaginaryBehemoths,Eradication by Zack Berwick
965,16 comments,3.1k,8 hours ago,r/whenthe,delicious meal
966,9 comments,530,10 hours ago,r/NatureIsFuckingLit,Todd used his weekend custody days to teach the Emmett and Elliot how to strut and impress the ladies
967,9 comments,530,10 hours ago,r/NatureIsFuckingLit,🔥 Woodcock probes the soil to search for worms
968,16 comments,569,5 hours ago,r/nasa,Getting to hold a thruster after working with NASA on the upcoming Artemis recovery mission.
969,58 comments,2.9k,1 day ago,r/interestingasfuck,Baboon becomes a leopard
970,58 comments,2.9k,1 day ago,r/interestingasfuck,A young female Leopard grows attached to a baby Baboon; sometimes carnivores become confused by their maternal instincts.
971,77 comments,393,4 hours ago,r/torontoraptors,[Josh Lewenberg] DJ Wilson is back with the Raptors. They've signed him to a second hardship 10-day.
972,8 comments,1.2k,9 hours ago,r/fixedbytheduet,When she’s into nipple play
973,50 comments,1.8k,8 hours ago,r/GMEJungle,WSJ is not our friend. Article in Friday 01/07 AM Issue.
974,36 comments,6.7k,11 hours ago,r/technicallythetruth,Gamers Know How It Is ...
975,17 comments,680,7 hours ago,r/KingOfTheHill,My neighbors had the right idea
976,52 comments,2.4k,13 hours ago,r/suspiciouslyspecific,Ben Shapiro
977,114 comments,1.3k,4 hours ago,r/Cringetopia,...
978,305 comments,Vote,40 minutes ago,r/news,Three men convicted of murdering Ahmaud Arbery sentenced to life in prison
979,75 comments,5.5k,14 hours ago,r/ItemShop,GENDER CHANGING CANDY BAR. Replenishes Hunger and changes your gender.
980,27 comments,426,4 hours ago,r/virginvschad,The Virgin criticism vs the Chad hate
981,21 comments,499,5 hours ago,r/ParadoxExtra,don't forget Stellaris
982,84 comments,935,8 hours ago,r/gay,One of my favorite memes. What was your moment?
983,79 comments,2.9k,5 hours ago,r/wallstreetbets,"Sup Retards, it’s been awhile"
984,33 comments,629,6 hours ago,r/Catholicism,"Married one year today, with a daughter due in March."
985,85 comments,1.7k,12 hours ago,r/rance,Konplotizme
986,44 comments,3.1k,11 hours ago,r/blursed_videos,Blursed Dora
987,22 comments,1.5k,11 hours ago,r/forhonor,Amazing Artwork by GASONE
988,18 comments,743,7 hours ago,r/shiba,Yoshi all proud with his first stick
989,14 comments,600,6 hours ago,r/satisfying,Satisfy
990,115 comments,1.8k,12 hours ago,r/dankinindia,r/india ugh
991,43 comments,333,3 hours ago,r/indieheads,Angel Olsen teasing something for Monday with Sharon Van Etten and Julien Baker
992,368 comments,1.6k,5 hours ago,r/teenagers,are you trash?
993,15 comments,610,6 hours ago,r/KneadyCats,Max likes to try to use his back feet ❤
994,16 comments,358,3 hours ago,r/DaniDev,Be patient yall goddamn
995,7 comments,748,7 hours ago,r/survivor,When you're at a job interview and they ask why you want to work at their company:
996,955 comments,6.3k,7 hours ago,r/survivor,Geopolitics is your sandbox
997,65 comments,2.6k,1 day ago,r/Minecraft,[Minecraft] Frogs can eat goats
998,65 comments,2.6k,1 day ago,r/Minecraft,The frogs can eat goats.
999,43 comments,867,5 hours ago,r/IndianDankMemes,ब्लेसिंग योर फीड
1000,55 comments,3.0k,11 hours ago,r/lgbt,if candace owens is praising you you’re doing something wrong
