comment_count,upvote_delta,timeup_list,subreddit,thread_text
106 comments,7.8k,14 hours ago,r/AnimalCrossing,I made the Guardian Battle at Fort Hateno from BOTW
76 comments,4.7k,12 hours ago,r/egg_irl,Egg_Irl
62 comments,3.8k,11 hours ago,r/Invincible,I’ve been prepared to post this for 2 months.
88 comments,2.3k,10 hours ago,r/Gunners,Um.... Should we be worried? 👀
73 comments,4.3k,11 hours ago,r/legendofkorra,Evolution of Team Avatar
166 comments,14.8k,13 hours ago,r/hmm,hmm
83 comments,1.4k,9 hours ago,r/NewDealAmerica,It’s worth recalling that Joe Biden is the reason this woman can’t discharge her loans via bankruptcy. Now he dangles loan forgiveness like a carrot on a stick in front of her and the rest of us.
38 comments,1.7k,3 hours ago,r/AnimalsBeingDerps,"""Please let me out 🥺"""
14 comments,2.3k,9 hours ago,r/houseplants,It’s nice when your houseplants give you clear feedback every now and again
94 comments,3.6k,15 hours ago,r/ArtefactPorn,"7000 year old Neolithic figurines from Romania, called ""The Thinker"" and ""The Sitting Woman"". (1024X768)"
73 comments,874,7 hours ago,r/ENLIGHTENEDCENTRISM,The left is worse than the kkk and nazis because at least they are honest about who they are
158 comments,17.3k,16 hours ago,r/2meirl4meirl,2meirl4meirl
121 comments,3.0k,14 hours ago,r/KeanuBeingAwesome,"69, Dudes!"
8 comments,1.4k,6 hours ago,r/TheRealJoke,Left with no rights
117 comments,837,4 hours ago,r/KitchenConfidential,Canceled my holidays due to Covid crap and every plan falling apart. Decided to prepare myself some nice Christmas dinner at home by myself. Dropped the knife while doing the dishes. Fuck me. Never seen a knife like that.
98 comments,1.2k,8 hours ago,r/196,On a gagné
98 comments,1.2k,8 hours ago,r/196,Rule 1 is a dangerous mistress
97 comments,23.1k,12 hours ago,r/wholesomememes,Me and my buddy with a meme
533 comments,23.0k,13 hours ago,r/PrequelMemes,Now THIS is Podracing!
22 comments,2.0k,8 hours ago,r/StardewValley,"Happy Holidays, fellow farmers🥳"
49 comments,2.4k,9 hours ago,r/reddeadredemption,"This detail is amazing... it’s a split second explosion, yet the shards from the Molotov cocktail are still rendered in amazing detail. No wonder my Xbox one lagged so much when I got close."
185 comments,7.6k,14 hours ago,r/BetterEveryLoop,When everything is exactly as it seems!
95 comments,3.3k,14 hours ago,r/SandersForPresident,This isn't a picture of a Bernie event. This is a picture of Bernie talking to the people that couldn't get in to a Bernie event.
68 comments,1.7k,9 hours ago,r/Undertale,"how did i get a version of the Papyrus date where every mention of dating is replaced with ""Hang out""?"
49 comments,2.6k,12 hours ago,r/okbuddyhetero,Cring straight meme made holesome 😊
121 comments,6.8k,14 hours ago,r/assholedesign,I hate any shops that do this
78 comments,3.5k,12 hours ago,r/vaxxhappened,Choices have consequences!
105 comments,2.6k,11 hours ago,r/ComedyCemetery,Nah I remember these emojis 🗿
128 comments,14.8k,16 hours ago,r/WhatsWrongWithYourDog,"Show your doggy is happy, without actually saying your doggy is happy🤗"
75 comments,3.2k,15 hours ago,r/simpsonsshitposting,Fuck this message
193 comments,2.9k,11 hours ago,r/masseffect,"I printed, assembled and painted these 1/4 scale statues of Miranda, Liara and Tali sculpted by the talented Gerardo Vasquez of La Mazmorra Estudio. Hope you enjoy. Garrus is next."
82 comments,1.1k,6 hours ago,r/DestinyTheGame,A stasis rocket launcher that does what the snowballs do would be Fantastic!
115 comments,3.8k,14 hours ago,r/nostalgia,"One Eye’D Willie’s ship - on set, The Goonies"
91 comments,726,3 hours ago,r/HollowKnightMemes,Y’all remember that whole “hornet is gay” thing? This is proof that we were right
164 comments,2.1k,9 hours ago,r/starcitizen,Caterpillar Steel - Dropship - Time to Drop!
208 comments,810,4 hours ago,r/trans,I am a transgender woman and I have a horrible secret…
59 comments,2.1k,11 hours ago,r/CasualConversation,"I just had my first ever ""typical teenager"" Hangout experience and it wasn't with my typical friend group"
109 comments,4.7k,13 hours ago,r/Warhammer40k,One of the newest freehands!
113 comments,2.2k,11 hours ago,r/reactiongifs,"MRW my fully vaxxed dad catches Covid a day before he was supposed to fly down, but he cancels his flight and will miss Christmas with us so as to not put my immunocompromised wife and unvaxxed 2 year old at risk."
29 comments,2.4k,9 hours ago,r/ich_iel,ich🎄iel
77 comments,3.8k,7 hours ago,r/therewasanattempt,To do the split across the beds
77 comments,3.8k,7 hours ago,r/therewasanattempt,To do the split across the beds
77 comments,3.7k,11 hours ago,r/adhdmeme,Wompwompwomp
29 comments,1.3k,6 hours ago,r/AbandonedPorn,"RUSTING MINE CART in abandoned Slate mine , Wales U.K. , video link 🎥 in comment .."
47 comments,2.3k,9 hours ago,r/Aquariums,A gift to our store from Seachem.
164 comments,2.1k,10 hours ago,r/Persona5,I have like 500 hours in P5/R and just now realized you can ram enemies on foot.
106 comments,1.2k,7 hours ago,r/OnePunchMan,Last chapter had me like
98 comments,1.1k,9 hours ago,r/functionalprint,It blows my mind that you can fabricate something like this on a $150 machine in your house.
22 comments,899,4 hours ago,r/BobsBurgers,Merry Christmas bobs burger community:))
73 comments,2.0k,12 hours ago,r/TheWayWeWere,"Private George A. Huckenberger in a trench near Bastogne. In December 1944, he died during a battle at the age of 22."
24 comments,1.6k,7 hours ago,r/SapphoAndHerFriend,i feel like this fits here
89 comments,723,6 hours ago,r/thefighterandthekid,"Talmbout happy hour, Bappa?"
49 comments,3.1k,10 hours ago,r/velvethippos,"For those of you who enjoyed the pics of my Ozzy in his Hawaiian shirt, here he is smiling with his Christmas ball! 😍"
96 comments,1.6k,11 hours ago,r/falloutnewvegas,fonnie
15 comments,1.9k,8 hours ago,r/okbuddybaka,rule
85 comments,1.1k,7 hours ago,r/RocketLeague,why would you do one item with two different rarites? Is this a bug? Im very confused
18 comments,3.1k,10 hours ago,r/PartyParrot,Attempted hack
70 comments,1.4k,7 hours ago,r/fakedisordercringe,"Downvoted so much in ASD subs I had to delete, ironic"
73 comments,2.7k,10 hours ago,r/AvatarMemes,NWH was fantastic
39 comments,3.4k,11 hours ago,r/confusing_perspective,The Goblin under the Staircase
134 comments,805,5 hours ago,r/Bitcoin,Bitcoin hodlers did
151 comments,3.3k,12 hours ago,r/labrador,"Buddy, our English Lab, is nearing 14. He’s been with me since I was in elementary school, and now I’m in grad school."
15 comments,1.5k,7 hours ago,r/community,Troy 's mouth is too close to his brain [S01E15]
99 comments,6.1k,14 hours ago,r/nonononoyes,Pheww.. (via @eliotnochez)
70 comments,4.6k,12 hours ago,r/itookapicture,ITAP of my wife & a friend having a late night chat.
79 comments,3.8k,15 hours ago,r/PetTheDamnCat,"Please allow me to sit on your lap, hooman!"
42 comments,1.5k,11 hours ago,r/antifastonetoss,Its more accurate now
25 comments,2.1k,9 hours ago,r/scrungycats,Ginger sink scrunge before x-mas.
110 comments,1.1k,7 hours ago,r/assassinscreed,"What do you think of Kassandras hidden blade? Personally I love the design, just wish we got the chance to actually use it"
66 comments,5.4k,13 hours ago,r/comedyhomicide,"Everything is better with cake, right?"
27 comments,865,8 hours ago,r/weddingshaming,An unexpected party boat joins the party
323 comments,2.1k,5 hours ago,r/cats,What bread is this cat?
74 comments,1.6k,9 hours ago,r/mapporncirclejerk,"This map shows every country I've been to, enjoy"
63 comments,2.3k,10 hours ago,r/standardissuecat,"My SIC came without the standard Tail Attachment, but I got the Adventure Package add-on and am pleased with my unit, anyway."
349 comments,4.3k,8 hours ago,r/pcmasterrace,My friend’s laptop battery i removed. It’s 5 years old and plugged in 99.9% of the time. How much longer do you think until it would’ve blown up?
79 comments,1.5k,9 hours ago,r/Metroid,It is inevitable
36 comments,2.2k,9 hours ago,r/bi_irl,bi_irl
64 comments,1.4k,6 hours ago,r/instantkarma,"Guy tries to rob some people, gets what he deserves."
13 comments,3.0k,10 hours ago,r/HydroHomies,Supreme water drinking experience
34 comments,2.1k,9 hours ago,r/paradoxplaza,"Man, I love the Paradox community!"
90 comments,3.3k,12 hours ago,r/GifRecipes,Super Flavorful Sticky Lemon Tofu
45 comments,1.8k,11 hours ago,r/thomastheplankengine,"Had a dream where Markiplier encountered a shoebill animatronic in Security Breach. This is what the jumpscare looked like. He seems on edge the entire video, too. Anyway when I woke up I knew I had to recreate this beast."
96 comments,395,4 hours ago,r/FortniteLeaks,"New/Readded Shop Tabs, via @iFireMonkey"
66 comments,1.7k,4 hours ago,r/NatureIsFuckingLit,🔥 Guy gets a family of geese to take a picture with him.
9 comments,2.2k,9 hours ago,r/tippytaps,Happy To Bring Back his walk: excitement
6 comments,800,3 hours ago,r/HongKong,Pillar of shame - pillar = Shame
27 comments,1.6k,8 hours ago,r/jerma985,A message I sent to my friend a couple days ago.
308 comments,2.8k,6 hours ago,r/dndmemes,Seriously what is it I’m new
24 comments,Vote,6 hours ago,r/dndmemes,"We created four holiday-themed flavors of Truly and are curious if Redditors are smart enough to spot the real ones in a sea of fakes. Upvote whichever flavors in the comments you think are real (and don’t cheat, that’s no fun)."
57 comments,2.0k,10 hours ago,r/DeepRockGalactic,speedrun tutorial
68 comments,861,4 hours ago,r/FortNiteBR,man was using aimbot and he still died
150 comments,1.2k,8 hours ago,r/minipainting,"My first post here, this figure I sculpted, printed and painted, I'm more sculptor than painter but have been practicing for couple of years now, I have seen several glorious works here an I hope some day be on level, any comments about the paint job will be greatly appreciated."
83 comments,3.3k,11 hours ago,r/OnePiece,DEMONIO FLEUR painting!
81 comments,555,4 hours ago,r/XboxSeriesX,Walked into a Target and they had this on the shelf….
136 comments,17.2k,18 hours ago,r/trippinthroughtime,Modern hero.
55 comments,2.1k,9 hours ago,r/EngineeringPorn,Just in case anyone needed a spec/drawing for this...
65 comments,2.5k,13 hours ago,r/RimWorld,Am I going to hell for laughing at this?
59 comments,1.4k,7 hours ago,r/OldManDog,Our Buddy is almost 14. He’s been with me from elementary school to grad school.
73 comments,2.1k,5 hours ago,r/CrappyDesign,"Just so we're all clear, this man has cracked open a child and is now wearing its insides on his head, correct?"
77 comments,1.3k,6 hours ago,r/PokemonSwordAndShield,"In over 300 hours of playing, I have never seen this happen, let alone from the NPCs"
55 comments,1.1k,9 hours ago,r/WetlanderHumor,6 hours
67 comments,4.5k,13 hours ago,r/2007scape,Walter on the graceful grind
49 comments,2.5k,12 hours ago,r/bestof,"Based on a baseball fan's memory from childhood, u/CoolBeansMan9 locates the recipe for a basketball player's mother's pecan fudge in a kids magazine from 25 years ago and u/DuhPai provides the text"
34 comments,1.8k,11 hours ago,r/calvinandhobbes,Ever wonder what Calvin’s Mom puts into their meals?
210 comments,13.6k,13 hours ago,r/pokemon,Introducing my new DnD character… Blast Oise!
38 comments,1.2k,6 hours ago,r/OneyPlays,SMILING FRIENDS BILLBOARD
84 comments,450,3 hours ago,r/Edmonton,Fuck this guy in particular
95 comments,2.9k,14 hours ago,r/WeWantPlates,Bread inside a purse (Portugal)
76 comments,1.1k,7 hours ago,r/MilitaryPorn,"Ukrainian soldiers parading on green t-shirts and berets, armed with Fort-221 carbines during Armed Forces Day, on 6 December 2018. The Fort-221 is an Ukrainian licenced version of the Tavor CTAR-21. [3273x2368]"
100 comments,1.3k,6 hours ago,r/CrazyFuckingVideos,Getting high as f/\ck
22 comments,3.0k,11 hours ago,r/CloneWarsMemes,How the Clone Wars started…
63 comments,585,4 hours ago,r/onguardforthee,"The Secret to the Weston Family’s Wealth Is Exploitation, Not Hard Work"
49 comments,3.6k,12 hours ago,r/powerwashingporn,1st wash in 11 years
227 comments,13.9k,13 hours ago,r/StarWars,My brother and I like messing with our mom’s nativity scene...
99 comments,3.7k,13 hours ago,r/InternetIsBeautiful,"I made a website to learn and teach guitar - read, create and share, charts and tutorials"
81 comments,1.2k,9 hours ago,r/Re_Zero,[media] Official Daphne face reveal
44 comments,3.0k,11 hours ago,r/creepy,Hell hound (by me)
84 comments,1.3k,8 hours ago,r/Brawlstars,Lola's second gadget (concept)
77 comments,5.6k,17 hours ago,r/corgi,So the puppy cam fell and everybody got curious.
114 comments,625,5 hours ago,r/xboxone,"Tf, none of my games are working"
110 comments,6.3k,9 hours ago,r/blursedimages,blursed dog
66 comments,851,4 hours ago,r/MachinePorn,"Sailors on a Russian ""Typhoon"" submarine."
61 comments,571,3 hours ago,r/pitbulls,Help! Bella won't let me put her sweater on.
21 comments,927,5 hours ago,r/thalassophobia,Apparently this is The Sunken Goddess sculpture- that’s all I know but look at how big it is!
56 comments,2.0k,9 hours ago,r/hearthstone,Sus warrior
7 comments,1.9k,9 hours ago,r/StardustCrusaders,A jolyne drawing by me
60 comments,1.7k,11 hours ago,r/botw,TIL Lynels can teleport
96 comments,817,6 hours ago,r/Frugal,Cut my full-size sponge into 3rds for doing dishes
30 comments,2.7k,7 hours ago,r/rareinsults,"It takes me an hour to watch 60 minutes, is that normal?"
73 comments,1.5k,10 hours ago,r/povertyfinance,Cried today because I have medical insurance for the first time in 10 years.
41 comments,1.3k,8 hours ago,r/bindingofisaac,reward plates...
18 comments,1.0k,5 hours ago,r/blender,I made Doc Ock arms in Blender! (Cycles)
65 comments,1.7k,8 hours ago,r/btd6,BTD6 but it's PVZ
18 comments,1.8k,8 hours ago,r/pyrocynical,Bas
3 comments,3.0k,11 hours ago,r/shittyrainbow6,"Pain, agony even, suffering, if you will, torture to say the least, anguish basically, misery as a matter of fact."
590 comments,32.4k,11 hours ago,r/Damnthatsinteresting,Making a bracelet from old coins
88 comments,1.3k,10 hours ago,r/ExpectationVsReality,The Subway salad I ordered versus what I got.
52 comments,2.9k,22 hours ago,r/woodworking,The future of sanding is upon us
52 comments,2.9k,22 hours ago,r/woodworking,My autonomous random orbit sander
106 comments,952,6 hours ago,r/seinfeld,Now it's time for the Airing of Grievances
100 comments,4.7k,13 hours ago,r/JuJutsuKaisen,Just wanted to share with you my Maki Zenin cosplay - Spear handmade by me!
47 comments,1.0k,8 hours ago,r/iiiiiiitttttttttttt,Every. Single. Time. Why??
24 comments,3.1k,11 hours ago,r/ApexOutlands,😔 Oh no
50 comments,850,8 hours ago,r/PokemonUnite,Sometimes you just gotta go for it 💁🏾‍♂️
91 comments,3.7k,16 hours ago,r/AmateurRoomPorn,Our bathroom in FL
15 comments,1.8k,9 hours ago,r/yesyesyesyesno,What a beautiful view!
848 comments,2.2k,4 hours ago,r/teenagers,i have the best music taste in this sub probably
17 comments,1.7k,8 hours ago,r/PerfectlyCutBooms,Rock?
22 comments,2.0k,9 hours ago,r/HistoryAnimemes,"Now I am become [Hentai Tag], destroyer of worlds."
89 comments,2.7k,11 hours ago,r/battlestations,My floating corner for editing
18 comments,720,4 hours ago,r/thanosdidnothingwrong,When you take it the maw is dead
84 comments,6.1k,6 hours ago,r/memes,Chemistry final coming up
61 comments,630,4 hours ago,r/hockey,"On this day in NHL history, the “Santa Brawl” took place at Nassau Coliseum. Any fan who wore a Santa costume could get on the ice during intermission. Two fans were revealed to have Ranger jerseys on and were subsequently jumped. The incident resulted in the NHL banning on ice promotions."
62 comments,2.5k,12 hours ago,r/legostarwars,"""Not to worry, we are still flying half a ship"" - early Christmas gift to myself: the Invisible Hand by TanBrickz!"
54 comments,3.8k,14 hours ago,r/spaceporn,Loved this recent article: 5 of the most exciting telescope pictures of the universe
562 comments,2.3k,7 hours ago,r/NoStupidQuestions,Why do men like boobs so much?
27 comments,3.2k,14 hours ago,r/animegifs,Noble Phantasm Excalibur!
66 comments,1.1k,8 hours ago,r/AlbedosCreations,Venhe plus a collection of characters with Gorou's ears and tail(I can do requests for these easily)
31 comments,1.5k,8 hours ago,r/HermitCraft,"On the back of the steampunk astronaut suits, everyone has the first letter of their name, except for Mumbo, who has a mustache there"
137 comments,2.9k,8 hours ago,r/ProgrammerHumor,Me Opening my 6th Chrome Tab
109 comments,8.5k,18 hours ago,r/HumansAreMetal,This man paints so realistic.
401 comments,2.2k,6 hours ago,r/PublicFreakout,"Dare Kid's pube face beta male goes to Indian reservation, refuses to wear a mask, doesn't understand tribal jurisdiction, assaults worker, Gets fined over $500, lies, plays victim and begs for money!"
69 comments,1.3k,10 hours ago,r/Wrasslin,Samoa Joe dodging his opponents is one of the funniest things & most realistic of reactions you can have in a match 😅
576 comments,5.7k,9 hours ago,r/politics,"Jen Psaki praises Trump, says 'we are grateful' for him touting the safety and efficacy of COVID-19 vaccines"
23 comments,2.2k,10 hours ago,r/BokuNoHeroAcademia,Here’s my drawing of Mirko!
60 comments,476,4 hours ago,r/yourmomshousepodcast,"Aw, shit"
20 comments,3.9k,17 hours ago,r/MapPorn,Crispy parmesan Thailand
20 comments,3.9k,17 hours ago,r/MapPorn,The topography of Thailand
34 comments,1.5k,10 hours ago,r/WhyWomenLiveLonger,Vasectomy challenge
66 comments,670,5 hours ago,r/travel,"Spending a few days in Florence, IT. Finally got to see the David... it was breathtaking."
47 comments,1.7k,11 hours ago,r/imaginarymaps,20 states (n.d.)
438 comments,9.7k,13 hours ago,r/todayilearned,"TIL that Jill Dando, presenter for the BBC ""unsolved crime"" series Crimewatch, was murdered during her time as host for the show. Crimewatch reconstructed her murder and a suspect was convicted. However, the conviction was overturned, he was acquitted upon retrial, and the case remains unsolved."
45 comments,730,7 hours ago,r/GodofWar,Mom: “We have GOW at home” GOW at home:
13 comments,868,5 hours ago,r/evangelionmemes,Asuka being the best character as always
24 comments,1.3k,7 hours ago,r/WhiskerFireworks,"Some extra sweet, extra sleepy fireworks from Amadeus this afternoon. As always, good vibes friends ✌🏾✌🏾✌🏾"
57 comments,2.0k,12 hours ago,r/OMORI,Omori drip is real
32 comments,1.9k,9 hours ago,r/forhonor,"Drive me closer, my subjects, I want to hit them with my mug."
32 comments,3.4k,15 hours ago,r/CatsAreAssholes,He is such a prick
17 comments,2.3k,10 hours ago,r/AnimalTextGifs,What leash
28 comments,1.2k,7 hours ago,r/CODZombies,Zombies community waiting for a round base map on vanguard
38 comments,1.8k,9 hours ago,r/airsoft,Same energy to u/Master_KiLL147's post
41 comments,2.7k,11 hours ago,r/GMEJungle,Right!!! Right??? 🤔
43 comments,Vote,2 hours ago,r/criticalblunder,Bully spits on a kid with broken arm
14 comments,1.6k,8 hours ago,r/dadswhodidnotwantpets,"""Don't you ever bring that bird into this house. She will not be welcome here."""
44 comments,939,7 hours ago,r/Sims4,Y'ALL I MADE MY SIM GO ON A BLIND DATE AND I GOT FREAKING FATHER WINTER I AM DONE
80 comments,12.1k,12 hours ago,r/meme,Maybe I am a mistake
88 comments,4.9k,7 hours ago,r/MadeMeSmile,"I saw someone I know on Google Streetview for the first time. It’s my dad, standing in his garage. The image was taken in 2015. He passed away in 2017 at age 93. This was like getting a surprise visit from him."
55 comments,1.1k,7 hours ago,r/DankMemesFromSite19,Happy Holidays!
317 comments,1.5k,7 hours ago,r/relationship_advice,"""New"" BF [31/M] of 9 months is insatiable sexually. I [32/F] am not used to saying no, and the frequency with which he seeks sex is really startling. Advice from people dating/married to people with high sex drive."
41 comments,5.0k,1 day ago,r/TikTokCringe,Making a Christmas Tree
41 comments,5.0k,1 day ago,r/TikTokCringe,Making a Christmas Tree
26 comments,1.3k,7 hours ago,r/foxes,i am speed. agility is my middle name
62 comments,1.8k,9 hours ago,r/sewing,First foray into menswear! Simplicity S8899 for Christmas
38 comments,1.9k,12 hours ago,r/megalophobia,Real sirenhead
32 comments,2.2k,12 hours ago,r/rimjob_steve,Appropriate username was taken
37 comments,1.3k,7 hours ago,r/furry,The Delivery Dog (Artwork by myself SixthLeafClover)
35 comments,2.4k,13 hours ago,r/disneyvacation,How to initiate sex without talking
164 comments,8.9k,8 hours ago,r/Unexpected,"Yep, that's it. Enough internet for today"
42 comments,2.0k,12 hours ago,r/reallifedoodles,wizards
37 comments,1.8k,11 hours ago,r/cromch,he cromch da lipstick
47 comments,659,7 hours ago,r/Destiny,Steven Kenneth Bonnell's Punch-Out: Socialism Circuit Opponents
64 comments,4.8k,14 hours ago,r/PixelArt,[OC] Suburbia
34 comments,2.8k,11 hours ago,r/DDLC,"Alexa, play Your Reality"
14 comments,912,5 hours ago,r/CrackheadCraigslist,All I wanted was a plush
40 comments,2.7k,14 hours ago,r/HunterXHunter,__awww
16 comments,2.2k,10 hours ago,r/blursed_videos,Blursed_EpicSave
128 comments,1.2k,6 hours ago,r/BestofRedditorUpdates,AITA for telling my girlfriend to cover up her body when strangers enter the home?
44 comments,1.0k,6 hours ago,r/ClashOfClans,“I speak for the trees” - The Lorax
50 comments,3.7k,14 hours ago,r/dogswithjobs,Latte wishing everyone happy holidays
61 comments,2.0k,8 hours ago,r/gifsthatkeepongiving,Human goat
58 comments,2.3k,10 hours ago,r/youngpeopleyoutube,among us
87 comments,3.7k,9 hours ago,r/tumblr,Next new craze
44 comments,1.4k,9 hours ago,r/JDM,"My GTR,bought in 2007 before all the hype 👌"
44 comments,1.3k,7 hours ago,r/splatoon,"I’m Probably Super Late, but I Never Realized the Salmon Rush Lobby Name Cards Were Shaped Like Salmon Filets"
11 comments,1.8k,9 hours ago,r/offlineTV,And Miyoung too but there exists no such meme template
63 comments,1.3k,10 hours ago,r/RedDeadOnline,My RDO Character: Moses
17 comments,1.5k,8 hours ago,r/bigboye,Spending the holidays with big friends
34 comments,459,4 hours ago,r/ireland,"Not all of you are going to feel OK this Christmas, especially under the current circumstances. You are not alone."
59 comments,1.7k,11 hours ago,r/fireemblem,Wanted to show my Christmas Tharja Cosplay I made. 😊
52 comments,524,2 hours ago,r/49ers,1st 49er game after being a fan for 33 years (sorry my kid is a loser)
25 comments,2.2k,11 hours ago,r/fuckcars,“Level of service”
329 comments,2.1k,8 hours ago,r/marvelstudios,Remember Eternals? Its box office just crossed $400M worldwide.
17 comments,1.6k,9 hours ago,r/ChainsawMan,My Makima Cosplay :)
260 comments,2.5k,9 hours ago,r/TwoXChromosomes,A lady at work who was obsessed with my weight being unhealthy nearly got a heart attack from smoking cigarettes all of her life
40 comments,540,6 hours ago,r/BlueArchive,The real reason PVP is unbalanced
21 comments,1.0k,9 hours ago,r/KingOfTheHill,There’s some milk in the fridge that’s about to go bad…..and there it goes.
44 comments,682,4 hours ago,r/unitedkingdom,Channel 4 News end credits on Jon Snow's last ever broadcast
15 comments,2.3k,10 hours ago,r/MoldyMemes,Epic memes 2
85 comments,3.4k,5 hours ago,r/interestingasfuck,"2D facial reconstruction of an unknown murder victim, based only on her skull, conducted by forensic artist Karen T. Taylor. Partly due to the sketch, the victim was later successfully identified"
299 comments,1.7k,7 hours ago,r/SquaredCircle,Opinion: Bobby Lashley was a great WWE champion who was treated as a big deal when he had the belt. Big E still feels like a mid-carder who just happens to be WWE champion
175 comments,3.8k,9 hours ago,r/TIHI,Thanks i hate it....
51 comments,472,4 hours ago,r/ferrets,Remember Molly!? ❤️ Meet Georgia Glow!! It begins again... ☺️
51 comments,1.5k,11 hours ago,r/creepyPMs,WTF DUDE!!!
46 comments,4.2k,14 hours ago,r/rickandmorty,And how devoted are you?
26 comments,2.8k,11 hours ago,r/MinecraftMemes,"""Accidentally"""
35 comments,1.3k,9 hours ago,r/DestinyFashion,"I love the variety that Transmog has added to this game. 6 Random Warlocks, only 2 overlapping armor pieces."
31 comments,1.7k,9 hours ago,r/Pareidolia,"Winter, staring you right in the face."
21 comments,631,4 hours ago,r/whatsthisplant,Anyone has an idea of what this is?
53 comments,612,4 hours ago,r/vancouver,Just finished this painting “The Grandview cut” 30 x 40 acrylic on canvas
18 comments,2.1k,6 hours ago,r/antimeme,No meme here
27 comments,1.6k,9 hours ago,r/wholesome,Men do cry!
42 comments,1.3k,4 hours ago,r/WatchPeopleDieInside,Competition!
172 comments,11.1k,12 hours ago,r/lotrmemes,He was usually so brilliant at it
47 comments,2.6k,11 hours ago,r/GaySoundsShitposts,Fitness
25 comments,731,5 hours ago,r/Seaofthieves,I made some Mermaid Gems out of resin... I mean.. I destroyed Siren statues
34 comments,1.8k,9 hours ago,r/Minecraftbuilds,A medieval House in a dark forest
38 comments,635,6 hours ago,r/GooglePixel,"My Findings on the Pixel 6 Pro's ""10–120 Hz"" Variable Refresh Rate"
10 comments,1.7k,9 hours ago,r/puns,He left this comment on Twitter that is totally right.
37 comments,2.5k,11 hours ago,r/notmycat,Going through a hard time right now but this nice lady brightened my day
42 comments,1.8k,10 hours ago,r/BokuNoMetaAcademia,No! NOOOOOO!
49 comments,4.7k,7 hours ago,r/funny,Courtesy of the internet
15 comments,1.3k,8 hours ago,r/ImaginarySliceOfLife,Octopus Ramen - by AnimaToey
45 comments,3.4k,13 hours ago,r/skamtebord,Be careful what you wish for
43 comments,Vote,1 hour ago,r/loopringorg,"You guys saw this tweet right, bullish!"
37 comments,2.6k,1 hour ago,r/loopringorg,Predictions Tournament
54 comments,1.0k,8 hours ago,r/ihadastroke,my friend has a stroke
