,comment_count,upvote_delta,timeup_list,subreddit,thread_text
757,14 comments,1.1k,6 hours ago,r/darkestdungeon,_BILLY YES
758,15 comments,869,7 hours ago,r/animalsdoingstuff,Kitties just want belly rubs
759,15 comments,632,5 hours ago,r/TenseiSlime,Just finished the show and Clayman at Walpurgis reminded me of this meme.
760,15 comments,394,3 hours ago,r/FreckledGirls,Happy holidaze
761,14 comments,398,2 hours ago,r/boburnham,Just got my Inside CD and Bo left me a little message ☺️
762,14 comments,628,5 hours ago,r/MoldyMemes,A
763,14 comments,544,5 hours ago,r/rance,"Voilà où je passe mes vacances de Noël, comme un authentique rançais"
764,14 comments,622,4 hours ago,r/DarkViperAU,How DarkViperAU was created
765,15 comments,878,5 hours ago,r/PetTheDamnCat,I just cant
766,8 comments,835,10 hours ago,r/instantkarma,There was an attempt
767,8 comments,835,10 hours ago,r/instantkarma,Sometimes it happens 😃
768,18 comments,1.3k,7 hours ago,r/onejob,Maximum security
769,14 comments,701,7 hours ago,r/RATS,Some cuteness to fight seasonal depression!
770,14 comments,968,7 hours ago,r/blurrypicturesofcats,blurry picture of cats
771,4 comments,958,5 hours ago,r/TrashTaste,It do be like that
772,40 comments,1.2k,7 hours ago,r/trans,I got a bunch of new dresses for Christmas and this is my favourite 😻
773,14 comments,645,6 hours ago,r/sabaton,Happy Birthdah Chris!
774,9 comments,859,5 hours ago,r/MostBeautiful,"The ancient Rock of Cashel upon snowfall, Tipperary, Ireland."
775,13 comments,1.3k,4 hours ago,r/shittymoviedetails,"In Spider-Man: No Way Home (2021), Dr. Strange wears a Columbia University hoodie under his robes. This is because he knew that Peter was rejected from MIT and wanted to rub it in that he got into a top school and Peter didn’t."
776,13 comments,3.8k,13 hours ago,r/SequelMemes,We're gonna crash
777,13 comments,463,5 hours ago,r/nier,Kaine [cosplay by Yumidun]
778,18 comments,548,2 hours ago,r/MakeMeSuffer,My Taxi driver was having a fun drive...
779,11 comments,1.1k,6 hours ago,r/2meirl42meirl4meirl,2meirl42meirl4meirl
780,35 comments,1.3k,5 hours ago,r/pokemon,"Apparently, if you press + on a Pokémon's page, it switches between one footprint and all of them."
781,13 comments,753,5 hours ago,r/HazbinHotel,"The year is nearing its end, fanart by artist Seely (@SeelApproved)"
782,130 comments,9.4k,11 hours ago,r/meme,There is another..
783,10 comments,862,6 hours ago,r/thomastheplankengine,saw this around 3am. i never played animal crossing
784,12 comments,979,6 hours ago,r/ArchitecturePorn,"Bled, Slovenia"
785,14 comments,407,3 hours ago,r/MadeMeCry,Toys R Us
786,79 comments,5.1k,12 hours ago,r/TrueOffMyChest,My mom broke life changing news to me 10 years after I figured it out.
787,15 comments,Vote,2 hours ago,r/PrincessesOfPower,[OC] Suit She-Ra as a Secret Santa Present
788,33 comments,1.2k,4 hours ago,r/gifs,Doggy wont ever leave his home again
789,11 comments,848,5 hours ago,r/RoughRomanMemes,Who needs first or second hand sources anyways.
790,129 comments,878,5 hours ago,r/ClashRoyale,When you argue with a hog player
791,12 comments,499,3 hours ago,r/antifastonetoss,95% of Reddit on any topic ever.
792,10 comments,590,3 hours ago,r/HIMYM,I always loved this scene. This guy chose the right day to visit the Empire State building.
793,11 comments,750,4 hours ago,r/GME,DRSd 30 for my dad
794,7 comments,714,4 hours ago,r/DesignPorn,"Catton House, West Vancouver, Canada, designed by Arthur Erickson and Geoffrey Massey in 1967"
795,568 comments,Vote,2 hours ago,r/memes,drop it
796,11 comments,595,4 hours ago,r/misleadingthumbnails,Rusty boat in the deep ocean.
797,6 comments,2.4k,8 hours ago,r/meirl,meirl
798,10 comments,537,5 hours ago,r/ImaginaryCharacters,South Park Reimagined by Travis Davids
799,11 comments,672,5 hours ago,r/Pareidolia,"You would squint too, if you had to gobble up a traffic sign"
800,40 comments,3.3k,7 hours ago,r/greentext,Anon learns blizzard's secret
801,30 comments,1.1k,4 hours ago,r/lego,My brother received this from my mom yesterday for christmas. Told him it would take him a little while. Woke up to this this morning.
802,309 comments,2.6k,6 hours ago,r/mildlyinfuriating,Imagine paying taxes to get roads like this
803,10 comments,565,5 hours ago,r/thanksihateit,"Thanks, I hate it. ?. ?"
804,43 comments,1.4k,5 hours ago,r/Animemes,Turn off
805,11 comments,1.1k,8 hours ago,r/casualnintendo,The more you know.
806,4 comments,743,5 hours ago,r/CatsEnjoyingPets,More head scratchies for the best kitty around
807,22 comments,1.4k,6 hours ago,r/WatchPeopleDieInside,Something definitely broke
808,10 comments,616,4 hours ago,r/woooosh,He's a special one.
809,10 comments,888,6 hours ago,r/calvinandhobbes,My parents forced me to read when I was a child and I hated it until one day they gave me the Essential Calvin and Hobbes.
810,11 comments,996,7 hours ago,r/HalfLife,Although I guess some people would like to murder their coworkers...
811,115 comments,5.0k,7 hours ago,r/facepalm,Anti-vaxxers using potatoes. Uh huh....
812,10 comments,Vote,1 hour ago,r/nasa,James Webb Space Telescope successfully deploys antenna
813,83 comments,2.8k,7 hours ago,r/ich_iel,ich_iel
814,10 comments,538,3 hours ago,r/Catswithjobs,Freight inspector and official bridge monitor
815,33 comments,1.6k,7 hours ago,r/StardustCrusaders,I drew Zombie The World
816,9 comments,711,5 hours ago,r/offlineTV,When The Smartest Kid Takes Crack (Michael Reeves Compilation)
817,9 comments,433,3 hours ago,r/Superbowl,I was told to stop by over here! “Rainbow Owl” crossstitch
818,85 comments,2.7k,9 hours ago,r/pcmasterrace,Windows 9 is clearly better
819,116 comments,811,3 hours ago,r/IASIP,Never forget the fallen
820,9 comments,526,5 hours ago,r/DankMemesFromSite19,Making an SCP meme everyday for every SCP: Day [[866]]
821,8 comments,442,4 hours ago,r/ProperAnimalNames,Depressed Lettuce
822,8 comments,1.0k,8 hours ago,r/cursed_videomemes,Nfts
823,10 comments,502,4 hours ago,r/QuotesPorn,"""Its dark because you're trying too hard.""-Aldous Huxley [1080×1317]"
824,8 comments,445,4 hours ago,r/k_on,Feeding the nyan
825,8 comments,478,4 hours ago,r/PERSoNA,Takemi [art by n2w__ej]
826,8 comments,584,5 hours ago,r/torties,"I got This absolute cutie for christmas. We adopted her, and she already feels right at Home!"
827,10 comments,1.1k,8 hours ago,r/Angryupvote,Damnit man !!!!!
828,24 comments,3.5k,8 hours ago,r/HolUp,Meanwhile Cousins who just came back from their walk..
829,7 comments,437,11 hours ago,r/insanepeoplefacebook,This is how Genders SHOULD look!!
830,7 comments,437,11 hours ago,r/insanepeoplefacebook,This is how Genders SHOULD look!!
831,185 comments,6.4k,10 hours ago,r/Cringetopia,"As a member of the black community, I humbly decline"
832,5 comments,920,6 hours ago,r/AbandonedPorn,And here we see the duality of man… Utah [OC]
833,68 comments,1.4k,6 hours ago,r/IdiotsInCars,Exiting the freeway while racing
834,7 comments,882,8 hours ago,r/hermitcraftmemes,[What about Thor] Moon? Big
835,7 comments,995,8 hours ago,r/SkyrimMemes,Almost
836,7 comments,971,8 hours ago,r/MonsterHunter,MHRise Cosplay: Cassandra
837,7 comments,626,6 hours ago,r/AccidentalCamouflage,Dalmata Beach
838,4 comments,786,5 hours ago,r/Satisfyingasfuck,Amazing art
839,18 comments,936,3 hours ago,r/TIHI,"Thanks, I hate Guava Chawla"
840,7 comments,1.1k,9 hours ago,r/skamtebord,salad
841,6 comments,440,3 hours ago,r/TheDepthsBelow,So many turtles 😍
842,58 comments,853,3 hours ago,r/Genshin_Impact_Leaks,Qiqi's domain has been repurposed for the Potions event (via BLANK)
843,285 comments,Vote,1 hour ago,r/movies,THE BATMAN - The Bat and The Cat Trailer
844,411 comments,2.3k,7 hours ago,r/PublicFreakout,Karen gets bad because woman moves her flower pot away from her own front door.
845,6 comments,698,7 hours ago,r/notmycat,Not my cat sitting outside my window around 9pm
846,5 comments,421,4 hours ago,r/BreadStapledToTrees,A Tiny Slice on American Beech
847,5 comments,765,6 hours ago,r/ofcoursethatsathing,Underground Houseplant Robot Fighting Ring
848,7 comments,1.3k,3 hours ago,r/wholesomememes,Good times :)
849,17 comments,1.6k,4 hours ago,r/oddlysatisfying,Video collage of a SpaceX launch.
850,23 comments,1.6k,7 hours ago,r/IllegallySmolCats,Roar loud little lion.
851,4 comments,419,3 hours ago,r/funnyvideos,Football Commentators In Real Life
852,5 comments,593,5 hours ago,r/dreamsmp,The two Arctic Empires
853,9 comments,1.6k,7 hours ago,r/starwarsmemes,Book of Boba Fett opening scene
854,44 comments,1.5k,7 hours ago,r/WhatsWrongWithYourDog,What's wrong with him?
855,151 comments,1.2k,6 hours ago,r/tifu,TIFU by thinking honey is spicy
856,179 comments,855,3 hours ago,r/wallstreetbets,This is what injecting hopium looks like.
857,32 comments,997,4 hours ago,r/formuladank,Gordon Murray was bonkers
858,4 comments,1.0k,17 hours ago,r/WinStupidPrizes,AA-
859,4 comments,1.0k,17 hours ago,r/WinStupidPrizes,Kid doing science experiment on the treadmill
860,4 comments,1.2k,9 hours ago,r/EmpireDidNothingWrong,My oil painting of Darth Vader
861,3 comments,Vote,2 hours ago,r/KeanuBeingAwesome,Behind the scenes with Stephen Colbert
862,3 comments,387,2 hours ago,r/submechanophobia,A ship lowering a deep sea oil pipeline
863,3 comments,374,3 hours ago,r/Animal_Sanctuary,"Bolt, the Egyptian fruit bat, quickly claiming his mango treat from his caretaker at Bat World Sanctuary"
864,3 comments,388,3 hours ago,r/sweden,Jakten efter svenska tacos till fredagsmyset här i Peru intensifieras
865,3 comments,590,5 hours ago,r/tuckedinkitties,My kitty Bjorn waiting for Santa
866,2 comments,477,4 hours ago,r/absolutelynotme_irl,absolutelynotme_irl
867,1 comment,638,4 hours ago,r/MEOW_IRL,MEOW IRL
868,297 comments,1.9k,8 hours ago,r/NoStupidQuestions,If you make macaroni and cheese with holy water does the macaroni and cheese become holy? If not which part of the process removes it's holiness?
869,193 comments,2.3k,8 hours ago,r/todayilearned,"TIL King Ferdinand VII of Spain had a huge member, so much in fact that it's rumored that one of his wives died of a hemorrhage derived from having sex with the monarch."
870,311 comments,1.9k,7 hours ago,r/CasualUK,Anyone else currently drowning in chocolate?
871,183 comments,11.5k,14 hours ago,r/whenthe,"You have good taste, my man"
872,275 comments,2.5k,13 hours ago,r/Damnthatsinteresting,This Is How Women Dressed In The Year 1896
873,275 comments,2.5k,13 hours ago,r/Damnthatsinteresting,This Is How Women Dressed In The Year 1896
874,29 comments,1.8k,5 hours ago,r/me_irl,me_irl
875,129 comments,13.2k,16 hours ago,r/AnimalCrossing,I did this ACNH animation based on my winter trauma. Please enjoy 😊
876,140 comments,1.9k,3 hours ago,r/funny,I photoshopped an armadillo and a doe together
877,118 comments,997,2 hours ago,r/Tinder,For context she said she was learning French..
878,25 comments,2.6k,10 hours ago,r/Technoblade,Happens way too often :( (original technofanart in comments)
879,120 comments,15.0k,22 hours ago,r/tuckedinkitties,this must be so cozy
880,120 comments,15.0k,22 hours ago,r/tuckedinkitties,this must be so cozy
881,88 comments,910,5 hours ago,r/confidentlyincorrect,LinkedIn influences are on a whole different league
882,85 comments,1.0k,6 hours ago,r/gtaonline,Just 300 more
883,29 comments,1.5k,7 hours ago,r/science,"A significant proportion of U.K nurses were identified as having probable PTSD during the pandemic . While this declined over the three surveys, almost 29.3% continued to report experiences indicative of a probable post-traumatic stress disorder diagnosis 3 months after the first pandemic peak."
884,112 comments,678,4 hours ago,r/technology,"One-Third Of Programmers Use Marijuana While Working, With Many Touting Creative Benefits, Study Finds"
885,89 comments,1.7k,9 hours ago,r/awfuleverything,that's enough internet for the century
886,86 comments,2.3k,5 hours ago,r/politics,Alleged ‘dead’ Georgia voters found alive and well after 2020 election
887,37 comments,1.4k,7 hours ago,r/dankvideos,Reason why Men live shorter than women
888,65 comments,2.1k,8 hours ago,r/europe,"30 years today since the miracle at Gottröra (Scandinavian Airlines Flight 751) - Even though the airplane broke in three, there were no fatalites"
889,13 comments,1.3k,4 hours ago,r/suspiciouslyspecific,😔
890,83 comments,712,3 hours ago,r/LifeProTips,LPT: The *least* expensive part of owning a pet is buying the pet.
891,48 comments,1.3k,7 hours ago,r/TwoSentenceHorror,I was surprised by my ex-wife's nice gesture of sending me a box of chocolates for my 5 years of sobriety anniversary.
892,66 comments,927,5 hours ago,r/Grimdank,On a thread about kill team
893,93 comments,1.1k,5 hours ago,r/amcstock,I HOLD FOR 1m
894,110 comments,1.4k,7 hours ago,r/IndianDankMemes,Bruhh
895,47 comments,655,3 hours ago,r/Conservative,"“Alleged?” Hope Xi sees this, bro."
896,53 comments,1.1k,5 hours ago,r/natureismetal,Frog got caught in a flash freeze
897,27 comments,3.2k,9 hours ago,r/therewasanattempt,To catch the toy
898,49 comments,4.9k,13 hours ago,r/antimeme,It's a cow
899,63 comments,651,3 hours ago,r/DestinyTheGame,The 30th Anniversary ornament has finally let my Titan live his dream....of being covered in cats.
900,28 comments,4.7k,13 hours ago,r/Bossfight,"Dux, Obliteration of Boundaries, Protector of Egg"
901,77 comments,893,3 hours ago,r/nba,[Zach LaVine] reacts to recording his 65th 30-point game with the Bulls and being only 472 away from Michael Jordan's record: “😂😂Dude wasn’t real.”
902,53 comments,7.2k,11 hours ago,r/blursedimages,Blursed_Present
903,54 comments,1.3k,4 hours ago,r/titanfall,both are pretty cool
904,2 comments,1.5k,8 hours ago,r/BrandNewSentence,Someone please eat my brain spaghetti.
905,25 comments,1.1k,8 hours ago,r/oddlyspecific,It is pretty effective though
906,25 comments,1.1k,8 hours ago,r/oddlyspecific,"Ok, Josh"
907,54 comments,1.9k,7 hours ago,r/news,"E.O. Wilson, naturalist dubbed a modern-day Darwin, dies at 92"
908,31 comments,2.3k,8 hours ago,r/lotrmemes,🤖
909,65 comments,1.1k,4 hours ago,r/OldSchoolCool,"Tennis fashion, 1978"
910,19 comments,1.2k,7 hours ago,r/itookapicture,ITAP of a Northern hawk owl
911,15 comments,1.4k,5 hours ago,r/cursedcomments,Cursed_wolverine
912,123 comments,592,16 hours ago,r/oddlyterrifying,Consider modern drones as a realistic candidate before you post a blurry video of a UFO from ground saying it moves goo fast.
913,123 comments,592,16 hours ago,r/oddlyterrifying,Drone reaching ridiculous speed in 1 second
914,1 comment,403,4 hours ago,r/ReasonableFantasy,Alice by Nature San light
915,59 comments,496,2 hours ago,r/MaliciousCompliance,Ex demands undercooked chicken; can’t understand how he got sick
916,19 comments,3.2k,15 hours ago,r/ImaginarySliceOfLife,Bokka Pass by のば
917,60 comments,886,15 hours ago,r/ANormalDayInRussia,Russians vs. the English language
918,60 comments,886,15 hours ago,r/ANormalDayInRussia,Russians trying to make sense of English
919,16 comments,805,8 hours ago,r/Izlam,Siblingz unite!
920,131 comments,520,5 hours ago,r/Anarcho_Capitalism,"Is Reddit just a propagandist tool? My feed is littered with glaringly wrong, biased ‘news’ posts."
921,67 comments,1.1k,9 hours ago,r/Fallout,F*** that armed bottlecap mine in Starlight Drive-In
922,20 comments,528,5 hours ago,r/overlord,Clementine [OC]
923,144 comments,668,7 hours ago,r/ShuumatsuNoValkyrie,Chapter 57 - Shuumatsu No Valkyrie
924,43 comments,490,5 hours ago,r/PokemonROMhacks,[MAP] Pokémon Giratina's Legend - Ethereal City
925,15 comments,312,3 hours ago,r/BuyItForLife,Sunbeam Mixmaster still making cakes
926,49 comments,1.1k,10 hours ago,r/xqcow,x & marty ACTUAL duo of the year
927,39 comments,4.2k,17 hours ago,r/funny,I don’t understand the appeal
928,39 comments,4.2k,17 hours ago,r/funny,I don’t understand the appeal
929,23 comments,371,4 hours ago,r/stalker,Mr. Incredible becoming uncanny (S.T.A.L.K.E.R Edition)
930,56 comments,1.9k,13 hours ago,r/DotA2,GabeN really thought he could fool me…
931,15 comments,669,7 hours ago,r/TarkovMemes,Me as a Scav trying to befriend a thicc PMC
932,10 comments,1.6k,12 hours ago,r/Re_Zero,[Media] Ram Mondays #94
933,4 comments,524,5 hours ago,r/woof_irl,woof irl
934,139 comments,491,2 hours ago,r/Deltarune,"i had a lot of fun drawing new Berdly's dialogue sprites, so now i'm asking you to give me any cosplay ideas for Kris! (i'll choose the most interesting suggestions from your comments)"
935,204 comments,465,5 hours ago,r/Seattle,Were you a part of that incredible shit show that was SeaTac yesterday? What's your story?
936,168 comments,422,4 hours ago,r/portugal,O meu vizinho é inspetor das finanças e é corrupto.
937,133 comments,3.5k,15 hours ago,r/BoneAppleTea,Maternity Leaf 😅
938,49 comments,394,4 hours ago,r/pokemongo,"At long last, it’s finally done. Caught a Kabuto, and now I’m free!"
939,8 comments,876,6 hours ago,r/oddlyspecific,"Meanwhile, in another dimension"
940,293 comments,1.5k,11 hours ago,r/EscapefromTarkov,My buddy has an Altyn & a slick
941,12 comments,545,6 hours ago,r/notdisneyvacation,How to Have Fun at a Party Where Everyone Is Getting Drunk
942,57 comments,477,5 hours ago,r/chile,/r/chile in a nutshell
943,44 comments,1.1k,4 hours ago,r/formula1,James Hunt and Niki Lauda just casually having lunch while sitting in the sidepod of a Ligier.
944,29 comments,831,8 hours ago,r/WritingPrompts,"[WP] ""BE NOT AFRAID"" said the multi-eyed, feather-winged being. ""Sir, this is a Wendy's"" sighed the baggy-eyed, tired cashier."
945,24 comments,1.7k,12 hours ago,r/PetsareAmazing,Gentle Giant with his Tiny Friend!
946,33 comments,1.5k,8 hours ago,r/hmm,Hmm
947,167 comments,5.1k,18 hours ago,r/loseit,Any “weight gain” after a single holiday meal is poop and water retention. You didn’t “gain” multiple pounds of body fat. You’re fine.
948,30 comments,350,3 hours ago,r/pansexual,"decided to cut my hair off, how do you guys like it?"
949,43 comments,438,5 hours ago,r/DDLC,You are wonderful
950,183 comments,666,4 hours ago,r/TwoXChromosomes,"More women than men feel uncomfortably cold at the office, and it’s impacting their work performance"
951,28 comments,550,6 hours ago,r/Destiny,The Match of the Century
952,81 comments,4.6k,17 hours ago,r/redneckengineering,PVC pipe bazooka ignites bonfire
953,15 comments,389,4 hours ago,r/cakedecorating,A cute cake for the birthday girl! :)
954,40 comments,795,5 hours ago,r/ffxiv,I made a little Fat Cat ( ˙꒳​˙ )
955,381 comments,2.5k,14 hours ago,r/ApexOutlands,Who is this? Wrong answers only.
956,230 comments,21.6k,11 hours ago,r/shitposting,I am 14 and this is deep
957,214 comments,998,11 hours ago,r/WhitePeopleTwitter,Richie Rich
958,214 comments,998,11 hours ago,r/WhitePeopleTwitter,Richie Rich
959,175 comments,1.2k,10 hours ago,r/australia,Australia is the hottest place in the world right now and I’m definitely feeling it
960,45 comments,10.1k,19 hours ago,r/AvatarMemes,Until next November 1st
961,28 comments,372,4 hours ago,r/DestinyFashion,"""Chroma Fang' I think I have found a very unique look for my hunter, what do you guys think ? appreciate any feedback !"
962,222 comments,12.1k,20 hours ago,r/toptalent,"After 2 years and over 750 working hours, my dad finally finished building his fireplace"
963,34 comments,298,2 hours ago,r/Argaming,+10 de carisma
964,66 comments,1.2k,5 hours ago,r/oddlyterrifying,"New fear unlocked, the bone and skin man"
965,68 comments,604,6 hours ago,r/WeWantPlates,Didnt think they’d serve my steak INSIDE my drink. New York Strip in a Manhattan lol.
966,44 comments,1.1k,10 hours ago,r/okbuddyhetero,Like bruh 💀💀💀
967,10 comments,356,3 hours ago,r/superpoweralchemists,Knowing everything about 3 year olds
968,179 comments,514,5 hours ago,r/canada,"Canadians eager to be nurses facing tougher entry requirements, fewer training spots"
969,21 comments,982,6 hours ago,r/egg_irl,egg😍irl
970,108 comments,324,3 hours ago,r/PersonalFinanceCanada,Do not use KOHO
971,11 comments,337,3 hours ago,r/CoolGadgetsTube,Open / Closed 3D Prints
972,31 comments,917,3 hours ago,r/dndmemes,Am I too much of a lore nerd?
973,180 comments,1.0k,9 hours ago,r/memesITA,Girartelo fino alla fine (collaborazione con u/NapoleoneBonoacarte u/donix_d_nator u/wjdbfifj e u/itsfrank25
974,56 comments,7.6k,13 hours ago,r/PrequelMemes,I've been looking forward to this
975,50 comments,1.4k,5 hours ago,r/gaming,R6 do be strange sometimes doe
976,4 comments,657,7 hours ago,r/ImaginaryMonsters,God by Me
977,170 comments,476,5 hours ago,r/boxoffice,All 48 Billion Dollar Films
978,14 comments,684,7 hours ago,r/SandersForPresident,This pandemic makes it clear how dysfunctional our healthcare system is. Let us not give up the struggle for Medicare for All.
979,19 comments,515,6 hours ago,r/RDR2,"The realism is stunning, found his teeth and my bullet in this point blank E-Round execution."
980,14 comments,887,9 hours ago,r/HuTao_Mains,I'm a little late to the party but Merry Christmas! 🎄Hutao fanart by me~
981,26 comments,1.6k,3 hours ago,r/Hololive,"No memes. Just Haachama appreciation posting. KEEP WORKING HARD, STRONGEST IDOL!"
982,758 comments,5.4k,17 hours ago,r/RedDeadOnline,do you like my character?
983,37 comments,424,5 hours ago,r/SonicTheHedgehog,Amy Rose by @PyonSukis
984,6 comments,410,5 hours ago,r/ACAB,Wee Woo pt 2
985,1 comment,Vote,2 hours ago,r/Damnthatsinteresting,A deep sea monster scene inside a block of epoxy
986,1 comment,Vote,2 hours ago,r/Damnthatsinteresting,A deep sea monster scene inside a block of epoxy
987,5 comments,734,8 hours ago,r/pisscommenting,Beat it chick!
988,99 comments,381,4 hours ago,r/BravoRealHousewives,"The top result, wow"
989,12 comments,454,5 hours ago,r/EpicSeven,Yufine [art by げげ_gae'gae]
990,273 comments,Vote,2 hours ago,r/JoeRogan,"Elon Musk says 'wokeness' is 'divisive, exclusionary, and hateful'"
991,15 comments,370,4 hours ago,r/nostalgia,Rugrats watches
992,144 comments,796,5 hours ago,r/unpopularopinion,"""Home made"" doesn't mean ""good"" and it's extremely overrated"
993,39 comments,630,4 hours ago,r/niceguys,I’m glad he made all his red flags loud and clear
994,12 comments,940,6 hours ago,r/SweatyPalms,jumping into the water like this
995,172 comments,363,4 hours ago,r/germany,How do you feel? There are more and more more atheists?
996,186 comments,5.6k,7 days ago,r/DocumentedFights,HMFT after I try to attack someone whose filming me
997,186 comments,5.6k,7 days ago,r/DocumentedFights,dickhead gets humiliated
998,73 comments,3.6k,13 hours ago,r/anime_irl,anime_irl
999,148 comments,802,8 hours ago,r/IllegalLifeProTips,ILPT: Quickly disable FaceID on iPhone in case the police gets your phone
1000,16 comments,863,6 hours ago,r/MovieDetails,"In Ratatouille (2007), the restaurant has ""Nemo"" brand caviar, a reference to Finding Nemo (2003)."
1001,9 comments,442,5 hours ago,r/analog,Boardwalk [Minolta SRT-101 | 50mm f/1.4 | Kodak Portra 400]
1002,44 comments,570,6 hours ago,r/EliteDangerous,The more you look the weirder it gets
1003,15 comments,339,7 hours ago,r/MadeMeSmile,Tippy taps for his gift! 🎄
1004,15 comments,339,7 hours ago,r/MadeMeSmile,Man gets what he wants for Christmas…
1005,16 comments,2.1k,11 hours ago,r/BikiniBottomTwitter,Just adult things
1006,4 comments,373,4 hours ago,r/ImaginaryBehemoths,Grimdancer by Randy Vargas
1007,41 comments,898,3 hours ago,r/BlackPeopleTwitter,A romantic WWE Mixed Tag Team Match for four.
1008,15 comments,374,4 hours ago,r/guineapigs,Now this is how Mondays should be handled!
1009,45 comments,724,8 hours ago,r/SatisfactoryGame,Q: How big a rail network should we build? A: Yes!
1010,27 comments,902,9 hours ago,r/howtonotgiveafuck,“I will not give a fuck”
1011,16 comments,356,4 hours ago,r/horizon,Rare view of two Behemoths mating
1012,6 comments,400,4 hours ago,r/PandR,Sister in law came through with the greatest Xmas present!
1013,26 comments,847,3 hours ago,r/TheLastAirbender,Real Life Bending
1014,14 comments,1.5k,12 hours ago,r/MadeMeSmile,Being pulled over
1015,14 comments,1.5k,12 hours ago,r/MadeMeSmile,Cops pulling the guy over..
1016,14 comments,818,8 hours ago,r/MilitaryPorn,Croatian soldiers going home from frontlines in Croatia summer 1991. [1080 x 719]
1017,417 comments,330,3 hours ago,r/Libertarian,"For those of you thinking about moving to Florida because it the ""free-est state in the US"" remember these points."
1018,240 comments,14.4k,21 hours ago,r/Astronomy,The James Webb. From my observatory.
1019,7 comments,598,7 hours ago,r/ImaginaryLandscapes,Distant Hills
1020,17 comments,378,4 hours ago,r/americandad,At Disney today. Immediately thought of this.
1021,53 comments,1.1k,7 hours ago,r/lgbt,I guess I’m gay now
1022,47 comments,330,3 hours ago,r/retrogaming,Did you guys notice George Costanza owned a Virtual Boy?
1023,32 comments,347,4 hours ago,r/LegendsOfRuneterra,"It's one damage, Michael. How much could it cost? 7 mana?"
1024,103 comments,999,10 hours ago,r/2visegrad4you,I hate their nat***alists🤢. Our Nationalists are the best!!! 💪💪💪
1025,17 comments,375,4 hours ago,r/splatoon,Discount Splatoon
1026,12 comments,Vote,2 hours ago,r/corgi,Jake is 14 today! Our little king
1027,6 comments,969,9 hours ago,r/PunPatrol,Sorry not sorry
1028,17 comments,352,4 hours ago,r/feemagers,Guys am I dreaming?? The jeans I got for Christmas have pockets deep enough to actually fit stuff??
1029,3 comments,338,4 hours ago,r/dank_meme,Any Numbers? ;-)
1030,14 comments,Vote,1 hour ago,r/pettyrevenge,"His stupid driving caused a wreck, but I walked off with a little satisfaction..."
1031,123 comments,291,3 hours ago,r/greece,Έπεσα θύμα βίαιης ομοφοβικής επίθεσης από προσωπικό νυχτερινού κέντρου. Η αστυνομία δεν έκανε απολύτως τίποτα. Τι μπορώ να κάνω?
