,comment_count,upvote_delta,timeup_list,subreddit,thread_text
233,331 comments,7.4k,14 hours ago,r/DunderMifflin,Didn’t know this was a serious problem for people XD.
234,161 comments,3.0k,4 hours ago,r/CrappyDesign,This is so hard to understand im putting an explanation in comments
235,189 comments,568,4 hours ago,r/baseball,[Jessica Toonkel] NYT To Buy The Athletic for $550 Million
236,226 comments,7.6k,17 hours ago,r/science,Ants Can Heal Wounded Trees
237,244 comments,3.0k,7 hours ago,r/dataisbeautiful,[OC] Major reason for suicide in each State & U.T. of India (year 2020)
238,191 comments,1.4k,6 hours ago,r/nocontextpics,PIC
239,71 comments,5.5k,8 hours ago,r/Art,"Fox, Me, Digital, 2021"
240,242 comments,Vote,8 hours ago,r/Art,"[PSA] We want your track driving Pro Tips, Reddit. Comment with your best technical tip for some gold, and a chance for your maneuver to be demonstrated by a Toyota Motorsport driver in the all new GR86."
241,234 comments,7.6k,5 hours ago,r/nextfuckinglevel,Hi folks! I've designed this Lego tree that I've submitted to LEGO Ideas and would like to know what you think!
242,288 comments,706,6 hours ago,r/GreenBayPackers,Aaron Rodgers on future in Green Bay: 'The grass is greener where you water it'
243,193 comments,6.9k,13 hours ago,r/ContagiousLaughter,Petition for more boob space
244,189 comments,5.6k,4 hours ago,r/Superstonk,"I called the dtcc in NY NY and they confirmed that until you DRS YOU DONT OWN SHIT. Here is the number ask for yourself, 888 382 2721, first prompt press 1, second prompt press 4. Watch this get down voted."
245,267 comments,2.5k,6 hours ago,r/ParlerWatch,"Ted Cruz calling Jan. 6 a ""violent terrorist attack"" leaves Trump supporters outraged"
246,34 comments,3.0k,4 hours ago,r/KidsAreFuckingStupid,Technically the truth.
247,251 comments,17.5k,19 hours ago,r/UpliftingNews,"After a 70 years absence, cheetahs to return to Indian jungles"
248,130 comments,2.5k,12 hours ago,r/SpidermanPS4,Black suit Glitch? Has anyone else come across this?
249,173 comments,2.7k,4 hours ago,r/Grimdank,Straight from r/TraitorsWritingLoyalists
250,28 comments,4.5k,7 hours ago,r/AnimalsBeingBros,Everyone needs a little help sometimes
251,305 comments,708,4 hours ago,r/ffxiv,Current state of housing market.
252,76 comments,2.7k,4 hours ago,r/BoneAppleTea,Current state of this sub
253,134 comments,4.5k,10 hours ago,r/agedlikemilk,This took a very dark turn
254,240 comments,934,7 hours ago,r/projectzomboid,2022 and Beyond
255,269 comments,1.0k,8 hours ago,r/brasil,"Parcelar carro é pros fracos, o negócio é parcelar IPhone pelo visto"
256,229 comments,6.8k,13 hours ago,r/assholedesign,"Benches at our school, made from just Steelrods so you cant sit on them very long"
257,253 comments,11.4k,19 hours ago,r/Futurology,Drone carrying a defibrillator saves its first heart attack patient in Sweden
258,147 comments,2.9k,5 hours ago,r/ATBGE,Maison Margiella Tabi shoe
259,171 comments,4.3k,6 hours ago,r/OnePiece,"""Luffy on Throne"" by Last Sleep Studio"
260,79 comments,6.8k,7 hours ago,r/dankvideos,Somebody has to do it
261,78 comments,1.3k,5 hours ago,r/okbuddybaka,Can't wait to see anon's debut!! 😀
262,223 comments,3.2k,10 hours ago,r/destiny2,"As a new player, i would be so happy to play the Leviathan-Raids."
263,141 comments,3.9k,14 hours ago,r/okbuddyhetero,Lesbian posting 💪
264,378 comments,1.7k,3 hours ago,r/Overwatch,How would you describe this?
265,156 comments,3.9k,12 hours ago,r/UrbanHell,"Alma-Ata, Kazakhstan, tonight"
266,56 comments,5.7k,8 hours ago,r/futurama,Let the Feast Of A 1000 Hams begin!
267,156 comments,339,3 hours ago,r/DuggarsSnark,A new season of life continues
268,112 comments,9.1k,16 hours ago,r/HumansBeingBros,He ain't heavy
269,1.1k comments,7.1k,6 hours ago,r/antiwork,"My availability has always been strictly Mon-Fri. I spoke to a manager when I saw this sign and was told I will be working that day, regardless of my availability. The schedule is now up and I have been assigned a full shift that Saturday."
270,144 comments,2.3k,12 hours ago,r/distressingmemes,Life Through Nothing
271,110 comments,4.2k,15 hours ago,r/insaneparents,Had to fix it oops. When you blow up on your stepmom cause she hid the fact her family all tested positive for Covid.
272,383 comments,1.7k,6 hours ago,r/playstation,Pick One Colour
273,102 comments,758,6 hours ago,r/victoria3,AAR screenshot - Opulent pops
274,226 comments,967,5 hours ago,r/india,I hit my chemistry sir
275,52 comments,2.6k,4 hours ago,r/Awwducational,"When you tickle rats, they laugh. Their voices are so high-pitched that you need special equipment to hear them, but once you do, you can hear their laughter right away."
276,225 comments,3.4k,5 hours ago,r/WinStupidPrizes,Make a fresh haircut with chef machine
277,210 comments,1.1k,9 hours ago,r/aviation,"The time SR-71 Blackbird crew that ‘gave the birdie’ to a French Air Force Mirage III pilot, lit the afterburners and outran him"
278,148 comments,2.7k,4 hours ago,r/thatHappened,Im sorry but what.
279,233 comments,1.3k,9 hours ago,r/ireland,Beat the banks by just… looking down!
280,338 comments,2.4k,9 hours ago,r/ClashRoyale,Let's play a game. Try and guess my opponent`s last card
281,126 comments,6.9k,11 hours ago,r/GamePhysics,[Blade & Sorcery] Extremely professional stealth kill
282,289 comments,2.1k,7 hours ago,r/PS5,Half-Life: Alyx will be coming to PlayStation VR2
283,283 comments,11.0k,12 hours ago,r/starterpacks,Guy who always wears shorts in the middle of winter starter pack
284,149 comments,1.5k,8 hours ago,r/whatsthisbug,"Hi, my mother sent me this video and asked if I knew what it was, I have absolutely no idea so asking here. It sticks it’s younger out kind of like a snake but looks more like a worm. Found in southern Spain"
285,198 comments,4.2k,4 hours ago,r/funny,I bet there is an even bigger Buddha behind that
286,145 comments,3.9k,6 hours ago,r/rarepuppers,Cat? Dog? Other?
287,314 comments,2.4k,5 hours ago,r/dankinindia,Modern Problems Require Modern Solutions
288,34 comments,3.8k,1 day ago,r/MadeMeSmile,He's so happy to see her
289,34 comments,3.8k,1 day ago,r/MadeMeSmile,He's so happy to see her
290,191 comments,1.8k,11 hours ago,r/MoldyMemes,Moldy birthday cake
291,88 comments,7.5k,9 hours ago,r/FuckNestle,True champs I tell you
292,135 comments,10.7k,13 hours ago,r/ScottishPeopleTwitter,Good rationing there
293,213 comments,1.8k,9 hours ago,r/byebyejob,"Tucson police officer who fatally shot man in wheelchair has been fired, department says"
294,170 comments,2.0k,7 hours ago,r/ElderScrolls,The levitation act is such bs.
295,99 comments,2.0k,8 hours ago,r/AccidentalRacism,H&M ad
296,150 comments,15.9k,12 hours ago,r/comics,Science!
297,100 comments,14.1k,10 hours ago,r/tumblr,Hmmmmmmmmmmmmm
298,30 comments,4.2k,7 hours ago,r/suicidebywords,Fiona after dark
299,190 comments,3.6k,13 hours ago,r/tooktoomuch,when the alcohol kicks in and you suddenly convert to veganism
300,134 comments,2.9k,5 hours ago,r/LosAngeles,"One year ago today, Congressman Mike Garcia (R-Santa Clarita) was caught on camera meeting with rioters shortly before they stormed the U.S. Capitol. Later that day, Garcia voted to overturn the election. He's up for re-election this year."
301,221 comments,3.4k,6 hours ago,r/Shitty_Car_Mods,Who needs to see out of the rear window anyway
302,238 comments,1.0k,8 hours ago,r/EverythingScience,'The next variant is just around the corner': Experts warn the world's at risk until all are vaccinated
303,151 comments,4.2k,12 hours ago,r/dankruto,"I dub thee, The Most Cursed Depiction Of Naruto Ever"
304,61 comments,7.7k,9 hours ago,r/Hololive,Happy Birthday to Ame and the Ameverse!
305,52 comments,1.9k,5 hours ago,r/FuckYouKaren,Yellow card
306,52 comments,1.9k,5 hours ago,r/FuckYouKaren,Triggered by a 9 yrold
307,51 comments,3.4k,19 hours ago,r/Unexpected,Hands are for the weak
308,51 comments,3.4k,19 hours ago,r/Unexpected,Hands are for the weak
309,152 comments,3.7k,6 hours ago,r/Cringetopia,The irony lmao
310,46 comments,3.8k,6 hours ago,r/yesyesyesyesno,just finishing off
311,234 comments,1.5k,11 hours ago,r/NintendoSwitch,Team Asano at Square Enix confirms they will release and announce multiple titles in 2022 other than Triangle Strategy
312,242 comments,Vote,11 hours ago,r/NintendoSwitch,"[PSA] We want your track driving Pro Tips, Reddit. Comment with your best technical tip for some gold, and a chance for your maneuver to be demonstrated by a Toyota Motorsport driver in the all new GR86."
313,129 comments,3.2k,6 hours ago,r/Genshin_Impact_Leaks,YaeMiko Burt 4k image
314,97 comments,2.7k,5 hours ago,r/nonononoyes,Guy angers a goat while his friends spectate
315,128 comments,1.3k,4 hours ago,r/BritishSuccess,Pretty sure I was about to be mugged the other night until I acted louder and chavvier than the guy who came up to me.
316,133 comments,10.2k,17 hours ago,r/confusing_perspective,Getting a real handful
317,115 comments,3.3k,11 hours ago,r/brooklynninenine,Any thoughts about this crossover? (Psych)
318,94 comments,4.4k,11 hours ago,r/anime_irl,anime_irl
319,180 comments,1.2k,5 hours ago,r/ontario,Bill 124 limits our ability to attract and retain nurses and other healthcare workers.
320,198 comments,2.2k,5 hours ago,r/Coronavirus,Every U.S. cruise with passengers has coronavirus cases on board
321,195 comments,3.0k,7 hours ago,r/pcgaming,Raven Software strike continues as staff report no response from Activision management
322,216 comments,1.2k,7 hours ago,r/TooAfraidToAsk,"Why do I have to brush my teeth daily but yet they’ve found 50,000 year old skeletons with teeth still intact?"
323,84 comments,6.5k,6 hours ago,r/technicallythetruth,Yeah Sounds About Right ...
324,28 comments,6.0k,8 hours ago,r/ShitPostCrusaders,🍩
325,3.0k comments,4.0k,12 hours ago,r/AskReddit,What makes you happy?
326,210 comments,1.3k,5 hours ago,r/askscience,"Is balding accelerated by external factors like stress, or is it just genetic?"
327,204 comments,2.8k,9 hours ago,r/lego,Damn that’s a lotta stickers
328,89 comments,2.0k,7 hours ago,r/TheSimpsons,"Mom, I know your intentions are good but aren’t police a force that maintains the status quo for the wealthy elite? Don’t you think we should attack social problems instead of jamming people into overcrowded prisons?"
329,179 comments,1.4k,7 hours ago,r/AnarchyChess,Give this tactic a special name.
330,54 comments,6.3k,8 hours ago,r/whenthe,my goons
331,112 comments,466,19 hours ago,r/Edmonton,Unvaccinated paying homeless people to get vaccinated for them
332,112 comments,466,19 hours ago,r/Edmonton,Edmonton police investigating use of vulnerable people to get QR vaccination codes | Globalnews.ca
333,236 comments,781,5 hours ago,r/AskUK,"Hey ya Brits and gits, is ""Only Fools And Horses"" as popular in its home country as it is in Serbia?"
334,206 comments,2.4k,5 hours ago,r/LeopardsAteMyFace,Nick Fuentes gets banned from the free speech loving Gettr
335,150 comments,10.6k,11 hours ago,r/BrandNewSentence,Humanity can achieve great things despite the flaws
336,118 comments,3.9k,7 hours ago,r/MaliciousCompliance,"One per person, per visit."
337,158 comments,1.2k,7 hours ago,r/fakedisordercringe,this is just ridiculous
338,568 comments,3.3k,6 hours ago,r/videos,Australian Love Letter to Novak Djokovic - Tom Cardy
339,328 comments,3.5k,3 hours ago,r/facepalm,"Quebec influencers’ maskless in-flight party goes viral, airline company cancels return tickets"
340,632 comments,39.7k,11 hours ago,r/lotrmemes,A beautiful picture of J.R.R. Tolkien for all of us to have and enjoy.
341,71 comments,11.2k,7 hours ago,r/dankmemes,Checkmate
342,197 comments,587,5 hours ago,r/MMA,“I’ve Never Seen Anyone as Powerful as Him” – Ciryl Gane Admits Francis Ngannou Is the Strongest Puncher in the UFC
343,80 comments,5.5k,15 hours ago,r/SequelMemes,Sandpeople matter.
344,123 comments,1.2k,7 hours ago,r/fuckcars,Lol. Elon Musk's Boring company has traffic jams. I was told it was impossible.
345,123 comments,1.2k,7 hours ago,r/fuckcars,Lol. Elon Musk's Boring company has traffic jams. I was told it was impossible.
346,74 comments,1.3k,6 hours ago,r/Kanye,💀
347,37 comments,1.7k,3 hours ago,r/BestofRedditorUpdates,OP asks if she WBTA if she asks her boyfriend to stop bringing his sister on their dates
348,182 comments,9.2k,13 hours ago,r/AdviceAnimals,The baited click is so damn annoying
349,153 comments,3.5k,4 hours ago,r/PoliticalHumor,"We made it, folks!"
350,72 comments,430,3 hours ago,r/FundieSnarkUncensored,Anthym is back home
351,103 comments,3.8k,14 hours ago,r/OTMemes,Tbh I never noticed either.
352,242 comments,Vote,14 hours ago,r/OTMemes,"[PSA] We want your track driving Pro Tips, Reddit. Comment with your best technical tip for some gold, and a chance for your maneuver to be demonstrated by a Toyota Motorsport driver in the all new GR86."
353,215 comments,2.3k,10 hours ago,r/Warframe,Never forget to appreciate how good the movement is in this game
354,142 comments,Vote,2 hours ago,r/SubredditDrama,"On the 1 year anniversary of the Capitol insurrection, r/conspiracy can’t decide whether the attack was a “false flag” to make conservatives look bad or that the insurrection where people were beaten to death was not a big deal"
355,185 comments,698,4 hours ago,r/rupaulsdragrace,"As season 14 starts tomorrow, let’s take one more look at season 13’s most gagatrondra moments."
356,160 comments,4.8k,9 hours ago,r/mildlyinteresting,"Current IKEA cupboard walls are so thin that the sun shines through their knotholes (and yes, it looks that red)"
357,262 comments,2.1k,8 hours ago,r/Bitcoin,The closer you look the less you see
358,32 comments,2.9k,6 hours ago,r/carporn,This Lancia👀 [1080x1042]
359,86 comments,5.5k,9 hours ago,r/apexlegends,"Ok ok, that's really clever I like that."
360,137 comments,4.0k,8 hours ago,r/blunderyears,2002. I literally took my Josie and the Pussycats VHS cover to the hairdresser.
361,159 comments,2.0k,7 hours ago,r/freefolk,How do people get so good at cosplays? How can I learn this?
362,43 comments,3.0k,6 hours ago,r/Memes_Of_The_Dank,Bros stays bros
363,98 comments,4.8k,12 hours ago,r/terriblefacebookmemes,Proud moment
364,406 comments,13.3k,10 hours ago,r/news,"France fines Google, Facebook for not allowing users to deny cookies as simply as accepting them."
365,31 comments,1.7k,3 hours ago,r/bi_irl,bi_irl
366,24 comments,2.6k,6 hours ago,r/Catswithjobs,Kajiit has tools if you have coins
367,192 comments,1.8k,4 hours ago,r/3Dprinting,I 3D printed a wrench and it works!
368,102 comments,3.3k,5 hours ago,r/NonPoliticalTwitter,Banana Laffy Taffy
369,93 comments,979,5 hours ago,r/DnD,Player wanted to get revenge on another player during our session
370,315 comments,1.6k,10 hours ago,r/rickandmorty,Which song you would listen to ?
371,120 comments,2.5k,16 hours ago,r/mexico,"In the 70s, Marvel let a Mexican publisher put out original Spider-Man comics, and the first thing artist José Luis González Durán did was give Gwen Stacy a ridiculously fat ass. It's amazing what we can accomplish when we, as nations, work together."
372,120 comments,2.5k,16 hours ago,r/mexico,"In the 70s, Marvel let a Mexican publisher put out original Spider-Man comics, and the first thing artist José Luis González Durán did was give Gwen Stacy a ridiculously fat ass. It's amazing what we can accomplish when we, as nations, work together."
373,100 comments,3.5k,7 hours ago,r/StardewValley,is this satisfying or is it just me 😮‍💨
374,103 comments,2.0k,10 hours ago,r/SmashBrosUltimate,I played squad strike full random with a friend and it went into a full dittos match up. What are the odds ??
375,201 comments,4.7k,6 hours ago,r/aww,"meet my son, today is his first day at our house. all my life I dreamed of a dog and after 22 years my dream came true 😍🥰🙃 do you think he is as happy as me?"
376,42 comments,4.2k,7 hours ago,r/whenthe,Log4j
377,294 comments,5.4k,12 hours ago,r/ksi,Bald SIDEMEN with beard
378,181 comments,7.4k,11 hours ago,r/amcstock,🚨 #CitadelScandal: Here is a VITAL segment from the video that reddit is trying to CENSOR from Wall Street veteran Charles Gradante regarding CITADEL. Spread this shit as FAR & WIDE as possible on social media. The blatant CRIME has gone unchecked for LONG enough. DOWNLOAD LINK IN COMMENTS. 🚨
379,145 comments,3.3k,12 hours ago,r/DidntKnowIWantedThat,A very cool concept of augmented reality glasses by Iskander Utebayev.
380,46 comments,6.7k,10 hours ago,r/maybemaybemaybe,Maybe Maybe Maybe
381,152 comments,16.7k,13 hours ago,r/suspiciouslyspecific,"Love my 2010 Corolla, paint chipping off the hood and all..."
382,76 comments,849,3 hours ago,r/bestof,u/down_up__left_right explains the difficult job of preserving the draft speeches for Republicans' January 6th coup attempt to overturn the 2020 election
383,242 comments,Vote,3 hours ago,r/bestof,"[PSA] We want your track driving Pro Tips, Reddit. Comment with your best technical tip for some gold, and a chance for your maneuver to be demonstrated by a Toyota Motorsport driver in the all new GR86."
384,116 comments,1.0k,8 hours ago,r/wasletztepreis,Was letzte Cousine Bernd / Reup.
385,143 comments,1.2k,3 hours ago,r/Justrolledintotheshop,Dude claims we planted an attack rat in his truck. Leaves a 1 star review years after the fact. Can't make this shit up.
386,406 comments,2.1k,5 hours ago,r/LivestreamFail,Girl gets kissed by a creep without consent [QuiteLola]
387,175 comments,6.4k,15 hours ago,r/toptalent,Martial artist using nunchaku
388,159 comments,3.4k,8 hours ago,r/reddeadredemption,Been stuck in my mind ever since I started watching TPB
389,321 comments,16.3k,9 hours ago,r/HolUp,"March 21, 2007"
390,81 comments,1.3k,9 hours ago,r/linuxmasterrace,Steve can suck my popsicle.
391,157 comments,1.3k,5 hours ago,r/ToiletPaperUSA,"""Crocodile tears"""
392,135 comments,16.8k,15 hours ago,r/maybemaybemaybe,Maybe Maybe Maybe
393,148 comments,2.4k,11 hours ago,r/DestinyTheGame,I am once again asking for Pulse Rifles to get a 25% blanket PvE buff
394,129 comments,2.7k,9 hours ago,r/tf2,Big theory created entirely not out of boredom
395,44 comments,8.4k,6 hours ago,r/memes,Tasty plastic bricks
396,104 comments,5.7k,10 hours ago,r/PetTheDamnCat,What an adorable little beast!
397,154 comments,634,6 hours ago,r/Destiny,Outside of politics and dating Destiny has no good takes
398,137 comments,1.9k,7 hours ago,r/gameofthrones,[NO SPOILERS] How do people get so good at cosplays? How can I learn this?
399,79 comments,2.6k,14 hours ago,r/fixedbytheduet,It’s a bop
400,195 comments,11.6k,9 hours ago,r/greentext,Anon gets fired
401,36 comments,6.4k,10 hours ago,r/hmmm,hmmm
402,157 comments,1.2k,9 hours ago,r/dating_advice,"I (25f) survived. The only problem now is, nobody wants to date me because of it."
403,47 comments,7.2k,11 hours ago,r/surrealmemes,Metaverse Walmart
404,1.2k comments,Vote,11 hours ago,r/surrealmemes,"Toss a comment to your SmellyBardBot, oh people of Reddit. Toss a comment to your SmellyBardBot, oh people of Reddit. Oh People of Reddit. No seriously, ask for a poem about a Witcher character and I shall pen one about their smell."
405,167 comments,616,3 hours ago,r/alberta,I just asked the person to put a mask on
406,77 comments,2.2k,6 hours ago,r/vexillologycirclejerk,I don’t even know what to say about this one
407,53 comments,2.0k,5 hours ago,r/Embroidery,Some more monochrome embroidery! These textures are very enjoyable to work with!
408,115 comments,900,6 hours ago,r/philadelphia,New construction CAN look nice after all (Main Street Manayunk)
409,163 comments,2.2k,8 hours ago,r/environment,"Billionaires 'should pay for climate action'. Researchers found an even higher proportion of the public - 75 percent - want the mega-rich to focus their financial resources on the problems facing Earth, like climate change, before space travel."
410,218 comments,4.2k,11 hours ago,r/blender,I designed and modeled these DUNE-inspired shoes in Blender. How can I make them better?
411,102 comments,1.6k,10 hours ago,r/Brawlstars,When the devs teaches you how to play club league (yes its their official main account)
412,106 comments,3.0k,7 hours ago,r/Warhammer40k,Are the Space Marines using Cameleoline or it is other stealth technology?
413,242 comments,Vote,7 hours ago,r/Warhammer40k,"[PSA] We want your track driving Pro Tips, Reddit. Comment with your best technical tip for some gold, and a chance for your maneuver to be demonstrated by a Toyota Motorsport driver in the all new GR86."
414,86 comments,2.6k,6 hours ago,r/educationalgifs,How SARS-CoV-2 fuses with cells
415,76 comments,2.6k,6 hours ago,r/DunderMifflin,Kevin really had Jim's back if Roy tried to beat him up. He even took off his jacket while Roy was talking to Jim.
416,60 comments,2.1k,5 hours ago,r/gayspiderbrothel,Spider
417,14 comments,2.1k,5 hours ago,r/FullmetalAlchemist,All on a child’s allowance
418,46 comments,2.3k,6 hours ago,r/BeAmazed,Treat them with love till the end. They would do the same for you.
419,66 comments,3.4k,5 hours ago,r/rareinsults,I’d wear a skirt for this
420,106 comments,1.5k,9 hours ago,r/averageredditor,Average karma farm
421,188 comments,2.6k,4 hours ago,r/BlackPeopleTwitter,Give Mr Keith David his Oscar and his flowers.
422,22 comments,3.5k,8 hours ago,r/bonehurtingjuice,Paintball Fight
423,58 comments,8.8k,14 hours ago,r/fakehistoryporn,Kevin Spacey confesses his crimes (2017)
424,38 comments,1.7k,4 hours ago,r/EarthPorn,"[OC]I used a 1951 camera to take this photo. Sinai mountains, Egypt. [1200x1200]"
425,138 comments,1.9k,9 hours ago,r/Eldenring,*WARNING VERY IMPORTANT DISCOVERY*
426,21 comments,1.5k,4 hours ago,r/WhatsWrongWithYourCat,There is no cat in this image
427,46 comments,2.0k,5 hours ago,r/dogelore,le film discussions about this movie in a nutshell have arrived
428,23 comments,2.1k,5 hours ago,r/rimjob_steve,Christ is Risen
429,103 comments,3.2k,8 hours ago,r/TankPorn,"Der Fuhrer asked if we can make it a bit bigger.... Model Maus being demonstrated, May 14th, 1943"
430,221 comments,3.4k,5 hours ago,r/WhitePeopleTwitter,I think it is a good idea.
431,191 comments,4.1k,12 hours ago,r/ForzaHorizon,"Hello PG, I know hyper cars are nice and all, but hear me out.."
432,84 comments,5.1k,13 hours ago,r/egg_irl,egg👖irl
433,179 comments,885,7 hours ago,r/LegendsOfRuneterra,"Ok Riot, what the heck is going on here?"
434,61 comments,3.2k,7 hours ago,r/HollowKnightMemes,Shaw
435,31 comments,1.9k,5 hours ago,r/woahdude,Welcome to the matrix
436,107 comments,1.5k,5 hours ago,r/Qult_Headquarters,Fuck each and every one of these traitors and specially the guy whose name is on the flags they were carrying that day.
437,653 comments,2.6k,4 hours ago,r/gaming,What’s your game(s)? Cyberpunk and Red dead 2 for me.
438,20 comments,2.3k,6 hours ago,r/wholesomegifs,Best friends since day 1
439,62 comments,3.3k,8 hours ago,r/HighQualityGifs,"You have received a ""gift"" from reddit!"
440,131 comments,2.8k,14 hours ago,r/pointlesslygendered,Ok? [advert]
441,30 comments,4.4k,5 hours ago,r/cursedcomments,Cursed Twins
442,130 comments,2.3k,6 hours ago,r/HydroHomies,Why does Ted hate us?
443,86 comments,679,5 hours ago,r/SuccessionTV,I’ve got nothing but time for Team Tabi
444,174 comments,1.0k,5 hours ago,r/arcane,[no spoilers] Get jinxed
445,242 comments,Vote,5 hours ago,r/arcane,"[PSA] We want your track driving Pro Tips, Reddit. Comment with your best technical tip for some gold, and a chance for your maneuver to be demonstrated by a Toyota Motorsport driver in the all new GR86."
446,77 comments,2.2k,10 hours ago,r/evangelionmemes,I'm gonna add oil to the fire
447,46 comments,4.2k,9 hours ago,r/AnimalCrossing,"It was meant to be a joke, but I think Isabelle actually shot me in the end 😢"
448,114 comments,3.6k,9 hours ago,r/TrashTaste,Trash Taste becoming uncanny
449,123 comments,1.7k,6 hours ago,r/functionalprint,"New Easy Lithium Box, recyclable, every size, 50 Amps. it took me 1000 hours of research!"
450,31 comments,1.3k,3 hours ago,r/CozyPlaces,This is where I'm currently recovering from a cold..
451,165 comments,4.0k,13 hours ago,r/witcher,I will just say paying 10 usd for the Witcher 3 plus dlc was the best gaming deal I have ever got
452,35 comments,1.9k,5 hours ago,r/skamtebord,Bing bong
453,84 comments,1.2k,3 hours ago,r/SelfAwarewolves,Condemning conservative terrorists is really driving the wedge between Americans
454,65 comments,2.1k,6 hours ago,r/blackmagicfuckery,Stick fuckery
455,54 comments,3.9k,14 hours ago,r/AvatarMemes,“That’s rough buddy.”
456,98 comments,1.4k,8 hours ago,r/Komi_san,Wait a damn minute...
457,92 comments,3.5k,12 hours ago,r/GlobalOffensive,Redesign of the Diamond Riptide Medal (Concept)
458,56 comments,1.9k,5 hours ago,r/IASIP,My favourite blooper in the show.
459,138 comments,8.6k,16 hours ago,r/ihadastroke,Conversation I had with my beloved Mother
460,136 comments,1.4k,1 day ago,r/NotHowGirlsWork,Just basic economics
461,136 comments,1.4k,1 day ago,r/NotHowGirlsWork,with nearly 7000 up votes on reddit too
462,48 comments,1.3k,3 hours ago,r/AbsoluteUnits,"Sculptor creates massive 12 feet tall ""Techno Gorilla"" from car parts"
463,113 comments,4.0k,13 hours ago,r/pokemongo,R.I.P. Lucky Trade
464,499 comments,4.3k,4 hours ago,r/antiwork,Former McDonald's CEO warns that a surge in retiring baby boomers amid ongoing hiring struggles will lead to a 'catastrophe'
465,96 comments,2.2k,9 hours ago,r/NewVegasMemes,About to start Dead Money. Very first time playing it and am almost blind aside from the memes. I’m level 7.
466,179 comments,1.4k,8 hours ago,r/sweden,Efter att jag har sett elfakturan för December.
467,18 comments,2.5k,4 hours ago,r/perfectlycutscreams,You didn't have to do em like that
468,73 comments,1.0k,7 hours ago,r/VALORANT,New game mode: Ability Draft
