comment_count,upvote_delta,timeup_list,subreddit,thread_text
809 comments,22.2k,9 hours ago,r/antiwork,"Just withdrew my application for a position after a terrible interview where the interviewer wouldn’t turn on her camera, told me she didn’t read my resume, wouldn’t give me a pay range and asked me questions like “Will you leave us if you get another job? Because the last girl did”"
446 comments,6.5k,14 hours ago,r/gadgets,MIT unveils the world’s longest flexible fiber battery. You can weave and wash it in fabrics | The new battery fiber allows designs and applications that have not been possible before.
210 comments,4.9k,8 hours ago,r/funnyvideos,What is dude's reaction about?
63 comments,8.5k,10 hours ago,r/anime_irl,anime_irl
212 comments,2.7k,13 hours ago,r/CrusaderKings,Is there anyway to increase my chance of being homosexual?
246 comments,4.0k,11 hours ago,r/Naruto,Fun Fact: Orichimaru is the only one to have used the Reaper Death Seal and survive!
326 comments,12.1k,13 hours ago,r/BeAmazed,what a nice story
718 comments,10.9k,12 hours ago,r/science,"Rainy years can’t make up for California’s groundwater use — and without additional restrictions, they may not recover for several decades."
226 comments,21.4k,13 hours ago,r/TikTokCringe,Pip and the ceiling
455 comments,3.7k,10 hours ago,r/weed,Let the battle begin… (edited after removal)
305 comments,2.8k,13 hours ago,r/Qult_Headquarters,Fundamentalist bible thumping conman gets kicked to the curb.
112 comments,4.1k,15 hours ago,r/Battlefield,I demand to know who these 7 people are
90 comments,13.7k,12 hours ago,r/bonehurtingjuice,It’s the rule
286 comments,17.7k,12 hours ago,r/WinStupidPrizes,Do the splits across beds. Pose for pic. Allow gravity to humor others.
36 comments,5.6k,9 hours ago,r/youseeingthisshit,When you end up at the vet instead of the park.
355 comments,1.7k,7 hours ago,r/JusticeServed,"Kim Potter, ex-Minnesota officer, found guilty of manslaughter in death of Daunte Wright — Kim Potter, who is white, said she meant to use her Taser on Wright, a 20-year-old Black man, but drew her handgun by mistake and fired a fatal shot."
403 comments,6.1k,15 hours ago,r/battlefield2042,Oh man this game…
168 comments,1.5k,11 hours ago,r/recruitinghell,Recruiter told me that if I said yes to submitting my resume to the company I would have to commit to working for them if they liked me
443 comments,2.0k,9 hours ago,r/ClashRoyale,"I'm bored, so name a deck and I'll explain how it's no skill! (Credit to u/Problematicar for the map of the meta)"
250 comments,879,8 hours ago,r/YUROP,Part 15
232 comments,10.1k,12 hours ago,r/CozyPlaces,Finally done with my Bathroom! (Took me 4 months alone)
215 comments,2.0k,10 hours ago,r/OutOfTheLoop,What’s up with delivery drivers throwing away packages lately?
115 comments,14.7k,12 hours ago,r/clevercomebacks,Sigma male spotted
298 comments,3.6k,13 hours ago,r/explainlikeimfive,"ELI5: Why is it that printing good quality photos at home cost a fortune, yet they give out nice looking flyers/pamphlets in the public like it's nothing?"
210 comments,1.4k,6 hours ago,r/australia,Morrison government tells tribunal robodebt documents must stay secret to protect cabinet process
353 comments,20.3k,15 hours ago,r/NonPoliticalTwitter,She sounds fungible
69 comments,4.9k,5 hours ago,r/MadeMeSmile,This might be the best wedding picture ever.
102 comments,3.2k,15 hours ago,r/hoi4,It was harder than conquering the USSR as Germany
159 comments,3.3k,7 hours ago,r/JusticeServed,Additional prison time added for woman over her role in catalytic converter theft ring.
333 comments,4.2k,12 hours ago,r/aviation,"Learjet 35A engines get ripped off the plane after hard landing in Cancún, Mexico"
47 comments,6.6k,11 hours ago,r/TheMandalorianTV,This is NOT the way.
372 comments,16.5k,21 hours ago,r/FunnyandSad,Stop making fun of older kids
112 comments,14.7k,16 hours ago,r/PeopleFuckingDying,MaN BrutAllY HITs kEANu rEevEs WiTH A bLuNT objECT
546 comments,3.2k,7 hours ago,r/CFB,The Rutgers Scarlet Knights have accepted the Gator Bowl invitation.
15 comments,3.1k,7 hours ago,r/MEOW_IRL,MEOW IRL
310 comments,2.6k,6 hours ago,r/technology,"Tesla, bowing to pressure, stops allowing drivers to play video games while driving"
399 comments,5.4k,5 hours ago,r/Damnthatsinteresting,"In 2009 when giving a TED talk on malaria, Bill Gates released a jar full of mosquitoes on the crowd."
250 comments,2.9k,7 hours ago,r/playboicarti,Almost a year bros
217 comments,21.0k,14 hours ago,r/Art,"Suburbia, Seppuku_Doge/me, Pixel art, 2021"
108 comments,1.9k,13 hours ago,r/BoJackHorseman,meaning behind this precise frame?
161 comments,3.7k,8 hours ago,r/Deltarune,Surprise! (Part two)
222 comments,2.8k,13 hours ago,r/footballmanagergames,Story about how my father showed us he played too much Football Manager. 😂
2.0k comments,21.1k,16 hours ago,r/worldnews,CNN Exclusive: US intel and satellite images show Saudi Arabia is now building its own ballistic missiles with help of China
220 comments,1.2k,9 hours ago,r/rupaulsdragrace,Drag Race 2021: Iconic Moments I will take to my Grave
192 comments,2.8k,9 hours ago,r/xqcow,"it arrived! thank you mista x! this is definitely for school, and not for drawing big anime tits! Clueless"
9 comments,6.7k,10 hours ago,r/blessedimages,Blessed Memory
265 comments,3.8k,12 hours ago,r/arcane,[no spoilers] You can only choose one.
181 comments,1.9k,5 hours ago,r/Kanye,Howdy gang!🤠 Lost my virginity last night listening to Power!😱😉😈
435 comments,4.8k,9 hours ago,r/CasualUK,Got this right before I was about to set off to the in-laws for Christmas. Merry Christmas everyone!
153 comments,1.6k,10 hours ago,r/magicthecirclejerking,Damn what a take...
96 comments,1.5k,2 hours ago,r/AbruptChaos,Don't litter your cigarettes
144 comments,8.8k,12 hours ago,r/IllegallySmolCats,this is how cheeto greeted me this morning!
132 comments,2.4k,5 hours ago,r/whenthe,I do not endorse the colonization of Africa I recommend it.
146 comments,3.5k,14 hours ago,r/ThatLookedExpensive,pouring water in bike exhaust
78 comments,4.4k,9 hours ago,r/dadjokes,"Word on the street is, Cookie Monster has tested positive for COVID"
125 comments,1.5k,9 hours ago,r/anime_titties,Nigeria destroys 1 million expired doses of donated AstraZeneca Covid-19 vaccines
150 comments,2.8k,13 hours ago,r/copypasta,Necrophilia is not THAT bad.
54 comments,2.3k,5 hours ago,r/ThatsInsane,"Saving lives is all in a day’s work for sixth-grader, Dayvon Johnson"
130 comments,7.6k,14 hours ago,r/fightporn,Hurt
130 comments,7.6k,14 hours ago,r/fightporn,Worst way to start MMA round
35 comments,2.8k,6 hours ago,r/technicallythetruth,Wow thank you Legos!
195 comments,2.0k,9 hours ago,r/HaloMemes,Like 90% of Spartan OC's
359 comments,9.5k,14 hours ago,r/Animemes,Struggling to choose
81 comments,5.4k,9 hours ago,r/Animemes,It all works out in the end
165 comments,3.5k,12 hours ago,r/de,Manchmal hat man auch Glück im Leben und das bei einem Ordnungsamt.
312 comments,4.6k,10 hours ago,r/trashy,Tiger sure he's changed huh
120 comments,3.5k,9 hours ago,r/gtaonline,I wish we could do this all year round
142 comments,1.1k,9 hours ago,r/TalesFromYourServer,"24 years in the industry and this is the first year I've noticed SOOO many Shootings because of ""customer service"" What the Actual Fuck?"
68 comments,3.0k,6 hours ago,r/blursedimages,Blursed_Knife
217 comments,5.5k,7 hours ago,r/politics,A 'populist' Senate candidate wants to ban members of congress from holding and trading stocks — and throw them in jail if they don't comply
194 comments,2.7k,13 hours ago,r/Persecutionfetish,Does this count
46 comments,2.4k,6 hours ago,r/Catswhoyell,"Every morning, my almost 21 year old cat screams at us to greet us. Today, I was able to sneak up on her 😂"
154 comments,2.9k,12 hours ago,r/softwaregore,emmm why is this here
122 comments,1.9k,11 hours ago,r/Bad_Cop_No_Donut,"Mom of Teen Shot the Head by 'School Safety Officer' Sues Gunman, Long Beach School District"
193 comments,1.5k,10 hours ago,r/FireEmblemHeroes,State of the Sub (Circa 23/12/21)
276 comments,3.1k,11 hours ago,r/3Dprinting,Overture3D is switching to 100% paper spools!
173 comments,1.5k,10 hours ago,r/TankPorn,"The welding on T34s were so crude. I get it that minimizing fabrication time was a priority, but ughh."
139 comments,2.0k,9 hours ago,r/CapitolConsequences,"3 hours of uncut surveillance footage showing outnumbered law enforcement enduring a continuous melee assault in order to protect the U.S. Capitol and the people within from a deadly, domestic terrorist insurrection."
161 comments,1.7k,11 hours ago,r/AskOuija,I texted my wife if she was down for butt stuff tonight. All she sent me was a picture of _________!
37 comments,1.3k,3 hours ago,r/woahdude,This moth from the genus Phalera looks like a fragment of twig complete with chipped bark and even the layering of wood tissue at the “cut” ends... perfectly resembling a broken piece of wood to avoid predation.
115 comments,2.5k,8 hours ago,r/NotHowGirlsWork,I found a real one out in the wild. It's so pathetic it's hilarious.
155 comments,7.7k,7 hours ago,r/ShitPostCrusaders,Both. Both is good.
116 comments,3.9k,9 hours ago,r/ffxiv,I know there's 9002 posts about the grapes already but consider this:
189 comments,2.2k,6 hours ago,r/ufc,Sean Strickland is something else
166 comments,1.3k,9 hours ago,r/askscience,How did wild sheep live a lifetime without the possibility to have their wool cut?
59 comments,2.5k,7 hours ago,r/specializedtools,A customized TI-58 was used aboard the USMC Harrier to calculate various maneuvers and flight parameters
87 comments,4.5k,9 hours ago,r/OTMemes,There. I solved the problem xD
281 comments,11.5k,8 hours ago,r/interestingasfuck,I built a full-auto nerf gun that shoots me in the face
36 comments,4.0k,9 hours ago,r/gifsthatkeepongiving,Paint me like one of your imaginary girls.
206 comments,1.3k,9 hours ago,r/VALORANT,Next Agent Teaser
220 comments,4.2k,8 hours ago,r/ksi,What’s next
99 comments,2.9k,8 hours ago,r/Technoblade,We have lost against the guy with 46 videos...
217 comments,6.1k,16 hours ago,r/gravityfalls,hope someone agrees
110 comments,1.7k,8 hours ago,r/averageredditor,Average Redditor trying to not be a degenerate
282 comments,1.7k,8 hours ago,r/ich_iel,Ich_iel
164 comments,3.5k,11 hours ago,r/Eldenring,New Gameplay Clip from official Twitter Account!
80 comments,7.8k,11 hours ago,r/dogelore,Le gentleman burglar has arrived
93 comments,1.6k,6 hours ago,r/tf2,How is this persons Golden Pan Unusual?
164 comments,15.0k,15 hours ago,r/perfectlycutscreams,L E G E N D A R Y
63 comments,5.7k,7 hours ago,r/Hololive,Today is absolutely amazing. Fubuki really deserves it!
140 comments,3.6k,13 hours ago,r/Instagramreality,LMAO
51 comments,1.6k,4 hours ago,r/blunderyears,"This just came up on my mom's Facebook memories. I insisted on wearing a suit everywhere I went because I had a phase when I was younger where I wanted to be the president, and for years my brother's would cry every time they saw Santa."
123 comments,2.9k,8 hours ago,r/ChoosingBeggars,My boyfriend does some really bomb ass art... This was a request he got today 🤣🤣
186 comments,1.4k,7 hours ago,r/woodworking,Used a lag bolt as a router bit to make a textured vase... Idk how safe it is but it worked 🤷‍♂️
166 comments,1.7k,6 hours ago,r/IASIP,"Oh, So you like Sunny? *cocks gun* SAY MY NAME"
63 comments,3.6k,9 hours ago,r/WhatsWrongWithYourDog,Ciri has absolutely no idea who ate the Christmas cookies while we were out shopping. She’s so mad she can’t even look at the plate.
99 comments,734,6 hours ago,r/LiveFromNewYork,Tony Stark would be a 5 timer
236 comments,1.9k,9 hours ago,r/Overwatch,Is this the full game for 15 bucks ?
466 comments,9.0k,9 hours ago,r/todayilearned,"TIL that it’s a tradition in Italy to watch the movie Trading Places on Christmas Eve, with millions tuning in every year."
73 comments,3.0k,8 hours ago,r/starterpacks,Last Day Before Break Starterpack
112 comments,3.0k,7 hours ago,r/tf2,TF2 Gimmicks in a Nutshell
59 comments,2.7k,7 hours ago,r/ComedyNecrophilia,Abrams
291 comments,2.3k,8 hours ago,r/PS5,Reminder for new PS5 owners: you can get 6 Months of Apple TV+ for free.
136 comments,3.4k,15 hours ago,r/FuckYouKaren,"So, she seems nice. :/ (Found in my local NextDoor group.)"
72 comments,5.6k,7 hours ago,r/HumansBeingBros,Lads from Yorkshire fund a huge collection of toys for children in need at Christmas!
180 comments,3.7k,12 hours ago,r/niceguys,"Idk what kind of girls he met, espescially bc of Nr. 1"
30 comments,1.1k,2 hours ago,r/Technoblade,HE'S BACK
82 comments,1.4k,10 hours ago,r/Austria,An die Oide die eben um 17:00 beim Billa auf der Wilhelminenstraße 7kg Faschiertes kauft hat …magst du dich vielleicht melden?
183 comments,11.0k,15 hours ago,r/lgbt,Canada’s House of Commons has unanimously voted to ban LGBTQ+ conversion therapy 👏⁠
93 comments,4.3k,10 hours ago,r/AnarchyChess,Nice to see they redesigned the bishops for chess 2.0
177 comments,1.1k,7 hours ago,r/liberalgunowners,"I actually lost a friend this way. I didn't know she was a hardcore antigunner. I offered a free trip to the range, she said no, never, and that I would never change her stance on guns. Oh well. I didn't want to put that much energy into it lol."
22 comments,1.6k,1 day ago,r/196,Me_irlgbt
22 comments,1.6k,1 day ago,r/196,Mommy rule
103 comments,2.1k,6 hours ago,r/suspiciouslyspecific,The HOA hates this man.
137 comments,30.5k,11 hours ago,r/dankmemes,Coincidence?
183 comments,3.9k,11 hours ago,r/Witcher3,#notmyeskel
107 comments,3.5k,11 hours ago,r/AskHistorians,"My Uncle was a Tunnel Rat in Vietnam and has agreed to do an interview with me in the next 2 days, I need help finding the right questions to ask him."
215 comments,3.4k,10 hours ago,r/OldSchoolCool,Elizabeth Hurley 1992
103 comments,1.3k,10 hours ago,r/suddenlysexoffender,Just an innocent little dance instruction
31 comments,1.1k,3 hours ago,r/popping,an incredible bl[oc]ked pubic hair follicle. i NEVER grow amazing things like this - it’s a christmas miracle!
1.6k comments,47.9k,12 hours ago,r/news,New York governor signs bill criminalizing fake Covid-19 vaccination cards
49 comments,3.3k,8 hours ago,r/BeAmazed,Living with a Black Sable
34 comments,2.4k,17 hours ago,r/therewasanattempt,HMC while doing something with spare time
34 comments,2.4k,17 hours ago,r/therewasanattempt,To do something (not sure what)
192 comments,3.7k,13 hours ago,r/cyberpunkgame,"Internet Historian still working on ""Fall of 77"""
208 comments,2.9k,8 hours ago,r/tech,Google Earth caught a $2 billion stealth bomber on candid camera
53 comments,2.5k,7 hours ago,r/EscapefromTarkov,Tarkov Christmas decoration update
170 comments,30.3k,15 hours ago,r/fakehistoryporn,The first Chinese tourist in Hong Kong Disneyland (1997)
54 comments,5.4k,19 hours ago,r/gifs,Teacher promises her third grade class hot chocolate if she made the shot
54 comments,5.4k,19 hours ago,r/gifs,Teacher promises her third grade class hot chocolate if she made the shot
229 comments,1.2k,6 hours ago,r/reddeadredemption2,I feel my heart crack…
113 comments,3.6k,9 hours ago,r/TwoSentenceHorror,"I hit a dead end, and with nowhere to go to escape the zombies, I turned the gun onto myself"
191 comments,1.7k,11 hours ago,r/portugal,Uma noite de Natal em 1995
47 comments,3.2k,9 hours ago,r/Chonkers,Golden Tiger-Less then 30 are known to exist in the world
88 comments,6.0k,11 hours ago,r/CuratedTumblr,about seagulls
189 comments,4.7k,15 hours ago,r/zelda,"[ALL] The year has come and gone, and some things remain forgotten..."
86 comments,1.5k,5 hours ago,r/YouShouldKnow,YSK: The Symptoms of Carbon Monoxide (CO) Poisoning
94 comments,1.6k,6 hours ago,r/TheRightCantMeme,Racists continue to prove they have no idea how biology works
43 comments,2.3k,7 hours ago,r/antimeme,This is true
193 comments,2.9k,10 hours ago,r/Marvel,Some Christmas reading!
47 comments,6.0k,12 hours ago,r/Catswithjobs,Bodega Security Guard
56 comments,1.7k,5 hours ago,r/Markiplier,Excited for the next video!
210 comments,1.7k,9 hours ago,r/gatekeeping,"I called warhammer 40k figured “warhammers” lol. His name is white, mine is black"
147 comments,1.4k,7 hours ago,r/history,"My Uncle was a Tunnel Rat in Vietnam and has agreed to do an interview with me in the next 2 days, I need help finding the right questions to ask him."
184 comments,6.4k,16 hours ago,r/playstation,Bye bye loading screen tips
44 comments,2.3k,7 hours ago,r/HollowKnight,I got this guy for my birthday :D
24 comments,6.7k,11 hours ago,r/woooosh,Paw Patrol and the Iranian Hostage Crisis
479 comments,26.9k,10 hours ago,r/HolUp,That was quick
214 comments,2.0k,6 hours ago,r/gifs,Hardcore stairs
107 comments,6.4k,15 hours ago,r/toptalent,He has super talent
175 comments,2.1k,5 hours ago,r/amcstock,I know posting your own tweet is bad taste but this guy is a king jerkoff!
166 comments,9.5k,15 hours ago,r/GetMotivated,[Image] An example of others helping those in need.
111 comments,4.4k,10 hours ago,r/ATBGE,These Pokemon remasters are perhaps going a bit far
174 comments,1.1k,8 hours ago,r/Asmongold,The copium I've seen...
155 comments,1.3k,4 hours ago,r/tooktoomuch,No money! No vagina!
59 comments,3.1k,9 hours ago,r/MarchAgainstNazis,Can't say he didn't do his job...
164 comments,604,6 hours ago,r/ethtrader,All the more reason told hold your wealth in crypto
239 comments,10.3k,15 hours ago,r/instantkarma,Legendary Skills
114 comments,3.4k,9 hours ago,r/intermittentfasting,"(F)5’6-SW:255, CW: 145(ish), 18:6 most days. The sub started it all for me and wanted to do my yearly check in!! This is l(if)e changing. The before and afters always were the most motivating. Also I did zero exercise- it’s all just changing when I eat!"
220 comments,1.7k,6 hours ago,r/Konosuba,Go ahead. Try me.
53 comments,937,8 hours ago,r/TrueSTL,Least racist TES fan
134 comments,1.0k,6 hours ago,r/Baking,First time making macarons… what the heck went wrong?!
239 comments,8.3k,10 hours ago,r/halo,I was on a custom social game and witnessed this epic 1v1 sword duel
109 comments,1.6k,12 hours ago,r/netflixwitcher,they deserve the credit
116 comments,4.5k,14 hours ago,r/agedlikemilk,Well...
134 comments,3.6k,15 hours ago,r/batman,Batman actors with their directors over the years
54 comments,1.6k,11 hours ago,r/eu4,So I'm new to playing EU4. Here is a story of mine in two parts.
72 comments,Vote,2 hours ago,r/xqcow,"im sorry mista x, this is the first thing i drew with the tablet u bought me"
47 comments,5.1k,7 hours ago,r/me_irl,Me_irl
101 comments,1.2k,8 hours ago,r/submechanophobia,"This is a piece of the USS Scorpion, a nuclear submarine lost with all hands after an accident onboard caused it to sink uncontrollably below its crush depth and violently implode"
84 comments,17.1k,15 hours ago,r/BrandNewSentence,Time pillow and duvet of truth
124 comments,2.1k,11 hours ago,r/savedyouaclick,"Why Does Ciri Look Different in The Witcher Season 2? | The actress has aged some due to the passage of time, which often happens to human actors. Also, she's decided to stop bleaching her eyebrows."
26 comments,1.8k,6 hours ago,r/cursedcomments,Cursed_Red Flag
191 comments,3.8k,8 hours ago,r/whenthe,gamer
168 comments,9.6k,14 hours ago,r/ContagiousLaughter,I'm without words with this reaction.
21 comments,4.6k,11 hours ago,r/dankchristianmemes,"Stay Strong, Soldiers"
30 comments,2.0k,7 hours ago,r/titanfall,The Respawn Civil War
57 comments,2.0k,7 hours ago,r/NotMyJob,"Made the medal, boss!"
77 comments,1.6k,6 hours ago,r/feedthebeast,"Working on a mod called Clockwork, this is an upgraded elytra :))"
49 comments,2.7k,8 hours ago,r/BoneAppleTea,Build a-pond
103 comments,1.8k,10 hours ago,r/SmashBrosUltimate,I learned my lesson: Never homiestock!
25 comments,4.6k,11 hours ago,r/Zoomies,Heard Reddit Likes When You Show A Little Ass
63 comments,2.1k,10 hours ago,r/dankruto,Sakura's chat history [oc]
613 comments,16.1k,11 hours ago,r/IdiotsInCars,One lane two idiots
44 comments,Vote,1 hour ago,r/MarchAgainstNazis,Vaccine mandate protesters turned away from Trump Tower restaurant requiring COVID shots
44 comments,Vote,1 hour ago,r/MarchAgainstNazis,Vaccine mandate protesters turned away from Trump Tower restaurant requiring COVID shots
21 comments,4.6k,11 hours ago,r/brooklynninenine,One of my favourite lines by Holt!
144 comments,2.4k,4 hours ago,r/WhitePeopleTwitter,Wow. Wow wow wow.
123 comments,1.3k,6 hours ago,r/HazbinHotel,She Knows What She's Doing (𝙼𝚊𝚍𝚍 𝙷𝚢𝚎𝚗𝚊)
27 comments,1.7k,6 hours ago,r/HollowKnightMemes,The man is a legend
112 comments,1.0k,4 hours ago,r/Genshin_Impact_Leaks,Shenhe in Game (Credits to BLANK)
72 comments,2.0k,9 hours ago,r/UnethicalLifeProTips,ULPT When I was in college I set my Uber profile picture to some random model so that Uber drivers would pick me up
402 comments,5.5k,9 hours ago,r/PoliticalHumor,MUH JOB MADE ME DO IT
259 comments,3.5k,7 hours ago,r/BlackPeopleTwitter,DC should be used to this by now
19 comments,1.2k,5 hours ago,r/futurama,Me after treating my wife to 30 seconds of sex:
15 comments,Vote,2 hours ago,r/AnimalsBeingBros,Willow and Shadow meeting for the first time… oh the places you’ll go :)
153 comments,2.0k,1 month ago,r/NORDVEI,HMFT after I brandish a knife in front of the police
153 comments,2.0k,1 month ago,r/NORDVEI,#NSFW Åh nei! Han ødela kleppern
204 comments,1.3k,10 hours ago,r/Miata,"Yes I came here to get roasted, no it's not done yet"
169 comments,1.7k,9 hours ago,r/DotA2,Can we all agree we hate this mf
33 comments,6.3k,9 hours ago,r/DotA2,Lakers Predictions
226 comments,48.0k,14 hours ago,r/Eyebleach,When you look over and these 3 cuties suddenly pop out…
63 comments,544,4 hours ago,r/RPClipsGTA,Al Saab is forced to kill a woman called Abigail to prove he's not a variant
166 comments,7.3k,14 hours ago,r/ThatsInsane,Loggers often ride a flotilla logs down the river
111 comments,1.9k,10 hours ago,r/tylerthecreator,fantano rates “CALL ME IF YOU GET LOST” the 14th best album of the year. W
53 comments,4.5k,11 hours ago,r/GamePhysics,[Wreckfest] I got SENT
67 comments,1.1k,9 hours ago,r/onejoke,"well yeah, ‘sir’ is a title, not a pronoun"
619 comments,2.4k,4 hours ago,r/teenagers,Wonder what this is… wrong answers only.
200 comments,6.7k,14 hours ago,r/destiny2,Don't look away while opening packages :(
166 comments,4.3k,12 hours ago,r/Breath_of_the_Wild,Girlfriend bought me a Switch and BOTW. First time playing and I stumble across this ungodly place.
48 comments,1.5k,6 hours ago,r/surrealmemes,My pet when i buy him new food:
281 comments,16.6k,11 hours ago,r/oddlyterrifying,Martin Laurello was called the Human Owl. He could pivot his head to 180° over his shoulder and look behind him with his body still facing forward
103 comments,4.3k,11 hours ago,r/pokemongo,This entire subreddit in a nutshell
82 comments,1.4k,11 hours ago,r/bleach,He really is hard to notice uh............................
65 comments,1.3k,5 hours ago,r/Berserk,Berserk Volume 41 to be published by Dark Horse in Summer 2022
28 comments,2.7k,8 hours ago,r/PewdiepieSubmissions,Hmmmmmmmm
55 comments,2.8k,12 hours ago,r/polandball,Export
76 comments,3.1k,10 hours ago,r/theydidthemath,[Request] The inflation calculator only goes back to 1908 and doesn’t cross the Atlantic. How accurate is the yearly here?
31 comments,1.9k,7 hours ago,r/smashbros,How to edgeguard Aegis ;) 🧠
40 comments,2.9k,6 hours ago,r/oddlysatisfying,This sweet Christmas tree
96 comments,2.9k,9 hours ago,r/Rabbits,I got my bunny a bunny for Christmas
20 comments,3.2k,16 hours ago,r/hmm,My merpeople need me
20 comments,3.2k,16 hours ago,r/hmm,Hmmm
226 comments,3.1k,12 hours ago,r/malelivingspace,"Recent divorcee, finally have a space to call my own"
130 comments,725,7 hours ago,r/oculus,Best way to fly 10/10
21 comments,1.7k,6 hours ago,r/jacksepticeye,Family reunion!!
111 comments,1.0k,7 hours ago,r/Idiotswithguns,Look at what I just got today bruh
155 comments,3.3k,2 years ago,r/DidntKnowIWantedThat,"Why, just why [product]"
155 comments,3.3k,2 years ago,r/DidntKnowIWantedThat,Does anyone know where I can buy this?
493 comments,Vote,2 years ago,r/DidntKnowIWantedThat,"Toss a comment to your SmellyBardBot, oh people of Reddit. Toss a comment to your SmellyBardBot, oh people of Reddit. Oh People of Reddit. No seriously, ask for a poem about a Witcher character and I shall pen one about their smell."
52 comments,2.8k,9 hours ago,r/Awwducational,The purple harlequin toad (Atelopus barbotini) is native to the uplands of French Guiana. It is also popularly known as the purple florescent frog.
110 comments,2.4k,12 hours ago,r/KingdomHearts,I was fighting Data Marluxia when this happened...
87 comments,3.2k,14 hours ago,r/StupidFood,"Yes, that's a tea bag"
68 comments,1.6k,10 hours ago,r/F1Game,"He knew I’d win because of his penalties so tried taking me out, the end result was incredibly satisfying"
110 comments,2.5k,11 hours ago,r/NewVegasMemes,"Own up, who does this..."
91 comments,2.0k,7 hours ago,r/MemePiece,We don’t like overused jokes now?
107 comments,3.1k,11 hours ago,r/riskofrain,Happy Holidays!
117 comments,3.2k,12 hours ago,r/Nicegirls,Friend's Snapchat story made me slam my face on my desk
96 comments,976,8 hours ago,r/libertarianmeme,JUST GET YOUR LUCKY ROCK ALREADY PEOPLE!!!
27 comments,2.2k,8 hours ago,r/rarepuppers,We tricked him into exercising
72 comments,8.3k,14 hours ago,r/WhatsWrongWithYourCat,Are they supposed to have tentacles?
22 comments,3.2k,10 hours ago,r/dankvideos,Worst feeling...
54 comments,4.4k,16 hours ago,r/ScottishPeopleTwitter,120 questions
134 comments,2.4k,5 hours ago,r/mildlyinfuriating,"If your headlights, not even your high beams, are THIS bright, you deserve to go straight to hell."
