,comment_count,upvote_delta,timeup_list,subreddit,thread_text
230,254 comments,7.3k,14 hours ago,r/educationalgifs,How the James Webb telescope will be moving once it reaches its destination
231,77 comments,7.5k,7 hours ago,r/meme,It's black magic
232,334 comments,1.8k,5 hours ago,r/books,I feel like such an idiot
233,78 comments,1.8k,6 hours ago,r/MemePiece,Still a mystery...
234,182 comments,8.8k,13 hours ago,r/AnimalsBeingJerks,"Not all the lizards want to kill you, just this one."
235,224 comments,2.3k,11 hours ago,r/KGBTR,Matematik sınavının belirlenen tarihten önce ve süpriz bir şekilde olmasına tepki olarak tüm 10. Sınıflar okuldan kaçtık(not 150 kişi falanız)
236,105 comments,4.0k,9 hours ago,r/marvelmemes,imagine a scene with these two trying to communicate
237,95 comments,2.3k,5 hours ago,r/LivestreamFail,Tyler1 gets hyped on League of Legends Announcements
238,228 comments,1.8k,12 hours ago,r/ik_ihe,Ik🚗ihe
239,245 comments,1.5k,4 hours ago,r/QAnonCasualties,I’m so tired of this
240,77 comments,3.8k,23 hours ago,r/VanLife,"I had to update the amount it costs to do this if you’re not handy, but thought you’d all enjoy this!"
241,77 comments,3.8k,23 hours ago,r/VanLife,"I had to update the amount it costs to do this if you’re not handy, but thought you’d all enjoy this!"
242,30 comments,2.4k,4 hours ago,r/me_irlgbt,me_irlgbt
243,176 comments,948,7 hours ago,r/boston,DO NOT STICK YOUR HAND IN THE SNOWBLOWER GUYS.
244,207 comments,2.1k,3 hours ago,r/ChoosingBeggars,Who's down for $2.50 an hour?
245,210 comments,4.5k,14 hours ago,r/ThatLookedExpensive,Crash at a classic car race
246,357 comments,31.9k,8 hours ago,r/Unexpected,reloading random things like guns
247,223 comments,2.3k,5 hours ago,r/snakes,"Finally caught one of the rarest species of snake in the USA 🇺🇸 one of the most beautiful species too! These gems are native to an extremely isolated range within the USA and can only be found in a single county, Handled under research permits. Speckled Racer Drymobius margaritiferus"
248,139 comments,2.5k,7 hours ago,r/bestof,flaneur451 explains in detail how the middle school they work at always has “zero coronavirus cases” on their dashboard — with tricks worthy of a Joseph Heller novel.
249,208 comments,4.5k,12 hours ago,r/HistoryPorn,"Chinese guerrilla fighter Cheng Benhua 成本華 smiling moment before execution by the Japanese, she was 24. (Late 1938) [502 x 806]"
250,182 comments,9.0k,10 hours ago,r/coolguides,Molecules! (ZOOM IN) Hand drawn by a co-worker
251,95 comments,4.6k,6 hours ago,r/dankvideos,well done o7
252,180 comments,11.7k,14 hours ago,r/AnimalsBeingBros,The bird share some food to scared hungry rat..
253,270 comments,2.1k,5 hours ago,r/deadbydaylight,"This is probably the best way to explain the ""balance"" of this game"
254,132 comments,4.0k,7 hours ago,r/ffxiv,Final Fantasy XIV inspired outfit: Astrologian
255,58 comments,9.2k,9 hours ago,r/me_irl,me_irl
256,50 comments,6.0k,8 hours ago,r/marvelmemes,Iron Man Jr.
257,35 comments,5.5k,8 hours ago,r/fakehistoryporn,The first emperor of China undertakes PCR test (210 BBC)
258,259 comments,3.6k,6 hours ago,r/MapPorn,Comparing The Latitude Of North America And Europe
259,68 comments,5.2k,8 hours ago,r/FellowKids,Pizza Hut is bae
260,188 comments,1.6k,6 hours ago,r/GlobalOffensive,Mouz announce NBK
261,197 comments,1.5k,11 hours ago,r/ENLIGHTENEDCENTRISM,the real centrist was reddit all along...
262,330 comments,Vote,2 hours ago,r/HolUp,...
263,138 comments,704,5 hours ago,r/reddevils,"Fred on Twitter: Over the past few days I have read several fake news involving my name and other MUFC athletes. I'm not in the habit of answering controversial stuff publicly, but this time I will have to."
264,70 comments,4.9k,8 hours ago,r/CozyPlaces,My backyard feels cozy this morning
265,205 comments,3.6k,7 hours ago,r/tf2,"""Mission begins in 60 seconds."""
266,876 comments,12.7k,8 hours ago,r/antiwork,Just lie
267,79 comments,8.7k,10 hours ago,r/anime_irl,anime_irl
268,172 comments,1.8k,2 hours ago,r/raimimemes,I did not care for The Godfather.
269,74 comments,2.8k,8 hours ago,r/hoi4,Yep That's Me You're Probably Wondering How I Ended Up In This Situation
270,452 comments,5.8k,5 hours ago,r/Damnthatsinteresting,Chuck Berry and John Lennon were both legendary singers in their own right when they joined forces in 1972 to make television history. Yoko Ono tried to chime in but was her mike was cut during the second song.
271,92 comments,3.9k,7 hours ago,r/Spiderman,It must have felt so good to see the movie along with all the fans!
272,139 comments,1.5k,8 hours ago,r/rupaulsdragrace,Iconic “walk into a mall” drag race entrances
273,60 comments,3.5k,7 hours ago,r/Zoomies,I am speed
274,247 comments,781,6 hours ago,r/GamingLeaksAndRumours,"Mario Kart 9 “is in Active Development” and “Comes with a New Twist,” Analyst Says. Could be announced this year"
275,166 comments,2.1k,11 hours ago,r/TIHI,"Thanks, I hate how unrealistic this is."
276,166 comments,2.1k,11 hours ago,r/TIHI,"Thanks, I hate how unrealistic this is."
277,220 comments,1.0k,7 hours ago,r/KitchenConfidential,"Just getting back to work after Covid ripped thru BOH and we had to shutdown. One of the people who got covid showed up this morning without a mask and set to work without one, so he walked in and I walked right out."
278,185 comments,3.6k,10 hours ago,r/TwoSentenceHorror,The people learned the horrible truth about the immortality serum.
279,139 comments,1.2k,6 hours ago,r/CrusaderKings,"I accidentally created two Englands, How can i merge them?"
280,188 comments,2.9k,6 hours ago,r/freefolk,The decline as per Rotten Tomatoes
281,248 comments,433,3 hours ago,r/bayarea,Vaccination still works: GET VACCINATED AND GET BOOSTED
282,79 comments,3.4k,5 hours ago,r/cursedcomments,cursed_tape
283,179 comments,4.6k,8 hours ago,r/YouShouldKnow,"YSK: If you're stuck in your car during a blizzard and snow is piling up around your car, do not leave the engine running if your tailpipe is at risk of being blocked by the snow. Carbon monoxide will come into the car interior and kill you."
284,369 comments,4.0k,4 hours ago,r/politics,2 lawyers arguing against Biden's vaccine mandate before the Supreme Court will have to do it remotely after testing positive for COVID-19
285,252 comments,804,4 hours ago,r/atheism,"Do you guys realise that 99% of posts here relate only to puritanical, backwards, USA? The rest of the world is long past this."
286,234 comments,783,5 hours ago,r/Turkey,"Görüntüler Adana'dan. Bir Suriyeli'nin TikTok'ta paylaştığı videoda bir grup ""sığınmacı""nın ellerinde silah ve kesici aletlerle sokaklarda dolaştığı görüldü."
287,162 comments,6.4k,10 hours ago,r/LeagueOfMemes,They are so good at this.
288,178 comments,2.2k,4 hours ago,r/CatastrophicFailure,Two year’s ago today. Ukrainian flight PS752 was shut down over Tehran killing all 176 unboard. Date:08/01/2020
289,213 comments,3.8k,10 hours ago,r/ThatsInsane,A guy throw a bottle off a high building in Dubai this week. It landed on the head of a young man dinning in a restaurant below. This is a 3D reconstruction of the victim's Head CT. He is in a critical condition.
290,83 comments,4.5k,8 hours ago,r/blackcats,Why do you guys all have my cat??
291,127 comments,1.1k,6 hours ago,r/hockey,"After last night's game vs WPG, Nathan MacKinnon is officially a career PPG player"
292,327 comments,7.0k,9 hours ago,r/mildlyinfuriating,Terrible people in this world
293,226 comments,1.6k,3 hours ago,r/ufc,Derric active as hell
294,121 comments,4.0k,7 hours ago,r/starterpacks,childhood pain starter pack
295,185 comments,33.7k,14 hours ago,r/technicallythetruth,Well that’s a bit cute 😇
296,265 comments,928,4 hours ago,r/videos,"Oops, left the propane running..."
297,57 comments,2.7k,5 hours ago,r/WhatsWrongWithYourCat,My cat wouldn’t stop trying to get into her food bag. I put her food into a container instead and this is how I found her.
298,124 comments,2.3k,9 hours ago,r/DeepRockGalactic,the nightmare crossover!
299,208 comments,1.3k,6 hours ago,r/askscience,Is there real-world data showing boosters make a difference (in severity or infection) against Omicron?
300,112 comments,1.5k,7 hours ago,r/blender,What's the best approach to model this bottle in Blender?
301,238 comments,5.6k,9 hours ago,r/worldnews,Astronomers spot dying star just before it explodes and record supernova | Science & Tech News
302,69 comments,6.9k,13 hours ago,r/OTMemes,Empire of Dreams was an interesting documentary
303,89 comments,8.7k,17 hours ago,r/dankchristianmemes,"sir, this is the scariest moment of my life"
304,49 comments,5.4k,8 hours ago,r/PeopleFuckingDying,ApEx prEDaTor BRutALlY mURdErs EVERY VicTiM!
305,229 comments,1.2k,6 hours ago,r/dankruto,Name any Naruto character
306,186 comments,4.1k,12 hours ago,r/JDM,1992 Mitsubishi GTO found at the back of my dads shed from when he imported cars from Japan in the 90s
307,212 comments,3.0k,10 hours ago,r/WeWantPlates,Got sandy feet as a dessert
308,121 comments,1.5k,9 hours ago,r/niceguys,"Random guy from a discord server I’m in, never even talked to him"
309,87 comments,1.1k,7 hours ago,r/fakedisordercringe,Am I the only one dying for an explanation on why every TikTok personality with DID has random lines on their face disguised as makeup
310,210 comments,567,5 hours ago,r/stocks,Hedge funds are selling tech shares at their fastest pace in a decade
311,298 comments,9.6k,10 hours ago,r/PewdiepieSubmissions,"Hi, MangoMakeBeats here! After months, I have finally finished Pewdiepie's melody! (On Spotify now!!)"
312,230 comments,2.4k,8 hours ago,r/CasualConversation,"So many young people have never actually hung up on someone, with an actual handset."
313,68 comments,1.9k,3 hours ago,r/ksi,U/connerlee_00 asked me to post this and he Said that a close friend of his is struggling from cancer and has been battling it unfortunately it is now terminal he is a big fan of ksi and the sidemen and it would mean the world to him if he could ever meet them.
314,300 comments,2.9k,6 hours ago,r/meme,Take him away.
315,134 comments,2.0k,5 hours ago,r/thatHappened,"I, too, will give up my life of crime for a hug"
316,193 comments,710,6 hours ago,r/Bumble,I love the feature where women have to go first! The feature:
317,110 comments,1.2k,8 hours ago,r/outofcontextcomics,Wait a minute...
318,172 comments,2.8k,8 hours ago,r/ireland,"Us Louth Dundalkians being able to get cheap drink, five minutes across the border after being roasted on this sub reddit for the past couple years."
319,184 comments,4.0k,11 hours ago,r/animegifs,nom nom~
320,139 comments,2.3k,10 hours ago,r/entitledparents,Evil Mamabear wanted to have a family vacation without me
321,46 comments,5.6k,5 hours ago,r/wholesomememes,warm showers are the best
322,36 comments,1.9k,7 hours ago,r/Chonkers,Sweetest Chonker comforting Granny in her last moments.
323,36 comments,1.9k,7 hours ago,r/Chonkers,Sweetest Chonker comforting Granny in her last moments.
324,222 comments,2.6k,5 hours ago,r/Animemes,Anime version
325,278 comments,12.5k,11 hours ago,r/sadcringe,Certified hood classic
326,1.2k comments,8.0k,6 hours ago,r/facepalm,Fuck the Taliban
327,100 comments,2.0k,10 hours ago,r/pointlesslygendered,[product] So apparently dessert wines have genders now.
328,180 comments,1.1k,8 hours ago,r/Qult_Headquarters,The way Republicans gloss over an attempted coup really tells you who they care about.
329,106 comments,11.5k,12 hours ago,r/StardewValley,Little sister’s gift to me this Christmas- a handmade replica of the wizards tower!
330,100 comments,2.4k,11 hours ago,r/HolUp,I think this fits
331,100 comments,2.4k,11 hours ago,r/HolUp,2021 end credits.
332,138 comments,883,6 hours ago,r/Kanye,What would be the title of this movie?
333,114 comments,6.1k,10 hours ago,r/dogelore,Le minor disability has arrived
334,116 comments,2.2k,5 hours ago,r/DiWHY,Previous Homeowner wanted Coax in every room
335,54 comments,6.1k,9 hours ago,r/AnimalsBeingJerks,Bring me real food peasant!
336,212 comments,926,5 hours ago,r/JordanPeterson,People forget how libertarian minded Reddit was a decade ago.
337,140 comments,1.2k,8 hours ago,r/dndnext,"A simple rule of thumb I've discovered as a DM to make the game more fun for players: require TWO checks for failure (i.e., no instant failure)"
338,40 comments,1.9k,3 hours ago,r/bonehurtingjuice,This meme was in Spanish I translated it for you guys
339,155 comments,3.4k,7 hours ago,r/baseball,Rod Carew indicates that Kermit may be tipping his pitches
340,92 comments,7.0k,9 hours ago,r/OneSecondBeforeDisast,So this is how Japanese did it .
341,95 comments,1.2k,6 hours ago,r/BobsBurgers,yo season 1 was risky 😅
342,190 comments,6.0k,12 hours ago,r/HollowKnightMemes,Anyone like playing with the compass off sometimes?
343,155 comments,1.1k,6 hours ago,r/DestinyTheGame,Why does Bungie hide the actual bonuses of perks in their description when fan made sites easily show them?
344,52 comments,4.4k,9 hours ago,r/woahdude,The moon and the tree (painting timelapse)
345,71 comments,3.2k,7 hours ago,r/ExtraFabulousComics,who's there
346,177 comments,1.1k,6 hours ago,r/averageredditor,Average redditor believes the death of children is better than not getting his toys
347,194 comments,1.2k,8 hours ago,r/GodofWar,Which look do you prefer for THOR? Share your opinions and thoughts down below!
348,350 comments,5.9k,7 hours ago,r/mildlyinteresting,The gas station near me has the price of coffee also listed
349,127 comments,6.6k,10 hours ago,r/BrandNewSentence,Cum wax??
350,49 comments,601,3 hours ago,r/Sims4,"Why’s my sim leaving brown trails-she is lactose intolerant, could it possibly be doodoo? 💀"
351,226 comments,3.4k,6 hours ago,r/amcstock,I am GME ape. You are AMC ape. We have the same common enemy. Fight the enemy not each other.
352,139 comments,5.2k,10 hours ago,r/SweatyPalms,From a death sentence to a second chance in under a minute
353,30 comments,2.1k,4 hours ago,r/nonononoyes,The perfect seduction trick doesn't exis-
354,1.2k comments,7.2k,8 hours ago,r/news,"Overwhelmed by Omicron surge, U.S. hospitals delay surgeries"
355,35 comments,1.9k,12 hours ago,r/aww,Female Gorilla greets her silverback with a hug
356,35 comments,1.9k,12 hours ago,r/aww,Female Gorilla greets her silverback with a hug
357,40 comments,1.9k,4 hours ago,r/vexillologycirclejerk,"Flag of Human but transparent, to recreate the original video"
358,32 comments,1.8k,4 hours ago,r/tattoos,"A Blue Koi Fish and Cherry Blossoms by Adam Sky, Morningstar Tattoo Parlor, Belmont, Bay Area, California"
359,35 comments,3.7k,4 hours ago,r/tumblr,“Quit telling people that I’m dead!”
360,41 comments,3.7k,8 hours ago,r/ScottishPeopleTwitter,Let it snow
361,68 comments,3.6k,4 hours ago,r/oddlysatisfying,The Perfect Sandwich
362,95 comments,2.7k,6 hours ago,r/pitbulls,He's not usually allowed on the couch...
363,28 comments,2.6k,6 hours ago,r/AccidentalRenaissance,Melkam Gena! Ethiopian Christmas Eve at Lalibela.
364,200 comments,2.0k,5 hours ago,r/trashy,Brony in the wild
365,98 comments,1.7k,4 hours ago,r/bindingofisaac,let's goooooo
366,101 comments,3.6k,9 hours ago,r/jacksepticeye,They're just having fun
367,62 comments,7.2k,7 hours ago,r/whenthe,oh yes the economy
368,114 comments,3.7k,6 hours ago,r/formuladank,lewis crouching on his tire [Template]
369,141 comments,830,7 hours ago,r/antinatalism,How irresponsible these fools.
370,112 comments,3.1k,12 hours ago,r/xqcow,What day is it?
371,97 comments,3.4k,8 hours ago,r/Naturewasmetal,Triceratops femur (left) vs elephant femur
372,14 comments,3.9k,8 hours ago,r/NonPoliticalTwitter,What a deal
373,145 comments,650,4 hours ago,r/TopMindsOfReddit,Top Minds still have no idea why 1/6 was such a big deal
374,49 comments,1.7k,4 hours ago,r/instant_regret,Bro thought it was a Vape
375,72 comments,2.6k,7 hours ago,r/battlefield2042,Big brain move from DICE/EA.
376,137 comments,4.6k,11 hours ago,r/MakeMeSuffer,The complimentary ‘shampoo’ in the motel I’m staying in overnight
377,112 comments,2.5k,7 hours ago,r/HydroHomies,Good guy making sure the customer in front of him is hydrated
378,102 comments,2.0k,8 hours ago,r/religiousfruitcake,lmao they really think this is gonna work and not piss people off?
379,160 comments,1.8k,5 hours ago,r/reactiongifs,"MRW the Pope says married people without children, like me, lead to a loss of our collective humanity and are a detriment to civilization"
380,123 comments,5.5k,16 hours ago,r/specializedtools,A dog's toothbrush
381,89 comments,1.0k,7 hours ago,r/TedLasso,This was my bad. Made for an awkward rest of the night.
382,159 comments,4.5k,6 hours ago,r/AbsoluteUnits,"Weighing in at approximately 8000 kg, this elephant from Tanzania is believed to be the largest in the world!"
383,173 comments,953,5 hours ago,r/ApexOutlands,"Sorry reasonable pathfinder mains, some of you are knobhead nonces"
384,275 comments,924,5 hours ago,r/FortNiteBR,Fortnite Map Concept: Apocalypse *Part 1* (Read photo captions for more information)
385,57 comments,2.5k,6 hours ago,r/reddeadredemption,Arguably the greatest kill cam ever recorded
386,120 comments,1.5k,5 hours ago,r/copypasta,"my girlfriend won't peg me. She says i'm gay. First, I am 100% straight, but I just want to be bent over have someone behind me pounding away. I want her to do that. Is it gay to want to be pegged?"
387,190 comments,2.2k,8 hours ago,r/pokemon,Pokèmon World map V2
388,87 comments,4.1k,8 hours ago,r/gayspiderbrothel,Moment
389,164 comments,581,5 hours ago,r/The10thDentist,"Natural Citrus is the worlds worst flavor. Unnatural, Incredibly artificial citrus flavor is fine."
390,71 comments,1.5k,7 hours ago,r/Grimdank,Lmao
391,129 comments,1.2k,5 hours ago,r/Military,Bang Bang Bang
392,129 comments,720,5 hours ago,r/PS4,Days Gone Director Pitched an Open World Resistance Game
393,110 comments,1.1k,6 hours ago,r/DCcomics,[Artwork] The Evolution of Dick Grayson by Nicola Scott
394,43 comments,1.7k,5 hours ago,r/houseplants,To my 21st Birthday my Grandma gave me the cactus she bought 48 years ago. His name is Albus. She never repotted him.
395,158 comments,4.5k,9 hours ago,r/Outdoors,Paragliding Dog
396,92 comments,801,6 hours ago,r/victoria3,Canada Unified
397,135 comments,1.2k,7 hours ago,r/InfowarriorRides,Woah!
398,168 comments,3.1k,14 hours ago,r/dogecoin,Its sad how true this is
399,154 comments,1.4k,7 hours ago,r/Conservative,199k jobs created in December vs 450k expected. A recovery is the easiest time to deliver growth and Brandon still can’t do it.
400,184 comments,8.8k,6 hours ago,r/Superstonk,GameStop 10-Q warns about misinformation not attributable to the company
401,36 comments,2.5k,7 hours ago,r/brooklynninenine,"Ew gross, those are our dads."
402,139 comments,837,5 hours ago,r/TheWeeknd,Does anybody else love this album more and more after every listen?
403,52 comments,1.7k,5 hours ago,r/MinecraftMemes,It's kinda true though
404,144 comments,2.1k,6 hours ago,r/starterpacks,What Redditors Assume Austism is Like Starterpack
405,126 comments,2.6k,11 hours ago,r/FuckYouKaren,An employee for a company I work for refused entry to an unvaccinated person back when vaccine checks were mandatory here in Sydney. They felt so “discriminated” against for not being able to pick up their curtains they compared it to Nazi Germany.
406,79 comments,3.6k,8 hours ago,r/Deltarune,"Define ""Overboard"" (Art by killb94, link in the Comments)"
407,97 comments,1.2k,2 hours ago,r/loopringorg,Only $2.5
408,145 comments,1.3k,7 hours ago,r/bleach,When they keep mentioning the Bounts in Canon episodes
409,146 comments,6.5k,16 hours ago,r/cyberpunkgame,Mr. Bean in Cyberpunk is pure gold
410,65 comments,1.3k,3 hours ago,r/TrashTaste,New News
411,530 comments,6.7k,3 hours ago,r/memes,I will have to spend my 50 years to see normal comments
412,40 comments,4.3k,10 hours ago,r/gifsthatkeepongiving,Pawttery
413,150 comments,2.9k,7 hours ago,r/Undertale,A lot of people liked my Frisk design so here is more!
414,96 comments,3.8k,8 hours ago,r/Terraria,Eoc but with fur
415,185 comments,903,5 hours ago,r/StupidFood,People might like this but mixing any chocolate like this certainly looks unappetizing to me
416,39 comments,2.1k,6 hours ago,r/AnimalCrossing,Sylvia seems to have forgotten one small detail.
417,200 comments,1.4k,8 hours ago,r/CODWarzone,It’s so much fun to play on console right now!
418,124 comments,2.8k,4 hours ago,r/Whatcouldgowrong,A car suppose to be 4 wheels
419,76 comments,1.2k,7 hours ago,r/okbuddyphd,AHAHAHAH
420,87 comments,7.0k,12 hours ago,r/FuckNestle,Agreed
421,96 comments,996,7 hours ago,r/simracing,"My new direct drive wheelbase got here today, I'm so excited 😊"
422,106 comments,708,5 hours ago,r/BitLifeApp,not what we wanted but i’ll take it!
423,42 comments,1.4k,4 hours ago,r/TheLastAirbender,Team Avatar forgets that Toph is blind - part 1
424,122 comments,937,8 hours ago,r/walkaway,"I’ll take things that never happened for 500, Alex"
425,81 comments,790,2 hours ago,r/BlackPeopleTwitter,Read the fine print. 😷
426,122 comments,1.2k,4 hours ago,r/onguardforthee,"""Not having kids is selfish"" says man who lives alone in golden palace"
427,86 comments,5.9k,13 hours ago,r/oddlyspecific,"Thanks, Tumblr."
428,130 comments,3.1k,12 hours ago,r/RocketLeague,Goodjob soldier
429,86 comments,1.4k,6 hours ago,r/curb,"Larry David after winning his first Emmy for writing ""The Contest"" ."
430,97 comments,4.7k,12 hours ago,r/FUCKYOUINPARTICULAR,"If we can't be a country, you ain't getting drunk"
431,25 comments,4.7k,10 hours ago,r/meirl,meirl
432,17 comments,1.4k,4 hours ago,r/StartledCats,Something touched my leg!
433,61 comments,2.1k,6 hours ago,r/Justfuckmyshitup,Johnny bravo.
434,87 comments,892,5 hours ago,r/CatsAreAssholes,"My asshole cat brought me a little mouse yesterday, and he was injured, I took care of him and brought him food to gain his strength and will let him out when he's well"
435,157 comments,1.2k,8 hours ago,r/thefighterandthekid,"Another rejected Changs NFT...The iconic ""Bapa gets rowlsted"" moment"
436,142 comments,1.5k,9 hours ago,r/SaimanSays,We did it reddit! it's gone :D
437,71 comments,924,5 hours ago,r/recruitinghell,NY will require job reqs to post salary range
438,109 comments,928,6 hours ago,r/Seaofthieves,I love how reports actually make a difference to the community.
439,280 comments,1.9k,6 hours ago,r/TwoXChromosomes,Tired of my miserable coworkers shitting on me because I have a happy marriage.
440,30 comments,1.6k,5 hours ago,r/photoshopbattles,PsBattle: Toddler dragging his sister away from blurred mom and dad kissing in background.
441,42 comments,2.1k,6 hours ago,r/legendofkorra,I think we're all Asami
442,114 comments,1.7k,7 hours ago,r/thelastofus,Neil Druckmann at his first E3 (1997)
443,173 comments,704,6 hours ago,r/Muse,NEW SONG ANNOUNCEMENT
444,42 comments,3.2k,9 hours ago,r/wholesomegreentext,"True Love, 4chan style I guess."
445,48 comments,4.4k,6 hours ago,r/me_irl,me_irl
446,199 comments,7.5k,7 hours ago,r/funny,Or not...
447,119 comments,7.6k,11 hours ago,r/blursed_videos,blursed yeet
448,65 comments,1.4k,4 hours ago,r/malelivingspace,basement mancave
449,58 comments,1.4k,10 hours ago,r/ForwardsFromKlandma,"Yep, that's exactly what happened."
450,273 comments,3.5k,6 hours ago,r/gaming,wife charging my controller
451,213 comments,2.6k,5 hours ago,r/marvelstudios,Peter Parker is barely 18 and has already been through more shit and is more experienced than most Avengers.
452,972 comments,6.3k,9 hours ago,r/PublicFreakout,Two cops film themselves assaulting suicidal man in hospital bed.
453,90 comments,1.4k,6 hours ago,r/iiiiiiitttttttttttt,"If you can’t beat them, join them kinda thing"
454,49 comments,3.5k,6 hours ago,r/coolguides,How birds stay on branches while they are asleep 😴
455,115 comments,876,6 hours ago,r/DC_Cinematic,New still of Batman and Catwoman
456,93 comments,712,1 day ago,r/3Dprinting,Rat brain slicer for my college so they didn’t have to spend 800$ on one
457,93 comments,712,1 day ago,r/3Dprinting,Rat brain slicer for my college so they didn’t have to spend 800$ on one
458,48 comments,2.8k,8 hours ago,r/BlackPeopleTwitter,A safer alternative
459,64 comments,1.8k,9 hours ago,r/masseffect,"Small tidbit: Whenever Hackett would say 'Hackett out', my girlfriend would cough. And she would laugh at her own joke every. single. time."
460,75 comments,1.3k,8 hours ago,r/Cricket,Young Johnny bairstow
461,80 comments,2.0k,12 hours ago,r/restofthefuckingowl,"Thanks, I'm rich now"
462,133 comments,4.3k,15 hours ago,r/theyknew,Yum!
463,51 comments,1.5k,5 hours ago,r/SapphoAndHerFriend,"Ah yes, business partners"
464,94 comments,2.1k,9 hours ago,r/Helltaker,IKR
465,84 comments,4.4k,14 hours ago,r/gifs,This guy loves his job
466,84 comments,4.4k,14 hours ago,r/gifs,This guy loves his job
467,66 comments,2.1k,9 hours ago,r/RimWorld,nothing says true love more then holding a gun to your partner's head while sleeping
468,53 comments,2.7k,19 hours ago,r/Unexpected,These barn cats
469,53 comments,2.7k,19 hours ago,r/Unexpected,Oh I love this show
470,92 comments,1.7k,8 hours ago,r/im14andthisisdeep,Have good intentions
471,56 comments,3.1k,9 hours ago,r/bi_irl,bi👀irl
472,120 comments,2.5k,13 hours ago,r/lifehacks,"If ur electricity goes out,and ur not sure if it's just ur apartment,look at how many wifi connections are available. If there are none then everyone's modems are down as they have no electricity."
473,112 comments,1.0k,8 hours ago,r/tooktoomuch,What painkillers is this dude on
474,144 comments,1.1k,5 hours ago,r/JoeRogan,If there is ever a doctor that needs to make an appearance on the podcast it’s this one
475,95 comments,2.5k,8 hours ago,r/arcane,"[No Spoilers] Please Riot, I need that sweet, sweet merch!"
476,13 comments,2.5k,13 hours ago,r/oddlyspecific,Damn imagine that
