,comment_count,upvote_delta,timeup_list,subreddit,thread_text
734,21 comments,785,5 hours ago,r/travel,"Imperia, Italy, December"
735,22 comments,1.4k,8 hours ago,r/DDLC,Smug Monika (ヤマザキハルノ on pixiv)
736,21 comments,574,5 hours ago,r/OldManDog,This old guy is 14 years old today!
737,20 comments,1.4k,7 hours ago,r/HumanForScale,Wandering Albatross: largest flying bird species
738,19 comments,659,4 hours ago,r/CICO,216 lbs then and 150 pounds now. 2 years of CICO and pure discipline.
739,16 comments,892,3 hours ago,r/PartyParrot,What the FACK
740,19 comments,822,6 hours ago,r/gaybros,"Bad photo, but we got engaged on NYE - our second anniversary! Couldn’t be happier~"
741,565 comments,3.0k,11 hours ago,r/europe,Geographical Center Of Each European Country Compared To Their Capitals
742,19 comments,978,7 hours ago,r/PokemonSwordAndShield,Got a Team Flare cosplay thing going on
743,148 comments,3.5k,7 hours ago,r/teenagers,14 year olds am i right?
744,21 comments,679,5 hours ago,r/NoMansSkyTheGame,"When you're here, you're family"
745,16 comments,726,4 years ago,r/likeus,"An orangutan named Harry that was reintroduced into the wild from an Asian zoo is seen spear fishing after watching local fisherman, 1990s"
746,16 comments,726,4 years ago,r/likeus,"An orangutan named Harry that was reintroduced into the wild from an Asian zoo is seen spear fishing after watching local fisherman, 1990s"
747,174 comments,5.1k,10 hours ago,r/formula1,Fernando Alonso’s swapped helmet collection
748,12 comments,1.8k,7 hours ago,r/SequelMemes,Tell me
749,18 comments,1.6k,10 hours ago,r/Augenbleiche,Gewaschene und geföhnte Kühe
750,37 comments,3.5k,8 hours ago,r/perfectlycutscreams,Ou seja
751,214 comments,4.0k,10 hours ago,r/Futurology,Stanford researchers extend lithium ion battery life by 30%
752,14 comments,1.1k,6 hours ago,r/TwoSentenceHorror,"My brother got a standing ovation from my family, as they all praised him for helping to lift everyone's spirits"
753,15 comments,991,7 hours ago,r/darkestdungeon,Abom meme - more brief stories?
754,16 comments,1.0k,7 hours ago,r/MxRMods,"Every time guys, you get me every time"
755,135 comments,3.1k,6 hours ago,r/nextfuckinglevel,This man do a CPR to save the dog .. God bless him !
756,17 comments,1.2k,7 hours ago,r/AccidentalCamouflage,An interesting meeting...or so it seems
757,103 comments,1.3k,3 hours ago,r/nba,"Danilo Gallinari on IG After Coming Back from H&S Protocols: ""Vaccination is very important and it's the only way to eradicate this plague. There's no reason against vaccines that is worth the sufferance and the frustration of this pandemic period. So please, continue to vaccinate yourselves!"""
758,17 comments,2.4k,10 hours ago,r/crappyoffbrands,there is so much on this image going on
759,15 comments,540,3 hours ago,r/skamtebord,View Black Crime Statistics
760,15 comments,598,4 hours ago,r/FuckNestle,"According to Nestle pet food company research, dog owners likely to report better health."
761,50 comments,1.1k,3 hours ago,r/Terraria,Terraria won the labor of love award for steam!
762,15 comments,1.4k,7 hours ago,r/thegrandtour,Blursed hammond 😁😍😏🧸
763,16 comments,963,5 hours ago,r/Embroidery,"""Iris"", a colorful fantasy planet embroidery, that reminds me of a weird oil spill 🥸"
764,14 comments,434,3 hours ago,r/gifsthatendtoosoon,WhAT IS IT
765,146 comments,9.0k,10 hours ago,r/gaming,The one most annoying thing in gaming
766,318 comments,7.1k,8 hours ago,r/shitposting,kevin
767,13 comments,945,5 hours ago,r/PixelArt,Se7en Encore - Animated Version (96 frames)
768,14 comments,1.7k,8 hours ago,r/nukedmemes,Remove polish with chemicals
769,22 comments,1.4k,5 hours ago,r/formuladank,Do you think new cars will be as interesting as 2014 ones?
770,52 comments,6.1k,6 hours ago,r/memes,Better than anything I made in the game
771,14 comments,796,6 hours ago,r/corgi,Little Dum Dum
772,14 comments,1.8k,11 hours ago,r/thesims,Placing plants with moveobjects on
773,13 comments,2.1k,9 hours ago,r/OldPhotosInRealLife,"Noorabad bridge, Morena, India. 1829 and 2018. Built 1605-1627."
774,5 comments,783,3 hours ago,r/PetsareAmazing,Studying Together!
775,5 comments,783,3 hours ago,r/PetsareAmazing,Studying Together!
776,16 comments,809,3 hours ago,r/ComedyNecrophilia,thank you sonichu
777,13 comments,1.0k,4 hours ago,r/pyrocynical,Hammond in utopia Confirmed!1!1
778,129 comments,2.0k,7 hours ago,r/Warhammer40k,New Inquisitor model
779,40 comments,1.4k,5 hours ago,r/Gamingcirclejerk,YIIK: A Post-Modern RPG (2019)
780,14 comments,815,5 hours ago,r/powerwashingporn,Some POV magic for yall
781,12 comments,878,6 hours ago,r/woof_irl,woof_irl
782,14 comments,734,5 hours ago,r/pokemonmemes,Purple cliff enters the chat:
783,14 comments,990,8 hours ago,r/Unexpected,Gift for Zoey
784,14 comments,990,8 hours ago,r/Unexpected,Zoey is smart
785,14 comments,562,4 hours ago,r/overlord,How Shalltear Was Made
786,15 comments,674,4 hours ago,r/shittyrainbow6,Squidward has 3 arms btw
787,13 comments,976,5 hours ago,r/StardustCrusaders,I painted Kira! :)
788,13 comments,1.5k,7 hours ago,r/Memes_Of_The_Dank,Unfortunately ugliness doesn't go away
789,10 comments,714,5 hours ago,r/subnautica,[No spoilers] Depends on the game... and maybe on the player as well.
790,43 comments,2.0k,7 hours ago,r/AdviceAnimals,It's a small win every time
791,77 comments,7.9k,11 hours ago,r/Hololive,the future: more of the present
792,11 comments,1.6k,10 hours ago,r/GTA,🤔
793,10 comments,900,5 hours ago,r/jerma985,do not trust
794,393 comments,6.0k,12 hours ago,r/LifeProTips,"LPT: I Have been homeless, there is one tip i can give you if you ever get homeless ""Dont hang around with other homeless people!"""
795,60 comments,1.4k,5 hours ago,r/StarWars,"Always two there are. No more, no less. A master and an apprentice."
796,10 comments,2.9k,12 hours ago,r/funnysigns,Found on insta
797,10 comments,690,5 hours ago,r/painting,Sweet & Sour Shrimp - oil by me
798,148 comments,2.6k,8 hours ago,r/Tinder,I sent it
799,65 comments,1.4k,3 hours ago,r/BlackPeopleTwitter,I’m glad that someone agrees with what I’ve been thinking about for years.
800,11 comments,783,5 hours ago,r/WorkersStrikeBack,Why Is It?
801,9 comments,638,5 hours ago,r/GoodFakeTexts,It's the mark of the nightmare
802,9 comments,1.3k,7 hours ago,r/happycowgifs,Happy cow out exploring the woods
803,44 comments,3.2k,8 hours ago,r/tumblr,"i mean it's great her mom would be ok with this but it's not like your parents have to agree with you. Their job is to provide for+ support a child and allow them to go their own way in life, even if they disagree."
804,9 comments,688,8 hours ago,r/MadeMeSmile,Watch cat do a roll.
805,9 comments,688,8 hours ago,r/MadeMeSmile,Watch cat do a roll.
806,85 comments,1.2k,4 hours ago,r/todayilearned,"TIL that ""Solitaire"" refers to any tabletop game you can play by yourself, not just the famous card game that was included on Microsoft Windows. The card game simply called ""Solitaire"" on Windows is actually named ""Klondike""."
807,10 comments,Vote,1 hour ago,r/puns,E or ß?
808,60 comments,4.3k,10 hours ago,r/meme,"Jk, i am not a 18 yo virgon, i am a 17 yo virgin"
809,10 comments,527,4 hours ago,r/197,success
810,87 comments,1.9k,5 hours ago,r/oddlyterrifying,This lion “playing” with a baby on the other side of the glass
811,273 comments,1.4k,5 hours ago,r/tf2,"I´ll draw, add, remove and/or change whatever the top(s) comments say. Day 2:"
812,8 comments,1.1k,7 hours ago,r/airplaneears,Traffic on the runway
813,52 comments,2.8k,4 hours ago,r/dankmemes,I don’t know why we have idealized these moments so much
814,8 comments,1.1k,6 hours ago,r/Berserk,Adventure Time with Guts and Puck by theEyZmaster
815,235 comments,3.4k,10 hours ago,r/halo,I just played with a teammate who had an unreleased skin and stance.
816,268 comments,2.4k,5 hours ago,r/pics,Jeffrey Epstein and Ghislaine Maxwell being personally blessed by the Pope
817,46 comments,1.8k,5 hours ago,r/Eyebleach,"A Gerenuk couple out on a date. The Female picks out the branch she likes, and the male bends it to let her eat."
818,10 comments,Vote,57 minutes ago,r/vaxxhappened,“You’re welcome” — Darwinism.
819,413 comments,10.5k,15 hours ago,r/ProgrammerHumor,"""Intro Programming Class"" Starter Pack"
820,516 comments,1.1k,6 hours ago,r/videos,AT&T accurately predicts the future in 1993 advertisements
821,134 comments,6.1k,6 hours ago,r/Superstonk,"Pictured here... is Keith Gill, Aka Roaring Kitty, Aka Deep Fucking Value - DESTROYER of Illegal Short Sellers Ken Griffin and Steve Cohen! 💪 - 2022 LFG!!!"
822,57 comments,3.2k,10 hours ago,r/greentext,Anon is a flat-earther and doesn't even know it
823,267 comments,2.7k,8 hours ago,r/PublicFreakout,You need to relax....aaaaaaaagh
824,7 comments,697,6 hours ago,r/Superbowl,"Amateur photographer here, caught this lovely Eastern Screech Owl taking a nap"
825,4 comments,704,3 hours ago,r/PetsareAmazing,Studying Together!
826,7 comments,808,5 hours ago,r/TheBoys,Truer words have never been spoken.
827,6 comments,1.0k,7 hours ago,r/analog,"In a field/ Praktica BMS, Kodak Ektar 100, 50mm f1, 8"
828,6 comments,668,5 hours ago,r/whatcouldgoright,What Could Go Right
829,4 comments,1.1k,8 hours ago,r/wholesomejojo,Happy New Year!
830,195 comments,16.1k,15 hours ago,r/greentext,Femanon is upset with mummy
831,3 comments,553,3 hours ago,r/WhatsWrongWithYourCat,Cat thinks it's a shark
832,4 comments,618,4 hours ago,r/reallifedoodles,eh... Never Mind
833,2 comments,991,6 hours ago,r/Perfectfit,Couldn't find my sunglasses in the car
834,2 comments,423,2 hours ago,r/suddenlysexoffender,This could be us
835,295 comments,1.5k,7 hours ago,r/NotHowGirlsWork,Wow what a catch
836,20 comments,1.0k,5 hours ago,r/ApexOutlands,Time flies
837,54 comments,1.3k,3 hours ago,r/Showerthoughts,"Between the years 1987-2013, there was no single year comprised of 4 different digits."
838,2 comments,1.4k,14 hours ago,r/me_irl,The Fall of Troy 1184 BC
839,2 comments,1.4k,14 hours ago,r/me_irl,me_irl
840,276 comments,4.4k,11 hours ago,r/Cringetopia,"Oh boy, 2022 starting off with a bang"
841,27 comments,894,3 hours ago,r/BeAmazed,My favorite drawings I did in 2021
842,178 comments,2.7k,9 hours ago,r/MapPorn,Map showing access to electricity in Africa
843,64 comments,3.4k,9 hours ago,r/pokemon,[OC]Pokemon Gameplay vs Lore
844,58 comments,1.7k,8 hours ago,r/HollowKnight,bye bye geo :(
845,197 comments,3.1k,10 hours ago,r/tf2,Keys Just Reached 70 Ref
846,362 comments,28.5k,12 hours ago,r/antiwork,Based on real events
847,303 comments,4.7k,9 hours ago,r/mildlyinteresting,My butter melted in the microwave like this
848,150 comments,1.5k,8 hours ago,r/harrypotter,"People here like to give Mike Newell a hard time, but this gets me every. single. time."
849,128 comments,1.3k,7 hours ago,r/SelfAwarewolves,Can you imagine?
850,125 comments,1.2k,4 hours ago,r/todayilearned,TIL there's an 18% average mortality rate for catch and release fishing with the rate varying significantly between species
851,62 comments,1.1k,3 hours ago,r/news,Philadelphia's ban on pre-hire marijuana testing will take effect in the new year
852,234 comments,2.3k,9 hours ago,r/IndianDankMemes,I feel bad for her
853,82 comments,1.5k,8 hours ago,r/FortNiteBR,do the trees autoaim for the nearest player?
854,146 comments,792,4 hours ago,r/ontario,Ford: This was a hard decision that we refused to make until the very last minute
855,93 comments,2.7k,8 hours ago,r/BlackPeopleTwitter,My head was hot when my little brother spent 300 on in game currency 😭
856,100 comments,4.0k,11 hours ago,r/DunderMifflin,Snowball fight in a nutshell
857,42 comments,5.8k,14 hours ago,r/vexillologycirclejerk,Flag of regret
858,143 comments,1.7k,4 hours ago,r/teenagers,I’m tired of all this cishet bullshit
859,28 comments,1.6k,7 hours ago,r/TikTokCringe,Biggest in the gym
860,23 comments,1.7k,17 hours ago,r/interestingasfuck,"Shadowfax, Vaporhorse of the Fens"
861,23 comments,1.7k,17 hours ago,r/interestingasfuck,Hot horse in cold weather
862,616 comments,4.2k,6 hours ago,r/antiwork,Rental property owner: No! It's unfair to compare us to scalpers! You don't understand! Landlords are responsible for maintenance and taxes on the properties they rent! Me: And homeowners aren't?
863,19 comments,2.4k,6 hours ago,r/dndmemes,Terrible enough we walked right through the front gate completely unchallenged.
864,81 comments,1.2k,4 hours ago,r/ich_iel,ich🤔iel
865,105 comments,4.4k,8 hours ago,r/interestingasfuck,Momma Bear living up the name.
866,44 comments,1.5k,7 hours ago,r/CuratedTumblr,14 skeletons
867,71 comments,6.7k,12 hours ago,r/TIHI,"Thanks, I hate the finger cleaner"
868,37 comments,1.2k,5 hours ago,r/WitchesVsPatriarchy,Am interesting take
869,291 comments,13.6k,9 hours ago,r/Superstonk,"Pictured here is Steve Cohen of Point72, the illegal short seller."
870,69 comments,1.6k,7 hours ago,r/gifs,Northern lights
871,65 comments,3.0k,10 hours ago,r/suspiciouslyspecific,"""Like soldiers marching to war"""
872,196 comments,9.0k,11 hours ago,r/Damnthatsinteresting,A Gerenuk couple out on a date.. The female picks out the branch she likes and the male bends it to let female feed.. 😊
873,200 comments,2.5k,8 hours ago,r/news,Puerto Rico’s COVID-19 positive rate jumps from 2% to over 30% in just two weeks
874,46 comments,1.7k,8 hours ago,r/ffxiv,Art of my Miqo'te OC doing a bit of pet care. Gotta keep those claws trimmed. :)
875,112 comments,1.5k,7 hours ago,r/MinecraftMemes,Wtf is that?? A shipwreck in the sky??
876,71 comments,853,3 hours ago,r/halo,Remember this?
877,303 comments,3.9k,8 hours ago,r/politics,"'In 2022, Let's Tax the Rich': 10 Billionaires Added $402 Billion to Their Fortunes in 2021 | ""It's taxes or pitchforks,"" declared one progressive advocacy group."
878,104 comments,2.4k,8 hours ago,r/raimimemes,Want help? Watch the batman
879,38 comments,1.2k,6 hours ago,r/spaceporn,Space X heavy rockets engaged.
880,54 comments,5.2k,13 hours ago,r/BikiniBottomTwitter,As seen on Facebook
881,60 comments,4.8k,11 hours ago,r/aww,Dog Musters the Courage
882,22 comments,1.4k,5 hours ago,r/amcstock,"2022 Goals: One meme a day till We squeeze, try me!"
883,33 comments,2.2k,9 hours ago,r/comics,Intelligence
884,52 comments,998,5 hours ago,r/ToiletPaperUSA,*Sad Anti-Semite Noises*
885,57 comments,4.4k,6 hours ago,r/HolUp,2 ⊙⊙ 1
886,31 comments,703,4 hours ago,r/Grimdank,"He got upstaged by a goth elf who had her power for like what, 8 hours?"
887,36 comments,844,4 hours ago,r/dankruto,Itachi's chat history [oc]
888,92 comments,897,4 hours ago,r/Cringetopia,Bet all college money on apes JPEG and still defending it after losing all the money
889,108 comments,962,2 hours ago,r/pcmasterrace,What all of you sick freaks wanted. McDonald's FanBurger PC [Update 2]
890,25 comments,841,3 hours ago,r/GetMotivated,[image] Keep going
891,36 comments,1.0k,6 hours ago,r/canada,Hockey fan called a hero after noticing Habs are bad at hockey
892,6 comments,1.6k,7 hours ago,r/cursedcomments,Cursed date night
893,98 comments,8.6k,11 hours ago,r/blursedimages,Blursed_Finn
894,19 comments,3.8k,11 hours ago,r/blessedimages,Blessed_Crunches [KéKé]
895,14 comments,945,4 hours ago,r/GMEJungle,There’s a News Blackout on the Fed’s Naming of the Banks that Got Its Emergency Repo Loans; Some Journalists Appear to Be Under Gag Orders | WallStreetOnParade.com
896,37 comments,760,4 hours ago,r/Deltarune,DELTASHOW Part 2: A Deleted Scene
897,85 comments,3.7k,9 hours ago,r/oddlyterrifying,Afk cars.
898,24 comments,936,5 hours ago,r/HistoryPorn,Sioux Chiefs in 1905 [3600 x 2690]
899,88 comments,11.6k,8 hours ago,r/memes,One potion makes awesome bubbles
900,88 comments,1.4k,4 hours ago,r/PoliticalHumor,At least he still has his sister/wife
901,27 comments,2.2k,10 hours ago,r/marvelstudios,Civil War fight Minecraft Edition (Source in comments)
902,36 comments,899,3 hours ago,r/technicallythetruth,What are your thoughts?
903,35 comments,811,5 hours ago,r/OnePunchMan,Cyberpunk Tatsumaki?
904,30 comments,2.5k,10 hours ago,r/GlobalOffensive,found on nevertellmetheodds
905,64 comments,2.7k,6 hours ago,r/WhitePeopleTwitter,"No, no he has a point"
906,29 comments,1.9k,9 hours ago,r/starwarsmemes,James May kills the younglings
907,10 comments,874,5 hours ago,r/HydroHomies,Gators love water
908,62 comments,2.7k,6 hours ago,r/MadeMeSmile,This is adorable and made my day
909,22 comments,1.0k,6 hours ago,r/Minecraftbuilds,Melon can be used like a grandma's wallpaper
910,21 comments,2.3k,9 hours ago,r/lotrmemes,Ride Of The Rohirim . . . . .
911,13 comments,1.6k,8 hours ago,r/funnyvideos,Based dogo life
912,13 comments,2.3k,8 hours ago,r/maybemaybemaybe,Maybe maybe maybe
913,8 comments,889,5 hours ago,r/me_irlgbt,Me_Irlgbt
914,34 comments,2.2k,7 hours ago,r/Eyebleach,"""Come meet my puppies."""
915,82 comments,2.9k,5 hours ago,r/dankmemes,Maybe this is the place to get laid
916,79 comments,1.4k,3 hours ago,r/mildlyinteresting,I saw this concrete ping pong table with a metal “net” and spherical concrete supports.
917,28 comments,2.2k,8 hours ago,r/meme,A PARADOX
918,28 comments,1.6k,5 hours ago,r/wholesomememes,This is so accurate
919,21 comments,3.7k,9 hours ago,r/ShitPostCrusaders,Drip DaJoe amarit
920,15 comments,2.6k,9 hours ago,r/antimeme,Wow! Water!
921,28 comments,Vote,2 hours ago,r/blunderyears,The only thing about this picture I regret is that this collection of Beanie Babies wasn’t larger.
922,15 comments,887,11 hours ago,r/blursedimages,I think this belongs here
923,15 comments,887,11 hours ago,r/blursedimages,Blursed_Finn
924,3 comments,573,4 hours ago,r/Blep,POV: You are the main ingredient in Quiznos' Famous Blep Biscuit Dough
925,297 comments,5.0k,11 hours ago,r/PublicFreakout,"One way to handle someone telling you to “fuck off ya black dog” (Geelong, Aus)"
926,131 comments,1.5k,7 hours ago,r/DunderMifflin,Liked him even more through my second watch. He is kinda relatable. I dont really get the hate for this guy.
