,comment_count,upvote_delta,timeup_list,subreddit,thread_text
0,16.9k comments,19.1k,6 hours ago,r/AskReddit,What ruins a movie instantly?
1,7.5k comments,58.0k,17 hours ago,r/nottheonion,NASCAR driver who unintentionally sparked 'Let’s Go Brandon' chant says corporations don’t want to sponsor him
2,1.3k comments,31.7k,5 hours ago,r/WhitePeopleTwitter,Can’t wait
3,6.8k comments,50.0k,7 hours ago,r/pics,Mark Bryan a robotic engineer is shattering gender norms by wearing what he likes.
4,156 comments,14.6k,3 hours ago,r/WatchPeopleDieInside,This is some Tom and Jerry vibe
5,736 comments,Vote,2 hours ago,r/nba,"[Kareem Abdul-Jabbar] While LeBron James is a necessary and dynamic voice critical of police brutality against the Black community, he needs to be the same necessary and dynamic advocate with vaccines, which could save thousands of Black lives right now."
6,512 comments,22.6k,5 hours ago,r/PoliticalHumor,Any second now………
7,5.6k comments,57.3k,6 hours ago,r/antiwork,So this is why we're protesting?
8,5.5k comments,69.1k,11 hours ago,r/facepalm,This woman talking about what kind of men she wants...
9,18 comments,Vote,11 hours ago,r/facepalm,"The judges from The Games Awards have spoken...but have you been heard? Respond directly to this post with games that should have won, but didn't. Who knows, maybe you'll score some Gold."
10,4.6k comments,7.2k,6 hours ago,r/AskMen,What are some HARD truths that people don't want to hear?
11,1.2k comments,15.6k,5 hours ago,r/politics,"The Pandemic Shows Why We Need Universal Health Care. Why Does the Richest Country in the World Have the Most Covid Deaths? A Primary Reason is That the United States Does Not Have a Free, Universal Health Care System."
12,3.6k comments,56.7k,11 hours ago,r/WhitePeopleTwitter,Richie Rich
13,377 comments,10.6k,4 hours ago,r/ProgrammerHumor,I have been attacked.
14,143 comments,22.4k,6 hours ago,r/aww,The ultimate coupling
15,2.5k comments,4.3k,10 hours ago,r/OnePiece,One Piece: Chapter 1036
16,2.5k comments,49.5k,13 hours ago,r/HolUp,HolUppppp
17,1.8k comments,24.2k,9 hours ago,r/Cringetopia,Some FDS mentality right there
18,1.4k comments,19.5k,15 hours ago,r/iamatotalpieceofshit,Woman sexually assaults guy on train
19,386 comments,19.0k,5 hours ago,r/nextfuckinglevel,Iceland without tourists.
20,1.3k comments,16.9k,7 hours ago,r/technology,Moderator Who Watched Hours of Traumatic Videos Sues TikTok for Failing to Protect Her Mental Health
21,736 comments,32.6k,6 hours ago,r/wallstreetbets,12$ is generous
22,1.3k comments,16.3k,6 hours ago,r/HermanCainAward,Uncanny coincidence: This old anti-vaxx cowboy with 1.9K Facebook friends died of COVID-19 and his funeral looked EXACTLY like this cartoon he shared.
23,1.2k comments,11.3k,11 hours ago,r/marvelmemes,IM MARY POPPINS YALL
24,357 comments,30.8k,6 hours ago,r/HolUp,BRO WAI-
25,592 comments,8.9k,4 hours ago,r/worldnews,‘Colossal waste’: Nobel laureates call for 2% cut to military spending worldwide
26,1.4k comments,18.9k,8 hours ago,r/IdiotsInCars,just a normal car meet (almost)
27,986 comments,7.5k,4 hours ago,r/PublicFreakout,Woman calls the cops because she's denied entry into a store for not wearing a mask
28,203 comments,17.7k,6 hours ago,r/BetterEveryLoop,Mid air kick from the pad holders perspective
29,1.3k comments,13.3k,1 day ago,r/whenthe,In 1945
30,1.3k comments,13.3k,1 day ago,r/whenthe,Hail
31,1.2k comments,37.0k,8 hours ago,r/MurderedByWords,Love it when people use dead celebs to push an agenda they would have completely disagreed with
32,1.1k comments,19.2k,16 hours ago,r/LeopardsAteMyFace,Candace Owens requires a paid subscription to view her interview with Trump. Conservatives unironically demand to get it for free.
33,1.3k comments,8.4k,16 hours ago,r/CoronavirusDownunder,A reminder of all the vaccinations & boosters you've already had.
34,564 comments,41.8k,7 hours ago,r/funny,I really need one of these nearby
35,1.1k comments,24.6k,14 hours ago,r/movies,"Jean-Marc Vallée Has Died; Director Of ‘Dallas Buyers Club,’ ‘Big Little Lies’ & ‘Sharp Objects’ Was 58"
36,1.2k comments,49.4k,11 hours ago,r/nextfuckinglevel,Jaw dropping fakeout on a charging wild boar.
37,803 comments,27.4k,7 hours ago,r/todayilearned,"TIL that in Churchill, Canada, locals keep their car doors unlocked in order to provide other residents a quick escape, should they encounter a polar bear"
38,994 comments,16.3k,15 hours ago,r/MovieDetails,"In ‘Don’t Look Up’ (2021), astronomers appear on a ‘Morning Joe’-style cable news talk show. Though not explicitly noted as liberal, their logo reflects their slant. A clever detail!"
39,1.0k comments,9.3k,15 hours ago,r/NoStupidQuestions,Left at home announced?
40,1.2k comments,9.4k,7 hours ago,r/dankmemes,What song is this?
41,366 comments,33.6k,7 hours ago,r/MadeMeSmile,Father of the year
42,282 comments,15.7k,6 hours ago,r/interestingasfuck,Jeff Lee Johnson Painting. The longer you look the more you see.
43,91 comments,15.5k,6 hours ago,r/Eyebleach,My Angel
44,671 comments,13.2k,6 hours ago,r/FuckYouKaren,Kickboxing Karen felt a little too arrogant
45,74 comments,6.9k,4 hours ago,r/HumansBeingBros,This barber gives free haircut to whoever can‘t afford it.
46,55 comments,9.4k,5 hours ago,r/AnimalsBeingDerps,That's pretty interesting looking stapler
47,933 comments,20.1k,15 hours ago,r/science,Analysis of Microplastics in Human Feces Reveals a Correlation between Fecal Microplastics and Inflammatory Bowel Disease Status
48,1.1k comments,2.4k,3 hours ago,r/KGBTR,FURKAN TOPAL CURRENT MOOD: HAPİSTEN ÇIKTIM!
49,1.1k comments,463,4 hours ago,r/Music,Describe a band poorly but accurately
50,963 comments,1.0k,8 hours ago,r/AskUK,What shop have you never been to?
51,1.1k comments,24.5k,13 hours ago,r/teenagers,"Gonna ask my crush (an extreme marvel fan) to the movies, wish me luck!"
52,116 comments,10.8k,5 hours ago,r/2meirl4meirl,2meirl4meirl
53,912 comments,13.4k,6 hours ago,r/facepalm,"Never underestimate a ""little virus"""
54,235 comments,10.7k,5 hours ago,r/greentext,The end is near for UK anons
55,261 comments,10.9k,6 hours ago,r/leagueoflegends,I spammed Ultimate Spellbook for days trying to get this sick ult combo
56,82 comments,7.2k,5 hours ago,r/educationalgifs,How engineered structures affect flow in rivers
57,24 comments,7.9k,6 hours ago,r/comics,Cardio
58,976 comments,24.5k,19 hours ago,r/coolguides,Do not mix these cleaning products
59,435 comments,8.8k,6 hours ago,r/news,Virginia family gets keys to Habitat for Humanity's first 3D-printed home in the US
60,974 comments,26.6k,12 hours ago,r/mildlyinfuriating,I work at an ice skating rink and instead of properly turning in skates people started just throwing them over the counter
61,96 comments,13.4k,6 hours ago,r/tumblr,This hellhole is free
62,899 comments,3.3k,3 hours ago,r/TrueOffMyChest,"I really hope all this gender identity stuff is real and not actually just mental disorders, because if it is truly mental instability we are really messing up a lot of kids by feeding into it."
63,120 comments,5.2k,4 hours ago,r/Hololive,Come cry with us in Haachama’s stream
64,125 comments,9.8k,6 hours ago,r/gaming,+10 mental damage
65,860 comments,19.6k,20 hours ago,r/ATBGE,A total 180 of them. Great.
66,203 comments,22.8k,16 hours ago,r/LifeProTips,"LPT: When it's time for your pet to be euthanized, have the vet come to your home. That way your pet can spend their last moments at home relaxed rather than being anxious at the vet's office."
67,75 comments,13.0k,6 hours ago,r/PrequelMemes,I have the High Ground!
68,42 comments,5.1k,4 hours ago,r/TheLastAirbender,Zuko forgot to credit someone...
69,229 comments,5.7k,4 hours ago,r/WinStupidPrizes,UFC fighter films himself jumping headfirst into a frozen river
70,606 comments,9.5k,7 hours ago,r/BlackPeopleTwitter,Cue Pain’s theme
71,90 comments,7.2k,5 hours ago,r/perfectlycutscreams,I'm crying
72,87 comments,7.2k,6 hours ago,r/NonPoliticalTwitter,Do remove it and put it in the socket of someone missing an eye. This is the beginning of the next Mummy movie.
73,885 comments,40.8k,13 hours ago,r/AbsoluteUnits,My parents dog who i got to see over the holidays
74,351 comments,5.1k,4 hours ago,r/MaliciousCompliance,Ex demanded I cook the dinner HE wanted.
75,398 comments,7.2k,6 hours ago,r/space,ArianeSpace CEO on the injection of JWST by Ariane 5.
76,462 comments,17.2k,14 hours ago,r/nba,Nikola Jokic twerks before tipoff
77,101 comments,8.1k,6 hours ago,r/lotrmemes,So no school!!!??
78,827 comments,19.5k,15 hours ago,r/ANormalDayInRussia,Russians trying to make sense of English
79,334 comments,81.1k,19 hours ago,r/HumansBeingBros,This restaurant offers food for free if you can’t afford it
80,815 comments,1.7k,8 hours ago,r/LeagueOfMemes,Riot is removing 1 out of the 3 basic abilities of every champion. The ability getting removed is the one that is usually maxed last. How screwed is your champion?
81,241 comments,11.9k,6 hours ago,r/funny,"Ordered, “I’d Rather Be Driving My Volkswagen” and received this instead."
82,689 comments,8.7k,16 hours ago,r/sports,Washington Football Team players fighting amongst themselves on the sideline during Sunday Night Football
83,785 comments,31.4k,18 hours ago,r/blackmagicfuckery,what?
84,494 comments,39.0k,9 hours ago,r/dankmemes,We gonna have a good time.
85,111 comments,2.5k,10 hours ago,r/copypasta,Will I get pregnant if he ejaculated in me?
86,661 comments,15.9k,16 hours ago,r/atheism,Grandma tries to teach my kid the biblical Christmas story. It doesn't go the way she had hoped.
87,756 comments,1.7k,9 hours ago,r/CryptoCurrency,Decentralisation is the ONLY point of crypto
88,702 comments,40.8k,11 hours ago,r/interestingasfuck,This raven sounding eerily like a human. Think what a mess was the first guy who saw this animal
89,760 comments,4.4k,3 hours ago,r/memes,Just moved and apparently they do not like California
90,586 comments,1.7k,7 hours ago,r/LivestreamFail,Rich Campbell is literally streaming the Lord of the Rings movies on Twitch
91,710 comments,3.9k,7 hours ago,r/NotHowGirlsWork,Ah yes women are used milk now
92,500 comments,27.6k,8 hours ago,r/wholesomememes,real chads respect women
93,612 comments,1.5k,11 hours ago,r/CFB,Is it fair to say that a Cincinnati win would be the biggest in college football history?
94,427 comments,12.5k,17 hours ago,r/YouShouldKnow,YSK: How to save cash to get out of a relationship with someone who is financially controlling you.
95,2.3k comments,10.5k,6 hours ago,r/shitposting,Based cum taiwan zamn femboy among us
96,94 comments,6.9k,6 hours ago,r/KidsAreFuckingStupid,Noob n Boomer 🤮 😦!!! 111
97,671 comments,1.5k,4 hours ago,r/starcitizen,"Downvote away, but it is what it is... 3 out of 18 planned items actually made it into 3.16's release"
98,124 comments,1.6k,5 hours ago,r/tifu,TIFU my friend's proposal
99,606 comments,5.5k,9 hours ago,r/CasualUK,"My daughter asked me if all the roads in Britain are connected. I mean, if we're just looking at the mainland... Maybe? Someone help, this is breaking my brain."
100,644 comments,7.5k,8 hours ago,r/ToiletPaperUSA,Imagine being this much of a fuckin cry baby
101,648 comments,16.0k,8 hours ago,r/oddlyterrifying,They pulled the towel out of the snake!
102,412 comments,35.2k,14 hours ago,r/shittymoviedetails,In Blade (1998) the policeman tell Blade to freeze and he turns without resisting however after seeing he is a black man the police fires at him
103,374 comments,12.9k,10 hours ago,r/formula1,"Brabham BT46B: Designed by Gordon Murray who found a loophole in the regulations and attached a massive fan to create a vacuum under the car and increase downforce. Driven by Niki Lauda at the '78 Swedish Grand Prix, it won the only race it ever competed in as it got withdrawn immediately after."
104,598 comments,484,4 hours ago,r/fantasyfootball,Let this be a lesson to some of you...
105,496 comments,2.1k,12 hours ago,r/TooAfraidToAsk,How can I know the porn I watch is Abuse-Free?
106,85 comments,8.0k,7 hours ago,r/pics,Our 1st Christmas together and our 15th Christmas together.
107,548 comments,6.8k,11 hours ago,r/awfuleverything,If you don't know what true human horror is please look up Nutty Putty Cave. 28 hours of claustrophobic hell.
108,436 comments,3.7k,3 hours ago,r/Animemes,Guess it.
109,112 comments,5.8k,6 hours ago,r/EarthPorn,"It is crazy cold in Sweden, Småland now. On my way to our “summer” cabin [OC][6000x4000]"
110,602 comments,6.7k,9 hours ago,r/ich_iel,Ich📝iel
111,498 comments,2.0k,4 hours ago,r/news,Outlets hurt by dwindling public interest in news in 2021
112,489 comments,637,5 hours ago,r/dndnext,What Did You Once Think Was OP?
113,407 comments,2.6k,12 hours ago,r/witcher,Yennefer and Geralt have no chemistry in the show
114,170 comments,4.7k,4 hours ago,r/Unexpected,Cursing driver while crossing the road
115,594 comments,21.5k,18 hours ago,r/Spiderman,Marvel need to reveal who he is
116,299 comments,7.7k,12 hours ago,r/gtaonline,what…
117,124 comments,5.6k,6 hours ago,r/DunderMifflin,Me and the boys on our way to take a widely agreed-upon opinion about The Office and post it in r/DunderMifflin as though it’s an original thought
118,97 comments,6.1k,17 hours ago,r/SapphoAndHerFriend,Gal pals dancing to attract a male mate
119,322 comments,1.3k,8 hours ago,r/nursing,Lol no
120,516 comments,2.8k,7 hours ago,r/unpopularopinion,'Narcissist' is the most overused/misused word of 2021
121,263 comments,4.8k,4 hours ago,r/meme,Spain … without the s ! 🐸🥲
122,182 comments,8.8k,15 hours ago,r/DunderMifflin,Has there ever been a better sales pitch of hot garbage than Andy with his break room cheese platter?
123,61 comments,4.8k,5 hours ago,r/EngineeringPorn,Large wave flume at a wave research lab
124,426 comments,47.3k,12 hours ago,r/mildlyinteresting,My Grandmother has the first snowmobile license in CA
125,60 comments,5.8k,6 hours ago,r/IllegallySmolCats,this is Mango
126,544 comments,2.4k,10 hours ago,r/ClashRoyale,Tell me something that will get you in a situation like this. Mega Knight is balanced.
127,473 comments,1.2k,9 hours ago,r/apple,Apple Allegedly Preparing for iPhones Without SIM Card Slot by September 2022
128,71 comments,4.6k,4 hours ago,r/me_irl,me_irl
129,430 comments,1.4k,4 hours ago,r/marvelstudios,"If Spidey is still going to have a mcu partner for every movie,who do you think should be the next one ?"
130,123 comments,4.8k,6 hours ago,r/GetMotivated,[Image] Believe in yourself!
131,358 comments,16.6k,7 hours ago,r/MadeMeSmile,Man gets what he wants for Christmas…
132,46 comments,2.9k,3 hours ago,r/Damnthatsinteresting,It is a small world
133,217 comments,4.0k,5 hours ago,r/brooklynninenine,MRW I'm downvoted into oblivion for saying I hate Adrian Pimento
134,112 comments,4.3k,5 hours ago,r/StarWars,Made this Star Wars animation a few weeks ago
135,89 comments,4.3k,5 hours ago,r/UpliftingNews,Taiwan delivers 10 metric tons of aid for Filipino typhoon victims
136,282 comments,909,3 hours ago,r/ufc,What did Uriah Hall mean by this?
137,454 comments,2.8k,7 hours ago,r/pokemon,Animals that I’m surprised that haven’t turned into Pokémon yet
138,363 comments,2.8k,9 hours ago,r/Genshin_Impact_Leaks,Keqing and Ningguang Skins Detail in Game (Source: Official Site Mihoyo)
139,127 comments,7.0k,17 hours ago,r/oldpeoplefacebook,"Visiting grandma, this is how she ""gets to Hulu""... On Netflix."
140,443 comments,1.2k,9 hours ago,r/unitedkingdom,Plans in England for car chargers in all commercial car parks quietly rolled back
141,521 comments,6.4k,12 hours ago,r/pcmasterrace,Gaming PC’s Graphics Card
142,197 comments,4.7k,11 hours ago,r/TwoSentenceHorror,"My boyfriend gets so angry sometimes, but it's not his fault; the restaurant has been putting a lot of strain on him."
143,298 comments,12.1k,16 hours ago,r/dadjokes,"I dislike karma whores who make posts that imply it's their cake day, simply for upvotes."
144,386 comments,1.7k,4 hours ago,r/stocks,"Why is it that this sub is for stocks, but whenever someone asks for what they should buy every one just goes directly towards index funds?"
145,268 comments,773,6 hours ago,r/relationship_advice,My parents care more about my brother's dog than they do about my son and it's driving a wedge between myself and them.
146,328 comments,18.2k,12 hours ago,r/ContagiousLaughter,spelling bee word got kid cracking up on stage
147,110 comments,3.9k,5 hours ago,r/cats,Meet Cleo! I rescued her off the street on my route (I’m a mailman)
148,294 comments,Vote,2 hours ago,r/antiwork,Friend of mine nailed the interview
149,201 comments,7.2k,7 hours ago,r/natureismetal,"Receding ice cap forces the polar bear to change its diet. Taking down reindeer. Svalbard, Norway"
150,383 comments,590,3 hours ago,r/DnD,What is a rule from another game that should be added to 5.5e? Wrong answers only
151,553 comments,4.1k,2 hours ago,r/interestingasfuck,"Illustration of the largest sacrifice of infants in history. Around 1450 AD, 227 children were sacrificed in the Peruvian Chimu culture. The theory is that this great sacrifice was made to appease the rain gods because the rain did not stop, flooding the area, ruining the crops and more."
152,335 comments,1.0k,5 hours ago,r/Firearms,When Canadians see rifles
153,377 comments,8.9k,9 hours ago,r/confidentlyincorrect,It's Wolfenstein
154,142 comments,1.8k,4 hours ago,r/playboicarti,kanye west
155,245 comments,6.6k,14 hours ago,r/DiWHY,"Please, do not cover you bathroom counter in cement. This has homeowner written all over it."
156,74 comments,4.0k,5 hours ago,r/Awwducational,"While donkeys may have a notorious reputation for being stubborn, they are actually quite fearless dealing with predators as well as intelligent, playful and curious. When this donkey in Arkansas received presents a few days ago, his owner reported he ""always gets so excited when he gets a new one."""
157,95 comments,3.1k,4 hours ago,r/SelfAwarewolves,Self aware wolfenstein
158,240 comments,9.5k,7 hours ago,r/maybemaybemaybe,Maybe maybe maybe
159,103 comments,20.2k,10 hours ago,r/trippinthroughtime,This is a whole mood
160,154 comments,5.4k,7 hours ago,r/OldSchoolCool,"Dolly Parton taking a bath at her Tennessee Mountain home, 1987."
161,256 comments,6.1k,16 hours ago,r/blunderyears,2002. What living with 3 sisters gets you. I'm a dude.
162,175 comments,5.8k,7 hours ago,r/dataisbeautiful,[OC] Photos in my library by month & year since 2007
163,285 comments,1.8k,3 hours ago,r/bestof,"u/CockGobblin does the math on ex-cop Jared Schmeck's PPP loan. Schmeck is the man who said ""Let's go Brandon"" to US President Biden in front of his children during a publicly televised Christmas greetings call."
164,59 comments,8.4k,8 hours ago,r/ItemShop,+1000 range
165,93 comments,4.3k,6 hours ago,r/food,[Homemade] Blueberry and Raspberry Pie
166,341 comments,2.0k,7 hours ago,r/explainlikeimfive,ELI5: Why cant phones turn on instantly when plugged in after dead battery but laptops can?
167,155 comments,3.3k,4 hours ago,r/Superstonk,The Big Short: Reloaded. A Summary of My DDs on Student Loan Asset Backed Securities.
168,134 comments,4.7k,5 hours ago,r/todayilearned,"TIL the identity of the Mona Lisa was only confirmed in 2005 when a researcher at Heidelberg University found a note in the margin of a book, handwritten by one of Leonardo´s contemporaries in 1503, saying ""Brother Leonardo is working on a portrait of Lisa of Giocondo."""
169,211 comments,4.1k,6 hours ago,r/greentext,Anon is a NEET
170,115 comments,1.5k,5 hours ago,r/Gamingcirclejerk,Who Did These Genres Best?
171,336 comments,24.9k,15 hours ago,r/Tinder,"Well, that was sweet."
172,218 comments,10.1k,11 hours ago,r/tf2,why the fuck is this in the game files
173,214 comments,2.5k,6 hours ago,r/IASIP,"I cried so hard at that last scene, not even ashamed to admit it"
174,308 comments,1.3k,7 hours ago,r/dating_advice,Looks don’t matter as much as you guys think they do
175,987 comments,19.7k,8 hours ago,r/nextfuckinglevel,A 1995 Interview with Princess Diana on her opinion on being Queen
176,165 comments,17.8k,10 hours ago,r/pcmasterrace,The dedication is Important...
177,62 comments,3.0k,4 hours ago,r/StardustCrusaders,New Araki Art dropped for the 35th anniversary of JoJo's Bizarre Adventure
178,364 comments,1.4k,7 hours ago,r/NintendoSwitch,Just bought The Witcher 3. What kind of black magic is behind this port?
179,177 comments,6.5k,7 hours ago,r/Genshin_Impact,It's Fischl's VA's Bday!
180,176 comments,11.7k,16 hours ago,r/raimimemes,How Peter should have responded smh
181,146 comments,3.0k,6 hours ago,r/TheRightCantMeme,Funny how they only care about feminism when they can use it as a cudgel against trans people.
182,243 comments,1.5k,10 hours ago,r/chess,"MVL on Twitter: It would be more reasonable to focus on having water available for players, metal detectors […] and respecting a schedule […] than to pay full attention on an outdated dress code"
183,338 comments,2.3k,8 hours ago,r/france,"""Sans masque sans capote""- la résistance, 2021"
184,283 comments,18.1k,16 hours ago,r/StartledCats,First time on ice combined with first time wearing a bell collar
185,210 comments,2.8k,8 hours ago,r/ProgrammerHumor,Oh god oh fuck I learned rust wtf do I do guys
186,306 comments,1.7k,5 hours ago,r/DestinyTheGame,"FYI - Bungie has already released more specifics about DCV in Year 5 (including currencies, consumables, The Helm Overhaul, and Vanity Acquisition, Exotics)"
187,213 comments,3.7k,14 hours ago,r/HermitCraft,Updated Hermit Chart
188,277 comments,6.1k,14 hours ago,r/SelfAwarewolves,Funny you should say that..
189,169 comments,2.0k,7 hours ago,r/justneckbeardthings,"He has always been VERY interested in Asian culture."" I can imagine!"
190,359 comments,630,4 hours ago,r/dogecoin,I work minimum wage and put my entire life savings into Doge 🚀🚀 🐕
191,162 comments,14.1k,8 hours ago,r/ProgrammerHumor,"I said ""we can make everything with css"" in class"
192,189 comments,4.1k,12 hours ago,r/TikTokCringe,Incorrectly assumed race/ethnicity
193,291 comments,2.6k,10 hours ago,r/india,Scares.
194,5 comments,3.0k,4 hours ago,r/gayspiderbrothel,NO REASON IN PARTICULAR
195,186 comments,831,7 hours ago,r/Polska,Veto
196,106 comments,2.5k,7 hours ago,r/pics,Mark Bryan a robotic engineer is shattering gender norms by wearing what he likes.
197,106 comments,2.5k,7 hours ago,r/pics,Mark Bryan a robotic engineer is shattering gender norms by wearing what he likes.
198,49 comments,3.7k,5 hours ago,r/dndmemes,Peace and Quiet was never an option.
199,130 comments,4.2k,6 hours ago,r/raimimemes,Multiverse of madness counts as a raimi’s movie right?
200,239 comments,8.1k,13 hours ago,r/Wellthatsucks,Couple getting soaked by multiple cars
201,239 comments,13.2k,10 hours ago,r/ChoosingBeggars,The right way to treat ChoosingBeggars
202,37 comments,6.8k,8 hours ago,r/antimeme,Virgin vs chad
203,340 comments,4.3k,7 hours ago,r/IndianDankMemes,Spiderman NWH ki baat chal rahi hai 🤡
204,69 comments,3.6k,6 hours ago,r/BrandNewSentence,Stanley Yelnats
205,56 comments,3.4k,5 hours ago,r/suspiciouslyspecific,Love Languages Matter
206,286 comments,19.2k,17 hours ago,r/WinStupidPrizes,Kid doing science experiment on the treadmill
207,237 comments,16.6k,14 hours ago,r/TIHI,"Thanks, I hate laughing without facial expressions"
208,176 comments,10.8k,10 hours ago,r/catsareliquid,"This is Cthulhu. If I don't do this, everyone will die."
209,278 comments,3.5k,6 hours ago,r/thatHappened,And it went down just like that!
210,243 comments,21.0k,12 hours ago,r/Superstonk,Saw this in another sub. Brick by brick
211,612 comments,5.8k,6 hours ago,r/politics,Fauci says he was 'stunned' by boos from Trump supporters over booster revelation
212,279 comments,2.0k,8 hours ago,r/TwoXChromosomes,"I thought I was just lazy and fat, but it turns out I have very low iron."
213,163 comments,3.8k,6 hours ago,r/Bossfight,"Potassius maximum, when you eat it it restores all of your HP"
214,218 comments,2.0k,12 hours ago,r/linux,My grandma called and thanked me for installing Linux on her old computer
215,208 comments,2.7k,4 hours ago,r/de,Vom Partner verlassen? Warum nicht ein wenig Kreditkartenbetrug für einen guten Zweck?
216,205 comments,5.5k,7 hours ago,r/Jokes,"Do you mind if I sit beside you?” The girl replied with a loud voice, ""NO, I DON 'T WANT TO SPEND THE NIGHT WITH YOU!"" All the students in the library started staring at the guy; he was truly embarrassed."
217,38 comments,4.2k,7 hours ago,r/Catswhoyell,My gfs cat yells back
218,158 comments,9.1k,14 hours ago,r/nevertellmetheodds,Finger of God
219,159 comments,1.5k,4 hours ago,r/dndmemes,What is the most creative use of an offense spell you have seen?
220,39 comments,6.1k,7 hours ago,r/blursedimages,blursed drawing
221,32 comments,4.2k,6 hours ago,r/NatureIsFuckingLit,🔥 Northern hawk owl
222,102 comments,3.4k,6 hours ago,r/destiny2,Found this at a Pawn shop yesterday for twelve bucks and couldn't resist grabbing it! Singlehandedly the coolest thing I own!
223,97 comments,3.8k,13 hours ago,r/youseeingthisshit,Wolf and dog - friendly encounter
224,238 comments,13.0k,9 hours ago,r/Minecraft,A friend challenged me to do a RGB texture pack. What do you think about it ?
225,149 comments,11.8k,9 hours ago,r/whenthe,All reputable information comes from the hub 👍
226,34 comments,3.4k,6 hours ago,r/surrealmemes,Turkey Looks Like It Has Been Rack'ed
227,326 comments,2.2k,3 hours ago,r/Spiderman,Which spiderman suffered the most?
228,67 comments,6.1k,8 hours ago,r/oddlyspecific,"Ok, Josh"
229,21 comments,4.3k,6 hours ago,r/OTMemes,At last he shall have his revenge
230,184 comments,3.3k,6 hours ago,r/AnimalCrossing,"In case anyone is wondering why I'm single - (my little bro got me the comforter for Christmas because he knows my favorite interests are Animal Crossing and sleeping lol, I love it!!)"
