comment_count,upvote_delta,timeup_list,subreddit,thread_text
12.1k comments,26.6k,12 hours ago,r/AskReddit,What movie do you HAVE to finish watching anytime you stumble across it while channel surfing?
10.1k comments,1.0k,7 hours ago,r/wow,GIVEAWAY: I'm giving away a $100 Blizzard Balance Gift Card to one comment in this thread
8.1k comments,1.9k,4 hours ago,r/PS4,Giveaway: 100$ Playstation Store Gift Card to one lucky commentor within 24 hours from this post.
6.6k comments,37.4k,6 hours ago,r/antiwork,In case you would like to know what it’s like working at Starbucks
4.9k comments,85.4k,12 hours ago,r/WhitePeopleTwitter,Ancient Greece wasn't gay
414 comments,16.0k,3 hours ago,r/BlackPeopleTwitter,Probably the smoothest finesse of 2021!
308 comments,34.3k,5 hours ago,r/aww,"Since you guys liked my last drawing, here are Petunia and Poppy the foster kittens"
252 comments,14.3k,4 hours ago,r/MadeMeSmile,"Went to Walmart today, first time going anywhere without my wheelchair in 2.5 years! Very daunting but felt amazing to accomplish!"
629 comments,37.4k,5 hours ago,r/comedyheaven,ham sniffer
4.8k comments,38.6k,18 hours ago,r/videos,"Redneck boomer tries to steal from a guy, gets caught on tape and then gets humiliated in front of his wife and the Internet."
171 comments,16.2k,4 hours ago,r/rareinsults,Best friend ever?
4.4k comments,34.8k,7 hours ago,r/news,"Kim Potter, ex-Minnesota officer, found guilty of manslaughter in death of Daunte Wright"
3.6k comments,83.7k,11 hours ago,r/nextfuckinglevel,Homeless man stands in front of stolen firetruck to end pursuit in Orange County
3.2k comments,101k,12 hours ago,r/pics,Neil Patrick Harris at the premiere of the new Matrix movie
2.9k comments,4.4k,7 hours ago,r/NoStupidQuestions,What is an instant turn off to you visually?
2.7k comments,8.4k,16 hours ago,r/AskMen,"What’s the best way to respond to, “I have a boyfriend” if you were just being friendly or asking a question?"
2.5k comments,89.3k,10 hours ago,r/facepalm,It's an insane
565 comments,19.6k,5 hours ago,r/nextfuckinglevel,"No hand contact, two persons head to head climb 100 stairs in 53 seconds"
1.5k comments,25.0k,6 hours ago,r/WhitePeopleTwitter,Who teaches their kids to be this mean?
2.4k comments,35.0k,12 hours ago,r/Tinder,Jesus Christ !!!
259 comments,19.7k,5 hours ago,r/Minecraft,Screw WorldEdit i've got lots of time
1.2k comments,25.6k,7 hours ago,r/nottheonion,US conservative parents push for book bans – and unintentionally make reading cool again
1.8k comments,42.0k,7 hours ago,r/Damnthatsinteresting,Lioness tried her best in calming Lion from attacking a stupid zookeeper who was making eye contact with lion!
2.4k comments,30.1k,14 hours ago,r/dataisbeautiful,[OC] Boys vs Girl Pixar Movies?
2.4k comments,25.7k,12 hours ago,r/gaming,Why are they so loved?
613 comments,7.1k,2 hours ago,r/todayilearned,"TIL a survey in 2021 found nearly 1 in 5 American men admit to not having a single close friend. This has been called, ""The Loneliness Epidemic."""
2.3k comments,74.1k,10 hours ago,r/Unexpected,Possibly my favourite plot twist of all time
2.2k comments,28.0k,11 hours ago,r/LifeProTips,"LPT: If you fly more than once a year and are not a terrorist, get TSA PreCheck"
2.1k comments,15.2k,13 hours ago,r/nba,"[Sullivan] Austin Rivers rolls his eyes when he hears conspiracy theories in the locker room: about Moderna mind control & the fake news about Biden & Big Pharma in bed with the Illuminati for millions. “It’s all for money,” Rivers heard a fellow player say. “How’s it for money? It’s fucking free!”"
2.2k comments,15.8k,7 hours ago,r/PublicFreakout,Kim Potter: GUILTY of 1st and 2nd degree manslaughter in Daunte Wright's death.
401 comments,8.1k,5 hours ago,r/fantasyfootball,Potential Snow in the forecast for Rams @ Vikings Sunday
2.1k comments,28.8k,8 hours ago,r/worldnews,"U.S. bans imports from China’s Xinjiang region, citing human rights abuses"
2.1k comments,15.0k,7 hours ago,r/Superstonk,That thing is happening tomorrow and they still have no clue.
2.0k comments,30.6k,14 hours ago,r/dndmemes,I really enjoy creative ideas for spellbooks but this debate is dumb.
1.9k comments,60.2k,13 hours ago,r/MurderedByWords,The british sure did that well
538 comments,10.4k,4 hours ago,r/oddlyterrifying,Your gut reaction is usually correct.
1.9k comments,19.7k,8 hours ago,r/NintendoSwitch,"If you are gifting a Nintendo Switch this year, do not open it up to download all the updates for your kids beforehand"
786 comments,7.7k,3 hours ago,r/HolUp,same
277 comments,8.0k,4 hours ago,r/Superstonk,Forbes Person of the Year: Keith Gill (aka DFV)
1.7k comments,3.4k,14 hours ago,r/canada,Top Canadian museum to be imminently gutted in the name of 'decolonization'
1.5k comments,17.3k,7 hours ago,r/mildlyinteresting,Two kidney stones I passed today.
1.5k comments,21.9k,8 hours ago,r/tifu,TIFU by telling my bf he sounds like a minecraft villager
1.6k comments,29.3k,11 hours ago,r/politics,"Legalize It, Already! Biden needs to ditch his old-fashioned ideas about marijuana and realize that legalization is a winning bipartisan issue—something he desperately needs in 2022."
148 comments,18.6k,6 hours ago,r/memes,Hopefully they’ll fix it in the next patch update
51 comments,8.1k,4 hours ago,r/wholesomememes,I can do this all day
1.4k comments,27.1k,15 hours ago,r/Showerthoughts,Pornstars are probably a lot more popular than we think they are. We just usually don’t talk about them.
1.5k comments,9.1k,14 hours ago,r/HermanCainAward,"[Corrected] Elderly man spends all free time being racist on Facebook, painful death ensues"
1.6k comments,21.4k,9 hours ago,r/starwarsmemes,It is a chalenge
1.4k comments,11.5k,11 hours ago,r/atheism,"""That'll be $6.66."""
1.3k comments,35.3k,11 hours ago,r/SelfAwarewolves,-1 IQ
542 comments,20.8k,7 hours ago,r/mildlyinfuriating,At target and my soul almost left my body. They’re mini fridges.
913 comments,14.8k,7 hours ago,r/IdiotsInCars,The invincible Toyota Yaris GR
1.3k comments,17.1k,12 hours ago,r/Cringetopia,This lady acting like a 6 year old throwing a tantrum
1.2k comments,4.9k,12 hours ago,r/DnD,Am I in the wrong/Gatekeeping?
161 comments,10.5k,7 hours ago,r/AdviceAnimals,Can’t wait for it
1.2k comments,10.1k,10 hours ago,r/marvelstudios,Vincent D'Onofrio confirms he is playing the same version of Kingpin in Hawkeye as he did in Daredevil
1.2k comments,17.2k,18 hours ago,r/books,'A For-Profit Company Is Trying to Privatize as Many Public Libraries as They Can'
1.1k comments,11.1k,7 hours ago,r/TrueOffMyChest,I hate the woman who falsely accused me of sexual assault and hope she fails in life.
177 comments,9.4k,6 hours ago,r/HumansBeingBros,"My mom does this every year, for the trash men."
1.1k comments,12.9k,9 hours ago,r/WatchPeopleDieInside,Off Duty Cop pulls pistol on dude buying Mentos. “HE PAID FOR IT?! ARE YOU SURE?! My apologies.”
1.0k comments,8.0k,6 hours ago,r/freefolk,"No Peter, it wasn't a ""pretty white people"" problem, it just fucking sucked."
1.1k comments,17.7k,15 hours ago,r/movies,John Wick Chapter 4 Delayed until 2023
965 comments,7.8k,14 hours ago,r/europe,"Putin Loses His Cool When Confronted Over Ukraine, Claims It Belongs To Lenin Anyway"
175 comments,6.2k,4 hours ago,r/wallstreetbets,Tax season is coming up
1.7k comments,48.2k,8 hours ago,r/pics,This sign erected in Greene's district
94 comments,16.2k,8 hours ago,r/lego,Got the absolute most insane Christmas gift from my buddy who is a designer for Lego. A Luke Skywalker (Anakin Skywalker) lightsaber signed by the designer Hans Schlömer.
965 comments,7.3k,12 hours ago,r/sports,"Former NFL player died of 'chronic alcohol use,' autopsy shows"
1.0k comments,12.8k,12 hours ago,r/Futurology,"After years of doubts, hopes grow that nuclear fusion is finally for real and could help address climate change"
853 comments,32.3k,10 hours ago,r/TheLastAirbender,What was Katara going to say before Toph cut her off? Wrong answers only!
176 comments,8.7k,6 hours ago,r/CrappyDesign,Seriously? (Hair Cuttery Online Booking)
397 comments,5.9k,5 hours ago,r/halo,Are you seriously asking me to play an ENTIRE MATCH every day?
178 comments,5.4k,5 hours ago,r/baseball,Drawing Mike Trout every day until the lockout is over. Day 20.
1.1k comments,3.4k,10 hours ago,r/JoeRogan,Sh*t Rogan would say
985 comments,50.8k,17 hours ago,r/science,Study: Watching a lecture twice at double speed can benefit learning better than watching it once at normal speed. The results offer some guidance for students at US universities considering the optimal revision strategy.
1.0k comments,2.2k,9 hours ago,r/fantasyfootball,Vikings roster moves RB Dalvin Cook placed on Reserve/COVID-19.
561 comments,6.1k,5 hours ago,r/pcmasterrace,Accurate
1.0k comments,31.9k,14 hours ago,r/AnimalsBeingJerks,Savage attack
962 comments,12.0k,9 hours ago,r/Justrolledintotheshop,Going for an oil change… shop drops my truck into their bay. Merry Christmas everyone
926 comments,19.1k,16 hours ago,r/SweatyPalms,45 kilo girl fires 45 Magnum
975 comments,51.0k,14 hours ago,r/wallstreetbets,Oh china just being china
812 comments,70.7k,10 hours ago,r/interestingasfuck,We received a visit from a Lynx kitten a few years ago
169 comments,10.4k,7 hours ago,r/gaming,Stealth expert in action
125 comments,2.9k,8 hours ago,r/Wellthatsucks,My sister-in-law thought she bought a confetti cannon to prank me
793 comments,1.3k,6 hours ago,r/CFB,"Ohio State has returned about 7,000 of its allotment of 20,000 Rose Bowl tickets."
739 comments,5.4k,10 hours ago,r/leagueoflegends,Skins are starting to look alike more and more
861 comments,10.4k,8 hours ago,r/unpopularopinion,"There's a growing movement of ""introverts"" that aren't introverts at all. Just socially inept people who refuse to learn to function."
825 comments,961,8 hours ago,r/WoT,Rafes Q and A makes it clear the show was made targeting those who read some or all of the books years ago because of the changes.
834 comments,16.1k,12 hours ago,r/MapPorn,That Passport Map but I inverted the colors so it makes sense now
776 comments,25.1k,17 hours ago,r/CasualUK,Gotta love the Royal Mail.
314 comments,8.5k,6 hours ago,r/KidsAreFuckingStupid,Title
385 comments,13.0k,7 hours ago,r/Hololive,ITS A XMAS MIRACLE OUR FRIEND FBK GOT VERIFIED!!
555 comments,19.9k,9 hours ago,r/HistoryPorn,Remember that photo of the construction workers having lunch on the unfinished Empire State Building? Well here's the photographer Charles Ebbets taking that photo. 9/20/1932 [1024 - 1024]
820 comments,3.1k,13 hours ago,r/RedLetterMedia,So I finally watched Matrix Resurrections...
956 comments,5.4k,4 hours ago,r/teenagers,"I have nothing against the posts btw, just need something to do"
759 comments,6.8k,14 hours ago,r/pcgaming,Project Zomboid's Player Base Has Risen from 3k to 30k Peak Players During Its 8th Year of Early Access on Steam
454 comments,4.2k,4 hours ago,r/PoliticalHumor,This is the strangest timeline
355 comments,5.3k,4 hours ago,r/ShitPostCrusaders,Start of a new series perhaps
502 comments,4.6k,4 hours ago,r/facepalm,Guy Gets Fired for Not Participating in Company Mandated Prayer. NC
816 comments,41.5k,12 hours ago,r/NatureIsFuckingLit,🔥 Cranes escorting an alligator back to the water
748 comments,6.8k,10 hours ago,r/UpliftingNews,Omicron up to 70% less likely to need hospital care
642 comments,42.1k,12 hours ago,r/aww,Elephants reunite with caretaker after 14 months
243 comments,7.2k,6 hours ago,r/skyrim,Decorating Without Mods
616 comments,3.3k,11 hours ago,r/GlobalOffensive,Women and Counter Strike
255 comments,13.9k,9 hours ago,r/raimimemes,"""Peter....don't tell MJ"""
467 comments,4.4k,5 hours ago,r/HermanCainAward,"Trump finally went too far for former nominee Ben Garrison, who is now over COVID and him both."
373 comments,9.9k,8 hours ago,r/iamatotalpieceofshit,Drunk driving in a Porsche
4.1k comments,8.8k,13 hours ago,r/AskReddit,"Men, What is the most unusual place you have masturbated?"
762 comments,1.7k,11 hours ago,r/ethereum,"”I’m anti centralized corporate controlled lies” ~Jack Dorsey, Twitter CEO"
655 comments,11.7k,18 hours ago,r/witcher,Hey Henry….
71 comments,3.4k,4 hours ago,r/gayspiderbrothel,redit
700 comments,3.0k,14 hours ago,r/philadelphia,5 in custody after House Democrat carjacked at gunpoint in Philadelphia
527 comments,2.9k,10 hours ago,r/BestofRedditorUpdates,I [23F] walked in on my dad [47m] and one of my best friends [24f] having sex… don’t know what to do
179 comments,3.9k,4 hours ago,r/StarWars,The most badass droid of star wars!
412 comments,8.5k,8 hours ago,r/LifeProTips,LPT: Behave at a work party as if you were at work. Don't let the word 'party' fool you.
705 comments,3.0k,11 hours ago,r/TooAfraidToAsk,Anyone brush their teeth only once a day or none at all as an adult?
439 comments,3.6k,10 hours ago,r/Grimdank,Let’s see how this goes
602 comments,18.8k,10 hours ago,r/Hololive,Fubuki got her shiny Magikarp
110 comments,11.7k,8 hours ago,r/me_irl,me_irl
757 comments,2.7k,8 hours ago,r/deadbydaylight,What perk is like a drug for you guys? For me its gotta be resilience I always find a way to run it on every survivor I use
104 comments,6.6k,7 hours ago,r/lotrmemes,They bow to no one.
840 comments,15.4k,9 hours ago,r/Tinder,Hard to swallow pill
460 comments,21.2k,11 hours ago,r/PrequelMemes,What a battle
607 comments,18.9k,14 hours ago,r/Spiderman,Stan's response on the Andrew being too handsome to play Spidey
291 comments,10.1k,11 hours ago,r/formuladank,Poor Italian Jesus
708 comments,22.8k,11 hours ago,r/cats,My cat before and after taking him to vet for a regular check up. Do you see a difference?
688 comments,13.5k,12 hours ago,r/PoliticalHumor,Can't say he didn't do his job...
507 comments,19.0k,13 hours ago,r/insaneparents,Found in one of my pregnancy groups
562 comments,2.9k,15 hours ago,r/Cooking,The sound of knives on a glass cutting board is haunting me.
531 comments,9.1k,18 hours ago,r/byebyejob,Scum woman kicking and slapping horse. She lost her job after this clip went viral.
34 comments,12.7k,8 hours ago,r/dankmemes,Good job
280 comments,26.1k,14 hours ago,r/greentext,Anon autism is strong
115 comments,4.1k,5 hours ago,r/hmmm,hmmm
711 comments,22.8k,15 hours ago,r/AbsoluteUnits,This forging hammer.
565 comments,1.6k,6 hours ago,r/SquaredCircle,"[Brandon Thurston] AEW Dynamite last night on TNT: 1,020,000 viewers P18-49: 480,000 (0.37 rating)"
584 comments,5.2k,11 hours ago,r/Gamingcirclejerk,"Welcome to the Dark Souls of life, bitch!"
591 comments,13.5k,14 hours ago,r/natureismetal,This vervet monkey got into a fight with the alpha of the group and was fined one appendage for his trouble.
221 comments,4.4k,6 hours ago,r/StarWarsBattlefront,KYBER Launch Trailer | Private Servers available now.
59 comments,6.9k,7 hours ago,r/Eyebleach,A little defender is growing up
197 comments,14.4k,10 hours ago,r/ProgrammerHumor,"""user.fist_name"""
127 comments,2.9k,14 hours ago,r/howyoudoin,"What's the best thing that Joey ever did for someone else? To me it was giving up eating meat for pregnant Phoebe, so that the meat he didn't eat and her eaten meat would cancel out."
49 comments,3.3k,4 hours ago,r/AnimalsBeingDerps,Cat doing cat things . . .
3.5k comments,7.9k,7 hours ago,r/antiwork,What are some things that are arbitrarily considered “unprofessional”?
328 comments,12.3k,10 hours ago,r/TIHI,Thanks I hate watching someone hum from the inside
113 comments,3.9k,13 hours ago,r/pettyrevenge,Wrong way in a tight parking lot? Nope - - not backing up for you.
539 comments,10.3k,16 hours ago,r/Coronavirus,Australia Considers Charging Unvaccinated Residents for COVID-19 Hospital Care
565 comments,10.4k,14 hours ago,r/Conservative,"Nancy Pelosi's Husband Seems to be a Savant at Timing His Stock Market Trades, Beating Nearly Every Hedge Fund by 30%"
85 comments,7.4k,8 hours ago,r/BikiniBottomTwitter,It's 'Bring Your Pet to Work Day' in Bikini Barrio homies! 💗
163 comments,3.7k,5 hours ago,r/Spiderman,"One the things i like in Andrew spider-man is that he likes to troll his villains, in comics spider makes this thing all the time"
262 comments,16.0k,11 hours ago,r/formula1,"Lando reacting to him winning the ""best overtake of 2021"" Twitter poll tournament"
440 comments,2.5k,12 hours ago,r/AskUK,"On a train without a physical ticket, how screwed am I?"
649 comments,53.6k,15 hours ago,r/oddlyspecific,That must suck
71 comments,4.0k,6 hours ago,r/WitchesVsPatriarchy,"Right right... ""accidentally"""
368 comments,3.4k,9 hours ago,r/LivestreamFail,Leslie from MasterChef reveals the truth about his salted cake
512 comments,7.6k,13 hours ago,r/confidentlyincorrect,"its 55 if you didnt know (this looks bad because i didnt know how to get it in one pic , sorry)"
871 comments,6.5k,7 hours ago,r/Cringetopia,why?
94 comments,3.4k,4 hours ago,r/dndmemes,The evil lich…erm… KALLAX!
583 comments,43.2k,12 hours ago,r/oddlysatisfying,This guy applying varnish after restoring this painting
515 comments,5.3k,13 hours ago,r/EverythingScience,The data that shows Boomers are to blame for the labor shortage
503 comments,1.9k,9 hours ago,r/raimimemes,"""Nothing like a little self deception to get you through the night"""
50 comments,6.8k,8 hours ago,r/suspiciouslyspecific,"""Have you thought about your future lately, son?"""
251 comments,1.2k,8 hours ago,r/FundieSnarkUncensored,Guess who didn’t have an orgasm during her honeymoon?
242 comments,8.7k,9 hours ago,r/notinteresting,This is what happens when you mix baking soda (sodium bicarbonate) with sunflower seed oil and just a drop of 70% isopropyl alcohol at room temperature
535 comments,1.6k,5 hours ago,r/formula1,"What are your crazy predictions for the f1 2022 season, mine is that lance will win a race"
438 comments,13.1k,13 hours ago,r/coolguides,facts that can save your life
416 comments,16.2k,15 hours ago,r/AbruptChaos,Lost control
270 comments,1.4k,3 hours ago,r/relationship_advice,My ex husband is mad that “I look better now”
528 comments,937,8 hours ago,r/CryptoCurrency,You doubters are going to look quite foolish when BTC actually DOES hit $100K by EOY
324 comments,12.8k,11 hours ago,r/UpliftingNews,Denver Museum of Nature & Science receives $25M anonymous donation
465 comments,2.1k,11 hours ago,r/CollegeBasketball,ELI5: Why do all the D1 schools stop on this “line” starting in North Dakota and ending in Texas?
146 comments,16.7k,11 hours ago,r/likeus,The goal celebration 🤣
444 comments,10.3k,12 hours ago,r/Genshin_Impact,Daily Login [Concept]
313 comments,2.3k,10 hours ago,r/harrypotter,...but WHY does Voldemort always wait until the end of the school year to try and kill Harry?
287 comments,3.5k,6 hours ago,r/sadcringe,"My friend gave his coworker my number, and we didn’t realize how creepy he was. I kindly told him my friend didn’t know i wasn’t looking, and that I wasn’t interested. And this is what I got."
81 comments,4.4k,6 hours ago,r/ANormalDayInRussia,"Arcade game from my childhood, the original post was deleted, reposting."
295 comments,15.8k,11 hours ago,r/DunderMifflin,I got a personalized video from Rainn Wilson for my donation from his Prizeo charity campaign!
461 comments,19.4k,5 months ago,r/IdiotsInCars,Nothing irritates me more than people with brights
461 comments,19.4k,5 months ago,r/IdiotsInCars,Nothing irritates me more than people with brights
175 comments,9.3k,9 hours ago,r/Wellthatsucks,Somewhere in Germany today
468 comments,9.6k,13 hours ago,r/Jokes,What's the difference between a cop and a bullet?
32 comments,4.0k,4 years ago,r/indianpeoplefacebook,Best Friends Forever
32 comments,4.0k,4 years ago,r/indianpeoplefacebook,Best Friends Forever
31 comments,4.7k,6 hours ago,r/meme,Netflix and chill I guess
108 comments,6.1k,4 hours ago,r/mildlyinteresting,My sliced bacon looks pixelated
383 comments,2.7k,11 hours ago,r/entitledparents,Husband's mom euthanized cat for easier Christmas
388 comments,1.6k,8 hours ago,r/Music,[Unpopular Opinion] Adele's 30 Album is Boring & Getting Undeserved Praise
446 comments,3.4k,13 hours ago,r/Warframe,"Been playing for 3 days, just landed on Venus' Fortuna."
58 comments,5.6k,8 hours ago,r/meirl,meirl
536 comments,2.3k,14 hours ago,r/HolUp,Absolutely disgusting
536 comments,2.3k,14 hours ago,r/HolUp,where to begin?
295 comments,3.5k,13 hours ago,r/nursing,"ER Doc on nurses leaving healthcare: ""Do you know what a modern hospital room with $100,000 of equipment is without a nurse? A storage closet."""
45 comments,12.2k,5 hours ago,r/memes,Must be scary for them
326 comments,15.6k,11 hours ago,r/DiWHY,Thank you for your service
605 comments,1.6k,7 hours ago,r/Terraria,Who is this? Wrong answers only
44 comments,2.6k,4 hours ago,r/evilbuildings,"Even during the apocalypse, Waffle House will remain open"
249 comments,21.6k,12 hours ago,r/MovieDetails,"In The Lion, the Witch and the Wardrobe (2005), if you look closely at the lamppost, you can see it has roots, like a tree. This is because in the Narnia books, the lamppost was grown from an iron bar torn from a similar lamp in London."
132 comments,2.1k,3 hours ago,r/ToiletPaperUSA,"Ladies and gentlemen, Garrison finally turns on Trump"
493 comments,9.1k,12 hours ago,r/lifehacks,Balance an empty can on the doorknob to alert you if someone tries to open the door while you’re elsewhere in the house. There have been a few break-ins in my neighborhood recently.
310 comments,5.5k,8 hours ago,r/space,Rollout complete! The James Webb Space Telescope and the Ariane 5 rocket it’s riding on are all settled in their final position on Earth. Next step: launch on Dec. 25 at 7:20 am ET (12:20 UTC) to #UnfoldTheUniverse
136 comments,663,6 hours ago,r/ApplyingToCollege,Applied to 100 colleges
370 comments,20.2k,1 day ago,r/antiwork,Amazon safety practices
370 comments,20.2k,1 day ago,r/antiwork,Amazon safety practices
412 comments,496,5 hours ago,r/sydney,NSW recorded 5612 total new cases of COVID-19 in the 24 hours to 8PM last night (24/12/2021)
95 comments,4.8k,10 hours ago,r/anime_irl,anime_irl
236 comments,2.8k,5 hours ago,r/TwoXChromosomes,A bit of advice from a middle aged woman
110 comments,3.4k,6 hours ago,r/pokemon,This is NUGGET BRIDGE! Beat us 5 trainers and win a fabulous prize!
175 comments,28.9k,14 hours ago,r/comics,Christmas Break
374 comments,6.6k,12 hours ago,r/thatHappened,Cheers erupted when the plane landed
533 comments,5.6k,11 hours ago,r/blackmagicfuckery,"If you cross your eyes at the right distance away with those ""Find The Difference"" pictures, focus on one element (in this case, umbrella is good) and align the double vision you get on the same element. All of the differences in the picture will immediately shimmer and stand out."
136 comments,1.9k,8 hours ago,r/playboicarti,"Bro, I’m dead. Kanye fans cannot be real😭😭😭"
132 comments,1.6k,9 hours ago,r/HobbyDrama,"[YA Novels] ""Kathleen Hale is a Crazy Stalker"": The YA author who showed up at someone's house over a bad online review, and the controversy that resulted"
128 comments,6.4k,15 hours ago,r/vexillologycirclejerk,Flag of This Actually Happened And Was Waved IRL A Few Years Ago In Manchester
408 comments,21.1k,13 hours ago,r/lotrmemes,Real fans will understand
444 comments,12.0k,12 hours ago,r/religiousfruitcake,“Family values” bible thumping conman gets kicked to the curb.
108 comments,3.3k,5 hours ago,r/GME,Forbes person of the year: Keith Gill
330 comments,5.9k,10 hours ago,r/tumblr,Hot take
394 comments,3.0k,6 hours ago,r/blackcats,What type of cat is this?
169 comments,5.2k,8 hours ago,r/shittymoviedetails,"For Matrix Resurrections, we get our first look at a black Joker"
186 comments,20.2k,12 hours ago,r/Bossfight,"G U Y! Abuser of Shockwaves, Scarer of Chickens"
467 comments,8.2k,10 hours ago,r/maybemaybemaybe,Maybe Maybe Maybe
262 comments,4.1k,14 hours ago,r/LiverpoolFC,Jota mugging off the Leicester fans. Sing about that 😂
415 comments,2.5k,5 hours ago,r/apexlegends,Why do people do this!?
480 comments,4.4k,13 hours ago,r/ForzaHorizon,Anyone else find driving semi-realistically more fun than actually racing or am I just a fucking weirdo? Vid for example
264 comments,4.6k,11 hours ago,r/CatastrophicFailure,"(May 2, 1980) An MD-80 hard-landing test ends up ripping the whole tail of the aircraft due to an excessive sink-rate by the crew."
108 comments,2.8k,5 hours ago,r/quityourbullshit,Finally found one in the wild. A small town FB group is not the place to BS. Save that for Reddit.
181 comments,1.7k,9 hours ago,r/h3h3productions,"Fun find from 2014- RK added Natalie Portman to a pro-Israel email chain warning of a second “Hollacast”, Natalie scolds him on exposing her email address to strangers and RK responds in typical RK fashion"
21 comments,8.7k,10 hours ago,r/EarthPorn,"Sabrina Lake - Bishop, CA [OC][4442x5818]"
323 comments,636,6 hours ago,r/dndnext,"What subclasses, feats, spells and whatnot are good early game, but fall of hard at later levels?"
208 comments,10.4k,11 hours ago,r/food,[homemade] BEC on a croissant
106 comments,5.6k,16 hours ago,r/justneckbeardthings,Fedorabeard stalks Hot Topic worker
257 comments,10.5k,10 hours ago,r/Whatcouldgowrong,WCGW sitting on a bathroom sink together
176 comments,6.1k,11 hours ago,r/marvelmemes,I remember
564 comments,7.6k,9 hours ago,r/greentext,Anon moves to Seattle
343 comments,1.2k,5 hours ago,r/apple,Apple Retail Employees Going On Strike
60 comments,3.6k,6 hours ago,r/Terraria,"I finally finished the Solar Wings from the Solar Pillar, and the full video is in the comments"
579 comments,12.6k,7 hours ago,r/nextfuckinglevel,Lioness shows amazing traits and stopped Lion from harming a stupid zookeeper who was trying to make eye contact with The Lion!
74 comments,4.3k,8 hours ago,r/photoshopbattles,PsBattle: NPH in a Colorful Suit
