,comment_count,upvote_delta,timeup_list,subreddit,thread_text
477,13 comments,2.5k,13 hours ago,r/oddlyspecific,"Thanks, Tumblr."
478,115 comments,1.2k,7 hours ago,r/woodworking,Will they float?
479,100 comments,6.8k,13 hours ago,r/WatchPeopleDieInside,The empathy I feel for her is off the scale
480,90 comments,7.9k,9 hours ago,r/greentext,Anon is slow tard
481,89 comments,1.8k,9 hours ago,r/Eldenring,The Grand Voyage
482,34 comments,2.3k,7 hours ago,r/natureismetal,No one is coming to save you
483,84 comments,1.6k,5 hours ago,r/confidentlyincorrect,You can only get pregnant one day a month??
484,101 comments,1.8k,8 hours ago,r/3Dprinting,Nozzle Cleaner (Automated with G-code)
485,44 comments,2.3k,7 hours ago,r/ofcoursethatsathing,The three horns drinking challenge
486,137 comments,7.4k,14 hours ago,r/dontputyourdickinthat,Dat bread dough 😩
487,86 comments,781,6 hours ago,r/italy,Oggi la bandiera italiana compie 225
488,84 comments,5.5k,11 hours ago,r/lgbt,Mountaineer Erin Parisi has waved and planted the transgender Pride flag
489,97 comments,2.7k,8 hours ago,r/MemePiece,it's a show about pirates
490,38 comments,4.2k,7 hours ago,r/ProgrammerHumor,what happens when you think you tested your software to the limits
491,148 comments,10.8k,8 hours ago,r/interestingasfuck,American Kestrel is the smallest and most common falcon in North America. It is also called the Sparrow Hawk
492,99 comments,2.6k,10 hours ago,r/IndianDankMemes,Fuck You randia <3
493,64 comments,Vote,1 hour ago,r/MurderedByAOC,"I'm not saying that, but yes I am."
494,36 comments,2.9k,6 hours ago,r/NatureIsFuckingLit,🔥 This moth orchid looks like a phoenix made out of flowers instead of fire.
495,84 comments,2.2k,7 hours ago,r/WinStupidPrizes,Drag race with scooter 110cc
496,36 comments,1.6k,6 hours ago,r/evilbuildings,A new shopping mall in China looks like the Windows XP dragging window glitch
497,78 comments,2.6k,13 hours ago,r/wow,Public Service Announcement.
498,20 comments,2.2k,7 hours ago,r/dogswithjobs,look at this cutie i found at the doctors office
499,72 comments,2.1k,7 hours ago,r/battlestations,updated 2022 lush 🍃 set-up
500,87 comments,1.2k,7 hours ago,r/RedDeadOnline,Get ready to make some muneh boahs! We got a new butcher role!
501,41 comments,3.6k,10 hours ago,r/CuratedTumblr,croisshark my beloved :)
502,166 comments,1.5k,6 hours ago,r/Rabbits,Getting this sweet girl in 3 weeks and I need name ideas please <3
503,36 comments,1.7k,6 hours ago,r/disneyvacation,How to reload your Super Soakers
504,44 comments,2.1k,7 hours ago,r/NewVegasMemes,best acid west of the mojave
505,14 comments,1.6k,6 hours ago,r/Markiplier,All the Markipliers 🤣🤣
506,42 comments,624,4 hours ago,r/FundieSnarkUncensored,Can we all agree to follow the rules please and thank you?!
507,93 comments,1.3k,4 hours ago,r/creepy,My neighbors are.....interesting people.
508,61 comments,6.6k,10 hours ago,r/BikiniBottomTwitter,Who misses the OG SpongeBob 😭*meow*
509,43 comments,2.9k,9 hours ago,r/toptalent,The moon and the tree (painting timelapse)
510,129 comments,4.3k,8 hours ago,r/leagueoflegends,Why are people flaming new ranked borders when whole purpose of playing this game is to flame the jungler?
511,98 comments,3.0k,11 hours ago,r/shittyfoodporn,Shitty food porn?
512,21 comments,1.8k,6 hours ago,r/Komi_san,"Levi, be careful with this Titan"
513,317 comments,11.1k,7 hours ago,r/Unexpected,Breaking News!!!!
514,408 comments,2.5k,5 hours ago,r/Cringetopia,Bruh
515,59 comments,738,4 hours ago,r/ATLA,No srsly is there a reason for this???
516,337 comments,8.4k,9 hours ago,r/Genshin_Impact,Shenhe
517,66 comments,6.4k,11 hours ago,r/Bossfight,Baby assassin..... dangerously cute
518,60 comments,1.7k,8 hours ago,r/StardustCrusaders,Another edit I made. All 6 JoJos in anime form but in their manga colors. Someone already done it but I want to do my own as well but with all JoJos together in one picture. Took me 6 hours.
519,112 comments,2.1k,10 hours ago,r/ComedyCemetery,Haha funny haha we get it shut up
520,13 comments,1.5k,5 hours ago,r/wholesomegifs,Australian farmer couldn’t attend his aunts funeral so he laid out grain in the shape of a heart so “she can see it through the clouds”
521,64 comments,1.2k,16 hours ago,r/confidentlyincorrect,Overly confident on Family Feud
522,64 comments,1.2k,16 hours ago,r/confidentlyincorrect,The epitome of confidently incorrect
523,98 comments,668,5 hours ago,r/CODVanguard,"Everyone: ""Shotguns are op!"" Shotgun users on large maps:"
524,23 comments,2.6k,9 hours ago,r/SequelMemes,Mf don't make me anxious
525,96 comments,3.6k,10 hours ago,r/velvethippos,Wilma says hi!
526,58 comments,1.7k,7 hours ago,r/OnePunchMan,Why didn't they?
527,46 comments,782,20 hours ago,r/GeschichtsMaimais,Failed revolutionaries from Europe be like.
528,46 comments,782,20 hours ago,r/GeschichtsMaimais,Gescheiterte Revolutionäre in Übersee
529,79 comments,1.9k,7 hours ago,r/XboxSeriesX,Love the little Easter Eggs on this!!
530,60 comments,1.3k,6 hours ago,r/stevenuniverse,Animation used to be reeeaaal crude
531,111 comments,7.1k,10 hours ago,r/GetMotivated,[Image]
532,28 comments,3.0k,6 hours ago,r/lotrmemes,Have you seen this photograph?
533,18 comments,Vote,1 hour ago,r/suicidebywords,RIP Danny
534,501 comments,5.3k,6 hours ago,r/pics,Klanbusters busting klansmen
535,68 comments,1.0k,8 hours ago,r/Daredevil,If Daredevil ever took up Iron Man's offer
536,72 comments,1.3k,9 hours ago,r/OldPhotosInRealLife,"A Tree from 2008 to 2021. 12.31, Dongjiadu, Shanghai, China"
537,102 comments,1.6k,9 hours ago,r/modernwarfare,loving 2022 so far tbh
538,45 comments,2.0k,10 hours ago,r/SkyrimMemes,"I don't want him dead, I want him tortured. Any ideas?"
539,272 comments,Vote,1 hour ago,r/CryptoCurrency,"LRC lets people mint an NFT for JUST $2.50, over 100X CHEAPER than on Opensea."
540,22 comments,Vote,1 hour ago,r/insaneparents,She threw things at me a lot
541,68 comments,615,4 hours ago,r/BookOfBobaFett,The most brave character in series
542,99 comments,904,4 hours ago,r/mapporncirclejerk,Map of power socket types of Europe
543,38 comments,1.1k,4 hours ago,r/tf2shitposterclub,I'm going to hell for this
544,61 comments,1.1k,7 hours ago,r/imaginarymaps,What if Kazakhstan's current Revolution turned into a Civil war?
545,18 comments,1.0k,4 hours ago,r/gatesopencomeonin,Boys can be ...
546,85 comments,804,4 hours ago,r/ElderScrolls,Bretons are simply superior to all other races
547,84 comments,1.6k,9 hours ago,r/batman,Bruce Wayne's Long Coat 🦇
548,96 comments,1.1k,7 hours ago,r/danganronpa,Damn bro….. this is genuinely heartbreaking😢
549,74 comments,3.9k,7 hours ago,r/PrequelMemes,Unstoppable... he is unstoppable!
550,53 comments,671,3 hours ago,r/valheim,How a 20 minute errand turned into a 6 hour voyage
551,90 comments,2.0k,11 hours ago,r/HelluvaBoss,Loona Cosplay by n_mirikashi
552,106 comments,424,2 hours ago,r/DocumentedFights,spitting on guy escalates to a physical altercation
553,82 comments,1.4k,10 hours ago,r/memeframe,Best frame for every mission (meme)
554,102 comments,1.8k,6 hours ago,r/Art,"MACHINE 005, Me, Digital, 2022"
555,56 comments,1.7k,8 hours ago,r/WorkersStrikeBack,This is why revolutionary class consciousness is so important.
556,536 comments,5.1k,12 hours ago,r/NoStupidQuestions,How in the FUCK do you report a porn website?
557,58 comments,535,5 hours ago,r/confession,I stole thousands of dollars from my dad while in prison and lied to him for years
558,99 comments,1.8k,7 hours ago,r/destiny2,Wtf I opened over a hundred chests without getting this sword and now Its the only thing that drops? Bungie explain
559,68 comments,969,7 hours ago,r/HaloMemes,Vale is garbage tier
560,49 comments,2.0k,7 hours ago,r/Pikabu,So Satisfying !!
561,49 comments,2.0k,7 hours ago,r/Pikabu,So Satisfying !!
562,77 comments,1.3k,6 hours ago,r/MobKitchen,Harissa & Cumin Potatoes with Crispy Chickpeas & Yoghurt
563,77 comments,1.3k,6 hours ago,r/MobKitchen,Harissa & Cumin Potatoes with Crispy Chickpeas & Yoghurt
564,43 comments,1.6k,9 hours ago,r/maybemaybemaybe,Chad is faithful and has a dope ass collection
565,43 comments,1.6k,9 hours ago,r/maybemaybemaybe,Maybe Maybe Maybe
566,114 comments,2.8k,9 hours ago,r/animememes,It was me Dio.
567,122 comments,1.8k,9 hours ago,r/Shitty_Car_Mods,I don’t know if I hate this or not…
568,18 comments,1.6k,6 hours ago,r/funnyvideos,swag scrat
569,64 comments,1.2k,5 hours ago,r/DuggarsSnark,"Lookin at you, Meech"
570,45 comments,941,8 hours ago,r/PERSoNA,Kanji remains based
571,36 comments,1.1k,4 hours ago,r/blackmagicfuckery,they jump?
572,84 comments,4.3k,14 hours ago,r/spaceporn,"The Space Shuttle Endeavour mounted atop the Shuttle Carrier Aircraft flies over California's Mojave Desert on its way back to the Kennedy Space Center in Florida on Dec 10, 2008"
573,27 comments,2.2k,8 hours ago,r/itookapicture,ITAP of a cardinal
574,82 comments,836,4 hours ago,r/intermittentfasting,"M/27/5’9. A year of OMAD and 20:4. I feel really uneasy posting this because I have been insecure about my body my entire life. I just hope this post will inspire others because if I can do it, you can too. It’s never too late to better yourself. SW:188 GW:140 CW: 146."
575,76 comments,551,4 hours ago,r/startrekmemes,Still Hodling On
576,18 comments,1.8k,7 hours ago,r/NotMyJob,I feel safe now.
577,61 comments,836,6 hours ago,r/texas,Hot as a two-dollar pistol
578,141 comments,8.0k,7 hours ago,r/MadeMeSmile,He's a hero in real life too
579,16 comments,1.1k,4 hours ago,r/Cursed_Images,Cursed Birth
580,50 comments,858,5 hours ago,r/ZeroWaste,Keurig Canada fined $3 million for misleading claims over coffee pod recycling
581,134 comments,8.7k,12 hours ago,r/Hololive,“And the winner goes to.....!”
582,58 comments,1.7k,7 hours ago,r/BokuNoHeroAcademia,Ochacos cheeks become even rosier in the cold [fanart by me]
583,52 comments,1.3k,6 hours ago,r/DevilMayCry,Positive affirmations from character action protagonists
584,56 comments,2.2k,8 hours ago,r/HistoryPorn,"Christmas day in Vukovar, 1992, Croatian War [1080x858]"
585,56 comments,1.7k,8 hours ago,r/PandR,ONE OF THE BEST EPISODES EVER!
586,6 comments,1.2k,5 hours ago,r/meme,Ohio am I right?
587,6 comments,1.2k,5 hours ago,r/meme,Ohio am I right?
588,33 comments,1.1k,8 hours ago,r/okbuddybaka,Feel like a clown when watching Anime.
589,47 comments,1.8k,8 hours ago,r/Instagramreality,When a family member accidentally posts your real face
590,9 comments,1.5k,6 hours ago,r/HollowKnightMemes,Stay pure
591,62 comments,5.2k,9 hours ago,r/perfectlycutscreams,Nein
592,63 comments,1.5k,7 hours ago,r/libertarianmeme,Term limits anyone !
593,545 comments,8.1k,12 hours ago,r/iamatotalpieceofshit,"Guy heckles cruise captain and crew members, gets kicked out"
594,78 comments,845,6 hours ago,r/totalwar,FAREWELL Total War Warhammer II (100th video)
595,155 comments,14.2k,8 hours ago,r/nextfuckinglevel,An encounter of two man of the same culture
596,564 comments,3.2k,8 hours ago,r/science,"Women vaccinated against COVID-19 saw a slight delay in their period of almost a day. The slight increase in menstrual cycle length is not clinically significant. Any change of fewer than eight days is classified as normal by the International Federation of Gynecology and Obstetrics. N=4,000"
597,68 comments,688,5 hours ago,r/h3h3productions,Hasan is such a hypocrite for streaming master chef
598,69 comments,948,5 hours ago,r/gaybros,Adopting a teen is the best hardest thing you can ever do. 🏳️‍🌈
599,40 comments,1.4k,5 hours ago,r/TheLastAirbender,Is this official LoK FB post hinting at something or is it just for fun?
600,34 comments,2.1k,8 hours ago,r/ComedyNecrophilia,She wasnt the 1 😭😭
601,44 comments,3.4k,11 hours ago,r/HighQualityGifs,Tryna make HQG appeal to newcomers can be tricky.
602,31 comments,1.4k,6 hours ago,r/Keep_Track,"Joe Manchin: Coal baron, protector of billionaires, child poverty booster"
603,93 comments,693,4 hours ago,r/90s,The most 90s thing known to man
604,619 comments,3.1k,7 hours ago,r/gaming,"AMA: We're the devs of Dead Cells, we've just released a new DLC and we're here to talk about whatever you want!"
605,71 comments,Vote,2 hours ago,r/xboxone,My Target today. Is the great Xbox drought over?
606,27 comments,946,8 hours ago,r/DBZDokkanBattle,"Damn I can't run her on peppy gals, didnt pull Videl"
607,58 comments,1.6k,9 hours ago,r/Warframe,Hand-made Ordis
608,75 comments,1.6k,6 hours ago,r/assholedesign,"Ads disguised as somebody in your friends list so when you click on them, it brings you to their game"
609,110 comments,599,4 hours ago,r/xbox,Anyone else do hardware mods?
610,76 comments,4.1k,8 hours ago,r/BrandNewSentence,What?
611,57 comments,2.5k,9 hours ago,r/Warhammer40k,Ultramarines' Primaris Chaplain
612,36 comments,Vote,2 hours ago,r/RPClipsGTA,Judge Crane's verdict on Irwin Dundee 61x Misuse of a 911 System
613,55 comments,3.2k,13 hours ago,r/witcher,I built a Ciri sculpture in minecraft
614,284 comments,15.1k,11 hours ago,r/blursedimages,Blursed_Quagmire irl
615,52 comments,1.6k,9 hours ago,r/aaaaaaacccccccce,A lot of Christians don't understand abstinence vs asexuality
616,46 comments,1.8k,8 hours ago,r/evangelionmemes,GTA Evangelion 5.0: You can (not) survive
617,76 comments,1.3k,10 hours ago,r/webcomics,BOBBY IS A TREE.
618,517 comments,3.6k,8 hours ago,r/TrueOffMyChest,I hate that I [28F] joined the fat acceptance movement and let my health suffer the consequences
619,59 comments,777,5 hours ago,r/cringepics,Playing the victim on facebook
620,20 comments,881,3 hours ago,r/SupermodelCats,Pearl uses her back feet to help make the biscuits
621,33 comments,1.1k,7 hours ago,r/thomastheplankengine,Got stuck in an infinite playground with trans kids from my school
622,52 comments,1.7k,8 hours ago,r/ihadastroke,You have such a way with words
623,40 comments,1.3k,1 day ago,r/HolUp,Press F to pay respect!
624,40 comments,1.3k,1 day ago,r/HolUp,Press F to pay respect!
625,19 comments,1.6k,7 hours ago,r/PetTheDamnDog,Pet the sad doggo
626,434 comments,1.7k,8 hours ago,r/TooAfraidToAsk,Is heroin something you get addicted to on the first try?
627,11 comments,1.4k,6 hours ago,r/Konosuba,Aqua drawn by えにぐま。
628,44 comments,2.6k,11 hours ago,r/GaySoundsShitposts,if candace owens is praising you you’re doing something wrong
629,202 comments,1.5k,4 hours ago,r/nba,"[Kawakami] Andrew Bogut recalls the time when Klay Thompson was roaming in Olympic Village, in full Team USA gear, asked Bogut if he can come to Team Australia's quaters, stayed for dinner and ended the night with playing ping pong with a random player from Australian Athletics team"
630,56 comments,1.6k,7 hours ago,r/Minecraftbuilds,I made this thing; Thoughts?
631,391 comments,8.1k,9 hours ago,r/WhitePeopleTwitter,"Florida man stockpiled 1,000,000 covid tests and let them expire. Video included."
632,31 comments,3.1k,14 hours ago,r/Neverbrokeabone,"Phew, close one"
633,297 comments,1.8k,4 hours ago,r/tf2,"I´ll draw, add, remove and/or change whatever the top(s) comments say. Day 3:"
634,211 comments,18.2k,13 hours ago,r/therewasanattempt,To rob him
635,70 comments,684,4 hours ago,r/SatisfactoryGame,"I finally ""completed"" my Early-Game factories today"
636,50 comments,1.0k,5 hours ago,r/HadesTheGame,There is no greater disappointment
637,71 comments,2.8k,6 hours ago,r/shitposting,I forgor
638,47 comments,853,4 hours ago,r/ontario,Spot the difference
639,9 comments,1.2k,4 hours ago,r/antimeme,Technically the truth
640,50 comments,759,5 hours ago,r/DIY,2 bedroom apartment renovation
641,58 comments,3.0k,10 hours ago,r/adhdmeme,Middle? There is no middle.
642,55 comments,1.2k,9 hours ago,r/UrbanHell,Seoul slums
643,39 comments,2.8k,10 hours ago,r/dadjokes,"A little boy came running up to me and said, ""Please help, my dad is in a fight!"" I followed him and came across two men fighting, so I asked him, ""Which one's your dad?!"" He replied, ""I don't know."""
644,21 comments,2.0k,8 hours ago,r/LiminalSpace,The Amazing World of Gumball.
645,482 comments,8.2k,14 hours ago,r/oddlyterrifying,"Amazon won't let us listen to music or sit down but we get these ""motivational"" messages all day long."
646,176 comments,3.1k,10 hours ago,r/videos,This will be the greatest little science lesson you hear today
647,463 comments,45.2k,11 hours ago,r/interestingasfuck,Working 2D paper flashlight
648,72 comments,4.1k,10 hours ago,r/MinecraftMemes,Which one are you?
649,318 comments,5.3k,7 hours ago,r/politics,Cyber Ninjas shutting down after judge fines Arizona audit company $50K a day
650,39 comments,1.2k,7 hours ago,r/travel,"On someone else's request, here are a few more shots from my trip to Lisbon last week."
651,46 comments,1.7k,11 hours ago,r/WarplanePorn,Supermarine Spitfire. New in box. Some assembly required. Ammo and fuel not included. Will ship internationally (AXIS powers excluded) (580x402)
652,51 comments,4.2k,3 days ago,r/AbsoluteUnits,Bears also want to keep the doctor away
653,51 comments,4.2k,3 days ago,r/AbsoluteUnits,Bears also want to keep the doctor away
654,32 comments,644,5 hours ago,r/RetroFuturism,pan american view their future big in 1970
655,57 comments,2.4k,9 hours ago,r/FoodPorn,"[OC] New and improved, honey crueller doughnuts!"
656,97 comments,3.2k,4 hours ago,r/HolUp,Ummm
657,48 comments,435,3 hours ago,r/bisexual,just told 2 close friends i'm bi in the groupchat...
658,18 comments,3.3k,10 hours ago,r/ItemShop,"Avocado ball, +100 playfulness -10 originality"
659,40 comments,591,5 hours ago,r/ethtrader,"I've been buying the ""LAST"" dip."
660,66 comments,1.4k,6 hours ago,r/Memes_Of_The_Dank,Anyone else in the same boat?
661,51 comments,1.0k,6 hours ago,r/BadChoicesGoodStories,Republicans: the dumbest people on the planet
662,57 comments,1.6k,11 hours ago,r/vandwellers,"𝑺𝒖𝒏𝒓𝒊𝒔𝒆, [𝒖𝒏𝒆𝒅𝒊𝒕𝒆𝒅] 𝒂𝒔 𝒔𝒆𝒆𝒏 𝒕𝒉𝒓𝒐𝒖𝒈𝒉 𝒕𝒉𝒆 𝒊𝒄𝒆 𝒐𝒏 𝒎𝒚 𝒘𝒊𝒏𝒅𝒔𝒉𝒊𝒆𝒍𝒅. 🧊"
663,31 comments,846,4 hours ago,r/blunderyears,We would dress up and go to Walmart to play hide and seek
664,16 comments,1.3k,6 hours ago,r/PhoenixSC,"Mmm, Spicy snack."
665,49 comments,953,7 hours ago,r/araragi,ｂｅｓｔ ｇｉｒｌ.
666,30 comments,1.3k,6 hours ago,r/arknights,"Rosmontis and a tired Doctor (by @@na_tarapisu153, TL by me)"
667,294 comments,3.7k,9 hours ago,r/formula1,"Useless but interesting fact: the only two drivers who won the Championship not powered by Renault, Ferrari or Mercedes engines in the past 30 years(1992-2021)"
668,14 comments,1.4k,7 hours ago,r/zelda,[BOTW] Adorable Zelda (art by mmimmzel)
669,51 comments,1.3k,17 hours ago,r/memes,trans rights are pretty pogger
670,51 comments,1.3k,17 hours ago,r/memes,trans rights are pretty pogger
671,53 comments,1.8k,10 hours ago,r/analog,Mamiya 7 | 65mm | Portra 160
672,33 comments,2.1k,9 hours ago,r/HermitCraft,"Boatem map, map of the Boatem"
673,45 comments,1.5k,9 hours ago,r/DankMemesFromSite19,Time To Switch Teams
674,15 comments,1.2k,5 hours ago,r/shittymoviedetails,"In Spiderman: No Way Home(2021), Dr. Strange tells Peter to ""Scooby-Doo this crap"" in reference to Scooby-Doo! and the Curse of the 13th Ghost(2019), where Dr. Strange helped a bunch of pothead teenagers and a dog return Ghosts to captivity in a chest. This is similar to the plot of No Way Home."
675,9 comments,1.5k,7 hours ago,r/gravityfalls,Pill and Blankton
676,34 comments,1.2k,8 hours ago,r/smashbros,New Smash Pic-of-the-Day! (01/07/2022) from @Sora_Sakurai
677,91 comments,5.4k,7 hours ago,r/cats,"Travis and Sigrid, the bike riding adventure cat (it's us!)"
678,328 comments,4.5k,8 hours ago,r/leagueoflegends,"Quickshot is back in social media, will be in LEC, explains why he needed time"
679,68 comments,1.2k,9 hours ago,r/FridayNightFunkin,who tf playing cheeky mod on the Walmart pc 💀
680,54 comments,698,4 hours ago,r/LosAngeles,"""So, you have chosen....death"" - Red-tailed Hawk in Burbank"
681,199 comments,3.7k,5 hours ago,r/wallstreetbets,Today in a nutshell
682,38 comments,2.1k,9 hours ago,r/drawing,Picked up my pencil for the first time in 2022 🥰
683,39 comments,2.2k,12 hours ago,r/BokuNoMetaAcademia,No wonder therapy is so lucrative
684,34 comments,1.4k,7 hours ago,r/whatcouldgoright,How to throw yourself at the ground and miss.
685,37 comments,775,3 hours ago,r/BisexualTeens,I don’t think I’m gay
686,42 comments,1.0k,5 hours ago,r/dankruto,Tobirama's chat history [oc]
687,52 comments,2.2k,9 hours ago,r/blackmagicfuckery,"Amazing 3D Time Tunnel in Hangzhou, China"
688,39 comments,834,4 hours ago,r/Berserk,"Okey guys, the first session is done :D"
689,37 comments,2.8k,13 hours ago,r/Catculations,I misscatculated…
690,40 comments,693,3 hours ago,r/okbuddyhetero,Waiting for gogoanime to load ffs
691,4 comments,963,5 hours ago,r/AnimalTextGifs,Long day
692,5 comments,1.5k,7 hours ago,r/Technoblade,Need more be said?
693,375 comments,6.6k,12 hours ago,r/Showerthoughts,You were in your mom longer than your dad ever will be
694,48 comments,500,3 hours ago,r/Bitcoin,"2 bananas, 591 sats ($0.25 / R4) and a Lightning Network fee of just 1 satoshi. Using @MuunWallet in South Africa's township."
695,43 comments,1.2k,3 hours ago,r/IllegallySmolCats,"the ginger girls this morning! Cheeto weighed in at a pound yesterday (470g)! Curry and Butterball weigh around 670g and 700g respectively, for reference"
696,24 comments,2.3k,7 hours ago,r/NonPoliticalTwitter,What would you put in there?
697,55 comments,8.0k,7 hours ago,r/dankmemes,An interesting tit
698,11 comments,1.4k,7 hours ago,r/nukedmemes,Take it from Tom
699,151 comments,3.4k,6 hours ago,r/news,Monsanto pleads guilty to pesticide-related crimes in Hawaii
700,31 comments,Vote,6 hours ago,r/news,Rewards just got real. We match all the cash back you’ve earned at the end of your first year. (Limitations apply.)
701,238 comments,15.9k,13 hours ago,r/aww,My Aussie girl (who’s scared of men) finds a new friend 🥺
702,24 comments,1.2k,6 hours ago,r/Battlefield,"During the BF4 days, one of my goals was to get on the Hainan end of match screen. To this day it's still my favorite clip."
703,59 comments,2.1k,11 hours ago,r/MakeupAddiction,Warm blends with green multichrome shimmer :3
704,30 comments,1.1k,5 hours ago,r/thalassophobia,Lighthouse in Portugal. This is the time of the year that the waves are massive. Not on my bucket list!!!
705,43 comments,538,4 hours ago,r/legostarwars,"I know a lot of you have bigger collections, but I’m really happy with what I have. Don’t have room for them, so they’re in my basement."
706,43 comments,1.2k,8 hours ago,r/TheSimpsons,"Hello, this is Moleman in the morning. Good Moleman to you. Today, part four of our series of the agonizing pain in which I live every daaaay."
707,51 comments,1.1k,7 hours ago,r/AbruptChaos,Filming the rain.
708,30 comments,693,6 hours ago,r/MonsterHunterWorld,Namielle gaining Bioluminesce by absorbing water!
709,57 comments,1.9k,5 hours ago,r/ich_iel,ich_iel
710,38 comments,2.1k,9 hours ago,r/engrish,did you every saw a so fast dog?
711,64 comments,574,5 hours ago,r/Brawlstars,Oh god
712,41 comments,957,8 hours ago,r/F1Game,Great battle at Baku
713,41 comments,1.2k,7 hours ago,r/thesims,"Found this photo of me, age 18, playing the Sims, in the year 2000. If you look closely, I’m building some kind of 5-TV theater surrounded by a pool."
714,5 comments,1.4k,7 hours ago,r/AAAAAAAAAAAAAAAAA,AAAAAAAAA
715,49 comments,789,6 hours ago,r/BigChungusReligion,"There were references to this event in the seventy third chapter, twelfth verse of the holy chungus bible"
716,56 comments,650,6 hours ago,r/sabaton,"This morning, I woke up to Soldier Of Heaven and 4 inches of snow"
717,36 comments,886,7 hours ago,r/swtor,Did you know that you can earn the Legacy Title 'Cartel Security' by traversing the rafters of the Cartel Bazaar where you can find a secret NPC?
718,27 comments,1.3k,7 hours ago,r/HadToHurt,well someone is cranky this morning.
719,30 comments,706,4 hours ago,r/ShitpostXIV,NFT- Non Fourchenault Token
720,37 comments,1.6k,12 hours ago,r/maybemaybemaybe,Makeup
721,37 comments,1.6k,12 hours ago,r/maybemaybemaybe,Maybe maybe maybe
722,19 comments,650,2 hours ago,r/CloneWarsMemes,Ouch!
723,86 comments,2.5k,7 hours ago,r/Deltarune,Berdly's and Lancer's inbattle animations if they were party members!
724,45 comments,1.4k,8 hours ago,r/Baking,That's one way of using up the Chocolate Oranges.
725,160 comments,5.6k,15 hours ago,r/WinStupidPrizes,Wcgw putting hydraulics on a car
726,160 comments,5.6k,15 hours ago,r/WinStupidPrizes,Puttin' hydraulics in cars takes skillz that this dude didn't have
727,37 comments,2.2k,11 hours ago,r/ArtefactPorn,"The Temple of Hephaestus in Athens, Greece, built in 415 B.C. (2000X1499)"
728,33 comments,1.3k,9 hours ago,r/InternetIsBeautiful,Google shut down their web site for free 3D low poly models and Dook remade it
729,14 comments,1.2k,7 hours ago,r/shittyrainbow6,Very interesting title
730,40 comments,2.2k,10 hours ago,r/depression_memes,any dr who fans here?
731,164 comments,4.3k,10 hours ago,r/todayilearned,TIL that in 2013 the Vatican had to pull 6000 papal medals from sale because the inscription said “Lesus“ instead of “Jesus”.
732,48 comments,2.9k,13 hours ago,r/Angryupvote,Angry Jesus corporation
733,12 comments,1.1k,6 hours ago,r/PetsareAmazing,Smol cat petting his Hooman!
734,43 comments,520,4 hours ago,r/TaylorSwift,After working very slowly over the last 5 months 😬 I finally finished my crochet version of the cardigan!
735,50 comments,698,6 hours ago,r/labrador,This is Dexter he’s 9 weeks old !
736,40 comments,1.5k,9 hours ago,r/minipainting,My projects
737,23 comments,614,5 hours ago,r/TenseiSlime,Literally
738,48 comments,1.1k,9 hours ago,r/falloutnewvegas,'SURROUNDED'
