,comment_count,upvote_delta,timeup_list,subreddit,thread_text
495,79 comments,938,6 hours ago,r/notinteresting,I forgot to shave
496,58 comments,1.0k,4 hours ago,r/InternetIsBeautiful,If you're alone this xmas we're running a Virtual Xmas Party today! Feel free to join and say hi :)
497,52 comments,1.4k,10 hours ago,r/GreenAndPleasant,CapiTAliSm eFFiciENtly AlloCAtEs ReSOURceS
498,66 comments,4.7k,15 hours ago,r/HumansBeingBros,A group of neighbours in LA threw a young girl a socially distances welcome-home party after she finished chemotherapy
499,41 comments,1.4k,5 hours ago,r/titanfall,Made a couple of smart airsoft sights Titanfall style :-)
500,77 comments,469,3 hours ago,r/Anarcho_Capitalism,"In a monumental moment of solidarity, a group of Australian citizens created a human blockade against the authorities to defend a cafe that serves all, regardless of vaccination status"
501,109 comments,2.6k,6 hours ago,r/raimimemes,Forget Bully Strange or Strange Bully i bring you Benedick Cumberbatch
502,26 comments,3.5k,9 hours ago,r/BirdsArentReal,Captured drone
503,77 comments,20.5k,15 hours ago,r/gifs,Such adorableness!
504,84 comments,656,5 hours ago,r/forhonor,"After 1,578 hours, i finally have all my heros to rep 10, let the grind continue!"
505,52 comments,504,4 hours ago,r/boston,PSA: It's REALLY icy out there. Be especially careful on those first few steps outside your door.
506,32 comments,1.1k,3 hours ago,r/Awwducational,"A number of mammals, such as foxes, dogs, cats, pademelons, and even humans, are targeted for kleptotrichy by birds which use the hairs as building material to construct their nests. This tufted titmouse is pulling hairs from a raccoon while it is munching on sunflower seeds from a birdfeeder."
507,28 comments,1.1k,4 hours ago,r/jschlatt,Why does google say ted is 5’8” when he is clearly taller than Schlatt (who is allegedly 6’3”)
508,24 comments,Vote,2 hours ago,r/lego,Road trip animation I made (RJMBricks OP)
509,109 comments,3.5k,7 hours ago,r/meme,A title
510,51 comments,686,3 hours ago,r/DnD,[OC] i gave my friend some teeth and they put them in dice
511,41 comments,2.3k,9 hours ago,r/animegifs,"""I love the kind of woman that can kick my ass"" !"
512,32 comments,1.9k,6 hours ago,r/MemeVideos,Chinazzers
513,69 comments,1.6k,6 hours ago,r/deadbydaylight,What are the totem perks' views on totems?
514,33 comments,1.6k,8 hours ago,r/okmatewanker,Ravva shtewpid innit
515,42 comments,632,5 hours ago,r/confessions,I like to creep around my home and act like a goblin
516,82 comments,1.1k,7 hours ago,r/RPClipsGTA,Chawa wakes up to give Boe his Chain on Christmas 💙
517,43 comments,630,6 hours ago,r/PERSoNA,It’s Christmas and I’m stuck at work
518,47 comments,1.3k,6 hours ago,r/ksi,The end of the sidemen is upon us. We are now in the endgame😥
519,40 comments,884,2 days ago,r/AskThe_Donald,I'm not sure if this is peak persecution fetish or peak self awareness
520,40 comments,884,2 days ago,r/AskThe_Donald,Why arecwe even still here??
521,47 comments,1.3k,4 hours ago,r/wallstreetbets,A special chart for all my WSBs
522,72 comments,662,5 hours ago,r/PhoenixSC,A perfectly normal image.
523,164 comments,8.1k,7 hours ago,r/dankmemes,Standing or sitting
524,53 comments,777,9 hours ago,r/memes,🏴󠁧󠁢󠁳󠁣󠁴󠁿
525,53 comments,777,9 hours ago,r/memes,American me might be guilty of this one
526,33 comments,1.5k,5 hours ago,r/ComedyNecrophilia,happy holy sunday y’all😝😝
527,9 comments,1.4k,5 hours ago,r/aaaaaaacccccccce,__Getting some real ace vibes from this
528,37 comments,4.3k,6 hours ago,r/blursedimages,Blursed_santa
529,55 comments,739,6 hours ago,r/ik_ihe,Ik🇮🇹ihe
530,36 comments,564,5 hours ago,r/KGBTR,canım ya
531,34 comments,2.0k,5 hours ago,r/Bossfight,"Deehr, soul gatherer from the cosmic planes."
532,34 comments,1.4k,6 hours ago,r/StarWarsBattlefront,Respect the elders Poe
533,49 comments,971,5 hours ago,r/canada,James Webb Space Telescope lifts off on historic mission
534,28 comments,2.3k,7 hours ago,r/starwarsmemes,"Kowalski/Tech,analysis"
535,55 comments,2.7k,13 hours ago,r/Rabbits,Painting of my bunny Kuzco
536,35 comments,542,3 hours ago,r/HighStrangeness,The Pascagoula Abduction in Mississippi is one of the most famous ET encounters stories out there
537,42 comments,684,5 hours ago,r/Denmark,"Mormor: Åh nej pakkeleg, det kan jeg ikke finde ud af. Også mormor:"
538,69 comments,365,3 hours ago,r/FridayNightFunkin,Hi everyone! I'd like to show a mod me and my team's making. vs newgrounds! The mod's still being worked but we're still open for people to join so if you'd like to comment/dm me!
539,40 comments,878,5 hours ago,r/Seaofthieves,My Wife Got Me This Awesome Sticker From An Etsy Shop — Merry Christmas Pirates!
540,62 comments,680,5 hours ago,r/jameswebb,God’s speed brother
541,74 comments,1.9k,5 hours ago,r/gayspiderbrothel,25000 likes
542,52 comments,8.5k,16 hours ago,r/fakehistoryporn,"On December 24, 2012, Santa was gunned down in the streets of Brazil by a rival drug cartel."
543,54 comments,420,3 hours ago,r/ontario,Eastern Ontario poutine is my favourite!
544,36 comments,2.5k,14 hours ago,r/mildlyinfuriating,Waiting in a queue
545,36 comments,2.5k,14 hours ago,r/mildlyinfuriating,Waiting in a queue
546,46 comments,814,4 hours ago,r/books,Pro tip - If you got an ebook reader or tablet for Christmas join r/FreeEBOOKS and get a ton of free stuff. (also see my comment on this post for 2000+ free ebooks)
547,49 comments,1.6k,8 hours ago,r/chess,I won my city's Chess Championship! Proud of this and thought I'd share.
548,66 comments,448,4 hours ago,r/tylerthecreator,W Christmas gift
549,12 comments,Vote,2 hours ago,r/OTMemes,Maybe he took Jesus for Obi-Wan erroneously
550,35 comments,2.5k,8 hours ago,r/Komi_san,"Both are very important, but…"
551,39 comments,1.1k,7 hours ago,r/panelshow,Bill Bailey with a touching tweet about his old Pal Sean Lock
552,25 comments,2.4k,8 hours ago,r/ApexOutlands,The skies belong to meme
553,65 comments,1.8k,7 hours ago,r/LiverpoolFC,Klopp appreciating Nat and Rhys and team for last season.
554,48 comments,1.5k,9 hours ago,r/cyberpunkgame,I got the tarot cards from the game (multiple pics)
555,26 comments,1.3k,23 hours ago,r/blursedimages,Blursed Phone
556,26 comments,1.3k,23 hours ago,r/blursedimages,Blursed Phone
557,12 comments,1.3k,5 hours ago,r/lostredditors,In a server which is opposite to P2W Minecraft servers.
558,29 comments,3.7k,10 hours ago,r/Minecraftbuilds,Christmas Gift Tutorial
559,65 comments,623,6 hours ago,r/RATS,"My sweet Karev had to be put down on Thursday, please call him a handsome boy"
560,18 comments,891,2 hours ago,r/Terraria,A fallen star landed on my christmas tree
561,54 comments,1.4k,6 hours ago,r/lotr,"Got this bad boy for Christmas, time to start the Christmas tradition - this time in glorious 4k"
562,40 comments,1.2k,7 hours ago,r/lgbtmemes,No problem with it
563,155 comments,11.7k,13 hours ago,r/formula1,A legendary photo of Kimi from his rally days (2010)
564,54 comments,817,5 hours ago,r/shittyfoodporn,My Christmas dinner! Good bread good meat. Good god let’s eat!
565,52 comments,477,4 hours ago,r/forsen,MERRY CHRISTMAS BAJS !!
566,53 comments,7.8k,14 hours ago,r/photoshopbattles,PsBattle: This stubborn angy kitten
567,64 comments,1.5k,8 hours ago,r/intermittentfasting,after dealing with androgenetic alopecia and feeling so insecure about my hair for the last 6+ years i’ve finally found the courage to just cut it all off and honestly this is the best i’ve felt in YEARS!! 328 vs 198
568,51 comments,1.2k,9 hours ago,r/Chihuahua,I received a new chihuahua storage garment
569,23 comments,1.7k,4 hours ago,r/AnimalsBeingDerps,Merry derpmas from my dog to yours
570,13 comments,1.1k,4 hours ago,r/evilbuildings,Add some red lighting and BOOM- evil gingerbread house
571,37 comments,700,6 hours ago,r/videos,"the biggest space telescope ever built has just launched, promising a new era of exploration"
572,29 comments,1.3k,5 hours ago,r/toptalent,dP Art Drawing use compass to draw many drawings on one sheet of paper.
573,56 comments,2.5k,6 hours ago,r/Superstonk,We Are So Close Now... Evergrande Defaults... AGAIN!
574,22 comments,1.1k,5 hours ago,r/antifastonetoss,Wholesome Xmas Edit
575,38 comments,681,5 hours ago,r/trans,GUYS I DID IT
576,44 comments,4.7k,14 hours ago,r/MostBeautiful,"Snow covered Commonwealth Avenue through the Back Bay neighborhood of Boston, Massachusetts."
577,29 comments,Vote,1 hour ago,r/agedlikemilk,And the servers are down...
578,49 comments,5.6k,5 hours ago,r/memes,real heroes
579,34 comments,1.1k,4 hours ago,r/standupshots,Merry Christmas
580,26 comments,1.1k,8 hours ago,r/ParadoxExtra,What 2000 hours in EU4 does to a MF
581,25 comments,1.1k,9 hours ago,r/SkyrimMemes,Man my soul gonna be ripped into pices after my death... (Original content meme)
582,27 comments,1.1k,8 hours ago,r/badUIbattles,[CONCEPT] When a captcha is designed especially for robots: Introducing notACaptcha!
583,25 comments,3.5k,10 hours ago,r/dogelore,le ratio has not arrived
584,72 comments,1.3k,3 hours ago,r/Whatcouldgowrong,WCGW fender bumping a subcompact with an SUV
585,36 comments,8.1k,10 hours ago,r/wholesomememes,"Christmas will never be the same without you, grandma"
586,19 comments,1.6k,6 hours ago,r/NonPoliticalTwitter,Burgers don't grow on trees
587,43 comments,1.5k,8 hours ago,r/dankruto,Ouch!
588,33 comments,2.2k,9 hours ago,r/tumblr,you guys I— (I hope this is not a repost)
589,32 comments,Vote,2 hours ago,r/CapitolConsequences,January 6 traitors spending Christmas in solitary confinement
590,21 comments,1.0k,4 hours ago,r/BisexualTeens,"Ah yes, German"
591,46 comments,Vote,2 hours ago,r/blackcats,I swear he’s not a stuffed animal. I’m at least 90% sure?
592,49 comments,2.4k,9 hours ago,r/bi_irl,bi_irl
593,26 comments,864,3 hours ago,r/WarshipPorn,"Last year’s gingerbread “house”. USS Nevada (BB-36), 1945 configuration [OC] [Album]"
594,40 comments,3.8k,12 hours ago,r/Chonkers,My cat hatching his present
595,23 comments,3.0k,9 hours ago,r/Animemes,Literally me in quarantine
596,49 comments,989,8 hours ago,r/CICO,after dealing with androgenetic alopecia and feeling so insecure about my hair for the last 6+ years i’ve finally found the courage to just cut it all off and honestly this is the best i’ve felt in YEARS!! 328 vs 198
597,41 comments,1.2k,6 hours ago,r/Warframe,"after *much* procrastination, my custom warframe card deck is finally complete"
598,29 comments,364,2 hours ago,r/boxoffice,Spider-Man: No Way Home becomes the biggest movie of the year globally
599,26 comments,1.4k,19 hours ago,r/technicallythetruth,The Citroen 2CV Advert
600,26 comments,1.4k,19 hours ago,r/technicallythetruth,The Citroen 2CV Advert
601,47 comments,5.3k,13 hours ago,r/NintendoSwitch,"Christmas present that my wife painted for me, she’s the best. SILKSONG HYPE!"
602,44 comments,3.1k,9 hours ago,r/hmm,Hmmm
603,15 comments,1.5k,6 hours ago,r/meirl,meirl
604,38 comments,1.0k,5 hours ago,r/MonsterHunterWorld,A meme we all feel
605,22 comments,2.9k,9 hours ago,r/Cursed_Images,Cursed_wishing
606,15 comments,1.2k,5 hours ago,r/AbandonedPorn,Abandoned 18th-century neoclassical-styled palace [OC]
607,38 comments,1.6k,7 hours ago,r/EarthPorn,"This is probably the coldest looking photo I've taken. Pedersöre, Finland [OC][3162x4758]"
608,19 comments,916,4 hours ago,r/thanosdidnothingwrong,"""Reality can be whatever I want"""
609,40 comments,655,5 hours ago,r/wow,I have been asking for a forstmorne ever since I have gotten into the lore of wow. I am so excited!
610,42 comments,1.1k,6 hours ago,r/HalfLife,Am I part of the science team now?
611,38 comments,1.5k,8 hours ago,r/Undertale,"Different stages of ""Drunk"""
612,16 comments,1.1k,2 months ago,r/stateball,Inter-species Intelligence Overlap
613,16 comments,1.1k,2 months ago,r/stateball,Inter-species Intelligence Overlap
614,25 comments,1.5k,4 hours ago,r/rareinsults,Could reflect lasers with that head
615,6 comments,946,4 hours ago,r/animalsdoingstuff,A big smile from the big guy
616,5 comments,1.3k,1 day ago,r/aww,A doggo’s love for her puppers
617,5 comments,1.3k,1 day ago,r/aww,A doggo’s love for her puppers
618,31 comments,523,4 hours ago,r/Turkey,Keşke muzların kendiliğinden büyüyen ve biyolojik olarak parçalanabilen bir çeşit kabuğu olsaydı. Belki daha az plastik harcardık.
619,37 comments,960,4 hours ago,r/adhdmeme,the empty mug party must end some day
620,29 comments,723,6 hours ago,r/evangelionmemes,Probably canon
621,33 comments,619,5 hours ago,r/airsoft,Peak at my new smart sight (for a customers LMG) with variable backloght
622,47 comments,505,4 hours ago,r/ak47,"Last reload of 2021, happy holidays everyone 💥"
623,35 comments,5.6k,14 hours ago,r/criticalblunder,Calculated
624,35 comments,5.6k,14 hours ago,r/criticalblunder,That Is Not Right!
625,39 comments,2.9k,10 hours ago,r/ComedyCemetery,this is the most middle aged father joke i have ever seen
626,7 comments,1.6k,7 hours ago,r/PandR,"Merry Christmas, Pawneeans!"
627,31 comments,2.0k,10 hours ago,r/arknights,Christmas with the Abyssal Hunters
628,665 comments,38.8k,15 hours ago,r/worldnews,"With tourism suffering, sea turtles are thriving in peace in Phuket"
629,38 comments,1.3k,6 hours ago,r/funnyvideos,Spider sense
630,38 comments,928,8 hours ago,r/memesITA,buon natale gente del sub
631,23 comments,1.6k,7 hours ago,r/Zoomies,First time at the park in the snow after adoption zoomies I can’t stand it
632,26 comments,1.8k,8 hours ago,r/tech,Amazon warehouse workers on Staten Island refile union petition
633,31 comments,1.0k,8 hours ago,r/travel,"Picture I took last year in Nong Khiaw, Northern Laos"
634,23 comments,405,3 hours ago,r/TrueSTL,the direnni tower
635,24 comments,980,5 hours ago,r/DemocraticSocialism,The workers won. Kellogg's folded. This is a great day for US labor rights.
636,330 comments,5.1k,8 hours ago,r/facepalm,I give thee MURICA!!
637,23 comments,1.9k,8 hours ago,r/HollowKnightMemes,The answer is that bugs don't celebrate Christmas
638,36 comments,2.7k,11 hours ago,r/TrashTaste,You’ve met Black Goku. Have you met White Buzz?
639,82 comments,2.5k,7 hours ago,r/KidsAreFuckingStupid,Anyone else's kids like this on Christmas morning? Just mine then...
640,237 comments,8.1k,10 hours ago,r/cats,"They've all claimed their territory, but where do I sleep?"
641,32 comments,406,3 hours ago,r/Patriots,The guy in the red sleeves! Merry Christmas Patriot nation!
642,32 comments,1.1k,4 hours ago,r/Terraria,Yaay!! Finally got the game
643,26 comments,1.4k,6 hours ago,r/BobsBurgers,__Positive Reinforcement
644,36 comments,1.9k,10 hours ago,r/brooklynninenine,Best Christmas present ever! It’s heist time!!
645,9 comments,1.3k,6 hours ago,r/HollowKnight,[lifori] Merry Christmas
646,23 comments,764,5 hours ago,r/PokemonSwordAndShield,COSMIC POWER
647,30 comments,2.4k,7 hours ago,r/ProgrammerHumor,body { background-color: teal; }
648,22 comments,1.1k,7 hours ago,r/thesims,Did The Baby Chicks Always Look Like This?!😂😂
649,14 comments,1.4k,15 hours ago,r/MapPorn,Outjerked once again
650,14 comments,1.4k,15 hours ago,r/MapPorn,Exaggerated Population Density Map Of Nigeria
651,81 comments,1.6k,5 hours ago,r/PoliticalHumor,Candace Owns just said Trump believes in vaccines because he watches too much mainstream media and not enough internet news.
652,31 comments,463,3 hours ago,r/CallOfDuty,[MW2] REMINDER: if you are hyped for MW2 2022 then you got to realise that you are going to see this:
653,21 comments,562,4 hours ago,r/masseffect,My wife knows little about Metroid. She bought me this calendar because it’s the only Metroid calendar she could find on Amazon. Flipping through it and found this. Lol I’d ship it
654,16 comments,873,6 hours ago,r/MarchAgainstNazis,They’ve really got stumped haven’t they
655,174 comments,1.0k,3 hours ago,r/nba,"[AlBaroudi] Gilbert Arenas spent his entire rookie salary ($845,000) before the draft, leaving him with a $500 weekly budget for the entire 2001-02 season. Arenas' financial situation became so dire he had to sleep at the Warriors' arena because he couldn't afford the gas to drive back-and-forth."
656,19 comments,722,3 hours ago,r/pitbulls,Merry Christmas from a very happy Leyla Luna to you and yours!
657,128 comments,2.0k,4 hours ago,r/antiwork,"Saw this on Twitter, Merry Christmas r/AntiWork"
658,7 comments,753,3 hours ago,r/MemePiece,Ohhh.
659,11 comments,1.1k,5 hours ago,r/dogswithjobs,A very merry Christmas from Pickle!
660,17 comments,1.4k,6 hours ago,r/CrappyDesign,Merry Asstmchri! Repost of pic I took in Budapest 4 years ago.
661,33 comments,864,4 hours ago,r/Rainbow6,My girlfriend got me this. I fucking love this girl so much
662,29 comments,510,4 hours ago,r/BeamNG,This community is great
663,29 comments,562,3 hours ago,r/DeepRockGalactic,My sister got me a wonderful gift… this mug and a promise to buy the game and play with me.
664,16 comments,862,4 hours ago,r/boneachingjuice,Average troposhere fan vs average stratosphere enjoyer
665,24 comments,1.7k,8 hours ago,r/HollowKnightMemes,Ascend! Ascend! Ascend ascend ascend with Gorb!
666,30 comments,914,8 hours ago,r/StardustCrusaders,I got this for Christmas
667,4 comments,803,3 hours ago,r/TikTokCringe,The pawphecy has been fulfilled
668,20 comments,1.8k,6 hours ago,r/lotrmemes,Life in the shire afterwards
669,19 comments,605,4 hours ago,r/KingOfTheHill,"“I don’t think I can ever go back to cocoa!” Merry Christmas, you crazy bastards!"
670,26 comments,990,5 hours ago,r/physicsmemes,It's a Christmas miracle
671,12 comments,1.0k,7 hours ago,r/thomastheplankengine,curated tumblr
672,27 comments,1.5k,7 hours ago,r/itookapicture,ITAP of a sauna
673,24 comments,1.4k,8 hours ago,r/IndianGaming,Laughing on 100°C.
674,24 comments,432,2 hours ago,r/forwardsfromgrandma,"Thanks, Neil. Very cool!"
675,24 comments,Vote,11 hours ago,r/yesyesyesyesno,Self-evident
676,24 comments,Vote,11 hours ago,r/yesyesyesyesno,Teach this guy how to fill the gas …
677,17 comments,2.6k,10 hours ago,r/Konosuba,Surprise gift from Darkness
678,17 comments,1.7k,8 hours ago,r/Helltaker,Baphomet & Krampus
679,16 comments,1.3k,7 hours ago,r/vexillologycirclejerk,Flag of Belgium but i made it reeeaaaally scary
680,26 comments,538,5 hours ago,r/subnautica,[No spoilers] Hey everyone ;) My first Snow Stalker plush I've made recently💙
681,24 comments,598,4 hours ago,r/reddeadredemption,YOU ARE NOT SENDING ME TO THE COOLER
682,27 comments,343,2 hours ago,r/TenseiSlime,Rimuru is in trouble
683,142 comments,5.3k,13 hours ago,r/WinStupidPrizes,"If you throw boiling water into cold air, it turns into steam."
684,304 comments,Vote,2 hours ago,r/HermanCainAward,Woke up to some unsurprising news about a former coworker.
685,27 comments,2.9k,14 hours ago,r/Perfectfit,"Shot from highway, mountains line up perfectly with billboard."
686,27 comments,731,4 hours ago,r/Helltaker,Merry christmas helltaker
687,21 comments,844,7 hours ago,r/Witcher3,The ladies of Witcher wish you a merry Christmas
688,24 comments,3.9k,14 hours ago,r/thisismylifenow,Look at this happy potato!
689,25 comments,791,6 hours ago,r/fnv,Runnin low on smokes again
690,26 comments,10.8k,17 hours ago,r/FuckYouKaren,Even the street signs are tired of it
691,27 comments,597,5 hours ago,r/walkaway,Is Lori Lightfoot the spawn of Beetlejuice and ET?
692,23 comments,840,5 hours ago,r/GME,MERRY STONKMAS ALL YOU APETTES AND APES. DFVs tweet from last year 😘
693,31 comments,1.0k,5 hours ago,r/Undertale,Pretty good Christmas if I do say so myself
694,24 comments,1.1k,7 hours ago,r/Eldenring,Day to night transition in Elden Ring
695,21 comments,2.8k,4 hours ago,r/aww,Cat wears a little coat while being amazed by snow
696,25 comments,729,3 hours ago,r/me_irlgbt,me_irlgbt
697,20 comments,556,3 hours ago,r/nostalgia,My daughter. Playing with her new Tamagotchi.
698,22 comments,1.7k,10 hours ago,r/netflixwitcher,"Merry Witchmas! Um... Christmas, I mean!"
699,23 comments,564,5 hours ago,r/xbox,Dinner with the Master Chief.
700,20 comments,918,7 hours ago,r/DarkViperAU,I still love this clip so much
701,10 comments,2.1k,9 hours ago,r/PeopleFuckingDying,"mAn SucCuMBs INsTaNtLy tO DiM mAk (""tOUcH Of dEatH"") tEChNiqUe!"
702,24 comments,714,6 hours ago,r/AnimeART,Do you wear glasses? 👓🥰
703,21 comments,501,3 hours ago,r/Badfaketexts,Mama Mia
704,17 comments,772,5 hours ago,r/discordapp,WHAT IS THIS SUPPOSED TO MEANNNNN
705,21 comments,407,3 hours ago,r/NotMyJob,Stitched the design on boss!
706,17 comments,844,7 hours ago,r/DestinyMemes,Incredible accuracy
707,17 comments,3.0k,11 hours ago,r/AnimalsBeingBros,When they don’t think we’re watching…. We’re recording 🤫
708,18 comments,1.1k,8 hours ago,r/Sidemen,Congrats everyone
709,19 comments,773,7 hours ago,r/steinsgate,Merry Kurisu-mas! (cosplay by me)
710,20 comments,873,5 hours ago,r/analog,"Merry Christmas, y’all. Stay safe! [Fujifilm GA645Zi • Ektar 100]"
711,131 comments,1.2k,4 hours ago,r/Tinder,This gem on Christmas day!
712,20 comments,500,4 hours ago,r/Ningen,Veget
713,18 comments,1.0k,6 hours ago,r/simpsonsshitposting,Mr. Anderson.
714,26 comments,1.7k,6 hours ago,r/pokemon,Wtf ditto
715,19 comments,703,4 hours ago,r/danganronpa,I’m Not Wrong
716,416 comments,1.7k,5 hours ago,r/teenagers,Why can’t god just give me a cute boy to simp over 😔😔
717,195 comments,1.5k,5 hours ago,r/atheism,"Thanks to the head of NASA for a national embarrassment just now, following the launch of the James Webb Space Telescope."
718,18 comments,983,5 hours ago,r/TheMandalorianTV,Me after a week of prep for Spider-Man: No Way Home followed by a week of prep for The Matrix Resurrections and now The Book of Boba Fett is next week
719,18 comments,906,6 hours ago,r/IASIP,Me heading into Jan 2022
720,148 comments,1.0k,3 hours ago,r/marvelstudios,Can we agree that NWH is a series of terrible decisions by Peter Parker?
721,17 comments,1.1k,8 hours ago,r/Apandah,Apandah Ankha dance
722,156 comments,915,5 hours ago,r/SaimanSays,I prefer center fresh
723,18 comments,561,2 hours ago,r/Physics,After so many years waiting
724,17 comments,680,6 hours ago,r/AmongUs,"the saddest feeling in the world is forgetting to exchange socials with ur amongus buddy of the night……… bunny, if youre out there, id do anything for u…….. i miss u already……….."
725,6 comments,1.0k,5 hours ago,r/pyrocynical,VERY SPOOKY 👻👻👻
726,16 comments,416,2 hours ago,r/borderlands3,Christmas Present From My Sister (BL2 Unkempt Harold)
727,16 comments,648,5 hours ago,r/DankMemesFromSite19,No way he is a chid of the Scarlet King.
728,17 comments,1.3k,7 hours ago,r/dontdeadopeninside,MRYER XMS(lion)A
729,17 comments,578,5 hours ago,r/birding,This little guy is the reason I have been taking long walks to the park every single day :-)
730,33 comments,3.7k,12 hours ago,r/skyrim,Best sport in Skyrim
731,18 comments,770,5 hours ago,r/terriblefacebookmemes,help him
732,17 comments,476,4 hours ago,r/SuccessionTV,Christmas present from my brother
733,18 comments,1.1k,9 hours ago,r/Re_Zero,"[Media] Echidna offered a unique kind of snow globe,it contains the witch of greed herself!"
734,16 comments,786,5 hours ago,r/Berserk,Merry Christmas strugglers
735,17 comments,612,6 hours ago,r/OldManDog,First Christmas in 16 years without my beloved old Frank
736,15 comments,703,6 hours ago,r/PrincessesOfPower,"Can confirm, am skinny guy"
737,12 comments,614,2 hours ago,r/Embroidery,I made this for Christmas
738,15 comments,4.6k,10 hours ago,r/PrequelMemes,Somethings happening. I'm not the Santa I should be.
739,16 comments,1.4k,17 hours ago,r/FTMfemininity,We All Want To Be Respected: Then Why Judge The Freedom Of Others?
740,16 comments,1.4k,17 hours ago,r/FTMfemininity,Why can’t we all just support each other? Merry Christmas btw ❤️
741,17 comments,585,5 hours ago,r/MildlyVandalised,bought a used washing machine. Hoping i dont get left with soggy bottoms
742,61 comments,3.9k,8 hours ago,r/greentext,Anon enjoys the christmas spirit
743,13 comments,1.3k,7 hours ago,r/CatsAreAssholes,We almost made it to Christmas without a tree incident….
744,76 comments,4.9k,9 hours ago,r/Unexpected,Most wholesome video I've seen in a long time
745,16 comments,895,5 hours ago,r/Memes_Of_The_Dank,How you doin'
746,19 comments,2.9k,4 hours ago,r/dankmemes,Hail Satan
747,16 comments,366,3 hours ago,r/curb,"From my family to yours, Merry Christmas"
748,9 comments,916,5 hours ago,r/PetTheDamnDog,"Seeing my mum's dog for Christmas after 6 months, lots of cuddles after this."
749,16 comments,710,6 hours ago,r/startrekmemes,__Friend of mine shared this in a group text today
750,14 comments,594,5 hours ago,r/Dinosaurs,>:(
751,29 comments,2.1k,7 hours ago,r/blursed_videos,blursed_tom
752,16 comments,685,5 hours ago,r/cremposting,For MY BoON
753,15 comments,1.0k,8 hours ago,r/wholesome,A very good boy
754,15 comments,1.5k,1 day ago,r/MadeMeSmile,Moms are the best
755,15 comments,1.5k,1 day ago,r/MadeMeSmile,Moms are the best
756,15 comments,644,6 hours ago,r/noita,My dad and I have both been playing this game a lot so for Christmas I drew him some fanart as a gift!
757,15 comments,576,5 hours ago,r/mathmemes,The worst sin
758,15 comments,2.6k,12 hours ago,r/dontputyourdickinthat,Worth a try
759,14 comments,560,3 hours ago,r/OnePunchMan,"""Big K"" - King's new fragrance, for men 👑"
760,14 comments,407,3 hours ago,r/Outdoors,The snow storm last week in Colorado. It was quite magical
761,81 comments,2.3k,8 hours ago,r/MurderedByWords,Meghan McCain tells Candace Owens to f*ck off.
762,13 comments,996,7 hours ago,r/Technoblade,"He is the best person ever, he's happy even in those hard times, but as they say ""NOT EVEN CLOSE BABY! TECHNOBLADE NEVER DIES!!!!"""
763,13 comments,607,5 hours ago,r/SpaceXMasterrace,"Hell yeah! Merry Christmas everybody, and congrats to everybody involved so far!"
