,comment_count,upvote_delta,timeup_list,subreddit,thread_text
487,66 comments,5.7k,17 hours ago,r/OldPhotosInRealLife,Unknowingly captured the same image in 2020 that my dad took on vacation back in 1965 - Shenandoah NP
488,216 comments,5.1k,9 hours ago,r/PublicFreakout,That's some National Geographc S*%t
489,40 comments,566,6 hours ago,r/NobodyAsked,Just...why?
490,72 comments,1.1k,21 hours ago,r/interestingasfuck,We dead.
491,72 comments,1.1k,21 hours ago,r/interestingasfuck,Demonstrating how fast a drone can be
492,23 comments,899,7 hours ago,r/hoi4,Is This Rare ?
493,79 comments,1.3k,4 hours ago,r/gadgets,A 62-Year-Old Paralyzed Man Sent Out His First Tweet With Brain Chip | Without the need for keystrokes.
494,15 comments,1.3k,4 hours ago,r/WitchesVsPatriarchy,May your soul be overgrown with moss 🌿
495,55 comments,946,5 hours ago,r/LiverpoolFC,"[Liverpool FC] Thiago Alcantara, Fabinho, Curtis Jones and Virgil van Dijk are set to be available for our clash with Leicester."
496,87 comments,2.0k,9 hours ago,r/PhoenixSC,After seeing the monster school video screenshot on the last video of PhoenixSC that reminded me. What happened to the original monster school ???!
497,54 comments,5.1k,15 hours ago,r/OneSecondBeforeDisast,Hiding from the cat
498,42 comments,916,6 hours ago,r/BritishSuccess,Neighbours got the Christmas they deserved!
499,67 comments,1.1k,6 hours ago,r/brasil,Como burlar a lei bíblica
500,15 comments,1.2k,2 hours ago,r/AdviceAnimals,Every single year.
501,48 comments,632,5 hours ago,r/OMORI,"I just had an AU idea where Sunny suddenly starts speaking spanish after 'that' night, so i had to poorly draw it. (Also hi im new to the subreddit!)"
502,29 comments,2.5k,6 hours ago,r/tumblr,Pet names
503,30 comments,1.3k,4 hours ago,r/lego,10030 in black
504,51 comments,747,6 hours ago,r/CitiesSkylines,"NIMBY, or YIMBY? The Argument Between Railfans and Housewives Begins..."
505,57 comments,1.9k,10 hours ago,r/Cursed_Images,Cursed mod
506,67 comments,376,3 hours ago,r/nvidia,Nvidia GPU's Relative Performance Comparison Chart (last few generations) (credits to u/soomrevised)
507,23 comments,1.6k,10 hours ago,r/fixedbytheduet,The council has spoken
508,27 comments,790,7 hours ago,r/AskHistorians,"How did Spain manage to go from being the richest state in Europe during the first half of the XVI century to declaring bankruptcy multiple times in 1557, 1560, 1576, 1590 ?"
509,31 comments,1.2k,6 hours ago,r/freefolk,Will it ever end ?
510,17 comments,1.3k,1 year ago,r/trashy,"Honestly, fuck Nestle"
511,17 comments,1.3k,1 year ago,r/trashy,"Honestly, fuck Nestle"
512,29 comments,2.3k,7 hours ago,r/ComedyNecrophilia,big balls 4K hd😍😍😍😍
513,56 comments,785,4 hours ago,r/lgbtmemes,I'm waiting for Italy
514,1.5k comments,9.8k,9 hours ago,r/antiwork,To all the anti-antiwork redditors:
515,67 comments,2.4k,8 hours ago,r/Undertale,gotta love steam (meme flair for no other reason)
516,38 comments,837,3 hours ago,r/kpop,"GOT the beat (GOT: Girls On Top) - Individual Teaser Images (BoA, Girls' Generation / SNSD Taeyeon, Red Velvet Seulgi, aespa Winter)"
517,31 comments,1.4k,10 hours ago,r/FragileWhiteRedditor,FWR makes abhorrent comment on post about 13yo black kid accidentally kills himself with a gun.
518,135 comments,3.1k,12 hours ago,r/PetTheDamnDog,"Her name was Claire, she was very cuddly and loved attention. She died in June, please press F."
519,1.5k comments,16.3k,11 hours ago,r/facepalm,Falsely accused a guy of sexual harassment
520,62 comments,840,7 hours ago,r/IndiaSpeaks,School-going girls thrashed by Congress workers for raising pro-Modi slogans at Priyanka Vadra rally. What a model of women empowerment!
521,28 comments,1.5k,5 hours ago,r/cyberpunkgame,CyberCiri cosplay by me
522,48 comments,748,5 hours ago,r/dashcamgifs,Stay in your car and it won't be a mess.
523,24 comments,2.1k,8 hours ago,r/ik_ihe,ik_ihe
524,19 comments,Vote,2 hours ago,r/wholesomememes,Good friends are gold.
525,39 comments,1.2k,7 hours ago,r/physicsmemes,What could go wrong? (source in the comments)
526,75 comments,3.7k,13 hours ago,r/notinteresting,I found out something about worms
527,234 comments,2.4k,5 hours ago,r/mildlyinfuriating,"My wife went to a party last night with her friend, the designated driver that lives round the corner. When the friend said it was time to leave (at the agreed leaving time) my wife said that she was going to stay 10 more minutes so to go without her. It was a 2 hour round trip to fetch her at 1am."
528,63 comments,825,6 hours ago,r/Chihuahua,"Yuppy would like some sympathy because his mother won’t give him any. He snuck upstairs and ate more than a bowlful of cat food as fast as he possibly could and is now a tiny bit too full. Also, one naughty Yuppy to a good home."
529,9 comments,1.7k,6 hours ago,r/vexillologycirclejerk,"Rejected flag of the EU, but its my friends broken webcam"
530,9 comments,1.0k,3 hours ago,r/AteTheOnion,Go blow your noodle
531,36 comments,2.8k,13 hours ago,r/youngpeopleyoutube,NOOOOOOOOOOOO!
532,42 comments,805,1 day ago,r/GreenAndPleasant,Love to have a free press
533,42 comments,805,1 day ago,r/GreenAndPleasant,Love to have a free press
534,66 comments,Vote,1 hour ago,r/PS5,God of War Ragnarök has a (placeholder) date of September 30th 2022 in the PlayStation database
535,9 comments,1.2k,4 hours ago,r/zelda,[SS] Zelda (art by mmimmzel)
536,44 comments,2.4k,13 hours ago,r/babyelephantgifs,A baby elephant having a serious battle with its adorably small trunk
537,48 comments,4.8k,7 hours ago,r/aww,She is so pure!!
538,75 comments,1.1k,5 hours ago,r/Watches,[Vacheron Constantin] Overseas Dual Time Everest Edition
539,94 comments,563,5 hours ago,r/selfie,Happy Monday ☺️ Back to work for me today!
540,20 comments,1.1k,4 hours ago,r/futurama,"After the death of my best friend, this line was very comforting to me"
541,38 comments,1.1k,7 hours ago,r/environment,A Plant That Sterilizes Medical Equipment Spews Cancer-Causing Pollution on Tens of Thousands of Schoolchildren
542,15 comments,1.7k,6 hours ago,r/BoJackHorseman,For all yous out there pining for Andrew Garfield
543,44 comments,594,5 hours ago,r/Anticonsumption,Did they really thought we will pay for all of this
544,44 comments,1.3k,5 hours ago,r/HollowKnight,Like that's ever gonna happen!
545,72 comments,708,3 hours ago,r/weed,"Be like bob, don't be cringe."
546,53 comments,1.9k,7 hours ago,r/skyrim,The Elder Scrolls V: Skyrim
547,52 comments,1.1k,7 hours ago,r/NoMansSkyTheGame,tf was that soun— WHAT THE FU-
548,71 comments,910,6 hours ago,r/london,"I took a picture of Canary Wharf from Harrow, 15 miles across London."
549,78 comments,4.8k,11 hours ago,r/europe,The inside of Prague Astronomical Clock.
550,34 comments,726,4 hours ago,r/theydidthemath,[Request] Is it possible that the toy climbs the building on 2AA batteries? How high would it climb?
551,70 comments,715,7 hours ago,r/labrats,Italian lab drinking prosecco in 50ml Falcon because we ran out of plastic cups HAPPY HOLIDAYS!
552,60 comments,3.5k,13 hours ago,r/LiminalSpace,2:32 am
553,16 comments,3.0k,4 hours ago,r/memes,What have we got here?
554,44 comments,1.0k,4 hours ago,r/Technoblade,look who is on first
555,31 comments,614,4 hours ago,r/WetlanderHumor,The Ever Victorious Army
556,42 comments,441,4 hours ago,r/GreenBayPackers,Mmmmhmmm. A nice retort.
557,78 comments,2.4k,1 day ago,r/BeAmazed,Would you like to bathe in the wind whilst people eat below you?
558,78 comments,2.4k,1 day ago,r/BeAmazed,A unique bathtub that extends outside to a bath ramp
559,24 comments,2.1k,7 hours ago,r/Komi_san,The live wallpaper I animated ~ Original Artist:QOME
560,48 comments,1.6k,6 hours ago,r/Berserk,"i made this for my boyfriend, i hope he likes it"
561,30 comments,882,6 hours ago,r/chelseafc,Cesc don't stand for no non sense
562,15 comments,1.6k,6 hours ago,r/AnarchyChess,"Guys, I figured out how En Passant works"
563,85 comments,465,4 hours ago,r/amihot,27F What do you think about me?🤔😻
564,62 comments,858,5 hours ago,r/woahdude,Crazy drone
565,81 comments,2.5k,2 hours ago,r/Damnthatsinteresting,A deep sea monster scene inside a block of epoxy
566,17 comments,1.1k,4 hours ago,r/Chadtopia,Chad finally gets the card he’s been grinding for his whole life
567,60 comments,371,3 hours ago,r/Warhammer,🤩🤩🤩
568,38 comments,833,7 hours ago,r/UrbanHell,Faux store fronts masking rising vacancy
569,39 comments,1.3k,7 hours ago,r/HumansAreMetal,"Nadya Tolokonnikowa riskiert ihr Leben, um gegen den Autoritarismus in Russland zu protestieren."
570,50 comments,353,2 hours ago,r/FreeGameFindings,[Epic Games] (Game) Mages of Mystralia
571,48 comments,1.1k,4 hours ago,r/IdiotsNearlyDying,Tourist is attacked by crocodile after ‘mistaking it for a plastic model and posing for selfie’ 💓😄
572,32 comments,1.5k,6 hours ago,r/ShingekiNoKyojin,Looks familiar
573,41 comments,2.3k,11 hours ago,r/Naturewasmetal,Some 1880s Victorian holiday cards.
574,63 comments,1.5k,6 hours ago,r/crappyoffbrands,"Did not know, Mario was vegan"
575,66 comments,841,3 hours ago,r/apexlegends,Craziest 1hp Ranked clutch EVER.
576,42 comments,458,3 hours ago,r/libertarianmeme,Glitch in the matrix
577,33 comments,1.0k,3 hours ago,r/OnePunchMan,only fax here
578,57 comments,1.0k,4 hours ago,r/Shitty_Car_Mods,"Fuck you, PT Cruiser Limo"
579,87 comments,1.5k,3 hours ago,r/OldSchoolCool,Bill Watterson of Calvin and Hobbes came-1986
580,6 comments,1.2k,4 hours ago,r/comedyhomicide,Hahaha very funny
581,12 comments,1.7k,3 hours ago,r/cursedcomments,Cursed_foreskin
582,46 comments,2.2k,5 hours ago,r/titanfall,Respawn tried but failed
583,33 comments,4.4k,9 hours ago,r/TheLastAirbender,paused at the wrong moment
584,47 comments,6.8k,18 hours ago,r/rickandmorty,Who can relate?
585,31 comments,536,4 hours ago,r/DuggarsSnark,Tomorrow will officially be...
586,15 comments,1.4k,6 hours ago,r/disneyvacation,How to dress your spouse for work so they can get a few extra minutes of sleep after a holiday weekend
587,62 comments,11.4k,15 hours ago,r/NatureIsFuckingLit,🔥 Let It Snow! 🔥
588,33 comments,485,4 hours ago,r/IndoorGarden,Happy Jade💕 I never knew they flowered until this baby bloomed! I’m so happy it’s so happy! Makes my day every time I pass her💖
589,13 comments,1.4k,6 hours ago,r/hellsomememes,#TeamCthulhu
590,45 comments,763,3 hours ago,r/HadToHurt,"Hey man, what's wrong with this laser?"
591,452 comments,975,3 hours ago,r/LivestreamFail,DJWheat on Streamers Reacting to Entire Movies and Shows on Stream
592,37 comments,1.6k,6 hours ago,r/FoodPorn,[OC] Lasagna I made for the holidays
593,56 comments,1.8k,5 hours ago,r/cats,"Mom told me to sit still, If I don't want to be a clown"
594,18 comments,4.0k,8 hours ago,r/technicallythetruth,Kicked Out Even After a Perfect Answer ...
595,30 comments,2.6k,8 hours ago,r/ksi,JJ's hamster in his ex's house
596,45 comments,1.7k,9 hours ago,r/PixelArt,Made my pixel art come to life. My first animated artwork.
597,36 comments,1.6k,7 hours ago,r/GTA,And the best boss award goes to...
598,25 comments,1.5k,3 hours ago,r/Genshin_Impact,I drew Keqing
599,358 comments,Vote,1 hour ago,r/MadeMeSmile,This would save millions of people around the world!
600,37 comments,1.2k,9 hours ago,r/Metroid,I felt so powerful just to die 10 seconds later
601,25 comments,1.9k,10 hours ago,r/civ,Yes I played this card. No the other cards weren’t better. Yes they knew the reference. No I did not win. Yes I cut all contact with them.
602,26 comments,735,5 hours ago,r/ZeroWaste,One of the (fairly popular) juice brands in Austria is now also selling juices in reusable glass bottles
603,28 comments,1.2k,9 hours ago,r/PropagandaPosters,"""Conquering Space!"" USSR, 1960"
604,448 comments,1.6k,4 hours ago,r/HermanCainAward,"🏆 Marine combat veteran, bodybuilder, young husband and father. Disinformation victim. 🏆"
605,57 comments,765,6 hours ago,r/Stellaris,Cryogenesis Unofficial Species Pack - Mod Release
606,47 comments,623,6 hours ago,r/SpaceXLounge,NSF Live catched a meteor!
607,28 comments,2.0k,7 hours ago,r/AnimalsBeingJerks,Give him a nice lil pet Mo
608,55 comments,1.0k,7 hours ago,r/DarkViperAU,Unsettled Matto
609,30 comments,2.4k,8 hours ago,r/confusing_perspective,It’s not her toes
610,30 comments,901,8 hours ago,r/Overwatch_Memes,Diff this diff that
611,53 comments,1.5k,3 hours ago,r/worldnews,Crisis response teams achieve 70% reduction in people taken into custody under Mental Health Act
612,44 comments,875,6 hours ago,r/Justrolledintotheshop,Guy says nail in his tire caused it to go flat
613,15 comments,988,3 hours ago,r/yesyesyesyesno,Don't you just love dogs?
614,130 comments,14.7k,13 hours ago,r/marvelmemes,My back Ah My back
615,103 comments,2.6k,4 hours ago,r/Superstonk,"Imagine tanking the price right after Christmas, when everybody had pocket money from grandma, float is about to get locked real quick, believe it or not, I'm hyped! LFG apes."
616,42 comments,3.0k,10 hours ago,r/im14andthisisdeep,Found this on a friend's story (he's around 50)
617,18 comments,2.6k,9 hours ago,r/starwarsmemes,The dark side of the force is a pathway to many abilities some consider to be unnatural...
618,42 comments,1.2k,9 hours ago,r/arknights,Sussurroverse
619,37 comments,Vote,2 hours ago,r/KimetsuNoYaiba,Uzui views on other hashira.
620,54 comments,Vote,1 hour ago,r/FullmetalAlchemist,Edward Elric has been eliminated! The winner of FMA: Elimination Game is ROY MUSTANG!!!
621,139 comments,2.6k,7 hours ago,r/CasualUK,My Taxi driver was having fun today...
622,45 comments,1.5k,10 hours ago,r/Brawlstars,Gru holding gun pin
623,42 comments,944,3 hours ago,r/notinteresting,Click here to add text
624,1 comment,1.0k,4 hours ago,r/AnimalTextGifs,Purrfection
625,51 comments,1.1k,4 hours ago,r/DeepRockGalactic,Met a dev earlier
626,36 comments,540,20 hours ago,r/GreenAndPleasant,Fox nonce
627,36 comments,540,20 hours ago,r/GreenAndPleasant,Fox nonce
628,43 comments,447,4 hours ago,r/camping,Winter Car Camp for Xmas weekend
629,30 comments,1.5k,6 hours ago,r/dontdeadopeninside,Me when when eating I'm happy: cheese:
630,33 comments,599,4 hours ago,r/whatsthisbug,"I have never seen a fluorescent bug, except fireflies, can someone identify this one?"
631,27 comments,1.4k,4 hours ago,r/MinecraftMemes,It do be like that
632,34 comments,772,4 hours ago,r/WorkersStrikeBack,Why is this an acceptable life?
633,49 comments,751,7 hours ago,r/painting,"Acrylic and pencil on paper ""Pigeons"""
634,28 comments,1.5k,6 hours ago,r/GamePhysics,[Cyberpunk 2077] When you want to go home.. But you're already there.
635,46 comments,3.8k,1 day ago,r/animalsdoingstuff,Never give up on your dreams.
636,46 comments,3.8k,1 day ago,r/animalsdoingstuff,Never give up on your dreams.
637,247 comments,2.2k,6 hours ago,r/teenagers,I love my crush
638,38 comments,1.1k,7 hours ago,r/popping,I don’t know if it’s just me...
639,42 comments,Vote,2 hours ago,r/TaylorSwift,I am feeling 22
640,32 comments,481,3 hours ago,r/functionalprint,Geared Hinge
641,44 comments,1.2k,5 hours ago,r/Dachshund,I made a wooden dachshund paper towel holder. Someone in r/woodworking mentioned I should post it here too :)
642,30 comments,1.0k,4 hours ago,r/drawing,I drew my friend strolling through a foggy night
643,855 comments,1.2k,6 hours ago,r/AskReddit,Kids today will never know how legendary Chuck Norris is … What are some facts that you know about Chuck Norris ?
644,9 comments,987,4 hours ago,r/me_irlgbt,me_irlgbt
645,26 comments,1.1k,5 hours ago,r/Awwducational,Donkeys can get quite excited when they are given new toys to play with.
646,26 comments,1.1k,5 hours ago,r/Awwducational,"While donkeys may have a notorious reputation for being stubborn, they are actually quite fearless dealing with predators as well as intelligent, playful and curious. When this donkey in Arkansas received presents a few days ago, his owner reported he ""always gets so excited when he gets a new one."""
647,35 comments,1.3k,9 hours ago,r/FellowKids,I’m the cafeteria
648,28 comments,1.6k,8 hours ago,r/animegifs,How to use a gun properly | Bing :
649,19 comments,1.1k,4 hours ago,r/photoshopbattles,PsBattle: Cat in his carrier
650,29 comments,1.9k,9 hours ago,r/thisismylifenow,I wonder what did he do to deserve it
651,28 comments,1.3k,7 hours ago,r/ForzaHorizon,when you cant paint the roll cage so tint the windows
652,40 comments,756,13 hours ago,r/pics,For those of you who don’t live in a snowy tundra
653,40 comments,756,13 hours ago,r/pics,For those of you who don’t live in a snowy tundra
654,7 comments,1.3k,6 hours ago,r/SpeedOfLobsters,Will Smith's musical career takes a strange turn
655,8 comments,948,3 months ago,r/AnimalsBeingDerps,"""Does not compute"""
656,8 comments,948,3 months ago,r/AnimalsBeingDerps,"""Does not compute"""
657,31 comments,421,4 hours ago,r/projectzomboid,"If you found these barrels, drop everything and grab this one. It can collect rainwater and store 800 units of water."
658,20 comments,1.2k,5 hours ago,r/subnautica,[NO SPOILERS] I enjoyed that reference.
659,39 comments,2.0k,9 hours ago,r/YUROP,nice.
660,35 comments,911,4 hours ago,r/attackontitan,AoT girls [art by しょぬ]
661,16 comments,1.8k,8 hours ago,r/BokuNoHeroAcademia,"[OC][Fanart] I colored my Deku art, hope you like it!"
662,20 comments,435,3 hours ago,r/fireemblem,Half the battle (Awkward Zombie_
663,18 comments,569,5 hours ago,r/mythologymemes,yes homo
664,36 comments,432,4 hours ago,r/5ToubunNoHanayome,New Merch Collaboration ft. The Driptuplets
665,12 comments,1.4k,6 hours ago,r/shittyrainbow6,Everybody has this Skin
666,93 comments,1.6k,5 hours ago,r/dataisbeautiful,[OC] My GF and I tracked the average effect of Video Games vs Average Heart Rate over the last 12 months
667,38 comments,772,3 hours ago,r/CozyPlaces,"pov: it’s snowing outside, your coffee is warm & you’re in for a day of games"
668,26 comments,674,5 hours ago,r/smashbros,New Smash Pic-of-the-Day! (12/27/2021) from @Sora_Sakurai
669,27 comments,964,7 hours ago,r/EnterTheGungeon,Sadge
670,34 comments,2.0k,11 hours ago,r/blursed_videos,Blursed_Imortality
671,162 comments,1.4k,4 hours ago,r/PoliticalHumor,Owning the libs by... owning your mom
672,32 comments,918,5 hours ago,r/battlestations,Orange is a nice color
673,26 comments,2.0k,3 hours ago,r/Hololive,Happy 2nd Anniversary Kaichou! o7
674,28 comments,570,5 hours ago,r/ConservativeMemes,What are y'all going to do once communism is achieved?
675,34 comments,996,5 hours ago,r/woodworking,My first shot at inlay work
676,36 comments,581,6 hours ago,r/Justfuckmyshitup,F I ? R C ?
677,18 comments,608,6 hours ago,r/WarshipPorn,A sad pic of HMS's Duke of York [1200x900]
678,37 comments,1.6k,6 hours ago,r/Konosuba,Wait a minute
679,76 comments,2.0k,6 hours ago,r/formula1,"Alain Prost, Gerhard Berger and Emerson Fittipaldi carrying Sennas coffin at his funeral"
680,33 comments,3.1k,10 hours ago,r/Minecraftbuilds,Thoughts on my recreation of the Nightingale portal!
681,29 comments,629,6 hours ago,r/Embroidery,Spent months recreating my boyfriend’s D&D map for him for Christmas! I’m still pretty amateur at embroidery but I’m super proud of how this turned out!
682,29 comments,536,5 hours ago,r/dune,I wanted to share with you this beautiful brazilian box of dune
683,32 comments,2.4k,13 hours ago,r/blender,"Dr. Strange style portal, Got a Greenscreen for Christmas, made this as a test"
684,33 comments,367,2 hours ago,r/PokemonUnite,A little something I made after scoring a last second goal
685,36 comments,892,6 hours ago,r/FortNiteBR,Run the Jules
686,33 comments,2.5k,1 day ago,r/perfectlycutscreams,My helicopter people need me (sorry if repost)
687,33 comments,2.5k,1 day ago,r/perfectlycutscreams,Trevor heads out on an imaginary helicopter
688,27 comments,731,3 hours ago,r/vaxxhappened,The Herman Cain Seal of Approval.
689,33 comments,1.2k,21 hours ago,r/pics,They knew that very well
690,33 comments,1.2k,21 hours ago,r/pics,Cheeky car show with the lads
691,102 comments,2.7k,7 hours ago,r/therewasanattempt,To redeem money from a gift
692,17 comments,1.3k,23 hours ago,r/thisismylifenow,Let me fix your hair for you
693,17 comments,1.3k,23 hours ago,r/thisismylifenow,Let me fix your hair for you
694,33 comments,685,4 hours ago,r/dankinindia,High effort hai bro
695,21 comments,445,3 hours ago,r/TVDetails,Emily in Paris (2020) Actor doesn't even try. Lmao
696,26 comments,3.6k,15 hours ago,r/TheBoys,I posted my Homelander art on Instagram and Toni Starr himself commented on it! What a cool thing for him to do.
697,24 comments,1.2k,6 hours ago,r/ontario,Good morning Ontario
698,30 comments,1.5k,11 hours ago,r/gifsthatendtoosoon,yumy
699,30 comments,893,7 hours ago,r/Apandah,"""hey dad how was wor..."""
700,27 comments,639,6 hours ago,r/WarplanePorn,F-16 Takeoff [Video]
701,25 comments,912,7 hours ago,r/yakuzagames,He’s left the yakuza life and is a normal citizen now I swear
702,26 comments,1.1k,9 hours ago,r/spacefrogs,Hmmm
703,26 comments,722,4 hours ago,r/wow,My new Succubus doesn't do any DPS. Just sings and talks to critters a lot.
704,23 comments,831,6 hours ago,r/whitepeoplegifs,Incredible skills on 2 wheels
705,83 comments,1.2k,3 hours ago,r/ThatsInsane,How much we accomplished in just 66 years
706,25 comments,1.6k,8 hours ago,r/hmm,Hmm
707,16 comments,3.0k,13 hours ago,r/KenM,Ken M loves a good Christmas dinner with his family
708,29 comments,1.2k,7 hours ago,r/interestingasfuck,Real-time geomorphology
709,29 comments,1.2k,7 hours ago,r/interestingasfuck,Real-time geomorphology
710,26 comments,643,5 hours ago,r/TheWayWeWere,"Young couple posing for a portrait, Pittsburgh, late 1930s (photographed by Charles ""Teenie"" Harris)"
711,41 comments,1.7k,3 hours ago,r/Unexpected,newton’s third law
712,24 comments,1.6k,10 hours ago,r/Augenbleiche,Hirsch schießt und TOOR TOOOR TOOOR TOOR!!
713,18 comments,557,4 hours ago,r/savedyouaclick,Is Mount Everest really the tallest mountain on Earth? | Yes if measuring height above global mean sea level. No if measuring from base to peak (Mauna Kea is taller; it's partially under water)
714,18 comments,1.8k,8 hours ago,r/velvethippos,Dog Day Monday - Blue
715,15 comments,767,4 hours ago,r/BobsBurgers,Tiny baby Louise in S6E9 “Sacred Couch” is the cutest frickin thing
716,24 comments,989,5 hours ago,r/DnD,[Art]Ice Harpy Boss
717,20 comments,634,4 hours ago,r/GMEJungle,Love the smell of short attacks in the morning. You can taste their fear 😎💎🙌🏾🚀🌕
718,17 comments,748,6 hours ago,r/babybigcatgifs,Sharing is caring!
719,17 comments,410,2 hours ago,r/Kaiserreich,So turns out there’s a Custom Tag for Bhutan if you conquer the Himalayas.
720,25 comments,669,6 hours ago,r/osugame,"Utami | Aether Realm - The Sun, The Moon, The Star [Mourning Those Things I've Long Left Behind] 99.35% FC #2 | 826pp | 83.14 UR"
721,24 comments,1.8k,9 hours ago,r/Persona5,Queen by Chanch
722,7 comments,1.0k,5 hours ago,r/CuratedTumblr,blunder years
723,24 comments,1.7k,8 hours ago,r/Deltarune,Day 4 of modifying Starwalker: Suswalker
724,22 comments,410,3 hours ago,r/HaloMemes,Fred-104.jpg
725,24 comments,1.1k,6 hours ago,r/minecraftseeds,enclosed warm ocean covered in coral reef just west of spawn! seed: -404108749251477019 JAVA 1.18.1
726,22 comments,2.2k,12 hours ago,r/PeopleFuckingDying,MoNsTeR pRePaRiNg CaT fOr HiS dInNeR!
727,13 comments,981,5 hours ago,r/suddenlybi,I’m a male
728,24 comments,418,4 hours ago,r/esist,Love this!
729,23 comments,1.1k,5 hours ago,r/terriblefacebookmemes,Bro-
730,23 comments,790,7 hours ago,r/FIFA,Keeper runs into post (awful challenge)
731,23 comments,964,6 hours ago,r/PerfectlyCutBooms,"""You don't have the ba-"""
732,23 comments,643,3 hours ago,r/awesome,I’ve bath
733,23 comments,603,2 hours ago,r/2007scape,Me OMW to complete Recruitment Drive
734,15 comments,351,3 hours ago,r/victoria2,this what peak VIC 2 looks like
735,20 comments,892,7 hours ago,r/GTAV,And the best boss award goes to...
736,15 comments,934,6 hours ago,r/AdviceAnimals,"As an unphotogenic person, every time my picture is taken:"
737,17 comments,1.5k,10 hours ago,r/gravityfalls,Shmebulock - Toothpaste 🪥🌈👀
738,17 comments,1.5k,10 hours ago,r/gravityfalls,Shmebulock - Toothpaste 🪥🌈👀
739,17 comments,2.7k,13 hours ago,r/puns,Mind. Blown
740,18 comments,2.0k,9 hours ago,r/jacksepticeye,Ironic.
741,18 comments,1.3k,9 hours ago,r/Naruto,Happy Belated Birthday to the person whose clones can use susanoo! (Dec 24th)
742,17 comments,888,4 hours ago,r/golf,What it feels like sometimes
743,19 comments,1.4k,9 hours ago,r/Chonkers,"help, my cat has a hungry fainting"
744,51 comments,1.3k,4 hours ago,r/DunderMifflin,Steve carrell on the set right after his final shot on the series.
745,77 comments,2.1k,4 hours ago,r/Minecraft,"I know it's probably blasphemy, but I made the French Taunting scene out of Minecraft. Curse me if you will, but at least my mother wasn't a hamster, nor did my father smell of elderberries.."
746,18 comments,670,7 hours ago,r/JDM,Classic jdm picture. No laptops yet.
747,20 comments,442,3 hours ago,r/MemeVideos,Touch some grass
748,8 comments,686,3 hours ago,r/Memes_Of_The_Dank,Bruhh.
749,16 comments,631,5 hours ago,r/ralsei,Smug Dance
750,15 comments,897,5 hours ago,r/CatsStandingUp,Cat.
751,35 comments,891,11 hours ago,r/animegifs,[REQUEST] How much force is needed to shoot that marker from your butt?
752,35 comments,891,11 hours ago,r/animegifs,Assaulted
753,170 comments,4.5k,7 hours ago,r/shitposting,Kevin
754,17 comments,1.1k,8 hours ago,r/okmatewanker,He can live with the Yanks for the rest of his life🤮🤢🤮
755,14 comments,783,4 hours ago,r/ShittyLifeProTips,"SLPT: Reduce your chance of getting covid by not showering before visiting friends and family, so that everyone will keep their distance from you"
756,72 comments,1.1k,6 hours ago,r/Warhammer40k,Finished the Howling Griffons fourth company!!
