,comment_count,upvote_delta,timeup_list,subreddit,thread_text
231,28 comments,2.6k,4 hours ago,r/rarepuppers,Pool pooch
232,78 comments,11.6k,10 hours ago,r/HydroHomies,make the conscious choice to hydrate
233,90 comments,3.2k,5 hours ago,r/oddlysatisfying,Sealcoating a driveway
234,282 comments,10.1k,16 hours ago,r/gadgets,The Kidney Project successfully tests a prototype bioartificial kidney
235,79 comments,3.0k,5 hours ago,r/specializedtools,Large wave flume at a wave research lab
236,41 comments,4.7k,7 hours ago,r/bonehurtingjuice,Occupational hazards
237,269 comments,1.4k,3 hours ago,r/Coronavirus,Fauci wants to “seriously” consider vaccine mandate for domestic flights
238,211 comments,1.6k,4 hours ago,r/askscience,How does NASA and other space agencies protect their spacecraft from being hacked and taken over by signals broadcast from hostile third parties?
239,142 comments,6.9k,7 hours ago,r/Damnthatsinteresting,A water damaged copy of “Alice in Wonderland” which grew fungi.
240,310 comments,44.9k,17 hours ago,r/Eyebleach,TRIFORCE ACTIVATE
241,131 comments,1.9k,3 hours ago,r/arcane,"[no spoilers] I mean, seriously, what the hell?"
242,263 comments,1.7k,12 hours ago,r/newzealand,"Reminder that tip top is currently owned by nestle, a scumbag of a company."
243,123 comments,12.5k,12 hours ago,r/therewasanattempt,To hold your ball
244,96 comments,1.2k,5 hours ago,r/reddeadredemption,Found this sheep by valentine he was wondering alone and he has this pink tie i killed him but i cant skin it what the heck is this
245,18 comments,Vote,5 hours ago,r/reddeadredemption,"The judges from The Games Awards have spoken...but have you been heard? Respond directly to this post with games that should have won, but didn't. Who knows, maybe you'll score some Gold."
246,222 comments,Vote,2 hours ago,r/StarWars,Do you consider grey jedi's cannon? Why or why not?
247,55 comments,6.0k,7 hours ago,r/aww,TRIFORCE ACTIVATE
248,95 comments,2.2k,12 hours ago,r/bindingofisaac,This meme took a fat 2 minutes to make so sorry if it’s bad
249,95 comments,2.9k,6 hours ago,r/sadcringe,I realy hope this is satire
250,132 comments,7.0k,7 hours ago,r/facepalm,“This is how it feels to be a white conservative”
251,244 comments,18.1k,15 hours ago,r/gaming,Mario then realized he now wants more than a kiss after rescuing Peach
252,153 comments,4.1k,8 hours ago,r/SmashBrosUltimate,That's enough to make me wanna strangle that bitch
253,224 comments,2.2k,11 hours ago,r/loopringorg,New GameStop Job Ad: Absolute PROOF that GME is building an NFT Gaming Platform on a Layer 2…. (Scroll Right ➡️➡️➡️) Buckle Up Loop Troop 🚀🚀🚀🚀
254,190 comments,50.8k,10 hours ago,r/me_irl,me_irl
255,181 comments,1.6k,9 hours ago,r/CrusaderKings,The route the AI is taking to Jerusalem in the first crusade
256,97 comments,4.0k,5 hours ago,r/BlackPeopleTwitter,necessary pill to swallow 💊
257,113 comments,3.1k,4 hours ago,r/Unexpected,Gotem
258,267 comments,1.8k,10 hours ago,r/StarWarsBattlefront,Count Dooku’s reign of terror is over. Only 5 heroes remain. Who should go next?
259,69 comments,2.6k,5 hours ago,r/GlobalOffensive,First thing to draw with Lasercube
260,13 comments,3.2k,6 hours ago,r/BikiniBottomTwitter,You and I are not so different
261,142 comments,1.4k,9 hours ago,r/imaginarymaps,Alternate Map of Rome if they had Conquered China (Circa 576)
262,94 comments,2.3k,5 hours ago,r/ffxiv,Estinien 300 IQ [art by Diago_FFXIV]
263,156 comments,2.5k,5 hours ago,r/dankchristianmemes,The Africans I meet on FB may be the most active Christians I’ve ever seen
264,290 comments,1.5k,10 hours ago,r/xboxone,Watching the Xbox documentary. Can someone please tell me what this game is?
265,154 comments,4.0k,6 hours ago,r/MinecraftMemes,Who needs minecraft realms?
266,326 comments,669,5 hours ago,r/polls,What is your favorite sleep times?
267,337 comments,15.2k,12 hours ago,r/gifs,what's the name of this fruit...
268,43 comments,3.2k,5 hours ago,r/technicallythetruth,The place I visited most this year
269,265 comments,2.7k,5 hours ago,r/RocketLeague,Petition for Psyonix to add a Toyota Camry and/or a Honda Civic
270,75 comments,2.4k,7 hours ago,r/MemePiece,Fax
271,203 comments,7.9k,11 hours ago,r/BeAmazed,Your blood turns green 30ft underwater due to no red light being present
272,166 comments,633,4 hours ago,r/pcgaming,Why Does EA Destroy Companies They Buy?
273,164 comments,885,3 hours ago,r/europe,Global warming is not the only theat caused by coal plants
274,91 comments,1.1k,6 hours ago,r/factorio,I've been playing Factorio V0.16 for already several years now and I just noticed that there's a V1.1...
275,49 comments,4.3k,6 hours ago,r/cursedcomments,Cursed_christmas
276,100 comments,8.2k,11 hours ago,r/PewdiepieSubmissions,“i’lL nEvEr bE fAmiLy fRiEnDlY”
277,184 comments,1.6k,6 hours ago,r/ksi,Some of you guys make me sick
278,129 comments,3.1k,11 hours ago,r/tf2shitposterclub,mfw the meanie scunt on fire who stood still calling for medic took my healthpack
279,106 comments,5.2k,15 hours ago,r/ufc,WCGW diving head first into a frozen river
280,106 comments,5.2k,15 hours ago,r/ufc,Merab Dvalishvili (UFC BW division) dives head first into frozen river💀
281,140 comments,1.4k,11 hours ago,r/sweden,Kristina skippar mellandagsrean
282,185 comments,1.9k,6 hours ago,r/Eldenring,Collection of all default character faces in the CNT
283,174 comments,1.7k,4 hours ago,r/MarchAgainstNazis,Look at what my parents got for me for Christmas… without me asking of course.
284,102 comments,4.3k,14 hours ago,r/dankruto,space time ninjutsu would be a faster option smh
285,310 comments,7.1k,6 hours ago,r/memes,Feet fetish is one of the most normal fetishes
286,38 comments,1.8k,3 hours ago,r/Art,"Marie Antoinette Strip Tease, Thierry Bruet, Oil on canvas, 2010"
287,198 comments,1.0k,6 hours ago,r/SquaredCircle,"A move you'll never see in the WWE, Seth Rollins 'Rubix Cube'"
288,188 comments,1.4k,7 hours ago,r/battlefield2042,Specialists ranked by how cheesy their voice lines are
289,145 comments,22.5k,16 hours ago,r/perfectlycutscreams,Aaa-
290,47 comments,1.6k,2 hours ago,r/WhatsWrongWithYourDog,"Never seen a doggo sit like this before but I must say, I’m happy I did!"
291,191 comments,2.2k,5 hours ago,r/philosophy,"Societies choose to make evil look sexy to distract us from real evil – called ‘banal’ evil by Hannah Arendt. Real evil is done quietly and without intention, like climate change."
292,56 comments,2.5k,5 hours ago,r/marvelstudios,The greatest scene in NWH (fan art)
293,64 comments,2.3k,13 hours ago,r/JustGuysBeingDudes,Filming his boy getting berated
294,178 comments,15.1k,15 hours ago,r/rareinsults,Strawberry Shortcake Extra
295,113 comments,4.3k,15 hours ago,r/Rainbow6,Who's the artist of this Jack O Pose Nøkk? (Not my content)
296,58 comments,4.1k,7 hours ago,r/titanfall,hey who is that guy?
297,137 comments,5.1k,15 hours ago,r/adhdmeme,"Not Schizophrenia, ADHD"
298,133 comments,2.2k,10 hours ago,r/HistoryPorn,"Mohamed Reza Pahlavi and his wife Farah Pahlavi, upon his coronation as the Shâhanshâh of Imperial (Pahlavi) Iran, and his wife was crowned as the Shahbanu, on October 26th, 1967, in the Imperial State of Iran. [417 x 590]"
299,68 comments,5.4k,9 hours ago,r/WhatsWrongWithYourCat,My cat brings random items he finds in the attic :)
300,100 comments,1.2k,4 hours ago,r/techsupportgore,I thought I had a tiktok addiction... poor s9 :(
301,41 comments,2.2k,4 hours ago,r/Terraria,Late Merry Xmas from the nurse =w=
302,170 comments,2.8k,6 hours ago,r/Coronavirus,'We just do not have enough players': More bowl games canceled as COVID cases surge
303,137 comments,10.4k,9 hours ago,r/StarWars,Nailed it!
304,44 comments,2.2k,5 hours ago,r/AbruptChaos,Tractor has a mind of its own
305,194 comments,17.6k,14 hours ago,r/rarepuppers,Good boy knows today is HIS day!
306,97 comments,2.4k,5 hours ago,r/ich_iel,ich🏴󠁧󠁢󠁥󠁮󠁧󠁿iel
307,66 comments,1.8k,3 hours ago,r/Tinder,This could be me
308,76 comments,3.7k,15 hours ago,r/baseball,I think this is one of the greatest ugly sweater I’ve ever got!!
309,120 comments,Vote,5 hours ago,r/ConservativeMemes,What are y'all going to do once communism is achieved?
310,120 comments,Vote,5 hours ago,r/ConservativeMemes,What are y'all going to do once communism is achieved?
311,41 comments,2.8k,6 hours ago,r/BeAmazed,drawing a nose
312,475 comments,3.7k,4 hours ago,r/shitposting,IT'S ABOUT TO GO DOWN
313,259 comments,7.4k,7 hours ago,r/dankmemes,Come here
314,29 comments,5.7k,9 hours ago,r/suicidebywords,...
315,76 comments,2.1k,4 hours ago,r/MapPorn,A Very detailed Blank Map Resource for editing
316,76 comments,3.2k,10 hours ago,r/vexillology,Flag of Japan in the style of Saudi Arabia (Text says Long live Japan / Nippon Banzai. Gun is an Arisaka Type 99)
317,31 comments,2.6k,4 hours ago,r/Hololive,Haachama is celebrating Cocos 2nd anniversary with emotional karaoke right now 😢
318,104 comments,9.9k,17 hours ago,r/WitchesVsPatriarchy,Feminist saint 🙏🏻
319,751 comments,2.7k,3 hours ago,r/pics,This is what you can find in a local gun store from Texas
320,79 comments,876,17 hours ago,r/funny,Is he… you know…
321,79 comments,876,17 hours ago,r/funny,Yet another year as the last unmarried in the family.
322,69 comments,1.1k,6 hours ago,r/Bad_Cop_No_Donut,Copaganda in the wholesome subreddits
323,275 comments,681,5 hours ago,r/FridayNightFunkin,Bnb has officially been trashed
324,98 comments,1.7k,5 hours ago,r/Rabbits,I spotted this bunny. Is he domestic or wild?
325,89 comments,8.8k,11 hours ago,r/CrappyDesign,Not the best brand name for a wheel chair
326,155 comments,3.5k,11 hours ago,r/facepalm,This woman talking about what kind of men she wants...
327,155 comments,3.5k,11 hours ago,r/facepalm,This woman talking about what kind of men she wants...
328,248 comments,3.3k,7 hours ago,r/fakehistoryporn,The Cold War map of the world 1985.
329,204 comments,11.5k,12 hours ago,r/TikTokCringe,Gingerbread house by an architect
330,148 comments,595,3 hours ago,r/FantasyPL,FPL Crashes one min before the transfer deadline. Compilation video of live reactions as they happened.
331,33 comments,2.4k,6 hours ago,r/spaceporn,A Juno picture of the rings of Jupiter from the inside.
332,145 comments,5.5k,5 hours ago,r/MadeMeSmile,Aggressive generosity
333,78 comments,5.3k,9 hours ago,r/engrish,It is forbidden to dog
334,147 comments,Vote,1 hour ago,r/MMA,Notable fighters who went on a winless run in 2021
335,174 comments,22.7k,17 hours ago,r/dogswithjobs,My service dog recently learned a new task!
336,74 comments,4.6k,9 hours ago,r/anime_irl,anime_irl
337,173 comments,1.8k,4 hours ago,r/iamatotalpieceofshit,Posse of Grown Adults Relentlessly Bullying Strangers During the Holidays.
338,83 comments,1.4k,8 hours ago,r/ENLIGHTENEDCENTRISM,Liberal rehabilitation of Trump is already starting
339,272 comments,13.0k,9 hours ago,r/politics,"Conservative dark-money group bankrolled almost every major Republican effort in Colorado last year, tax docs show"
340,72 comments,815,2 hours ago,r/Kanye,man
341,139 comments,5.4k,11 hours ago,r/dankvideos,Minors 😳
342,84 comments,2.3k,9 hours ago,r/ArtefactPorn,"The death mask of Agnes Sorel, famous “Dame de beauté” and mistress of King Charles VII of France compared to the Fouquet painting of her - 1450 [1758x784]"
343,271 comments,2.8k,7 hours ago,r/Damnthatsinteresting,this man has an extra functioning finger
344,183 comments,6.3k,16 hours ago,r/MakeMeSuffer,"I posted a burn on my hand just recently. I have another burn from a radiator cap unthreading on a HWY. I DO know better to mess with a radiator when it’s boiling and over heated, but it unthreaded, It sounds like a loud zip noise and is scary. I got out of the way and avoided traffic just in time."
345,208 comments,2.0k,6 hours ago,r/amcstock,"This is why I HODL! My baby has already had 3 open hear surgeries, doctors paralyzed his vocal chords which caused him a tracheotomy. Rebuilt his airway and now he can breathe but will never be able to speak.."
346,107 comments,4.6k,23 hours ago,r/youseeingthisshit,HMC while I kick a bottle cap off the Liquor I just bought
347,107 comments,4.6k,23 hours ago,r/youseeingthisshit,Reaction is priceless
348,110 comments,2.3k,10 hours ago,r/DeepRockGalactic,DRG in a nutshell
349,138 comments,5.6k,17 hours ago,r/antiassholedesign,Instead of listing games on sale for 34.99$ like most stores would. GameStop lists them for 35.01$ so they are eligible for free shipping.
350,135 comments,8.5k,15 hours ago,r/yesyesyesno,yes yes yes no
351,72 comments,1.1k,7 hours ago,r/Gunners,Martin Ødegaard's 3 goals and 3 assists in December
352,387 comments,3.2k,7 hours ago,r/teenagers,How to deal with a creep 101
353,181 comments,3.2k,13 hours ago,r/BisexualTeens,"Oh, I know you do"
354,51 comments,2.1k,5 hours ago,r/gifsthatkeepongiving,Making an ice bar
355,230 comments,4.5k,6 hours ago,r/Superstonk,Thought this comment deserved its own post. 'How do you deal with that?'
356,64 comments,1.5k,3 hours ago,r/halo,"I’ve never been great with the sniper, so this is my crowning achievement"
357,81 comments,3.8k,16 hours ago,r/reactiongifs,MRW my mom’s new boyfriend gets me a Victoria Secret gift card for Christmas
358,106 comments,4.9k,10 hours ago,r/gatekeeping,"Gatekeeping having fun with your children. (Crosspost, but had to cross out the names)"
359,155 comments,3.2k,3 hours ago,r/nextfuckinglevel,This guy found some ancient dna inside himself
360,110 comments,Vote,2 hours ago,r/cats,Adopted a fat indoor cat. Need weight loss advice.
361,66 comments,744,5 hours ago,r/averageredditor,Average groomers
362,143 comments,9.7k,7 hours ago,r/interestingasfuck,Real-time geomorphology
363,105 comments,925,7 hours ago,r/hockey,"There are currently 146 open rinks or ice tracks free to use in Tampere, Finland all within 10 km radius."
364,129 comments,1.3k,5 hours ago,r/Warframe,"""Let's say we shake on it!"""
365,101 comments,4.6k,10 hours ago,r/ThatsInsane,Why was this abandoned
366,93 comments,13.0k,3 years ago,r/satisfying,stardew tree physics
367,93 comments,13.0k,3 years ago,r/satisfying,Dead tree completely falls apart when it hits asphalt.
368,70 comments,2.4k,6 hours ago,r/formuladank,Is this a joke?
369,77 comments,1.5k,10 hours ago,r/GreenAndPleasant,Tory MP who voted against free school meals and in favour of benefit cuts has the nerve to use a food bank for self-promotion
370,81 comments,2.2k,11 hours ago,r/polandball,Türkiye
371,126 comments,Vote,2 hours ago,r/ImaginaryWarhammer,The Chosen One Strikes an Angel of Death by Jdsarte
372,89 comments,1.5k,4 hours ago,r/lotrmemes,Hey do! Merry do!
373,154 comments,1.4k,10 hours ago,r/mapporncirclejerk,Mamma Mia!
374,35 comments,1.2k,2 hours ago,r/quityourbullshit,OP goes on r/povertyfinance to claim he saved up nearly 100k in 3 years by budgeting with Mint. Quickly has to backtrack when called out. Suddenly it takes more than budgeting to save so much.
375,132 comments,1.3k,3 hours ago,r/pitbulls,Y’all keeping bullying my fat girl so here are pics where you can tell she isn’t morbidly obese.
376,132 comments,923,8 hours ago,r/Bitcoin,"I was this high on mushrooms 5 years ago when I finally understood Bitcoin and decided to make it my savings account, changing my life forever. Thank you Bitcoin"
377,35 comments,4.6k,7 hours ago,r/oddlysatisfying,This bouncing ball animation
378,24 comments,1.7k,4 hours ago,r/Breath_of_the_Wild,"One year later - this is Franks daughter, Daisy."
379,117 comments,2.9k,11 hours ago,r/Showerthoughts,"Your brain is the only organ that can’t be transplanted. If you got a brain transplant, you wouldn’t wake up with a new brain. You would wake up with a new body."
380,6 comments,2.2k,6 hours ago,r/wholesomegreentext,Wholesome grandpa/grandson
381,13 comments,1.9k,14 hours ago,r/MadeMeSmile,Good boy knows today is HIS day!
382,13 comments,1.9k,14 hours ago,r/MadeMeSmile,Good boy knows today is HIS day!
383,33 comments,2.1k,6 hours ago,r/ihadastroke,Me when when eating I'm happy: cheese:
384,162 comments,1.2k,3 hours ago,r/legendofkorra,My attempt at the worst LoK live action casting
385,69 comments,2.4k,13 hours ago,r/Witcher3,Best detail in the game
386,240 comments,929,4 hours ago,r/SHIBArmy,Who is still holding strong?! 🎁🎁🎁
387,77 comments,3.2k,15 hours ago,r/Perfectfit,Apple Air Tags to my butt plug (NSFW?)
388,282 comments,5.9k,6 hours ago,r/funny,Rise in complaints
389,58 comments,2.1k,6 hours ago,r/Grimdank,The unimaginable has happened
390,98 comments,848,5 hours ago,r/Warhammer40k,Hopefully this clears up some confusion.
391,11 comments,Vote,2 hours ago,r/thanosdidnothingwrong,He got unlucky
392,100 comments,446,3 hours ago,r/DBZDokkanBattle,SUPER STRIKE EVENTS are getting updated!
393,27 comments,1.7k,4 hours ago,r/apexlegends,Whenever I see a Mirage decoy
394,101 comments,1.0k,7 hours ago,r/walkaway,Funny how people forgot about this footage after Biden won isn't?
395,94 comments,4.0k,9 hours ago,r/LeagueOfMemes,This is what I think about Yuumi
396,31 comments,2.5k,7 hours ago,r/Konosuba,Picked up Megumin's China Dress version today!
397,14 comments,1.3k,3 hours ago,r/blessedimages,Blessed Cloudy Day
398,113 comments,387,3 hours ago,r/ageofsigmar,Fury of the Deep battle box revealed! Idoneth Deepkin vs Fyreslayers
399,58 comments,3.0k,11 hours ago,r/HollowKnightMemes,Literally 30 minutes ago
400,108 comments,556,2 hours ago,r/trashy,I feel sorry for everyone who had to encounter them
401,104 comments,812,4 hours ago,r/EverythingScience,"One-Third Of Programmers Use Marijuana While Working, With Many Touting Creative Benefits, Study Finds"
402,54 comments,2.6k,10 hours ago,r/NewVegasMemes,Terrifying Presence > Other Perks
403,60 comments,1.4k,7 hours ago,r/CapitolConsequences,Capitol panel to investigate Trump call to Willard hotel in hours before attack
404,21 comments,1.4k,4 hours ago,r/CatsAreAssholes,Charo recreating that one scene from Scarface
405,35 comments,3.4k,1 day ago,r/CountOnceADay,bi_irl
406,35 comments,3.4k,1 day ago,r/CountOnceADay,32974
407,21 comments,3.0k,7 hours ago,r/PewdiepieSubmissions,Pewds be like
408,122 comments,2.5k,13 hours ago,r/DIY,"I made a jewlery box with a hidden compartment that can only be opened with a powerful magnet, inside there are gears that can only be turned with a special key, the iris mechanism turns and presents a ring and also plays music from the light activated diode."
409,99 comments,443,2 hours ago,r/discordapp,"Oh boy, gotta make sure everyone is aware"
410,76 comments,5.3k,10 hours ago,r/suspiciouslyspecific,"ah yes, we all had that friend... right...?"
411,35 comments,1.5k,4 hours ago,r/harrypotter,Harry Potter and the Prisoner of Candyland
412,82 comments,2.5k,20 hours ago,r/AbruptChaos,16-car pileup
413,82 comments,2.5k,20 hours ago,r/AbruptChaos,16-car pileup
414,35 comments,1.7k,4 hours ago,r/meirl,meirl
415,91 comments,2.3k,7 hours ago,r/carporn,Toyota Yaris GR [1080x1080]
416,61 comments,3.1k,12 hours ago,r/CuratedTumblr,In case anyone's wondering I'm not a bot I'm just bored and there's a lot of content to post
417,48 comments,1.6k,4 hours ago,r/deadbydaylight,I just wanna be sure if he’s coming towards me
418,54 comments,2.5k,10 hours ago,r/TankPorn,German Tpz Fuchs
419,94 comments,760,7 hours ago,r/guitarcirclejerk,Thought it was posted in this sub lmao
420,35 comments,1.6k,7 hours ago,r/okbuddybaka,🐿️
421,41 comments,3.1k,8 hours ago,r/ShitPostCrusaders,"They know, they now"
422,97 comments,1.7k,6 hours ago,r/tooktoomuch,How goods cricket
423,7 comments,1.4k,4 hours ago,r/MemeEconomy,Gotta keep buying SHIB
424,68 comments,1.8k,5 hours ago,r/PrequelMemes,Virgin L3-37 vs Chad K-2SO
425,96 comments,826,5 hours ago,r/aaaaaaacccccccce,*hides in corner just trying to help invade Denmark*
426,83 comments,11.2k,17 hours ago,r/hmmm,hmmm
427,959 comments,4.4k,7 hours ago,r/Cringetopia,God protects me from such atrocities😌🙏
428,105 comments,4.3k,10 hours ago,r/SCP,scp 055
429,85 comments,1.5k,6 hours ago,r/religiousfruitcake,Oh brother.
430,62 comments,2.5k,13 hours ago,r/ClashOfClans,Relatable
431,39 comments,2.1k,6 hours ago,r/FUCKYOUINPARTICULAR,Fuck you Andrew
432,64 comments,2.9k,10 hours ago,r/egg_irl,egg_irl
433,46 comments,1.5k,5 hours ago,r/BokuNoMetaAcademia,Try what..? (official volume extra page)
434,117 comments,799,6 hours ago,r/stopdrinking,Can everyone who made it through Christmas alcohol free give yourself a high five?
435,62 comments,1.6k,4 hours ago,r/AbruptChaos,Who will pay for that
436,106 comments,3.3k,9 hours ago,r/SweatyPalms,"The path to Harihar Fort, Maharashtra India."
437,151 comments,1.1k,7 hours ago,r/3Dprinting,New Customizable Snap-Together Raspberry Pi Case 2/3/4
438,71 comments,2.0k,11 hours ago,r/csgo,Wait... i remember this place
439,145 comments,496,4 hours ago,r/AskOuija,"Without saying “Your Mom,” who has the hottest pussy?"
440,145 comments,595,3 hours ago,r/HelluvaBoss,Quote youre favourite character and let others guess who it is.
441,21 comments,3.2k,5 hours ago,r/blursedimages,Blursed friendzone
442,69 comments,973,6 hours ago,r/RimWorld,"Oh no... Randy, you psychopath! What do I do?"
443,50 comments,1.6k,7 hours ago,r/comics,I don't want to hear
444,60 comments,1.8k,10 hours ago,r/terriblefacebookmemes,From the generation that needed educational videos telling them not to hide in a fridge.
445,70 comments,539,1 day ago,r/justneckbeardthings,"Weeb really wants all ""foreigners"" to be expelled from Japan"
446,70 comments,539,1 day ago,r/justneckbeardthings,"Weeb really wants all ""foreigners"" to be expelled from Japan"
447,64 comments,1.1k,7 hours ago,r/Philippines,Burn!!!
448,79 comments,1.6k,6 hours ago,r/HighQualityGifs,When I found out what it took to take the red pill
449,78 comments,3.8k,13 hours ago,r/animememes,So True 😂
450,188 comments,5.8k,9 hours ago,r/gaming,Oh Nintendo... You really have no clue what your audience wants
451,195 comments,891,6 hours ago,r/trans,What name do I look like?/ what do you think my name is?
452,120 comments,14.2k,15 hours ago,r/tattoos,"Geometric and pattern bands done by Elizabeth at Noir Tattoo in Shanghai, China"
453,24 comments,2.4k,8 hours ago,r/evangelionmemes,"""Fix Shinji's back, Asuka. Or Rei will have to do it instead."""
454,49 comments,2.6k,7 hours ago,r/youseeingthisshit,confused monkey
455,28 comments,1.8k,9 hours ago,r/AnarchyChess,Now the camera moves where Hikaru looks. Anti-cheating at its best.
456,174 comments,4.2k,7 hours ago,r/Minecraft,What did I do to deserve this?
457,47 comments,4.4k,15 hours ago,r/pyrocynical,Pie row
458,65 comments,1.0k,6 hours ago,r/forwardsfromgrandma,Can all the people who compare covid-related things to Nazi Germany just go fuck off
459,38 comments,1.6k,10 hours ago,r/soccercirclejerk,stats nonce
460,83 comments,4.4k,10 hours ago,r/gravityfalls,Shmebulock - Toothpaste 🪥🌈👀
461,121 comments,4.2k,6 hours ago,r/antiwork,Fuck the 40 hour work week.
462,66 comments,1.3k,8 hours ago,r/Sekiro,Skipping all of Fountainhead Palace with 2 simple items
463,67 comments,890,6 hours ago,r/Patriots,It never worked out.
464,73 comments,2.2k,9 hours ago,r/travel,"Michelangelo's David is great, but pieta is on whole another level with the details imo. Saw both last week and i couldn't stop admiring it"
465,56 comments,5.0k,13 hours ago,r/dogelore,Day Twenty Six of Destroy your Dick December Has Arrived.
466,24 comments,1.7k,5 hours ago,r/SupermodelCats,I swear Mochi poses when I point my phone in her direction
467,79 comments,900,4 hours ago,r/SaimanSays,Dislike button wapas laao mitron
468,65 comments,1.1k,6 hours ago,r/mathmemes,Which type of student are you ?
469,32 comments,1.3k,4 hours ago,r/videos,"A taxi driver's car catches on fire, so strangers stop by and start collecting donations for him. He made more than the car's worth in donations by the end of the day."
470,80 comments,2.7k,11 hours ago,r/notliketheothergirls,So special
471,35 comments,1.3k,4 hours ago,r/goldenretrievers,"Got hit by a car and have no injuries, only tiny lung bruises. Meanwhile car’s bumper is damaged pretty bad. Recovering from all the meds and the shock now! Lucky boi!"
472,391 comments,5.0k,8 hours ago,r/oddlyterrifying,'Surgically' Removing an iron rod used for healing a leg fracture
473,55 comments,1.0k,2 years ago,r/LateStageCapitalism,This Canadian is trash!
474,55 comments,1.0k,2 years ago,r/LateStageCapitalism,Quarantine
475,72 comments,1.4k,3 hours ago,r/CryptoMoonShots,🌟 FCF (French Connection Finance) 🌟| NASDAQ partnership contract received ! ✅ | Listed on 4 exchanges! Gate.io next🚀| Crypto Payment Gateway for Shopify & WooCommerce 🛍| Biggest crypto use case on BSC⚡️ | Passive Income paid in BNB daily! ✨ | Innovative KYC/Doxxed Team
476,44 comments,1.2k,8 hours ago,r/GaySoundsShitposts,Well if you insist
477,39 comments,389,3 hours ago,r/boardgames,"I'd find interesting a ""minimum table surface"" and ""recommended table surface"" on BGG pages"
478,47 comments,1.9k,6 hours ago,r/sewing,Saw this and it made me laugh and think of this sub
479,16 comments,1.8k,6 hours ago,r/RoomPorn,"Small guesthouse in the garden, South Pasadena, Los Angeles County, California [1080x1350]"
480,31 comments,2.3k,7 hours ago,r/CozyPlaces,Christmas morning at my parents’ house
481,5 comments,984,3 hours ago,r/KamikazeByWords,This is the “long story”
482,47 comments,1.5k,7 hours ago,r/FloridaMan,"Florida Man wears 'Fuck the Police' t-shirt to court, wins case against police"
483,68 comments,4.5k,12 hours ago,r/softwaregore,hehe baby go brrrrrrrr
484,76 comments,3.0k,9 hours ago,r/itookapicture,ITAP of a girl on a beach [MLM]
485,65 comments,1.0k,5 hours ago,r/blackcats,Do you ever wonder what your cat’s parents look like/if they’re black also?
486,66 comments,2.6k,10 hours ago,r/houseplants,Pest identification?
