,comment_count,upvote_delta,timeup_list,subreddit,thread_text
722,142 comments,1.8k,5 hours ago,r/mildlyinfuriating,"Sorry but that's not how it works, and this really bothers me. If you're struggling with illnesses such as Deppression or anxiety, positivity wont fix things this easily."
723,40 comments,1.3k,8 hours ago,r/UpliftingNews,India gifts half a million doses of Covaxin to Afghanistan
724,46 comments,562,2 hours ago,r/intermittentfasting,Lost 35 lbs doing 18:6! It may be nothing compared to other people in here but before starting IF I never thought I'd do it.
725,3 comments,843,3 hours ago,r/AskHistorians,"My grandmother once said that, as a young woman in 1930s New York, she would chat with her friends in French when their husbands were around, because all the young ladies in her social circle learned French in school but all the young men learned German or Russian instead. Was this a common split?"
726,118 comments,5.2k,9 hours ago,r/Genshin_Impact,"Genshin🤝Beyblade (yeah, it's an actual bug)"
727,582 comments,21.5k,17 hours ago,r/worldnews,"Taiwan sends honey oranges, pineapple sugar apples to Singapore for Lunar New Year: Singapore has become prime market for Taiwan fruit following Chinese ban."
728,29 comments,644,6 hours ago,r/WritingPrompts,"[WP] The three rules have been passed down from generation to generation: One, when it visits, do not refuse it entry. Two, when it offers a gift, do not reject its generosity. Three, when it leaves, do not turn your back until it is no longer in sight. In this way, our family has been kept safe."
729,42 comments,369,3 hours ago,r/mmamemes,I CANT'T LET YOU GET CLOSE.
730,93 comments,1.8k,5 hours ago,r/cats,I think my cat is broken
731,30 comments,1.5k,11 hours ago,r/battlefield_one,"This tank was running everyone over, so my teammate and I decided to lay a trap."
732,27 comments,2.0k,8 hours ago,r/Minecraftbuilds,Minecraft underground Base design | Sound On
733,19 comments,1.2k,6 hours ago,r/standardissuecat,Sweet Emma with her white toes ♥️
734,42 comments,865,7 hours ago,r/btd6,"Due to popular demands, here added Minecraft Sauda ""riding"" Minecraft Flying Fortress."
735,5 comments,803,4 hours ago,r/TILI,"Thanks, i love it"
736,150 comments,7.8k,11 hours ago,r/therewasanattempt,To drink lime juice without reaction
737,38 comments,698,7 hours ago,r/5ToubunNoHanayome,So my friend asked me to watch this series and pick my favorite Quint and after watching both seasons I’d say Yotsuba is my favorite
738,20 comments,938,11 hours ago,r/HolUp,Power of religion
739,20 comments,938,11 hours ago,r/HolUp,cursed ad
740,34 comments,649,4 hours ago,r/goldenretrievers,Our boy Royce lost his first tooth! He’s only 3.5 months - when did yours start losing teeth?
741,28 comments,1.8k,9 hours ago,r/quityourbullshit,Added the cancer for an extra hit of karma
742,272 comments,5.1k,11 hours ago,r/todayilearned,"TIL about ""JanSporting"", the act of putting a backpack on the intoxicated to prevent them from turning on their back while unconscious."
743,49 comments,1.3k,6 hours ago,r/MemeVideos,:((
744,24 comments,2.1k,9 hours ago,r/BokuNoHeroAcademia,"Deku Panel by me , is it good?"
745,12 comments,934,4 hours ago,r/spaceporn,Orion rising above an old palace
746,16 comments,550,12 hours ago,r/SandersForPresident,No country that has nationalized healthcare has ever gone back.
747,16 comments,550,12 hours ago,r/SandersForPresident,No country that has nationalized healthcare has ever gone back.
748,21 comments,1.3k,6 hours ago,r/itookapicture,ITAP of a Hibiscus
749,33 comments,1.1k,5 hours ago,r/zelda,"[BotW] Help, what type of spear is this? (AutomaticGiraffe)"
750,7 comments,1.2k,6 hours ago,r/2meirl42meirl4meirl,2meirl42meirl4meirl
751,42 comments,578,5 hours ago,r/WeWantPlates,Tacos in glasses
752,42 comments,1.2k,8 hours ago,r/HadesTheGame,"So there was this bag of gold, just lying here..."
753,32 comments,663,3 hours ago,r/Seattle,"Even with a major snowstorm, WA Twitter knows how to make you smile"
754,31 comments,579,5 hours ago,r/seinfeld,You're pushing your luck Tennis man
755,34 comments,763,3 hours ago,r/loopringorg,Fixed the coffee machine at the office today (Shit post)
756,24 comments,426,3 hours ago,r/okbuddychicanery,"your employee just created this, what do you do?"
757,29 comments,590,5 hours ago,r/vancouver,Coyote experiencing an existential crisis at Sunset Beach (not my pic)
758,23 comments,491,4 hours ago,r/The_Mueller,"Trump's Press Secretary says he ""gleefully"" watched (and rewatched) his supporters storm the US Capitol. At this same time, Republican House Leader McCarthy, Chief of Staff Meadows, Ivanka Trump were all begging Trump to walk 20 steps and tell his crowd to stop. He refused to."
759,43 comments,1.4k,1 day ago,r/meme,I admit I tried it to
760,43 comments,1.4k,1 day ago,r/meme,I hate this
761,39 comments,789,5 hours ago,r/HaloMemes,It's time for the truth.
762,27 comments,886,1 day ago,r/DelusionsOfAdequacy,Does learning strange spoken language rules count?
763,27 comments,886,1 day ago,r/DelusionsOfAdequacy,Fun with edu-fuckin-cation! Am I doing it right?
764,31 comments,2.9k,11 hours ago,r/SpeedOfLobsters,Praise
765,27 comments,1.5k,7 hours ago,r/ItemShop,Uno Counter (ITEM) 999999 children from basement (1 time use) allows you to counter an uno reverse card.
766,39 comments,2.6k,12 hours ago,r/comedyhomicide,haha 😐
767,178 comments,Vote,2 hours ago,r/halo,"Fortnite is down for 6 hours, Players receive free pick axe and double XP weekend. BTB is down for a month, and 343 wants you to spend $$ to buy challenge swaps so you can continue to level up."
768,19 comments,882,7 hours ago,r/antifastonetoss,Don’t Die for Donald
769,43 comments,718,4 hours ago,r/TenseiSlime,Time for.... Treyni fanart!
770,13 comments,1.6k,12 hours ago,r/hmm,Better than gold coins
771,13 comments,1.6k,12 hours ago,r/hmm,Hmmmmmmmmmmmmmm
772,26 comments,1.0k,5 hours ago,r/crappyoffbrands,"Seems legit, should I try that restaurant?"
773,16 comments,2.1k,9 hours ago,r/forbiddensnacks,"Forbidden oreo, wax stamp."
774,37 comments,1.4k,7 hours ago,r/Rabbits,"To celebrate one year on Reddit, here is my bunny Ollie :)"
775,369 comments,1.2k,4 hours ago,r/Genshin_Impact_Leaks,weekly boss gameplay
776,32 comments,1.2k,7 hours ago,r/stevenuniverse,It's almost a year since SU:F ended
777,200 comments,1.1k,3 hours ago,r/Coronavirus,NC hospitals say 100% of COVID-19 patients on ventilators are unvaccinated :: WRAL.com
778,35 comments,1.2k,6 hours ago,r/Seaofthieves,Have you heard of the cursed chests yet? Very dangerous species
779,23 comments,2.8k,10 hours ago,r/HollowKnight,Amazing Fan Art - by Adrien Jeannerod
780,37 comments,836,6 hours ago,r/streetwear,[WDYWT] matching 💚💙
781,27 comments,882,4 hours ago,r/TheLastAirbender,Some of the worst ATLA ships.
782,32 comments,650,6 hours ago,r/botw,TIL there’s a free eightfold blade on top of a mountain behind Impa’s house
783,27 comments,1.7k,10 hours ago,r/CityPorn,"Ginza, Tokyo"
784,26 comments,910,8 hours ago,r/Guacamole_penis,He doesnt care
785,26 comments,1.1k,8 hours ago,r/drawing,My progress in a year
786,12 comments,2.0k,9 hours ago,r/animememes,I saw this one after a long time
787,29 comments,470,4 hours ago,r/spain,Christmas is over!
788,28 comments,482,5 hours ago,r/TheDragonPrince,I've been drawing my personal timeskip designs to ease the pain of waiting - here's Callum and Rayla sightly aged up
789,22 comments,620,3 hours ago,r/Naturewasmetal,The Giant Chinese Elk (Sinomegaceros Pachyosteus) by Rudolf Hima on Instagram
790,35 comments,674,6 hours ago,r/ac_newhorizons,Some in progress shots of my Witcher inspired island 🐺
791,21 comments,837,6 hours ago,r/astrophotography,Jupiter in the evening
792,20 comments,2.1k,9 hours ago,r/HermitCraft,Cleo and Enderman (swipe->)
793,32 comments,2.9k,13 hours ago,r/cute,The end though
794,161 comments,1.9k,6 hours ago,r/titanfall,So why is no one talking about the TFO Revival project ?
795,21 comments,1.7k,9 hours ago,r/okmatewanker,Mfs actin like it was last year
796,31 comments,783,6 hours ago,r/totallynotrobots,Do u want. Chili?
797,25 comments,757,4 hours ago,r/gaybros,Gay dads 👬
798,16 comments,760,4 hours ago,r/Simulated,That rubber band gave me a headache! | Marble run simulation
799,62 comments,1.7k,5 hours ago,r/tumblr,"Yeah, a lot more businesses have gotten greedy and much more sanitised."
800,4 comments,1.6k,19 hours ago,r/rarepuppers,I’ve started service dog training and it’s adorable. Here she is with impulse and eye contact training
801,4 comments,1.6k,19 hours ago,r/rarepuppers,I’ve started service dog training and it’s adorable. Here she is with impulse and eye contact training
802,24 comments,2.5k,4 hours ago,r/aww,High five bro 😎
803,27 comments,802,6 hours ago,r/FireEmblemHeroes,Christmas Tharja cosplay made by me
804,17 comments,1.2k,6 hours ago,r/araragi,Thai Monogatari fans are on an other level
805,359 comments,1.6k,5 hours ago,r/trashy,Passengers flying from Canada to Cancun take to partying during flight
806,8 comments,587,2 hours ago,r/me_irlgbt,me_irlgbt
807,18 comments,1.0k,6 hours ago,r/ArchitecturePorn,"The Fox Theater's stage from the main floor. The theater was designed using a mix of Burmese, Moorish, Persian, Indian, Chinese and Hindu Motifs to give the space an exotic look and feel. 1928, C, Howard Crane architect, Detroit Michigan"
808,941 comments,6.2k,6 hours ago,r/ArchitecturePorn,Geopolitics is your sandbox
809,62 comments,1.9k,6 hours ago,r/GetMotivated,[Image] 2022
810,21 comments,883,5 hours ago,r/Helltaker,To be honeat they burned it amazing job
811,441 comments,5.2k,11 hours ago,r/raimimemes,Simply A Joke Andrew Is Also Great!
812,26 comments,507,4 hours ago,r/NuxTakuSubmissions,"There’s not a lot on rule34, I need more"
813,15 comments,1.1k,4 hours ago,r/KidsAreFuckingStupid,Somebody's son got earache.
814,274 comments,916,2 hours ago,r/SquaredCircle,Bryan Alvarez on Twitter: **SPOILER** Miraculous update on injured AEW star
815,26 comments,965,6 hours ago,r/trans,"I took this selfie right after I was done streaming, and I still am completely baffled I went from hating everything about me to becoming a girl that’s confident enough to try and entertain strangers."
816,27 comments,1.2k,9 hours ago,r/PhoenixSC,Frog is hungry
817,27 comments,680,6 hours ago,r/worldbuilding,Gold Lightning Agency propaganda poster
818,27 comments,1.2k,7 hours ago,r/NoMansSkyTheGame,🌴🪐
819,9 comments,1.9k,6 hours ago,r/ProgrammerHumor,What most MVPs look like
820,27 comments,578,4 hours ago,r/elderscrollsonline,Illustrated a piece depicting the conflict between the Altmer and Maormer
821,25 comments,595,6 hours ago,r/AllCombatSports,Small Guy w Grappling Skills vs Big Guy with None... Guess Who Wins
822,25 comments,595,6 hours ago,r/AllCombatSports,Small Guy w Grappling Skills vs Big Guy with None... Guess Who Wins
823,26 comments,1.5k,10 hours ago,r/LiminalSpace,Dekan( دكان) pixelart by me
824,11 comments,2.2k,7 hours ago,r/blessedimages,Blessed_Lawyer
825,22 comments,589,6 hours ago,r/KingOfTheHill,Poor Bill
826,12 comments,713,4 hours ago,r/ComedyCemetery,Wasn't very funny to begin with and yet somehow someone managed to make it even worse.
827,23 comments,493,4 hours ago,r/germany,Train close to Berlin [OC]
828,25 comments,1.8k,10 hours ago,r/ShingekiNoKyojin,"""Attack on Titan The Final Season"" Part 2 - Countdown Animation (3 Days to go)"
829,22 comments,474,4 hours ago,r/hermitcraftmemes,"[Top text bottom text] PearlescentMoon, Bottom text"
830,20 comments,1.3k,7 hours ago,r/Badfaketexts,One of our own
831,8 comments,573,3 hours ago,r/WatchDogsWoofInside,"I sneezed, resulting in great offense apparently"
832,22 comments,525,2 hours ago,r/WhiskerFireworks,Lil Cheese has curly fireworks! (I thought he’d grow out of them!)
833,536 comments,2.0k,8 hours ago,r/teenagers,my boyfriend ordered pineapple on pizza. is he wrong for this?
834,243 comments,4.3k,4 hours ago,r/Superstonk,People like to mention DFV bought options. What they don't tell you is that the premiums were literally cents when he bought his. When he doubled down he didn't buy more options he bought shares. I'm not against options but don't mislead people. Anyone rushing you is not your friend.
835,23 comments,1.0k,6 hours ago,r/InternetIsBeautiful,Website where everybody can create custom sized templates for paper craft and packaging for free!
836,17 comments,936,6 hours ago,r/teefies,Jerry sais hello
837,16 comments,798,5 hours ago,r/characterdrawing,[OC] Ecko
838,25 comments,613,5 hours ago,r/thanosdidnothingwrong,The the whole thing is a full frontal nu-e
839,22 comments,929,6 hours ago,r/BirdsArentReal,The most annoying birds in the world
840,22 comments,859,5 hours ago,r/Hornyjail,wait
841,65 comments,2.2k,5 hours ago,r/oddlyterrifying,Antique bear automaton whose fur was destroyed by an infestation of moths.
842,23 comments,704,6 hours ago,r/skiing,"In the meantime, in Tokyo"
843,23 comments,732,7 hours ago,r/touhou,I'll take my chocolate
844,24 comments,565,4 hours ago,r/ARK,Found an RPG and a rocket in a red drop. First thing I did with it.
845,22 comments,899,8 hours ago,r/PaymoneyWubby,Ride Wife? Life Good.
846,152 comments,1.9k,7 hours ago,r/battlefield2042,Every single post has this Angel's quote
847,20 comments,1.2k,7 hours ago,r/powerwashingporn,Night and day.. literally!
848,231 comments,1.6k,6 hours ago,r/TwoXChromosomes,"Men aren't a ""part of the solution"" to male violence. They are the solution. There are literally no other solutions to male violence other than males stopping their own global systemic violence (and excuse/glorification/minimisation) of that violence. ~Dr. Jessica Taylor"
849,26 comments,2.7k,9 hours ago,r/shittymoviedetails,Have you ever noticed that Dwayne Douglas ''The Rock'' Johnson is playing the same character in every jungle movie?
850,22 comments,640,5 hours ago,r/HazbinHotel,Gay spider is good spider.
851,67 comments,1.6k,6 hours ago,r/sports,Real Madrid's goal against Alcoyano
852,36 comments,2.1k,4 hours ago,r/greentext,The street life
853,46 comments,1.8k,7 hours ago,r/gayspiderbrothel,Wholesome 100
854,18 comments,389,2 hours ago,r/Iamactuallyverybadass,Marine veteran Taylor Winston
855,22 comments,1.0k,9 hours ago,r/nukedmemes,"Bob Wicks does not breathe oxygen. This is not because he chooses to nor that his body isn't designed for it, there simply isn't any oxygen where he breathes"
856,85 comments,3.0k,10 hours ago,r/ABoringDystopia,Surely not!!??!
857,89 comments,4.1k,5 hours ago,r/interestingasfuck,Indoor tornado
858,1.2k comments,Vote,5 hours ago,r/interestingasfuck,"Toss a comment to your SmellyBardBot, oh people of Reddit. Toss a comment to your SmellyBardBot, oh people of Reddit. Oh People of Reddit. No seriously, ask for a poem about a Witcher character and I shall pen one about their smell."
859,21 comments,449,3 hours ago,r/velvethippos,Studying with my little rescue nugget
860,21 comments,1.1k,8 hours ago,r/notmycat,Two cats keeping us company while we are on a coffee break
861,19 comments,1.1k,8 hours ago,r/houseplants,Made a moss terrarium today
862,48 comments,1.7k,6 hours ago,r/ich_iel,Ich iel
863,5 comments,679,4 hours ago,r/Catloaf,"Bless my soul, what have we here? A CATLOAF!"
864,79 comments,2.5k,8 hours ago,r/starwarsmemes,Episode two was awesome
865,40 comments,1.7k,4 hours ago,r/oddlysatisfying,Australian farmer couldn’t attend his aunts funeral so he laid out the grain in the shape of heart
866,16 comments,1.8k,10 hours ago,r/calvinandhobbes,Bark Bark
867,18 comments,2.7k,10 hours ago,r/calvinandhobbes,Predictions Tournament
868,9 comments,776,5 hours ago,r/Konosuba,Aqua drawn by あ
869,370 comments,990,4 hours ago,r/HermanCainAward,"Princess Puce has been on a Vent since Christmas. She hated masks, so she can't be too happy now."
870,18 comments,664,6 hours ago,r/Dachshund,"Our new family member, Louie, the miniature dachshund."
871,18 comments,1.0k,7 hours ago,r/DDLC,Happy New Year! This year in Japan is the Year of the Tiger!
872,81 comments,2.1k,8 hours ago,r/anime_irl,Anime_irl
873,61 comments,1.8k,4 hours ago,r/BlackPeopleTwitter,And they always kept the door closed too
874,17 comments,872,7 hours ago,r/Sneks,I’ve never loved an animal more 😩🥺❤️
875,17 comments,911,7 hours ago,r/Baking,"When I was little I would only assist my mom in making baklava so I finally tried it myself, I think it turned out alright"
876,20 comments,3.0k,6 hours ago,r/whenthe,Don't
877,18 comments,561,5 hours ago,r/Chodi,Modern problem requires modern solution.
878,17 comments,636,6 hours ago,r/Nijisanji,Fuck around find out
879,17 comments,713,6 hours ago,r/PoliticsPeopleTwitter,"Boss make a dollar while I make a dime, so I schedule my breakdowns on company time"
880,17 comments,713,6 hours ago,r/PoliticsPeopleTwitter,"Boss make a dollar while I make a dime, so I schedule my breakdowns on company time"
881,15 comments,1.7k,10 hours ago,r/Superbowl,"A Snowy Owl hanging out below a solar panel. Lancaster County, Pennsylvania, USA."
882,13 comments,Vote,2 hours ago,r/CryptoMoonShots,CURE is blasting into 2022 like a rocket! 🚀 Project featured as Coin of the Week by Pixl!! 👾AMA with their entire community on Saturday at 6UTC!!🎙CURE Pay added Apple Pay and PayPal 🔥 New donations incoming! 💖
883,10 comments,784,5 hours ago,r/magicthecirclejerking,And on the eighth day god said buy singles
884,345 comments,2.2k,5 hours ago,r/PublicFreakout,Florida deputy finds missing girl in motel room with 22 year old she met online
885,118 comments,2.5k,7 hours ago,r/amcstock,Everyone needs to read Userofintellect Twitter post.
886,410 comments,7.1k,8 hours ago,r/nextfuckinglevel,The opening of a dams gates after several years
887,15 comments,336,2 hours ago,r/cottagecore,"My confidence has been quite low lately, so I turned myself into a painting 😳❤"
888,9 comments,699,5 hours ago,r/ReasonableFantasy,Practice by Cheng Gong
889,89 comments,Vote,1 hour ago,r/blackcats,How many of y’all only have one cat? I don’t want her to be lonely but can’t really get a 2nd right now.
890,16 comments,540,4 hours ago,r/DestinyFashion,EDZ Trucker
891,14 comments,634,6 hours ago,r/PERSoNA,Yu and Naoto's First Date
892,58 comments,2.1k,2 hours ago,r/funny,I'm in ...
893,15 comments,431,4 hours ago,r/oldpeoplefacebook,Stuff my uncle posts on Facebook
894,10 comments,927,8 hours ago,r/tommyinnit,he is married to a woman and that is interesting
895,115 comments,1.7k,7 hours ago,r/Wellthatsucks,Walked out my door to see this. Guess I won’t be driving to work today
896,13 comments,498,4 hours ago,r/animation,some animations I did last year
897,13 comments,2.8k,9 hours ago,r/2meirl4meirl,2meirl4meirl
898,9 comments,606,4 hours ago,r/HelluvaBoss,When you realize Blitzø hallucinates in his own artstyle
899,12 comments,775,6 hours ago,r/SpecialHumor,And now I want to play Sea of Thieves all of a sudden
900,17 comments,2.9k,10 hours ago,r/HydroHomies,I’ve found my people
901,6 comments,1.0k,4 hours ago,r/BikiniBottomTwitter,Get away from me
902,12 comments,562,4 hours ago,r/dontdeadopeninside,This great hot way to coffee choc
903,12 comments,518,5 hours ago,r/childemains,look at this shoujo manga mc looking ass mf
904,48 comments,1.2k,18 hours ago,r/gaming,Proving once and for all that Stardew Valley is the superior product
905,48 comments,1.2k,18 hours ago,r/gaming,Proving once and for all that Stardew Valley is the superior product
906,10 comments,455,4 hours ago,r/ChildrenFallingOver,Newton’s 3rd Law
907,12 comments,1.3k,10 hours ago,r/Re_Zero,[Media] Emilia drawn by Anjaku112.闇弱
908,10 comments,495,5 hours ago,r/SkyrimMemes,*hisses to be left alone*
909,10 comments,901,8 hours ago,r/DivorcedBirds,"With yet another tantrum about something irrelevant, Maggie was absolutely done with Jason and his childishness. “Talk to the wing,” she said, exhausted. “And tomorrow talk to your lawyer because I am done.”"
910,10 comments,471,4 hours ago,r/NewGreentexts,The street life
911,81 comments,8.7k,9 hours ago,r/MadeMeSmile,Life can wait.
912,8 comments,386,3 hours ago,r/Zoomies,He was waiting for this the whole evening
913,6 comments,2.1k,11 hours ago,r/dank_meme,METAVERSE WALMART
914,220 comments,1.0k,4 hours ago,r/TrueOffMyChest,"Wife was leaving me for someone else, he just died"
915,5 comments,445,4 hours ago,r/cathostage,We've all been there. (New Yorker cartoon by Julia Suits)
916,209 comments,2.6k,4 hours ago,r/politics,"Biden Torches Trump Over Jan. 6: ‘His Bruised Ego Matters More to Him Than Our Democracy’ - “This Wasn’t a Group of Tourists,” the President Said During a Speech From the Capitol on Thursday. “This was an Armed Insurrection”"
917,5 comments,447,7 hours ago,r/StartledCats,cat was gearing up to hit LIGHTSPEED
918,5 comments,447,7 hours ago,r/StartledCats,cat was gearing up to hit LIGHTSPEED
919,5 comments,604,5 hours ago,r/Megumin,My finished Megumin! I hope you like her~
920,5 comments,511,4 hours ago,r/ImaginaryWarhammer,Brunner: Nehb-ka-menthu vs the Vampires
921,4 comments,466,4 hours ago,r/ATLA,My third rewatch and I only now realise this line was setting up for the white lotus' arrival. Gave me chills.
922,4 comments,481,3 hours ago,r/Thisismylifemeow,Do not disturb
923,38 comments,2.6k,10 hours ago,r/rarepuppers,My Little Dum Dum
924,33 comments,1.3k,2 hours ago,r/cursedcomments,Cursed elixir
925,97 comments,2.5k,3 hours ago,r/HolUp,that's an awkward blind date
926,99 comments,6.4k,13 hours ago,r/WinStupidPrizes,unnecessarily step on the toy and try to brake it.
927,3 comments,535,5 hours ago,r/NolanBatmanMemes,Cautious Selina
928,137 comments,1.6k,5 hours ago,r/dndmemes,This has happened too many times.
929,243 comments,815,4 hours ago,r/unpopularopinion,"""I don't know how to cook"" means the same thing as ""my brain is barely functional"""
930,176 comments,1.7k,7 hours ago,r/Minecraft,Anyone know why my villagers spontaneously combusted?
931,123 comments,863,4 hours ago,r/MapPorn,number of nuclear power plants in europe
932,20 comments,2.1k,6 hours ago,r/meme,Giddy Up!
933,47 comments,6.7k,10 hours ago,r/blursedimages,Blursed Haircut
934,26 comments,1.6k,7 hours ago,r/skyrim,Can't argue with the name
935,61 comments,1.4k,7 hours ago,r/Overwatch,Thanks for delivering Hammond!
936,43 comments,2.5k,7 hours ago,r/mildlyinteresting,A park in a city famous for ceramics got creative replacing part of this railing
937,34 comments,2.4k,10 hours ago,r/StarWars,Boarding Party - Created by Jack Gregory
938,208 comments,4.7k,6 hours ago,r/dankmemes,su....
939,33 comments,998,5 hours ago,r/TwoSentenceHorror,"I stood before God and Satan, and accepted my fate when they sentenced me to Hell."
940,50 comments,1.7k,5 hours ago,r/Damnthatsinteresting,"So, there’s an adjustment for loose doors......"
941,21 comments,2.5k,10 hours ago,r/hmmm,hmmm
942,88 comments,4.8k,8 hours ago,r/WhitePeopleTwitter,Matthew 25
943,43 comments,1.4k,7 hours ago,r/TrashTaste,I found perfect figure for Connor.
944,36 comments,3.6k,2 years ago,r/facingtheirparenting,A Proud Dad
945,36 comments,3.6k,2 years ago,r/facingtheirparenting,A Proud Dad
946,38 comments,600,2 hours ago,r/MinecraftMemes,It do be like that
947,32 comments,1.3k,6 hours ago,r/antimeme,Opinions? 🤔
948,29 comments,1.5k,8 hours ago,r/StardustCrusaders,King Crimson art im really proud of
949,26 comments,872,4 hours ago,r/ATBGE,The Sultan of Swing?
950,19 comments,1.2k,6 hours ago,r/destiny2,Avarokk has some advice
951,19 comments,1.7k,8 hours ago,r/WhatsWrongWithYourDog,"So, Tommy likes to sleep like this"
952,97 comments,5.9k,7 hours ago,r/shitposting,Snap back to reality
953,7 comments,1.2k,6 hours ago,r/oddlyspecific,Horse Life
954,16 comments,1.2k,7 hours ago,r/meirl,meirl
955,10 comments,841,5 hours ago,r/EarthPorn,"Horsetail Fall, Yosemite National Park, California. February 2016. [OC] [3648x5472]"
956,22 comments,3.1k,9 hours ago,r/me_irl,me_irl
957,178 comments,570,5 hours ago,r/OutOfTheLoop,What's up with people hating on all-in-one shampoos?
958,22 comments,720,3 hours ago,r/OneSecondBeforeDisast,He’s fucked
959,19 comments,589,6 hours ago,r/thomastheplankengine,I only remember seeing this
960,19 comments,558,2 hours ago,r/pokemon,Machamp spotting Machop in bench press.
961,410 comments,1.3k,7 hours ago,r/CryptoCurrency,"The 4th largest BTC address just added a massive 43,000 BTC! This wallet has never sold a single BTC in its history and now holds almost $5BN worth"
962,16 comments,1.0k,6 hours ago,r/funnyvideos,This is very emotional
963,34 comments,883,8 hours ago,r/politecats,Polite little man asking for a bite
964,48 comments,459,4 hours ago,r/fragilecommunism,I guess I got my wings? UK lefty sub banned me for saying China isn't the hero in the whole Covid-19 pandemic.
965,4 comments,1.1k,9 hours ago,r/depression_memes,When you can't fill the void by upvoting the doggo
966,83 comments,761,4 hours ago,r/LeopardsAteMyFace,Ron DeSantis out of breath in video prompts COVID speculation
967,39 comments,1.1k,6 hours ago,r/PewdiepieSubmissions,My post were removed so I’ll try again I guess. Today marks the day of my 9 years subscription to Pewds so officially a 9 year old now
968,17 comments,601,6 hours ago,r/chuunibyou,"Yep, never task pool cleaning duty to a group of chuunibyous."
969,46 comments,1.2k,10 hours ago,r/UnexpectedlyWholesome,Dad’s are the best
970,168 comments,2.1k,9 hours ago,r/dankinindia,"Haa bhai, guroor toh hai!"
971,10 comments,580,6 hours ago,r/ImaginaryMonsters,"QiangLiang ,The Possession Armor by Tooth Wu"
972,22 comments,1.4k,7 hours ago,r/suspiciouslyspecific,All my teenage problem are cured
973,16 comments,896,8 hours ago,r/2visegrad4you,big win for poland
