,comment_count,upvote_delta,timeup_list,subreddit,thread_text
0,4.0k comments,25.2k,4 hours ago,r/antiwork,What you think of this one?
1,9.2k comments,16.4k,6 hours ago,r/AskReddit,What is a legal scam that is still happening in 2022?
2,7.9k comments,31.7k,9 hours ago,r/mildlyinteresting,These toilets are distinguished by chromosome notations rather by genders
3,4.4k comments,45.4k,9 hours ago,r/facepalm,Two cops film themselves assaulting suicidal man in hospital bed.
4,811 comments,31.2k,4 hours ago,r/funny,Once in a lifetime self-defense
5,4.1k comments,13.1k,12 hours ago,r/AskMen,"What is something you thought all men do, but turns out they don’t?"
6,3.9k comments,48.4k,14 hours ago,r/mildlyinfuriating,my roommate threw out my food to make room for her salad mixes in the fridge
7,3.4k comments,55.2k,11 hours ago,r/WhitePeopleTwitter,This shouldnt happen
8,3.1k comments,34.3k,7 hours ago,r/movies,"Jon Favreau: From a sidekick extra actor in the 1990s to one of the most innovative creators of our time, he gave us ""Iron Man,"" ""Elf,"" ""The Mandalorian"" and more"
9,774 comments,28.5k,5 hours ago,r/interestingasfuck,"Water Being Used to Project a Stop Sign in a Tunnel in Sydney, Australia"
10,831 comments,18.3k,5 hours ago,r/mildlyinteresting,This mall has a “husband depository” with massage chairs and phone chargers
11,2.6k comments,25.3k,8 hours ago,r/LifeProTips,"LPT: Stop watching movies/series you don't like. Don't feel obligated to watch them all to the end. There are too many bad movies/series out there, just start a new one or do something else."
12,2.6k comments,1.4k,7 hours ago,r/Music,"All this talk about closing songs, what’s an epic opening song from an album?"
13,2.1k comments,2.1k,7 hours ago,r/AskUK,What’s something you assumed was a universal thing but then realised from speaking to people overseas is a British thing?
14,1.3k comments,19.5k,5 hours ago,r/pics,I thought this day would never come! I am finally an American Citizen!
15,1.9k comments,8.8k,11 hours ago,r/europe,New poll: How much Germans trust other countries
16,1.3k comments,11.3k,5 hours ago,r/AdviceAnimals,Everyone knows people like this
17,1.9k comments,21.4k,9 hours ago,r/news,Antonio Brown allegedly broke COVID protocol by sneaking date into hotel - ProFootballTalk
18,1.6k comments,9.1k,15 hours ago,r/TwoXChromosomes,I Accept My Boyfriend with HSV but He Wouldn't Accept Me if I had it
19,758 comments,20.3k,7 hours ago,r/science,Foreign aid payments to highly aid-dependent countries coincide with sharp increases in bank deposits to offshore financial centers. Around 7.5% of aid appears to be captured by local elites.
20,1.4k comments,13.2k,4 hours ago,r/oddlyterrifying,"scary, deserved but painful"
21,1.7k comments,2.3k,9 hours ago,r/unitedkingdom,"META: r/Unitedkingdom is regularly cited as the worst national sub on Reddit. Why is this, and how can this be changed?"
22,239 comments,17.2k,5 hours ago,r/Damnthatsinteresting,"Aitzaz Hasan , 15 year old schoolboy , sacrificed his life to stop a suicide bomber"
23,1.7k comments,17.3k,6 hours ago,r/Superstonk,The Greatest FUD Ever Told
24,343 comments,24.6k,6 hours ago,r/wholesomememes,Kids have their privacy too
25,314 comments,7.2k,13 hours ago,r/AnarchyChess,What is a premove?
26,1.6k comments,3.2k,11 hours ago,r/CryptoCurrency,"A lot of retail investors have moved on already, they ain't gonna make it"
27,1.5k comments,32.5k,8 hours ago,r/politics,Damning Supercut Exposes Republicans Who Flip-Flopped On Trump And Jan. 6
28,1.5k comments,38.4k,9 hours ago,r/WitchesVsPatriarchy,...and why SHOULDN'T we go medieval on a rapist?
29,1.3k comments,2.3k,9 hours ago,r/Genshin_Impact_Leaks,abc64's on Yae's kit part 2
30,1.5k comments,69.1k,10 hours ago,r/nextfuckinglevel,Paragliding tandem with Good Boi
31,248 comments,8.4k,3 hours ago,r/WhitePeopleTwitter,The Covid fatalism has set in
32,1.4k comments,6.0k,15 hours ago,r/australia,"""This is Australia living with the virus... taking wickets in the virus."""
33,1.3k comments,6.6k,12 hours ago,r/confessions,I poked a hole in a condom and purposefully got a girl pregnant to prove I wasn't gay
34,1.2k comments,7.1k,5 hours ago,r/leagueoflegends,"The Call | Season 2022 Cinematic - League of Legends (ft. 2WEI, Louis Leibfried, and Edda Hayes)"
35,287 comments,7.0k,3 hours ago,r/gifs,Kazakh military joining protesters against corrupt government
36,1.4k comments,51.6k,9 hours ago,r/pics,Calvin Klein’s mom and dad (vintage and restored)
37,1.4k comments,47.8k,7 hours ago,r/MadeMeSmile,Wish me luck at my art show tonight!
38,1.3k comments,28.2k,10 hours ago,r/TIHI,"Thanks, I hate how unrealistic this is."
39,952 comments,16.5k,5 hours ago,r/HolUp,This dude was having none of his sh*t
40,1.3k comments,20.7k,15 hours ago,r/Showerthoughts,"It must suck to be a Botanist and Arborist and lose your immersion while watching a tv show or movie because you recognise all the plants and trees aren't native to the region the film/show is meant to be set in, signalling it wasn't filmed in the country it's set in."
41,1.3k comments,13.6k,7 hours ago,r/iamatotalpieceofshit,Slapping a suicidal guy twice on camera
42,1.3k comments,24.3k,17 hours ago,r/PoliticalHumor,MISSING: Ted Cruz's spine
43,1.3k comments,16.5k,8 hours ago,r/marvelstudios,Highest rated MCU films on IMDb
44,77 comments,9.1k,5 hours ago,r/WhatsWrongWithYourDog,"14 years old, on multiple meds, needs help down the stairs…but when it snows he acts like a pupper again!"
45,1.3k comments,52.7k,8 hours ago,r/todayilearned,TIL the British Hedgehog Preservation Society won a campaign in 2006 to force McDonalds to redesign their McFlurry cups due to hedgehogs repeatedly getting stuck in them and dying.
46,1.5k comments,2.3k,3 hours ago,r/terriblefacebookmemes,this is bad
47,524 comments,29.8k,6 hours ago,r/memes,This scene will always crack me up
48,1.2k comments,4.2k,12 hours ago,r/TooAfraidToAsk,I really am too aftaid to ask but is 4 liters of diet coke per day to much to drink?
49,134 comments,10.4k,4 hours ago,r/nextfuckinglevel,The joy of rescuing a stray pupper
50,1.2k comments,40.4k,9 hours ago,r/maybemaybemaybe,Maybe Maybe Maybe
51,1.2k comments,5.2k,6 hours ago,r/teenagers,"I'm finally 5'9"""
52,1.0k comments,7.6k,8 hours ago,r/HermanCainAward,Former nurse and uber Christian anti-vaxxer believed we were living in the Last Days. Turns out it was just HER last days.
53,1.1k comments,16.1k,8 hours ago,r/worldnewsvideo,to avoid traffic jams
54,1.1k comments,16.1k,8 hours ago,r/worldnewsvideo,Anti traffic hyperloop designed by Elon Musk to prevent traffic gets a traffic jam
55,888 comments,13.8k,7 hours ago,r/technology,Cyber Ninjas shutting down after judge fines Arizona audit company $50K a day
56,282 comments,18.5k,7 hours ago,r/trippinthroughtime,Answering the big questions
57,1.1k comments,14.0k,8 hours ago,r/PublicFreakout,You have no power here 🤣
58,1.0k comments,11.1k,11 hours ago,r/halo,Cross core customisation is possible. Modders achieved this with minimum effort apparently
59,345 comments,14.1k,6 hours ago,r/OnePiece,"This was a long time ago, I was studying black skin painting, so I decided to make our dear Kuma"
60,1.0k comments,8.3k,6 hours ago,r/Cringetopia,Some physical cringe
61,1.0k comments,6.3k,10 hours ago,r/gtaonline,Especially when you pvp with tryhard
62,1.0k comments,44.7k,9 hours ago,r/gaming,"My cosplay as DmC remake Dante. My apologies for not being a hot lady, but I hope this sub still likes it."
63,384 comments,7.7k,4 hours ago,r/Superstonk,CNBC just did the thing. They Claim retail just ran out of gas after the fake news was pushed by them. To try and make it sound like we are weak or slowing down . Both Carlos and this guy in the preview image were reading off paper cue cards on their desks instead of the teleprompter.
64,975 comments,12.6k,8 hours ago,r/TrueOffMyChest,My wife stopped me from killing myself last night without even knowing.
65,887 comments,52.7k,15 hours ago,r/gifs,Full send power drift.
66,907 comments,17.4k,16 hours ago,r/BeAmazed,"Marines perform boarding exercises with JETPACKS and landing on a high-speed ship. The future is now, old and young man"
67,190 comments,6.0k,4 hours ago,r/IASIP,"The perfect set up, and nobody got it"
68,802 comments,1.3k,6 hours ago,r/canada,"Alcohol can cause cancer, so why don't most Canadians know that?"
69,287 comments,12.6k,6 hours ago,r/DunderMifflin,Is this true?! I never noticed this before 💀
70,748 comments,33.1k,11 hours ago,r/Damnthatsinteresting,Nikola Tesla’a foot X-ray taken by himself on a machine he designed (1896)
71,756 comments,17.1k,16 hours ago,r/confidentlyincorrect,The epitome of confidently incorrect
72,778 comments,28.3k,15 hours ago,r/OldSchoolCool,Gary Oldman as Dracula 1992
73,710 comments,3.3k,7 hours ago,r/harrypotter,Stop telling me I don’t like Snape
74,825 comments,1.8k,8 hours ago,r/NoStupidQuestions,Do men also like receiving flowers?
75,709 comments,24.6k,17 hours ago,r/instant_regret,"When they heard the boom,boom..... they knew this was the wrong house"
76,271 comments,7.0k,4 hours ago,r/cats,My sister ordered a face mask from Amazon (left) and the photo on the right is what she received.
77,342 comments,11.2k,5 hours ago,r/Unexpected,His verse is out of this world
78,619 comments,42.9k,8 hours ago,r/aww,This Child’s reaction after being at Waterfall ….
79,119 comments,18.0k,7 hours ago,r/comics,"Pikachu, use Bubbles! [OC]"
80,372 comments,13.5k,7 hours ago,r/MovieDetails,In Batman Returns (1992) Michelle Pfeiffer put a live bird in her mouth for the scene where Catwoman threatens to eat Penguin's bird.
81,692 comments,8.0k,10 hours ago,r/MapPorn,"If you’re not sure which Germanic language you’re speaking, use this map"
82,610 comments,2.7k,7 hours ago,r/nursing,Who is going to be the one to tell everyone else healthcare in the US is collapsing?
83,324 comments,12.2k,15 hours ago,r/MaliciousCompliance,Let me go? Fine. You’ll lose millions.
84,479 comments,13.6k,12 hours ago,r/Hololive,"And with that, Okayu finishes 1st in the 2022 Hololive New Year Cup & claims the Mario Kart title!"
85,368 comments,7.3k,10 hours ago,r/Gamingcirclejerk,Average gamer in the future
86,3.4k comments,3.6k,6 hours ago,r/AskReddit,so what ya'll mad about today?
87,567 comments,7.2k,7 hours ago,r/SelfAwarewolves,Killing Gay People Isn’t Homophobic
88,3.1k comments,40.2k,9 hours ago,r/antiwork,Cause Jesus pays the bills...
89,589 comments,4.4k,12 hours ago,r/Overwatch,Suggested tweak to the max grapple time nerf for Wrecking Ball:
90,593 comments,2.9k,8 hours ago,r/explainlikeimfive,"ELI5: Why home blood tests do not exist, while we can measure our sugar levels with personal devices at home?"
91,432 comments,4.0k,11 hours ago,r/eu4,It's crazy how much Geography we can learn just by playing this game.
92,511 comments,5.5k,14 hours ago,r/holdmyfeedingtube,HMFT after I attempt the worlds first double front flip on a dirt bike
93,269 comments,4.2k,8 hours ago,r/BestofRedditorUpdates,AITA for telling my parents they only have one daughter and she is six feet in the ground.
94,595 comments,3.9k,8 hours ago,r/apexlegends,Decided to throw together a quick little suggestion for the Robot that I think would help
95,481 comments,6.7k,5 hours ago,r/tifu,TIFU by taking high dose vitamin d for over a month at night..
96,374 comments,6.7k,7 hours ago,r/Tinder,Didn’t know what to expect but was pleasantly surprised
97,527 comments,15.9k,7 hours ago,r/greentext,Don't do it bros
98,533 comments,3.9k,8 hours ago,r/worldnews,Kazakhstan internet shutdown deals blow to global bitcoin mining operation
99,388 comments,8.3k,18 hours ago,r/comicbooks,"For the “today’s comics are too political” crowd, here’s Cap being political in 1990. Daredevil #283 by Ann Nocenti"
100,482 comments,43.9k,9 hours ago,r/oddlysatisfying,Unbelievable hand and brush control by Alexander Timchenko
101,447 comments,5.1k,7 hours ago,r/Justrolledintotheshop,"Customer claims his wheel broke all by itself, wants it covered by warranty"
102,524 comments,59.2k,19 hours ago,r/KidsAreFuckingStupid,Big Jim
103,557 comments,14.0k,17 hours ago,r/VALORANT,Riot doesn’t know how to have a single original thought.
104,65 comments,13.7k,7 hours ago,r/blessedimages,Blessed_Mascot
105,110 comments,9.3k,5 hours ago,r/ShitPostCrusaders,The Rock has spoken
106,455 comments,3.5k,4 hours ago,r/Coronavirus,Omicron Isn’t Mild for the Health-Care System
107,513 comments,2.3k,6 hours ago,r/unpopularopinion,""" You have no right to speak on this"" is dumb."
108,117 comments,5.3k,4 hours ago,r/EarthPorn,"The Rock from The Goonies | Cannon Beach, OR | 3622x5023 | OC"
109,477 comments,1.5k,8 hours ago,r/de,Ampel-Koalition will Schwarzfahren entkriminalisieren
110,274 comments,32.1k,8 hours ago,r/blursedimages,Blursed_Batman
111,438 comments,961,6 hours ago,r/SubredditDrama,r/battlefield2042 mods threaten to lock the sub due to ongoing toxicity and harassment towards DICE employees. r/battlefield2042 reacts
112,227 comments,14.9k,17 hours ago,r/TikTokCringe,"new face, new Tyler"
113,213 comments,10.3k,7 hours ago,r/MurderedByWords,They'll help you get to the big words in no time.
114,82 comments,6.2k,5 hours ago,r/TikTokCringe,Long car ride
115,396 comments,18.1k,7 hours ago,r/rareinsults,Chicken has its benefits
116,364 comments,8.5k,10 hours ago,r/ShitPostCrusaders,"""they did nothing wrong "" lol"
117,166 comments,6.2k,5 hours ago,r/halo,Best Halo Infinte play of 2022?
118,612 comments,1.6k,6 hours ago,r/weed,what’s the weirdest way a plugs given you weed
119,51 comments,5.6k,5 hours ago,r/AnimalsBeingDerps,Such a goofball
120,151 comments,11.2k,6 hours ago,r/whenthe,Imagine my shock
121,469 comments,2.1k,9 hours ago,r/destiny2,Dunno if this is allowed but I made a destiny iceberg. It’s got some neat facts and if you have any questions please comment.
122,416 comments,2.4k,4 hours ago,r/SquaredCircle,"Macaulay Culkin on WWE: ""They’ve cut I think 86 wrestlers from their roster this past calendar year. So yeah, you don’t have this rich variety that you might have had before, but even then, man, it’s like how many times can we watch the same match over again?”"
123,447 comments,6.2k,6 hours ago,r/LeopardsAteMyFace,"it was dumb and sloppy... (ted cruz describes his life, food, philosophy, career and last night)"
124,242 comments,20.2k,7 hours ago,r/dankmemes,Studies show it do be like that
125,220 comments,7.7k,6 hours ago,r/ATBGE,Chicken Soup Popsicles
126,252 comments,12.4k,8 hours ago,r/Awwducational,"Red foxes are known to make a number of interaction calls. Submissive foxes will make ululating siren-like shrieks, aggressive encounters between foxes are met with ratchet-like sounds called gekkering, and tamed foxes will elicit laughter-like sounds when communicating with their human handlers."
127,294 comments,13.1k,8 hours ago,r/NatureIsFuckingLit,"🔥 This is the most beautiful corn. It is a Native American variety called ""Glass Gem Corn"" and yes it really does grow like that."
128,444 comments,1.3k,7 hours ago,r/Gunners,"Ornstein: 🚨 Arsenal pushing to sign Dusan Vlahovic this month. If 21yo leaves Fiorentina now, #AFC currently ahead based on fee/salary. Decision of striker + agent will be key. Isak & Calvert-Lewin also admired ➕ Nketiah info, other positions & more @TheAthleticUK"
129,82 comments,13.4k,8 hours ago,r/lotrmemes,The most LotR fans got from LEGO this Holiday 😢
130,272 comments,13.1k,8 hours ago,r/Catswhoyell,"Follow up on the vocal stray that meomnomnomows, here he is this morning waking up for breakfast! With 100% less giant jungle mosquitoes 🐈‍⬛❤️"
131,195 comments,7.1k,6 hours ago,r/AbsoluteUnits,This absolute fucking UNIT of a mountain goat! 🐐
132,522 comments,10.3k,8 hours ago,r/yesyesyesno,Chillin by the pool when....
133,500 comments,24.9k,11 hours ago,r/CasualUK,"Asked a guy to take a nice photo of me and my girlfriend. Our reply: “great, thank you”. As you do."
134,84 comments,11.2k,8 hours ago,r/2meirl4meirl,2meirl4meirl
135,278 comments,3.9k,10 hours ago,r/sadcringe,This.
136,462 comments,604,5 hours ago,r/Libertarian,"Elizabeth Warren blames grocery stores for high prices ""Your companies had a choice, they could have retained lower prices for consumers"". Warren said"
137,389 comments,2.8k,4 hours ago,r/nba,"Charles Barkley on Randle's thumbs down to Knicks fans: “I never understand why players think you are supposed to be cheered when you’re playing bad. You're gonna get booed when you’re playing bad… We ain't doctors or lawyers. If you play good, people cheer you. If you play bad, people boo you.”"
138,107 comments,6.4k,6 hours ago,r/BikiniBottomTwitter,It's really been that long...
139,485 comments,1.7k,5 hours ago,r/Rainbow6,Y7S1 Operator Leaked
140,524 comments,2.5k,8 hours ago,r/worldnewsvideo,Anti traffic hyperloop designed by Elon Musk to prevent traffic gets a traffic jam
141,238 comments,6.1k,7 hours ago,r/Genshin_Impact,"I'm Sorry, But... This Is Really an Issue ?"
142,270 comments,14.1k,8 hours ago,r/PrequelMemes,"Hang in there man, we all make mistakes"
143,315 comments,11.7k,8 hours ago,r/softwaregore,Hmm what should I watch?
144,176 comments,5.0k,5 hours ago,r/dndmemes,How to deal with horny bards.
145,282 comments,5.0k,5 hours ago,r/DnD,[Art] I trained an AI on the D&D Monsters and asked it to come up with it's own. This is what it made:
146,295 comments,2.4k,5 hours ago,r/ich_iel,Ich🇩🇪iel
147,99 comments,5.3k,14 hours ago,r/SCP,MTF Agents having a brief respite
148,202 comments,2.2k,8 hours ago,r/sports,Novak Djokovic will be allowed play at the French Open even if unvaccinated - France's sports minister.
149,395 comments,4.5k,6 hours ago,r/GME,WSB has become the very thing they swore to destroy... another ROBINHOOD 😭😭😭
150,334 comments,11.3k,8 hours ago,r/StarWars,"For anyone who, like me half an hour ago, didn't know this: the Gaffi Stick is based on a real thing: the totokia, the traditional weapon of Fiji."
151,226 comments,8.2k,8 hours ago,r/OldSchoolCool,"My folks wedding and reception pics - Montreal, 1969 (my mom made both her dresses)"
152,224 comments,8.4k,6 hours ago,r/pcmasterrace,Only reason i still have dvi is because my 15 year dell monitor suports 75hz
153,318 comments,5.1k,8 hours ago,r/dndmemes,"When the DM just wants you dead, you f*cking over-prepper"
154,439 comments,30.2k,15 hours ago,r/pcmasterrace,We need more
155,410 comments,2.7k,5 hours ago,r/EscapefromTarkov,The fastest gaming chair in Tarkov.
156,84 comments,9.1k,7 hours ago,r/pokemon,"Pikachu, use Bubbles! [OC]"
157,369 comments,20.6k,17 hours ago,r/BlackPeopleTwitter,"Not Twitter listing it as ""Food"""
158,568 comments,23.7k,10 hours ago,r/notinteresting,rate my setup
159,454 comments,855,7 hours ago,r/steelers,"Cbs posted Bens all time team,who would you add and replace?"
160,423 comments,4.4k,6 hours ago,r/ForzaHorizon,Could've at least had the Mastretta MXT but they didn't even bother with that...
161,666 comments,3.3k,3 hours ago,r/HermanCainAward,"D loved white people, Jesus and the Republican Party. She remained 'unjabbed' and proudly accepted her HCA this week."
162,113 comments,985,7 hours ago,r/WestSubEver,New ye photo instagram
163,384 comments,708,5 hours ago,r/fantasyfootball,CAR beat: Team would 'listen to offers' for CMC
164,129 comments,4.6k,4 hours ago,r/ProgrammerHumor,Just your regular 15 inch one
165,321 comments,4.2k,8 hours ago,r/TheRightCantMeme,One year ago…
166,368 comments,24.4k,11 hours ago,r/Minecraft,Found a screenshot from my early days... back when water could be placed in the nether
167,556 comments,10.9k,8 hours ago,r/cats,Which Julius are you today?
168,593 comments,55.7k,8 hours ago,r/funny,Mum showing the kids how it's done
169,490 comments,3.3k,5 hours ago,r/MadeMeCry,Mother cries while hugging her child as armed soldiers demolish their house in the background
170,338 comments,4.1k,6 hours ago,r/2007scape,Goodbye Barrows Gloves
171,409 comments,2.3k,9 hours ago,r/playstation,"I really hope whatever Sony comes up with, it rivals Gamepass"
172,401 comments,25.7k,14 hours ago,r/cursedcomments,cursed_death
173,332 comments,944,5 hours ago,r/CFB,Charles Barkley GUAR-AN-TEES a win for Georgia in the National Championship
174,214 comments,2.8k,8 hours ago,r/soccercirclejerk,Top 5 left wingers OFF ALL TIME
175,214 comments,7.4k,7 hours ago,r/IdiotsInCars,Welcome to new England. It snows here.
176,400 comments,3.8k,7 hours ago,r/space,"The ""mystery moon hut"" was a rock. Mystery over."
177,108 comments,4.2k,13 hours ago,r/polandball,The Best Days are Ahead of Us
178,58 comments,4.7k,6 hours ago,r/formuladank,Happy Birthday Sir Lewis Hamilton!
179,255 comments,26.5k,16 hours ago,r/AnimalsBeingDerps,Bath time
180,330 comments,3.2k,5 hours ago,r/formula1,"[CAR magazine] Audi and Porsche set to join F1 in 2026, powering McLaren and Red Bull"
181,44 comments,4.0k,4 hours ago,r/instantkarma,"If you're gonna pretend to be about that life, you better be about that life."
182,152 comments,3.8k,9 hours ago,r/HollowKnight,YESSS i got them all
183,154 comments,5.1k,13 hours ago,r/Spiderman,Possibly my favorite moment from any comic ever.
184,73 comments,5.4k,6 hours ago,r/Art,"The Scream, me, beaded pin, 2021"
185,403 comments,4.0k,5 hours ago,r/lego,"Yeah, I’m done buying Lego from Amazon"
186,288 comments,7.2k,11 hours ago,r/titanfall,People saying BT is why Jack was so strong and he fought he Apex Preds with BT but Cooper is still a one man army
187,431 comments,13.6k,9 hours ago,r/wallstreetbets,Light It Up 🎮🚀
188,124 comments,1.2k,8 hours ago,r/hungary,Neked melyik a kedvencem?
189,116 comments,7.6k,8 hours ago,r/GetMotivated,[Image] Max Planck
190,66 comments,11.5k,8 hours ago,r/WatchPeopleDieInside,Somebody is angry.
191,93 comments,13.5k,8 hours ago,r/perfectlycutscreams,That's gotta hurt
192,205 comments,3.2k,9 hours ago,r/raimimemes,"Spiderman tells Tobey, Sam and avi that they suck"
193,166 comments,6.9k,4 hours ago,r/interestingasfuck,This Persons Useless Skill
194,63 comments,7.8k,7 hours ago,r/tumblr,Kirby fan or deluded communist
195,379 comments,681,6 hours ago,r/FantasyPL,Son is injured and will not train until the international break at the end of the month.
196,1.2k comments,5.6k,5 hours ago,r/teenagers,"After you take a shower, what do you put on first after your undies? Top or trousers?"
197,60 comments,3.8k,5 hours ago,r/justneckbeardthings,This kind of fit in this sub
198,123 comments,14.5k,10 hours ago,r/Eyebleach,Employee showing where to check in
199,53 comments,5.5k,7 hours ago,r/IllegallySmolCats,dreaming of all the crimes she’ll commit when she wakes
200,187 comments,4.0k,4 hours ago,r/hmm,Hmmм
201,246 comments,14.4k,10 hours ago,r/CrappyDesign,My friends bathroom
202,212 comments,7.3k,7 hours ago,r/Minecraft,A 25-minute minecart ride in 2 minutes. Lampposts are 30 blocks apart.
203,157 comments,2.4k,6 hours ago,r/TheBoys,"'The Boys' Season 3 Teaser - June 3rd, 2022"
204,126 comments,9.0k,7 hours ago,r/technicallythetruth,Somebody that i used to knowww ....
205,18 comments,2.9k,3 hours ago,r/Bossfight,lava frog and have two stages
206,392 comments,3.8k,13 hours ago,r/BritishSuccess,"Winter in the UK: no wasps, not being woken by the sun, comforting food, not boiling to death at night"
207,92 comments,5.2k,7 hours ago,r/Chonkers,Sweetest Chonker comforting Granny in her last moments.
208,118 comments,3.5k,5 hours ago,r/HumansBeingBros,"Uber driver stranded on I-95 buys teen passenger hotel room, offered new job"
209,421 comments,31.1k,8 hours ago,r/MadeMeSmile,When Jack Black supported pregnant Angelina Jolie throughout the Kung Fu panda press tour
210,310 comments,1.7k,8 hours ago,r/ParlerWatch,Viva La Revolution!
211,322 comments,1.1k,4 hours ago,r/PS5,Update: Days Gone Sales Numbers Likely Lower Than 8 Million After Director Reveals Source Was Site That Tracks Trophies
212,485 comments,3.2k,4 hours ago,r/apexlegends,5 person squads as an event?
213,351 comments,6.5k,8 hours ago,r/ToiletPaperUSA,Oh the irony
214,336 comments,36.0k,11 hours ago,r/hmmm,hmmm
215,348 comments,6.7k,6 hours ago,r/movies,"Legendary actor Sidney Poitier, first Black man to win Best Actor Oscar, dies aged 94"
216,340 comments,5.3k,9 hours ago,r/NotHowGirlsWork,💀
217,252 comments,6.7k,10 hours ago,r/lotrmemes,I'm sorry
218,353 comments,4.8k,8 hours ago,r/Futurology,"Researchers in China say they have developed an industrial robot that can read a human co-worker’s mind with 96% accuracy. The co-worker did not need to say or do anything when they needed a tool or a component, as the robot would recognise the intention almost instantly"
219,304 comments,1.6k,3 hours ago,r/MMA,Derrick Lewis vs. Tai Tuivasa in the works for UFC 271 in Houston
220,267 comments,9.8k,10 hours ago,r/food,[Homemade] Neapolitan style sourdough pizza
221,468 comments,4.3k,7 hours ago,r/starwarsmemes,Caption This
222,316 comments,715,6 hours ago,r/Browns,[Derek Anderson] Problem is it’s been the same people writing the same story forever. Need to start over with new fresh faces in the media. Need to build a mindset that u can lose a few games and still grind out a season. Media influence on public there is large.Oh we suck again comes from them.
223,75 comments,5.6k,8 hours ago,r/Grimdank,*Organ music drop*
224,126 comments,3.2k,4 hours ago,r/Whatcouldgowrong,Assuming the pregnancy test strip as vape.
225,44 comments,8.2k,4 hours ago,r/memes,Been sitting here forever
226,82 comments,5.2k,7 hours ago,r/rarepuppers,"Every time I get up, Frankie steals my body pillow and refuses to move."
227,191 comments,5.4k,7 hours ago,r/Jokes,A French woman and a Spanish man had recently gotten married and moved to Spain.
228,175 comments,2.4k,7 hours ago,r/Marvel,"I’d be crying too if Spider-Man told me to f*@k off (Daredevil #5, Chip Zdarsky)"
229,456 comments,926,7 hours ago,r/NuxTakuSubmissions,Fefe new idea for you to steal
