,comment_count,upvote_delta,timeup_list,subreddit,thread_text
471,108 comments,1.6k,7 hours ago,r/EscapefromTarkov,"After 4 years, I finally did something cool."
472,62 comments,3.5k,9 hours ago,r/bisexual,A bi person in an opposite sex relatioship is still valid
473,72 comments,2.8k,13 hours ago,r/arknights,Ifrit all grown up (Wulifeng)
474,20 comments,1.8k,5 hours ago,r/AnimalTextGifs,Picture time!
475,131 comments,15.9k,11 hours ago,r/PrequelMemes,This is the accurate version of Jesus...change my mind
476,39 comments,1.0k,7 hours ago,r/ArtefactPorn,"The Flayed Martyr Saint Bartholomew draped in his own skin, by Marco d'Agrate in 1562, Milan Cathedral [865×1235]"
477,47 comments,798,5 hours ago,r/headphones,At least the IEMs are great
478,35 comments,3.4k,8 hours ago,r/gravityfalls,Pretty accurate
479,72 comments,1.5k,9 hours ago,r/MilitaryPorn,Paratrooper displaying the newly standard issued camo pattern and equipment of the Portuguese Army. 2021 [1080x1080]
480,71 comments,1.8k,7 hours ago,r/starwarsmemes,Finally some good character development...
481,235 comments,3.7k,7 hours ago,r/formula1,Average lap time across the whole season for every driver who participated in 2021
482,26 comments,2.3k,7 hours ago,r/Breath_of_the_Wild,[OC] Inspired by the lord of the mountain
483,39 comments,1.8k,5 hours ago,r/HistoryPorn,"German Emperor (Kaiser) Wilhelm II and Austrian Emperor Franz Joseph, posing in each other uniforms, Berlin, 1889 [1414 x 2000]"
484,75 comments,2.5k,3 hours ago,r/dankmemes,Cursed blessings
485,82 comments,1.7k,5 hours ago,r/woodworking,i’m working on my new kitchen and i have decide to put a led strip on the top of every drawer
486,78 comments,1.5k,9 hours ago,r/community,Who would win?
487,61 comments,1.3k,3 hours ago,r/thalassophobia,Jumping into the eye of darkness (OC).
488,54 comments,1.9k,9 hours ago,r/polandball,The easiest solutions are often the best
489,518 comments,6.5k,10 hours ago,r/worldnews,President Bolsonaro admitted to São Paulo hospital
490,84 comments,906,20 hours ago,r/nextfuckinglevel,This looks like just the thing for those out in the boonies!
491,84 comments,906,20 hours ago,r/nextfuckinglevel,Electric towing all terrain vehicle can do it all
492,131 comments,3.5k,13 hours ago,r/dankinindia,कृपया meme देख 🗿
493,81 comments,1.5k,7 hours ago,r/3Dprinting,You ever have a printer mess up so bad it makes ANOTHER printer fail?!
494,33 comments,800,5 hours ago,r/RoughRomanMemes,Caesar never lied…
495,90 comments,1.2k,8 hours ago,r/NationalPark,I Visited All 51 National Parks in the Lower 48 States of the USA in 9 Years
496,54 comments,3.4k,12 hours ago,r/AmongUs,I love Among Us reviews ඞ
497,88 comments,6.0k,11 hours ago,r/PeopleFuckingDying,lEmOn dEvOuRs aLl oThEr fRuIt In tHe gArDeN
498,90 comments,530,4 hours ago,r/DestinyTheGame,Spider is trading Etheric Spiral for Glimmer
499,102 comments,3.1k,8 hours ago,r/dogecoin,Crypto market explained in 13 second.
500,29 comments,716,3 hours ago,r/AskHistorians,"Westerns often depict decently-sized towns out in arid regions with little to no visible farmland. Is this purely a limitation of film budgets, or did settlements in the American west and northern Mexico in the 1800s actually generally import food rather than produce it locally?"
501,40 comments,4.1k,8 hours ago,r/Hololive,I can't miko's reaction is so hilarious
502,36 comments,936,5 hours ago,r/magicthecirclejerking,My 2-Headed Giant partner literally said what the fuck is wrong with you and left the table when I played this combo
503,66 comments,1.4k,5 hours ago,r/WhatsWrongWithYourDog,I just wanted to fold the laundry... Turn sound on
504,129 comments,3.8k,8 hours ago,r/LifeProTips,"LPT: Pay Attention to the smell of your home when you come back from a trip - that's what it smells like to guests all the time, you just get used to it."
505,38 comments,1.7k,5 hours ago,r/lgbt,1.5 years HRT. Next month I will change documents from male to female🤍
506,65 comments,3.0k,9 hours ago,r/shittyfoodporn,we luv 🍕
507,76 comments,1.2k,7 hours ago,r/DarkSouls2,Huge map of Dark Souls 2 (by me)
508,46 comments,7.6k,20 hours ago,r/MadeMeSmile,All of the good bois!!
509,46 comments,7.6k,20 hours ago,r/MadeMeSmile,All of the good bois!!
510,18 comments,4.2k,10 hours ago,r/legendofkorra,Classic dad joke
511,81 comments,6.6k,14 hours ago,r/ihadastroke,Foot cralp
512,36 comments,2.7k,6 hours ago,r/TheLastAirbender,"Since everyone loves talking about ships, here are my favorite ships."
513,50 comments,1.2k,3 hours ago,r/MemePiece,Can you still remember this scene? This was so heartwarming
514,73 comments,1.5k,5 hours ago,r/AnimalsBeingJerks,Say it to my face
515,28 comments,743,4 hours ago,r/WritingPrompts,[WP] The elder gods looks to us the same way we look to cockroachs. What means that they are irrationally scared of us.
516,54 comments,3.9k,12 hours ago,r/SweatyPalms,The best place to watch an avalanche is from.... Somewhere else.
517,100 comments,2.3k,5 hours ago,r/AnimalCrossing,Not me thinking Diva was going to give me her photo after almost 2 years
518,61 comments,899,3 hours ago,r/velvethippos,Blubird crying over hot popcorn… sound on 😂😂❤️
519,57 comments,665,3 hours ago,r/malelivingspace,Well Bois! After 5 years addiction finally got my shit together 6 months cleab..and it's fucking perfect. What style should I save up for? I want it clean and non cluttered.
520,46 comments,1.9k,9 hours ago,r/ArchitecturePorn,"Hotel Belvédère, Switzerland"
521,94 comments,1.2k,22 hours ago,r/Damnthatsinteresting,How to make cinnamon from scratch 🤯
522,94 comments,1.2k,22 hours ago,r/Damnthatsinteresting,How cinnamon is made
523,52 comments,1.5k,7 hours ago,r/dontdeadopeninside,use NEVER EVER ever BEEF. We frozen Always.
524,455 comments,1.7k,3 hours ago,r/PublicFreakout,"Cop drives with one hand at excess speed in the rain, ends up killing a pedestrian."
525,64 comments,503,2 hours ago,r/apple,Apple Becomes World's First $3 Trillion Company
526,51 comments,8.1k,12 hours ago,r/PewdiepieSubmissions,We love your A.S.S. pewds
527,71 comments,1.8k,9 hours ago,r/btd6,Won't be surprised if this is deleted
528,38 comments,2.9k,8 hours ago,r/BrandNewSentence,What's the exchange rate for a goat on shrooms?
529,46 comments,5.5k,13 hours ago,r/FuckYouKaren,Karens in a nutshell
530,54 comments,1.2k,7 hours ago,r/standupshots,Animal wisdom
531,31 comments,1.3k,4 hours ago,r/OneSecondBeforeDisast,The murdered victim takes a photo of his own killer on camera;
532,67 comments,2.6k,12 hours ago,r/ShingekiNoKyojin,"Less than one week until the next part of Season 4! To celebrate, a look at the key visuals from the seasons over the years"
533,74 comments,3.0k,5 hours ago,r/MadeMeSmile,Mr. Rogers was way ahead of his time.
534,25 comments,1.4k,4 hours ago,r/UrbanHell,"Surreal imagery in Chengde city, Hebei province"
535,70 comments,1.4k,7 hours ago,r/AnimeFunny,Ayo what kind of milk...
536,75 comments,2.3k,7 hours ago,r/gayspiderbrothel,ned
537,51 comments,828,6 hours ago,r/DemonSlayerAnime,How powerful is Agatsuma Zenitsu?
538,67 comments,4.9k,14 hours ago,r/BoneAppleTea,Machine temporarily unviable sorry for the in convince
539,17 comments,1.7k,6 hours ago,r/Im15AndThisIsYeet,I'm 15 and this is yeet
540,53 comments,2.4k,7 hours ago,r/WinStupidPrizes,never leave your hand while wheeling
541,33 comments,3.3k,7 hours ago,r/Genshin_Impact,This little hilichurl wasn't ready for 2022 to come
542,59 comments,797,6 hours ago,r/thanksimcured,Oof
543,47 comments,1.2k,6 hours ago,r/dankchristianmemes,My dating Life as a Homeschooled Christian
544,84 comments,3.6k,10 hours ago,r/drawing,My first self portrait
545,49 comments,676,3 hours ago,r/okbuddyhetero,I hate r/averageredditor I hate r/averageredditor
546,197 comments,2.8k,5 hours ago,r/mildlyinteresting,"This tanker truck driving down the highway only carries ""inedible"" blood."
547,120 comments,7.4k,7 hours ago,r/Superstonk,"Pictured here is Jeff Yass of Susquehanna, the illegal short seller."
548,62 comments,798,6 hours ago,r/Breadit,I bought a slicer
549,17 comments,4.6k,7 hours ago,r/oddlysatisfying,This 3D card from the Great Industrial Exhibition of 1851 held in London.
550,16 comments,2.3k,5 hours ago,r/perfectlycutscreams,Isle 4
551,61 comments,1.7k,9 hours ago,r/Astronomy,"JWST | Sunshield Deployed | 857,000km from Earth"
552,489 comments,23.7k,11 hours ago,r/WhitePeopleTwitter,I salute them.
553,35 comments,2.8k,8 hours ago,r/spaceporn,A towering dust devil casts a serpentine shadow over the Martian surface in this image acquired by the High Resolution Imaging Science Experiment (HiRISE) camera on NASA's Mars Reconnaissance Orbiter.
554,51 comments,1.5k,10 hours ago,r/linuxmemes,true?
555,74 comments,5.0k,11 hours ago,r/hmmm,hmmm
556,15 comments,3.9k,1 day ago,r/vexillologycirclejerk,me_irlgbt
557,15 comments,3.9k,1 day ago,r/vexillologycirclejerk,Flag of the USA but there's a star for every funny & original joke conservatives make about genders
558,57 comments,877,7 hours ago,r/Warhammer,Having a reshuffle and I found a sacred artifact
559,39 comments,3.3k,9 hours ago,r/Minecraftbuilds,Lake castle in the winter and summer
560,43 comments,3.0k,10 hours ago,r/onejob,He probably meant it
561,35 comments,747,5 hours ago,r/depression_memes,"Everyone: ok cool, now man up"
562,34 comments,788,5 hours ago,r/Kaiserreich,There is no contest here.
563,17 comments,1.8k,6 hours ago,r/lotrmemes,Made by a friend of mine (Jandrix C.)
564,58 comments,1.8k,10 hours ago,r/astrophotography,"JWST | sunshield deployed | 857,000 km from Earth"
565,50 comments,1.4k,8 hours ago,r/xqcow,These articles PepeLaugh
566,27 comments,7.7k,10 hours ago,r/antimeme,Which one is your teacher?
567,80 comments,869,4 hours ago,r/lego,Anyone remember Heroica?
568,83 comments,1.0k,4 hours ago,r/trans,[She/her] Dysphoria has been kicking my butt lately. Am I passing? Do I need to change something? :(
569,16 comments,1.7k,7 hours ago,r/disneyvacation,How to react when he tells you he plays League of Legends
570,10 comments,2.0k,7 hours ago,r/NintendoMemes,Who else but Nintendo
571,40 comments,1.1k,7 hours ago,r/environment,Powerful Methane Cloud Seen by Satellite Came From Georgia Natural Gas Pipeline: Williams Cos. admits it was an intentional release
572,37 comments,5.3k,7 hours ago,r/whenthe,I lost.
573,277 comments,7.5k,6 hours ago,r/HolUp,I have to change grandmas diaper again 😏
574,30 comments,896,7 hours ago,r/EverythingScience,Noblewoman’s tomb reveals new secrets of ancient Rome’s highly durable concrete
575,63 comments,575,5 hours ago,r/teslamotors,"Tesla was Norways #1 top selling car brand of any type in 2021(33% more than 2nd place), with M3 and MY as #1 and #4 most sold models respectively"
576,52 comments,3.4k,12 hours ago,r/vexillology,Belgian-Dutch Union in the style of Seychelles
577,70 comments,1.3k,8 hours ago,r/Sims4,I built Haven from Dragon Age Inquisition.
578,524 comments,1.3k,4 hours ago,r/TooAfraidToAsk,Men of Reddit: Do you look at other women despite having a significant other and loving/being loyal to them?
579,397 comments,10.3k,10 hours ago,r/Damnthatsinteresting,This student pilot loses engine and still manages to land in a field!
580,58 comments,1.8k,9 hours ago,r/shieldbro,Always listen to your brain
581,37 comments,1.7k,6 hours ago,r/RoomPorn,"Renovated master bath in the attic space of a 1912 Craftsman house, Wallingford, Seattle, Washington [1500x2000]"
582,44 comments,914,4 hours ago,r/thelastofus,When You're Fed Up Being Ambushed
583,54 comments,2.7k,12 hours ago,r/CloneWarsMemes,"I've definietly forgor about some good episodes, there are just too many"
584,50 comments,4.5k,12 hours ago,r/animememes,"FINALLY, TWO PIECE"
585,39 comments,1.1k,4 hours ago,r/OnePunchMan,I hope your disaster levels are high
586,24 comments,1.4k,5 hours ago,r/reactiongifs,MRW I’m preparing to board my Southwest flight with no assigned seat
587,29 comments,3.8k,12 hours ago,r/FUCKYOUINPARTICULAR,"Fuck you, Becky"
588,30 comments,Vote,2 hours ago,r/OutOfTheLoop,What's the deal with Ceddit and Removeddit? Why are they gone?
589,103 comments,10.3k,9 hours ago,r/nextfuckinglevel,Guy stops two moving bottles with a single arrow at the exact moment from a far distance.
590,23 comments,2.1k,13 hours ago,r/Unexpected,Hey its your uber driver here
591,23 comments,2.1k,13 hours ago,r/Unexpected,Hey its your uber driver here
592,59 comments,1.1k,5 hours ago,r/Gunners,Whoever comes in permanently this transfer window I beg that we stick to the new script [OC]
593,59 comments,1.8k,9 hours ago,r/SupermodelCats,My cat thinks she’s the most important thing ever
594,42 comments,550,3 hours ago,r/brandonherrara,MiNi 14
595,75 comments,3.7k,12 hours ago,r/MemeVideos,have a good one boys
596,46 comments,2.7k,10 hours ago,r/itookapicture,ITAP of singer Katie Koss [MLM]
597,61 comments,977,7 hours ago,r/pcgaming,Iratus: Lord of the Dead is free to claim on GOG this week
598,55 comments,989,3 hours ago,r/BrandNewSentence,I prefer shuffle
599,19 comments,1.5k,3 hours ago,r/AnimalsBeingJerks,Such a beautiful exchange
600,46 comments,1.8k,9 hours ago,r/Simulated,Spread-eagle
601,43 comments,822,6 hours ago,r/StrangerThings,"ǝʇɐp ǝsɐǝןǝɹ ʍouʞ ʇ,uop ןןıʇs ǝʍ pu∀"
602,8 comments,1.0k,3 hours ago,r/PetsareAmazing,Studying Together!
603,8 comments,1.0k,3 hours ago,r/PetsareAmazing,Studying Together!
604,546 comments,2.9k,5 hours ago,r/gaming,Who should be Kratos in a movie?
605,562 comments,1.9k,7 hours ago,r/CFB,SEC Shorts - Georgia begs for help from teams that beat Alabama
606,49 comments,1.2k,7 hours ago,r/Justfuckmyshitup,…
607,36 comments,1.1k,4 hours ago,r/civ,I forget everything I have as soon as I open this...
608,181 comments,3.1k,5 hours ago,r/shitposting,What’s your favorite?
609,24 comments,1.2k,6 hours ago,r/mapporncirclejerk,Places I've had sex
610,16 comments,1.7k,6 hours ago,r/Konosuba,Google is everywhere
611,39 comments,715,3 hours ago,r/confusing_perspective,Wait.... what?
612,14 comments,2.2k,7 hours ago,r/dankvideos,Racism bad
613,42 comments,3.1k,4 hours ago,r/facepalm,Should’ve named it add profile with +sign
614,50 comments,1.3k,8 hours ago,r/minipainting,"First mini of 2022, the baby beholder"
615,430 comments,5.1k,9 hours ago,r/PoliticalHumor,"Is it just me, or is the GOP running a ventriloquist dummy against Fetterman in PA?"
616,26 comments,1.1k,3 hours ago,r/niceguys,SatireI feel like this fits a lot of the posts here
617,28 comments,1.1k,5 hours ago,r/playboicarti,Juice WRLD sub discovers math
618,35 comments,1.9k,11 hours ago,r/masseffect,The Suicide Squad by Lap Pun Cheung
619,72 comments,3.2k,6 hours ago,r/interestingasfuck,Shorea Siamensis seeds falling
620,38 comments,1.2k,6 hours ago,r/bindingofisaac,Beast has skill issue
621,373 comments,9.7k,8 hours ago,r/antiwork,"Thought you might enjoy this one, sorry it has been posted before"
622,193 comments,6.5k,11 hours ago,r/CasualUK,Stay classy Portsmouth... the photo says it all
623,19 comments,1.5k,7 hours ago,r/futurama,We must fly to Rome and exhume the body of Saint James!
624,46 comments,864,5 hours ago,r/Rabbits,UEGENT: my bunny is having the surgery (spaying) that my last bunny never woke up from please give her good thoughts
625,33 comments,597,4 hours ago,r/FireEmblemHeroes,These suicidal mfs need therapy.
626,58 comments,1.1k,6 hours ago,r/RocketLeague,it was MY fault
627,32 comments,7.7k,14 hours ago,r/AnimalsBeingBros,One of my strays being a literal bro
628,61 comments,15.1k,10 hours ago,r/me_irl,me_irl
629,51 comments,1.2k,6 hours ago,r/GaySoundsShitposts,"nothing here, i'm just sad"
630,64 comments,6.3k,6 hours ago,r/memes,Pocket sand![OC]
631,47 comments,1.9k,7 hours ago,r/creepy,"Angels aren’t the only ones with haloes, me"
632,45 comments,3.9k,20 hours ago,r/MadeMeSmile,This sheet
633,45 comments,3.9k,20 hours ago,r/MadeMeSmile,Oh the frustration this could’ve saved me..
634,60 comments,3.7k,14 hours ago,r/pokemongo,I finally did it!
635,1.1k comments,2.7k,7 hours ago,r/NoStupidQuestions,Would I be able to win a fight with a Silverback Gorilla if I had a baseball bat?
636,42 comments,1.3k,9 hours ago,r/Apandah,"Fun fact: you can do this with: Kung fu panda (TV series), Monster vs Alien (TV series) and the garfield show"
637,28 comments,1.4k,6 hours ago,r/standardissuecat,Spicy SIC kittens I'm working on socializing. Their names are Rose and Dorothy.
638,43 comments,633,4 hours ago,r/HunterXHunter,I was commissioned to make a figure of Pitou and here’s it completed :)
639,43 comments,887,4 hours ago,r/happy,"Growing up, I'd always been insecure about my hair color since I get it from my mom, who I've never known, and would always dye it black, my dad's color. Now I've gone a whole year without doing so and feel beautiful"
640,23 comments,896,6 hours ago,r/stevenuniverse,Stuff that definitely happened while Steven wasn't there - Part 1
641,316 comments,25.6k,15 hours ago,r/aww,The last picture of Hand Banana before he surprise licked me in the face. You can see his intent.
642,41 comments,1.1k,4 hours ago,r/FoodPorn,My fiancé made this incredible rose style apple pie. It's as delicious as it looks and I had to show it off.
643,60 comments,2.0k,7 hours ago,r/AnarchyChess,A game I played against my little brother - he doesn't know the rules
644,38 comments,1.1k,7 hours ago,r/peopleofwalmart,first day as a cart pusher and i already love the job
645,51 comments,1.2k,6 hours ago,r/HermitCraft,I designed a Hermitcraft Season 8 Lego Minifigures Series...
646,99 comments,6.0k,12 hours ago,r/Animemes,RIP little one
647,45 comments,893,5 hours ago,r/Instantregret,There's something called recoil
648,51 comments,648,5 hours ago,r/CallOfDuty,The best COD mission to ever exist [MW]
649,48 comments,1.4k,7 hours ago,r/IndoorGarden,'Variegated Monstera' leaf Stained glass mirror that I made. 💚
650,54 comments,3.9k,14 hours ago,r/Angryupvote,took me a sec.. 🤦
651,6 comments,2.1k,8 hours ago,r/fakehistoryporn,Empress-Regnant Wu Zetian and her male concubines celebrate a military victory against the Khitan Rebellion (697 CE)
652,139 comments,2.4k,9 hours ago,r/StardewValley,i finally realized that i can't casually speedrun this game without automation.
653,13 comments,1.5k,6 hours ago,r/imsorryjon,"All of you keep making more faces for me , Jon..."
654,10 comments,1.4k,6 hours ago,r/MostBeautiful,"Stone cottage in Bignasco, a small village in Vallemaggia District, canton of Ticino, Switzerland."
655,24 comments,2.3k,10 hours ago,r/fixedbytheduet,Me in six
656,89 comments,3.9k,9 hours ago,r/gtaonline,He had a bad day at work maybe..
657,41 comments,1.2k,7 hours ago,r/softwaregore,The McDonald's app is just plain broken
658,42 comments,1.4k,9 hours ago,r/scottthewoz,Donkey kong
659,21 comments,1.3k,5 hours ago,r/Rainbow6,"""What's that noise? Guys? OH FU-"""
660,25 comments,3.7k,13 hours ago,r/tf2shitposterclub,Heavy
661,26 comments,1.1k,7 hours ago,r/PERSoNA,Yukari.
662,52 comments,2.9k,10 hours ago,r/hmm,Hmmm
663,39 comments,3.5k,11 hours ago,r/blursed_videos,Blursed Zombie
664,12 comments,1.0k,4 hours ago,r/forbiddensnacks,Forbidden lettuce wrap
665,54 comments,2.3k,4 hours ago,r/PrequelMemes,must have missed this clone wars episode
666,38 comments,1.2k,5 hours ago,r/tattoos,"Amazing Berserk Tattoo i got from Maria @ Ministry of Ink in Mannheim, Germany"
667,27 comments,908,4 hours ago,r/Breath_of_the_Wild,"BotW Fans, when BotW2 comes out:"
668,81 comments,2.8k,8 hours ago,r/maybemaybemaybe,Maybe maybe maybe
669,43 comments,670,3 hours ago,r/seniorkitties,"A month ago we wished him a happy 21st birthday, we take him to his last vet visit today. I'll miss you James."
670,12 comments,1.3k,6 hours ago,r/SkweezyJibbs,IF YA THINK ABOUT IT FOR MORE THAN LIKE 20 SECONDS ITS MESSED UP
671,498 comments,19.6k,15 hours ago,r/news,Man Kidnapped as a Child in China Reunited with Family After Drawing a Map of Home Village from Memory
672,36 comments,1.4k,4 hours ago,r/IllegallySmolCats,"Luna has been busy growing, also it's a boy! 😁"
673,33 comments,1.8k,8 hours ago,r/biology,videoStriated Heron using a dead bug for fishing
674,45 comments,1.3k,7 hours ago,r/BokuNoHeroAcademia,"Bakugo in my style, hope you like it! (Swipe for more)"
675,23 comments,1.8k,9 hours ago,r/arcane,[No spoilers] Hey at least it seems to work for her
676,33 comments,1.5k,8 hours ago,r/BokuNoMetaAcademia,I even got my dad hurt yesterday because of this
677,25 comments,1.9k,11 hours ago,r/agedlikemilk,Aunt in law sent these yesterday- gonna be the best year ever!
678,42 comments,2.2k,12 hours ago,r/surrealmemes,We are all Ş̴̧͚̹̻̗͎͔̰̙̙͔͎̖̙̈́̏̽̓̀̽́̑̋̈́́̌̑̀́͊͆̅̉̔͛̊̊͊͌̃̓͌̀͑̓̈́͊̐͊̓̔̒̈͛́̈́͗̂͂̿́̑̉́̊̓̀̎͘̕͘͜͠͠͝á̷̢̡̛̗͉̼͙̮̙̺̜͖̼͚̹̪̪͖̞̯͔̳̲͉͙̫̠̹̘̘̟̜̰̰̩̘̤̯͉̻̀͆͂͋̈̐̋̈́͌̀͆̋̾̄́͌̿͌̈́̇̀̆͆̊̆̃̓̍̈́̒̂̑̃͒͒̈͋̂̏̌̿͜͜͝͝͝ͅt̶̯̪̹̝̙̟̲̖̼̏̎a̴̢̡̢̨̡̛̛̙̹͇̤̪̫̞̰̦̫̠̬͓͇̖̜̜̺̥̲͚̞̫̯͔͓̞̤̪̰̣͙͚̳̻͚̗̙̲̭̹̤̎̾̅̄̏̽̓͐́̃̈̽̅͆̔̋̃͋̇̈̿̒͑̀̑̔̌̏̑̚ͅń̷̃͑̏̿̋͗̎̆̌̽̃͌̇͂̒̂́̽̇̓͘͘͝
679,40 comments,563,4 hours ago,r/MURICA,I drew some US-States. Doing all 50 is quite a challenge.
680,11 comments,1.2k,9 hours ago,r/HaloMemes,I can't bring myself to destroy the last tower. I will miss him too much.
681,7 comments,1.1k,10 hours ago,r/teenagers,We do not care
682,7 comments,1.1k,10 hours ago,r/teenagers,We do not care
683,17 comments,1.4k,6 hours ago,r/HollowKnightMemes,Well your lewd all over R34 so that makes you horny
684,32 comments,552,4 hours ago,r/autism,My parents told me not to mention being autistic in my college applications because I “wouldn’t get in.” They were wrong.
685,26 comments,1.2k,7 hours ago,r/notmycat,UPDATE: Built not-my-cat a home on the terrace
686,90 comments,6.9k,7 hours ago,r/dankmemes,We are all gonna die
687,31 comments,1.0k,5 hours ago,r/Baking,Little goodies
688,19 comments,2.7k,10 hours ago,r/adhdmeme,It's true.
689,696 comments,7.4k,9 hours ago,r/politics,6 in 10 Americans say U.S. democracy is in crisis as the 'big lie' takes root
690,122 comments,3.0k,8 hours ago,r/pcmasterrace,Reviews of gaming setups
691,33 comments,2.4k,11 hours ago,r/WhatsWrongWithYourCat,Cats show what they think about newly installed blinds
692,238 comments,11.7k,9 hours ago,r/Unexpected,"'dad, I am running away!'"
693,21 comments,872,5 hours ago,r/SkyrimMemes,Poor PartySnax
694,36 comments,1.4k,8 hours ago,r/InsanePeopleQuora,I found this one today and my 2022 is already ruined
695,27 comments,4.0k,13 hours ago,r/thisismylifenow,I'm stuck with this chick forever...
696,24 comments,1.8k,10 hours ago,r/teefies,Luna’s Teefies
697,32 comments,1.4k,9 hours ago,r/PerfectlyCutBooms,Not really a boom but a shot
698,27 comments,1.5k,8 hours ago,r/blender,KUNG FU PANDA PETALS
699,29 comments,1.1k,7 hours ago,r/aaaaaaacccccccce,😩
700,11 comments,1.3k,4 hours ago,r/AnimalsBeingDerps,Silly kitty giving my bun stealthy boops while I clean the shelter<3 busted at the end!!!
701,28 comments,2.1k,8 hours ago,r/EarthPorn,The Icicle River near Leavenworth [OC] [2079x1248]
702,38 comments,1.2k,8 hours ago,r/TILI,"Thanks, I love hating on hating Thanks, I love it"
703,98 comments,1.7k,2 hours ago,r/funny,It's that time of the year again...
704,30 comments,1.4k,8 hours ago,r/Re_Zero,[Media] Subaru and Satella
705,24 comments,684,23 hours ago,r/PublicFreakout,She thought it was grass:
706,24 comments,684,23 hours ago,r/PublicFreakout,She thought it was grass:
707,240 comments,18.9k,9 hours ago,r/HolUp,Hang on…
708,31 comments,1.5k,4 hours ago,r/ShitPostCrusaders,Bruh
709,25 comments,1.1k,5 hours ago,r/animalsdoingstuff,-Come out -Come in
710,914 comments,6.0k,5 hours ago,r/animalsdoingstuff,Geopolitics is your sandbox
711,18 comments,2.6k,11 hours ago,r/lotr,Minas Tirith & Aragorn oil painting on canvas by me
712,23 comments,1.7k,10 hours ago,r/wholesome,Friendly reminder :))
713,14 comments,Vote,2 hours ago,r/thanosdidnothingwrong,They hate each other
714,20 comments,757,5 hours ago,r/onguardforthee,Workplace reminds you mental health comes first unless it impedes productivity
715,23 comments,842,5 hours ago,r/AmateurRoomPorn,Eclectic-styled bedroom in Massachusetts
716,11 comments,721,5 hours ago,r/KendrickLamar,I'm starting to think Kendrick was really just using the phone here and nothing else
717,17 comments,1.3k,1 day ago,r/GreenAndPleasant,"If I see one more article pitying Ghislaine Maxwell, I will become the joker"
718,17 comments,1.3k,1 day ago,r/GreenAndPleasant,"If I see one more article pitying Ghislaine Maxwell, I will become the joker"
719,27 comments,1.3k,7 hours ago,r/Eldenring,Rise from your slumber bois!!! It's 2022!!
720,27 comments,1.5k,7 hours ago,r/ComedyCemetery,No I won't delete this
721,125 comments,1.8k,2 hours ago,r/MadeMeSmile,Our imperfections are what makes us human
722,16 comments,890,5 hours ago,r/Kanye,We off the grid grid grid
723,22 comments,2.1k,9 hours ago,r/dontflinch,Breaking a stick
724,20 comments,707,5 hours ago,r/BoJackHorseman,Ophelia/Sarah Lynn
725,17 comments,1.4k,20 hours ago,r/MadeMeSmile,All of the good bois!!
726,17 comments,1.4k,20 hours ago,r/MadeMeSmile,All of the good bois!!
727,24 comments,1.2k,7 hours ago,r/Naturewasmetal,"Megaloceros giganteus (& Turdus merula) in Eemian Jutland. The newest finds from Denmark are from ~12000 years ago, but apparently it survived well into the Holocene in the Urals."
728,14 comments,868,7 hours ago,r/esist,Exactly
729,24 comments,720,3 hours ago,r/Megumin,Yes
730,22 comments,1.7k,10 hours ago,r/Outdoors,Winter landscapes of Lapland
731,22 comments,646,5 hours ago,r/chuunibyou,The confession
732,22 comments,1.2k,5 hours ago,r/Helltaker,You know what to do
733,22 comments,831,7 hours ago,r/pitbulls,Meatball hard at work
