,comment_count,upvote_delta,timeup_list,subreddit,thread_text
0,15.4k comments,29.1k,16 hours ago,r/AskReddit,What science fiction or fantasy show is worth watching?
1,7.7k comments,39.6k,9 hours ago,r/gaming,What are some examples of truly great DLC?
2,4.3k comments,21.4k,10 hours ago,r/PublicFreakout,Women trying to stop the demolition of their home as armed soldiers try to enforce it
3,455 comments,14.8k,4 hours ago,r/space,James Webb Space Telescope’s Specialized Heat Radiator Deployed Successfully
4,3.9k comments,31.2k,7 hours ago,r/politics,Ron DeSantis Out of Breath in Video Prompts COVID Speculation
5,2.9k comments,19.7k,7 hours ago,r/fuckcars,Lol. Elon Musk's Boring company has traffic jams. I was told it was impossible.
6,520 comments,29.9k,5 hours ago,r/FuckYouKaren,Triggered by a 9 yrold
7,685 comments,46.6k,5 hours ago,r/Damnthatsinteresting,Australian farmer couldn’t attend his aunts funeral so he laid out grain in the shape of a heart so “she can see it through the clouds”
8,2.3k comments,8.2k,17 hours ago,r/apple,Staggering: 87% of U.S. teenagers have iPhones
9,1.4k comments,16.4k,5 hours ago,r/politics,Biden slams Trump for watching TV during Capitol insurrection: He was ‘doing nothing as police were assaulted’
10,1.8k comments,49.0k,6 hours ago,r/MurderedByWords,That's because Australia isn't real
11,484 comments,26.1k,5 hours ago,r/MadeMeSmile,I agree
12,2.2k comments,54.9k,11 hours ago,r/WhitePeopleTwitter,"“All these billionaires, yet no solutions”"
13,2.0k comments,4.0k,6 hours ago,r/TwoXChromosomes,"A guy declined sex because I don’t shave down there, feeling a bit sad and self-conscious now"
14,2.0k comments,5.3k,14 hours ago,r/CryptoCurrency,"I can't be the only one who thinks that most of the ""Buy the dip"" dudes are full of shit."
15,192 comments,15.8k,5 hours ago,r/NatureIsFuckingLit,"🔥 Clouded leopard spotted in Nagaland, India"
16,86 comments,21.0k,5 hours ago,r/technicallythetruth,I love the sense of humor!
17,1.8k comments,34.0k,14 hours ago,r/lotrmemes,"The society's precious. They stoles it they did. Liars, tricksies they are."
18,1.9k comments,55.4k,8 hours ago,r/nextfuckinglevel,Homeless man gets a free makeover!
19,608 comments,9.0k,4 hours ago,r/marvelstudios,Rewatching some D+ shows and I don’t think anything tops how unnerving this moment was when it first aired
20,1.7k comments,16.9k,15 hours ago,r/nba,[Highlight] Kyle Lowry is ejected for his 2nd technical after the “disgusting act” of passing the referee the ball
21,1.7k comments,26.8k,16 hours ago,r/iamatotalpieceofshit,"Predator trying to hook up with girl half his age (Chicago, IL)"
22,1.9k comments,10.2k,6 hours ago,r/nottheonion,St. Louis couple who waved guns at protesters want weapons back
23,779 comments,35.0k,6 hours ago,r/dankmemes,What have they done
24,1.7k comments,20.5k,15 hours ago,r/TrueOffMyChest,"Very few months to live, I'm scared of death"
25,759 comments,20.8k,7 hours ago,r/worldnews,Philippines bans child marriage
26,238 comments,Vote,7 hours ago,r/worldnews,"[PSA] We want your track driving Pro Tips, Reddit. Comment with your best technical tip for some gold, and a chance for your maneuver to be demonstrated by a Toyota Motorsport driver in the all new GR86."
27,1.6k comments,39.3k,14 hours ago,r/LifeProTips,"LPT: If you are in your mid to late 20’s make a habit of strengthening your back, hips, and legs."
28,1.5k comments,19.0k,14 hours ago,r/pics,"America, one year ago today"
29,539 comments,11.2k,4 hours ago,r/raimimemes,Somebody needs to remove some dirt from his eye.. No one hates him for Spiderman 3..we love him
30,1.6k comments,25.2k,6 hours ago,r/funny,Behold the magic stick
31,1.5k comments,27.3k,8 hours ago,r/awfuleverything,don't make anyone your relationship goals
32,1.5k comments,45.3k,20 hours ago,r/OldSchoolCool,In honor of my 60th birthday. Here’s me circa 1982. Everything old is new again. High wasted is back ladies!
33,216 comments,11.8k,5 hours ago,r/therewasanattempt,to jump to the water
34,1.4k comments,5.6k,11 hours ago,r/teenagers,Guess this good boys name and you will get my free award. Hint: It’s a three letter name
35,202 comments,16.6k,6 hours ago,r/GetMotivated,[Image] Be proud of yourself:)
36,1.3k comments,11.1k,13 hours ago,r/Tinder,Well.... that escalated quickly.
37,1.2k comments,44.1k,11 hours ago,r/antiwork,'Not worth it'
38,68 comments,8.2k,3 hours ago,r/WatchPeopleDieInside,Dog judges cat.
39,1.2k comments,7.5k,4 hours ago,r/movies,‘Encanto’s’ ‘We Don’t Talk About Bruno’ Is Topping the Charts. So Why Didn’t Disney Submit It for Oscars?
40,1.2k comments,57.5k,9 hours ago,r/Unexpected,Yoga
41,518 comments,26.4k,7 hours ago,r/antiwork,Dear CEOs:
42,1.2k comments,5.0k,7 hours ago,r/halo,"This subreddit has gotten so deluded, that we're actually comparing Halo Infinite's campaign to CYBERPUNK."
43,1.1k comments,34.4k,9 hours ago,r/JusticeServed,"Waiter serves some nice, fresh justice"
44,632 comments,3.3k,5 hours ago,r/ich_iel,Ich🥙iel
45,1.1k comments,2.0k,11 hours ago,r/buildapc,Am i getting scammed by my coworker
46,415 comments,16.9k,5 hours ago,r/Minecraft,The frogs can eat goats.
47,537 comments,44.9k,7 hours ago,r/Eyebleach,Man creates “stick library” for dog park.
48,1.1k comments,19.5k,11 hours ago,r/Wellthatsucks,A coworker tried to sharpen my good kitchen knifes with an angle grinder.
49,1.2k comments,25.6k,11 hours ago,r/pcmasterrace,i need to go outside
50,1.0k comments,5.3k,7 hours ago,r/sports,‘It’s the only way to stop this pandemic’: Nadal backs the rules that stopped Djokovic
51,975 comments,14.1k,13 hours ago,r/Cringetopia,Good lord why
52,999 comments,19.4k,7 hours ago,r/mildlyinfuriating,The keyboard passed down to me by the previous technician that I have to use
53,936 comments,3.2k,6 hours ago,r/JoeRogan,Some of you need to stop your simping
54,90 comments,28.2k,7 hours ago,r/wholesomememes,you have saved our lives. we are eternally grateful!
55,824 comments,31.3k,14 hours ago,r/MovieDetails,"In Die Hard (1988), the scene where Uli pockets a candy bar was improvised by actor and stuntman Al Leong. Writer Steven de Souza said “That assured him a longer life. I was killing somebody every eight or 10 pages but that moment made him interesting. He's one of the last guys to die.”"
56,233 comments,9.4k,5 hours ago,r/WhitePeopleTwitter,And I get angry at memes that target me like this
57,800 comments,10.8k,14 hours ago,r/europe,The statue to Kazakhstan’s first president (1990-2019) and until a few hours ago head of the Security Council (1991-2022) Nazarbayev is down in Almaty region.
58,552 comments,24.8k,7 hours ago,r/interestingasfuck,"This crystal I grew looks like a green rupee. It's called potassium ferrioxalate, and it took a month to grow."
59,1.0k comments,4.3k,5 hours ago,r/BikiniBottomTwitter,Write down 'spongebob' in your language.
60,995 comments,11.1k,8 hours ago,r/blessedimages,"Blessed dinosaurs, take a break today"
61,236 comments,17.6k,16 hours ago,r/CapitolConsequences,My Dad Attacked Cops at the Capitol Riot. I Turned Him In.
62,257 comments,11.1k,5 hours ago,r/dndmemes,Murderhobo Paladins are really just Oathbreakers in denial
63,843 comments,6.3k,8 hours ago,r/wallstreetbets,We’re in a bubble folks
64,776 comments,2.5k,11 hours ago,r/ufc,Sean Strickland knocks out sparring partner
65,928 comments,14.3k,8 hours ago,r/shitposting,🥺 cock chemk
66,811 comments,6.8k,9 hours ago,r/Genshin_Impact,What if.....Just what if!!! What weapon Would you pick? (Created by me!) (You can use even without permission but dont spread false info!♡)
67,239 comments,Vote,9 hours ago,r/Genshin_Impact,"[PSA] We want your track driving Pro Tips, Reddit. Comment with your best technical tip for some gold, and a chance for your maneuver to be demonstrated by a Toyota Motorsport driver in the all new GR86."
68,491 comments,14.0k,6 hours ago,r/WitchesVsPatriarchy,Women owning time as a construct
69,748 comments,12.4k,15 hours ago,r/gadgets,"Amazon improperly collects and stores consumers’ biometric data through its Alexa voice-based virtual assistant devices, a new class action lawsuit alleges"
70,415 comments,10.3k,4 hours ago,r/Unexpected,"Surely, it helps"
71,753 comments,3.4k,4 hours ago,r/HermanCainAward,Antivax Crusader Red earns a HCA
72,71 comments,7.9k,5 hours ago,r/ToiletPaperUSA,.
73,851 comments,14.8k,7 hours ago,r/pics,The Confederate flag made it deeper into Washington on 1/6/21 than it did during the Civil War
74,796 comments,75.5k,12 hours ago,r/memes,The struggle is real
75,581 comments,8.7k,16 hours ago,r/LivestreamFail,Gordon Ramsay throwing shade on people streaming his shows on Twitch
76,839 comments,9.9k,7 hours ago,r/meme,Can't we just remove them all? Please!?
77,724 comments,935,5 hours ago,r/harrypotter,"If we got a Harry Potter spin-off show that wasn’t about the Marauders, what would you like the show to be based on?"
78,661 comments,10.4k,1 day ago,r/Unexpected,WCGW Just dropping off some groceries
79,661 comments,10.4k,1 day ago,r/Unexpected,Just dropping off some groceries
80,478 comments,9.4k,5 hours ago,r/Superstonk,Dear superstonkers
81,776 comments,5.9k,10 hours ago,r/unpopularopinion,I don’t like Nutella.
82,645 comments,15.9k,18 hours ago,r/LeopardsAteMyFace,"An Arizona GOP senate candidate challenges Trump to a debate, calls him a little bitch, and burns his MAGA hat with a flamethrower"
83,120 comments,15.8k,6 hours ago,r/HolUp,A Classic!
84,83 comments,9.2k,5 hours ago,r/greentext,Watch out for the hobgoblin
85,100 comments,6.5k,5 hours ago,r/PoliticalHumor,Happy January 6 Biden is still your president
86,337 comments,14.5k,7 hours ago,r/facepalm,"Hmm, funny that."
87,641 comments,1.1k,3 hours ago,r/videos,Q Shaman Prison Interview
88,322 comments,9.3k,6 hours ago,r/Animemes,What have they done
89,640 comments,2.7k,12 hours ago,r/Philippines,Don't you just hate it when Fil-Ams...
90,313 comments,7.2k,11 hours ago,r/LeagueOfMemes,"If you know, you know"
91,655 comments,2.5k,7 hours ago,r/PS4,"Days Gone Director Says It Outsold Ghost of Tsushima, But Was Treated Like a 'Disappointment' By Management"
92,409 comments,49.4k,9 hours ago,r/me_irl,Me_irl
93,382 comments,14.5k,6 hours ago,r/funnyvideos,gordon ramsay with kids vs adults
94,712 comments,42.3k,14 hours ago,r/blackmagicfuckery,How’s this even possible?!
95,611 comments,14.8k,7 hours ago,r/cats,"After a year of feeding, spoiling and small cautious head pats, she has finally adopted me. Help me name this sweet thing"
96,560 comments,17.7k,12 hours ago,r/PrequelMemes,"Ok, honest question. Who would have gone to see this movie?"
97,159 comments,10.4k,7 hours ago,r/StartledCats,cat was gearing up to hit LIGHTSPEED
98,79 comments,4.8k,4 hours ago,r/ProgrammerHumor,You should test your code for EVERY browser
99,220 comments,36.3k,9 hours ago,r/aww,"Those eyes, my god."
100,201 comments,6.3k,5 hours ago,r/sadcringe,Found this tell me if it's a repost
101,77 comments,8.1k,7 hours ago,r/TikTokCringe,Random villager going to bed after a day’s work
102,650 comments,1.9k,10 hours ago,r/EscapefromTarkov,how is it possible that there are people like this who are not getting instabanned?
103,87 comments,8.8k,5 hours ago,r/rareinsults,That must make life fun
104,609 comments,24.1k,16 hours ago,r/Spiderman,The moment they truly became Spider-Man
105,509 comments,23.6k,9 hours ago,r/PrequelMemes,Always bugged me a little
106,311 comments,5.5k,5 hours ago,r/Tinder,Is this prompt funny or am I an idiot?
107,523 comments,4.1k,12 hours ago,r/tennis,"Rafael Nadal's full answer today on Djokovic's situation. ""From my point of view, the only thing that I can say is I believe in what the people who knows about medicine says, and if the people says that we need to get vaccinated, we need to get the vaccine."""
108,108 comments,7.4k,6 hours ago,r/oddlysatisfying,The way this camera operator perfectly zooms in on the ball
109,642 comments,5.9k,5 hours ago,r/Spiderman,What do y'all think?
110,165 comments,24.5k,8 hours ago,r/cursedcomments,Cursed_Funeral
111,342 comments,7.0k,14 hours ago,r/WitchesVsPatriarchy,"My husband, the ally"
112,130 comments,7.4k,7 hours ago,r/comics,Great
113,641 comments,6.5k,6 hours ago,r/skyrim,"In your opinion, what is the most gorgeous looking weapon in the game ? I am going for Dawnbreaker."
114,522 comments,1.0k,6 hours ago,r/AskMen,What trait do people call attractive but it’s really only attractive when you are handsome?
115,437 comments,11.9k,11 hours ago,r/HistoryPorn,"The Queen consort of Mongolia, Genepil, in Mongolia. The last queen consort and married to the Bogd Khaganate, Bogd Khan, until his death on April 17th, 1924, when the monarchy was abolished. She was killed during the Stalinist purges in May 1938. Photograph dated January 1st, 1923. [800 x 800]"
116,534 comments,3.0k,6 hours ago,r/SquaredCircle,Cody Rhodes posts pro-vaccination message on Instagram
117,409 comments,18.9k,9 hours ago,r/AnimalsBeingJerks,Otters not letting the orangutan sleep
118,516 comments,18.5k,16 hours ago,r/WatchPeopleDieInside,Well that's stuck
119,250 comments,5.0k,5 hours ago,r/instant_regret,She wasn't ready.
120,178 comments,4.5k,4 hours ago,r/lotrmemes,Petition to make this the sub banner to celebrate a great man's birthday and piss off the Tolkien Society
121,573 comments,2.2k,6 hours ago,r/canada,'Cancer is not going to wait': Patients frustrated as surgeries postponed due to COVID-19 overload
122,241 comments,Vote,6 hours ago,r/canada,"[PSA] We want your track driving Pro Tips, Reddit. Comment with your best technical tip for some gold, and a chance for your maneuver to be demonstrated by a Toyota Motorsport driver in the all new GR86."
123,369 comments,20.0k,8 hours ago,r/marvelmemes,I'm sorry for whomever sees this
124,30 comments,4.4k,4 hours ago,r/2meirl4meirl,2meirl4meirl
125,124 comments,6.0k,6 hours ago,r/IdiotsInCars,Are you a roll down the window person or aircon?
126,673 comments,3.2k,8 hours ago,r/oddlyspecific,Never realized hell had so many categories...
127,393 comments,16.3k,12 hours ago,r/greentext,Alien hates humans
128,227 comments,6.2k,6 hours ago,r/gifs,Laser-guided GPS On A Bike
129,316 comments,3.5k,2 hours ago,r/news,DeSantis admits to finding 1 million stockpiled COVID-19 tests in warehouse
130,623 comments,9.1k,8 hours ago,r/CasualUK,32 years old and just passed my driving test!
131,450 comments,11.1k,7 hours ago,r/Superstonk,"Did anybody catch the line in the Charles Gradante video explaining why a long hedge fund / whale doesn’t just step in and drop half a billion dollars on GME shares + ITM calls to blow up the hedgies? The SEC will step in and stop them. We, retail, are the catalyst to MOASS."
132,528 comments,6.9k,16 hours ago,r/YouShouldKnow,"YSK that Venmo, PayPal, and CashApp have to report $600 transactions to the IRS, as of January 1st 2022"
133,513 comments,7.1k,10 hours ago,r/tifu,TIFU by unpairing my girlfriend's earphones from her phone
134,406 comments,27.4k,10 hours ago,r/TIHI,Thanks I hate it
135,613 comments,36.9k,11 hours ago,r/HolUp,cursed ad
136,606 comments,55.1k,10 hours ago,r/clevercomebacks,"Ticks also gotta eat ,"
137,481 comments,15.3k,16 hours ago,r/MaliciousCompliance,Matched by boss in a night
138,501 comments,10.8k,12 hours ago,r/DiWHY,I was just looking for a cute game- now I feel gross and sad.
139,550 comments,5.3k,1 day ago,r/NotHowGirlsWork,women are shoes now
140,550 comments,5.3k,1 day ago,r/NotHowGirlsWork,with nearly 7000 up votes on reddit too
141,415 comments,14.1k,14 hours ago,r/todayilearned,"TIL IBM donated an International Translator System for use at the Nuremberg Trials, which brought the trial to life through simultaneous interpretation of English, Russian, French, and German delivered to 600 headsets with five audio channels. Later, IBM sold the proven system to the United Nations."
142,881 comments,6.8k,4 hours ago,r/memes,Are there still people that don't consider games OST as real music?
143,631 comments,10.2k,14 hours ago,r/blackcats,Munchkin wants to know why the hell you're still awake when you have work in the morning. He is judging you.
144,537 comments,780,4 hours ago,r/leagueoflegends,The Champions for the VGU Poll for 2023
145,537 comments,11.7k,15 hours ago,r/gifs,Giant purple isopod
146,104 comments,7.3k,9 hours ago,r/marvelmemes,Because he has a taxing day time job Justin. Gawd!
147,554 comments,27.1k,8 hours ago,r/MadeMeSmile,"Made it outside today, PTSD therapy starts in 6 days, met a squirrel - feeling positive about 2021."
148,523 comments,38.5k,20 hours ago,r/PraiseTheCameraMan,Tracking
149,1.2k comments,Vote,20 hours ago,r/PraiseTheCameraMan,"Toss a comment to your SmellyBardBot, oh people of Reddit. Toss a comment to your SmellyBardBot, oh people of Reddit. Oh People of Reddit. No seriously, ask for a poem about a Witcher character and I shall pen one about their smell."
150,216 comments,9.6k,8 hours ago,r/IllegallySmolCats,"Meet the new rescues: Lulu, Luna, and Nana."
151,531 comments,3.6k,6 hours ago,r/trashy,Fresh Off the Operation Table
152,352 comments,5.7k,5 hours ago,r/oddlyterrifying,"This was at the hospital where my daughter was just born. The sign translates into ""no brain"" fetus."
153,423 comments,1.5k,5 hours ago,r/Genshin_Impact_Leaks,2.5 floor 11 ley line disorder. I wonder who this could be hinting towards…
154,189 comments,4.0k,4 hours ago,r/NotHowGirlsWork,The delusions about paternal lineage
155,408 comments,3.0k,5 hours ago,r/trippinthroughtime,"It is the leech, that binds us."
156,436 comments,1.1k,5 hours ago,r/Conservative,The histrionics today are beyond parody.
157,112 comments,6.8k,6 hours ago,r/AnimalsBeingDerps,Call the cops when you see nala
158,194 comments,7.6k,7 hours ago,r/Catswhoyell,I’ve slowly been befriending this stray young man who LOVES to yell when he sees me. Apparently also while eating.
159,154 comments,3.9k,4 hours ago,r/mildlyinteresting,This hermaphroditic Cardinal my mom spotted yesterday
160,398 comments,3.0k,10 hours ago,r/2007scape,This PMOD is blackmailing me with mutes - 25mil for him to unmute me.
161,103 comments,10.1k,8 hours ago,r/pokemon,Pika pika - thundershock [OC]
162,434 comments,2.8k,5 hours ago,r/atheism,Pope under fire after calling people ‘selfish’ for having pets instead of kids
163,463 comments,5.4k,22 hours ago,r/ThatsInsane,HMFT after I test a cheap bulletproof jacket indoors using a rifle
164,463 comments,5.4k,22 hours ago,r/ThatsInsane,bulletproof jacket
165,434 comments,8.6k,13 hours ago,r/apexlegends,If the Pilot in the “Gridiron” SFTO was accurate to lore:
166,118 comments,7.4k,7 hours ago,r/AbruptChaos,broke the roof
167,350 comments,7.6k,7 hours ago,r/formula1,Only driver to score a Grand slam in 2021
168,172 comments,9.1k,11 hours ago,r/Hololive,You Can't Just Drop a Bomb like that
169,302 comments,9.3k,8 hours ago,r/instantkarma,Shopkeeper is like: Hey you fucking Robber try to robe someone else!
170,54 comments,4.8k,5 hours ago,r/PewdiepieSubmissions,Went to Walmart and found myself a little gem
171,451 comments,1.1k,7 hours ago,r/wow,"I've heard so many more people say BFA was actually underrated, and even I find myself miss BFA at times"
172,285 comments,4.3k,7 hours ago,r/gatekeeping,Gatekeeping pictures of beloved historical figure
173,167 comments,3.1k,11 hours ago,r/Grimdank,Gotta feel bad for Ahriman cus he's been trying to fix the rubric for 10k years straight
174,355 comments,2.0k,6 hours ago,r/news,Infiltrator wanted to 'kneecap' a violent neo-Nazi group
175,160 comments,6.1k,12 hours ago,r/TwoSentenceHorror,I felt happy for the first time in 14 years as we sat down and I prepared to say the magic words to finally leave this abusive relationship behind me for good.
176,241 comments,Vote,12 hours ago,r/TwoSentenceHorror,"[PSA] We want your track driving Pro Tips, Reddit. Comment with your best technical tip for some gold, and a chance for your maneuver to be demonstrated by a Toyota Motorsport driver in the all new GR86."
177,74 comments,7.3k,7 hours ago,r/Bossfight,"Mannequeen, guardian of the shop, fear of jojo stands"
178,156 comments,5.7k,13 hours ago,r/PandR,This knowledge makes everything better.
179,118 comments,5.0k,1 day ago,r/Satisfyingasfuck,Cutting perfectly fitting shelves
180,118 comments,5.0k,1 day ago,r/Satisfyingasfuck,good way of measuring stucco
181,429 comments,1.5k,6 hours ago,r/Amd,RX 6500 XT (2022) vs RX 480 (2016)
182,100 comments,1.5k,8 hours ago,r/hoi4,Guess my favorite land doctrine...
183,118 comments,4.8k,6 hours ago,r/weed,The best way to Wake & Bake
184,123 comments,4.1k,5 hours ago,r/lgbt,MtF. Another try at makeup <3
185,188 comments,2.9k,12 hours ago,r/antiMLM,"""this isn't because of the jewelry-it is because of chemical reactions"" 🙄🙄🙄🙃🙃🙃"
186,19 comments,3.5k,4 hours ago,r/TheLastAirbender,Let's go penguin sledding! (reuploaded because spelling)
187,271 comments,4.8k,6 hours ago,r/Jokes,"There was a German, an Italian and an Irishman on death row."
188,406 comments,2.8k,4 hours ago,r/battlefield2042,DICE listening to the community again
189,474 comments,5.0k,6 hours ago,r/PublicFreakout,"Officer Eugene Goodman leads US capitol rioters away from Chamber, one year ago today..."
190,73 comments,10.2k,7 hours ago,r/shitposting,Fornite
191,213 comments,12.4k,8 hours ago,r/blursedimages,blursed_ass_pic
192,391 comments,21.7k,12 hours ago,r/oddlysatisfying,Removing more rock from a ~12 million year old fossil crab using an air scribe (more rock removed as requested)
193,375 comments,2.4k,7 hours ago,r/explainlikeimfive,"ELI5: When so many homeowners struggle with things clogging their drains, how do hotels, with no control whatsoever over what people put down the drains, keep their plumbing working?"
194,53 comments,5.1k,6 hours ago,r/NonPoliticalTwitter,Three Whales
195,493 comments,3.0k,9 hours ago,r/gtaonline,Comet S2 Cabrio now available for purchase! Will you buy it?
196,241 comments,Vote,9 hours ago,r/gtaonline,"[PSA] We want your track driving Pro Tips, Reddit. Comment with your best technical tip for some gold, and a chance for your maneuver to be demonstrated by a Toyota Motorsport driver in the all new GR86."
197,411 comments,2.9k,11 hours ago,r/books,I Hate Dust Jackets
198,480 comments,34.0k,12 hours ago,r/hmm,Hmmmmmmmmmmmmmm
199,81 comments,2.6k,8 hours ago,r/CuratedTumblr,"""The Longing"" Speedruns are something else"
200,159 comments,2.9k,4 hours ago,r/ThatsInsane,Exploring a perfect recreation of Titanic in Unreal Engine
201,348 comments,788,3 hours ago,r/CFB,NYT To Buy The Athletic for $550 Million [TheInformation]
202,142 comments,2.5k,3 months ago,r/suspiciouslyspecific,I think we are missing cultural context for most Deuteronomy's laws
203,142 comments,2.5k,3 months ago,r/suspiciouslyspecific,Wondering how many times this happened
204,167 comments,8.7k,8 hours ago,r/titanfall,Did not have the guts to post this back then but i won my HS costume contest
205,89 comments,2.9k,4 hours ago,r/leagueoflegends,I've decided not to climb to Challenger this season
206,314 comments,1.6k,9 hours ago,r/programming,"Google fined 150M€, Facebook 60M€ for asymmetric cookie dialogs"
207,363 comments,1.4k,6 hours ago,r/NoStupidQuestions,"Pornhub seems to remember me, even though I watch in incognito mode. How do I make it stop recommending videos based on what I've watched previously?"
208,359 comments,4.2k,7 hours ago,r/deadbydaylight,The Biggest Threat To DBD
209,243 comments,3.0k,13 hours ago,r/niceguys,Shoulda left after the first message I know
210,291 comments,3.6k,15 hours ago,r/ComedyNecrophilia,stuff feels extra wholesome today 😱
211,344 comments,8.6k,14 hours ago,r/natureismetal,The fight for the toughest headbutt
212,710 comments,13.2k,6 hours ago,r/Unexpected,just an old grandma with dementia 💀
213,373 comments,13.9k,10 hours ago,r/oddlyterrifying,Well..
214,459 comments,32.6k,9 hours ago,r/interestingasfuck,Antique bear automaton whose fur was destroyed by an infestation of moths.
215,192 comments,11.8k,6 hours ago,r/MadeMeSmile,"“You look so silly, popsy”"
216,559 comments,2.3k,3 hours ago,r/nba,"Glenn Consor apologizes for his insensitive comments about Kevin Porter Jr: ""I mistakenly thought that Kevin was the son of former Washington player Kevin Porter and was unaware that the words I chose to describe his game-winning shot would be in any way hurtful or insensitive"""
217,386 comments,25.6k,11 hours ago,r/meirl,meirl
218,315 comments,6.0k,11 hours ago,r/starwarsmemes,No redemption for stormies?
219,380 comments,7.1k,10 hours ago,r/facepalm,Incest is totally okay
220,296 comments,7.3k,11 hours ago,r/ABoringDystopia,Customer is always right
221,81 comments,4.6k,10 hours ago,r/polandball,Best Currency
222,84 comments,8.1k,8 hours ago,r/perfectlycutscreams,I have a new favourite sound
223,242 comments,Vote,8 hours ago,r/perfectlycutscreams,"[PSA] We want your track driving Pro Tips, Reddit. Comment with your best technical tip for some gold, and a chance for your maneuver to be demonstrated by a Toyota Motorsport driver in the all new GR86."
224,272 comments,3.6k,6 hours ago,r/technology,Why Facebook keeps collecting people’s data and building their profiles even when their accounts are deactivated
225,378 comments,3.8k,6 hours ago,r/MapPorn,Quiz: Sovereign States of Confusion
226,194 comments,8.9k,6 hours ago,r/Damnthatsinteresting,This is absolute lifesaver.
227,82 comments,2.6k,3 hours ago,r/BlackPeopleTwitter,The Brokest (and most humble) Avenger
228,292 comments,552,5 hours ago,r/Quebec,Grande classe de retour de Cancun
229,219 comments,2.5k,11 hours ago,r/Gamingcirclejerk,No Sleep Till Battlefield
230,278 comments,963,8 hours ago,r/masseffect,I understand now 😞
231,146 comments,3.1k,13 hours ago,r/ThatLookedExpensive,This Ferrari SF90 Delivery
232,226 comments,1.1k,5 hours ago,r/hockey,Providence Bruins sign Tuukka Rask to PTO
