,comment_count,upvote_delta,timeup_list,subreddit,thread_text
234,105 comments,11.5k,10 hours ago,r/rarepuppers,"Every time, snack time."
235,137 comments,819,4 hours ago,r/StardewValley,What is “common sense” for most players that you didn’t discover until much later? TIL that this is a door and not a window
236,155 comments,1.1k,6 hours ago,r/Persecutionfetish,Oh no
237,138 comments,3.9k,6 hours ago,r/deadbydaylight,Leg
238,234 comments,650,6 hours ago,r/deadbydaylight,RTS with deep economics. All resources are physical and must be transported to each point in the supply chain.
239,254 comments,1.7k,5 hours ago,r/Stellaris,5'000 system Galaxy | What 45 years of expansion and discovery looks like
240,59 comments,9.8k,11 hours ago,r/comics,Monster [OC]
241,40 comments,2.2k,3 hours ago,r/CozyPlaces,Evening in my selfmade cabin by the sea
242,233 comments,3.2k,5 hours ago,r/titanfall,She does not count as a pilot
243,70 comments,3.1k,3 hours ago,r/Unexpected,When you don't want to pay
244,30 comments,2.6k,5 hours ago,r/lego,I made the 2x2 pirate treasure map into a 48x48 map
245,166 comments,10.1k,10 hours ago,r/suspiciouslyspecific,Would be extremely helpful.
246,353 comments,4.7k,10 hours ago,r/pcmasterrace,I made myself a laptop cooler! Thoughts?
247,223 comments,3.7k,14 hours ago,r/Cyberpunk,We failed as a society. The dark cyber punk future became true.
248,284 comments,5.3k,11 hours ago,r/CatastrophicFailure,"1/03/2022, Wasilla Alaska. A windstorm with 100mph+ gusts takes out the KFC."
249,1.9k comments,22.0k,9 hours ago,r/facepalm,"Karen is pissed off that she is not allowed in without a mask, and calls 911..."
250,108 comments,9.7k,12 hours ago,r/Genshin_Impact,Keqing loves Golden Shrimp Balls
251,120 comments,15.8k,12 hours ago,r/shittymoviedetails,In Spider-Man (2002) Peter has a radioactive spider bite the size of a golf ball but instead of going to a doctor he decides to sleep it off. This is because Peter lives in America.
252,124 comments,13.4k,8 hours ago,r/blursedimages,blursed_snow
253,62 comments,5.7k,8 hours ago,r/DnD,"[OC][ART]Tales From the Tables, episode 11: ""Don't judge by appearances!"""
254,270 comments,2.3k,10 hours ago,r/Bitcoin,"On this day 13 years ago, Satoshi Nakamoto launched Bitcoin. Hidden in the genesis block—mined on January 3, 2009—is a clue. A reaction to the inadequacy and injustice of central banking and fiat currency."
255,67 comments,5.4k,6 hours ago,r/oddlysatisfying,Hand painted pottery
256,72 comments,3.6k,6 hours ago,r/dogelore,Le smurf has arrived.
257,138 comments,933,4 hours ago,r/FragileWhiteRedditor,Can’t touch the famous white historical figure ZEUS
258,129 comments,1.4k,5 hours ago,r/recruitinghell,"Constantly seeing shit like this is really starting to piss me off. I don't care if it's indeed's fault or the employer's fault, STOP TRYING TO PASS OFF NON-REMOTE JOBS AS REMOTE."
259,71 comments,3.6k,6 hours ago,r/whenthe,Tactical advantage
260,214 comments,7.3k,9 hours ago,r/trippinthroughtime,This painting has always bothered me
261,152 comments,1.4k,4 hours ago,r/SuccessionTV,Reminder Kendall gave Greg a multimillion dollar apartment to live in rent free while Tom mocked him for looking in Staten Island 💔
262,126 comments,3.0k,9 hours ago,r/calvinandhobbes,"Susie Derkins, the new girl"
263,3.4k comments,5.6k,6 hours ago,r/AskReddit,"You are given 1 wish, but everything you wish happens to everyone, what is your wish?"
264,199 comments,6.2k,10 hours ago,r/CasualUK,"TIL author John Cunliffe created Postman Pat in response to the bullying he received as a child, and wanted to create an idyllic world where everyone was nice to each other."
265,78 comments,13.0k,11 hours ago,r/WhitePeopleTwitter,Nancy’s not taking prisoners
266,78 comments,13.0k,11 hours ago,r/WhitePeopleTwitter,OOF
267,64 comments,14.1k,10 hours ago,r/blessedimages,blessed villains
268,198 comments,1.4k,9 hours ago,r/JustBootThings,"The second you sign your life away, automatically makes you a Hero"
269,204 comments,18.9k,14 hours ago,r/TIHI,"Thanks, I hate jazz."
270,83 comments,5.4k,13 hours ago,r/gifs,Aww this cat worried about its human is amazing.
271,154 comments,1.3k,8 hours ago,r/forwardsfromgrandma,"I say ""wokeness"" is a smear because the status quo doesn't like it when people demand change."
272,73 comments,613,4 hours ago,r/antiMLM,Is your family concerned you work for an illegal pyramid scheme? They haven't done their research if it's not presented in a manila folder.
273,180 comments,1.6k,5 hours ago,r/bisexual,Bi men are fucking assholes.
274,141 comments,4.1k,9 hours ago,r/dadjokes,What did 0 say to 8 ?
275,57 comments,4.0k,13 hours ago,r/Komi_san,[Chapter 215] Can we talk about Masayoshi here?
276,112 comments,3.5k,6 hours ago,r/Jokes,I don't get the point of threesomes.
277,165 comments,4.2k,13 hours ago,r/woooosh,Xbox rope Obama
278,24 comments,4.2k,7 hours ago,r/EarthPorn,"first sunrise of 2022 in Bavaria, Germany OC [6047x3919]"
279,72 comments,1.7k,8 hours ago,r/antifastonetoss,No good time allowed
280,166 comments,7.5k,10 hours ago,r/GetMotivated,My new year's resolution was to go all 2021 without drinking alcohol. I am happy to say this was the first time I didn't fail my resolution. I could not feel better without it. [Image]
281,90 comments,1.1k,7 hours ago,r/TheRightCantMeme,Idiots
282,122 comments,1.3k,8 hours ago,r/walkaway,We all know who has the real privilege
283,151 comments,1.2k,8 hours ago,r/Watches,"[Fossil] I know r/watches aren’t too fond of them, but it’s my first mechanical watch!"
284,202 comments,1.5k,8 hours ago,r/Firearms,"Repost because I’m a hack, but true nonetheless."
285,107 comments,2.6k,8 hours ago,r/MyPeopleNeedMe,They say elephants are good judges of people
286,187 comments,889,6 hours ago,r/SafeMoon,Kucoin?
287,76 comments,3.0k,5 hours ago,r/OTMemes,The first death star cloned itself before getting destroyed
288,135 comments,10.8k,10 hours ago,r/natureismetal,Plant is tough asf
289,149 comments,638,3 hours ago,r/financialindependence,Reflections of a Black Woman Reaching 50% FI in 5.5 Years
290,166 comments,3.3k,9 hours ago,r/ClashRoyale,"my nephew sent me this, and I just can't"
291,107 comments,1.6k,8 hours ago,r/Warframe,Shoutout to the Amalgam Alkonost for being the most terrifying creature in this game to date. that thing is a modified Corpus Crewman (seriously it still has the helmet and gloves on) who buffs their fellow crewmen by injecting them with stims so potent it literally melts the skin off their faces.
292,164 comments,1.1k,7 hours ago,r/bengals,To salty KC redditors in our sub
293,84 comments,4.4k,11 hours ago,r/leagueoflegends,"I've dreamed of this scenario since I started playing Jhin, 200k mastery points ago. Perfect wet dream."
294,80 comments,2.8k,5 hours ago,r/IASIP,I love you
295,156 comments,5.6k,16 hours ago,r/mathmemes,Reject Geometry. Embrace Analysis!
296,137 comments,1.3k,9 hours ago,r/askscience,"When a huge piece of ice calves off a glacier/ice sheet into the sea, once the initial ‘wave’ settles is the sea level rise around the world instant or does it take a long period of time to take effect?"
297,118 comments,3.8k,7 hours ago,r/rickandmorty,Must be a planet without cats
298,129 comments,634,3 hours ago,r/ApexOutlands,Something Bangalore would say in the bedroom. Go
299,212 comments,873,5 hours ago,r/Eldar,We got the new guardian guys!
300,143 comments,4.2k,7 hours ago,r/Whatcouldgowrong,I'll kick this puddle of flaming liquid. WCGW?
301,62 comments,3.2k,6 hours ago,r/HydroHomies,Starting the year off hydrated 🥵🥵
302,217 comments,1.6k,6 hours ago,r/DocumentedFights,"Woman gets a good dose of equality. If you hit someone, be prepared to be hit back."
303,139 comments,1.4k,5 hours ago,r/CasualConversation,"I work as a content writer, and it can be such a weird, unethical, soul-sucking job. (Alternate title: never trust anything you read on the internet.)"
304,47 comments,2.2k,11 hours ago,r/hoi4,Turned out to be almost 1M casualties
305,192 comments,1.5k,3 hours ago,r/battlefield2042,"Okay DICE your vacation is up , no more radio silence. What's the plan for Battlefield ?"
306,48 comments,4.5k,7 hours ago,r/gayspiderbrothel,Big chungus keanu reaves holesome 100
307,208 comments,3.1k,7 hours ago,r/CrazyFuckingVideos,One of the reasons you shouldn't ride your motorbike in places where it is illegal to do so
308,118 comments,1.1k,7 hours ago,r/TrueSTL,I made an Elder Scrolls Wojak Compass and this is definitely the perfect sub for it. Are your favorites based?
309,124 comments,2.1k,12 hours ago,r/BritishSuccess,Only 3 people in front of me in the queue at the post office. Only had to wait 42min!
310,84 comments,1.0k,5 hours ago,r/exmormon,"WTF!! I just learned my dad, former bishop, 2-time stake president, and career CES area coordinator is a pedophile!"
311,981 comments,5.3k,7 hours ago,r/politics,"US could be under a right-wing dictatorship by the end of the decade, expert warns"
312,389 comments,11.8k,8 hours ago,r/Minecraft,"I'm making a texture pack with custom models using optifine, thoughts? (these are the only mobs I've changed so far)"
313,158 comments,637,5 hours ago,r/GamingLeaksAndRumours,The Next Video Game From BioShock’s Creator Is in Development Hell
314,114 comments,6.8k,12 hours ago,r/Animemes,We all have a weakness
315,38 comments,1.6k,2 hours ago,r/IllegallySmolCats,"little cheeto, big chair"
316,43 comments,1.8k,3 hours ago,r/JusticeServed,Teen mugging suspect turned in by his mom who recognized him in video stills
317,145 comments,6.6k,14 hours ago,r/ItemShop,Elemental dice
318,164 comments,2.0k,6 hours ago,r/ufc,"I miss Stipe Miocic, the HW GOAT!!!"
319,80 comments,3.5k,7 hours ago,r/reddeadredemption,Made an oil painting of Arthur
320,145 comments,3.9k,13 hours ago,r/gatesopencomeonin,How it should go
321,78 comments,4.5k,10 hours ago,r/assholedesign,"The spambot promised me to not spam me anymore, only to spam me today."
322,33 comments,2.9k,6 hours ago,r/Catswithjobs,I think I accidentally adopted a dragon. She thinks it's her job to hoard and guard anything shiny
323,103 comments,1.4k,8 hours ago,r/CapitolConsequences,A Key Reason Jan. 6 Rioters Aren’t Facing Sedition Charges: They’re White
324,70 comments,2.6k,5 hours ago,r/GME,There’s a News Blackout on the Fed’s Naming of the Banks that Got Its Emergency Repo Loans; Some Journalists Appear to Be Under Gag Orders
325,127 comments,1.0k,6 hours ago,r/Naruto,"Not sure if any of y’all notice this but Obito use his real voice, instead of his Tobi voice"
326,93 comments,1.0k,7 hours ago,r/WestSubEver,New Weeknd album dropping Friday
327,143 comments,2.2k,11 hours ago,r/NewVegasMemes,I better see some love for that superior weapon skill or I swear I'll post another low effort meme
328,109 comments,5.3k,12 hours ago,r/ksi,End of an Era 😓
329,114 comments,1.1k,8 hours ago,r/Frugal,the uncomfortable truth: less time on your phone and TV will result in less spending
330,181 comments,1.1k,6 hours ago,r/DC_Cinematic,Justice league (Yeah Cyborg too)
331,73 comments,1.0k,8 hours ago,r/bleach,"Askin literally just ""noped"" out of battles lmao"
332,247 comments,2.0k,11 hours ago,r/Shitty_Car_Mods,Please please please give me all your opinions on my old vw that I built.
333,314 comments,Vote,2 hours ago,r/egg_irl,egg_irl
334,199 comments,1.0k,7 hours ago,r/Denmark,"I drew a map of Denmark with the current borders of Denmark but set in the Viking age, some cities weren't founded yet so that's why I didn't drew them and I probably forgot some other settlements just because I don't know them all (I'm Belgian) I still hope you'll enjoy it!!"
335,90 comments,2.3k,3 hours ago,r/BlackPeopleTwitter,I don't know if I should laugh or not
336,171 comments,27.2k,13 hours ago,r/technicallythetruth,Maybe she is a bit angry
337,113 comments,4.4k,8 hours ago,r/DesignPorn,"Kudos to Nabisco's new pop-open boxes, which actually let you fit your hand inside the cracker box for once"
338,45 comments,2.5k,5 hours ago,r/lostredditors,Surely they’ll remember
339,121 comments,2.5k,20 hours ago,r/Whatcouldgowrong,HMFT after I BASE jump without properly packing my parachute.
340,121 comments,2.5k,20 hours ago,r/Whatcouldgowrong,Wcgw after jumping from massive heights without a proper parachute…
341,188 comments,2.6k,5 hours ago,r/oddlyterrifying,X-ray of serial killer Albert Fish (Brooklyn Vampire) after his arrest. He would embed needles into his groin and abdomen. The second pic is of a letter he wrote to a victims family. Be warned. Its very disturbing.
342,90 comments,1.8k,8 hours ago,r/religiousfruitcake,12th reason why I left that religion
343,365 comments,5.5k,8 hours ago,r/LeagueOfMemes,Practical Guide to Choosing Your Jungle Main
344,134 comments,3.2k,5 hours ago,r/mildlyinteresting,These statues in front of a finnish train station are vaccinated.
345,134 comments,624,4 hours ago,r/XboxSeriesX,"Halo co-creator Marcus Lehto has approved Halo: Infinite: ""Hats off to my friends at 343. Halo Infinite campaign brings back the magic of Halo. """
346,146 comments,1.4k,4 hours ago,r/ABoringDystopia,"Politician who voted for the Iraq War, encouraged Obama to bomb civilians in Syria, Yemen & Pakistan, and supported a coup in Honduras is now doing ads asking you to donate to help refugees"
347,115 comments,976,3 hours ago,r/Whatcouldgowrong,WCGW walking out of a moving bus
348,91 comments,952,4 hours ago,r/Deltarune,An interesting post I found on Tumblr regarding the release plan for chapters 3-5. What do you guys think? Do you agree or disagree with the post? Let me know down below.
349,429 comments,3.3k,5 hours ago,r/WhitePeopleTwitter,Pausing evictions
350,115 comments,Vote,2 hours ago,r/oblivion,So I got this a few minutes ago… what is with people now a days
351,89 comments,5.2k,14 hours ago,r/tattoos,Mama and my little girl! Jackie from gallery of ink in Harrison New Jersey
352,107 comments,2.2k,5 hours ago,r/tooktoomuch,My minds tellin me no
353,154 comments,1.9k,4 hours ago,r/technology,Hyundai stops engine development and reassigns engineers to EVs
354,64 comments,3.3k,2 hours ago,r/Superstonk,"🔴Daily Reverse Repo Update 01/03: $1,579.526B🔴"
355,131 comments,1.7k,4 hours ago,r/xboxone,Halo co-creator has approved Halo: Infinite
356,64 comments,1.2k,7 hours ago,r/Cricket,That's a huge statement
357,164 comments,3.2k,9 hours ago,r/funnyvideos,"Pretty bad day, huh?"
358,3 comments,20.1k,9 hours ago,r/funnyvideos,Predictions Tournament
359,119 comments,1.1k,7 hours ago,r/RedDeadOnline,It's been 3yrs since we were hired by Jessica and we still don't know how the story ends...maybe in 2022. Maybe in my dreams.
360,156 comments,2.8k,7 hours ago,r/SmashBrosUltimate,P A I N
361,144 comments,950,7 hours ago,r/MLS,"I Still Work In A Crowded Florida Theme Park, And For The 7th Straight Year I Kept Track Of All Of The North American Professional Soccer Stuff I Saw"
362,115 comments,2.8k,8 hours ago,r/confidentlyincorrect,No.
363,437 comments,4.9k,7 hours ago,r/PoliticalHumor,Obamas still got it in 2022
364,70 comments,1.5k,7 hours ago,r/lgbt,Trans women and the expectation of femininity
365,145 comments,1.6k,3 hours ago,r/chelseafc,Thiago Silva extends contract
366,42 comments,3.0k,6 hours ago,r/perfectlycutscreams,AHHHHHHHHHHHHHH-
367,96 comments,512,2 hours ago,r/sports,NHL commissioner Bettman has asked to move hockey to Summer Olympics
368,62 comments,3.9k,7 hours ago,r/SCP,SCP 173's dilemma
369,109 comments,2.1k,6 hours ago,r/Technoblade,Hmmm
370,79 comments,5.7k,13 hours ago,r/TrashTaste,Made me think of grant
371,87 comments,2.8k,12 hours ago,r/aviation,"If you are cold, let this F-14 Tomcat photo warms you up"
372,89 comments,10.9k,12 hours ago,r/aviation,The /r/torontoraptors Seasonal W/L Prediction Tournament
373,66 comments,5.7k,17 hours ago,r/SandersForPresident,Bernie Sanders giving his New Years Resolution in 1978
374,107 comments,866,6 hours ago,r/TheExpanse,The Expanse is #2 again for r/television's 2021 Favorite Shows Survey
375,379 comments,6.7k,7 hours ago,r/nextfuckinglevel,Mental ability > Physical disability
376,77 comments,2.2k,10 hours ago,r/eu4,You did not see that coming.
377,60 comments,3.4k,13 hours ago,r/Steam,"Ah yes my favorite early access game, The Witcher 3"
378,106 comments,513,3 hours ago,r/golf,Sergio takes a divot on the green
379,30 comments,2.6k,6 hours ago,r/AnimalsBeingJerks,"Hey buddy, what did the five fingers say to the face?"
380,107 comments,3.3k,5 hours ago,r/interestingasfuck,Exploring a perfect recreation of the Titanic in Unreal Engine
381,105 comments,2.2k,7 hours ago,r/fo4,"This community, pretty much"
382,74 comments,3.0k,6 hours ago,r/dankruto,Naruto fandom in a nutshell
383,71 comments,4.5k,8 hours ago,r/antimeme,Always ready to help a lady in need.
384,145 comments,4.1k,12 hours ago,r/MakeMeSuffer,My feet covered in poison ivy right now
385,144 comments,1.9k,6 hours ago,r/OldSchoolCool,"Crocodile Dundee (1986) Paul Hogan as Michael Dundee. As a kid I thought that nothing can't get any cooler than this guy. As an adult, I still think the same."
386,125 comments,881,5 hours ago,r/functionalprint,TPU Gasket for the Float Chamber on My Snowblower's Gasoline Carburetor
387,48 comments,2.8k,6 hours ago,r/egg_irl,egg_irl
388,51 comments,3.6k,8 hours ago,r/educationalgifs,"Dolphins smack fish with their tails to stun them, making the fish easier to grab."
389,103 comments,1.5k,8 hours ago,r/FortNiteBR,I find it funny how Galactus was never mentioned by name ever again after season 4
390,40 comments,2.6k,6 hours ago,r/anime_irl,anime_irl
391,120 comments,1.3k,5 hours ago,r/ffxiv,Reunion
392,23 comments,3.4k,7 hours ago,r/gifsthatkeepongiving,A stunning barn owl hovering during the snowfall
393,265 comments,1.1k,2 hours ago,r/meme,I want to listen to your ideas
394,62 comments,1.5k,5 hours ago,r/JuJutsuKaisen,"Akutami Gege's illustration for the new year 2022, the year of the tiger!"
395,130 comments,2.2k,11 hours ago,r/london,Obviously getting the first run of the year in
396,102 comments,1.7k,6 hours ago,r/loopringorg,Vitalik talks about Loopring again!
397,105 comments,1.7k,10 hours ago,r/ik_ihe,ik⏰ihe
398,96 comments,1.2k,3 hours ago,r/blackcats,Fig when we got him 6 months ago vs now. Is this a normal level of cat chonk or do we need to lay off the dreamies?
399,83 comments,6.3k,7 hours ago,r/funny,Motion of the ocean (oc)
400,16 comments,3.1k,7 hours ago,r/FunnyandSad,That's nuts
401,99 comments,5.6k,15 hours ago,r/PraiseTheCameraMan,I recorded this from my phone whilst genuinely trying to avoid crushing any kids standing behind me
402,74 comments,1.4k,9 hours ago,r/atheism,Carl Sagan reminds us of the dangers in believing a higher power and hoping they will fix our problems
403,71 comments,731,3 hours ago,r/pettyrevenge,"Dogs won't stop barking, meet my leaf blower."
404,189 comments,10.6k,6 hours ago,r/memes,Asian people be like
405,41 comments,2.3k,6 hours ago,r/whitepeoplegifs,In-flight entertainment
406,143 comments,1.9k,7 hours ago,r/Satisfyingasfuck,This guy is very brave
407,26 comments,4.6k,7 hours ago,r/Eyebleach,Favorite spot
408,74 comments,2.8k,8 hours ago,r/Overwatch_Memes,The overwatch flanking experience
409,52 comments,3.2k,12 hours ago,r/youngpeopleyoutube,pls remove timer
410,62 comments,1.4k,7 hours ago,r/tylerthecreator,TYLER CONFIRMED ON THE WEEKND’S NEW ALBUM!!!!!
411,39 comments,3.3k,8 hours ago,r/HighQualityGifs,how I feel about all of you...
412,946 comments,7.9k,6 hours ago,r/antiwork,"with the min wage increasing in a lot of states to $15 an hour, remember that some states are remaining at $7.25 an hour"
413,411 comments,4.7k,13 hours ago,r/FingMemes,What could go wrong?
414,411 comments,4.7k,13 hours ago,r/FingMemes,Hmm
415,68 comments,936,7 hours ago,r/linuxmasterrace,This supervisor is very strict.
416,93 comments,5.3k,14 hours ago,r/animegifs,80's Training Montage
417,134 comments,1.9k,8 hours ago,r/Conservative,Right AOC
418,72 comments,1.5k,8 hours ago,r/TankPorn,What it's like to come under long range fire from 3 tanks.
419,2.0k comments,27.0k,10 hours ago,r/pics,This is the world atheists want
420,97 comments,1.8k,4 hours ago,r/PewdiepieSubmissions,Made this For All 19YOs on this planet. Happy 2022. (Mods please don't delete this it's not meant for LWIAY. it's just for the Bros)
421,341 comments,19.1k,11 hours ago,r/therewasanattempt,to beat a level 100 boss without doing the side quests
422,25 comments,1.4k,3 hours ago,r/Cursed_Images,Cursed gym
423,97 comments,2.3k,6 hours ago,r/OldSchoolCool,"Tobey Maguire and Leonardo DiCaprio, 1989. They've been friends since they were 12."
424,914 comments,6.0k,6 hours ago,r/OldSchoolCool,Geopolitics is your sandbox
425,116 comments,912,6 hours ago,r/LosAngeles,"Happy 2022 Los Angeles! If you need a new face mask with filter/nose bridge/ear saver/lanyard for the new year message me or comment here. They are completely free and I can cover shipping too. Thanks to Redditors I have made 22,070 free masks!"
426,49 comments,5.9k,8 hours ago,r/me_irl,me_irl
427,90 comments,2.5k,9 hours ago,r/CODWarzone,Quick meme I made
428,140 comments,508,4 hours ago,r/germany,"He Germans, I finally ordered one of these online. We don't really use these in England but after spending time in Germany and seeing them used fairly regularly I wanted in."
429,22 comments,4.3k,7 hours ago,r/pokemon,"[OC] just look down, sir"
430,14 comments,1.6k,4 hours ago,r/SapphoAndHerFriend,And they were roommates
431,65 comments,1.4k,4 hours ago,r/totalwar,The main reason I like undead factions:
432,75 comments,1.4k,8 hours ago,r/factorio,Dear lord it's gorgeous
433,127 comments,2.3k,6 hours ago,r/MaliciousCompliance,You said 7am to 3pm
434,70 comments,2.0k,3 hours ago,r/Damnthatsinteresting,My favorite drawings I did in 2021
435,108 comments,3.6k,13 hours ago,r/de,Birkenau/Odenwald - Nach einem Gewitter
436,202 comments,3.9k,8 hours ago,r/ich_iel,Ich_iel
437,55 comments,3.0k,11 hours ago,r/ContagiousLaughter,Timmy2cans latest. The first guy even joined in laughing 😂 😂
438,196 comments,8.6k,7 hours ago,r/Unexpected,Case at customs
439,16 comments,2.6k,7 hours ago,r/Zoomies,3 winters of wishing for snow while we were at my parents’ house and it finally happened! She’s so happy doing her snow zoomies!
440,39 comments,2.9k,6 hours ago,r/ksi,All the memes JJ used in the 20 v 1 video
441,72 comments,2.6k,9 hours ago,r/zelda,[TP] [OC] If Twilight Princess was designed by Tim Burton
442,114 comments,1.8k,4 hours ago,r/woahdude,When the planet is coming at you
443,64 comments,2.1k,6 hours ago,r/MoldyMemes,Magic mike
444,157 comments,9.5k,9 hours ago,r/marvelmemes,Bro come a long way
445,89 comments,1.5k,3 hours ago,r/CrappyDesign,In this street in Amsterdam you have to park on the edge of the river
446,22 comments,1.9k,5 hours ago,r/GMEJungle,A News Blackout on the Fed’s Naming of the Banks that Got Its Emergency Repo Loans; Some Journalists Appear to Be Under Gag Orders
447,66 comments,1.5k,4 hours ago,r/Grimdank,Unquenchable
448,97 comments,2.0k,11 hours ago,r/libertarianmeme,Every time
449,112 comments,2.4k,6 hours ago,r/apexlegends,Dual shell isnt that bad afterall :>
450,61 comments,818,6 hours ago,r/soccercirclejerk,"Chuck from Kentucky here. Why do the Man City Blues give nicknames to their players, like Kevin 'The Brain Huh' and Ruben 'The Ass'?"
451,71 comments,2.1k,4 hours ago,r/Whatcouldgowrong,WCGW crowding on thin ice
452,79 comments,3.3k,9 hours ago,r/amcstock,"Hedgies would like nothing better than to bury this. Has nearly 2,000+ ⬆️ here, meanwhile only 143 Retweets, 270 ♥️ there…Increase exposure by retweeting and ❤️. Plz be on both platforms until MOASS! (Link in comments) #TogetherStrong"
453,68 comments,2.5k,10 hours ago,r/physicsmemes,I am using these memes to hold onto my sanity
454,88 comments,10.0k,13 hours ago,r/anime_irl,anime_irl
455,123 comments,5.8k,9 hours ago,r/dndmemes,I am NOT ready for phase two
456,42 comments,1.7k,6 hours ago,r/AnimalsBeingDerps,Miscatculation
457,42 comments,1.7k,6 hours ago,r/AnimalsBeingDerps,Cats in Istanbul as usual!
458,38 comments,2.7k,9 hours ago,r/brooklynninenine,Jake got mission-impossible'd!
459,72 comments,1.4k,6 hours ago,r/comedyhomicide,Holy shit PLEASE shut up
460,44 comments,3.5k,12 hours ago,r/okbuddybaka,That must be a really weird job
461,266 comments,2.4k,2 hours ago,r/politics,Nunes formally resigns from Congress
462,127 comments,4.5k,11 hours ago,r/hmmm,hmmm
463,59 comments,3.7k,12 hours ago,r/HollowKnight,N̶̡̨̧̛̩̹͙̩͆͂̊͒̏̄̕͝e̵̗̮̟̪͙̿͆̀̋͛̈́͘x̵̣̱̞̤̀̈͛̂̀t̴͔̎̂͘ ̶̞̥̠̻͍̰͉̝͎͆͛̾i̶͍͇͘s̵̢̧͎̪̗̻̗̻̝̱̀̽̀͆̎͑͋̓̚͠ ̷̠̗̑͂͋͝ͅy̸̢͚̦̯̟͗̌́̐̈͌͑̇̽ỏ̷̙̮̯̐u̶̧̗̲̤̽̈̅͊͊͘͘͝.̶̞͈͐̓͂̎̀̒͂̓͜͝ͅ.̶̘̩̞̭̎̌̏̈́́͠.̶̨̩̗̫̙̦̹̫͓̈́͠
464,107 comments,3.2k,10 hours ago,r/Awwducational,"This weird critter is called Hallucigenia! It's an extinct Lobopodian from the Cambrian! This strange animal sported 10 pairs of legs, with the first 3 pairs acting as arms that were probably used for feeding. Hallucigenia's closest relatives that still survive to this day are velvet worms"
465,63 comments,2.0k,6 hours ago,r/Overwatch,"I made three fusion heroes with Mercy, Moira and Echo (more info + animation for Resonance's abilities&voice in the comments!)"
466,91 comments,1.6k,9 hours ago,r/brasil,Vídeo que recebi da minha cliente 🥲
467,92 comments,814,3 hours ago,r/HollowKnightMemes,mossbag may not like this one
468,551 comments,1.9k,4 hours ago,r/HermanCainAward,"Update: Biker joked about still being alive despite taking no precautions but sadly found out, Covid is no joke. Just a couple of weeks ago he was strong as an ox, now his family is planning a funeral."
469,98 comments,7.8k,14 hours ago,r/notinteresting,yay
470,147 comments,5.7k,7 hours ago,r/cats,3 new kittens were just born in my bed. Sooo cute
