,comment_count,upvote_delta,timeup_list,subreddit,thread_text
764,13 comments,2.7k,11 hours ago,r/reactiongifs,MRW someone says “I won’t see you until next year” on December 31st.
765,14 comments,794,6 hours ago,r/Stellaris,Merry Christmas!
766,41 comments,2.1k,7 hours ago,r/antimeme,Not what I expected
767,13 comments,618,5 hours ago,r/MedievalCats,My wife’s Christmas present to me 😂
768,13 comments,863,7 hours ago,r/thurstonwaffles,He looks so cute and fluffy uwu
769,159 comments,4.7k,11 hours ago,r/oddlysatisfying,Graffiti art in action
770,13 comments,1.6k,10 hours ago,r/SupermodelCats,Someone told me Marshmallow could fit here.. Merry Christmas to y'all!
771,12 comments,540,4 hours ago,r/dashcamgifs,The workers left no signs or warnings of any kind
772,12 comments,616,5 hours ago,r/catbellies,Baby Oreo's belly
773,12 comments,1.1k,8 hours ago,r/ihadastroke,??????
774,11 comments,3.6k,13 hours ago,r/SpeedOfLobsters,Loot
775,12 comments,609,4 hours ago,r/magicthecirclejerking,"Myry Christmas or whatever, I don’t know"
776,176 comments,2.8k,6 hours ago,r/HolUp,There's nothing Sus here 😳
777,40 comments,1.7k,4 hours ago,r/formula1,"2015 Italian GP, Renault's V6 engine exposed on Max Verstappen's STR10"
778,17 comments,1.6k,4 hours ago,r/shitposting,Title
779,15 comments,671,4 hours ago,r/3Dprinting,Wife got me a t-shirt for Christmas
780,12 comments,684,4 hours ago,r/CrusaderKings,The CK3 Mod Co-op wishes everyone a fantastic Christmas / New Year Holiday Season!
781,64 comments,2.0k,5 hours ago,r/dndmemes,"Druid's Timeless Body is a fun feature, a shame it's hard to make it useful while the campaign is ongoing."
782,36 comments,1.9k,7 hours ago,r/PewdiepieSubmissions,A Challenger Appears
783,12 comments,873,7 hours ago,r/Eyebleach,Greebles on the Brain
784,12 comments,873,7 hours ago,r/Eyebleach,Busy in watchin
785,10 comments,586,3 hours ago,r/legendofkorra,A simple drawing of Korra by me :)
786,12 comments,1.4k,9 hours ago,r/tuckedinkitties,Hmm what is this suspicious lump?
787,12 comments,526,3 hours ago,r/valheim,The fiancé hooked it up this Christmas! Merry Christmas everyone!
788,49 comments,1.9k,7 hours ago,r/hockey,"We’ve been stuck inside so long, I can’t remember what year it is! Happy Holidays everyone!"
789,11 comments,667,5 hours ago,r/kurzgesagt,You can't do this to me mom
790,13 comments,1.9k,10 hours ago,r/Angryupvote,lol
791,11 comments,1.4k,10 hours ago,r/adventuretime,This scene defines who Jake is so well.
792,12 comments,776,5 hours ago,r/Naturewasmetal,"[r/Pleistocene] The 13,000-year-old Swimming Reindeer sculpture was carved from a mammoth's tusk"
793,81 comments,5.0k,8 hours ago,r/interestingasfuck,"The iconic ringtone from the Nokia line of cellphones is actually based on a Spanish guitar piece by Francisco Tárrega called -Gran Vals-, written in 1902"
794,139 comments,919,3 hours ago,r/Cringetopia,Dancing while your baby is dying
795,11 comments,736,5 hours ago,r/GODZILLA,It that time of the year again! By Legendofthedeep
796,17 comments,1.0k,4 hours ago,r/IllegallySmolCats,She was feeling herself lol
797,30 comments,1.6k,4 hours ago,r/wholesomememes,Does it snow where you live? [OC]
798,47 comments,873,3 hours ago,r/halo,Super tiny elites? Halo 4 Spartan Ops MCC bug?
799,12 comments,502,4 hours ago,r/disneyvacation,How to know when you have taken self-love too far.
800,159 comments,6.1k,8 hours ago,r/nextfuckinglevel,Fantastic person
801,79 comments,1.8k,7 hours ago,r/oddlyterrifying,Amber Court Hotel. The most haunted hotel in Malaysia. Moss on the building makes it look like its bleeding.
802,34 comments,2.9k,7 hours ago,r/Hololive,Here's what a Haachama Christmas looks like
803,11 comments,2.0k,10 hours ago,r/Megumin,Megumin is excited for Christmas!
804,13 comments,557,11 hours ago,r/WatchPeopleDieInside,This guy seems fun
805,13 comments,557,11 hours ago,r/WatchPeopleDieInside,Harmless prank
806,43 comments,5.8k,11 hours ago,r/AnimalsBeingDerps,The little arm just kills me. @_@ kitty
807,12 comments,649,6 hours ago,r/PizzaCrimes,Why so many crusts.. hopefully it has cheese in the multiple crusts
808,11 comments,453,3 hours ago,r/ColorizedHistory,"Children looking at Xmas toys in a shop window. New York, circa 1910."
809,11 comments,588,4 hours ago,r/SpidermanPS4,Fun Fact: Peters bag from Spiderman PS4 can still be found at the F.E.A.S.T shelter
810,5 comments,628,3 hours ago,r/MemeEconomy,Invest in Geralt not finding his swords
811,10 comments,476,20 hours ago,r/wholesome,Merry Christmas - my sister and I got a new dog to our parents and it's the first time I see my father cry
812,10 comments,476,20 hours ago,r/wholesome,Merry Christmas - my sister and I got a new dog to our parents and it's the first time I see my father cry
813,10 comments,721,8 hours ago,r/gaming,This is a kid’s game...
814,10 comments,721,8 hours ago,r/gaming,Merry Christ...
815,11 comments,614,5 hours ago,r/EverythingScience,The most powerful telescope ever built has successfully launched
816,6 comments,1.4k,6 hours ago,r/suspiciouslyspecific,no.
817,77 comments,6.0k,12 hours ago,r/LeagueOfMemes,Emeny.mov
818,77 comments,2.7k,9 hours ago,r/mildlyinfuriating,I dropped my screw storage box
819,12 comments,419,3 hours ago,r/ImaginaryLeviathans,Underwater horror by Ian Su
820,10 comments,1.0k,8 hours ago,r/overlord,i instantly thought of best girl Yuri when seeing best girl Komi
821,11 comments,498,3 hours ago,r/comedyhomicide,So unnecessary
822,74 comments,1.4k,4 hours ago,r/pcmasterrace,Hey guys thanks for making me check my refresh rate. My 60hz monitor was set to 59.940hz! Can't believe I was missing out on a whole 0.06hz.
823,137 comments,3.1k,9 hours ago,r/IndianDankMemes,Chad...
824,67 comments,823,3 hours ago,r/MakeMeSuffer,I fell in the shower and knocked myself out somehow
825,223 comments,1.1k,5 hours ago,r/PublicFreakout,Obnoxious drunk guy not wearing his mask fights another passenger on Delta flight
826,34 comments,985,4 hours ago,r/zelda,[OoT] My mother left behind her gaming days with N64. I got her OoT and a N64 controller on the switch for Christmas. Maybe too soon as she just said F**K making Christmas lunch now.
827,10 comments,555,5 hours ago,r/onejob,"Ah yes, I would like Satan for Christmas"
828,9 comments,2.5k,1 day ago,r/VoidCake,Absolutelynotme_irl
829,9 comments,2.5k,1 day ago,r/VoidCake,"Happy holidays, heathens"
830,11 comments,380,2 hours ago,r/HadToHurt,r/HadToHurt Christmas Video. Merry Xmas Everybody!
831,11 comments,417,4 hours ago,r/Metroid,I Drew Zero Suit Samus
832,40 comments,1.5k,4 hours ago,r/ich_iel,ich🇩🇪iel
833,316 comments,4.7k,8 hours ago,r/Damnthatsinteresting,This is very interesting
834,7 comments,444,3 hours ago,r/futurama,"I just bought a 64oz hydro flask, and the only reason I bought this color was so I could put this bad boy on it!"
835,9 comments,1.1k,8 hours ago,r/GMEJungle,Lock it up 2022: 1 float = 1 hedgies🚀🚀🚀🚀
836,4 comments,687,4 hours ago,r/dankchristianmemes,"Merry Christmas. Be nice, St. Nicholas is watching."
837,8 comments,849,7 hours ago,r/depression_memes,I might consider it.
838,6 comments,928,6 hours ago,r/Miniworlds,Deep sea world in a cork
839,105 comments,1.9k,6 hours ago,r/space,James Webb Space Telescope has Successfully Launched into Orbit
840,7 comments,718,6 hours ago,r/araragi,__I said with a posed look
841,212 comments,34.0k,16 hours ago,r/WatchPeopleDieInside,"It's ok, he will master it by next Christmas"
842,8 comments,1.5k,9 hours ago,r/HydroHomies,My new notebook ain’t fucking around
843,7 comments,814,6 hours ago,r/PartyParrot,Birbs got good taste
844,33 comments,1.5k,4 hours ago,r/Eyebleach,"Welcome to the family, Hank!"
845,7 comments,1.1k,8 hours ago,r/funnysigns,Messy eaters
846,6 comments,403,3 hours ago,r/trashpandas,Those whiskers 🦝 Just Noodle being pals with my wife…
847,6 comments,1.3k,10 hours ago,r/SamONellaAcademy,Idk if this is already posted
848,6 comments,517,4 hours ago,r/Persona5,"Hello Again, Sae"
849,50 comments,1.8k,3 hours ago,r/funny,Home Alone
850,4 comments,702,4 hours ago,r/Futurology,A seed for all seasons: can ancient methods future-proof food security in the Andes?
851,6 comments,1.1k,7 hours ago,r/dreamsmp,Technoblade never dies!
852,7 comments,567,4 hours ago,r/forbiddensnacks,Forbidden Creamy Peanut Butter
853,6 comments,1.1k,13 hours ago,r/memes,When cristmas celebration reduces your stress
854,6 comments,1.1k,13 hours ago,r/memes,Merry Christmas Everyone.
855,6 comments,433,3 hours ago,r/anime_titties,Tokyo to recognise same-sex partnerships in huge step towards equality
856,6 comments,345,3 hours ago,r/shieldbro,Christmas present I made for my dad
857,4 comments,860,7 hours ago,r/CatsWhoSqueak,a foster from a few years back ♡
858,7 comments,558,3 hours ago,r/mallninjashit,She had they key to his heart...
859,2 comments,922,6 hours ago,r/TheRealJoke,All a-loan
860,5 comments,501,3 hours ago,r/puns,From r/AskReddit
861,23 comments,1.9k,6 hours ago,r/technicallythetruth,"No, No, he's got a point..."
862,17 comments,880,3 hours ago,r/dogelore,Le rarest of all treasures has arrived!
863,122 comments,10.4k,7 hours ago,r/memes,You and I are not so different
864,6 comments,687,6 hours ago,r/WANDAVISION,Where he gets his supply of tiny laborers:
865,14 comments,2.3k,9 hours ago,r/nonononoyes,Harley and The useless box
866,49 comments,1.5k,7 hours ago,r/DiWHY,Absolutely Disgusting
867,4 comments,1.0k,7 hours ago,r/MEOW_IRL,MEOW_IRL
868,5 comments,1.2k,8 hours ago,r/ImaginarySliceOfLife,Bless this mess
869,179 comments,13.9k,16 hours ago,r/TIHI,"Thanks, I Hate Angelina Buscemi/Steve Jolie"
870,140 comments,2.0k,4 hours ago,r/antiwork,I doubled my Pay
871,4 comments,547,3 hours ago,r/animememes,Great cosplay
872,7 comments,516,5 hours ago,r/StrangerThings,Merry Christmas!
873,55 comments,3.6k,10 hours ago,r/CasualUK,Who you gonna recall?
874,178 comments,3.0k,9 hours ago,r/todayilearned,"TIL the German peasents war (1524-1525) was a widespread popular revolt in some German-speaking areas in Central Europe. It failed because of intense opposition from the aristocracy, who slaughtered up to 100,000 of the 300,000 poorly armed peasants and farmers"
875,4 comments,711,6 hours ago,r/corgi,Merry Whatever 🎄 from my little Grinch to yours ❤️
876,2 comments,Vote,2 hours ago,r/surrealmemes,The holiday season is for bonding
877,3 comments,734,6 hours ago,r/nier,White Christmas [shinya_komi]
878,3 comments,370,3 hours ago,r/nathanwpyle,A R B I T E R
879,1 comment,553,4 hours ago,r/SympatheticMonsters,I hope you enjoy your Christmas as much as Mothman enjoys his lights. Artist: @CryptidClub
880,14 comments,4.4k,12 hours ago,r/starwarsmemes,You underestimate the...Wait! What now?
881,137 comments,5.1k,11 hours ago,r/therewasanattempt,To commit a hate crime
882,1 comment,410,3 hours ago,r/beetlejuicing,Going green
883,1 comment,708,16 hours ago,r/blessedimages,Spider Christmas
884,1 comment,708,16 hours ago,r/blessedimages,Blessed Spider Christmas
885,51 comments,1.8k,9 hours ago,r/FoodPorn,"Aussie style Christmas lunch - Assorted seafood, glazed ham, sous vide turkey, duck fat roasted potatoes, baked stuffing and salads."
886,36 comments,826,4 hours ago,r/Showerthoughts,Legends about dragons probably began because our ancestors unearthed dinosaur bones while mining.
887,13 comments,2.0k,9 hours ago,r/adhdmeme,My heart is butter.. this post is butter knife..
888,1 comment,680,6 hours ago,r/ImaginaryMonsters,Portal Monster by Ben Garriga
889,21 comments,2.8k,11 hours ago,r/tumblr,r/tumblr discovers smiling
890,144 comments,7.5k,13 hours ago,r/raimimemes,Tom Holland is one of us!
891,630 comments,17.0k,12 hours ago,r/HolUp,Female comedian disguises as a man to prove women are funny. Had mental breakdown when no one laughed.
892,32 comments,942,21 hours ago,r/PublicFreakout,HMC while I hold some fireworks
893,32 comments,942,21 hours ago,r/PublicFreakout,LET IT GO!
894,83 comments,1.6k,9 hours ago,r/Grimdank,Knowing what happened and how easy the perpetrators got off fills every man with primal rage
895,232 comments,1.1k,7 hours ago,r/science,Electric car supply chain carbon emissions lower than ICE vehicles. The total indirect emissions from electric vehicles pale in comparison to the indirect emissions from fossil fuel-powered vehicles
896,252 comments,729,4 hours ago,r/CryptoCurrency,"Theory: Memecoins that have had substantial pumps like DOGE will never reach their ATH again because memecoin investors want ""the next DOGE"", not DOGE"
897,16 comments,1.3k,5 hours ago,r/rareinsults,Well he's got a point
898,15 comments,1.5k,5 hours ago,r/meme,Why did you change the topic?
899,40 comments,736,4 hours ago,r/Gamingcirclejerk,I wonder what he had to say
900,204 comments,39.6k,17 hours ago,r/oddlyterrifying,Buy your ink
901,77 comments,844,5 hours ago,r/movies,The wedding scene in Godfather I where the bride's mother was singing is one of the most natural/ realistic scenes ever filmed in movie history imho.
902,36 comments,1.7k,8 hours ago,r/MinecraftMemes,"""Reduced Village Spawning"""
903,185 comments,1.3k,5 hours ago,r/nba,"Shaq on Nets bringing Kyrie Irving back: “I hate when people make a big stand about what they're gonna do. 'Oh Kyrie if you're not all in, don't even come.' The Nets organization wanna be all in, blah blah blah. Now the COVID thing came up & couple of guys are out. 'We'll let you play, Mr. Kyrie.'”"
904,376 comments,4.8k,9 hours ago,r/facepalm,You aren't supposed to pay taxes.
905,109 comments,3.3k,9 hours ago,r/Superstonk,I don’t care what generation you are apart of. Video games will forever thrive and so will GameStop! ❤️ Merry Christmas Apes! 🌲🎅🎁🦍
906,81 comments,1.0k,6 hours ago,r/RocketLeague,Merry Christmas to all the Left Goes players out there
907,77 comments,1.4k,8 hours ago,r/FortNiteBR,Been playing since day one and just had one of the best games of my life. 21 kills + this sweet no scope to win the game.
908,42 comments,768,5 hours ago,r/woodworking,Built my son an elevated bed for Christmas!
909,37 comments,5.2k,13 hours ago,r/dankvideos,Yo bro check this out
910,33 comments,919,6 hours ago,r/BeAmazed,Guy Makes a 3D Concrete Printer ...Prints a Castle
911,22 comments,1.3k,7 hours ago,r/funnyvideos,Rio de Janeiro is a war zone
912,40 comments,4.8k,12 hours ago,r/pokemon,Christmas
913,71 comments,7.7k,13 hours ago,r/me_irl,me_irl
914,26 comments,778,5 hours ago,r/Spiderman,Andrew Garfield vs. Tom Hardy. Please and thank you.
915,79 comments,1.3k,5 hours ago,r/IndianDankMemes,I am RAM BHAKT
916,31 comments,1.8k,9 hours ago,r/anime_irl,Anime_irl
917,26 comments,699,4 hours ago,r/Warframe,Nidus Prime polymer clay sculpture I was commissioned to make in November. Hope you'll like him!
918,26 comments,689,4 hours ago,r/AnarchyChess,I won my city's Chess Championship! Proud of this and thought I'd share.
919,84 comments,993,4 hours ago,r/OldSchoolCool,"As a kid in 1971, this was “the best gift I received, or would ever receive.” Merry Christmas everyone!"
920,22 comments,1.8k,9 hours ago,r/blackcats,My Local Cat Cafe / Adoption Center Posted This on Facebook. Though You All Might Enjoy It Too.
921,11 comments,586,2 hours ago,r/bi_irl,bi_irl
922,19 comments,1.0k,6 hours ago,r/NonPoliticalTwitter,Don't be that person
923,37 comments,1.3k,5 hours ago,r/DunderMifflin,Cheer or fear? Belsnickel is here! I judge your year as…
924,17 comments,5.1k,7 hours ago,r/dankmemes,Someone’s gotta teach them how things work…
925,13 comments,2.9k,12 hours ago,r/Memes_Of_The_Dank,haha balls
926,11 comments,780,5 hours ago,r/Konosuba,Kurisumasu party!
927,13 comments,958,6 hours ago,r/Deltarune,"Stole this template, not sorry"
928,57 comments,881,3 hours ago,r/blackmagicfuckery,would love an explanation for this
929,49 comments,937,4 hours ago,r/lgbt,I came out as trans a few months ago and I got a ton of small trans things from my parents. This one was probably my favorite. Genuinely started crying after getting this stuff
930,7 comments,1.1k,4 hours ago,r/AnimalsBeingJerks,"“It’s not Christmas yet!” But, almost there!!!"
931,45 comments,2.0k,5 hours ago,r/greentext,why we started
932,11 comments,622,4 hours ago,r/ComedyNecrophilia,Persona 2019 Joker
933,27 comments,2.4k,7 hours ago,r/WhitePeopleTwitter,Absolutely Brutal
934,6 comments,541,3 hours ago,r/BikiniBottomTwitter,Big facts.
935,20 comments,2.9k,7 hours ago,r/blursedimages,Blursed_hospital
936,48 comments,912,4 hours ago,r/LeagueOfMemes,Some team compositions I came up with
937,2 comments,848,6 hours ago,r/gravityfalls,It do be like that sometimes
938,14 comments,1.7k,7 hours ago,r/antimeme,Something is wrong
939,109 comments,1.5k,9 hours ago,r/MMA,"You have seen Khabib, GSP, Nunes vs Helen Yee. But have you seen Yee vs Rockhold"
940,44 comments,994,5 days ago,r/TikTokCringe,I have no words
941,44 comments,994,5 days ago,r/TikTokCringe,I don’t even know what to say other than wtf
942,563 comments,6.4k,13 hours ago,r/Cringetopia,"Dude sideswipes cop, runs from police, then plays victim once he gets arrested"
943,56 comments,415,4 hours ago,r/OMORI,"I have been wondering for a while about Aubrey's reaction, can someone please explain."
944,196 comments,483,5 hours ago,r/RoastMe,She can’t access to Reddit (because it’s blocked in China) but she asked me to be roasted!!! Bring it on! 🔥 .🔥
945,2 comments,987,8 hours ago,r/AccidentalWesAnderson,Through the window of a train
946,18 comments,490,5 hours ago,r/CODZombies,I love democracy
947,6 comments,600,4 hours ago,r/animegifs,Misunderstanding
948,10 comments,799,7 hours ago,r/KneadyCats,Hooooo... what should we do on Christmas? 🎶 on Christmas Day! 🎶 day in the morning!
949,24 comments,489,5 hours ago,r/KitchenConfidential,Christmas crab cakes for the family!
950,67 comments,1.4k,10 hours ago,r/TheSimpsons,Has anyone played this? Not what I was expecting but I’ll give it a shot I guess.
951,73 comments,5.2k,11 hours ago,r/Hololive,Thank you Aki
952,13 comments,1.3k,8 hours ago,r/HermitCraft,Merry Christmas in Boatem!
953,39 comments,908,8 hours ago,r/beatlescirclejerk,Checkmate BTS fans
954,7 comments,333,2 hours ago,r/webcomics,With great efficiency comes great responsibility.
955,31 comments,500,5 hours ago,r/ireland,"I’m absolutely bawling now, Mam just dropped me off an Isolation Christmas Dinner Hamper. Complete with a selection of cheese & a Christmas cracker. Jesus what a day."
956,62 comments,1.8k,10 hours ago,r/iamatotalpieceofshit,Man thinks its funny to ruin his dad’s first vr experience
957,6 comments,828,14 hours ago,r/rarepuppers,"Houdini got a little valium at the vet yesterday for his annual teeth cleaning and, well…"
958,6 comments,828,14 hours ago,r/rarepuppers,"Houdini got a little valium at the vet yesterday for his annual teeth cleaning and, well…"
959,11 comments,766,5 hours ago,r/MakeMeSuffer,Cursed elephant.
960,11 comments,766,5 hours ago,r/MakeMeSuffer,Never knew that about elephants.
961,3 comments,391,3 hours ago,r/boottoobig,I'm not sure how long I can take this
962,77 comments,357,3 hours ago,r/dndnext,Was anyone else surprised to find out gnomes are TALLER than Halflings?
963,21 comments,401,4 hours ago,r/AdviceAnimals,I’m hoping there are many in the same boat as me.
964,72 comments,Vote,2 hours ago,r/FullmetalAlchemist,Alphonse Elric has been eliminated! FMA: Elimination Game FINALE. Vote out your least favourite character
965,11 comments,Vote,2 hours ago,r/cursedcomments,Cursed_Adulthood
966,11 comments,2.4k,13 hours ago,r/Sneks,Merr Chrissmass!
967,195 comments,11.4k,17 hours ago,r/AnimalCrossing,"I still remember showing her around my island for the first time. Merry Christmas, mum. Hard to believe it's been almost 5 months."
968,133 comments,1.7k,12 hours ago,r/DungeonsAndDragons,Phase 1 “Lay out all painted minis”
969,250 comments,5.8k,12 hours ago,r/pics,First year as a single father and I think I did good. Merry Christmas 🎅
970,94 comments,4.4k,16 hours ago,r/JuJutsuKaisen,Definitely me rn
971,5 comments,891,8 hours ago,r/happycowgifs,Omg what a doll 💚
972,94 comments,697,7 hours ago,r/MomForAMinute,To all my children
973,7 comments,329,3 hours ago,r/saltierthancrait,"Merry Christmas, STC!"
974,66 comments,436,4 hours ago,r/BravoRealHousewives,I was traumatised
975,493 comments,575,4 hours ago,r/ufc,Who are the top 3 best strikers in the UFC right now?
976,26 comments,5.2k,15 hours ago,r/Catswithjobs,He has a long night a head of him.
977,22 comments,667,5 hours ago,r/SmashBrosUltimate,Pain….agony even….
978,26 comments,2.0k,8 hours ago,r/WatchPeopleDieInside,Losing her noodles
979,23 comments,1.4k,10 hours ago,r/destiny2,These are getting out of hand...
980,35 comments,466,5 hours ago,r/arduino,Made a little Christmas gift for coworkers. It’s an LED company logo :D
981,6 comments,770,7 hours ago,r/RWBY,Happy Holidays (kumafromtaiwan)
982,43 comments,414,4 hours ago,r/BassGuitar,"Got my first electric bass for christmas! Gretsch is the name on the box, but I don’t know the specific model."
983,73 comments,907,6 hours ago,r/gtaonline,I'm high and alone at home on GTA for Christmas. It's a tradition now
984,9 comments,708,5 hours ago,r/MemeVideos,Epic battle
985,11 comments,654,5 hours ago,r/intermittentfasting,This is how Santa looks since he started IF 😂
986,43 comments,585,6 hours ago,r/Military,What rank is Plank
987,14 comments,304,2 hours ago,r/BaldursGate3,Happy Holidays from Larian Studios
988,23 comments,637,6 hours ago,r/shittytechnicals,Land Rover half track indian army technical
989,5 comments,1.3k,10 hours ago,r/dank_meme,"Oh god, you actually right"
990,21 comments,523,3 hours ago,r/ATBGE,Stupid Sexy Flanders
991,270 comments,7.5k,16 hours ago,r/MapPorn,America If You Scaled Each State To The Value Of It’s Housing
992,39 comments,1.0k,9 hours ago,r/AnimeFunny,Merry Christmas guys!!!
993,87 comments,357,3 hours ago,r/tifu,TIFU by forgetting to take out my period cup for almost a month!
994,237 comments,1.0k,5 hours ago,r/politics,Democrats' Betrayals Are Jeopardizing American Democracy
995,12 comments,471,5 hours ago,r/torties,The gift I got of my tortie
996,37 comments,716,5 hours ago,r/ThatsInsane,"The ultimate apocalypse weapon, until you run out of gas."
997,137 comments,1.6k,12 hours ago,r/creepyPMs,"im a 14 year old male, the female is 27, asking for MY nudes"
998,149 comments,11.8k,16 hours ago,r/KidsAreFuckingStupid,No presents:(
999,21 comments,1.4k,5 hours ago,r/whenthe,ros
1000,14 comments,672,7 hours ago,r/Sims4,"My sim had twins with Vlad, I named the boy Vladislaus Straud V and look! He IS the Vlad!"
1001,30 comments,547,6 hours ago,r/InsanePeopleQuora,Maybe Because They Speak English...?
1002,53 comments,1.3k,8 hours ago,r/vexillologycirclejerk,Can you identify what flag is this? China? or Soviet?
1003,65 comments,792,8 hours ago,r/greece,Βασισμένο μιμιδιο
1004,29 comments,1.0k,9 hours ago,r/pettyrevenge,"Demand my math answers? Ok then, guess you'll fail math class."
1005,20 comments,410,4 hours ago,r/Mid_Century,Merry Mid Century Christmas! 🎄
1006,8 comments,458,5 hours ago,r/sololeveling,The wife made me a portrait of my best boy for Christmas
1007,23 comments,854,6 hours ago,r/TheLastAirbender,Two Sky bisons are better than one (I got the smaller one for this Christmas)
1008,15 comments,489,5 hours ago,r/5ToubunNoHanayome,For Team Yotsuba 💚🙃
1009,20 comments,1.3k,10 hours ago,r/MadeMeCry,Faith in humanity restored
1010,67 comments,497,5 hours ago,r/HelluvaBoss,"Who would win in an unarmed fight (no conventional weapons, just fists and nail and what they have on)"
1011,20 comments,2.0k,13 hours ago,r/WritingPrompts,"[WP] “Is that a….” The nuke explodes harmlessly against the alien starships shields. “Child’s toy? Yes,” the tired alien said. They were part of a group that helped the more…dumb races of the universe develop and evolve. But this race of “humans” would soon prove rather…difficult to educate."
1012,342 comments,11.2k,15 hours ago,r/todayilearned,TIL the James Webb Space Telescope is so sensitive it could theoretically detect the heat signature of a bumble bee at the distance of the moon.
1013,11 comments,423,4 hours ago,r/guineapigs,I think she likes her Christmas present
1014,6 comments,504,5 hours ago,r/TheDepthsBelow,A Christmas present my Fiancé drew me of my favourite creature!
1015,856 comments,2.2k,5 hours ago,r/antiwork,“1 Million Dollars Isn’t a lot of Money”
1016,61 comments,458,5 hours ago,r/UnresolvedMysteries,UFO Enthusiast Granger Taylor Disappeared After Claiming That Aliens Invited Him On A Space Trip
1017,175 comments,4.3k,15 hours ago,r/TwoSentenceHorror,"After 2 years of searching, she finally found her lost son."
1018,36 comments,689,7 hours ago,r/Kenshi,Mfw I see another Kenshi nude mod
1019,6 comments,543,12 hours ago,r/FunnyandSad,free if you’re under a specified income.
1020,6 comments,543,12 hours ago,r/FunnyandSad,free if you’re under a specified income.
1021,27 comments,521,5 hours ago,r/brasil,A importância de você se vacinar!
1022,9 comments,647,5 hours ago,r/Eldenring,If it was pot boy
1023,3 comments,598,6 hours ago,r/ImaginaryLandscapes,Hogwarts by Kevin Gnutzmans
1024,6 comments,1.2k,10 hours ago,r/HistoryAnimemes,I post Spanish History memes whenever I feel like doing so (day 150)
1025,38 comments,780,8 hours ago,r/tea,Got the same but different gift from three people :)
1026,14 comments,1.0k,9 hours ago,r/Unexpected,Seagull 👍
1027,14 comments,1.0k,9 hours ago,r/Unexpected,Jonathon Livingston
1028,7 comments,388,4 hours ago,r/Guacamole_penis,🤔
1029,111 comments,5.0k,11 hours ago,r/ich_iel,ich💉iel
1030,84 comments,2.6k,12 hours ago,r/2007scape,I killed some guy's HCIM at work today
