comment_count,upvote_delta,timeup_list,subreddit,thread_text
143 comments,4.9k,11 hours ago,r/formuladank,NO MICHAEL NO
32 comments,711,7 hours ago,r/TNOmod,Merry Christmas and Happy Holidays from the Illusions' End team to our community!
27 comments,1.5k,9 hours ago,r/Simulated,(OC) Marble rigid body physics. Motor constraint is turning the lifting mechanism
22 comments,695,6 hours ago,r/RWBY,Qrow and Raven may be misusing their bird forms...(TehShraid)
129 comments,1.5k,5 hours ago,r/nba,"Shai Gilgeous-Alexander has more total wins and less total losses than Luka Doncic, Trae Young and Deandre Ayton"
35 comments,712,5 hours ago,r/brasil,mais um ano consecutivo
44 comments,950,8 hours ago,r/playrust,I built a real life auto turret (nerf gun) that shoots me in the face
43 comments,2.5k,12 hours ago,r/AmongUs,"My best friend absolutely can’t stand Among us, so I made this Christmas wrap just for him"
47 comments,2.1k,7 hours ago,r/holdmycosmo,HMC while make a quick exit
57 comments,2.5k,12 hours ago,r/drawing,I drew a beautiful worm
15 comments,2.5k,2 years ago,r/CozyPlaces,Lego world needs some rain too
15 comments,2.5k,2 years ago,r/CozyPlaces,Cozy Lego
6 comments,1.4k,8 hours ago,r/onejob,Ummm I guess
40 comments,604,6 hours ago,r/GTA,What the fuck do I do now
32 comments,751,7 hours ago,r/vandwellers,Winter is here. Picture was taken in a snow storm in Denmark
31 comments,942,1 day ago,r/interestingasfuck,"An undercover police officer on duty. New York, Brooklyn, 1 July 1969."
31 comments,942,1 day ago,r/interestingasfuck,"An undercover police officer on duty. New York, Brooklyn, 1 July 1969."
80 comments,2.4k,7 hours ago,r/Minecraft,"Heard they added a new dimension this update, but I can't seem to get it to work :/"
44 comments,2.1k,7 hours ago,r/Art,"Stylized portrait 2, me, markers, 2021"
41 comments,953,7 hours ago,r/HelluvaBoss,They are coming to lewd her
42 comments,2.5k,14 hours ago,r/FoodPorn,Double smoked ham with pineapple brown sugar glaze
38 comments,2.3k,13 hours ago,r/Stellaris,"Not on the level as everyone else's, but here's my fanart."
31 comments,879,6 hours ago,r/distressingmemes,Nice swim with friends
36 comments,4.1k,15 hours ago,r/MostBeautiful,"Sunlight through the trees at St. Anne's Park, Dublin, Ireland."
42 comments,1.2k,8 hours ago,r/CallOfDuty,[MW2] Here's a sight for sore eyes
29 comments,4.8k,15 hours ago,r/boottoobig,"I have questions, I can't linger"
44 comments,957,8 hours ago,r/lostpause,Lickable tv
43 comments,1.5k,10 hours ago,r/Cyberpunk,"Repair Shop, by me. 2021."
42 comments,6.2k,16 hours ago,r/Cursed_Images,cursed merc
7 comments,629,4 hours ago,r/Embroidery,First time doing this thread pull finish. It is oh so viscerally satisfying.
10 comments,1.3k,8 hours ago,r/TrashTaste,Bigguk Digguk
28 comments,1.0k,9 hours ago,r/arresteddevelopment,The sneakiest variant is coming
32 comments,1.8k,10 hours ago,r/CatsEnjoyingPets,My dear old lady still enjoy pets even at 22
14 comments,1.1k,7 hours ago,r/ShittyLifeProTips,"SLPT: Need to take a cab but don’t have any money? Get in a cab and have the driver drive 10 feet then get out. Since his meter won’t charge you for 10 feet, repeat this until you get to your destination for free."
22 comments,986,8 hours ago,r/FireEmblemThreeHouses,Drawing FE3H Badly Until a New Fire Emblem Game is Announced - Day 161
6 comments,1.4k,4 hours ago,r/BrandNewSentence,Imagine being abducted by aliens and they give you a Gucci belt
157 comments,1.8k,7 hours ago,r/thatHappened,Wtf is this? The teacher started giving him head in front of the class in 6th grade?!?!
15 comments,550,2 hours ago,r/tuckedinkitties,It was suggested to me that this moment with Amadeus would belong here. Good vibes friends ✌🏾✌🏾✌🏾
58 comments,8.2k,14 hours ago,r/EarthPorn,"Milky Way gleaming over Indian Rock, Yosemite National Park [OC][3648x5472]"
39 comments,2.0k,7 hours ago,r/shittymoviedetails,"In Ready Player One (2018) we can see players are still using Tracer's OW1 design, this is because in 2044 OW2 will still be in development hell"
34 comments,789,7 hours ago,r/Borderlands2,That's a good point there Sonic
29 comments,924,8 hours ago,r/parrots,Spreading Birb Love: Day 29
26 comments,795,7 hours ago,r/TeamfightTactics,My Ziggs every round
88 comments,9.0k,14 hours ago,r/gayspiderbrothel,rap god
92 comments,6.4k,12 hours ago,r/ToiletPaperUSA,Ben and Jordan explore a sexual kink
32 comments,770,5 hours ago,r/Rainbow6,"I’m a new player, here is my best play so far :)"
6 comments,703,9 hours ago,r/blursedimages,He just need an update.
6 comments,703,9 hours ago,r/blursedimages,Blursed kritten
225 comments,1.1k,4 hours ago,r/NotHowGirlsWork,Ouch
26 comments,505,5 hours ago,r/badUIbattles,I remade reCAPTCHA to have chess. Introducing cancer captcha v4
61 comments,17.5k,16 hours ago,r/meirl,meirl
32 comments,1.6k,12 hours ago,r/webcomics,Stupid sock
13 comments,1.3k,8 hours ago,r/Overwatch_Memes,Reaper Shadow Step
112 comments,4.9k,11 hours ago,r/MakeMeSuffer,Idk if someone already posted this here
35 comments,1.6k,6 hours ago,r/specializedtools,Auto splitter
153 comments,4.0k,6 hours ago,r/Superstonk,Dec 23rd Smoothbrain News
20 comments,973,7 hours ago,r/MonsterHunterWorld,A blood red flash in the night: My art of the Nargacuga Night Wings!
124 comments,1.5k,5 hours ago,r/OldSchoolCool,David Hasselhoff - 1980s to 2020s
23 comments,543,5 hours ago,r/FuckNestle,Found this and thought I'd share
16 comments,734,5 hours ago,r/vexillology,Croatian flag sits on top of damaged Vukovar Water Tower credit: ANCJI
35 comments,2.7k,13 hours ago,r/im14andthisisdeep,Found this on Instagram today
19 comments,518,10 hours ago,r/WhitePeopleTwitter,Thoughts? Brazil’s democracy vs socialist party expectations
19 comments,518,10 hours ago,r/WhitePeopleTwitter,Every single time
15 comments,1.1k,8 hours ago,r/MonsterHunter,Mechatsune
16 comments,2.1k,11 hours ago,r/funnysigns,"Just stole it straight of discord, but it made me laugh."
34 comments,595,4 hours ago,r/cringepics,"Idk why, but this makes me feel weird"
25 comments,1.1k,15 hours ago,r/oddlyspecific,you would be just some guy
25 comments,1.1k,15 hours ago,r/oddlyspecific,That must suck
31 comments,1.1k,8 hours ago,r/torties,Peony looks like she just discovered that her rich & much older husband died
33 comments,1.2k,9 hours ago,r/terriblefacebookmemes,Holy cr*p mom got owned
12 comments,1.2k,8 hours ago,r/Catloaf,"This might be Woody’s most perfect loaf ever. 10/10 perfectly tucked feetsies, with a 10/10 tail tuck to side. I’d say he’s ready to compete professionally."
24 comments,Vote,2 hours ago,r/StardewValley,"Don't tell anyone, but I'm about to pull a hilarious prank on the whole village!"
27 comments,2.1k,12 hours ago,r/ShingekiNoKyojin,YouSeeBIGGIRL/T:T (Artwork credits - taba00000)
29 comments,1.7k,11 hours ago,r/MemeVideos,A sequel
28 comments,2.0k,12 hours ago,r/Outdoors,Looking after number one
19 comments,2.4k,12 hours ago,r/adventuretime,My real life dog's leg looking like something Jake would do. Immediately thought of adventure time
27 comments,747,7 hours ago,r/catpics,Girlfriend sent me this photo of her cat this morning
27 comments,1.3k,9 hours ago,r/gaybros,Under the mistletoe by @JojiArt
54 comments,2.1k,7 hours ago,r/marvelmemes,Nuts
27 comments,2.1k,12 hours ago,r/ItemShop,"Tomabunny, a healing item what taste like a tomato and it's shaped like a bunny. Recovers 30 HP"
28 comments,1.3k,9 hours ago,r/BlackClover,My Noelle Silva Cosplay :D
20 comments,1.1k,8 hours ago,r/carporn,Honda NSX. [1080 x 1080]
20 comments,900,7 hours ago,r/squidgame,Petition to change the sub logo
24 comments,2.0k,11 hours ago,r/PetsareAmazing,"""Looks like you're finished with this, thankyou and goodbye"""
220 comments,7.8k,14 hours ago,r/maybemaybemaybe,Maybe maybe maybe
24 comments,799,6 hours ago,r/valheim,Closing the year with my version of a Great Hall.
22 comments,457,4 hours ago,r/MildlyVandalised,Richard can't catch a break
23 comments,722,6 hours ago,r/Helltaker,I think we al know where this is going...
18 comments,2.0k,11 hours ago,r/teefies,When I can find my staple remover…no he’s not stuck
21 comments,4.9k,16 hours ago,r/SequelMemes,I'm so hyped
21 comments,629,5 hours ago,r/OldPhotosInRealLife,"Not sure if this is allowed, not my photos. Link to the Tik Tok in comments."
21 comments,569,6 hours ago,r/transformers,Presents Are the Right of All Sentient Beings
21 comments,1.7k,11 hours ago,r/TouchThaFishy,Touch Tha Face
235 comments,1.2k,4 hours ago,r/movies,I love the movie Tremors
238 comments,1.1k,4 hours ago,r/DunderMifflin,"“Fashion show, fashion show, fashion show at lunch!” What lines from the show get stuck in your head?"
21 comments,674,7 hours ago,r/FIFA,Didnt know that 5* skills are also useful for defending...
20 comments,861,8 hours ago,r/uselessredcircle,Oh thanks
20 comments,1.0k,9 hours ago,r/lgbtmemes,i found some more
19 comments,778,7 hours ago,r/LiminalSpace,When I Come Undone
20 comments,584,5 hours ago,r/jschlatt,Catshlatt
16 comments,584,4 hours ago,r/SpidermanPS4,I finally got a picture of capturing a pigeon.
19 comments,453,5 hours ago,r/Hornyjail,Yea
17 comments,423,4 hours ago,r/fnv,My Deathclaw pin hidden under my fringe jacket. Always have some Fallout somewhere on me. Ring-a-ding baby.
235 comments,829,2 hours ago,r/dataisbeautiful,Pornhub 2021 insights
107 comments,948,3 hours ago,r/science,"Children who engage the most with princess culture report more egalitarian attitudes about gender roles, lower adherence to hyper-masculine norms, and better body esteem five years later."
96 comments,2.1k,8 hours ago,r/technology,"Seconds before a 6.2 earthquake rattled California, phones got a vital warning | Half a million phones received emergency alerts thanks to system offering a few seconds to take cover"
16 comments,781,7 hours ago,r/ParadoxExtra,I never needed migration treaties.
17 comments,1.1k,9 hours ago,r/PetTheDamnDog,12 year old Molli is persistent
77 comments,3.1k,10 hours ago,r/AnimalsBeingJerks,A marten wreaking havoc in a German supermarket
10 comments,751,6 hours ago,r/StartledCats,Startled by water
16 comments,414,4 hours ago,r/NFCNorthMemeWar,KEVIN!
12 comments,2.6k,12 hours ago,r/lostredditors,in a sub about drawing
18 comments,1.7k,11 hours ago,r/tf2shitposterclub,this meme i made about altitude
57 comments,1.3k,5 hours ago,r/BikiniBottomTwitter,The Military–Industrial Complex
15 comments,1.8k,11 hours ago,r/PERSoNA,This calls for a celebration
88 comments,2.3k,9 hours ago,r/Grimdank,I got this tattoo and then got COVID literally a week later... I dont know what I expected
135 comments,1.3k,5 hours ago,r/unpopularopinion,Taking a nap in your automobile should be fully legal and never frowned upon.
49 comments,1.3k,6 hours ago,r/space,"I made this short video as a tribute to the US Apollo Space Program, I hope you like it."
168 comments,3.1k,6 hours ago,r/aww,Merry (early) Christmas Reddit. I had a little girl today.
35 comments,1.6k,3 hours ago,r/pics,"""The optimist"": my 91 year old grandfather's lockdown creation"
131 comments,1.4k,6 hours ago,r/Genshin_Impact_Leaks,New event boss
2 comments,1.1k,8 hours ago,r/cowboybebop,I hope this format catches on more here
14 comments,447,3 hours ago,r/yakuzagames,We need this for Yakuza 8
5 comments,659,10 hours ago,r/interestingasfuck,Lynx kitten
5 comments,659,10 hours ago,r/interestingasfuck,We received a visit from a Lynx kitten a few years ago
53 comments,Vote,1 hour ago,r/WinStupidPrizes,Attention seeker gets well deserved attention
146 comments,11.7k,9 hours ago,r/dankmemes,Let's make Dankmemes Dank again
14 comments,417,4 hours ago,r/danganronpa,Seasons greetings from Kaede
13 comments,715,7 hours ago,r/PaymoneyWubby,The Wubby is rising
46 comments,917,3 hours ago,r/therewasanattempt,To play with a golden retriever
73 comments,3.4k,10 hours ago,r/Deltarune,I just notice that ralsei laugh pose is almost identical to toriel thats really a cool detail
12 comments,1.1k,8 hours ago,r/PandR,My last day as an elected official is at the end of this month. This show is more accurate than most realize.
126 comments,3.6k,7 hours ago,r/mildlyinteresting,TV Remote in my Grandmother’s Nursing Home
7 comments,689,6 hours ago,r/nathanwpyle,A N E C D O T E
12 comments,731,7 hours ago,r/Guacamole_penis,He's literally me
106 comments,1.2k,2 hours ago,r/dndmemes,Based on a real discussion with my friends
10 comments,850,7 hours ago,r/goodboomerhumor,This gem found on facebook
10 comments,519,4 hours ago,r/Visiblemending,Covered a small stain on my bra
130 comments,15.9k,17 hours ago,r/HistoryPorn,"Eiffel Tower under construction, July 1888 [Colorized] [1080x783]"
40 comments,1.2k,5 hours ago,r/WhatsWrongWithYourDog,Since he was so loved here last time: Here is a compilation of Summit and all of his weird faces pt 2
10 comments,1.3k,10 hours ago,r/Komi_san,Mi celebrating the last episode of first season of Komi san
10 comments,671,6 hours ago,r/shieldbro,Merry Christmas (馬の助) [The Rising of the Shield Hero]
10 comments,597,5 hours ago,r/Angryupvote,Angry German Pharma?
96 comments,3.6k,7 hours ago,r/HolUp,…..
8 comments,1.4k,10 hours ago,r/ZeroWaste,My late grandparents used to send us giant packs of apples in these containers that my parents have been using as Xmas ornament cases for decades.
7 comments,1.1k,9 hours ago,r/GoodFakeTexts,He just wanna see a cat
25 comments,2.1k,9 hours ago,r/titanfall,"New chassis, same titan"
7 comments,1.0k,9 hours ago,r/barkour,Bouncy Barkour
6 comments,1.5k,12 hours ago,r/MemeAddicts101,"Yo, the memes down there"
6 comments,1.5k,12 hours ago,r/MemeAddicts101,It's the most wonderful time of the year
5 comments,812,8 hours ago,r/animememes,naruto memes for you'll;)
23 comments,1.1k,5 hours ago,r/PewdiepieSubmissions,All crust
169 comments,2.3k,5 hours ago,r/oddlysatisfying,removing the burnt part of a pizza
241 comments,3.2k,7 hours ago,r/Tinder,I hate dating.
261 comments,3.3k,7 hours ago,r/LifeProTips,"LPT: Burgers ""Made with 100% beef"" means the beef USED in that burger is 100% beef, not that the burger patty itself is 100% beef. This is a marketing tactic. More examples in the description."
74 comments,1.8k,8 hours ago,r/apexlegends,Mirage secret BUFF!
75 comments,3.5k,12 hours ago,r/ATBGE,This eye contact eye face makeup
50 comments,4.5k,13 hours ago,r/freefolk,true :D
21 comments,1.3k,6 hours ago,r/hmmm,hmmm
62 comments,1.9k,8 hours ago,r/gtaonline,I have 2 million dollars worth of carpal tunnel inflammation
63 comments,2.4k,10 hours ago,r/blackcats,"Picked this guy up under a bush over a year ago. His name is Dirt, and he is the weirdest cat I've even met"
120 comments,4.6k,9 hours ago,r/BlackPeopleTwitter,Netflix and Lick
45 comments,10.5k,11 hours ago,r/wholesomememes,He loves the lights
147 comments,3.4k,8 hours ago,r/cats,I present to you: George
17 comments,Vote,8 hours ago,r/cats,"Welcome to the season of movie marathons, overindulgence, and not needing an excuse to leave the couch. Got anything good you're binging that you just *need* people to know about? Comment below for bragging rights, and maybe some Reddit Gold."
20 comments,7.1k,10 hours ago,r/PrequelMemes,Crossover Meme
3 comments,1.3k,6 hours ago,r/perfectlycutscreams,nein
22 comments,5.6k,12 hours ago,r/cursedcomments,Cursed_answer
57 comments,3.6k,12 hours ago,r/starwarsmemes,Meme of the year
34 comments,997,9 hours ago,r/MakeupAddiction,"Thank you to everyone here who helped me feel comfortable enough to do my wedding makeup. I'm checking in after my post 3 months ago because I just got back wedding pictures. I've never felt more beautiful. Seriously, thank you so much, MUA!"
8 comments,868,5 hours ago,r/HydroHomies,Keep up!
139 comments,919,9 hours ago,r/SonicTheHedgehog,I never imagined two years ago that this is the discussion we'd be having
19 comments,1.4k,11 hours ago,r/Superbowl,This is my young male barn owl name Orbit. ( lets think of a good caption for him)
64 comments,1.8k,9 hours ago,r/AdviceAnimals,No need to gatekeep health
18 comments,773,8 hours ago,r/CatsStandingUp,Cat.
23 comments,1.1k,10 hours ago,r/Animal_Sanctuary,"Desi’s extraordinary rehabilitation and recovery thanks to his loving, dedicated caretakers at Live Freely Sanctuary"
34 comments,2.2k,13 hours ago,r/NoMansSkyTheGame,"Drink up, buddy. That was a lot of jumps just now 🚰"
11 comments,837,8 hours ago,r/HuskyTantrums,People say you sound like a Honda Civic
51 comments,1.7k,12 hours ago,r/analog,Kayla • Mamiya Rz67 Pro ll | 65mm F/4 L-A Floating System / Kodak Portra 400
15 comments,2.9k,15 hours ago,r/yesyesyesno,Late evening walks be like
23 comments,2.1k,9 hours ago,r/me_irlgbt,Me_irlgbt
54 comments,698,3 hours ago,r/DestinyTheGame,Please un-nerf Xenophage.
15 comments,1.5k,11 months ago,r/AreTheCisOk,"Congratulations, you played yourself"
15 comments,1.5k,11 months ago,r/AreTheCisOk,"Congratulations, you played yourself"
16 comments,391,4 hours ago,r/thanksihateit,Thanks I hate Poland
33 comments,616,6 hours ago,r/MadeMeCry,Just watch trust me
125 comments,963,9 hours ago,r/pugs,R.I.P Handsome Samsom
1.4k comments,2.1k,10 hours ago,r/DnD,Tell me you play DND without telling me you play DnD
19 comments,1.7k,12 hours ago,r/nukedmemes,"It’s a bird, or an air raid siren. Your choice."
36 comments,2.1k,13 hours ago,r/arknights,Elite Smoothie 🦏🥤
79 comments,3.4k,12 hours ago,r/IllegallySmolCats,"Little Merlin is back at the shelter and I missed him! His foster returned him early, so now I get to foster him until he reaches 2 lbs. The meow! ❤"
39 comments,445,5 hours ago,r/touhou,suika's gift to the masses
14 comments,1.1k,10 hours ago,r/Catculations,catculating laser bug…
97 comments,3.0k,15 hours ago,r/RoughRomanMemes,Total war players get this
251 comments,1.6k,12 hours ago,r/BMW,They stole my steering wheel! I didn’t even know these were valuable
54 comments,1.3k,11 hours ago,r/MomForAMinute,got 5 A’s and 1 C+ after trying to unalive myself earlier this semester and spending a lot of time recovering from the trauma of being hospitalized in a psych ward let’s celebrate this win !
80 comments,6.2k,10 hours ago,r/whenthe,Spider-cuck
35 comments,1.7k,9 hours ago,r/blackmagicfuckery,Teleport
13 comments,605,6 hours ago,r/Im15AndThisIsYeet,I’m 15 and this is yeet
301 comments,2.2k,10 hours ago,r/Berserk,So I recently started watching SAO and I have to ask… What the fuck is this?
557 comments,7.6k,14 hours ago,r/Showerthoughts,"It somehow became socially acceptable for a straight woman to put stuff in her butt, yet not so acceptable for a straight man to put stuff in his."
29 comments,1.9k,9 hours ago,r/shittyrainbow6,Thankfully I managed to cancel it before the worst happened
73 comments,601,7 hours ago,r/mexico,NO LO HAGA COMPA!
13 comments,2.3k,10 hours ago,r/AnimalsBeingBros,"He always got the ‘hurry up, grandpa’ look back."
19 comments,1.3k,3 hours ago,r/HumansBeingBros,"Someone put out a heater for cold street dogs in Kathmandu, Nepal"
99 comments,872,9 hours ago,r/melbourne,Bicycle gutters
68 comments,2.6k,14 hours ago,r/DesignPorn,Scarface - Limited Edition Blu-ray (SteelBook) Cover
17 comments,796,8 hours ago,r/rugbyunion,It’s been 4 years since Rugby Twitter gave us this great moment
20 comments,2.1k,9 hours ago,r/jacksepticeye,How BB feels about Christmas VS How he feels seeing Sean's Home for Christmas
88 comments,908,9 hours ago,r/fo4,Something is wrong with my Pip-Boy
4 comments,543,14 hours ago,r/ArtefactPorn,An underwater statue at the sunken Roman city of Baiae. 100 BC to AD 500. (1052X1190)
4 comments,543,14 hours ago,r/ArtefactPorn,An underwater statue at the sunken Roman city of Baiae. 100 BC to AD 500. (1052X1190)
10 comments,777,8 hours ago,r/samoyeds,"On our way home! Meet our new floof, Lia :)"
24 comments,1.8k,9 hours ago,r/Eldenring,Years of content even after release
36 comments,1.8k,13 hours ago,r/HalfLife,Patrick Bateman playing half life
19 comments,406,4 hours ago,r/DemonSlayerAnime,"The longer you look, the better it gets"
40 comments,832,9 hours ago,r/GreenBayPackers,DT Kenny Clark cleared from COVID and is back at practice
20 comments,1.3k,11 hours ago,r/okmatewanker,Big tech manipulation smh
21 comments,634,7 hours ago,r/FallenOrder,Cal invaded Holiday Matsuri in Orlando over the weekend!
8 comments,409,4 hours ago,r/EnjiNight,Christmas reveal
115 comments,10.2k,12 hours ago,r/AnimalsBeingDerps,You spin me right round
15 comments,560,6 hours ago,r/bingingwithbabish,It had to be done
35 comments,332,3 hours ago,r/CoronavirusDownunder,"My House R_eff as of December 24th, with daily cases and restrictions. Latest estimate: R_eff = 1.00 ± 0.10. (image with linear scale)"
36 comments,1.3k,7 hours ago,r/clevercomebacks,Clever baby
5 comments,657,7 hours ago,r/agedlikewine,[SPIDERMAN NWH SPOILERS] Dude got his wish.
15 comments,606,7 hours ago,r/ShitpostXIV,A random person walked straight into a trap
7 comments,1.6k,12 hours ago,r/happycowgifs,Cow who was recently rescued by an animal sanctuary gets some zoomies after being introduced to their new friends for the first time
49 comments,1.2k,7 hours ago,r/sports,Army's Cole Talley kicks a game-winning field goal as time expires to defeat Missouri in the 2021 Armed Forces Bowl.
42 comments,2.3k,10 hours ago,r/LeagueOfMemes,I'll get through every champ eventually
27 comments,1.5k,12 hours ago,r/okbuddyhololive,GO WHITE GIRL GO!!!!
11 comments,314,3 hours ago,r/creepyasterisks,damn *lactates*
249 comments,1.4k,8 hours ago,r/Conservative,Run for your lives!!
1.8k comments,3.2k,12 hours ago,r/AskMen,What is something that women wear that really catches your attention?
16 comments,1.5k,12 hours ago,r/DevilMayCry,Rtx activated
12 comments,1.5k,12 hours ago,r/airplaneears,AAAAAHHHH
15 comments,Vote,2 hours ago,r/LivestreamFail,Technoblade gives update on his cancer - 99.9% less cancer and right arm did not have to be amputated
9 comments,1.4k,11 hours ago,r/LilGrabbies,Cheerios: the best incentive for Chinmas pics
93 comments,10.7k,16 hours ago,r/KidsAreFuckingStupid,They say baby making makes you hungry..
127 comments,439,5 hours ago,r/TarkovMemes,Found my new wallpaper
38 comments,503,6 hours ago,r/Gunpla,You can stop scrolling now. This is the PG you've been looking for.
9 comments,401,4 hours ago,r/Steam,PSA: For anyone interested in XCOM you should know that EW is included in the complete bundle but is marked as the same price.
31 comments,1.1k,10 hours ago,r/worldbuilding,Little Christmas Gift I created: The Dragon Rabbit (Drachninchen)
3.8k comments,58.1k,15 hours ago,r/mildlyinfuriating,Meals (1 per person) we get at my job for shifts up to 12hrs
51 comments,598,7 hours ago,r/VRchat,Soon
13 comments,636,7 hours ago,r/ralsei,Eeehh…
28 comments,624,7 hours ago,r/boburnham,"bruh, bo is in the new roku screen thingy"
106 comments,2.5k,14 hours ago,r/Naturewasmetal,"Doodle by HodariNundu inspired by Australian aboriginal stories about giant, long armed, man-killing kangaroos, and how ancestral people learned to overcome them. Procoptodon goliah went extinct around 15,000 years ago. Some Dreamtime stories are said to be much older than that!"
96 comments,2.2k,14 hours ago,r/techsupportgore,Is this what them kids call PoE?
29 comments,Vote,14 hours ago,r/techsupportgore,Your best life has entered the chat. You’ve got 30 minutes to assemble an amazing afternoon using only Velveeta and what’s around you—what do you do? Best answers get gold.
313 comments,1.6k,12 hours ago,r/ontario,Ontario calls for volunteers for vaccination yet Ford sitting on billions of dollars of unspent COVID-19 fund since last year.
11 comments,484,6 hours ago,r/killedthecameraman,Breaking off a tire boot turns projectile
119 comments,1.3k,7 hours ago,r/Breath_of_the_Wild,If the Yiga only eat bananas then why would they need cups bowls spoons and knifes?
5 comments,466,5 hours ago,r/Blep,Wolfie's vacant stared blep
40 comments,3.6k,4 hours ago,r/memes,This gets me every damn time
37 comments,2.2k,6 hours ago,r/me_irl,Me_irl
152 comments,1.3k,11 hours ago,r/unrealengine,"I worked on AAA games like Skyrim and Fallout 3/4/76 for 17+ years, now I'm a solo indie dev making a Horror Hunting Simulator called The Axis Unseen. I've been using Unreal Engine 5 and it's awesome! Nanite and Lumen are game changers."
43 comments,479,6 hours ago,r/CalamityMod,broken af i literally only take 1 damage from every hostile creature
10 comments,1.1k,10 hours ago,r/lordoftherings,I told you to take the wizard's staff!
168 comments,1.5k,12 hours ago,r/poland,Say Wachowski again! SAY WACHOWSKI AGAIN! I DARE YOU
10 comments,639,7 hours ago,r/PrehistoricMemes,Imagine….
28 comments,2.9k,15 hours ago,r/SupermodelCats,Curly is my talented photography assistant
54 comments,679,4 hours ago,r/ClashRoyale,Just created the next generation 3.0 X-bow! Any thoughts?
