,comment_count,upvote_delta,timeup_list,subreddit,thread_text
0,565 comments,28.3k,5 hours ago,r/WhitePeopleTwitter,Hurting > Helping ….
1,24.8k comments,22.3k,6 hours ago,r/AskReddit,"What's your ""I fucking hate this song"" song?"
2,973 comments,25.5k,5 hours ago,r/Superstonk,A News Blackout on the Fed’s Naming of the Banks that Got Its Emergency Repo Loans; Some Journalists Appear to Be Under Gag Orders
3,8.4k comments,2.7k,4 hours ago,r/destiny2,GIVEAWAY: I'm giving away a pre-order of Destiny 2: The Witch Queen Deluxe Bundle ($100 value) to one comment in this thread
4,405 comments,41.0k,6 hours ago,r/MadeMeSmile,Priorities.
5,5.1k comments,41.9k,6 hours ago,r/pics,Mugshots of 8 of the right wing terrorists who plotted to kidnap the Democratic governor of Michigan
6,173 comments,15.6k,3 hours ago,r/rareinsults,This one got me
7,3.5k comments,11.2k,8 hours ago,r/teenagers,I will draw your FAVORITE CHARACTER (please wait since art takes time)
8,3.2k comments,32.1k,9 hours ago,r/facepalm,Destroying a sand sculpture
9,349 comments,20.5k,6 hours ago,r/TikTokCringe,Infinite power
10,3.2k comments,9.1k,5 hours ago,r/NoStupidQuestions,Damn so I'm 19 and I inherited 120k from my great-grandmother what do i do now?
11,2.5k comments,26.4k,6 hours ago,r/Wellthatsucks,"Sold my iPad in public space at night in Minnesotan -10F temperature, turned out it's fake."
12,2.6k comments,31.2k,7 hours ago,r/news,‘No one can win a nuclear war’: Superpowers release rare joint statement
13,457 comments,32.8k,6 hours ago,r/wallstreetbets,The answer which strengthens us
14,2.5k comments,31.1k,9 hours ago,r/politics,Maxine Waters Calls Marjorie Taylor Greene An 'Extremist Radical' Who Should Not Be In Congress
15,900 comments,30.3k,6 hours ago,r/coolguides,United States Elevation Map
16,1.7k comments,28.2k,6 hours ago,r/awfuleverything,Ordered pizzas from a new restaurant with absolutely zero ratings and got them like this
17,914 comments,12.5k,4 hours ago,r/antiwork,My mom got upset at how I treat my employee
18,2.3k comments,10.3k,16 hours ago,r/AskMen,Live in girlfriend of 6 years refers to me as a “housemate” when talking to male friends. What do?
19,928 comments,15.8k,5 hours ago,r/cats,Any reason why my cat just stares at me like this for hours?
20,278 comments,18.6k,6 hours ago,r/formuladank,Still can't believe this guy got dropped last season. Anyone remember his insane pole lap?
21,2.2k comments,16.2k,7 hours ago,r/LifeProTips,LPT: Don’t go the extra mile at your job
22,894 comments,28.9k,6 hours ago,r/BikiniBottomTwitter,YOU WHAT?!?!?
23,2.0k comments,10.6k,9 hours ago,r/TrueOffMyChest,I hate having children
24,1.5k comments,34.8k,6 hours ago,r/interestingasfuck,Video footage of a man's first moments of consciousness after waking up from being in a coma for 10 years
25,2.1k comments,41.6k,8 hours ago,r/nextfuckinglevel,An orangutan tries to fight off a bulldozer destroying his forest...
26,549 comments,10.8k,5 hours ago,r/PS5,Shaquille O'Neal Gifted 1000 PS5s And Nintendo Switches To Underprivileged Kids On Christmas: “My Parents Didn’t Have A Lot. But They Taught Me The Value of Giving Back.”
27,1.6k comments,15.9k,8 hours ago,r/movies,"""Not Another Teen Movie"" is such a good spoof movie in a decade when the genre died"
28,1.7k comments,9.6k,9 hours ago,r/Futurology,"US could be under rightwing dictator by 2030, Canadian professor warns | US politics"
29,1.8k comments,22.4k,7 hours ago,r/Tinder,Found one!
30,1.8k comments,2.7k,4 hours ago,r/canada,"Ontario closes schools until Jan. 17, bans indoor dining and cuts capacity limits"
31,298 comments,28.5k,6 hours ago,r/cursedcomments,Cursed_hotdog
32,1.7k comments,31.7k,8 hours ago,r/funny,Never gets old
33,130 comments,18.0k,7 hours ago,r/space,"FYI, as of January 1 all scientific journals of the American Astronomical Society (like the Astrophysical Journal) are open access!"
34,1.7k comments,13.4k,10 hours ago,r/dataisbeautiful,[OC] Every € me and my wife earned and spent living in Berlin 2021
35,100 comments,14.7k,5 hours ago,r/technicallythetruth,That's a lot of money
36,1.7k comments,38.4k,8 hours ago,r/ProgrammerHumor,"This not a joke, this is real Skype account creation. H O W"
37,1.5k comments,14.3k,7 hours ago,r/marvelstudios,What 2 characters would you have like to have seen interacted that never met on screen?
38,1.6k comments,16.8k,12 hours ago,r/Minecraft,Started an ambitious project. Can anyone tell what it is yet?
39,1.4k comments,25.1k,6 hours ago,r/unpopularopinion,It should be illegal for companies to advertise that a phone has a certain amount of space only for half of it to be occupied by the OS
40,653 comments,27.6k,7 hours ago,r/gaming,What's a sale?
41,294 comments,17.7k,6 hours ago,r/AnimalsBeingDerps,Cats in Istanbul as usual!
42,478 comments,54.1k,8 hours ago,r/Unexpected,Zoey is smart
43,146 comments,17.9k,5 hours ago,r/dankmemes,Those goddamn reposters
44,170 comments,13.5k,5 hours ago,r/Minecraft,Melon can be used like a grandma's wallpaper
45,1.3k comments,18.1k,8 hours ago,r/antiwork,"My grandmother just died, I have to be at work in an hour"
46,1.3k comments,8.5k,6 hours ago,r/maybemaybemaybe,Maybe Maybe Maybe
47,1.3k comments,15.2k,8 hours ago,r/pokemon,"What if... Sharpedo was longer? Tell me your own ""what if"" from Pokémon, I think some might be quite fun to draw!"
48,434 comments,27.3k,8 hours ago,r/Showerthoughts,Dogs would love it if dog food makers would put a toy in the bag like cereal.
49,129 comments,11.4k,5 hours ago,r/wholesomememes,Sometimes this is all it takes to make my day just a tad little better
50,1.2k comments,44.2k,9 hours ago,r/todayilearned,"TIL that, as a philanthropist, actor Paul Newman was counted as the person who had distributed more money - in relation to his own wealth - than any other American during the 20th century."
51,1.1k comments,14.7k,10 hours ago,r/WhitePeopleTwitter,It's really that easy
52,519 comments,41.2k,8 hours ago,r/aww,Doggo with floppy ears :)
53,1.1k comments,16.6k,8 hours ago,r/IdiotsInCars,90 Yr Old Man almost killed my Sister
54,1.1k comments,6.3k,12 hours ago,r/LeagueOfMemes,Which table you wanna sit at?
55,1.2k comments,51.0k,7 hours ago,r/memes,Don't you feel a bit scared?
56,1.0k comments,2.6k,5 hours ago,r/videos,Oprah Visits a County Where No Black Person Had Lived for 75 Years (1987)
57,76 comments,20.0k,7 hours ago,r/tumblr,hehe ancient boomer teachers
58,1.0k comments,9.1k,18 hours ago,r/StupidFood,"$1,000 Tomahawk Steak wrapped in 24k gold leaf"
59,362 comments,9.4k,7 hours ago,r/Coronavirus,"In Portugal, with 89% of the total population fully vaccinated, almost 90% of UCI Covid patients are unvaccinated"
60,1.0k comments,9.0k,6 hours ago,r/PublicFreakout,"Karen goes off on black man about ""caucasian"" being a slur"
61,493 comments,15.0k,6 hours ago,r/HolUp,Modern problems require ancient solutions.. I guess
62,3.0k comments,13.9k,6 hours ago,r/facepalm,Saw the recent post about the dude with a sign about Christian women and thought I'd share one I saw while on campus the one day.
63,967 comments,41.9k,8 hours ago,r/gaming,"IKEA made xbox and playstation sized boxes, that you can place and check if it will fit on the furniture you want to buy"
64,860 comments,32.3k,10 hours ago,r/worldnews,Japan bans facial recognition tech exports due to China's human rights abuses: Tokyo signals intention to work with US and other allies on future export restrictions.
65,465 comments,12.7k,6 hours ago,r/therewasanattempt,To eat a kid
66,607 comments,7.8k,6 hours ago,r/lifehacks,Keep your toddler safely in the grocery cart seat (and prevent abductions) with a carabiner.
67,1.0k comments,7.0k,4 hours ago,r/wallstreetbets,This is what Rivian cars look like. Buy Puts
68,839 comments,18.5k,9 hours ago,r/marvelmemes,I'm kinda done with the DCEU tbh
69,63 comments,9.0k,7 hours ago,r/BlackPeopleTwitter,There's no way they'd be able to 𝘤𝘭𝘢𝘱 back after this one
70,833 comments,896,3 hours ago,r/CFB,"Nick Saban asked if CFP expansion could help avoid semifinal blowouts: ""If this is the best four teams and they played each other, I don’t see the logic that if we had more teams, they would be better games. I don’t see how that adds up."""
71,598 comments,20.4k,8 hours ago,r/science,"Dog owners likely to report better emotional health during Covid-19 pandemic, study shows"
72,178 comments,5.9k,4 hours ago,r/WatchPeopleDieInside,He got ragdolled out of there.
73,826 comments,10.3k,9 hours ago,r/MapPorn,Map presenting coldest temperatures ever measured in Celcius...
74,594 comments,10.9k,10 hours ago,r/raimimemes,You can’t do this to me
75,713 comments,6.1k,12 hours ago,r/europe,2008 crisis and Pandemic create a lost decade for many European Countries. Which countries have higher or lower GDP nominal per capita in 2020 than 2008 (source: Worldbank)
76,205 comments,8.2k,7 hours ago,r/Justrolledintotheshop,When all else fails
77,188 comments,6.2k,21 hours ago,r/Music,"Singer Omarion Speaks Out: 'I Am an Artist, Not a COVID Variant'"
78,188 comments,6.2k,21 hours ago,r/Music,"Singer Omarion Speaks Out: 'I Am an Artist, Not a COVID Variant'"
79,776 comments,19.6k,9 hours ago,r/whenthe,enemy spotted
80,153 comments,7.8k,8 hours ago,r/Hololive,Towa confused by the superior idol step
81,676 comments,7.0k,16 hours ago,r/explainlikeimfive,ELI5: how does the ground not cave in while being under the heavy weight of cities?
82,575 comments,14.9k,7 hours ago,r/mildlyinfuriating,this packaging for 1 potato
83,63 comments,7.3k,6 hours ago,r/WhatsWrongWithYourDog,"You can't change the direction of the wind, but we can adjust the sails."
84,69 comments,6.2k,4 hours ago,r/PrequelMemes,100% a repost I'm sure. But this is probably one of my favorite Prequal/Star Wars memes.
85,886 comments,4.5k,7 hours ago,r/AnimalCrossing,What's your passport nickname?
86,736 comments,4.9k,13 hours ago,r/Battlefield,"100% impossible, you will all die"
87,491 comments,20.6k,15 hours ago,r/lotrmemes,Always have a backup Hobbit.
88,327 comments,22.2k,8 hours ago,r/Cringetopia,"Poor, poor guy"
89,162 comments,16.0k,8 hours ago,r/MurderedByWords,The sun will burn brighter
90,217 comments,18.3k,9 hours ago,r/oddlysatisfying,Titanium powder reacts with iodine monochloride
91,133 comments,23.4k,9 hours ago,r/Eyebleach,Cute kitten
92,553 comments,56.4k,20 hours ago,r/HumansBeingBros,Even the smallest gesture can make someone’s day :’)
93,335 comments,30.2k,10 hours ago,r/Art,"Space Milk ✨, levimagony, 3D, 2021"
94,121 comments,5.5k,5 hours ago,r/Terraria,oh you wanna see weird suitable houses?
95,641 comments,19.1k,9 hours ago,r/Damnthatsinteresting,Woman stabbed 32 times by her abusive ex-boyfriend ties the knot with the paramedic who rescued her life
96,664 comments,3.7k,6 hours ago,r/HermanCainAward,Washington guitarist thought mask and vaccine compliance was the same as being compliant to Hitler in the 30s. He has now played his last gig.
97,150 comments,16.0k,8 hours ago,r/blackmagicfuckery,This man out here lagging irl
98,89 comments,8.6k,6 hours ago,r/ShitPostCrusaders,Stray Cat is an absolute unit
99,171 comments,7.5k,6 hours ago,r/Bossfight,"Roo, the Ripped Liberator"
100,559 comments,10.0k,11 hours ago,r/ChoosingBeggars,"Bride cancels her wedding because her guests didn't ""donate"" a $1,500 each to fund the event"
101,438 comments,5.5k,7 hours ago,r/NotHowGirlsWork,Men just don't get it...
102,126 comments,6.8k,5 hours ago,r/antiwork,Relating to that cop situation
103,160 comments,3.2k,5 hours ago,r/PS5,Shaquille O'Neal Gifted 1000 PS5s And Nintendo Switches To Underprivileged Kids On Christmas: “My Parents Didn’t Have A Lot. But They Taught Me The Value of Giving Back.”
104,160 comments,3.2k,5 hours ago,r/PS5,Shaquille O'Neal Gifted 1000 PS5s And Nintendo Switches To Underprivileged Kids On Christmas: “My Parents Didn’t Have A Lot. But They Taught Me The Value of Giving Back.”
105,549 comments,3.1k,6 hours ago,r/cringepics,This is painful
106,350 comments,15.9k,7 hours ago,r/Showerthoughts,"Considering that the CIA confirmed Osama Bin Laden played online video games like CounterStrike, numerous people probably eliminated him over the years without realizing it was him."
107,499 comments,1.7k,6 hours ago,r/SquaredCircle,Big E had seven losses as WWE champion leading up to Day One
108,438 comments,13.7k,17 hours ago,r/AbruptChaos,Let's relax in the pool
109,512 comments,2.9k,9 hours ago,r/TooAfraidToAsk,I can’t find one of my balls. Please HELP !!!?
110,397 comments,2.9k,8 hours ago,r/Neverbrokeabone,Shot gun to the upper thigh Christmas Eve. Missed bone. Already walking.should be full recovery
111,370 comments,10.1k,9 hours ago,r/dndmemes,Spell Boi
112,106 comments,6.3k,6 hours ago,r/bonehurtingjuice,Could somebody actually translate this?
113,291 comments,5.1k,7 hours ago,r/tumblr,Harry Potter.
114,476 comments,7.3k,8 hours ago,r/AdviceAnimals,"I committed myself last year for suicidal thoughts, and can’t pay the bill for it."
115,116 comments,6.8k,5 hours ago,r/blursedimages,Blursed game
116,517 comments,2.4k,8 hours ago,r/InternetIsBeautiful,The International Flag of Planet Earth (IFOPE)
117,118 comments,1.2k,3 hours ago,r/TwoXChromosomes,My abusive ex gets to hug me and there's nothing I can do about it.
118,432 comments,12.7k,8 hours ago,r/AbsoluteUnits,"When this bull comes calling, the cows come running."
119,541 comments,794,6 hours ago,r/fantasyfootball,"If there is one set in stone “golden rule” regarding fantasy football, it’s this…"
120,277 comments,15.2k,16 hours ago,r/UpliftingNews,"Hockey fan who spotted Vancouver Canucks staffer's cancerous mole given $10,000 medical school scholarship"
121,489 comments,602,5 hours ago,r/dating,"My girlfriend challenged me to impress her and if I don't, she'll break up with me"
122,246 comments,3.7k,15 hours ago,r/Instagramreality,The top comment was that she just has “a very specific body type.” The rest of the comments were young girls asking how to get this skinny.
123,234 comments,2.4k,9 hours ago,r/fuckcars,Abelist
124,145 comments,7.1k,7 hours ago,r/formula1,Cheeky Bridgestone ad from 2008
125,475 comments,10.9k,10 hours ago,r/PoliticalHumor,"Siri, what does “jaw-droppingly entitled white privilege” sound like? Follow-up question: “Who is Kevin Sorbo?”"
126,213 comments,15.5k,9 hours ago,r/greentext,Vox got what they asked for
127,123 comments,7.8k,5 hours ago,r/Superstonk,"Four days ago, the Federal Reserve released the names of the banks that had received $4.5 trillion in cumulative loans in the last quarter of 2019 under its emergency repo loan operations for a liquidity crisis that has yet to be credibly explained."
128,273 comments,14.8k,17 hours ago,r/MaliciousCompliance,I have to call in sick before 6 in the morning? Alright then.
129,187 comments,9.0k,10 hours ago,r/TheLastAirbender,Katara's Game
130,1.5k comments,3.0k,2 hours ago,r/teenagers,I swear on my left nut that for every comment i get in the next hour i will do a push-up
131,147 comments,6.8k,7 hours ago,r/instantkarma,Guy on truck has a great aim to Robber!
132,447 comments,3.4k,11 hours ago,r/byebyejob,She worked in a gas station deli.
133,333 comments,1.8k,10 hours ago,r/witcher,A commentary on the plot inconsistencies of Netflix Witcher Season 2
134,251 comments,4.1k,3 hours ago,r/cats,What is he thinking??
135,444 comments,861,4 hours ago,r/reddevils,"Manchester United Team vs Wolves - Premier League 03 January 2022 | Starting XI : De Gea, Wan Bissaka, Varane, Jones, Shaw, Matic, McTominay, Sancho, Greenwood, Ronaldo, Cavani."
136,262 comments,1.4k,8 hours ago,r/SubredditDrama,OP in r/TrueOffMyChest throws a Christmas party and no one shows up. Top comments are filled with empathy. Others are not when they find out that OP does not care about Covid and had the party on Dec 24th.
137,312 comments,3.2k,6 hours ago,r/tifu,TIFU by showing my erect penis to my In-laws
138,242 comments,8.5k,7 hours ago,r/shitposting,Pure Reddit moment
139,135 comments,9.7k,8 hours ago,r/Gamingcirclejerk,vibeo gane
140,209 comments,3.9k,5 hours ago,r/baseball,Map of MLB with no divisons or teams at all
141,87 comments,10.3k,8 hours ago,r/NonPoliticalTwitter,Stop yelling at me
142,112 comments,5.2k,6 hours ago,r/starterpacks,11 yo street gangsta starter pack
143,329 comments,13.5k,9 hours ago,r/mildlyinteresting,My Toblerone broke in the wrong place
144,45 comments,6.1k,4 hours ago,r/wholesomememes,cute sous chef :*
145,367 comments,5.2k,16 hours ago,r/GreenBayPackers,THE PACKERS HAVE CLINCHED THE #1 SEED UPVOTE PARTY!
146,412 comments,7.0k,7 hours ago,r/iamverybadass,"Nice trigger discipline, Skeletor"
147,451 comments,3.6k,5 hours ago,r/Warhammer40k,New! Plastic! Aeldari Guardians!
148,398 comments,11.5k,14 hours ago,r/ThatsInsane,Lady's pet lion gets out and she carries it home like a house cat...
149,420 comments,7.4k,6 hours ago,r/pics,Doctor protesting. New York City.
150,4 comments,Vote,6 hours ago,r/pics,"Managing diabetes can be challenging, but with Walgreens Find Care®, finding the right care doesn't have to be."
151,72 comments,10.1k,9 hours ago,r/DunderMifflin,Work from home be like.....
152,122 comments,10.8k,9 hours ago,r/toptalent,this artwork and the slight animation at the end
153,212 comments,7.5k,8 hours ago,r/food,[Homemade] Homestyle mcmuffin
154,384 comments,1.9k,7 hours ago,r/ontario,All Ford would have to do to get re-elected is ... fix the coming tsunami of nursing shortages.
155,157 comments,27.3k,9 hours ago,r/me_irl,me_irl
156,153 comments,20.1k,8 hours ago,r/MadeMeSmile,She loves it
157,324 comments,5.9k,10 hours ago,r/tf2,GangFort. A 2D demake of TF2 just came back after 6 years for god damn NFTs.
158,264 comments,5.6k,9 hours ago,r/PrequelMemes,I have a quick question. How is it that Darth Plaguis and count dooku managed to hide their sith eyes for so long?
159,356 comments,10.2k,10 hours ago,r/nonononoyes,"Not once, twice"
160,64 comments,4.4k,6 hours ago,r/OddSatisfying,This Compass Cake
161,64 comments,4.4k,6 hours ago,r/OddSatisfying,This Compass Cake
162,362 comments,18.2k,16 hours ago,r/NatureIsFuckingLit,🔥 This Shark escaping this Whale's reach
163,161 comments,12.8k,12 hours ago,r/ShitPostCrusaders,Openings spoiled everything
164,294 comments,6.9k,7 hours ago,r/skyrim,"After years of having my game crash whenever I try to make it look good, I have managed to make my Skyrim look good while still being playable."
165,336 comments,1.3k,9 hours ago,r/india,"""Taarak Mehta Ka Ooltah Chashmah"" is unfunny, tone-deaf, regressive yet wildly popular!"
166,251 comments,2.6k,12 hours ago,r/RimWorld,i think i've installed too many mods
167,260 comments,3.1k,4 hours ago,r/Spiderman,"I was rewatching all Spider-Man movies again and I just realized that Tobey Maguire's body in the Spider-Man 1 was one of the most naturally achievable body in a short period of time, ever shown in a Hollywood film imo"
168,281 comments,5.2k,7 hours ago,r/trashy,Trashy woman gets called out for not picking up her dogs poop on the neighbors yard
169,70 comments,5.8k,7 hours ago,r/ToiletPaperUSA,Charlie Kirk unearths the truth about government surveillance.
170,55 comments,950,3 hours ago,r/vexillologycirclejerk,I'm doing a scientific experiment in the comments
171,512 comments,16.0k,8 hours ago,r/shitposting,Happens every goddamn time
172,231 comments,4.6k,6 hours ago,r/freefolk,Peter kind of forgot...
173,93 comments,4.1k,6 hours ago,r/im14andthisisdeep,yes 🗿
174,245 comments,8.7k,9 hours ago,r/halo,I'll never be able to do this again.
175,388 comments,2.6k,4 hours ago,r/nba,"[Wojnarowski] Reporting with @ESPN_MacMahon : The Houston Rockets are suspending Kevin Porter Jr., and Christian Wood for tonight’s game against the Philadelphia 76ers, disciplining both for poor behavior surrounding Saturday’s loss to Denver."
176,213 comments,3.6k,5 hours ago,r/StarWars,First and last lines spoken on-screen by characters in the Skywalker Saga
177,438 comments,1.0k,3 hours ago,r/CryptoCurrency,"Igor Bogdanoff has just died, six days after his twin brother Grichka. RIP."
178,101 comments,3.6k,7 hours ago,r/oddlyterrifying,Chilling the pool when...
179,128 comments,2.4k,6 hours ago,r/ich_iel,Ich🎩iel
180,187 comments,8.9k,16 hours ago,r/ShittyLifeProTips,"SLPT: If you catch your teenage son masturbating or watching porn, you need to have a chat with him. Tell him that jerking off is a sin and he’ll go to hell for doing it. That way he will focus on his studies and will never be tempted to spank the monkey again."
181,486 comments,25.9k,8 hours ago,r/HolUp,Because that's what heros do!
182,326 comments,5.1k,7 hours ago,r/iamatotalpieceofshit,"not yielding, hitting a pedestrian then fleeing"
183,316 comments,5.5k,7 hours ago,r/raimimemes,Misery. Misery. Misery. That's what the studio has chosen.
184,186 comments,4.4k,7 hours ago,r/LeopardsAteMyFace,"Without Farage we wouldn't have Boris.. Oh, our family is suffering!"
185,22 comments,5.4k,14 hours ago,r/pics,Rainbow from window lines up perfect on stove
186,22 comments,5.4k,14 hours ago,r/pics,Rainbow from window lines up perfect on stove
187,211 comments,2.0k,8 hours ago,r/Aquariums,Nightmare fuel. Spider fell into my tank and proceeded to crawl around for a half hour...
188,37 comments,3.8k,6 hours ago,r/MovieDetails,"In Scoob! (2020), Shaggy walks past ""Casey's Creations"". This is a reference to Casey Kasem, the original voice actor of Shaggy from the 1969 Scooby Doo TV show."
189,303 comments,2.2k,7 hours ago,r/TheWeeknd,Teaser released - 7th January 2021 - like I told y’all - LET’S GO XO
190,358 comments,1.2k,5 hours ago,r/Music,Everytime you hear an ad on Spotify you are indirectly paying a dollar amount to a company whose CEO just invested 100 million euros in AI military technology. Just fyi
191,169 comments,5.2k,6 hours ago,r/Genshin_Impact,I made an Alternate Wish Animation for Jean
192,407 comments,5.7k,6 hours ago,r/MinecraftMemes,plz dont
193,407 comments,2.9k,6 hours ago,r/gtaonline,"Name a more anoying vehicle to use, i’ll wait"
194,234 comments,24.5k,8 hours ago,r/dankmemes,What is your answer?
195,236 comments,9.1k,9 hours ago,r/2meirl4meirl,2meirl4meirl
196,98 comments,3.6k,9 hours ago,r/harrypotter,"Our favourite trio, all grown up 🥺"
197,270 comments,697,5 hours ago,r/unitedkingdom,Brexiteer Edwina Currie roasted for failing to come up with tangible benefits of Brexit
198,60 comments,8.2k,8 hours ago,r/comedyheaven,Quality time
199,163 comments,7.3k,8 hours ago,r/oddlyspecific,You ok there bud?
200,121 comments,2.2k,3 hours ago,r/SelfAwarewolves,Starvation? What even is that? The world may never know.
201,99 comments,7.9k,9 hours ago,r/WitchesVsPatriarchy,"Blessed be, sister!"
202,101 comments,3.6k,11 hours ago,r/YUROP,Couldn’t resist.
203,38 comments,3.9k,6 hours ago,r/CuratedTumblr,Do I look like I know what a “trap card” is?
204,250 comments,6.2k,13 hours ago,r/justneckbeardthings,The beard within is strong with this one
205,215 comments,8.6k,12 hours ago,r/IndianDankMemes,Australian Bihari
206,46 comments,5.3k,7 hours ago,r/TIHI,"Thanks, I hate emo kids"
207,259 comments,5.4k,12 hours ago,r/technology,Germany: Data retention to be abolished once and for all.
208,204 comments,22.2k,15 hours ago,r/meirl,meirl
209,256 comments,3.4k,8 hours ago,r/MarchAgainstNazis,This photo is uploaded on the Twitter profile of the kid who stomped on the memorial of the victims who his friend killed while drunk driving.
210,104 comments,4.6k,7 hours ago,r/intermittentfasting,"100lbs gone! 5'9"" (270lbs-165lbs) I got tired of being the fat little sister"
211,316 comments,709,5 hours ago,r/texas,Don Huffines Ad during Cowboys game. Not sure which part is a joke but I posted about it yesterday and saw some of yall wanted to see the Ad cause it seems unreal.
212,143 comments,4.4k,9 hours ago,r/LivestreamFail,Small Korean streamer named 승상딱 (Seung-seung-kak) completes his 17 day livestreamed journey from Seoul to Busan per walking (roughly 325km)
213,165 comments,3.6k,6 hours ago,r/hockey,Picture I snagged at the Winter Classic on Saturday. Enjoy🎉
214,182 comments,1.2k,8 hours ago,r/victoria3,Civil war TIME!
215,242 comments,2.3k,12 hours ago,r/SpidermanPS4,Thoughts??
216,60 comments,1.9k,7 hours ago,r/averageredditor,Reddit Moment
217,85 comments,18.9k,9 hours ago,r/wholesomememes,Everybody needs protecting now and then.
218,162 comments,4.2k,7 hours ago,r/battlestations,My setup has really grown on me
219,31 comments,3.8k,1 year ago,r/pics,"Fukuoka, Japan"
220,31 comments,3.8k,1 year ago,r/pics,"Fukuoka, Japan"
221,410 comments,1.9k,6 hours ago,r/Undertale,Mix soul traits are allowed. Mine would be Dedication which leans towards Perseverance.
222,135 comments,2.4k,9 hours ago,r/thatHappened,"Aw yes, the infamous case of a prostitute doing their job for free"
223,80 comments,6.5k,15 hours ago,r/AnarchyChess,"Mods are awake, upvote checkers"
224,552 comments,4.2k,4 hours ago,r/awfuleverything,Why would you go out of your way to be so awful and destroy someone's sand art?
225,215 comments,13.7k,14 hours ago,r/ATBGE,Getting a fresh cut to start the year
226,172 comments,1.5k,5 hours ago,r/MMA,Rafael Fiziev calls out Rafael dos Anjos: ‘I’m the best Rafael in UFC
227,249 comments,757,6 hours ago,r/nursing,Where is the military?
228,214 comments,1.9k,9 hours ago,r/trashy,And on the next episode of Jerry Springer 🤣🤣🤣
229,184 comments,2.2k,4 hours ago,r/GlobalOffensive,Ropz joins faze
230,53 comments,4.9k,4 hours ago,r/memes,My struggle with dark souls
231,110 comments,7.2k,9 hours ago,r/DiWHY,I don't think half the people here know what DIY is
232,184 comments,10.2k,18 hours ago,r/Chonkers,40 lb chonker OH LAAAAWD
233,233 comments,1.6k,7 hours ago,r/ForzaHorizon,"I don't understand it, this was clearly intentional. Second clip I added shows how they drove all 3 races. I hate online"
