,comment_count,upvote_delta,timeup_list,subreddit,thread_text
244,150 comments,3.0k,10 hours ago,r/osugame,New Featured Artist: xi
245,158 comments,7.4k,15 hours ago,r/StarWars,May the force be with you this holiday season
246,122 comments,2.1k,2 hours ago,r/LifeProTips,"LPT: If you have a kid who wakes up everyone way too early on Christmas, wrap a small lego set for them in their room. They can wake up and start their Christmas early with building a toy while everyone else can get some extra time to sleep"
247,241 comments,1.4k,7 hours ago,r/CFB,"WAKE THE FELIZ NAVIDAD UP, IT'S CHRISTMAS!"
248,66 comments,6.4k,7 hours ago,r/pics,Family was over. This was our baby gate.
249,22 comments,7.1k,8 hours ago,r/gayspiderbrothel,nevguy pls no posting
250,187 comments,3.3k,12 hours ago,r/NotHowGirlsWork,"Good news everyone! All the pain from childbirth solely comes from your vagina. Also, there is not pain its all in your head."
251,148 comments,2.0k,5 hours ago,r/thatHappened,Such a normal thing for a doctor to write on a medical record lmao
252,151 comments,1.1k,5 hours ago,r/Genshin_Impact_Leaks,FAKE CYNO LEAKS [Credit to BLANK]
253,106 comments,2.6k,7 hours ago,r/tf2shitposterclub,Its a good idea i think
254,32 comments,3.4k,3 hours ago,r/memes,Just came to a relization
255,167 comments,2.4k,9 hours ago,r/ffxiv,It's 3:50am and I've just come to the realization that Santa Claus is a primal...
256,159 comments,2.2k,6 hours ago,r/LivestreamFail,The James Webb Space Telescope has lifted off
257,51 comments,2.3k,4 hours ago,r/AnimalsBeingDerps,No one will play with her
258,85 comments,5.4k,12 hours ago,r/formuladank,Which ones you selecting?
259,191 comments,5.0k,7 hours ago,r/ich_iel,Ich👀iel
260,147 comments,587,4 hours ago,r/Teachers,"RANT [Christmas brunch conversation]: ""If you can't do anything, you can always become a teacher"""
261,179 comments,14.8k,9 hours ago,r/funny,"My daughter is obsessed with horses, but I obviously can't afford to buy her one. Bought her a gift card for riding lessons and wrapped it like this"
262,18 comments,2.4k,4 hours ago,r/rarepuppers,She convinced me it was nice enough for a walk
263,110 comments,2.9k,21 hours ago,r/CrazyFuckingVideos,HMC while I let my hair down and more nsfw
264,110 comments,2.9k,21 hours ago,r/CrazyFuckingVideos,Messiness at Drag Brunch
265,71 comments,8.7k,7 hours ago,r/technicallythetruth,"Well, if you put it that way..."
266,197 comments,7.5k,9 hours ago,r/hmmm,hmmm
267,114 comments,5.6k,17 hours ago,r/facepalm,+1 logic
268,114 comments,5.6k,17 hours ago,r/facepalm,+1 logic
269,274 comments,36.1k,10 hours ago,r/me_irl,me_irl
270,144 comments,1.6k,6 hours ago,r/europe,James Webb Space Telescope has Successfully Launched into Orbit
271,209 comments,4.0k,7 hours ago,r/2007scape,For my 30th my girlfriend got me a Runescape Cake.. I think she's outdone her self for Christmas it's Runescapeopoly.
272,252 comments,1.4k,7 hours ago,r/modernwarfare,Got MW For Christmas!
273,1.4k comments,8.2k,7 hours ago,r/facepalm,Karen needs to breathe air
274,182 comments,506,3 hours ago,r/MagicArena,A disappointing Christmas offer
275,96 comments,10.5k,9 hours ago,r/blessedimages,Blessed Laughing Chris Evans
276,232 comments,15.6k,17 hours ago,r/BoneAppleTea,Eagle Testicle
277,249 comments,Vote,1 hour ago,r/meme,Continuing the legacy…
278,69 comments,1.9k,3 hours ago,r/Wellthatsucks,Cut all of the “ties”on my daughters new toy. that gray tie was the wire for the remote.
279,281 comments,706,3 hours ago,r/SaimanSays,gear wali cycle mangta (as a innocent child)
280,183 comments,3.1k,8 hours ago,r/LeagueOfMemes,P E I N
281,75 comments,1.8k,4 hours ago,r/dndmemes,The Truth about the Succubi.
282,154 comments,4.6k,11 hours ago,r/ChoosingBeggars,"$800 camera with extra specs listed at $400, “grinch” because won’t go to $100."
283,158 comments,3.2k,8 hours ago,r/religiousfruitcake,"Found on a Christian anti-dino FB page. Yes, they are serious."
284,105 comments,977,5 hours ago,r/FireEmblemHeroes,Official FEH height chart (from Character Illustrations Vol. 1)
285,111 comments,3.6k,6 hours ago,r/Showerthoughts,"If women age like milk and men age like wine, that's a good thing. Aged milk is cheese which pairs very well with wine."
286,214 comments,5.2k,13 hours ago,r/dankinindia,Hmm
287,78 comments,2.1k,8 hours ago,r/bindingofisaac,I love beast
288,76 comments,3.1k,10 hours ago,r/LiverpoolFC,Keita set for La Liga loan spell?
289,162 comments,1.1k,2 hours ago,r/FrankOcean,New blonded radio at 11 AM PT
290,77 comments,2.4k,4 hours ago,r/ShitPostCrusaders,I hope your Christmas is awful
291,18 comments,3.2k,3 hours ago,r/blursedimages,Blursed St.Paul
292,122 comments,6.6k,9 hours ago,r/Bossfight,"It's a crab, it's a tank, it's a..."
293,243 comments,18.6k,8 hours ago,r/gaming,Forza Horizon
294,111 comments,5.5k,1 day ago,r/nextfuckinglevel,Grandpa is teaching this moron a lesson!
295,111 comments,5.5k,1 day ago,r/nextfuckinglevel,Grandpa is teaching this moron a lesson!
296,86 comments,900,5 hours ago,r/kpop,Positive COVID-19 Diagnosis of BTS Members RM and Jin
297,170 comments,4.6k,16 hours ago,r/ThatLookedExpensive,Ryanair 737 runs over a tow bar left on the apron as the jet moved forward.
298,24 comments,1.8k,3 hours ago,r/gifs,She seems a little nervous about this
299,340 comments,10.7k,7 hours ago,r/WhitePeopleTwitter,"We need answers, Steve"
300,91 comments,6.3k,9 hours ago,r/engrish,Merry Christmas
301,58 comments,4.0k,7 hours ago,r/dadjokes,I told my daughter that I saw a deer on the way to work this morning. She asked me...
302,129 comments,1.6k,7 hours ago,r/france,Les victimes se reconnaîtront
303,73 comments,2.4k,5 hours ago,r/CozyPlaces,Christmas dinner table!
304,129 comments,838,5 hours ago,r/argentina,Mi novia (francesa) me hizo un bordado de un carpincho navideño como regalo. :D
305,238 comments,583,4 hours ago,r/dogecoin,"I gave 4,200DOGE to all 3 of my younger brothers for Xmas. They responded as followed…"
306,83 comments,1.2k,7 hours ago,r/skyrim,Interesting. Playing Anniversary edition. Discovered this in Calcelmo's museum
307,30 comments,Vote,2 hours ago,r/chloe,Merry Xmas pepperonis
308,148 comments,9.0k,14 hours ago,r/rarepuppers,"Houdini got a little valium at the vet yesterday for his annual teeth cleaning and, well…"
309,86 comments,354,2 hours ago,r/oculus,Purchased a oculus for hubby’s x-mas gift and he just opened it up to play….. I’m at a loss for words. Called target and was told it would take 3 days to investigate. How do they even investigate this sort of thing? Has anyone ever heard of something like this happening?
310,51 comments,2.1k,4 hours ago,r/OneSecondBeforeDisast,Dancing
311,48 comments,3.0k,6 hours ago,r/ATBGE,This cursed door handle
312,80 comments,1.5k,9 hours ago,r/UnethicalLifeProTips,"ULPT: When lying, keep things vague with a minimal amount of detail. Only give detail if they ask for clarity."
313,73 comments,11.4k,12 hours ago,r/europe,"Myllykoski River in Oulanka National Park, Finland"
314,293 comments,876,4 hours ago,r/weed,Got this bad boy for Xmas. Need a name do ur thing reddit!!
315,134 comments,7.8k,10 hours ago,r/CasualUK,Merry Christmas! Here’s a non-political festive duck repost while the mods aren’t looking. Ho Ho Quack
316,74 comments,12.9k,15 hours ago,r/TheLastAirbender,"Toph Beifong aka ""The blind bandit,earthbending champion,greatest earthbender in the world,and Melon lord""is GOATED,no matter what season."
317,56 comments,1.9k,6 hours ago,r/JustBootThings,"__Hilarious, but also feel like it belongs here."
318,124 comments,2.5k,5 hours ago,r/maybemaybemaybe,Maybe maybe maybe
319,135 comments,1.2k,5 hours ago,r/ElderScrolls,Imperials be like:
320,91 comments,4.6k,14 hours ago,r/dontyouknowwhoiam,Trying to argue with Kingpin
321,1.4k comments,19.1k,10 hours ago,r/antiwork,My grandmother told me that when I asked my boss for a raise I was exploiting my boss
322,109 comments,8.7k,19 hours ago,r/DesignPorn,In Toronto
323,93 comments,685,5 hours ago,r/averageredditor,Average Redditors when you mention the “Bible” or “Religion”
324,61 comments,3.6k,5 hours ago,r/MadeMeSmile,Parents surprise daughter with dog she’d been caring for at shelter
325,18 comments,Vote,5 hours ago,r/MadeMeSmile,"The judges from The Games Awards have spoken...but have you been heard? Respond directly to this post with games that should have won, but didn't. Who knows, maybe you'll score some Gold."
326,38 comments,5.9k,9 hours ago,r/anime_irl,anime_irl
327,109 comments,4.7k,6 hours ago,r/whenthe,My ears
328,101 comments,3.6k,8 hours ago,r/woahdude,Mushroom Music - Conifer tuft's edition
329,59 comments,8.1k,10 hours ago,r/bonehurtingjuice,20BitChip made this and i thought it belonged here
330,164 comments,3.9k,9 hours ago,r/im14andthisisdeep,This portrays the modern society...
331,165 comments,1.7k,9 hours ago,r/cringepics,This weird guy really thinks he's hot stuff. He post stuff like this all the time lol.
332,112 comments,2.0k,5 hours ago,r/tf2,My chat is so stechted! Is there a fix?
333,100 comments,2.0k,4 hours ago,r/apexlegends,"Built an apex style smart optic for airsoft, compass and round counting included!"
334,64 comments,4.2k,5 hours ago,r/Genshin_Impact,Christmas in the Favonius lounge!
335,219 comments,897,4 hours ago,r/HollowKnight,What is your biggest achievement in Hollow Knight?
336,9 comments,1.8k,4 hours ago,r/gravityfalls,He literally didn’t change a single thing
337,43 comments,1.1k,7 hours ago,r/BestofRedditorUpdates,AITA for telling my SIL it would be wrong for me to walk her down the aisle
338,127 comments,3.0k,11 hours ago,r/tooktoomuch,This lad living his best life.
339,107 comments,1.7k,8 hours ago,r/Warhammer,New Eldar Rangers:
340,74 comments,729,4 hours ago,r/Gunners,Thoughts?
341,17 comments,3.1k,7 hours ago,r/Breadit,Merry Christmas!
342,55 comments,928,4 hours ago,r/OutOfTheLoop,What's up with the James Webb telescope launch today? What do we hope to find with it?
343,89 comments,2.5k,10 hours ago,r/Deltarune,Chapter 7 ending leak (100% legit)
344,88 comments,1.0k,8 hours ago,r/reddevils,Christmas with The Reds : Social Media from Players with their Families
345,58 comments,1.1k,4 hours ago,r/MaliciousCompliance,Tie my clipboard to my wrist?? Okay!
346,51 comments,3.9k,8 hours ago,r/TheGoodPlace,Biggest twist of the entire show
347,135 comments,2.1k,11 hours ago,r/memeframe,It's just something else
348,155 comments,2.7k,13 hours ago,r/BritishSuccess,"30 years old with no children, but still waking up at 05:38 AM Christmas Day to see what the missus has put under the tree."
349,161 comments,4.2k,6 hours ago,r/BlackPeopleTwitter,Absolutely Disgusting
350,642 comments,45.0k,9 hours ago,r/nextfuckinglevel,Feliz Navidad; Merry Christmas Reddit.
351,74 comments,2.2k,5 hours ago,r/Overwatch,I can't believe this backcap worked
352,59 comments,1.7k,4 hours ago,r/GlobalOffensive,Remember when Taco had a fidget spinner (before they were popular) at Eleague Atlanta? And Anders and Semmler were very intrigued by it.
353,86 comments,2.2k,3 hours ago,r/cats,Was never a cat man but my 120lbs dog of 10 years passed away and this beautiful baby girl came into my life by chance and saved me from losing myself in the loss!
354,36 comments,2.4k,5 hours ago,r/coolguides,Different architectural styles for Christmas trees
355,153 comments,1.7k,4 hours ago,r/tf2,"""Emilia, a famous vtuber is streaming the gam-"" ""F*** OFF!"""
356,133 comments,3.8k,11 hours ago,r/hmm,hmmmmmm
357,88 comments,1.8k,10 hours ago,r/okbuddyhetero,😭😭😭😭😭😭😭😭😭😭😭
358,118 comments,7.9k,11 hours ago,r/PixelArt,"Behold, my in-game 'go to bed' animation!"
359,67 comments,3.3k,5 hours ago,r/Hololive,Marine took off her skirt.
360,83 comments,1.3k,5 hours ago,r/HermitCraft,Stats: Each hermits' total episode count across all 8 seasons!
361,262 comments,1.6k,4 hours ago,r/NoStupidQuestions,"[NSFW] Back when pictures had to be developed and you took naked pictures of yourself, would the employees have seen them?"
362,116 comments,Vote,2 hours ago,r/Gundam,Did you actually enjoy mobile suit gundam unicorn?
363,184 comments,1.9k,6 hours ago,r/Cringetopia,what the FUCK
364,64 comments,5.3k,15 hours ago,r/BokuNoHeroAcademia,New Horikoshi Art!
365,109 comments,2.3k,4 hours ago,r/DunderMifflin,Does Pam call Erin by her actress name(Ellie) in the end?
366,75 comments,1.3k,4 hours ago,r/justneckbeardthings,A neckbeard definitely made this
367,43 comments,2.3k,3 hours ago,r/shitposting,Mama Mia
368,70 comments,3.7k,9 hours ago,r/RocketLeague,I can't believe I get to play this awesome game with my son <3
369,96 comments,4.2k,13 hours ago,r/AteTheOnion,Ate the Hamster
370,64 comments,644,4 hours ago,r/SapphoAndHerFriend,"Shock of all shocks, the heteros are upseteros about how super duper gay The Matrix franchise is and they're not shy about telling us. Being Straight continues to seem extraordinarily unpleasant."
371,84 comments,10.8k,8 hours ago,r/cursedcomments,Cursed_symbol
372,94 comments,1.3k,9 hours ago,r/TankPorn,"John Gorman's Sherman tank Ballyragget, and the Tiger II tank of 503rd Heavy Panzer Battalion that it knocked out by ramming, July 1944."
373,838 comments,55.4k,12 hours ago,r/HolUp,That’s a great ugly swe… HolUp
374,107 comments,1.2k,6 hours ago,r/Conservative,"30 years ago today, the world received the second best Christmas miracle ever known - the death of the USSR"
375,79 comments,1.4k,5 hours ago,r/GifRecipes,15 Minute Easy Noodles
376,14 comments,2.3k,6 hours ago,r/shittyrainbow6,lol
377,84 comments,838,4 hours ago,r/golf,"Girlfriend got me a lag shot for Christmas. I’m right handed. Bless her heart, A+ for effort"
378,161 comments,2.0k,7 hours ago,r/linuxmasterrace,Now fixed ?
379,51 comments,1.8k,5 hours ago,r/bestof,Astronomer /u/Andromeda321 explains why the James Webb Space Telescope is game changing
380,129 comments,3.2k,4 hours ago,r/pics,Me and my baby. Merry Christmas from Pakistan ??
381,43 comments,2.9k,7 hours ago,r/AvatarMemes,Reason why earth kingdom lost the war.
382,33 comments,1.7k,4 hours ago,r/leagueoflegends,My favorite feature of the new Hextech Portals.
383,52 comments,4.7k,9 hours ago,r/blursed_videos,blursed_sand
384,77 comments,3.1k,14 hours ago,r/popping,"TikTok ear pimple, pretty satisfying!"
385,65 comments,3.3k,14 hours ago,r/Catswhoyell,Feeding the 3 month old stray I took home 3 weeks ago (sorry for the can sounds)
386,139 comments,458,2 hours ago,r/FreeGameFindings,[Epic Games] (Game) Prey
387,83 comments,1.2k,10 hours ago,r/RedDeadOnline,I just don't understand why they didn't put red dead 2 cloth physics in RDO? it looks really cool though.
388,135 comments,4.1k,15 hours ago,r/blunderyears,"You couldn't convince me that my XL Polo wasn't peak style. Age 11, '94"
389,66 comments,1.2k,7 hours ago,r/fuckcars,people could have walk straight to IKEA from the apartment but this city is built for cars
390,16 comments,1.5k,4 hours ago,r/imsorryjon,"""Up on the Housetop"""
391,33 comments,2.1k,6 hours ago,r/food,[Homemade] Gingerbread Lighthouse
392,121 comments,950,7 hours ago,r/GTA,Rockstar Games announced gta v expanded and enhanced edition 1 years ago and they still not announced red dead redemption 2 Xbox series x/s and ps5 edition. What a shame
393,112 comments,2.6k,8 hours ago,r/lifehacks,the easiest way
394,8 comments,1.4k,4 hours ago,r/SapphoAndHerFriend,This sub in a nutshell
395,106 comments,501,3 hours ago,r/tacticalgear,.
396,85 comments,2.3k,11 hours ago,r/comicbooks,Merry Christmas and Hanukkah Sameach!!
397,87 comments,7.5k,12 hours ago,r/IllegallySmolCats,A new orange in the house for Christmas
398,85 comments,618,4 hours ago,r/lego,Why does Luke Skywalker come with a syringe?
399,122 comments,736,5 hours ago,r/2visegrad4you,Hungary moment
400,193 comments,9.5k,8 hours ago,r/funny,"Our little trouble has just figured this out, we are screwed 😑 Merry Christmas everyone!"
401,35 comments,1.7k,5 hours ago,r/furry,NIGHT MODE OFF/ON / art by me
402,203 comments,2.9k,7 hours ago,r/politics,Opinion | A $778 Billion Pentagon Budget Is Our Lump of Coal
403,90 comments,570,4 hours ago,r/philadelphia,"Someone parked in my driveway, towing on Christmas?"
404,57 comments,1.3k,9 hours ago,r/eu4,My current colonial run as Bremen :D
405,21 comments,2.4k,6 hours ago,r/CuratedTumblr,Tokyo Ghoul
406,223 comments,31.2k,13 hours ago,r/shitposting,🎅
407,100 comments,1.1k,2 hours ago,r/hockey,My GF took two weeks to hand draw a map with every NHL team for my Christmas gift this year.
408,61 comments,1.2k,10 hours ago,r/imaginarymaps,The Danelaw in 1300 if Cnut did not die earry
409,45 comments,1.6k,4 hours ago,r/breakingbad,Just need to make a quick call to Skyler
410,97 comments,665,5 hours ago,r/fasting,"M39, 5'9"", 253LB - 153LB. 4 months"
411,137 comments,752,4 hours ago,r/amcstock,When you run out of ideas to write a hit piece
412,86 comments,5.5k,14 hours ago,r/Breath_of_the_Wild,True heroes
413,51 comments,2.8k,10 hours ago,r/SCP,has it really been that long ago
414,104 comments,6.0k,14 hours ago,r/creepy,Gruß vom Krampus
415,90 comments,1.8k,5 hours ago,r/blender,Is this good for an attempt at realism?
416,105 comments,5.7k,12 hours ago,r/GetMotivated,[Image] Stay
417,25 comments,1.5k,4 hours ago,r/PetTheDamnCat,"Excuse me, I need some care!"
418,38 comments,1.5k,4 hours ago,r/astrophotography,Ariana 5 rocket carrying the JWST.
419,115 comments,1.1k,2 hours ago,r/FoodPorn,Iv got covid so Christmas dinner for one this year…
420,78 comments,1.3k,2 hours ago,r/coolguides,A nice emergency room guide listing the order of people who see the doctor
421,152 comments,1.9k,6 hours ago,r/StarWars,"I discovered that the song ""Ballroom Blitz"" fits....rather well with Kylo/Rey's duel. Merry Christmas everyone! Clip from YouTube"
422,105 comments,901,6 hours ago,r/MetalMemes,Let's just enjoy holidays together
423,110 comments,14.3k,10 hours ago,r/cursedcomments,Cursed_jesus
424,19 comments,1.9k,6 hours ago,r/tattoos,"Nosferatu by Ligia from Gristle Tattoo in Brooklyn. ""If that was you on the phone and you on the bus...who was flickering the lights??"""
425,29 comments,5.1k,6 hours ago,r/aww,Paw on top.
426,187 comments,929,5 hours ago,r/DestinyFashion,"One, two, or three?"
427,111 comments,2.2k,4 hours ago,r/Unexpected,I definitely did not see that coming. Pleasantly surprised.
428,88 comments,1.8k,9 hours ago,r/CatastrophicFailure,Power lines shorting (December 2021)
429,164 comments,1.6k,8 hours ago,r/FortNiteBR,I see you scrolling
430,137 comments,668,3 hours ago,r/deadbydaylight,"Look what I got for Christmas! Now I just need to learn the game, and then Everyone’s going to suffer."
431,86 comments,1.7k,11 hours ago,r/ClashOfClans,Lemme take y’all back to the days
432,37 comments,2.7k,7 hours ago,r/jacksepticeye,There are two types of people in this world
433,71 comments,1.1k,6 hours ago,r/notliketheothergirls,Wtf...
434,41 comments,3.7k,9 hours ago,r/shittymoviedetails,"In Pokemon: The Series (1997), Ash Ketchum wears rubber gloves whilst carrying his sick Pikachu to the hospital so as to not get shocked. But he still holds Pikachu to his chest. This is a reference to how Ash has good intentions, but is an absolute fucking idiot."
435,23 comments,2.8k,8 hours ago,r/ThatsInsane,Insane realistic pencil drawing
436,59 comments,1.5k,5 hours ago,r/sewing,Edwardian Camp Lingerie Dress •• Self draft
437,36 comments,2.9k,8 hours ago,r/RoomPorn,"Blue-tiled bathroom and shower with a soaking tub, North Portland, Portland, Oregon [778x1000]"
438,28 comments,631,6 hours ago,r/rupaulsdragrace,Alaska is listed as a top donor on Aja's GoFundMe page
439,20 comments,1.5k,9 hours ago,r/IndiaSpeaks,Merry Christmas
440,20 comments,1.5k,9 hours ago,r/IndiaSpeaks,Merry Christmas to everyone who celebrates ! ❤️
441,19 comments,1.2k,3 hours ago,r/AnimalCrossing,The preps and the exiled goth
442,69 comments,3.8k,11 hours ago,r/pokemongo,Santa brought me a lump of coal
443,123 comments,2.3k,5 hours ago,r/IdiotsInCars,Idiot tries taking exit last minute | Straight from local new site just now (happened dec 23rd)
444,88 comments,1.6k,11 hours ago,r/Battlefield,I'm a good pilot but a medic at heart
445,41 comments,1.2k,3 hours ago,r/youngpeopleyoutube,Do not say that word!!111
446,55 comments,1.8k,5 hours ago,r/Brawlstars,We Cracked a Password! (Gumball Parody Animation)
447,68 comments,1.2k,3 hours ago,r/SmashBrosUltimate,Too many cooks
448,111 comments,1.3k,19 hours ago,r/starwarsmemes,"Also the Mandalorian, but it's not prequel stuff so ,I guess it doesn't count"
449,111 comments,1.3k,19 hours ago,r/starwarsmemes,The one good thing to come out of Disney for Star Wars:
450,59 comments,836,7 hours ago,r/Cricket,Watching the 438 game has become a christmas tradition in South Africa.
451,25 comments,1.6k,5 hours ago,r/UpliftingNews,"Posting on social media the University of Warsaw said: “PhD student Michał Styczyński discovered a substance from the melanin category which can be used as an effective, natural UV filter in Antarctic bacteria (eliminating synthetic ingredients of creams which contribute to the death of coral reefs)"
452,65 comments,543,5 hours ago,r/desabafos,Ontem conheci uma pessoa da família e preferia nem ter conhecido
453,15 comments,2.7k,6 hours ago,r/AnimalsBeingJerks,Good ol' Christmas hospitality!
454,62 comments,2.1k,11 hours ago,r/linux,"Merry Christmas, everybody!"
455,75 comments,2.2k,5 hours ago,r/todayilearned,"TIL it used to be thought that the deepest depths of the ocean were a lifeless desert, but research carried out since the mid-1980s finds that the ocean floor is teeming with life and may rival tropical rainforests for biodiversity."
456,13 comments,1.2k,3 hours ago,r/wholesomegreentext,Good Anon
457,54 comments,1.1k,6 hours ago,r/WhatsWrongWithYourCat,"My cat has been really fussy about eating lately. My [snarky] daughter (who works in a nice restaurant) suggested ""It's the presentation! It needs to be plated properly!"". (results in comment)"
458,92 comments,417,3 hours ago,r/HeroForgeMinis,"Adventure Calendar 2021, Day #25: Layered Clothing"
459,64 comments,1.6k,10 hours ago,r/pointlesslygendered,[socialmedia] ???
460,59 comments,3.4k,12 hours ago,r/HighQualityGifs,MERRY CHRISTMAS
461,78 comments,1.9k,7 hours ago,r/Survival,"Some years back i was working deep inside the jungle in the Republic of Congo on a TV shoot filming hunters and gatherers. We had a rat that lived in a bamboo bush in camp and ate our rations at night. After complaining about it this kid was just ""say no more""."
462,33 comments,2.8k,11 hours ago,r/okbuddybaka,Merry crima baka retards
463,9 comments,2.3k,7 hours ago,r/pokemongo,👁👃👁 (I'm sorry.)
464,35 comments,1.2k,3 hours ago,r/Overwatch_Memes,"All I want for Christmas... are those! Ooohoh, baby!"
465,59 comments,2.0k,9 hours ago,r/CrappyDesign,This ad for a pore minimizer 🤢
466,86 comments,1.7k,7 hours ago,r/reddeadredemption2,Xmas gift from my Son & bonus daughter ❤️❤️❤️
467,39 comments,1.3k,4 hours ago,r/ClashRoyale,Bruh
468,24 comments,2.5k,5 hours ago,r/Eyebleach,Kitty getting tucked in with its favorite toy
469,67 comments,3.4k,12 hours ago,r/rickandmorty,"When you love Christmas, but some people try to ruin it... By ""making love"" with your mom while your dad is watching from a closet in a Superman shirt."
470,54 comments,739,16 hours ago,r/interestingasfuck,Medieval armour vs. full weight medieval arrows
471,54 comments,739,16 hours ago,r/interestingasfuck,Medieval armour vs. full weight medieval arrows
472,103 comments,1.7k,6 hours ago,r/zelda,"[MM] caught covid on my bday/xmas, but at least I get to play majora's mask for the first time"
473,142 comments,1.6k,6 hours ago,r/egg_irl,Egg👌Irl
474,99 comments,991,22 hours ago,r/nextfuckinglevel,"Well boys, who’s ready for the wasteland cause it looks like synths are on the way"
475,99 comments,991,22 hours ago,r/nextfuckinglevel,This robots movement
476,89 comments,1.2k,9 hours ago,r/IndiaSpeaks,Merry Christmas to everyone who celebrates ! ❤️
477,48 comments,11.7k,14 hours ago,r/2meirl4meirl,2meirl4meirl
478,47 comments,810,6 hours ago,r/wasletztepreis,Was letzte ungeimpft Nachweis
479,30 comments,2.3k,13 hours ago,r/Im15AndThisIsYeet,I'm 15 and this is yeet
480,69 comments,1.6k,9 hours ago,r/EngineeringPorn,"I don't know if it belongs here, but here's my biomechanical hand I design for an engineering class (sorry for the cheesy music)"
481,121 comments,3.6k,5 hours ago,r/MadeMeSmile,Merry Christmas Reddit! she said yes!!
482,65 comments,451,4 hours ago,r/ForzaHorizon,The Forzathon Shop is back to Thursday's listings and will not update again until the next week.
483,55 comments,711,6 hours ago,r/TurkeyJerky,Coğrafya kader mi?
484,41 comments,1.8k,6 hours ago,r/Baking,My gingerbread house this year is a fisherman seeking shelter from the storm inside a lighthouse haunted by the ghost of its first lighthouse keeper
485,59 comments,1.0k,6 hours ago,r/MonsterHunter,_PETITION TO REMOVE THIS STUMP
486,51 comments,2.7k,6 hours ago,r/pcmasterrace,"I will admit, harddrive clicks are universally terrifying."
487,19 comments,1.9k,6 hours ago,r/ItemShop,"Mini sidekick, 120% hit speed / 5% damge"
488,43 comments,538,4 hours ago,r/fantasyfootball,Any chance we could get a pinned thread or something about covid (in)actives today/tomorrow?
489,60 comments,561,5 hours ago,r/SpaceXLounge,Congrats to the nominal James Webb Space Telescope launch on Christmas Day!!!
490,102 comments,1.2k,8 hours ago,r/gameofthrones,[No Spoilers] Which one's ur favorite?!
491,39 comments,3.2k,9 hours ago,r/crappyoffbrands,When you find the PS5 on Wish
492,71 comments,2.0k,2 hours ago,r/interestingasfuck,Spongebob episode where the characters are the voice actors themselves
493,44 comments,1.6k,9 hours ago,r/LiminalSpace,Mario-64
494,74 comments,452,3 hours ago,r/loopringorg,Wooo! Metaverse office for LoopRing HQ.
