,comment_count,upvote_delta,timeup_list,subreddit,thread_text
469,49 comments,3.3k,8 hours ago,r/dadjokes,"I asked my daughter, ""If there’s a bee in my hand, what’s in my eye?"" Rolling her eyes, she said, ""I give up. What?"""
470,101 comments,1.3k,6 hours ago,r/donthelpjustfilm,Should they have let him in?
471,86 comments,2.0k,6 hours ago,r/TheRightCantMeme,I Wonder Who
472,90 comments,847,16 hours ago,r/Cringetopia,Look at me I’m soooo cool for hating on queer people!
473,90 comments,847,16 hours ago,r/Cringetopia,shut up shut up shut up SHUT UP SHUT SHUT THE FUCK UP!
474,39 comments,1.5k,4 hours ago,r/CuratedTumblr,i have never seen evangelion
475,116 comments,579,5 hours ago,r/argentina,¡Hola! Its been a year since my last post but this time i drew Argentina by hand! I added the Coat of Arms and your national bird (Rufuos Hornero). I hope you guys like it :D ¡Saludos desde los países bajos!
476,165 comments,1.4k,4 hours ago,r/ToiletPaperUSA,HAPPY ANNIVERSARY YOU FUCKING TRAITORS
477,105 comments,520,2 hours ago,r/playboicarti,lol how do y’all feel about this?
478,90 comments,3.5k,6 hours ago,r/dndmemes,"DM: you've sailed to your destination, but an iceberg is blocking the entrance. Druid: I don't think so"
479,68 comments,888,6 hours ago,r/ENLIGHTENEDCENTRISM,'Slavery is clearly wrong... but not all slave traders were bad'
480,56 comments,1.2k,3 hours ago,r/StardustCrusaders,I mashed up every JoJo OPs in Fighting Gold [OC]
481,78 comments,3.3k,10 hours ago,r/ProRevenge,Wage Theft Revenge
482,77 comments,1.5k,8 hours ago,r/hearthstone,The New Player Experience
483,52 comments,1.8k,10 hours ago,r/GamingDetails,"In Assassin's Creed Origins, light can shine through the tiny holes on Bayek's hood"
484,48 comments,3.8k,9 hours ago,r/OneSecondBeforeDisast,"Mmm, that looks tasty"
485,90 comments,2.2k,11 hours ago,r/ArtefactPorn,"Youhen Tenmoku Teabowl, one of three intact Jian wares in the world to exhibit this ""cosmos-like"" iridescent speckle pattern and the only one to have it on both sides. Made in Fujian, China during the Southern Song Dynasty (1127-1279), now a National Treasure of Japan (info in comments). [7361x8270]"
486,141 comments,Vote,2 hours ago,r/thesopranos,Rest in peace Peter Bogdanovich
487,97 comments,739,5 hours ago,r/CovIdiots,There's an idea
488,98 comments,518,4 hours ago,r/Metroid,Who wins this fight?
489,75 comments,577,5 hours ago,r/WestSubEver,Mfin Kevin Abstract dressed exactly like Ye
490,102 comments,631,5 hours ago,r/bestoflegaladvice,"Despite Thor’s brutal assault on LocationBot, our best buddy has survived and is back to take his rightful place as the one true bot of BoLA! All hail u/LocationBot!"
491,146 comments,1.7k,5 hours ago,r/Undertale,It’s a tough game…
492,106 comments,779,7 hours ago,r/povertyfinance,My comp is mass hiring customer service work from home jobs. Sign up bonus.
493,74 comments,1.4k,9 hours ago,r/yakuzagames,Yakuza (2005) had some interesting writing
494,127 comments,1.0k,6 hours ago,r/libertarianmeme,Never Forget
495,102 comments,2.7k,8 hours ago,r/mapporncirclejerk,"NO NEED TO GUESS WHERE I AM FROM, YOU ALREADY KNOW. PLEASE STOP THIS TREND, OMG PLEASE"
496,184 comments,2.8k,8 hours ago,r/iamatotalpieceofshit,"Tiktoker ""pranks"" teen by falsely accusing him."
497,174 comments,1.5k,4 hours ago,r/IdiotsInCars,can't decide if he is idiot or extremely skilled.
498,60 comments,3.6k,6 months ago,r/greentext,Anon has made it
499,60 comments,3.6k,6 months ago,r/greentext,Anon has made it
500,82 comments,949,8 hours ago,r/RoughRomanMemes,the Chad historian versus Cringe social justice warrior
501,89 comments,2.4k,10 hours ago,r/OnePunchMan,I like how Murata attracts all kinds of readers by having various types of fanservice
502,69 comments,3.4k,9 hours ago,r/StarWars,"My Shaak ti cosplay, handmade."
503,125 comments,627,5 hours ago,r/Romania,"Părinții: ""Noi, când eram mici ca voi nu petreceam atâta timp la calculator. Ne jucam toată ziua cu prietenii pe afară"""
504,92 comments,5.1k,15 hours ago,r/Perfectfit,This tiny jar and a small jar
505,95 comments,9.1k,18 hours ago,r/interestingasfuck,My mom gave the same thumb rub :)
506,95 comments,9.1k,18 hours ago,r/interestingasfuck,Gorilla mom keeps her baby calm by gently patting him on the back
507,75 comments,1.1k,4 hours ago,r/furry,Stolen suits in Texas
508,70 comments,419,4 hours ago,r/wisconsin,Friendly reminder that Republican Senate candidate Derrick Van Orden flew to Washington DC to attend the January 6th Insurrection one year ago today
509,79 comments,1.1k,2 days ago,r/antiwork,Let’s all go on strike and demand better
510,79 comments,1.1k,2 days ago,r/antiwork,Let’s all go on strike and demand better
511,27 comments,2.8k,8 hours ago,r/Chonkers,chooonker
512,33 comments,2.0k,6 hours ago,r/StupidFood,this pink panther clip reminded me of something
513,70 comments,2.2k,9 hours ago,r/RocketLeague,My friend sent me this from the official rl acc.
514,115 comments,2.6k,8 hours ago,r/sewing,"When you find a style you like, make one in every colour!"
515,186 comments,519,5 hours ago,r/FridayNightFunkin,"shitty meme i made in paint, also promoting a mod im creating lmao"
516,86 comments,459,3 hours ago,r/Cricket,Gritty knock from Dean Elgar showing great resilience - 96(188)*
517,73 comments,996,8 hours ago,r/suddenlysexoffender,What?!!
518,53 comments,450,4 hours ago,r/FragileWhiteRedditor,"Who's ready for Nazis to unironically start calling Asians ""white adjacent""? /s God, we live in the worst timeline."
519,59 comments,2.3k,7 hours ago,r/gravityfalls,I think it’s a metaphor
520,222 comments,5.9k,8 hours ago,r/PrequelMemes,It starts with a vision and then you're a Sith cyborg
521,43 comments,4.3k,15 hours ago,r/ImaginarySliceOfLife,Arcade date with senpai (@chicken_utk)
522,87 comments,2.0k,10 hours ago,r/evilbuildings,"White Witch Castle in Bavaria, Germany"
523,35 comments,1.8k,6 hours ago,r/WhatsWrongWithYourDog,Never get a Shiba as your first dog
524,61 comments,759,6 hours ago,r/chelseafc,Your MOTM! 🇪🇸
525,43 comments,1.3k,19 hours ago,r/Unexpected,She bit me?!?
526,43 comments,1.3k,19 hours ago,r/Unexpected,Hands are for the weak
527,66 comments,1.2k,3 hours ago,r/Showerthoughts,"Since mirrors have a tiny delay, your reflection has won every staring contest against you"
528,140 comments,3.4k,9 hours ago,r/softwaregore,"""Where are we going to again?"""
529,68 comments,Vote,2 hours ago,r/totalwar,The Beardless Dwarfs Mod
530,99 comments,758,4 hours ago,r/cringepics,The Furry Gentleman
531,451 comments,2.1k,4 hours ago,r/marvelstudios,James McAvoy is confident that X-Men would beat the Avengers. What do you think about this?
532,87 comments,514,4 hours ago,r/thewitcher3,Netflix why? Also Eskel should be the W4 protagonist his W3 ending is flexible & he's not over powered like Ciri
533,73 comments,3.0k,9 hours ago,r/adhdmeme,It was good while it lasted
534,23 comments,2.5k,8 hours ago,r/AnimalTextGifs,Chatty cats are the best
535,82 comments,1.0k,7 hours ago,r/Guiltygear,Character gameplay chart
536,113 comments,3.9k,7 hours ago,r/Eyebleach,Cat Dog Other
537,108 comments,446,4 hours ago,r/retrogaming,Shocked this ad came from Nintendo
538,61 comments,1.1k,4 hours ago,r/GMEJungle,"The SEC Gamestop report clearly states multiple times that the January sneeze had nothing to do with an options gamma squeeze. And the majority of options activity was buying puts, not calls. Buy. Hold. DRS Book. Zen. 💎🙌🟣🚀"
539,93 comments,786,3 hours ago,r/Showerthoughts,"Technically, almost everyone’s first kiss was their mom"
540,244 comments,Vote,3 hours ago,r/Showerthoughts,"[PSA] We want your track driving Pro Tips, Reddit. Comment with your best technical tip for some gold, and a chance for your maneuver to be demonstrated by a Toyota Motorsport driver in the all new GR86."
541,47 comments,2.7k,8 hours ago,r/jacksepticeye,Is this ours or Sean’s dream …
542,806 comments,3.7k,7 hours ago,r/pics,Americans hold a Nazi rally in Madison Square Garden
543,129 comments,1.1k,7 hours ago,r/SaimanSays,senior citizen of this subreddit
544,58 comments,412,3 hours ago,r/ShitMomGroupsSay,She thinks it's crazy that I would give my kid medicine that a pediatrician prescribes but am afraid to give them homeopathic treatment from a company that killed kids.
545,82 comments,1.8k,7 hours ago,r/WorkersStrikeBack,'Not Worth it'
546,50 comments,1.1k,7 hours ago,r/mathmemes,Trick.
547,67 comments,921,6 hours ago,r/CasualConversation,I'm currently eating my first ever meal out on my own
548,328 comments,4.0k,5 hours ago,r/politics,"‘Look at All Those People Fighting for Me’: Trump ‘Gleefully’ Watched Jan. 6 Riot, Says Former Press Secretary - Stephanie Grisham Told CNN on Thursday That the Former President was So Excited by the Riot That He was Rewinding His TV and Watching it Again"
549,84 comments,858,8 hours ago,r/PokemonUnite,Why is everyone at my jungle??? Please stay out of my jungle and leave me alone.
550,54 comments,2.4k,5 hours ago,r/Art,"I still remember what was lost, Me/Miles Johnston/ Graphite, 2022"
551,83 comments,456,4 hours ago,r/animecirclejerk,Redo of a healer is proof you don't need fan service to make good anime
552,91 comments,1.9k,7 hours ago,r/BeAmazed,Two small towns in Colombia have been using these two zip lines for 50 years to transport back and forth. In 30 seconds they can zip to each town saving them from a 2 to 3 hours walk.
553,53 comments,1.5k,6 hours ago,r/ShittyLifeProTips,"SLPT: If you wish to smuggle LSD onto an aircraft, simply conceal the drug under your tongue. It's incredibly unlikely that airport security will ask to inspect your mouth, and you can simply swallow the drug if you are faced with this predicament."
554,93 comments,436,4 hours ago,r/TheWeeknd,DAWN FM RELEASE TIMES
555,78 comments,1.1k,6 hours ago,r/vegan,Non-vegans In Our Sub Be Like:
556,87 comments,895,8 hours ago,r/BuyItForLife,"my fathers Sears Betamax VCR. Bought in 1979, I still remember him explaining to friends what a 'Video Cassette Recorder' does as he showed off last week's football games. Weighs a ton. It still works to this day."
557,245 comments,Vote,8 hours ago,r/BuyItForLife,"[PSA] We want your track driving Pro Tips, Reddit. Comment with your best technical tip for some gold, and a chance for your maneuver to be demonstrated by a Toyota Motorsport driver in the all new GR86."
558,99 comments,1.0k,7 hours ago,r/DotA2,AOE indicators are insanely bugged for almost a month already
559,70 comments,1.8k,11 hours ago,r/BokuNoMetaAcademia,Idk if Camie actually likes him or not though cuz I’m kinda on the episode where she is introduced fully
560,55 comments,954,8 hours ago,r/walkaway,"HI MY NAME IS WASHINGTON D.C. - At President Trumps inauguration in 2017, over 200 people were arrested for firebombing the city and rioting. Dems and their pet news agencies doesn't call me an insurrection!"
561,75 comments,779,6 hours ago,r/bleach,What’s your favourite Tsukishima moment? It’s a tossup for when he fought Byakuya or Ulquiorra for me. Man what a cool character!
562,248 comments,2.1k,4 hours ago,r/meme,Don't fucking say it
563,116 comments,3.3k,9 hours ago,r/lgbt,saw this at a grocery store yesterday
564,77 comments,466,4 hours ago,r/parrots,"This sound, ugh. He learned it from the Conure next door! First neighbor with a bird since I moved to NYC"
565,43 comments,1.4k,5 hours ago,r/lego,I built a Plymouth Belvedere!
566,50 comments,4.8k,10 hours ago,r/HollowKnightMemes,meme
567,62 comments,2.1k,4 hours ago,r/wallstreetbets,"Hey, at least it wasn't 500,000."
568,120 comments,2.7k,3 hours ago,r/interestingasfuck,Failures in early missile tests
569,53 comments,2.3k,7 hours ago,r/engrish,Fork wortor
570,49 comments,1.3k,5 hours ago,r/EngineeringPorn,"Some throwback engineering porn: A rare look at a subterranean Roman aqueduct channel, this one built by the Roman army to bring water to Viminacium in modern Serbia. Despite the popular image of grand aqueduct bridges, most Roman aqueducts ran almost entirely underground."
571,89 comments,493,3 hours ago,r/subnautica,[NO SPOILERS] Its true though.
572,83 comments,1.5k,5 hours ago,r/coolguides,Every planet in our solar system can fit between the Earth and the Moon
573,53 comments,1.3k,8 hours ago,r/notliketheothergirls,She's over 40 years old and still posting this shite
574,61 comments,1.1k,6 hours ago,r/eu4,I've been waiting to do this for a long time
575,94 comments,1.6k,3 hours ago,r/maybemaybemaybe,maybe maybe maybe
576,22 comments,7.2k,13 hours ago,r/MEOW_IRL,Meow irl
577,68 comments,1.7k,7 hours ago,r/whitepeoplegifs,Failed tactic
578,59 comments,691,4 hours ago,r/ApexOutlands,Idk why there is even drama lol
579,95 comments,692,5 hours ago,r/RedDeadOnline,"My daughter woke up this morning and saw me playing what she calls ""Horsey Game"" and she wanted to drive the train so I thought I'd let her, she had a lot of fun"
580,22 comments,1.1k,4 hours ago,r/HollowKnight,This fork looks like Pale King
581,72 comments,777,5 hours ago,r/howyoudoin,Anne Dudek was in both in Friends and HIMYM and both characters were broken up with on their birthday!
582,138 comments,1.5k,9 hours ago,r/AnimeFunny,The fact that it is true...
583,246 comments,Vote,9 hours ago,r/AnimeFunny,"[PSA] We want your track driving Pro Tips, Reddit. Comment with your best technical tip for some gold, and a chance for your maneuver to be demonstrated by a Toyota Motorsport driver in the all new GR86."
584,59 comments,1.4k,5 hours ago,r/notinteresting,Grapes
585,69 comments,400,3 hours ago,r/camping,I got a solo stove (no affiliation) and it was worth every penny. Dang near smokeless.
586,44 comments,3.2k,14 hours ago,r/JustGuysBeingDudes,Ahhh.... ahhhh....here you go mf's....
587,42 comments,5.8k,9 hours ago,r/ShitPostCrusaders,king crimson!!!
588,67 comments,430,3 hours ago,r/Steam,Hello what does the tag 6dof mean?
589,9 comments,1.1k,4 hours ago,r/raining,Family time
590,43 comments,2.1k,10 hours ago,r/onejob,"Refrees aren't supposed to do that, right?"
591,46 comments,1.0k,4 hours ago,r/MemePiece,·
592,86 comments,9.6k,10 hours ago,r/perfectlycutscreams,fr tho 💀
593,15 comments,1.0k,3 hours ago,r/absolutelynotme_irl,absolutelynotme_irl
594,104 comments,3.4k,14 hours ago,r/holdmycosmo,HMC While I Park My Ride...
595,40 comments,1.4k,8 hours ago,r/ik_ihe,Ik🏊Ihe
596,75 comments,2.3k,10 hours ago,r/funny,Looney Tunes is a gem
597,75 comments,2.3k,10 hours ago,r/funny,Looney Tunes is a gem
598,57 comments,2.2k,9 hours ago,r/tf2shitposterclub,objector in a stonetoss comic???
599,77 comments,2.1k,8 hours ago,r/AbandonedPorn,"This abandoned pyramid is hidden in plain sight at one of the most amazing beaches in Playa del Carmen, Mexico - Link to album and video in comments - [2876 × 1614] [OC]"
600,80 comments,946,8 hours ago,r/castiron,Made a tornado omelette in my 10” lodge (this was my third try)
601,88 comments,3.1k,7 hours ago,r/Hololive,[Animation MV] Tsunomaki Watame - My song [original]
602,50 comments,579,2 hours ago,r/HermitCraft,Doc speaks facts
603,32 comments,2.7k,9 hours ago,r/wholesome,"Fly high, beautiful soul."
604,43 comments,2.8k,6 hours ago,r/BrandNewSentence,Or a self-checkout machine
605,57 comments,806,7 hours ago,r/chemistry,Does anyone know what is happening here ? I'm melting tin on a alligator clip.
606,71 comments,3.3k,10 hours ago,r/Battlefield,Sabaton Wingman
607,74 comments,2.2k,8 hours ago,r/Terraria,Mastermind boss concept (current sprite)
608,45 comments,1.8k,7 hours ago,r/arcane,[no spoilers] Not much has changed huh? Ekko and Jinx by me :3
609,40 comments,2.4k,12 hours ago,r/vaxxhappened,Every healthcare organization should be following this example.
610,70 comments,2.9k,12 hours ago,r/xqcow,Chat when xQc gives his opinion on a Jubilee video
611,43 comments,1.5k,11 hours ago,r/CrusaderKings,the northmen army ai sometimes...
612,82 comments,2.9k,10 hours ago,r/Outdoors,"Oahu, Hawaii, United States!!"
613,33 comments,1.5k,6 hours ago,r/OnePunchMan,I dislike how Murata ignores certain types of readers with his lack of fan service
614,16 comments,1.8k,7 hours ago,r/shittymoviedetails,"You might have noticed that the titles for the three MCU Spiderman films each contain a common word (""Home""). This is a reference to the Raimi trilogy, in which each film also contains a common word (""Spider-Man"")."
615,103 comments,1.5k,7 hours ago,r/IndianDankMemes,Nostalgia
616,94 comments,2.1k,4 hours ago,r/pcmasterrace,Teh war continues
617,187 comments,5.3k,6 hours ago,r/nextfuckinglevel,When you love what you do... nothing can stop you.
618,33 comments,780,6 hours ago,r/IDontWorkHereLady,Fired without being hired.
619,35 comments,3.2k,10 hours ago,r/animegifs,Asuka Surprise
620,106 comments,Vote,2 hours ago,r/FoodPorn,Sometimes I cry when I remember that there are some countries where Poutines aren't a thing
621,56 comments,2.0k,7 hours ago,r/MemePiece,Hopefully this Year...
622,26 comments,2.2k,8 hours ago,r/Technoblade,is that....CONTACT
623,82 comments,685,6 hours ago,r/stopdrinking,It's so much fun being a superhero.
624,1.2k comments,5.5k,8 hours ago,r/gaming,“What is a man? A Miserable little pile of secrets!”
625,46 comments,1.6k,6 hours ago,r/pitbulls,My Blue Nose Pit Selena 💙 rescued and saved her from a terrible home where she was abused and starved and shes gained almost 60 ibs and is a happy girl
626,49 comments,2.9k,4 hours ago,r/funny,Sweet relief
627,76 comments,1.4k,6 hours ago,r/Overwatch_Memes,Playing support be like…
628,37 comments,659,5 hours ago,r/kpop,"Twice's album Formula of Love: O+T=<3 has now sold over 800,000 copies combined on Gaon."
629,92 comments,1.7k,10 hours ago,r/Justfuckmyshitup,A human in front of me at CVS.
630,56 comments,2.3k,10 hours ago,r/lostredditors,injustice is injustice
631,584 comments,3.9k,4 hours ago,r/dankmemes,fuck zodiac sign
632,7 comments,823,2 hours ago,r/puns,No spoilers
633,1.0k comments,9.6k,13 hours ago,r/LifeProTips,LPT - Do not carry large sums of cash in the USA. You may fall victim to civil asset forfeiture
634,68 comments,2.7k,9 hours ago,r/im14andthisisdeep,bruh
635,85 comments,1.7k,9 hours ago,r/woooosh,the sun is a deadly laser
636,62 comments,5.7k,12 hours ago,r/antimeme,I mean it's not wrong
637,53 comments,1.3k,5 hours ago,r/woodworking,Table pedestal timelapse
638,35 comments,1.9k,12 hours ago,r/SapphoAndHerFriend,"From the wiki for The Count of Monte Cristo. “Intimate friends,” huh?"
639,55 comments,1.2k,7 hours ago,r/OMORI,You just got maried!!!
640,44 comments,2.1k,1 day ago,r/aww,Very cute good boy
641,44 comments,2.1k,1 day ago,r/aww,Very cute good boy
642,13 comments,1.2k,5 hours ago,r/Gamingcirclejerk,Never forget. Gaming turned Hank Hill from propane to pro-pain (to w*man and m*norities) 😥
643,65 comments,1.4k,8 hours ago,r/mycology,These glowing fungi popped up just outside my front door last night! I think they are called Mycena chlorophos or “green pepe”
644,70 comments,1.4k,7 hours ago,r/soccercirclejerk,The best player ever to wear an England jersey
645,72 comments,4.3k,14 hours ago,r/ofcoursethatsathing,A unique performance
646,23 comments,888,2 hours ago,r/gifsthatkeepongiving,Lockdown day 532
647,56 comments,4.5k,14 hours ago,r/Konosuba,Darkness & Wiz Happy Holidays 🎄🎄🎄🎁🎁
648,72 comments,1.5k,6 hours ago,r/AnimalCrossing,Love that you can remodel your villagers homes. I want to move in with Maple.
649,46 comments,892,2 hours ago,r/GME,I have an Engineering interview w/GME today — wish me luck! 🤞
650,18 comments,867,3 hours ago,r/gatesopencomeonin,A little advice for the ladies
651,97 comments,4.1k,7 hours ago,r/hmm,hmm
652,247 comments,2.0k,5 hours ago,r/technology,"European Airlines Are Operating 18,000 Empty Flights Because of a Dumb Rule"
653,52 comments,509,4 hours ago,r/shittyfoodporn,Buffalo Wild Wings has completely given up.
654,46 comments,817,5 hours ago,r/Aquariums,My beautiful lotus sprouted a flower :)
655,16 comments,2.0k,8 hours ago,r/RoomPorn,"Green bathroom full of plants in Melbourne, Victoria, Australia [1080x1349]"
656,52 comments,594,5 hours ago,r/JoeBiden,"Biden: If you did not win, you still love your country."
657,35 comments,973,7 hours ago,r/AccidentalAlly,"On a video about a passing trans girl, that mentionned she was trans."
658,96 comments,2.1k,8 hours ago,r/india,"I am a grown man, but today I cried....."
659,41 comments,641,15 hours ago,r/antiwork,Stop being poor!
660,41 comments,641,15 hours ago,r/antiwork,Just stop being poor.🤦‍♂️
661,48 comments,1.5k,6 hours ago,r/Deltarune,He really is a man of the pipis
662,53 comments,855,5 hours ago,r/cyberpunkgame,I looked down
663,49 comments,674,4 hours ago,r/MonsterHunter,Who’s egg is this? (@MysticKitsune)
664,56 comments,666,6 hours ago,r/exmuslim,The irony in this...
665,41 comments,1.8k,19 hours ago,r/BrandNewSentence,I think this sub would love this
666,41 comments,1.8k,19 hours ago,r/BrandNewSentence,cringe has been yeeted?
667,241 comments,785,3 hours ago,r/ufc,Real talk; which fighter would actually be champion if they fought in a real phone booth?
668,30 comments,3.1k,1 day ago,r/maybemaybemaybe,maybe maybe maybe
669,30 comments,3.1k,1 day ago,r/maybemaybemaybe,maybe maybe maybe
670,94 comments,15.1k,7 hours ago,r/memes,Say Good Night
671,43 comments,5.3k,12 hours ago,r/MakeMeSuffer,I tumbled across this fine piece of design for a 3D printer Great Description as well
672,47 comments,558,3 hours ago,r/Gunners,Gargantuan
673,32 comments,1.2k,5 hours ago,r/Pareidolia,Trump (but with lights on inside)
674,42 comments,955,7 hours ago,r/dogecoin,Doge look up
675,56 comments,679,5 hours ago,r/HIMYM,Anne Dudek was in both Friends and HIMYM and were both broken up with on their birthday!
676,16 comments,3.1k,7 hours ago,r/wholesomememes,The goofy face normally did the trick.
677,68 comments,578,5 hours ago,r/CitiesSkylines,I dont know what I was thinking when I made this...
678,95 comments,4.5k,5 hours ago,r/shitposting,Real
679,51 comments,1.0k,8 hours ago,r/Berserk,Which your fav guts. mine is conviction arc guts
680,885 comments,16.5k,14 hours ago,r/MurderedByWords,Vaccine debate in the local fb group
681,31 comments,695,6 hours ago,r/TarkovMemes,My RFB jammed and i witnesed the best unjam animation
682,29 comments,1.1k,5 hours ago,r/Persona5,The Vulgar Boy goes to see the Back-alley Doctor.
683,62 comments,2.0k,13 hours ago,r/OldSchoolCool,"Receptionist waits at her desk. General Motors Technical Center, 1965"
684,62 comments,2.0k,13 hours ago,r/OldSchoolCool,"Receptionist waits at her desk. General Motors Technical Center, 1965"
685,156 comments,5.6k,9 hours ago,r/blursedimages,Blursed Middle Finger
686,38 comments,2.5k,9 hours ago,r/Rainbow6,"Ah yes, regular round as monty"
687,1 comment,901,4 hours ago,r/wholesomejojo,All dogs are pure beans
688,7 comments,1.2k,5 hours ago,r/thesims,Tbh
689,47 comments,1.3k,6 hours ago,r/reactiongifs,"MRW my boss tells me my ""promotion"" comes with a new title, but no salary increase."
690,53 comments,1.5k,9 hours ago,r/Survival,Self rescue from a frozen lake
691,58 comments,4.6k,9 hours ago,r/me_irl,me_irl
692,54 comments,1.2k,8 hours ago,r/valheim,"Note to self: don't build an ""Obliterator"" indoors."
693,36 comments,1.6k,7 hours ago,r/FortNiteBR,One simple item changed map rotation forever
694,48 comments,532,4 hours ago,r/techsupportgore,My sisters setup
695,73 comments,1.1k,6 hours ago,r/Rabbits,Thought you guys might like it. (sorry if irrelvant)
696,62 comments,692,6 hours ago,r/sabaton,"The song is a BANGER, i hope you'll all enjoy it!!"
697,60 comments,2.9k,14 hours ago,r/food,[homemade]creamy white vine mushroom tagliatelle and homemade garlic bread
698,52 comments,2.1k,10 hours ago,r/PixelArt,Collage of drawings for an endangered animals project.
699,31 comments,2.9k,12 hours ago,r/shittyrainbow6,Bringing a 5G network to your city soon
700,23 comments,1.3k,6 hours ago,r/cursed_videomemes,Why was this on Xvideos?
701,20 comments,1.3k,6 hours ago,r/corgi,Meet patchy! The half toasted corgi ❤️
702,49 comments,1.3k,6 hours ago,r/DesignPorn,Creative Dose logo
703,39 comments,922,4 hours ago,r/de,Eine reguläre Tram in Rahnsdorf nähe Berlin
704,34 comments,1.4k,8 hours ago,r/MemeEconomy,Invest in Silconomics
705,60 comments,4.1k,13 hours ago,r/MostBeautiful,"I had just gotten off of work Jaipur, India."
706,46 comments,420,4 hours ago,r/tarantulas,Sockies says hi
707,44 comments,1.0k,6 hours ago,r/boston,Hi /r/boston! I completed my cross stitch temperature chart of 2021!
708,41 comments,1.3k,7 hours ago,r/GTA,Claude Roasts Franklin
709,47 comments,777,4 hours ago,r/YUROP,"Norway may not be a member of the European Union, but this fellow sure is doing an extra effort to blend in here in France"
710,19 comments,841,4 hours ago,r/attackontitan,Hajime Isayama’s 2022 New Year’s Resolution
711,46 comments,542,2 hours ago,r/xboxone,"Just got the last Series X here at Target! There's two in the pic, but someone got the first one before I did."
712,40 comments,1.1k,5 hours ago,r/MortalKombat,Sindel alt?
713,30 comments,2.3k,9 hours ago,r/blursed_videos,Blursed cinema
714,53 comments,1.6k,7 hours ago,r/MinecraftMemes,Cooked chicken only
715,29 comments,3.8k,14 hours ago,r/Breath_of_the_Wild,One of my favorite official artworks!
716,31 comments,1.9k,10 hours ago,r/HumanTippyTaps,She just got hired
717,21 comments,569,5 hours ago,r/civ,"Phew, managed to narrowly avoid a dark age"
718,107 comments,2.1k,6 hours ago,r/Tinder,I put in my profile that I don’t care how tall anyone is… so far I think it’s helping my chances of finding true love
719,52 comments,1.4k,7 hours ago,r/minipainting,Lamenter Eliminator and Active Camo recipe.
720,26 comments,2.7k,7 hours ago,r/AnimalsBeingDerps,Smol pup does big pup an excite
721,48 comments,760,6 hours ago,r/splatoon,Squid Attorney
