,comment_count,upvote_delta,timeup_list,subreddit,thread_text
0,18.5k comments,27.0k,10 hours ago,r/AskReddit,"If you were handed 10 billion dollars right now, what would you still never buy?"
1,725 comments,34.3k,4 hours ago,r/funny,Really.
2,318 comments,10.2k,2 hours ago,r/MadeMeSmile,The heartwarming moment a child was adopted by the family who took care of him for Christmas
3,6.4k comments,7.1k,12 hours ago,r/Music,Why does this sub hate rap music so much?
4,5.1k comments,46.0k,7 hours ago,r/WhitePeopleTwitter,Imagine acting like this towards someone who just asked your kids what they want for Christmas?
5,3.5k comments,39.6k,14 hours ago,r/Steam,"Breaking News ： Steam has been banned in China.. The store has been included in the ""wall"" list along with the community"
6,3.3k comments,8.3k,13 hours ago,r/AskMen,"Those of you who’ve walked out on first dates, what was your “I’m out of here” moment?"
7,1.1k comments,49.9k,6 hours ago,r/worldnews,The James Webb Space Telescope has successfully launched
8,3.7k comments,4.4k,4 hours ago,r/gaming,"Damn, I'm dead"
9,1.6k comments,60.2k,6 hours ago,r/space,James Webb Launch
10,43 comments,7.7k,3 hours ago,r/BlackPeopleTwitter,Happy holidays to all
11,3.2k comments,32.3k,8 hours ago,r/HolUp,I bet this is the most ironic thing you'll see today.
12,195 comments,22.9k,5 hours ago,r/interestingasfuck,Functional LEGO technic bridge girder
13,2.1k comments,3.7k,11 hours ago,r/AskUK,So what/who has ruined Christmas already?
14,477 comments,29.5k,6 hours ago,r/news,James Webb Space Telescope lifts off on historic mission
15,1.1k comments,28.9k,5 hours ago,r/nextfuckinglevel,This Christmas advert from a British supermarket. picturing the events that happened 105 years ago when they stopped the war for Christmas
16,337 comments,30.3k,5 hours ago,r/Unexpected,🤔🍑💬🤌
17,342 comments,48.6k,6 hours ago,r/pics,This UPS driver remains an absolute king
18,2.0k comments,14.0k,16 hours ago,r/news,"Covid hospitalizations are rising across the country, even in high-vaccination states"
19,2.0k comments,6.2k,5 hours ago,r/antiwork,"In honor of Clark Griswold, what's the crappiest bonus you ever recieved?"
20,123 comments,20.0k,5 hours ago,r/Damnthatsinteresting,Those editing skills...
21,1.8k comments,52.8k,16 hours ago,r/lotrmemes,Men of Quality
22,220 comments,10.9k,5 hours ago,r/todayilearned,TIL that James Webb ran NASA in the 1960’s and pushed for a balance between space flight and science. He wrote in 1965 that a major space telescope should be pursued.
23,1.0k comments,8.6k,4 hours ago,r/nba,"[Stan Van Gundy] This nostalgic emotion about the demise of the Staples Center is crazy. First, it is a building. Second, they aren’t blowing it up. They are just changing it’s corporate sponsor. What exactly are people nostalgic about — an office supply store’s sponsorship of a building?"
24,1.5k comments,35.2k,17 hours ago,r/iamatotalpieceofshit,Friendly reminder to call out your family for Shitty behavior.
25,1.5k comments,42.5k,6 hours ago,r/facepalm,This would be funnier if it wasn’t so dangerous
26,1.4k comments,58.4k,12 hours ago,r/MadeMeSmile,"My wife of 14 years, and mother of our 4 kids, worked so hard this year to accomplish her goal of getting back to the same size she was when we got married. She needs new clothes now, so tomorrow morning I'm going to surprise her with a brand new wardrobe that I've been putting together for months."
27,709 comments,21.7k,5 hours ago,r/gaming,I’m dead. I just bought her a book
28,780 comments,26.3k,5 hours ago,r/TIHI,"Thanks, I hate Elon musk and 1% the rich"
29,1.4k comments,31.8k,7 hours ago,r/mildlyinteresting,My new printer printed the user manual on its own as soon as I got it up and running
30,1.5k comments,4.2k,3 hours ago,r/teenagers,DOES NO ONE HAVE SNOW ON CHRISTMAS? 😭
31,1.3k comments,20.5k,8 hours ago,r/starterpacks,Black woman in a movie starter pack
32,492 comments,21.7k,6 hours ago,r/pcmasterrace,"To all the PCMR brothers and sisters who received higher refresh rate monitors from Santa, don't forget to manually change the refresh rate setting."
33,1.3k comments,7.6k,1 day ago,r/pakistan,"Pakistani shopkeeper calls America a ""terrorist country"" to an American vlogger"
34,1.3k comments,7.6k,1 day ago,r/pakistan,Chad Pakistani
35,433 comments,16.3k,6 hours ago,r/BrandNewSentence,Please stop
36,408 comments,7.5k,4 hours ago,r/WhitePeopleTwitter,Escalations ….
37,189 comments,6.4k,3 hours ago,r/Genshin_Impact,"My Paiman cosplay for you, guys!"
38,98 comments,13.2k,6 hours ago,r/oddlysatisfying,Keeping things in order
39,1.1k comments,43.5k,15 hours ago,r/Tinder,I’m sorry Gery
40,1.2k comments,24.0k,21 hours ago,r/byebyejob,How it started vs. How it’s going.
41,1.1k comments,49.9k,15 hours ago,r/ShittyLifeProTips,SLPT: how to stop Chinese telemarketers
42,1.0k comments,23.9k,14 hours ago,r/therewasanattempt,To look cool while playing chess
43,212 comments,21.6k,6 hours ago,r/BeAmazed,"Look like a typical thick novel? But when you tilt the book like reading it, the fore-edge will appear a majestic picture from LOTR"
44,998 comments,12.0k,6 hours ago,r/AbsoluteUnits,The former Minister of Health for Belgium
45,51 comments,12.4k,6 hours ago,r/MovieDetails,"In Shrek 2 (2004), King Harold and Queen Lillian were named after Harold and Lillian Michelson, a couple who had been working in Hollywood for decades. Lillian is a film researcher and Harold was a production designer (he died in 2007)."
46,893 comments,28.3k,13 hours ago,r/LifeProTips,LPT: Don't avoid photos during gatherings; you'll want more of them one day.
47,125 comments,19.7k,6 hours ago,r/me_irl,me_irl
48,824 comments,22.4k,14 hours ago,r/IdiotsInCars,Yeah don’t back your vehicle up or do what everyone else is doing.
49,678 comments,2.9k,7 hours ago,r/ich_iel,Ich🎄iel
50,906 comments,37.0k,12 hours ago,r/FunnyandSad,free if you’re under a specified income.
51,842 comments,4.7k,6 hours ago,r/greentext,Anon doesn’t like the vax
52,109 comments,12.3k,6 hours ago,r/NatureIsFuckingLit,"🔥 Sociable weaver's bird's nest, the largest nests in the world 🔥"
53,842 comments,15.0k,17 hours ago,r/WinStupidPrizes,Throws bricks at dogs and gets mauled
54,823 comments,8.3k,12 hours ago,r/FellowKids,Hehe communism! I’m so relatable guys!
55,915 comments,27.5k,14 hours ago,r/rareinsults,What do you even call that?
56,738 comments,4.7k,12 hours ago,r/NoStupidQuestions,Why did people sound more intelligent 50 years ago?
57,750 comments,32.2k,12 hours ago,r/MurderedByWords,"Read the situation, you dumb shit"
58,807 comments,5.4k,12 hours ago,r/politics,Why does America keep jailing people because they're poor?
59,142 comments,7.3k,4 hours ago,r/Tinder,Single mother
60,847 comments,2.0k,11 hours ago,r/polls,Whats the solution for this 1+1+1+1+1×0 = ?
61,927 comments,6.4k,8 hours ago,r/oddlyterrifying,This stack of bended spoons I found in my friend grandmother cupboard. Why would they be bent like this??
62,743 comments,4.8k,4 hours ago,r/gadgets,Apple’s AirTags are being abused by car thieves and stalkers
63,27 comments,9.8k,5 hours ago,r/PrequelMemes,Never forget
64,151 comments,11.4k,6 hours ago,r/therewasanattempt,To end it all
65,610 comments,7.8k,12 hours ago,r/insaneparents,"went to visit my boyfriend for the weekend and my mom decided to text me this while i was sleeping, im an adult btw"
66,640 comments,5.4k,14 hours ago,r/CasualConversation,Does anyone else feel like this is the least Christmas Christmas in a while?
67,626 comments,1.8k,6 hours ago,r/explainlikeimfive,ELI5: How did you kill a knight wearing full armor in medieval times?
68,78 comments,8.3k,4 hours ago,r/blursedimages,Blursed_Smile
69,86 comments,5.9k,3 hours ago,r/PewdiepieSubmissions,"year update, i guess :D"
70,592 comments,28.3k,7 hours ago,r/WatchPeopleDieInside,Checking me out
71,451 comments,42.6k,16 hours ago,r/BlackPeopleTwitter,The magical feel is really gone
72,102 comments,9.0k,4 hours ago,r/interestingasfuck,The rocket carrying James Webb space telescope as seen from my backyard...in Nepal
73,439 comments,9.2k,6 hours ago,r/cats,My cat came back home after 2 years.
74,742 comments,5.7k,14 hours ago,r/CryptoCurrency,YSK: The 'i got hacked' post are probably scammers themselves hoping for donations and you should not send them any money.
75,643 comments,18.5k,15 hours ago,r/Wellthatsucks,So this just happened. Now we have to find take out at 7 pm. on Christmas Eve.
76,606 comments,16.3k,8 hours ago,r/science,Launch of the James Webb Space Telescope
77,199 comments,6.4k,5 hours ago,r/nasa,Last look at the Webb Telescope
78,721 comments,29.1k,19 hours ago,r/instant_regret,Using a shovel to puncture a paint can
79,478 comments,70.2k,15 hours ago,r/perfectlycutscreams,"I put my father’s gift in a nesting-doll set of puzzle boxes. He took 45 minutes to solve the first one, then he saw another.."
80,88 comments,15.0k,6 hours ago,r/whenthe,We do a little trolling
81,71 comments,4.2k,3 hours ago,r/YouShouldKnow,"YSK about the Fundamental Attribution Error, a key concept in psychology where we judge others based on their actions but ourselves based on our intent."
82,586 comments,6.9k,14 hours ago,r/arcane,[no spoilers] how come everyone is so thirsty over Vi & Caitlyn when Mel is clearly the most beautiful woman on the show
83,103 comments,6.3k,5 hours ago,r/lotrmemes,So be it
84,551 comments,4.3k,8 hours ago,r/Warhammer40k,New Asuryani & CSM battlebox
85,280 comments,4.7k,4 hours ago,r/baseball,"Since everyone is suggesting division re-alignments, I'd like to throw my suggestion up for consideration."
86,183 comments,39.2k,8 hours ago,r/dankmemes,Battle of the century
87,118 comments,8.3k,5 hours ago,r/Hololive,A new hero. A new legend.
88,408 comments,2.3k,12 hours ago,r/harrypotter,"I don’t understand, what was so immoral about Harry using Snape’s old potions book in Half-Blood Price?"
89,55 comments,13.4k,7 hours ago,r/woooosh,These subtitles are really immersive
90,70 comments,5.3k,5 hours ago,r/dndmemes,They seemed to enjoy it.
91,280 comments,5.0k,5 hours ago,r/Gamingcirclejerk,womp womp
92,500 comments,4.0k,12 hours ago,r/battlefield2042,"Well, it finally happened. Merry christmas everyone?"
93,152 comments,29.1k,8 hours ago,r/wholesomememes,"Thankyou for the pie, grandma."
94,56 comments,7.1k,6 hours ago,r/maybemaybemaybe,Maybe maybe maybe
95,369 comments,7.1k,6 hours ago,r/Whatcouldgowrong,WCGW while driving on snow
96,59 comments,3.5k,8 hours ago,r/gaming,Forza Horizon
97,59 comments,3.5k,8 hours ago,r/gaming,Forza Horizon
98,451 comments,1.9k,16 hours ago,r/interestingasfuck,"Compare this to how OP archery is on WH, please make armour useful in WH3"
99,451 comments,1.9k,16 hours ago,r/interestingasfuck,Medieval armour vs. full weight medieval arrows
100,388 comments,5.7k,13 hours ago,r/movies,That Time the FBI Scrutinized “It's a Wonderful Life” for Communist Messaging
101,527 comments,14.7k,10 hours ago,r/trashy,This lady came and stole all of my…empty Nespresso pods. 😂
102,169 comments,12.2k,8 hours ago,r/ScottishPeopleTwitter,🎄 Merry Christmas 🎄
103,473 comments,3.9k,12 hours ago,r/dataisbeautiful,[OC] Not particularly beautiful but sad and requested... see discussion at: https://www.reddit.com/r/dataisbeautiful/comments/rm1iw2/oc_twelve_million_years_lost_to_covid/
104,7.7k comments,16.0k,15 hours ago,r/AskReddit,(Serious) what is a demon/ addiction / fetish you are trying to get over right now?
105,292 comments,14.4k,17 hours ago,r/sadcringe,Say you’re insecure without saying you’re insecure
106,427 comments,1.7k,6 hours ago,r/witcher,"The show failed miserably in they portrayal of elves, here's why"
107,393 comments,15.9k,13 hours ago,r/technology,'Don't Cross the Picket Line': Apple Workers Organize Christmas Eve Walkout
108,296 comments,8.9k,5 hours ago,r/space,The James Webb Telescope successfully separates from the final stage
109,38 comments,5.6k,4 hours ago,r/memes,James Bond
110,246 comments,4.7k,14 hours ago,r/SelfAwarewolves,The tourist…. doesn’t want to see other tourists
111,111 comments,6.7k,6 hours ago,r/ToiletPaperUSA,"Happy Candacemas, TPUSA"
112,158 comments,4.1k,8 hours ago,r/AnarchyChess,God jul
113,97 comments,4.5k,17 hours ago,r/maybemaybemaybe,"Man wrongfully imprisoned, missed childhood."
114,97 comments,4.5k,17 hours ago,r/maybemaybemaybe,Maybe Maybe Maybe
115,73 comments,3.9k,4 hours ago,r/OldSchoolCool,I peaked in '96
116,668 comments,Vote,1 hour ago,r/raimimemes,I will put anyone who asks to be in the list
117,409 comments,26.5k,14 hours ago,r/mildlyinfuriating,Waiting in a queue
118,313 comments,4.4k,14 hours ago,r/MMA,"30-0, legacy complete."
119,117 comments,4.8k,5 hours ago,r/DunderMifflin,I will never forget how David made Ryan cry in a deleted scene
120,236 comments,3.1k,8 hours ago,r/lgbt,my parents are forcing me to marry
121,452 comments,3.2k,5 hours ago,r/atheism,James Webb telescope is on its way! NASA Administrator 'thanks God' and quotes bible verses...barf!
122,120 comments,1.1k,5 hours ago,r/playboicarti,adin ross and carti subreddit beef
123,265 comments,3.4k,5 hours ago,r/marvelstudios,Is Wong bound by... Wanda? [Multiverse of Madness trailer]
124,227 comments,5.7k,15 hours ago,r/Naruto,Why did kishimoto do that to him? LMAOO
125,336 comments,6.6k,15 hours ago,r/OnePiece,1st popularity poll all the way back in 1998!
126,143 comments,3.8k,4 hours ago,r/AbruptChaos,Watch for falling Jeep
127,346 comments,12.8k,8 hours ago,r/pokemon,literally just got the game and i don’t wanna play anymore
128,105 comments,16.4k,9 hours ago,r/trippinthroughtime,No rest days
129,428 comments,3.8k,7 hours ago,r/halo,175 hours into infinite and i finally got a new helmet
130,390 comments,21.4k,11 hours ago,r/ProgrammerHumor,So accurate 👌
131,360 comments,5.1k,13 hours ago,r/australia,1743 map of Australia
132,428 comments,25.9k,14 hours ago,r/Unexpected,If i were 20 years younger…
133,427 comments,2.7k,3 hours ago,r/HermanCainAward,Red would rather have died than vaccinate. He got his wish.
134,23 comments,3.2k,3 hours ago,r/AnimalsBeingJerks,Merry Christmas
135,375 comments,25.1k,16 hours ago,r/OldSchoolCool,"My wife at 8yo kicking grown mens’ ass at RC racing. Circa 1986. (She’s looking the other way because she’s already that far ahead on the track). Credit local newspaper, Courier Journal for the photo."
136,302 comments,3.8k,11 hours ago,r/Jokes,Chinese man rings his boss...
137,260 comments,52.0k,10 hours ago,r/technicallythetruth,Can you talk real quick?
138,158 comments,8.1k,16 hours ago,r/shittymoviedetails,A detail that I never noticed as a kid is that Martha May really wants to fuck the grinch.
139,177 comments,5.4k,6 hours ago,r/freefolk,On Carice Van Houten’s (melisandre) instagram story
140,118 comments,9.6k,9 hours ago,r/comics,"Nice, like me"
141,66 comments,4.1k,4 hours ago,r/aww,A big tortoise meeting the little one
142,298 comments,21.1k,14 hours ago,r/blackmagicfuckery,Does anyone know how to make a holy bartender?
143,377 comments,16.7k,15 hours ago,r/oddlysatisfying,Getting rid of hornets
144,108 comments,1.8k,10 hours ago,r/hoi4,Thought I would go for the tried and true Hiroshima landing...
145,341 comments,8.2k,18 hours ago,r/SweatyPalms,Spelunking. I'll never understand why.
146,117 comments,15.3k,8 hours ago,r/Eyebleach,The most beautiful duck
147,370 comments,12.2k,13 hours ago,r/marvelmemes,NGL lie I would love to see what it would be like
148,363 comments,2.3k,9 hours ago,r/LinusTechTips,"lol ""I WANTED A PC!"""
149,16 comments,6.3k,6 hours ago,r/BikiniBottomTwitter,Merry Christmas!
150,414 comments,60.1k,10 hours ago,r/memes,Owl never forgive you
151,237 comments,3.6k,4 hours ago,r/lgbt,My transphobic family isn't letting me come to Christmas but i still wanted to dress up a bit
152,112 comments,5.7k,6 hours ago,r/oddlyspecific,Moon's haunted
153,73 comments,5.7k,5 hours ago,r/shitposting,nice car
154,142 comments,2.2k,9 hours ago,r/de,"Da hat der Weihnachtsmann wohl mit meiner Frau über mich ""gesprochen""."
155,357 comments,4.6k,7 hours ago,r/MakeMeSuffer,Quit smoking and coughed this up
156,50 comments,5.1k,6 hours ago,r/Art,"Swimming, Me, Oil on canvas board 24x30 cm, 2021"
157,192 comments,6.3k,12 hours ago,r/TheRightCantMeme,I recently joined some rightwing subreddits. The posts are hilarious but they actually mean it so it's kinda sad.
158,337 comments,7.0k,6 hours ago,r/Damnthatsinteresting,Little girl accidentally hit in the face by soldier after meeting Queen Elizabeth II
159,103 comments,8.4k,13 hours ago,r/FUCKYOUINPARTICULAR,Fuck #42
160,58 comments,3.0k,3 hours ago,r/blackmagicfuckery,Guiding a paper plane
161,177 comments,2.8k,3 hours ago,r/nottheonion,"A man played the same numbers on the same day on 160 lottery tickets. He won $800,000"
162,49 comments,5.9k,6 hours ago,r/suspiciouslyspecific,We drove out the lubrication
163,57 comments,3.2k,3 hours ago,r/MapPorn,Merry Christmas to all you map nerds!
164,360 comments,12.3k,5 hours ago,r/nextfuckinglevel,Host calls out audience for laughing at male domestic violence victim
165,314 comments,593,4 hours ago,r/SubredditDrama,Steam has been banned in China. G*mers react.
166,90 comments,7.6k,12 hours ago,r/likeus,All kids hate bath time
167,795 comments,51.0k,8 hours ago,r/gaming,Merry Christ...
168,52 comments,4.8k,3 hours ago,r/Damnthatsinteresting,The weaver bird that builds a second (false) door to its nest to protect its eggs from snakes.
169,110 comments,793,4 hours ago,r/SquaredCircle,"Wade Barrett on NXT S1: The eight of us on NXT season one, universally hated it. We were being built as rookies. [We] weren't deemed [good enough] to be allowed even in the locker room. We're changing in hallways. It wasn't just a storyline. We're actually treated like that behind the scenes."""
170,17 comments,2.6k,3 hours ago,r/natureismetal,A monitor lizard in India bringing the dinosaur vibes.
171,229 comments,9.1k,8 hours ago,r/Jokes,An Engineer accidentally goes to Hell instead of Heaven
172,122 comments,2.4k,2 hours ago,r/assholedesign,"This printer automatically prints its own manual on first boot, making you use your own paper and ink instead of the manufacturer's"
173,129 comments,7.8k,11 hours ago,r/Genshin_Impact,SHENHE Cosplay trial by Roxanne Kho
174,196 comments,1.6k,11 hours ago,r/Romania,Păi eu la vârsta ta…
175,370 comments,13.3k,8 hours ago,r/Minecraft,Bit of progress on my resource pack
176,156 comments,6.2k,16 hours ago,r/educationalgifs,Medieval armour vs. full weight medieval arrows
177,218 comments,19.3k,17 hours ago,r/meirl,meirl
178,333 comments,8.7k,10 hours ago,r/MinecraftMemes,Think about it
179,181 comments,4.3k,8 hours ago,r/gatekeeping,Gatekeeping the Japanese language
180,248 comments,2.9k,3 hours ago,r/Spiderman,I would very much like to see Gwen Stacy in Holland movies. We need a new blood to Peter's story and him meeting her in college would be awesome.
181,161 comments,4.4k,5 hours ago,r/awfuleverything,Raid shadow legends
182,154 comments,801,4 hours ago,r/nursing,"“It’s quiet and I’m bored.” - ED Charge RN, 0502 12/25/2021"
183,166 comments,852,7 hours ago,r/Philippines,"Kris Aquino breaks silence and shares ""facts about my kuya"""
184,106 comments,1.4k,7 hours ago,r/bleach,What even was this matchup😭 Kubo did my man chad wrong since the beginning
185,26 comments,3.4k,4 hours ago,r/fakehistoryporn,"Liberal atheists begin the war on Christmas, circa early 2000's"
186,259 comments,9.0k,13 hours ago,r/ANormalDayInRussia,Obama socializing in Russia (2005)
187,168 comments,1.6k,3 hours ago,r/niceguys,I have a married neck beard coworker who thinks if he gives me free weed that I will send him nudes. I’m the GM and he’s the assistant manager. I am so short staffed that I don’t want him to be butt hurt and leave. I have made it clear I’m not into him like that though but he clearly doesn’t care
188,101 comments,10.1k,5 hours ago,r/dankmemes,Cum again?!
189,327 comments,12.5k,17 hours ago,r/Unexpected,T-SHIRT
190,327 comments,12.5k,17 hours ago,r/Unexpected,T-SHIRT
191,81 comments,2.7k,8 hours ago,r/HistoryPorn,"1987, Egyptian citizen submitting a request to Mubarak during his visit to Portsaid [717x845]"
192,281 comments,2.6k,10 hours ago,r/YUROP,"Merry 30 years of USSR collapsing today for all EU states effected, now that was the true Christmas miracle for us!!"
193,150 comments,1.7k,10 hours ago,r/MilitaryPorn,"Imperial Japanese Army soldiers using Arisaka (bolt-action repeating rifles) to shoot blindfolded Sikhs, those prisoners had been taken after the fall of British Singapore on February 15th, 1942. They were shot in either occupied Burma or Malaya, c. 1943 - 1944. [697 x 434]"
194,102 comments,3.7k,5 hours ago,r/WhatsWrongWithYourDog,Roscoe took Christmas decoration duty into his own hands (paws) last night
195,277 comments,Vote,2 hours ago,r/TooAfraidToAsk,I just learned that my wife has cheated on me with many men. There's even a video of her talking to me on the phone while she's having sex with a guy. I don't know what to do. What do you think I should do?
196,216 comments,4.7k,13 hours ago,r/pyrocynical,Come on guys...
197,142 comments,2.5k,7 hours ago,r/CasualUK,My big present was a lynx Africa
198,161 comments,612,5 hours ago,r/vegan,I got tricked into eating non vegan food during Christmas by my family
199,100 comments,3.0k,4 hours ago,r/greentext,Anon experiences weed
200,103 comments,8.2k,17 hours ago,r/GamePhysics,[FH5] Well that's an interesting end to a race.
201,356 comments,5.6k,13 hours ago,r/funnyvideos,Making this man get off his flight because of a mask 🤣
202,64 comments,11.5k,9 hours ago,r/StartledCats,He just wanted say hey...
203,79 comments,4.3k,6 hours ago,r/PS4,PS Christmas Star
204,285 comments,2.4k,13 hours ago,r/Justrolledintotheshop,NO MORE AIR LINES!!!!
205,307 comments,5.2k,12 hours ago,r/india,Merry Christmas!!
206,349 comments,1.9k,8 hours ago,r/ClashRoyale,Only a super lighting chest??? This game doesn't care about us at all bruh
207,34 comments,4.3k,5 hours ago,r/cursedcomments,Cursed_RedditGold
208,89 comments,4.5k,6 hours ago,r/Catswithjobs,Musician
209,290 comments,1.8k,9 hours ago,r/EscapefromTarkov,Installation of Update 0.12.12.10
210,339 comments,30.2k,15 hours ago,r/wholesomegifs,A new friend has just appeared
211,101 comments,3.1k,6 hours ago,r/Grimdank,They are perfect in every way
212,74 comments,1.2k,4 hours ago,r/ImaginaryWarhammer,Ex-military (Space Marines fanart)
213,170 comments,3.1k,4 hours ago,r/PoliticalHumor,Whether you believe or not... the message sure seemed clear.
214,138 comments,4.2k,8 hours ago,r/formula1,From F1: Wishing you a very happy Christmas from all of us at F1!
215,197 comments,857,6 hours ago,r/sweden,"Reklamchef från Stockholm bytte till ett ""vanligt"" jobb under några månaders tid. Du kommer aldrig gissa vad som hände sen."
216,76 comments,11.9k,8 hours ago,r/antimeme,Sorry if it's not an antimeme
217,256 comments,1.9k,9 hours ago,r/DestinyTheGame,The change for the seasonal weapon ornaments to require 2 full resets each is insane
218,227 comments,6.2k,10 hours ago,r/Superstonk,Merry Christmas Everyone
219,171 comments,6.7k,9 hours ago,r/KidsAreFuckingStupid,Those headphones work great!
220,272 comments,2.4k,3 hours ago,r/woodworking,"My wooden PC case y'all roasted the living s*** out of. seems to be working just fine. no overheating so far. If it catches on fire and burns down my whole house, I'll get back to you😁"
221,100 comments,3.8k,14 hours ago,r/CrackheadCraigslist,I just wanted a table
222,65 comments,2.9k,4 hours ago,r/arcane,"[no spoilers] ""Let's not BLOW this out of proportion."""
223,329 comments,6.3k,10 hours ago,r/IndianDankMemes,The irony
224,277 comments,2.7k,7 hours ago,r/unpopularopinion,Most PS3 and 360 games still look great today.
225,272 comments,3.1k,8 hours ago,r/dankvideos,USA most terrorist cointry
226,223 comments,864,19 hours ago,r/ParlerWatch,This is the guy who called into a Christmas event for children to say let's go Brandon. So proud of interrupting an event for children he uploaded himself doing it.
227,223 comments,864,19 hours ago,r/ParlerWatch,This is the guy who called into a Christmas event for children to say let's go Brandon. So proud of interrupting an event for children he uploaded himself doing it.
228,199 comments,1.5k,10 hours ago,r/povertyfinance,Being poor around the holidays is extremely depressing
229,170 comments,2.3k,3 hours ago,r/Coronavirus,Former UK Prime Minister Tony Blair Says Anyone Still Unvaccinated Is 'An Idiot'
230,330 comments,3.6k,5 hours ago,r/IdiotsInCars,Directly turning onto the fast lane without looking !
231,266 comments,2.7k,7 hours ago,r/CrazyFuckingVideos,You thought only men do stupid shit 2.0
232,37 comments,2.2k,3 hours ago,r/instantkarma,Dog saves this shop owner from being robbed! 😱
233,201 comments,696,6 hours ago,r/nintendo,Yes.. the nintendo eshop is down.
234,217 comments,2.2k,10 hours ago,r/rance,Devinez quoi...
235,208 comments,8.9k,10 hours ago,r/ShitPostCrusaders,Big L for part 7
236,97 comments,4.0k,7 hours ago,r/gtaonline,looks like the cayo perico guard got tired of el rubio and works with you now
237,86 comments,3.8k,6 hours ago,r/StardewValley,"Unbeknown to each other, we got each other mermaid’s pendants for Christmas! (And now we are happily engaged!)"
238,160 comments,3.4k,9 hours ago,r/titanfall,Got it for christmas
239,291 comments,2.9k,4 hours ago,r/SelfAwarewolves,Wait till he finds one of the siblings came back and is trans.
240,76 comments,4.5k,7 hours ago,r/VALORANT,cypher jumpscare
241,38 comments,5.5k,8 hours ago,r/EarthPorn,"Australia's tropical top end. About to get our first cyclone of the season. Ord River, Western Australia. [OC][6000x3375]"
242,282 comments,972,5 hours ago,r/ufc,Which UFC fighter deserves this belt ?
243,92 comments,19.8k,9 hours ago,r/aww,The king....
